title,link,description,bloggername,bloggerlink,postdate
"<b>원예</b>치료 <b>원예</b>심리상담사, 무료강의로 쉽게",https://blog.naver.com/gkwodnjs842?Redirect=Log&logNo=222432889037,진로를 알아보는 와중에 <b>원예</b>치료 <b>원예</b>심리상담사라는 직업에 대해 알게 됐어요. 말 그대로 <b>원예</b>활동을 심리치료에 이용하는 과정인데 평소 저의 성향과도 잘 맞을 것 같았어요. 평소에 꽃이나 식물에도 관심이... ,섬의 섬,https://blog.naver.com/gkwodnjs842,20210715
"[GV] <b>원예</b> 이야기, 박하사탕 : 레디~ 액션! 18 넷",https://blog.naver.com/bikff?Redirect=Log&logNo=222426685896,박하사탕 Peppermint Candy 박유빈 / PARK Yu-bin 대한민국 | 2020 | 18 분 소개 바로가기 &gt;&gt; <b>원예</b> 이야기 Gardening... 05 &lt;<b>원예</b> 이야기&gt; 이희원 감독님 질문 꽃을 클로즈업한 인서트씬을 많이 넣어주셨어요. 그 의미가... ,부산국제어린이청소년영화제 BIKY,https://blog.naver.com/bikff,20210710
국산 기술로 <b>원예</b>작물 바이러스 진단 키트 16종 개발!... ,https://blog.naver.com/rda2448?Redirect=Log&logNo=222377051828,"농촌진흥청 국립<b>원예</b>특작과학원 <b>원예</b>특작환경과 조인숙 박사는 연간 농작물 바이러스병 피해액이 1조 원에 이른다는 점에 주목하고, 국산 키트 개발에 주력했다. 조 박사의 성과가 세상에 나오기 전까지... ",농촌진흥청 블로그 '농다락',https://blog.naver.com/rda2448,20210531
<b>원예</b>기능사 실기대비 (1일 특강),https://blog.naver.com/godori1967?Redirect=Log&logNo=222358327534,"본 포스팅은 <b>원예</b> 기능사 실기 준비를 위한 지극히 개인 적인 포스팅 입니다. 종자 감별 (채소종자, 화훼종자, 과실실물 등) 총 10개 이름 쓰기 이게 <b>원예</b>기능사 시험이 맞는건가 모르겠다. 언제부터인지... ",꿈꾸는텃밭,https://blog.naver.com/godori1967,20210520
가재울도서관 문화강좌 힐링 <b>원예</b>수업 테라리움 만들기,https://blog.naver.com/hope_city?Redirect=Log&logNo=222391139443,"지난 6월 3일 가재울도서관에서는 문화강좌 힐링 <b>원예</b> 수업이 진행되었습니다. 꽃, 식물 이론에 대해 배워보고 여러 가지 식물소재를 이용한 <b>원예</b>아트 작품 만들기 문화강좌로 4월 15일부터 6월 3일까지 8회차... ",의정부시 공식 블로그,https://blog.naver.com/hope_city,20210609
<b>원예</b> 분갈이용 방수매트 : 분갈이 편해졌어요,https://blog.naver.com/jinyblossom?Redirect=Log&logNo=222427716317,<b>원예</b> 분갈이용 방수 매트 구매후기 <b>원예</b> 분갈이 방수 매트 집에 있는 시간이 많아지면서 반려식물에 관심을 갖게 되고 한 두개씩 들여서 키우다보니 그 사이 폭풍 성장한 식물들은 분갈이를 해줘야 했어요.... ,jinyblossom,https://blog.naver.com/jinyblossom,20210711
[힐링<b>원예</b>] 한국 전통 미니키 다육공예,https://blog.naver.com/herbseed?Redirect=Log&logNo=222435826545,다가온에서 힐링<b>원예</b> 수업을 줌으로 하고 있답니다. 도서관 1층에 다가온이 있는데 다문화 가족만 이용... 수공예 수업과 힐링<b>원예</b> 수업 강좌가 올라와서 힐링<b>원예</b> 수업을 신청했다죠 1순위가 다문화 가족이라서... ,"은, 율, 한이와 만드는 이야기",https://blog.naver.com/herbseed,20210718
일산 <b>원예</b>수업 가드닝 클래스,https://blog.naver.com/tisenrawk?Redirect=Log&logNo=222423138353,일산 <b>원예</b>수업 가드닝 클래스 안녕하세요 여러분들의 일상에 항상 식물이 함께 하길 바라는... 일산 <b>원예</b>수업을 준비했습니다 전국적으로 준비하면 좋겠지만 ㅠㅠ 아직 인프라가 많이 형성되지않아 일산에서... ,볼거없는곳,https://blog.naver.com/tisenrawk,20210707
마을교사활동 교실로 찾아가는 <b>원예</b>체험활동 미세먼지... ,https://blog.naver.com/dnjfaudwhrud?Redirect=Log&logNo=222376308994,마을교사 활동으로 생태 <b>원예</b>수업을 학교에서 부탁하면 종종 찾아가서 아이들과 수업을... 찾아가서 <b>원예</b>체험을 진행해 주었네요 화분이 모두 사기화분이라 무게가 있어서 나르는데도 힘들더라구요. 마사와... ,월명팜 원예체험 치유농장,https://blog.naver.com/dnjfaudwhrud,20210531
청주 체험학습 더자람 <b>원예</b>교육농장에서 치유하다,https://blog.naver.com/sea3139?Redirect=Log&logNo=222432639304,오늘은 청주에서 <b>원예</b>체험 학습을 할 수 있는 더자람 치유 농장을 소개해 드리겠습니다 청주시 상당구... 두번째 하우스에 방문하니 지역 활동 강사분들이 <b>원예</b> 체험 키트를 만들고 계십니다. 복지관과 교육기관... ,라임씨의 행복찾기,https://blog.naver.com/sea3139,20210715
남해여행 추천코스 <b>원예</b>예술촌,https://blog.naver.com/hyungihuk?Redirect=Log&logNo=222433578570,남해여행 2일차 남해 독일마을을 가기 전에 독일마을 맞은편에 위치한 정원테마마을 <b>원예</b>예술촌을... net 간단한 소개와 함께입장료받고 출발곳곳에 숨겨진 포토존이 많았답니다<b>원예</b>예술촌 관람코스는... ,감성적인 남자의 이야기,https://blog.naver.com/hyungihuk,20210716
남해 <b>원예</b>예술촌,https://blog.naver.com/wow_press?Redirect=Log&logNo=222412561911,"남해 독일마을에서 길 하나만 건너면 <b>원예</b>예술촌이 있어요 입장료는 성인 기준 5,000원, 네이버로 사면 4,000원입니다! 남해 <b>원예</b>예술촌 입장시간 AM 9:00 ~ PM 5:00 월요일 휴관 <b>원예</b>예술촌 안내도 배우 박원숙 님이... ",와우스토리,https://blog.naver.com/wow_press,20210629
<b>원예</b>용품 한 바가지 구입-취미 is 돈이다.,https://blog.naver.com/corea1018?Redirect=Log&logNo=222411264400,"그래서 '베란다정원'을 시작하면서 처음으로 <b>원예</b>용품을 인터넷으로 구입해봤다. (이전까지는 다이소에서 구입하고, 화분의 경우 자취할 때 사용하던거 돌려막기 ㅋㅋ) 박스도 2개로 해서 도착한 <b>원예</b>용품들... ",정다운나라 입니다.^-^*,https://blog.naver.com/corea1018,20210626
남해 가볼만한곳:) 남해 독일마을 &amp;  남해 <b>원예</b>예술촌,https://blog.naver.com/kiddyag?Redirect=Log&logNo=222397414570,남해 가볼만한곳:) 남해 독일마을 &amp; 남해 <b>원예</b>예술촌 지난 토요일 - 친정 식구들과 함께 남해 가볼만한 곳인 #남해독일마을 과 #남해<b>원예</b>예술촌 으로 !! 남해 독일마을은 이전에도 한번 가보긴 했었는데요. 이번에... ,신꼬맹의 어느 멋진 날♡,https://blog.naver.com/kiddyag,20210614
국제<b>원예</b>종묘에서 조경수 사 왔어요,https://blog.naver.com/hasarin0?Redirect=Log&logNo=222302149047,태안국제<b>원예</b>종묘의 마스코트 국제<b>원예</b>종묘 충남 태안군 남면 진산2길 172-31 전화번호 1588-6891 3년 전 외부 주차장을 만들면서 10년 가까이 키운 울타리 향나무를 옮겨 심었는데 몸살을 앓다가 말라죽어... ,태안 한옥펜션 별궁 이야기,https://blog.naver.com/hasarin0,20210407
"남해 <b>원예</b> 예술촌, 남해 여행",https://blog.naver.com/ynk5789?Redirect=Log&logNo=222409618420,집사람의 성화에 못이겨 인근에 있는 <b>원예</b> 예술촌을 찾았다. 어렵게 온 여행이니 가능하면 많은 곳을 방문해야 한다고... 우산을 썼지만 신발은 이미 다 젖었고 비바람에 옷까지 비가 스며 들어온다. <b>원예</b>... ,"골 때리는 중국, 못말리는 중국인",https://blog.naver.com/ynk5789,20210625
#온마을돌봄 ~부모님들과 함께하는 초등학생 친구들의 <b>원예</b>농장... ,https://blog.naver.com/jodosu?Redirect=Log&logNo=222437730312,자연과 함께 사랑이 자라요~ 더자람<b>원예</b> 더자람교육농장 입니다^^ 각종 허브도 한두개씩 따보고요~~ 당아욱 보라색 먹는꽃을 5개씩 따기로 합니다. 수박도 신기한듯 통통통 두드려보고요~~ 새장에는 어떤 새들이... ,더자람원예농장,https://blog.naver.com/jodosu,20210719
"<b>원예</b>치료사 역량강화 워크샵, 변화하는 미래를 대비합니다.... ",https://blog.naver.com/miyaa1212?Redirect=Log&logNo=222420556993,"<b>원예</b>치료사 역량강화 워크샵 문화예술+<b>원예</b> 콘텐츠 강화교육 식물디자인공방 MIMI그라스 변화하는 미래, 인공지능 시대를 살아가는 우리와 우리를 필요로 하는 많은 대상자들을 위해 오늘도 주제를 만들고 그... ",원예통합교육 미미그라스,https://blog.naver.com/miyaa1212,20210705
경북도청신도시 | 예천군농업기술센터 치유농업생활<b>원예</b>... ,https://blog.naver.com/riz_ll?Redirect=Log&logNo=222431670335,도청신도시 주민을 위한 치유농업 생활<b>원예</b> 1일 체험 교육생 모집(마감) 도청 신도시 주민을 위한 치유농업 생활<b>원예</b> 1일 체험 교육을 실시하오니 관심 있는 분께서는 신청하시기 바랍니다. ※ 상세 교육... ,반짝반짝 빛나는,https://blog.naver.com/riz_ll,20210714
[시간 절약 리뷰-<b>원예</b>] 화분도 아웃렛에서? -남사 화훼 단지... ,https://blog.naver.com/designerhsb?Redirect=Log&logNo=222421387942,주제 - <b>원예</b>는 어렵고 비싸다는 생각이 든다. - 합리적인 구매를 위해 길을 나서지만 어디로 가야 할지... ■ <b>원예</b>는 어렵고 비싸다는 생각이 든다. 인기 있는 식물들을 위주로 가격들을 확인해 보았습니다.... ,남달라,https://blog.naver.com/designerhsb,20210705
업사이클링 생활<b>원예</b>~ 우리도 배워보아요.,https://blog.naver.com/ansanse01?Redirect=Log&logNo=222423490732,환경을 살리는 '업사이클링 생활<b>원예</b>'를 지역의 주민들과 함께 하고 있어요. 코로나19가 장기화되면서... 생활<b>원예</b> 프로그램을 진행하게 되었어요. 재활용 재생 화분을 활용한 <b>원예</b>활동으로~ 이론수업을 통해... ,안산시 경기행복마을관리소,https://blog.naver.com/ansanse01,20210707
"내가 사는 지역에서 문화예술을 체험하는 &lt;꿈의 정원, <b>원예</b> 꿈다락&gt;",https://blog.naver.com/gyeyang_gu?Redirect=Log&logNo=222425871087,"<b>원예</b>체험학습장이며, 직업체험처로 계양구청 블로그에서도 소개해 드린 적이 있었죠. '꿈의 정원'에서는 어떤 프로그램이 진행되는지 직접 다녀왔습니다. '꿈의 정원'은 6월부터 8월까지 식물과 함께 하는 '<b>원예</b>... ",계양구청 공식 블로그,https://blog.naver.com/gyeyang_gu,20210709
학교로 찾아가는 <b>원예</b>체험 공기정화 식물심기 산세베리아,https://blog.naver.com/dnjfaudwhrud?Redirect=Log&logNo=222376284195,지난주에 학교로 찾아가는 <b>원예</b>체험 수업을 하고 왔었던 사진입니다 전교생이 40명이 안되는 소규모 학교입니다 농촌의 고령화와 인구감소를 알수있는 현상입니다 농촌마을에서 아이 울음 소리가 사라진지... ,월명팜 원예체험 치유농장,https://blog.naver.com/dnjfaudwhrud,20210531
"치매예방뇌건강향상인지프로그램<b>원예</b>치료,<b>원예</b>심리수업... ",https://blog.naver.com/hys53312?Redirect=Log&logNo=222433390124,"자연친화적인 <b>원예</b>치료,<b>원예</b>심리 수업을 통해서 신체적,사회적 심리적,정서적안정과치유뿐아니라 요즘 많은 사람들이 걱정하고 있는 치매예방과 뇌건강향상에도 아주좋은 인지프로그램이라고 봅니다~~유휴... ",나비채교육센타 홍영숙 010 8738 5356,https://blog.naver.com/hys53312,20210716
범지기 8단지 힐링<b>원예</b>,https://blog.naver.com/siyoub66?Redirect=Log&logNo=222420220812,백일홍 범지기 8단지엔 글라스 하우스를 집 삼아 힐링<b>원예</b>모임이 있다. 봄에 햇살이 따스해지면 꽃씨를... 힐링<b>원예</b>모임의 회원님의 정성어린 손길과 관심이 이름처럼 치유의 힘을 내민다. 힘들고 지칠때면... ,제인의 에코사랑,https://blog.naver.com/siyoub66,20210704
동두천 초등학교도서관 독서<b>원예</b>치료수업  책과 함께... ,https://blog.naver.com/ynj0127?Redirect=Log&logNo=222408483879,독서<b>원예</b>프로그램은 선인장 호텔 이란 책입니다. 선인장이 가진 강점에 대해서 찾아보고 이야기를... 그리고 관련된 <b>원예</b>활동을 하는 것은 1석2조의 효과를 가져다줍니다. 테라리움 만들기 초등학교 <b>원예</b>수업 나... ,"꽃이야나무야 본사 (원예치료, 원예키트 전문)",https://blog.naver.com/ynj0127,20210624
<b>원예</b>심리지도사 자격증반 교육 /화순농업기술센타,https://blog.naver.com/nj7782?Redirect=Log&logNo=222403492695,<b>원예</b>심리지도사 자격증반 교육 /화순농업기술센타) 코로나로 잠시 멈추었던 교육들이 3월부터... 역량강화교육인 &quot; <b>원예</b>심리지도사 자격증 교육&quot; 4월15일부터 주1회(4시간씩) 10회과정 교육이었어요 좋은... ,꼼지락 찬희맘,https://blog.naver.com/nj7782,20210619
[아이랑남해여행] <b>원예</b>예술촌 - 체험관 강추!,https://blog.naver.com/wse1233?Redirect=Log&logNo=222412818702,"#남해여행 #가족여행 #아이랑여행 #아이랑갈만한곳 #남해갈만한곳 #클레이아트 #체험관강추 #<b>원예</b>예술촌 <b>원예</b>예술촌 다들 추천해줘서 우리도 입장~ 어른은 오천원, 아이는 3천원인가 그랬다...ㅎㅎㅎㅎ... ",YUBU 끄적끄적이.♥,https://blog.naver.com/wse1233,20210628
남해 가볼만한곳 <b>원예</b>예술촌 남해 독일마을 외 볼거리 먹거리,https://blog.naver.com/hloveh01?Redirect=Log&logNo=222411829258,"남해 가볼만한곳 <b>원예</b>예술촌 남해 독일마을 외 볼거리 먹거리 글, 사진 : 그루터기 보물섬이라 불리는 남해는 사계절이 아름다운 힐링의 섬이다. 남해 독일마을, 남해 <b>원예</b>예술촌, 섬이 정원 등 자연과 사람이... ",♣️행복 가득한 그루터기 발자취♣️,https://blog.naver.com/hloveh01,20210628
[★] <b>원예</b> 엑스터시 판매규격 조사,https://blog.naver.com/saleign?Redirect=Log&logNo=222385453651,"그래서 <b>원예</b> 엑스터시 긴 태그 떡메모지를 예판할 경우, 최소 주문수량은 40권이고, 1권이 100매일 때... <b>원예</b>엑스터시 예판 날짜 네이버 블로그에서 이제 투표 기능이 지원되지 않네요 ㅜ0ㅜ http://naver.me... ",the lair and the caretaker,https://blog.naver.com/saleign,20210605
키즈<b>원예</b> DIY오산초등학교 병설유치원 꽃바구니 만들기... ,https://blog.naver.com/miyaa1212?Redirect=Log&logNo=222432174982,"키즈<b>원예</b>프로그램은 참 많은데요. 꽃바구니 만들기 만큼 유치원 아이들이 행복해 하는 프로그램도 없죠. 행복해 할 아이들의 얼굴을 생각하며 한 송이, 한 송이 소중하게 키즈<b>원예</b>DIY 키트로 만들어 직배송 해... ",원예통합교육 미미그라스,https://blog.naver.com/miyaa1212,20210715
"부산과학기술대, 동래<b>원예</b>고등학교와 연계교육 협약",https://blog.naver.com/bist2020?Redirect=Log&logNo=222432725249,부산과학기술대학교가 동래<b>원예</b>고등학교와 연계교육 협약을 맺었습니다. 스마트도시농업 전문가 양성에 협력 할 예정입니다! 우리 부산과학기술대학교가 14일 동래<b>원예</b>고등학교와 스마트도시농업 전문가... ,부산과학기술대학교,https://blog.naver.com/bist2020,20210715
절임배추10kg 대관령<b>원예</b>농협,https://blog.naver.com/jinbengi87?Redirect=Log&logNo=222387277809,위 로고를 클릭하시면 해당 판매페이지로 바로 이동됩니다 사계절 내내 간편하게 김치 만들어 먹기 좋은 대관령<b>원예</b>농협의 절임배추 10kg이 도착했어요 10kg이면 약 5포기 내외로 받아볼 수 있답니다 대관령<b>원예</b>... ,진뱅아이 삼총사 육아일기,https://blog.naver.com/jinbengi87,20210606
베란다정원 <b>원예</b>용품 벽 공간활용으로 정리정돈,https://blog.naver.com/fayefaye79?Redirect=Log&logNo=222402146060,얼마전 <b>원예</b>용품을 정리정돈하며 따로 자리를 만들어두었더니 볼 때마다 흐뭇하고 사용하기도 편해서... 사용하는 <b>원예</b>용품들을 걸어서 보관하는 자리로 만들었어요. 원래 화분선반 아래쪽에 보관하던 것들이... ,초록과 함께하는 보통의 날들,https://blog.naver.com/fayefaye79,20210618
진주 <b>원예</b>농협 생산 맑은유자청으로 맛있는 유자에이드 만들어요,https://blog.naver.com/chssha86?Redirect=Log&logNo=222416976497,"진주 <b>원예</b>농협 생산 맑은유자청으로 맛있는 유자에이드 만들어요 여름... 여름...여름입니다~ 여러분... 하루에 물 1L 이상 먹고 있는것 같아요 요즘 물 외에도 즐겨 먹는 음료가 하나 있는데요, 바로 진주 <b>원예</b>... ",다니엘의 캐나다에 산다,https://blog.naver.com/chssha86,20210701
방가후돌봄 <b>원예</b>체험활동 율마의 한살이 알아보기,https://blog.naver.com/dnjfaudwhrud?Redirect=Log&logNo=222384093241,매주 목요일 오후5시 금산관내 지역아동센터 한곳에 방가후 돌봄활동으로 <b>원예</b>체험을 교육기부로 해주고 있네요 작년에는 3곳을 해주었는데 시간내기가 너무 힘들어서 올해는 한곳이라도 잘해주자해서... ,월명팜 원예체험 치유농장,https://blog.naver.com/dnjfaudwhrud,20210604
"4차산업시대에꼭필요한감성수업 <b>원예</b>치료,<b>원예</b>심리상담... ",https://blog.naver.com/hys53312?Redirect=Log&logNo=222416184505,꼭필요한 <b>원예</b>치료 <b>원예</b>심리상담수업~~* 이번에 나비채교육센타 에서5시간동안 특강이 이루어졌답니다~~굿 늦은시간 수업을 하시고 달려오신 울선생님들~~* 역량개발에 힘쓰시는 모습이 멋지십니다요~~굿... ,나비채교육센타 홍영숙 010 8738 5356,https://blog.naver.com/hys53312,20210701
"[<b>원예</b>가이드] 꽃 싱싱하게 오래보는 팁! 식초, 설탕, 락스의... ",https://blog.naver.com/nihhs?Redirect=Log&logNo=222433545117,▼▼▼▼▼영상보러가기▼▼▼▼▼ https://youtu.be/ncmF7qknsK4 #국립<b>원예</b>특작과학원 #꽃다발 #꽃꽂이 #꽃오래감상 #절화수명연장 #화병꽃 #화병물교체 #화병관리 #꽃다발,국립원예특작과학원,https://blog.naver.com/nihhs,20210716
용산 사제간동행수업 독서<b>원예</b>치료수업 배려와 오해에 관하여,https://blog.naver.com/ynj0127?Redirect=Log&logNo=222408771952,독서<b>원예</b>전문가로 활동하는 꽃놀이샘 책놀이샘입니다. 지난주에 이어 용산에 있는 남현초등학교에 다녀왔답니다. 지난주에는 저학년 학생들과 독서<b>원예</b>치료수업을 함께하고 이번주에는 고학년 학생들과 함께... ,"꽃이야나무야 본사 (원예치료, 원예키트 전문)",https://blog.naver.com/ynj0127,20210624
곰솔<b>원예</b>에서 진백 잎솎기 작업,https://blog.naver.com/baelf?Redirect=Log&logNo=222433965517,바쁘신 곰솔<b>원예</b>가든센터 사장님 지원차 진백 입솎기 작업을 거들고 왔습니다 낮에는 손님 때문에... 곰솔<b>원예</b>가든센터 이정표 외국 바이어들이 많이 오시니 사무실 동을 멋지게 만들고 계십니다 지난 6월에... ,배이사 개인 블로그,https://blog.naver.com/baelf,20210716
"신탄진중학교 <b>원예</b>치료사 진로체험 비누꽃 꽃바구니, <b>원예</b>치료... ",https://blog.naver.com/serimflower?Redirect=Log&logNo=222430704873,&quot;대전 신탄진중학교 <b>원예</b>치료사 진로체험&quot; 저희 세림<b>원예</b>연구소는 대전의 신탄진중학교에 방문하여 <b>원예</b>치료사라는 직업에 대해 알아보고 비누꽃 꽃바구니를 만들어보았답니다. 어? <b>원예</b>치료사는 생화 만지는... ,행복한 세상의 숲,https://blog.naver.com/serimflower,20210713
당진꽃집 로제르 &lt;가드닝키트&gt; <b>원예</b>체험키트 공구 키트공구,https://blog.naver.com/dmswls5490?Redirect=Log&logNo=222425757241,"로제르는 <b>원예</b>치료수업과 어르신들 힐링클래스, 플로리스트 체험클래스 등 각종 수업으로 활동하는... 모든 <b>원예</b>활동 재료는 로제르가 준비해드려용 이번에는 몇차례 <b>원예</b>수업을 불러주신 선생님께서... ",당진꽃집 로제르 (Roseur Flower),https://blog.naver.com/dmswls5490,20210709
오산복지관 창의감성 문화예술놀이 석고붕대손뜨기 미술<b>원예</b>치... ,https://blog.naver.com/miyaa1212?Redirect=Log&logNo=222430960372,"문화예술<b>원예</b>놀이를 통해 말하지 못함을 그리고, 할 수 없었던 일들을 헤쳐나갑니다. 나의 손은... 미술<b>원예</b>치료, 문화예술놀이를 통해 함께 하게됩니다. 오산세교복지관 40가족들에게 석고붕대 손뜨기 재료가... ",원예통합교육 미미그라스,https://blog.naver.com/miyaa1212,20210714
정신지체 장애인 <b>원예</b>치료,https://blog.naver.com/lifemoa?Redirect=Log&logNo=222438102971,정신지체장애인 <b>원예</b>치료 정신지체장애인은 개인차가 크고 다양한 형태의 행동장애를 나타낸다.이... 식물재배나 <b>원예</b>활동과같은 자연을 매개로한 프로그램이 필요하다. 정신지체장애인은 뇌의 기능 저하로... ,수원대 화훼조형학 원예치료 과정,https://blog.naver.com/lifemoa,20210720
그림책<b>원예</b>테라피/서울경기초<b>원예</b>활동/분당그림책<b>원예</b>테라피,https://blog.naver.com/yaeun55?Redirect=Log&logNo=222400622401,꼬우 꼬우 그림책<b>원예</b>테라피 서울경기초<b>원예</b>활동 분당그림책<b>원예</b>테라피 마리의정원 ***.****.**** 수업시엔 전화를 받을수 없어요 메세지 남겨주셔요 #그림책<b>원예</b>테라피 #서울경기초<b>원예</b>활동... ,마리의 정원(그림책원예테라피),https://blog.naver.com/yaeun55,20210616
[대전<b>원예</b>치료사/대전독서<b>원예</b>치료사/그림책플라워테라피... ,https://blog.naver.com/skyee10?Redirect=Log&logNo=222422528207,"오늘은 그림책<b>원예</b>심리 2급과정 중 마지막 시간입니다. 마지막은 어르신심리 두번째 시간이예요... 그림책<b>원예</b>심리 2급과정은 총 8회기로 구성되어 있습니다. 아동심리, 청소년심시, 성인심리, 어르신심리로... ",그림책플라워공방 작은숲,https://blog.naver.com/skyee10,20210706
#교사연수_생태<b>원예</b>_숲트레킹,https://blog.naver.com/heajk01?Redirect=Log&logNo=222435066399,#교사연수프로그렘_숲놀이_생태<b>원예</b> 2021 7 17 주말일지 오전8시에 숲으로 가다 자연에서 얻는 재료들로 #창조적파괴 로 작품활동속에 마음과 생각들을 표현해낸다 교사들이라 연실 깨달음으로 아하~~!! 그... ,홍천흙집숲정원,https://blog.naver.com/heajk01,20210717
방가후돌봄 <b>원예</b>체험활동,https://blog.naver.com/dnjfaudwhrud?Redirect=Log&logNo=222341737289,아이들과 과꽃 화분심기 체험을 하였네요 매주 목요일 지역아동센터 한곳에 교육기부 <b>원예</b>체험을 해드리고 있죠 사진은 어제 체험을 했던 사진을 오늘 올립니다 방가후돌봄 <b>원예</b>체험활동 재료비는 월명팜에서... ,월명팜 원예체험 치유농장,https://blog.naver.com/dnjfaudwhrud,20210507
"반려식물과함께하는<b>원예</b>치료,<b>원예</b>심리수업... ",https://blog.naver.com/hys53312?Redirect=Log&logNo=222425827948,비가 세차게 내리는 수요일 대구경북<b>원예</b>심리상담사 홍영숙강사는 감과복숭아로 유명한 청도를 향해 발걸음을 옮깁니다~~유휴 오늘은 청도에계신 주민분을 상대로 반려식물과함께하는 <b>원예</b>치료... ,나비채교육센타 홍영숙 010 8738 5356,https://blog.naver.com/hys53312,20210709
내 맘대로 베란다 <b>원예</b>,https://blog.naver.com/jumpgyu?Redirect=Log&logNo=222428674866,"플레이타임 출판사에서 발행한 『내 맘대로 베란다 <b>원예</b>』 책방에 입고 되었습니다. 국내에는 장편... 아마추어 <b>원예</b>인(이자 작가), 이토 세이코가 도쿄 외곽의 맨션 베란다에서 기록한 우왕좌왕 베란다 식물... ",스토리지북앤필름,https://blog.naver.com/jumpgyu,20210712
가족<b>원예</b>치료수업 서로의마음이해하기 초등학교 심리상담치료,https://blog.naver.com/ynj0127?Redirect=Log&logNo=222400002149,마음<b>원예</b>교육지도사로 활동하는 꽃놀이샘 책놀이샘입니다. 이번 수업은 강북구에 있는 초등학교 학생들과 10회기로 이루어지는 수업중에 9회기째 수업이랍니다. 혹시 조하리창이라고 들어보셨나요? 마음<b>원예</b>교... ,"꽃이야나무야 본사 (원예치료, 원예키트 전문)",https://blog.naver.com/ynj0127,20210616
