title,link,description,bloggername,bloggerlink,postdate
울산 남구 <b>피부관리</b> 앰플-캐비어 관리 와이오스킨앤왁싱 후기,https://blog.naver.com/inha722?Redirect=Log&logNo=222361881197,"사물함에 짐 보관 후, 간편한 옷으로 갈아입고 앰플-캐비어 관리에 들어갔어요. 제 피부에 맞게 '맞춤' <b>피부관리</b>를 진행해 주는 것뿐만 아니라 등 / 가슴 관리까지 한꺼번에 해주셔서 좋더라고요. 베드 온도도... ",기린아 세계일주 이야기,https://blog.naver.com/inha722,20210522
수원<b>피부관리</b> 여기 추천할만,https://blog.naver.com/ysjung0128?Redirect=Log&logNo=222219742853,"수원<b>피부관리</b> 랑스파 얼굴축소 윤곽관리는 두피부터 시작하여 목덜미, 얼굴 전체, 목, 어깨, 데콜테 등 상체는 물론 골반, 하체까지 거의 전신에 걸쳐 진행되는데요. 프로그램은 전문 테라피스트 쌤과 상담을... ",피부지킴이,https://blog.naver.com/ysjung0128,20210125
잠실<b>피부관리</b> 세레니끄잠실점 또 한번의 힐링 Time♥,https://blog.naver.com/rlathfus1995?Redirect=Log&logNo=222327553611,여기와서 <b>피부관리</b>받으면 뎡말~ 힐링 그자체일꺼같애여^ㅅ^ 그리고 관리가 다끝난후 세레니끄잠실점 체험 에푸터~ 피부트러블도 많이 완화가 되었고 재생도 많이되었고 수분도..ㅎㅎ 만족입니다~ 역쉬... ,류치루,https://blog.naver.com/rlathfus1995,20210429
신논현<b>피부관리</b> 나만 알고 싶은 샵 !,https://blog.naver.com/jyunkyryu?Redirect=Log&logNo=222334894323,제가 오늘 선택한 관리는 바로 노폐물과 모공정리를 해주고 피부를 화사하게 해주는 미백 관리 그리고 건조한 피부에 수분을 채워주는 수분관리까지 ~ 토탈로 받기로 했답니다. 신논현<b>피부관리</b>... ,쥰키의 니하오마,https://blog.naver.com/jyunkyryu,20210503
의정부 <b>피부관리</b> 연예인처럼 갸름한 V라인 얼굴!,https://blog.naver.com/chuyiyoung?Redirect=Log&logNo=222337959376,또 시국에 맞게끔 방역도 철저히 하시고 이러한 개인 위생에 철저하게 관리해주셔서 안심하고 받을 수... 저처럼 쳐진 피부에 속상하셨다면 의정부<b>피부관리</b> 스킨뮤즈에서 하이푸 리프팅 케어를 추천해드려요!... ,ღ Tiap hari Senang aja,https://blog.naver.com/chuyiyoung,20210504
분당 서현<b>피부관리</b> 키웰에서 골드 웨딩관리 받기!,https://blog.naver.com/jihye0212?Redirect=Log&logNo=222328886252,"그 이후에는 부족한 수분을 채워줄 수 있는 수분 앰플 관리랑 + 피부 진정받을 수 있는 관리까지 진행된다. 그리고 서현<b>피부관리</b>에서 신기했던 옥 관리 눈가 주름에 효과적인 관리로, 옥을 이용해 에너지를... ",제니는 세계일주중,https://blog.naver.com/jihye0212,20210430
검단<b>피부관리</b> 문제성피부 오늘예뻐지다,https://blog.naver.com/asdfy?Redirect=Log&logNo=222323516407,MTS관리를 받아보기로 했어요 피부과나 <b>피부관리</b> 경험유무에 따라서도 <b>피부관리</b>종류를 다르게 정할수 있는데 MTS 케어 같은 경우에는 뾰족한 침이 달린 기구를 이용해서 총 4ml의 앰플의 영양성분을 피부 깊숙히... ,일상입니다,https://blog.naver.com/asdfy,20210426
<b>피부관리</b>를 위해 마시는 콜라겐 에버콜라겐 앰플 선택,https://blog.naver.com/marianne40?Redirect=Log&logNo=222360820601,관리한 사람과 안 한 사람의 차이는 나이 들면서 나타난다고 하잖아요 그걸 왜 이제서야 절실히 깨달았는지 모르겠어요 좀 더 일찍부터 <b>피부관리</b> 신경 좀 썼으면 좋았을걸.. 흐흐흐 후회하면 무엇하리... 지금도... ,마리안느의 감성+,https://blog.naver.com/marianne40,20210524
역삼동<b>피부관리</b> 트러블 케어 후기,https://blog.naver.com/stopthe1?Redirect=Log&logNo=222342300923,화장품으로 <b>피부관리</b> 뿐만 아니라 작은얼굴 관리 비대칭 피부 톤 탄력 등등 다양한 부분을 케어한다고 해요 또한 가인미가는 20회와 같이 장기적인 관리로 진행을 하였는데 변화가 없다면 추가 금액을... ,김톰슨의 이것저것,https://blog.naver.com/stopthe1,20210508
백석동 <b>피부관리</b> 빛이나뷰티 생크림필,https://blog.naver.com/tkfkdgo9558?Redirect=Log&logNo=222321598554,성인여드름에 넓은 모공피부라서 심각하네요ㅠ 자주 백석동<b>피부관리</b>받으면서 좋아지도록 노력해봐야겠어요. 내부는 깨끗하고 관리받는동안 열시트도 켜주셔서 따뜻하니 좋았답니다. 백석동 <b>피부관리</b> 앞으로... ,우주大스타 고남매,https://blog.naver.com/tkfkdgo9558,20210424
이수역<b>피부관리</b> 박성희 명품에스테틱에서 비타민리페어케어... ,https://blog.naver.com/kje830830?Redirect=Log&logNo=222385234787,오늘은 윤기있는 톤업을 위해 이수역<b>피부관리</b> 박성희 명품에스테틱을 방문해보기로 했어용!... 수분겔+히알루로산 섞어서 관리해주셨어요~ 이렇듯 피부타입에 맞게 조금씩 추가해주시더라구요~! 그리고 투명한... ,(-:,https://blog.naver.com/kje830830,20210604
판교<b>피부관리</b> 골드테라피 <b>피부관리</b> 고은콜라겐,https://blog.naver.com/tnrgusgp7?Redirect=Log&logNo=222343641852,전신순환관리를 해 주셨어요 판교<b>피부관리</b> 골드테라피 <b>피부관리</b> 고은콜라겐에서 골드테라피를 마치고 제 피부를 만져보았어요 으~~~음 아가 피부처럼 뽀송 보들 하네요 거울을 보았어요 우와 속살보다 더... ,초록사탕,https://blog.naver.com/tnrgusgp7,20210509
"라네즈 워터슬리핑마스크 EX, 나이트 스킨케어 &amp; <b>피부관리</b>... ",https://blog.naver.com/iamchocolat?Redirect=Log&logNo=222407689953,"그래서 식단 조절도 하고, 이너뷰티와 영양제도 꼼꼼히 챙기고, 잃어버린 피부 밸런스를 되찾기 위해 홈케어도 열심히 하고 있는데요. <b>피부 관리</b>를 위해서는 일단 잠을 잘 자는 게 중요한 것 같아서 요즘... ",쇼콜라의 뷰티매거진♩,https://blog.naver.com/iamchocolat,20210623
송파<b>피부관리</b> 볼리아 송파점 후기,https://blog.naver.com/siriniah?Redirect=Log&logNo=222208851121,점점 탄력도가 떨어지는 피부때문에 고민중인 보리스입니다 나이 먹는건 정말 언제나 싫으네요!! ㅋㅋ... 올해는 더 예뻐지고 건강해 져봐요 ^^ 이상 볼리아송파점 윤곽관리 후기였어요. 송파<b>피부관리</b>... ,보리스 뷰리로그 ♡,https://blog.naver.com/siriniah,20210115
"광명<b>피부관리</b> 루아르에스테틱, 하체관리(엔더몰로지) 후기 :)",https://blog.naver.com/nuri221?Redirect=Log&logNo=222367111973,아주 낭낭하게 가득차버렸습니다 T_T 이럴때마다 하체관리를 찾아다니곤 하는데 요번에는 제가 사는 광명에 있는 '루아르에스테틱'에 다녀왔습니다 ෆ 광명<b>피부관리</b> 혹은 광명하체관리로 검색했을때 제일 많이... ,나블리의 나불나불로그 ♥,https://blog.naver.com/nuri221,20210526
부산 대연동 에스테틱 그녀의 관리실 여름 일상생활 <b>피부관리</b>... ,https://blog.naver.com/she_esthetic?Redirect=Log&logNo=222399342775,"<b>피부관리</b>,웨딩관리,pha물톡스필,벨벳필,산모산후관리,등관리,복부관리,하체관리, 전신관리가 있습니다. <b>피부관리</b>는 피부상태가 안 좋을 때만 하시는 것보다 평소에 생활의 일부분으로 꾸준하게 장기간으로... ",그녀의관리실 skin & body,https://blog.naver.com/she_esthetic,20210615
대전<b>피부관리</b> 센스있는 <b>피부관리</b>샵 추천!,https://blog.naver.com/miyuki1253?Redirect=Log&logNo=222204945531,"새로 <b>피부관리</b>샵을 다녀와봤는데, 피부집착녀인 제 마음에 쏙 들어버린 샵이었답니다! 서울에서 살 때 정기적으로 관리받던 샵이 있었는데, 직장때문에 대전으로 이사오고나서는 한동안 피부샵을 알아보느라... ",뷰티덕후보나,https://blog.naver.com/miyuki1253,20210112
바쁜 아침엔 남자올인원 남자화장품으로 <b>피부관리</b> 끝,https://blog.naver.com/kim385719?Redirect=Log&logNo=222395005028,이제 30대 중반을 바라보니 <b>피부관리</b>에도 신경을 써야할것 같아지네요 그냥 와이프 화장품 쓰거나... 1분정도면 피부에 화장품 다 바를수 있으니 시간도 아끼고 편하고 귀찮지 않아 좋습니다. 이렇게 볼에... ,그 집 이야기,https://blog.naver.com/kim385719,20210612
"익산 왁싱, <b>피부관리</b> 받으며",https://blog.naver.com/ksrin0510?Redirect=Log&logNo=222347653209,"마무리, 놀란 피부를 진정시켜 주고 있는 과정입니다. 이래서 <b>피부관리</b>샵을 찾아와야 하는 겁니다.... 익산 브라질리언 시술 준비 및 사후관리 팁 있어서 사진에 담아 봅니다. 확인을 잘 한 후 네이버 예약을 하고... ",소중한 기록들,https://blog.naver.com/ksrin0510,20210512
남자올인원로션 간편하게 <b>피부관리</b> 하기 좋은 남성기초화장품,https://blog.naver.com/95ert?Redirect=Log&logNo=222391583765,protector가 피부 진정을 도와줄 수 있어 순하게 쓰기 좋고요. Botaniceutical plus-10과 감초산 성분이... 그럼 이제 남성기초화장품 리스킨의 보쏘드 워터풀 로션으로 간편하게 <b>피부관리</b>를 해보도록 할텐데요. 2회... ,노루군의 MAN'S SKIN,https://blog.naver.com/95ert,20210609
&lt;산본<b>피부관리</b>/산본1인<b>피부관리</b>실&gt; 코로나 잔여백신 예방접종... ,https://blog.naver.com/isabel0802?Redirect=Log&logNo=222402006024,#산본<b>피부관리</b> #산본1인<b>피부관리</b> #산본<b>피부관리</b>실 #산본<b>피부관리</b>잘하는곳 #산본전신관리 #산본산후관리 #산본산전관리 #산본얼굴축소 #산본얼굴윤곽 #코로나예방접종 #코로나예방접종완료 #잔여백신예약... ,이자벨뷰스파,https://blog.naver.com/isabel0802,20210618
신도림 <b>피부관리</b> 샵 추천  &quot;비욘더&quot;,https://blog.naver.com/prettyyunah?Redirect=Log&logNo=222325360588,"요즘 <b>피부관리</b>에 빠져있는 나, 정말 매순간 매순간 피부에 진심이 되었다. 나이가 드니 점차 점차... 본격적인 관리를 시작하기 전에 나에대한 문진표를 작성했다. 약을 먹고 있는지 여부까지 판단해... ",엄청나,https://blog.naver.com/prettyyunah,20210427
잠실<b>피부관리</b> 재방문한 얼반스킨,https://blog.naver.com/violetdevil3?Redirect=Log&logNo=222269606509,잠실<b>피부관리</b> 샵. 이번에도 원장님과 1:1 상담 후 피부에 맞는 프로그램으로 진행하기로 했어요. 프로그램이 정해지면 바로 예쁜 꽃장식이 있는 관리실로 안내를 받아요. 프라이빗한 1인실이라 편하게 관리... ,보라앙마 일상맛집미용 블로그,https://blog.naver.com/violetdevil3,20210310
아산<b>피부관리</b>실 추천 지앤미에스테틱,https://blog.naver.com/salesman725?Redirect=Log&logNo=222420981425,일요일휴무 #아산<b>피부관리</b> #아산에스테틱 #아산바디관리 #아산다이어트 #아산여드름관리 #아산기미관리 #아산피부잘하는곳 #배방<b>피부관리</b> #배방다이어트 #배방피부잘하는곳 #배방여드름기미관리... ,salesman725님의블로그,https://blog.naver.com/salesman725,20210705
잠실<b>피부관리</b> 덕보고 있어요!,https://blog.naver.com/kya7702?Redirect=Log&logNo=222367605825,"약손명가의 42년 노하우가 집약된 피부-바디-웨딩 브랜드로 수기와 피부 타입에 따른 1:1 맞춤식 관리와... 잠실<b>피부관리</b> , 잠실역점의 관리실 내부 모습이에요. 본격적으로 관리 시작! 하체와 팔 관리를 마친 후... ",달리아스파,https://blog.naver.com/kya7702,20210526
송파<b>피부관리</b>는 좋은에스테틱,https://blog.naver.com/violetdevil3?Redirect=Log&logNo=222276148239,프라이빗한 1인 관리실로 안내를 받고 상의 탈의 후 누워있으면 송파<b>피부관리</b> 샵 관리사 분이 와서 바로 케어는 진행되어요. 스킨리셋관리는 나노니들을 사용해 앰플을 피부에 흡수시켜주는 관리인데... ,보라앙마 일상맛집미용 블로그,https://blog.naver.com/violetdevil3,20210316
구로<b>피부관리</b> 비욘더 투투어링 받은날,https://blog.naver.com/ashleybr?Redirect=Log&logNo=222319361738,광대쪽도 굴곡이 채워지고 ~ 촉촉촉촉 한피부 너무좋아요 #구로<b>피부관리</b> 정말루~ 에스테틱추천 #에스테틱추천 #예비신부관리 #웨딩케어 #산전산후 #beyonder #신도림<b>피부관리</b> #신도림<b>피부관리</b>실... ,YogaDARR,https://blog.naver.com/ashleybr,20210422
강동구<b>피부관리</b> 스페셜웨딩 결이고은!!,https://blog.naver.com/hjhj9893?Redirect=Log&logNo=222208536841,작아보이고 피부탄력도 신경써야되니~ 스페셜웨딩관리 후기가 엄청난걸 보니 예비신부들이 많이 찾는 곳이 결이고은천호점 <b>피부관리</b>실이라는 생각에 방문했어요 드레스입으려면 얼굴축소 팔 승모근 복부등... ,피어나제이마켓 (Pierna J_ market),https://blog.naver.com/hjhj9893,20210115
일산<b>피부관리</b> 여성스러운 얼굴선 완성!,https://blog.naver.com/kya7702?Redirect=Log&logNo=222368153733,디테일하게 얼굴 깊숙한 곳까지 만져주시기 때문에 피부와 얼굴 사이에 틈을 주게 해서 피부 컨디션이... 이렇게 일산<b>피부관리</b>는 관리 처음부터 끝까지 세세한 서비스를 제공 받을 수 있어 기분 좋게 방문할 수... ,달리아스파,https://blog.naver.com/kya7702,20210526
[분당<b>피부관리</b>] 스파더쉼 분당점 힐링 건식스파+게리종리프팅,https://blog.naver.com/kgoodn?Redirect=Log&logNo=222357199910,"<b>피부관리</b>+ 건식스파까지 진심 힐.링.하고왔슙미다!!! 정자역 #스파더쉼 분당점 정자역 4,5번 출구에서... 피부 상태 일대일 상담 진행 후 수분 영양 및 리프팅을 함께 하는 여기 스파더쉼의 시그니처 관리... ",순간기억장치-,https://blog.naver.com/kgoodn,20210519
산격동 <b>피부관리</b> 여기가 찐이야,https://blog.naver.com/rudvkf1925?Redirect=Log&logNo=222208189248,꼼꼼하고 세심한 관리를 원하신다면 산격동 <b>피부관리</b> 김태옥 스킨앤바디를 방문해주세요 : ) 어떤게 내 피부에 트러블인지 원인을 먼저 알고 그에 맞는 관리를 꾸준히 해주는게 중요하다고 해요! 방역과 위생에... ,생각,https://blog.naver.com/rudvkf1925,20210115
노원<b>피부관리</b> 얼짱몸짱 바로 여기서 관리햇!,https://blog.naver.com/vlzkcb16?Redirect=Log&logNo=222320843754,"다음으로는 쿨링관리!! 노원 <b>피부관리</b> 중 쿨링이 엄청 상쾌해요♡♡ 피부 온도를 -9도까지 내려줘서 탄력, 진중, 수분침투, 모공수축 효과까지~~ 쿨링하며 피부홍조&amp;모세혈관 탄력 잡아주는 에센셜 아로마 블루... ",신나게 놀아보자~쿵짝쿵짝 !,https://blog.naver.com/vlzkcb16,20210423
<b>피부관리</b>실 유명한곳 청주 슬림홀릭,https://blog.naver.com/whdgkaks?Redirect=Log&logNo=222318000941,"관리실 <b>피부관리</b>실에서 엄청나게 많은 관리를 할수있다는 사실! 이제 더이상 피부트러블때문에 고민하지마세요 피부의 트러블 뿐만 아니라 피부의 결, 피부색까지 함께 관리가 되는 관리실 관리 전보다 훨씬... ",CRAZY FOR LINE,https://blog.naver.com/whdgkaks,20210422
공릉 <b>피부관리</b> 그리다,https://blog.naver.com/cya4749?Redirect=Log&logNo=222326359495,"***-****-**** *영업시간 화~금 10:00-21:00 토 10:00-19:00 일, 월 휴무 *100% 예약제, 적어도 5일 전 예약 필수 *인스타그램 https://instagram.com/grida3393?igshid=1g95wlfa5g7l3 #노원여드름피부 #노원흉터관리 #노원<b>피부관리</b>",스마트토끼의 0:long_log,https://blog.naver.com/cya4749,20210428
노원<b>피부관리</b> 속당김해결,https://blog.naver.com/s780815?Redirect=Log&logNo=222326306631,"항상 칙칙한 피부에 화장도 잘 안 먹어서 걱정했었는데 이렇게 따로 꾸미지 않아도 이렇게 예뻐 보이다니, 노원<b>피부관리</b> 정말 대만족입니다! 나오는 길에 보니까 아까 안보였던 자격증이 정말 많더라고요.... ",수수맘스탈,https://blog.naver.com/s780815,20210428
울산 <b>피부관리</b> 리프팅 함께 케어하기,https://blog.naver.com/orange7347?Redirect=Log&logNo=222230901046,"안녕하세요, 지지지혜입니다 :) 나이가 들수록 <b>피부관리</b>가 힘든 것 같아요. 꾸준히 관리해줘야된다는 걸 피부로 와닿고 있는 1인입니다... 피부 상태가 안좋아졌다 싶으면 바로 케어 시작 - 제가 다니고 있는 울산... ",♩ 지혜로운 블로그,https://blog.naver.com/orange7347,20210204
"시흥 정왕동 <b>피부관리</b> , 구은희<b>피부관리</b>실 ! 쿨리프팅 완전 좋아♥",https://blog.naver.com/dailybyssong?Redirect=Log&logNo=222354829615,시화에서 병원 피부과에서만 받을 수 있는 관리로 배곧이랑 시화에서 유일하게 구은희 <b>피부관리</b>실에만 있는 관리라고 해요 :) 가격도 피부과의 거의 절반 정도 밖에 안해요! 진짜 첨 받아봤는데 너무나도... ,쏭룸,https://blog.naver.com/dailybyssong,20210517
가로수길 <b>피부관리</b> : 수기관리 너무 잘하고 피부 효과도 최고!... ,https://blog.naver.com/nada5333?Redirect=Log&logNo=222365769384,"구비하여 <b>피부관리</b>&amp;바디관리 효과를 최대로 가져갈 수 있는 곳이었어요. 이렇게 게리종 테라피도 진행할 수 있도록 구비가 되어있으셔요. 리프팅, 여드름성 피부에 좋다고 하네용! 깔끔한 탈의실에서 먼저 옷을... ",JJANG 3,https://blog.naver.com/nada5333,20210525
홍대<b>피부관리</b> W에스테틱에서 수분관리 받고 왔어요!,https://blog.naver.com/curious24?Redirect=Log&logNo=222343248250,다만 데콜데 마사지라던가 <b>피부관리</b> 외의 관리는 별도로 포함되어있지 않는 것같아서 피부개선만을 위해 가성비 좋게 다닐 홍대<b>피부관리</b> 샵을 찾는 분께 좋을 것같아요~ 아쿠아필이나 웨딩케어도 전문으로... ,에피의 하루,https://blog.naver.com/curious24,20210509
미사<b>피부관리</b> 잘하는곳 여기!,https://blog.naver.com/one12701010?Redirect=Log&logNo=222322498927,한동안 <b>피부관리</b> 안 받고 홈관리도 제대로 안된 상태라 피부가 많이 상했어요. 물방울 초음파관리 정도는 받아야 제 피부가 생기를 되찾을 것 같아서 결정한! 우선 관리 전 비포모습 찍어두고용. 관리 시작! 천연... ,한결은결맘의 ものがたり。,https://blog.naver.com/one12701010,20210425
디마르3 시그니처 비트 로제 토너로 여름철 <b>피부관리</b>해요☀️,https://blog.naver.com/blingnas?Redirect=Log&logNo=222436493125,"#여름철<b>피부관리</b> 를 위한 비책 만나볼까요? #DEMAR3 SIGNATURE VIT ROISE TONER 용량 : 150ml / 정가 : 34,500 원... 끝에 피부 개선에 최적화한 복합 포뮬러를 담아 세안 후에도 남은 유해 물질을 닦아내고 관리하는 데... ",딜리아니's 컬러풀 뷰티 패션블로거♡,https://blog.naver.com/blingnas,20210718
강동<b>피부관리</b> 천호 점에서 받고 왔어요~,https://blog.naver.com/lsooy88?Redirect=Log&logNo=222311047814,"얼굴을 케어하고 피부를 관리하는 샵이니 만큼 내부 위생과 청결을 생각하지 않을 수 없는데, 들어가자마자 깔끔한 분위기에 하나도 염려되지 않았답니다. 천호<b>피부관리</b> 가인미가의 시그니처! 석고본들이에요.... ",토리토리 밤토리네,https://blog.naver.com/lsooy88,20210415
인천 단지내상가 네일 <b>피부관리</b>매장 매매,https://blog.naver.com/jihunc5410?Redirect=Log&logNo=222424668087,"인천 단지내상가 네일 <b>피부관리</b>매장 매매 가정동 시설 완비된 소형평수 아파트 단지 상가 2층... &lt; 네일아트 , <b>피부 관리</b> , 왁싱 &gt; 모든 시설 / 룸 , 베드 완비 인수 시 추가 공사 없이 바로 운영 가능한 매장... ",최부장부동산 ★매물접수★,https://blog.naver.com/jihunc5410,20210712
겨울 <b>피부관리</b> To.메마른 건성에게,https://blog.naver.com/fgsgffsdf34?Redirect=Log&logNo=222189226809,악건성인 피부인지라 미스트는 필수였고 유분감이 높은 크림만 바르고 다니면서 간신히 버티고... 겨울 <b>피부관리</b>에 있어서 각질 관리도 매우 중요한 사항 하지만 겨울철 각질? 이라고 하면 늘 어렵고... ,뷰티박스 :: 생생후기,https://blog.naver.com/fgsgffsdf34,20201229
재생크림 재생연고 사용해 여드름 <b>피부관리</b>!,https://blog.naver.com/joaeng?Redirect=Log&logNo=222343825866,"재생연고 피부SOS템으로 쓰면 딱인 게 있어요 저의 여드름 <b>피부관리</b> 찐 후기로 낫츠 센텔라스카연고를... ㅋㅋ 매일 꾸준히 사용해주어야 붉은기개선, 여드름자국 없애는 데 더 효과적이에요 전 꾸준히 관리해... ",뚜이 : 마이 뷰티 클라우드,https://blog.naver.com/joaeng,20210509
<b>피부관리</b> :: 리즈뷰티샵 에서 수분관리 (용두동 피부샵),https://blog.naver.com/chdl89?Redirect=Log&logNo=222360614463,"대전 서대전네거리 <b>피부관리</b>, 리즈뷰티샵 내부 용두동 피부샵 1:1 관리로 진행하는 리즈뷰티샵은 아늑한 내부에 친절한 미소의 사장님이 반기는 곳. 특히나 <b>피부관리</b>와 아로마 마사지까지 시그니처로 내세워... ",채영테이블 :: 필라테스 강사의 건강한 식탁,https://blog.naver.com/chdl89,20210521
수원<b>피부관리</b> 생기 부여받기,https://blog.naver.com/piglet1044?Redirect=Log&logNo=222115812522,"저는 저만 이런줄알았는데, 인터넷 기사를 읽어보니, 코로나로 인해서 마스크를 많이 쓰다보니 피부가... 골라서 관리받을만한 안목이 생겼어요 ! 이번에는 수원<b>피부관리</b> 잘한다고 알려진 곳에 방문하여... ",POPOTENTEN 패션블로그,https://blog.naver.com/piglet1044,20201015
"관리, 위뷰티 안면비대칭경락 6, 7차 후기 + NEW 아랑<b>피부관리</b>",https://blog.naver.com/youmen2as?Redirect=Log&logNo=222336268223,비대칭관리는 손으로 해주셨는데 아랑<b>피부관리</b>는 발로!!!!! 승모근 때 처럼 발로 관리를 해주십니다... 저는 시술 쫄보라 피부과에 아예 가질 않고 그래서 깨순이기도 한데요ㅋㅋㅋ 피부 개복치라 레이저고... ,ⓒ뷰스타 쥬쥬의 코스메살롱,https://blog.naver.com/youmen2as,20210503
지성<b>피부 관리</b> 할때 궁금한점 3개,https://blog.naver.com/dafarancom?Redirect=Log&logNo=222307890736,지성<b>피부 관리</b>에 있어 가장 까다로운 여러 결절들을 유발하고 마는 것이죠. 원인을 알아봤으니 다스리는 방법을 살펴봐야겠죠? 저는 이 다섯가지를 쓰고 있는데 관리할때 궁금했던 점 중에 하나가 클렌징오일을... ,Tina' 뷰티서랍 <나만의 시크릿>,https://blog.naver.com/dafarancom,20210413
상암<b>피부관리</b> : 달리아스파 상암점 by 약손명가 에서 작은얼굴... ,https://blog.naver.com/heo1028?Redirect=Log&logNo=222350047932,관리하는 내내 친절하시고 불편함 없이 해주셔서 정말 만족스러웠던 달리아스파였습니다 ♥ 프라이빗한 공간에서 피부와 작은얼굴 관리를 동시에 받을 수 있다니! 정말 마포<b>피부관리</b> 달리아스파... ,Great day ahead,https://blog.naver.com/heo1028,20210514
홍대<b>피부관리</b> W에스테틱에서 산소필 후기!,https://blog.naver.com/leempd?Redirect=Log&logNo=222322965258,산소필 관리를 받으니 피부 속이 맑아진 느낌이예요. 이래서 <b>피부관리</b> 받나봐요 ㅠ 오늘 제대로 된 관리를 받아보니 왜 이렇게 사람들이 <b>피부관리</b>를 받으러 가나 받아보니 알겠더라구요. ㅋㅋㅋ 보통 처음 필... ,Daily life,https://blog.naver.com/leempd,20210426
송파<b>피부관리</b> 피부가 안 좋아질 수가 없는 물방울 ERM 관리!... ,https://blog.naver.com/nada5333?Redirect=Log&logNo=222345547712,"송파<b>피부관리</b> &lt;닥터포레&gt; 물방울 ERM 관리 받고 꿀피부 되기❣ 송파 지역에서 <b>피부관리</b> 필요하신분께 추천드릴만한 에스테틱, 닥터포레에요. 제품으로나 <b>피부관리</b> 효과로나, 수기관리로나 다 너무... ",JJANG 3,https://blog.naver.com/nada5333,20210510
부평<b>피부관리</b>실 클레오파트라 제대로 받았어요,https://blog.naver.com/allaboutcanada?Redirect=Log&logNo=222328856725,"햇지입니다 :) 운동으로 꾸준히 건강과 몸매관리를 하지만, 피부는 잘 몰라서 부평<b>피부관리</b>실 다녀왔어요! 홈케어도 안하고 그냥 스킨로션만 바르고 아~주 가끔 한국에서 피부과 갔는데 피부과에서는 가끔 과한... ",오늘은 뭐햇지?,https://blog.naver.com/allaboutcanada,20210430
