title,link,description,bloggername,bloggerlink,postdate
제주 송악산 둘레길 제주도 서쪽 코스 <b>걷기</b> 좋은 길,https://blog.naver.com/bb00dd?Redirect=Log&logNo=222419196897,"송악산 둘레길 제주도 서쪽 코스 <b>걷기</b> 좋은 길 제주 송악산 둘레길 여행일 : 2021년 5월 6일 / 글, 사진... 5월이라 아직은 봄의 기운이 가득한 시기라 덥지도 않아 <b>걷기</b> 좋은 날이었습니다. 7월에는 살짝 덥기는... ",순수시대 주세환의 여행 사진 갤러리,https://blog.naver.com/bb00dd,20210703
<b>걷기</b>운동 효과 칼로리 놀랍도다!,https://blog.naver.com/muebmpn?Redirect=Log&logNo=222432923733,운동 부족 해소에 도움이 되는 <b>걷기</b>운동 효과를 알아봅니다. <b>걷기</b>운동 특별한 장소도 도구도 필요없이 간편하게 시작할수 있습니다. 활동 부족해소 방법이에요 <b>걷기</b>는 유산소의 대표 주자이며 지방 연소... ,우리모두순풍 :: 멋진 농가 세상 이야기,https://blog.naver.com/muebmpn,20210715
<b>걷기</b>운동효과 + 보리새싹가루 섭취로 뱃살 빼기!,https://blog.naver.com/hj2ywith?Redirect=Log&logNo=222426740813,<b>걷기</b>운동효과를 누리는 방법은 즐겁게 걷는 것 며칠 전 여름이 다가오고 늘 즐겨 입던 롱스커트를... 다소 더워진 날씨였지만 버스 2코스는 그냥 걸어보자는 마인드로 요즘은 <b>걷기</b>를 생활화하고 있답니다.... ,알프스하이디의 엄마를 위한 알림장,https://blog.naver.com/hj2ywith,20210710
<b>걷기</b>운동,https://blog.naver.com/ssfcyml?Redirect=Log&logNo=222426728101,지난주 오늘 뜬금없이 만보 <b>걷기</b>에 나섰지 꼬맹이 가야금 수업 대기 시간에 운동이나 해볼까 수업이 2시간에서 3시간으로 늘어나 시간을 알차게 보내보자 해서 시작한 만보 <b>걷기</b> 그렇게 시작했던 첫 날... ,행복이 머무는 공간,https://blog.naver.com/ssfcyml,20210710
"곡성 관광 제3경, 섬진강 침실습지 물멍 그리고 <b>걷기</b>",https://blog.naver.com/gokseong_love?Redirect=Log&logNo=222412478949,"곡성 관광 제3경, 섬진강 침실습지 물멍 그리고 <b>걷기</b> 곡성 관광 9경 중, 제3경 침실습지는 새벽에... 시간 ▷<b>걷기</b>: 1 시간 30분 ▷물멍. 휴식 : 30 분 ▶제 1 구간 : 주차장- 생태데크- 파고라 생태데크 중간에 있는... ",곡성군 공식블로그,https://blog.naver.com/gokseong_love,20210630
<b>걷기</b> 운동 효과 / 자세 / 주의사항,https://blog.naver.com/spiritboxer?Redirect=Log&logNo=222403613413,<b>걷기</b> <b>걷기</b>라는 활동은 인간에게 있어 너무 자연스러운 일상 중 하나이기 때문에 올바르게 걷는 방법이라는 것에 대해 심각하게 고민을 하지 않는 경우가 많습니다. 하지만 자세나 환경 및 여타 조건들이 <b>걷기</b>... ,스피릿박서's World,https://blog.naver.com/spiritboxer,20210619
여름철 <b>걷기</b>운동시 체크사항은,https://blog.naver.com/drsjd126?Redirect=Log&logNo=222430107522,그렇기에 여름철에는 강도높은 무리한 운동보다는 가벼운 <b>걷기</b>운동으로도 탄력있는 몸매와 체중감량을 하면서도 무리가 가지 않는 건강한 신체를 만들 수 있는데요 여름철 <b>걷기</b>운동 시 체크사항은 어떤 것이... ,"7대 전통 비방에 빛나는 ""송부자""",https://blog.naver.com/drsjd126,20210713
밥먹듯 <b>걷기</b>,https://blog.naver.com/ssohwee?Redirect=Log&logNo=222426649151,"매일 <b>걷기</b>다. 아이를 학교에 바래다주고, (학교까지는 겨우 50여미터면 되는데도 여전히 아이는 같이... 인바디 체크 후에는 <b>걷기</b>에 헬스장의 근육 운동이 추가 됐지만, 웬만큼 덥거나 공기질이 최악이 아닌 이상... ","바람의 빛, 그림자의 꿈",https://blog.naver.com/ssohwee,20210710
임신 21주 배크기 증상 몸무게 태교미싱 붓기 태동위치 <b>걷기</b>운동,https://blog.naver.com/blacksky2775?Redirect=Log&logNo=222437607473,21주 4일 제 눈에만 조금 더 커진거 같나요 한주 한주 비교해보면 모르겠어요 근데 커지고 있긴 해요 ㅋㅋㅋ <b>걷기</b>운동 \<b>걷기</b> 운동은 정형회과 다녀오고 이틀 쉰 이후부터는 매일 하고있어요 한시간 이상... ,햇님♥달님 그리고 말라몬 짱이,https://blog.naver.com/blacksky2775,20210719
국내 여름 여행지ㅣ시원한 숲 <b>걷기</b>여행지 추천,https://blog.naver.com/koreatrails?Redirect=Log&logNo=222384709883,국내 여름여행지 '시원한 숲 <b>걷기</b> 여행지 추천' 한바탕 비가 쏟아진 후 다시 날씨가 조금씩 더워지기... 두루누비 <b>걷기</b>길을 소개합니다. 울산 해파랑길 7코스 태화강 십리대숲 태화강을 따라 펼쳐진 대나무숲에... ,"우리나라의 모든 걷기, 자전거 여행 - 두루누비",https://blog.naver.com/koreatrails,20210604
안양천 <b>걷기</b> 양천구 코스,https://blog.naver.com/maya_lee?Redirect=Log&logNo=222424652263,그래서 이번에는 양천구 코스로 안양천 <b>걷기</b>에 도전해 봤습니다. 제가 걸었던 코스는 염강나들목에서... 이번에는 안양천 <b>걷기</b>를 위해 이쪽으로 우회전 했어요. 안양천 합수부 지점은 양천구 염창동 둘레길이... ,좋은 엄마 되기...,https://blog.naver.com/maya_lee,20210708
함께 <b>걷기</b> 좋은 국내 안심순례길 5선  [정책 읽어주는 주무관],https://blog.naver.com/mcstkorea?Redirect=Log&logNo=222417844766,"있는 <b>걷기</b>길이죠. 약 6킬로미터, 2시간 30분이 걸리지만 순환형 코스이기 때문에 원하는 만큼 이곳에서... 있는 <b>걷기</b>길입니다. 약 10.3킬로미터, 4시간 정도 소요되구요. 곳곳에 쉼터와 이정표가 잘 설치되어 있고... ",도란도란 문화놀이터,https://blog.naver.com/mcstkorea,20210703
"7시 아침 운동 <b>걷기</b>, 코로나 검사",https://blog.naver.com/mee1202?Redirect=Log&logNo=222432382233,9시 아침 운동 <b>걷기</b>가 7시로 당겨졌다. 6:40 입트영을 듣고 끝나자마자 아이가 그 사이 먼저 깨서... 굳이 아침 <b>걷기</b> 운동하지 않아도 되는데 굳이 일어나서 나오는 이유는... 혼자만의 시간이 필요해서. 오롯이... ,♡ Eun's story ♡,https://blog.naver.com/mee1202,20210715
"경기도 여주 <b>걷기</b> 좋은 길 3선, 6월 가볼만한 곳",https://blog.naver.com/yeojuhangul?Redirect=Log&logNo=222395106625,"6월 가볍게 걸으며 산책하기 좋은 곳, 경기도 여주 <b>걷기</b> 좋은 길 3선 답답한 마스크와 어수선한... 비록 먼거리 여행은 아니어도 '우리동네 <b>걷기</b> 좋은 길' 을 찾아 걸어보는 것으로 대신해보는 건 어떨까요?... ",여주시블로그,https://blog.naver.com/yeojuhangul,20210612
시간 <b>걷기</b>운동 운동 419 칼로리 사용 / 골다공증 예방 <b>걷기</b>운... ,https://blog.naver.com/ji29nny23?Redirect=Log&logNo=222433584983,헬스클럽에서 1시간 <b>걷기</b>운동 419 칼로리 사용 헬스클럽에서 한 시간 <b>걷기</b>운동을 시작한지 3일 째 내 몸에 쌓아 놓았던 에너지 419 칼로리를 썼다. 땀 뻘뻘! 오늘은 아침 8~9시까지 한 시간동안 3.5킬로를... ,플로라,https://blog.naver.com/ji29nny23,20210716
"오늘은 <b>걷기</b> 대신 등산, 남한산성 오르기",https://blog.naver.com/minjeongp?Redirect=Log&logNo=222397989430,<b>걷기</b> 대신 등산 가끔은 평소보다 강하게 운동하는게 좋다고 하더라고요. 집 앞에서 버스를 타고 마천동 남한산성 입구까지 거기에서 수어장대까지 슉..슉..슉.. 이렇게 갈 줄 알았어요. 요즘 <b>걷기</b>가 일상이 되어... ,지니마미의 집과 집밥,https://blog.naver.com/minjeongp,20210614
7월 <b>걷기</b>의 기록 에스프레소 내리는 아침,https://blog.naver.com/mira3483?Redirect=Log&logNo=222422057785,월요일의 <b>걷기</b> 일어나면 냥이들 물 갈아주고 사료 넣어주고 걸으러 나가는 세곡천 좀 일찍 나오면... 아침<b>걷기</b>로 새로운 루틴을 만들어 보니 요즘 에스프레소 내릴때 맛과 향과 크레마에 더 집중하게 된다... ,하프의 To Do List,https://blog.naver.com/mira3483,20210706
제주 섭지코지 동쪽코스 <b>걷기</b>좋은길,https://blog.naver.com/everything91?Redirect=Log&logNo=222426818613,"제주 섭지코지 동쪽코스 <b>걷기</b>좋은길 제주 동쪽코스 섭지코지, 성산일출봉, 신양해수욕장 함께... ㅋㅋ 리조트에서 암꺼도 안 하고 쉬는 날과 엄마도 조카도 제주 <b>걷기</b>좋은길을 찾아 비를 피해 열심히도 여행을... ",★한량이의 배낭메고 지구정복★,https://blog.naver.com/everything91,20210710
"사랑 잇기, 사랑 이음 밥차, 효석문학 100리 길 1구간 따라 <b>걷기</b>",https://blog.naver.com/pc_happy700?Redirect=Log&logNo=222437212134,효석문학 100리 길 1구간 따라 <b>걷기</b> 3. 진부면 맛있는 못난이 농산물 푸트스트릿 개장식 4. 농업기술... 효석문학 100리 길 1구간 따라 <b>걷기</b> 2. 진부면 맛있는 못난이 농산물 푸트스트릿 개장식 3. 농업기술... ,평창군 블로그,https://blog.naver.com/pc_happy700,20210719
다이어트 건강지침서 / 영양과 운동 / <b>걷기</b>운동 전신운동... ,https://blog.naver.com/namoonura?Redirect=Log&logNo=222438153086,바른자세로 '<b>걷기</b>운동'='전신운동' 매일 바른자세로 하는 '<b>걷기</b>운동' 은 근육뿐만 아니라 전신을 사용해 신체 전반의 건강을 유지하는데 도움을 준다는 사실을 알고 계셨나요? 운동효과 2배 '바른 자세로 <b>걷기</b>... ,엄만달,https://blog.naver.com/namoonura,20210720
제주 아이랑 가볍게 <b>걷기</b> 좋은 비자림,https://blog.naver.com/hnote13?Redirect=Log&logNo=222434882265,#제주아이랑 <b>걷기</b> 좋은 #비자림 500~800년 사이의 비자나무들이 자생하는 희귀한 장소라고 한다. 특별한... 전부 평지로 되어 있어 부담없이 <b>걷기</b> 좋은곳이다. 숲입구에서 벼락맞은 나무도 구경하고 수국도... ,더블H하우스 : 행동가득,https://blog.naver.com/hnote13,20210717
<b>걷기</b> 좋은 전북 천리길 - 군산 구불 5길,https://blog.naver.com/jbgokr?Redirect=Log&logNo=222404995516,아름다운 호수도 좋지만 더운 여름에도 일부 구간을 제외하면 대부분 그늘로 되어있어 <b>걷기</b>에... 대신 <b>걷기</b> 초보에게는 다소 힘들 수 있으니 힘들면 중간에 물빛다리를 건너 절반만 걸어도 충분할 듯싶네요.... ,전라북도 공식 블로그,https://blog.naver.com/jbgokr,20210621
별내 우리동네 <b>걷기</b>운동,https://blog.naver.com/joo1055?Redirect=Log&logNo=222434876805,카페거리까지 <b>걷기</b>운동을 하러 나왔다 주로 오전엔 집안일을 하는데 여름이라 날씨가 더워서 <b>걷기</b>운동 먼저 하고 집안일을 하는걸로 시간 변경을 했다 그런데 오전 9시 인데도 엄청 덥다 내일은 조금 더 일찍... ,우초,https://blog.naver.com/joo1055,20210717
2021 생명사랑 밤길<b>걷기</b> / Live WALK 밤길<b>걷기</b> ⭐,https://blog.naver.com/dneyppah?Redirect=Log&logNo=222438209586,"^^ 올해도 생명사랑 밤길<b>걷기</b> 행사가 진행예정인데 같은 장소에서 출발하는 대면 프로그램은 서울, 부산이 예정이지만 코로나19 상황단계에 맞춰 조정될 수도 있다고 하구요. 비대면 밤길<b>걷기</b>는 원하는 곳... ",이오스타 인천송도점/ 제니,https://blog.naver.com/dneyppah,20210720
종아리통증으로 <b>걷기</b> 불편해요,https://blog.naver.com/skj3606?Redirect=Log&logNo=222400904492,있구요 <b>걷기</b> 불편할정도로 좀 아픈날도 있고 그러는데 왜 그런걸까요? ---------종아리통증으로 <b>걷기</b> 불편한것은 대둔근 햄스트링 과 비복근을교정하세요걸을때 종아리통증은 대둔근 좌골조면이... ,100세 체형교정,https://blog.naver.com/skj3606,20210626
"서울 폭염주의보 속 <b>걷기</b> (청계천, 세운상가, 청계상가... ",https://blog.naver.com/kiyoon96?Redirect=Log&logNo=222435035726,"따라 <b>걷기</b>로 했어요. 폭염주의보로 무척 더운 날이었지만, 청계천 가장자리에 그늘이 있어서 그늘로... 영풍문고에서부터 <b>걷기</b> 시작했는데 걷다 보니 세운상가 도착!! 세운청계상가는 얼마 전 종영한 드라마... ",꿈 가득 책장,https://blog.naver.com/kiyoon96,20210717
양주 도락산 옥천 약수터 초록 초록 숲길 <b>걷기</b> 좋은 곳!,https://blog.naver.com/yangju619?Redirect=Log&logNo=222417839912,장마 전에 덕계동 초록 초록한 숲길 도락산 옥천 약수터 숲 <b>걷기</b> 해보았습니다. 옥천 약수터 지도에... <b>걷기</b> 하면 운동! 도착하시면 약수! 준비된 의자에 앉아 여름 숲 새들의 소리에 마스크로 답답한 마음을 잠시... ,양주시 공식블로그 [클릭양주],https://blog.naver.com/yangju619,20210702
해운대 갈맷길<b>걷기</b>(2코스 1구간),https://blog.naver.com/04230819kj?Redirect=Log&logNo=222419967306,친구랑 갈맷길 <b>걷기</b> 여름되기전 햇살 좋고 바람 시원했던 5월~ 딸랑구 등교수업이 있던 날 친구랑 오전에 #갈맷길<b>걷기</b> 에 도전했어요!^^ 부산엔 바닷길따라 <b>걷기</b> 좋은 코스가 많답니다. 갈맷길~ 해파랑길~ 등등등... ,마.루.아.토.,https://blog.naver.com/04230819kj,20210704
"임산부 <b>걷기</b> 운동, 누구에게나 좋을까요?",https://blog.naver.com/doula77?Redirect=Log&logNo=222434947071,"<b>걷기</b> 운동은 누구나 쉽게 할 수 있고, 장소도 구애받지 않아서 접근성이 꽤 높은 운동입니다. 인간이 하기에 가장 완벽한 운동이라는 점에서도 굉장히 매리트가 많은 운동이죠. 실은 <b>걷기</b>를 운동이라고 칭한 건... ",출산할땐 둘라코리아,https://blog.naver.com/doula77,20210717
"에어컨 교체,만보<b>걷기</b>",https://blog.naver.com/kj87042003?Redirect=Log&logNo=222424490772,"에어컨 교체,만보<b>걷기</b> 목수가 자기집 관리는 빵점이고, 이발사가 자기 머리는 컷트를 못하고..... 우리집... 오후에는 비가 그쳐서 나홀로 <b>걷기</b>운동을 한다. 오늘도 나의 목표량을 체웟다. 일자:2021년 7월 7일... ",고락산성의 블로그,https://blog.naver.com/kj87042003,20210708
임산부와 태아의 건강에 도움 되는 <b>걷기</b> 운동!,https://blog.naver.com/prettydie?Redirect=Log&logNo=222406135020,<b>걷기</b> 운동은 누구나 부담 없이 시작할 수 있는 가벼운 운동으로 알려져 있습니다. 최근에는 따뜻한... <b>걷기</b> 운동은 자신의 건강과 체력 상태에 맞춰서 강도를 조절할 수 있는 장점을 가지고 있기 때문에 몸이... ,연세365산부인과,https://blog.naver.com/prettydie,20210622
만보<b>걷기</b> 7/5~7/6,https://blog.naver.com/1981tkdal?Redirect=Log&logNo=222422731407,만보<b>걷기</b>를 시작하고 5일이 지나자 더이상 근육통이 생기지않았다. 처음 3일은 진짜 체력저하를 극렬하게 느꼈는데 4일째부터는 좀 덜함. 사실 만보<b>걷기</b>를 시작한 후부턴 밀린 투자책도 안읽고 건강관련... ,돈덕후 상미의 자주독립기,https://blog.naver.com/1981tkdal,20210706
매일 <b>걷기</b>의 즐거움,https://blog.naver.com/shingist?Redirect=Log&logNo=222426475673,그렇게 시작한 <b>걷기</b> 모임은 처음 두 명이 시작해서 지금은 네 명의 고정 멤버가 되었다. 아침 9시 전에... 어느덧 <b>걷기</b>를 하며 4계절을 두 번씩 맞이하게 된 2년이 다가온다니... <b>걷기</b>도 좋고 자연을 즐기는 것도... ,화성에살다,https://blog.naver.com/shingist,20210710
<b>걷기</b> 혹은 필라테스(워킹맘 체력 키우기),https://blog.naver.com/meyou27?Redirect=Log&logNo=222420853264,쉬는날 오전 필라테스 예약을 못해서 어린이집 등원하자마자 공원으로 갔다 50분 <b>걷기</b> 편두통에 <b>걷기</b>가 그렇게 좋다고 해서 살기위한 운동 시작이다. 필라테스는 2월부터 시작했는데 체력이 좋아짐이 느껴진다.... ,황쩡의 블로그,https://blog.naver.com/meyou27,20210710
"<b>걷기</b> 운동 효과, 칼로리 소모는?",https://blog.naver.com/sp9025?Redirect=Log&logNo=222425740397,"<b>걷기</b> 운동 효과, 칼로리 소모는? 안녕하세요. 잠백이입니다. 바이러스가 점점 더 심해지고 있는 요즘... 바로, <b>걷기</b> 운동 효과 랍니다. 별다른 운동을 하지 않아도 충분히 걷는 것만으로도 충분히 운동의 효과를... ",개인공간,https://blog.naver.com/sp9025,20210709
봉산(烽山)-서오릉(西五陵)<b>걷기</b>,https://blog.naver.com/sonjson?Redirect=Log&logNo=222435071303,서울과 경기도의 경계가 되는 봉산(烽山)능선 <b>걷기</b>가 오늘의 주된 운동이고 서오릉은 덤이었던 셈이다.... 다음 토요일 서울둘레길 이어<b>걷기</b>를 계속하기로 하였다. 증산역 3번출구 8명 미팅 - 서울둘레길... ,달하 노피곰 도드샤,https://blog.naver.com/sonjson,20210717
의미있고 행복한일-하루10km<b>걷기</b>,https://blog.naver.com/hl5bat?Redirect=Log&logNo=222433836429,"10km를 <b>걷기</b> 시작했다. 걷는 코스는 집 앞 공원이 572m, 갑천은 엑스포다리로 올라가서 엑스포 광장을... <b>걷기</b> 시작한지 20일 만에 2kg이 줄었다. 70kg에서 68kg으로 내려갔다. 아마도 일시적인 현상도 있으리라... ",HAMRADIO & 의미있고 행복한 일 만들기,https://blog.naver.com/hl5bat,20210716
<b>걷기</b>를 생각하는 <b>걷기</b>_울리 하우저,https://blog.naver.com/mywayispa?Redirect=Log&logNo=222427674547,"싶어서' <b>걷기</b> 여행을 떠난다. 특별한 계획도, 뚜렷한 목적도 없다. 그냥 발길 닿는 대로 바람 부는 대로.... 그런 의미에서 &lt;<b>걷기</b>를 생각하는 <b>걷기</b>&gt;라는 국내판 책 이름은 매우 합당한 제목이다. 독일의 유명... ",호모 아카데미쿠스,https://blog.naver.com/mywayispa,20210711
서울 주말 나들이 경의선 책거리 혼자 서울 여행 <b>걷기</b>좋은길,https://blog.naver.com/jbm993?Redirect=Log&logNo=222429360519,서울 주말 나들이 경의선 책거리 혼자 서울 여행 <b>걷기</b>좋은길 주말 나들이 혼자 서울여행 경의선 책거리... 서울 주말 나들이나 일상속 <b>걷기</b> 좋은길로 찾아가도 좋을텐데요. 요즘처럼 함께가 아닌 둘이서.. 혹은... ,열씨미 카메라세상,https://blog.naver.com/jbm993,20210712
"인천 <b>걷기</b> 좋은 곳!  한국 최초의 서구식 공원, 인천 자유공원",https://blog.naver.com/incheontogi?Redirect=Log&logNo=222432600562,"여름에 <b>걷기</b> 좋은 공원, 인천 자유공원 맥아더 장군 동상이 있는 인천 자유 공원은 1957년 10월 3일부터 자유 공원이라는 이름으로 사용되었습니다. 역사가 꽤나 깊은 공원이죠? 또한 한국 최초의 서구식 공원이며... ",인천광역시 공식 블로그,https://blog.naver.com/incheontogi,20210715
[오늘의 6천보 <b>걷기</b>] 2021 07 06,https://blog.naver.com/cleo1112?Redirect=Log&logNo=222423636219,"쓰고 <b>걷기</b> 운동 하시는 아저씨 및 할머니들이 너무나 많아서 (무, 무떠워..ㅠ.ㅠ). 차라리 도로가지만... <b>걷기</b>는 계속 되어야 한다.. 쭈욱.. 하, 하지만 너무 덥..ㅠㅠ 30분 이상 땀 줄줄 흘린 것으로 만족. 오늘의... ",Cleo's handmade tale,https://blog.naver.com/cleo1112,20210707
비대면 시대에 사랑받는 전남 <b>걷기</b> 좋은 섬은?,https://blog.naver.com/mopaspr?Redirect=Log&logNo=222428714243,거리 두기를 실천하며 떠날 수 있는 전남 <b>걷기</b> 좋은 섬은 어떤 곳이 선정됐을까요? 5개의 테마로 즐기는 섬 여행 행정안전부는 섬 관광 전문가 자문과 섬 여행자의 다양한 취향을 고려해 '<b>걷기</b> 좋은 섬... ,대한민국 행정안전부,https://blog.naver.com/mopaspr,20210713
"한강까지 <b>걷기</b>, 스벅랜턴도 받고...",https://blog.naver.com/nalma?Redirect=Log&logNo=222426539753,"홀딱 맞으시는 분도 계셨고, 다리아래서 피해계시는 분들도 계셨고, 우리는 우산쓰고 계속 <b>걷기</b>. 한강도착~ 미니스톱 한강난지1호점에서 커피 한잔~ 얼음컵이랑 아메리카노 사서... 2층에 이렇게 먹을수 있는... ",날마네 뜰,https://blog.naver.com/nalma,20210710
공도읍 <b>걷기</b> 좋은 길,https://blog.naver.com/anseongsi1?Redirect=Log&logNo=222437058395,공도읍 <b>걷기</b> 좋은 길에는 다양한 자영업자 소상공인들께서 영업 중이었습니다. 안타까운 것은 2년... 공도읍 <b>걷기</b> 좋은 길 스스로에서 즐거운 산책과 함께 착한 소비도 해주시기 바랍니다. 골목 산책을 즐겨보니... ,안성 e 좋아,https://blog.naver.com/anseongsi1,20210719
고관절수술후 첫 망우산중랑둘레길 만보<b>걷기</b>,https://blog.naver.com/namoo528?Redirect=Log&logNo=222420977672,만보이상 걸었다 수술후 만보이상 <b>걷기</b>는 처음이다 두다리로ᆢ 모험한다는 마음으로 시작했다 거짓말 1도 보태지않고 6000보쯤에서 걸음을 걸을수 없을정도로 다리에 무리가 왔다. 잠시 쉬었다 <b>걷기</b>시작할때는... ,꽃들에게 희망을,https://blog.naver.com/namoo528,20210705
<b>걷기</b> 운동 - 기록 경신!!!,https://blog.naver.com/n_o_9?Redirect=Log&logNo=222426173821,"육류와 생선, 밀가루는 멀리하고 현미밥에 야채, 과일만 먹으면서 아침저녁으로 <b>걷기</b>로 했다. 대폭... 처음 목표는 만보 <b>걷기</b>. 녹록하지 않을 거라 생각했는데 의외로 10,000보 <b>걷기</b>는 쉬웠다. 2단계는 15,000보.... ",책나무출판사,https://blog.naver.com/n_o_9,20210710
포천 산정호수 둘레길 경기도 <b>걷기</b>좋은길 찾아서~,https://blog.naver.com/djkkll1233?Redirect=Log&logNo=222432835822,"포천 산정호수 둘레길 경기도 <b>걷기</b>좋은길 찾아서~ 글,사진 비바라기 비 오는 날 이날은 어디 갈까? 포천 산정호수 둘레길을 <b>걷기</b>로 한다. 최근 비 오는 날이 잦으니 우린 경기도 <b>걷기</b> 좋은 길을 찾아서 산책... ",비바라기의 콩이타로와 함께하는 여행,https://blog.naver.com/djkkll1233,20210715
"산책로를 따라 <b>걷기</b> 좋은 곳, 전곡근린공원",https://blog.naver.com/iyc21net?Redirect=Log&logNo=222434643664,잠시 쉬었다가 다시 산책로를 따라 <b>걷기</b> 운동을 했답니다. <b>걷기</b> 운동의 올바른 자세를 알려주는 표지판도 있었는데요. 가볍게 읽어보고 올바른 자세를 의식하며 걸었답니다. 중간중간 이런 표지판이... ,연천군공식블로그,https://blog.naver.com/iyc21net,20210718
<b>걷기</b> 운동의 효과와 올바른 자세를 알아봐요,https://blog.naver.com/kkn3526?Redirect=Log&logNo=222431530915,"바로 <b>걷기</b> 운동이 있습니다. 요즘같은 여름철에는 한낮 기온이 높은 시간보다 해가지는 무렵부터 해서 저녁무렵까지 <b>걷기</b> 딱 좋은 시간이 아닐까 하는데요 걸음을 걷는 것, 대체 어떤 효과가 있는지 궁금하실... ",편하지의원,https://blog.naver.com/kkn3526,20210714
<b>걷기</b>운동 코스의 끝을 가보다 !,https://blog.naver.com/handamen?Redirect=Log&logNo=222436084880,<b>걷기</b>운동 코스의 끝을 가보다 ! 작년부터 점심시간에 짬을 내어 <b>걷기</b> 운동을 시작했습니다. 코스는 학원부터 시작해서 연수원길 중간까지 왕복 2km~3km 정도 토욜날 고3짜리 따님 픽업하느라고 저는 저희... ,한국사회컴퓨터학원,https://blog.naver.com/handamen,20210718
오늘일기 20210528 저녁 <b>걷기</b>운동 굿!,https://blog.naver.com/jsn920?Redirect=Log&logNo=222372643216,ㅎㅎ 퇴근 후 저녁을 조금 먹고는 공원에 나가 <b>걷기</b>운동을 하였다. 가볍게 걸어볼까?..했었는데...웬걸...오늘은 5km 1시간을 완전...파워워킹으로 <b>걷기</b>운동을 제대로 하였다.ㅎㅎ 중간쯤 사람들이 너무 많아서... ,그린향기의 일상& 여행...,https://blog.naver.com/jsn920,20210528
<b>걷기</b> 좋은 제주 한담해안산책로,https://blog.naver.com/betelgiuse?Redirect=Log&logNo=222423877367,이곳은 바닷가 바로 옆에 산책로가 조성되어 있어 바다를 바라보며 <b>걷기</b>에 좋은곳인데요. 거기다 요즘... 제주 한담해안산책로는 산책로가 가파르거나 하지 않아서 <b>걷기</b>에 아주 좋더라고요. 주변에는... ,굿린,https://blog.naver.com/betelgiuse,20210707
만보 <b>걷기</b>가 식욕억제제였어,https://blog.naver.com/1981tkdal?Redirect=Log&logNo=222429159476,주말 만보 <b>걷기</b>도 하지않고 엄청 먹었다. 심지어 술도 마심 ㅠㅠ 입이 터진 건 아니고 먹을 상황이 생겨버림 ㅎ (결혼기념일) 근데 생각해보니 만보 <b>걷기</b>를 못한게 원인인 듯~ 만보 <b>걷기</b>를 했을때는... ,돈덕후 상미의 자주독립기,https://blog.naver.com/1981tkdal,20210712
