title,link,description,bloggername,bloggerlink,postdate
제주도 선물 편하게 <b>쇼핑</b>!,https://blog.naver.com/findjeju?Redirect=Log&logNo=222412796918,먹거리 위주의 제주도 선물 <b>쇼핑</b>을 마친 뒤 2층으로 올라갔어요. 감성소품위주로 구성이 되어있다길래... 오직 이 곳에서만 구매할 수 있는 스페셜한 소품도 많아 <b>쇼핑</b>하는 재미가 쏠쏠했답니다.,제주길잡이의 제주도여행,https://blog.naver.com/findjeju,20210628
인트렌드 INTREND 직구: 막스마라 아울렛 온라인 <b>쇼핑</b>.,https://blog.naver.com/tatu_yulia?Redirect=Log&logNo=222430740385,저지 드레스 <b>쇼핑</b>하기 보면... 이게 독일에는 노란색 재고가 없어요. 그래서 이런 경우가 있는 것이고.... 진짜 저렴히 <b>쇼핑</b>하게 되는 셈.. 그러면 초록 창에서 이걸로 검색해보면... 후기들이 쫘르륵 나옴. 읽고... ,밍기뉴의 해외직구 블로그,https://blog.naver.com/tatu_yulia,20210714
더 현대 서울 여의도 매장 <b>쇼핑</b> 후기 : ),https://blog.naver.com/jjeong1225?Redirect=Log&logNo=222423940922,"예상보다 더 볼만한 곳, 들릴만한 곳이 많아서 매장 <b>쇼핑</b> 후기 남기니 알차게 보실 분들은 참고해주시면 좋을 것 같아요 : ) 우선 첫인상은 <b>쇼핑</b>하기 참 좋은 곳이라는 인상을 받았어요. 일단 여의도기 때문에... ",이상한 나라의 히로,https://blog.naver.com/jjeong1225,20210708
메르제 기초화장품 현대몰<b>쇼핑</b>라이브에서 득템,https://blog.naver.com/tnstnqorqo?Redirect=Log&logNo=222431084972,메르제 기초화장품 현대몰<b>쇼핑</b>라이브에서 득템 메르제 순수 모이스처토너는 수분과 영양성분을... 메르제 기초화장품 현대몰<b>쇼핑</b>라이브에서 득템 나의 최애 메르제 토너패드 특이 패턴 요철로 이루어진... ,이런 귀한 곳에 이런 누추한 분이,https://blog.naver.com/tnstnqorqo,20210714
쿠팡 직구 글로벌 <b>쇼핑</b>데이 빅세일 2만 쿠폰DEAL,https://blog.naver.com/pf0itwsus?Redirect=Log&logNo=222406049373,글로벌 <b>쇼핑</b>데이라고 해서 여름맞이 빅세일이 진행 중이면서 최대 2만쿠폰까지 나와서 저렴하게 지름하기에 딱 좋거든요 필요했던 아이템이 있었다면 좋은 찬스로 득템해보세요!! 사실 해외<b>쇼핑</b>몰을 이용하는... ,쩡's 해외직구 소확행♡,https://blog.naver.com/pf0itwsus,20210622
H&amp;M 세일 미국 공홈 직구방법 <b>쇼핑</b>을 쉽게 해요!,https://blog.naver.com/jwzzz87?Redirect=Log&logNo=222401452060,급할 때에는 국내 매장을 가서 직접 <b>쇼핑</b>하기도 하고 그렇지 않을때에는 미국 공홈에서 주문을 하고... &gt;&gt; H&amp;M 미국 <b>쇼핑</b>몰 이동하기 - 직배송 불가. 배대지 이용 필수 - 최종 결제금액 $200 초과하면 관부가세... ,이짱 = 패션×직구×핫딜,https://blog.naver.com/jwzzz87,20210617
진짜 과일처럼 달고 과즙 팡팡 멸치<b>쇼핑</b> 산지직송 초당옥수수... ,https://blog.naver.com/shally0107?Redirect=Log&logNo=222435813146,http://m.smelchi.com/product/detail?productCd=44214724 멸치<b>쇼핑</b>을 통해 영업중인 바다사나이에서 초당옥수수 주문. 옥수수가 얼마나 신선하고 수분감이 많은지 박스가 이미 촉촉히 젖었다. 분리수거장에 바로... ,뚜의 행복찾기,https://blog.naver.com/shally0107,20210718
식물 <b>쇼핑</b>의 코스트코 - 파주 조인폴리아,https://blog.naver.com/jkb0908?Redirect=Log&logNo=222429291112,"식물<b>쇼핑</b>하기 좋은 곳이 있어 소개해 본다 일명 식물계의 코스트코! 지난 주말에 파주 조인폴리아에... 식<b>쇼핑</b> 리스트: 아스파라거스, 홍콩야자, 올리브나무, 스위트바질, 필로덴드론버킨, 호야 이렇게 많이... ",귀인냥의 블로그,https://blog.naver.com/jkb0908,20210712
"제주 디앤디파트먼트, 숙박, <b>쇼핑</b>, 식사",https://blog.naver.com/alswl9476?Redirect=Log&logNo=222438050456,"본격 <b>쇼핑</b>을 할 수 있는 공간 ~_~ 꽤 큰데, 공간에 비해 상품들이 적은편 초딩시절 기념품으로 사오고 했던 돌하르방 귀여운 의자들 가격은 엨.. 추억 감성 뿜뿜 아기자기 예뻤던 식기들 가구들도 꽤... ",먼로그,https://blog.naver.com/alswl9476,20210720
찌니의 <b>쇼핑</b>일기-헬렌카민스키 비앙카,https://blog.naver.com/jeongji11?Redirect=Log&logNo=222429943628,더스트백과 <b>쇼핑</b>백까지 함께 배송온 마이 핑크 비앙카 ㅋㅋㅋ 2월에 샀는데 왜 이제 포스팅하냐고요? 왜냐면 찌니의 <b>쇼핑</b>일기는 착샷이 필수니까요 그래서 여름이 되어 착샷을 찍을때까지 미뤄둘수밖에... ,찌니의 일상,https://blog.naver.com/jeongji11,20210713
20대여자시계 똑부러지게 백화점에서 할인받고 <b>쇼핑</b>,https://blog.naver.com/kajak21?Redirect=Log&logNo=222401058679,모인 <b>쇼핑</b> 천국이었던 캉카스백화점! 찾아 간 보람 넘쳤던 게요 저 이 까르띠에 산토스 갈베 왕창... 세심하게 전반적인 <b>쇼핑</b>을 다 케어해줘서 편했어요~ 놀라운 건 워치말고도 명품 백과 지갑에 주얼리까지... ,JW스케치,https://blog.naver.com/kajak21,20210617
일본 삿포로 <b>쇼핑</b>리스트 가고 싶어,https://blog.naver.com/skawjddl23?Redirect=Log&logNo=222422004019,이번 포스팅은 일본 삿포로 <b>쇼핑</b>리스트입니다. 조만간 갈 수 있게 된다면 사고 싶은 게 너무 많네요.... 일단 제가 일본 삿포로 <b>쇼핑</b> 리스트에서 사 오고 싶은 것 중 하나는 칫솔인데요. 우리나라에 없는 작은... ,나만의 세상 생각 잡동사니,https://blog.naver.com/skawjddl23,20210706
초기이유식준비물 육아<b>쇼핑</b>앱 MAMI 무료배송으로 준비♬,https://blog.naver.com/ghdlt86?Redirect=Log&logNo=222437003490,육아전문<b>쇼핑</b>앱 마미!! 하나만 구매해도 무료~ 거기다 회원가입하면 10만원 쿠폰팩도 쨘! 회원가입할때... 육아전문<b>쇼핑</b> 앱 마미에서 배송비 아끼며 <b>쇼핑</b>하세요♬ https://about.mami.co.kr #이유식초기세트... ,꼬꽁이 새댁,https://blog.naver.com/ghdlt86,20210719
하와이 선물과 소품이 가득한 <b>쇼핑</b>샵  샌드 피플 (마우이... ,https://blog.naver.com/sseoble?Redirect=Log&logNo=222421974716,하와이 기념품을 <b>쇼핑</b>하고 싶다면 샌드 피플 매장에 꼭 들려 보세요 ^^ 자! 그럼 잠시라도 오늘 마할로의 하와이<b>쇼핑</b> 이야기가 잠시 기분 좋음과 설레임이 있으셨길 바래봅니다. 좋은 하루들 되세요! Mahalo!~,하와이. 미서부. 남태평양은 마할로와 함께,https://blog.naver.com/sseoble,20210706
29CM x 곽지영의 미니멀 라이프 <b>쇼핑</b> 팁은?!,https://blog.naver.com/bllong2?Redirect=Log&logNo=222436181865,"29CM x 곽지영의 <b>쇼핑</b> 팁은?! 평소 미니멀리스트로 소문난 모델 곽지영이 미니멀 라이프 <b>쇼핑</b> 팁을 공개했죠 오랫동안 사용할 수 있는 액세서리, 인테리어, 주방 용품을 소개했다고 하는데요 모델 곽지영이... ",꽃블롱,https://blog.naver.com/bllong2,20210720
프랑스 건축 거장이 제안하는 새로운 <b>쇼핑</b> 경험 '돌체앤가바나... ,https://blog.naver.com/designpress2016?Redirect=Log&logNo=222410078568,계단 없이 경사로를 따라 가다 4층에 도달하는 형태는 고객의 <b>쇼핑</b> 경험을 보다 자연스럽고... 건축물 전체를 관통하는 나선형 경사로와 동일한 소재를 사용해 고객의 <b>쇼핑</b> 경험이 1층에서 야외... ,네이버 디자인,https://blog.naver.com/designpress2016,20210625
<b>쇼핑</b>호스트 섭외 가능한 라이브커머스업체,https://blog.naver.com/srru4407?Redirect=Log&logNo=222431550714,이런 날에는 집콕하면서 핸드폰으로 시원하게 <b>쇼핑</b> 즐기는게 모두의 희망이실텐데요! 이 희망을 대변하듯 요즘 모바일로 진행되는 라이브 <b>쇼핑</b> 방송인 라이브커머스의 인기는 하늘을 찌르고 있다고 해요! 아직... ,아무것도없는곳,https://blog.naver.com/srru4407,20210714
"[Paris] 파리 여행, 파리 <b>쇼핑</b>, 파리 풍경, 파리 마레지구 산책",https://blog.naver.com/clio2010?Redirect=Log&logNo=222432371881,"것은 <b>쇼핑</b>을 해야 하는데 아직 문을 열지 않은 샵들이 많았던 것 하지만 다행스럽게도 Saint James 세인트... 식재료 <b>쇼핑</b> ~~~~ 친구한테 이제는 가장 재밌는 <b>쇼핑</b>이 그릇 사는거, 식재료 사는거, 인테리어 소품... ",Someday France :),https://blog.naver.com/clio2010,20210715
미국 <b>쇼핑</b>리스트 : 한국에서 미국으로 한국식품 직배송... ,https://blog.naver.com/goforsweet?Redirect=Log&logNo=222423104539,"미국 <b>쇼핑</b>리스트 : 한국에서 미국으로 한국식품 직배송 받았어요, 한품 이용 #장바구니 #미국장바구니 #미국장보기 #미국<b>쇼핑</b> #<b>쇼핑</b>리스트 #한국식품<b>쇼핑</b> #한품 #미국생활 #내돈내산<b>쇼핑</b> #장바구니공개... ",Aloha life in Hawaii,https://blog.naver.com/goforsweet,20210707
직구할 때 경유하기 팁!(feat. 마이아멕스<b>쇼핑</b>/캐치패션),https://blog.naver.com/kellyz22?Redirect=Log&logNo=222421381807,"똑똑하게 <b>쇼핑</b>(직구)하려면 필수인 곳, 경유사이트 주변 사람들이 직구에 입문할 때 종종 물어보는데... 마이아멕스<b>쇼핑</b> 이건 신한 아멕스카드가 있어야 가능하다. 신한 아멕스 카드 고객 전용 온라인 캐시백... ","켈리가 말하길,",https://blog.naver.com/kellyz22,20210705
신생아 옷 <b>쇼핑</b>의 즐거움_미국 아동복 <b>쇼핑</b>팁,https://blog.naver.com/ddochi84?Redirect=Log&logNo=222433317172,"그래도 <b>쇼핑</b>을 갈때마다 눈에 보이는 귀여운 아기옷들은 한두개씩 사다가 모아놨는데, 빨아... 한국도 요즘은 인터넷 <b>쇼핑</b>몰로 구입하면 가격이 매우 저렴하지만 백화점에서 아기 옷을 사면 비쌌던 걸로... ",MJ's Joyful Kitchen-*,https://blog.naver.com/ddochi84,20210716
$ 상반기 <b>쇼핑</b> 결산 $ 샤넬 벨트 / 디올 슬링백 / 프라다 호보백... ,https://blog.naver.com/jsshhhmc?Redirect=Log&logNo=222437438550,"모처럼 맛집, 화장품 포스팅이 아닌 <b>쇼핑</b> 후기 포스팅을 준비했습니다. 올해는 <b>쇼핑</b>을 줄여보자!가 목표여서 매월 <b>쇼핑</b> 가계부도 쓰고 나름 노력 중이긴 한데 가끔씩 지름신이 강림할 때 평소에 고민하던 비싼... ",ELEKANGSEOL LIFE,https://blog.naver.com/jsshhhmc,20210719
"이커머스는 네이버 <b>쇼핑</b>라이브! 이용등급, 수수료 기준 총정리",https://blog.naver.com/bbiyou?Redirect=Log&logNo=222437197723,"네이버 <b>쇼핑</b> 라이브가 지난 1년간 누적 시청 3억 5천만 뷰! 누적 거래액 2500억 원을 넘었다죠? 판매자... 네이버 <b>쇼핑</b>은 등급이 안되면 못했기 때문에 처음에는 바로 입점할 수 있는 플랫폼 ( 인스타그램, 그립... ",잘나가는 빠워블로거❤ 봉여사,https://blog.naver.com/bbiyou,20210719
국내최초 라이브커머스 ::그립 앱으로 소통하며 최저가 <b>쇼핑</b>하... ,https://blog.naver.com/ehwidmswi?Redirect=Log&logNo=222420174483,요즘은 <b>쇼핑</b>플랫폼이 나날이 발전하고 있더라구요. 유튜브를 넘어 이제는 동영상 라이브로도 <b>쇼핑</b>하는 시대가 와서 고객입장으로써 넘넘 신박하고 재밌는 앱을 소개해드릴려구요~ 그립이라는 어플이에요.... ,* 쩡이의 잘 어질러진 방 *,https://blog.naver.com/ehwidmswi,20210704
일본 오사카 여행 다이소 과자 <b>쇼핑</b> 재밌어,https://blog.naver.com/skawjddl23?Redirect=Log&logNo=222413957426,이번 포스팅은 일본 오사카 여행 중 다이소 과자 <b>쇼핑</b> 후기입니다. 저는 먹는 거 구경하고 사는 거 되게... 다이소 <b>쇼핑</b> 후기 한번 보실까요? 일단 가볍게 먹기 좋은 군밤 우리나라도 많이 파는데 양이 많아서... ,나만의 세상 생각 잡동사니,https://blog.naver.com/skawjddl23,20210629
<b>쇼핑</b>이 즐겁다. 부산대 젊음의 거리!,https://blog.naver.com/geumjeonggu?Redirect=Log&logNo=222417421302,"유모차를 끌고 아이들과 함께 <b>쇼핑</b>을 온 엄마들도 있고, 삼삼오오 짝지어 <b>쇼핑</b>하러 온 엄마들의 모습도 보였습니다. 부산도시철도 1호선의 ‘부산대역’에서 하차하면, 시작되는 <b>쇼핑</b>의 거리는 교통이... ",Feel 금정 : 금정구 공식 블로그,https://blog.naver.com/geumjeonggu,20210702
오사카생활 day.348 : 밥-<b>쇼핑</b>-밥(긴샤리아게코테이... ,https://blog.naver.com/mirr13?Redirect=Log&logNo=222434992557,"<b>쇼핑</b>하기로 했지요. 농산물, 수산물, 고기까지.. ㅎ 출발 전에 아점. 일본 가정식집 #긴샤리아게코테이... ㅎㅎ <b>쇼핑</b> 마지막 코스 #코스트코_홀세일_이즈미 아, 이 사진을 마지막으로 코스트코 <b>쇼핑</b>샷은... ",행복한 날(我 & 日) 만들기~*^^*,https://blog.naver.com/mirr13,20210717
[광화문 교보문고] 뜨개서적(일서) <b>쇼핑</b>.,https://blog.naver.com/ksysysy?Redirect=Log&logNo=222427313419,언니랑 교보문고 광화문점으로 책<b>쇼핑</b> 다녀왔다. 그런데 안타깝게도.. 가는 길에 다른길로 새는바람에 정작 교보문고에서 30분의 시간밖에 못보냈다는.. 황당. ㅋ 교보문고 광화문점. 주변이 공사중이어서... ,소소하고 즐거운 일상,https://blog.naver.com/ksysysy,20210711
빈스 여름세일 마지막날. 면세 <b>쇼핑</b> 작은 팁.,https://blog.naver.com/tatu_yulia?Redirect=Log&logNo=222421589640,그러면 각각 다른 날 통관 처리되기 때문에 모두 면세 <b>쇼핑</b>이 가능한 것.  빈스 여름 세일 최대 70... 스커트 <b>쇼핑</b>하기 국내가 70만.. 정상 판매중인 오간자 사선 스커트입니다. 다른 소재의 원단이 겹쳐져 더욱... ,밍기뉴의 해외직구 블로그,https://blog.naver.com/tatu_yulia,20210706
올리브영 <b>쇼핑</b>리스트 &amp; 언박싱,https://blog.naver.com/jaiwonlove?Redirect=Log&logNo=222434442986,안녕하모니카~ 오늘은 저의 올리브영 <b>쇼핑</b>리스트 &amp; 언박싱 포스팅을 해보려구해요!!! 개별 상품의 상세... 올리브영 <b>쇼핑</b>리스트 같이 구경하실레예?? 1. 브링그린 티트리 시카 트러블 클렌징폼 요거는 남편용... ,I am :Dewing,https://blog.naver.com/jaiwonlove,20210717
정원e샵<b>쇼핑</b>. 출석체크 종료와 삼성카드 링크40%혜택.... ,https://blog.naver.com/krishnaa?Redirect=Log&logNo=222435807228,모든 상품이 40%할인이 되는 것은 아니기때문에 적용상품보기를 통해 <b>쇼핑</b>하면 된다. 내친김에 그동안 모아뒀던 적립금과 비타민도 모두 소진하기로 했다. 비타민은 오전 9시에 100명 한정으로 적립금으로... ,작은살림 by 바람,https://blog.naver.com/krishnaa,20210718
수원 애경백화점 롯데몰 <b>쇼핑</b>. 스시 맛집 도조,https://blog.naver.com/carajia?Redirect=Log&logNo=222418746230,"이런날은 <b>쇼핑</b>몰 안에서만 다니는게 최고져 ㅎㅎ 한달에 한번꼴로 여사님과 데이트하는데, 오랜만에 <b>쇼핑</b>하러 애경백화점 나왔어용 여사님께서 옷 사신다고 하셔서 옷 고르는거 도와주구. 엄마는 요조숙녀... ",플레이모어 PLAYMORE,https://blog.naver.com/carajia,20210703
수협<b>쇼핑</b> 클릭하면 해녀가 잡은 신선한 수산물 맛볼 수 있어요!,https://blog.naver.com/suhyup_nf?Redirect=Log&logNo=222437190964,수협<b>쇼핑</b>에서 여름을 맞아 특별한 기획전을 준비했습니다! 거제 해녀 기획전(~7/25) 7월 25일까지... 수협<b>쇼핑</b>은 해녀 나잠어업으로 상품을 공급하고 있는 '숨비영어조합법인'과 협업을 통해 매일 해녀들이... ,우리바다 푸른 이야기,https://blog.naver.com/suhyup_nf,20210719
함께 즐겨요~ 하인즈 네이버 <b>쇼핑</b> 라이브도 기대해 주세요.,https://blog.naver.com/dhdmsdo79?Redirect=Log&logNo=222429365564,이 모든 구성을 하인즈 네이버 <b>쇼핑</b> 라이브에서 만나보실 수 있답니다. - 하인즈 라이브 <b>쇼핑</b> 라이브 - 2021 년 7 월 16일 금요일 오후 4시 live 구성 1 : 토마토케첩 460g + 갈릭 마요 296ml + 버거 소스 230g + 전용 캔디... ,제시의 달빛부엌,https://blog.naver.com/dhdmsdo79,20210715
2021 서울 커피엑스포 부스 참가 취소 안내 / 네이버 <b>쇼핑</b>라이... ,https://blog.naver.com/harioseoul?Redirect=Log&logNo=222430253388,"네이버 <b>쇼핑</b>라이브 X 하리오코리아 - 여름, 콜드브루 이벤트!  그렇지만, 하리오코리아는 여기서 멈추지 않습니다! 오프라인 전시가 어렵다면, 온라인으로 여러분을 만날 준비를 하고 있습니다! 네이버 <b>쇼핑</b>라이... ",하리오코리아 공식블로그,https://blog.naver.com/harioseoul,20210713
파르나스몰 맛집 허머스 키친 케밥 먹고 소소 <b>쇼핑</b>,https://blog.naver.com/bahna2?Redirect=Log&logNo=222430144624,파르나스몰 맛집 허머스키친 + <b>쇼핑</b> 일주일 전만 하더라도 외출에 제약이 없었는데 지금은 나홀로... 먹고 <b>쇼핑</b>도했던 시간들이 또 문득 생각나서 끄집어 냈습니다! 삼성동 파르나스몰은 밥 먹고 <b>쇼핑</b>하기 넘... ,Travel portfolio,https://blog.naver.com/bahna2,20210713
"미국 하와이 코로나 일상 : <b>쇼핑</b>, 장바구니, 와이키키 호캉스... ",https://blog.naver.com/goforsweet?Redirect=Log&logNo=222434538043,"미국 하와이 코로나 일상 : <b>쇼핑</b>, 장바구니, 와이키키 호캉스, 외식 메뉴 등 #일상 #하와이일상 #미국일상 #하와이코로나 #코로나일상 #하와이생활 #미국생활 #미국<b>쇼핑</b> #장바구니 #와이키키 #호캉스... ",Aloha life in Hawaii,https://blog.naver.com/goforsweet,20210717
우리 가족선물은 최저가 삼성카드 <b>쇼핑</b>에서 챙기자,https://blog.naver.com/haejukdl?Redirect=Log&logNo=222342781909,"삼성카드를 사용하신 분들은 알겠지만, 삼성카드 <b>쇼핑</b>에서는 할인율이 상당히 높은 국내 최저가로... 회원이 아닌 분들도 <b>쇼핑</b>몰에 들어갈 수는 있지만, 가격 노출이 되지는 않는다. 오직 회원들을 위한 특가... ",불락지피~ 즐길 수 없으면 피하라,https://blog.naver.com/haejukdl,20210520
현재 진행 중! <b>쇼핑</b> 축제 두바이 서머 서프라이즈,https://blog.naver.com/dubaitourism?Redirect=Log&logNo=222436631605,"현재 도시 전역에서 진행 중인 <b>쇼핑</b> 축제가 있는데요, 바로 두바이 서머 서프라이즈(DSS)입니다~ 다소... 2021 #두바이 #두바이여행 #해외여행 #떠나고싶다 #여행은<b>쇼핑</b>이지 #<b>쇼핑</b>축제 #두바이서머서프라이즈... ",두바이관광청 블로그,https://blog.naver.com/dubaitourism,20210719
여름방학 간식 미니멜츠 구슬아이스크림 카카오<b>쇼핑</b> 톡딜,https://blog.naver.com/dodoskaao77?Redirect=Log&logNo=222434356643,"우연히 카카오톡 <b>쇼핑</b> 구경하다가 톡딜이라는게 있드라구요. 가격도 저렴한데 구슬아이스크림이라뉘 ㅋㅋ 구슬아이스크림 편의점가면 1개에 2,500원정도 하는데 너무 비싸서 자주 사주기 좀 부담스러운... ",봉자의 감성패브릭,https://blog.naver.com/dodoskaao77,20210720
여수수산시장 먹거리 건어물 <b>쇼핑</b>,https://blog.naver.com/fromrei8?Redirect=Log&logNo=222421814280,"여수 먹거리 수산시장 건어물 <b>쇼핑</b> 남편 두고 혼자 여행 왔는데, 맨손으로 집에 돌아가기 손이... 마침 시장 구경 좋아하고, <b>쇼핑</b>도 좋아하니 딱이다. 택시 기사님이 알려주신 곳에 가서 여수 먹거리 좀 수급해야... ",프롬레이의 여행잡화점,https://blog.naver.com/fromrei8,20210706
Tanger Outlets <b>쇼핑</b>,https://blog.naver.com/estheryoo5?Redirect=Log&logNo=222418413219,Outlets에 <b>쇼핑</b>을 갑니다. 오는 길 내내 폭우가 쏟아졌지만 아웃렛몰에 도착하니 부슬비로 바뀌었어요. 평일인데도 꽤 많은 사람들이 <b>쇼핑</b>을 왔는데 오늘부터 Independence Day 세일이... ,"에스더의 요리세상, 뉴욕생활 그리고 여행",https://blog.naver.com/estheryoo5,20210703
[한샘 X홈앤<b>쇼핑</b>] 어반바스 론칭 특집 기획전,https://blog.naver.com/hanssem70?Redirect=Log&logNo=222423115129,[한샘 X홈앤<b>쇼핑</b>] 어반바스 론칭 특집 기획전 안녕하세요☺ 여러분~~ 꿉꿉하고 더위가 기승을... 바꿔야 할 때~ 꿉꿉하고 지저분한 욕실에서 해방되고 싶은 분들을 위해 홈앤<b>쇼핑</b>에서 호텔식 스타일의... ,"집꾸밈에 대한 모든 것, 한샘닷컴에서 만나보세요",https://blog.naver.com/hanssem70,20210707
Rouje Archives <b>쇼핑</b> 리스트,https://blog.naver.com/soyyzz?Redirect=Log&logNo=222429193423,"From, 블로그씨 블로그씨는 요즘 <b>쇼핑</b>하는 재미로 살고 있답니다. 새로 산 나의 <b>쇼핑</b> 리스트들을 사진과 함께 보여주세요! —————— 이래저래 바빠도 <b>쇼핑</b>할 시간은 있지...~ 2~3년 전부터 완전... ",soy blog,https://blog.naver.com/soyyzz,20210712
파리<b>쇼핑</b> 갤러리 라파예트 이벤트로 파리여행 추억하기,https://blog.naver.com/nau2001?Redirect=Log&logNo=222428471705,"파리<b>쇼핑</b> 갤러리 라파예트 이벤트로 파리여행 추억하기 글, 사진 / 와그잡 안녕하세요:) 여행블로거... 파리<b>쇼핑</b> 갤러리 라파예트 오스만점 보통 파리 하면 아름다운 도시를 먼저 생각하지만 파리여행을... ",와그잡의 트래블홀릭,https://blog.naver.com/nau2001,20210712
식물<b>쇼핑</b> :  귀여운 자엽아카시아 구입 아이비는 서비스 득템,https://blog.naver.com/ellecoco?Redirect=Log&logNo=222434662689,암튼 우리집에 온 예쁜 아이들... 잘 해보자....^^ #식물인테리어 #플랜테리어 #식물<b>쇼핑</b> #식물구입 #자엽아카시아키우기 #자염아카시아물주는시기 #식물키우기 #반려식물 #식물 #미니정원,엘르코의 솔찍발찍 사는이야기,https://blog.naver.com/ellecoco,20210717
MLB키즈 반팔세트 주니어 골프룩 여름휴가 패션 네이버 <b>쇼핑</b>라... ,https://blog.naver.com/sasa9508?Redirect=Log&logNo=222427586248,7월 12일 단 하루 네이버 <b>쇼핑</b>라이브 할인도 하는데 자세한 내용은 아래 쓸게요~ 썬바이저까지 함께... 아직 아이들 여름옷 준비하지 못한 분들 이번 <b>쇼핑</b>라이브 놓치지 마세요 ㅋㅋ 정말 마지막 기회!... ,마르잔의 뷰티패션박스,https://blog.naver.com/sasa9508,20210711
네이버 <b>쇼핑</b> 라이브 첫 도전 합니다!!,https://blog.naver.com/mate44?Redirect=Log&logNo=222430382953,개인 <b>쇼핑</b>몰을 거치고~ 스마트스토어를 거치고~ 몇년 전부터는 소매는 모두 정리되고 수입 도매 유통으로 사업을 확장시켜 나가다가~ 다시 소매 시장도 잡아보려 합니다^^ 요즘 핫 하다는 #네이버<b>쇼핑</b>라이브 첫... ,나는 최고의 일본무역상이다,https://blog.naver.com/mate44,20210713
영창 커즈와일 MP120A 6월 28일 네이버 라이브<b>쇼핑</b> 할인정보,https://blog.naver.com/mjda20?Redirect=Log&logNo=222408020685,"영창 커즈와일 모델 중 MP120A, MP11A 디지털 피아노를 네이버 라이브<b>쇼핑</b>을 통해서 6월 28일 단 하루만... 영창 커즈와일 MP120A 6월 28일 네이버 라이브 <b>쇼핑</b>을 통해서 초특가행사하는 아이에요. 평소에 이 모델... ",에나의 런치박스,https://blog.naver.com/mjda20,20210623
[카페뮤제오] 레트로 감성 페이마 전동 그라인더 <b>쇼핑</b> 라이브!,https://blog.naver.com/caffemuseo?Redirect=Log&logNo=222423584962,페이마 전동 그라인더 - 네이버 <b>쇼핑</b> LIVE ON 위이이잉~~! 내 취향에 맞는 원두를 선택하고 분쇄하는... 페이마 그라인더 초특가 <b>쇼핑</b> LIVE! 핸드드립 전용 그라인더로 명실상부한 페이마 전동 그라인더! 공식... ,카페뮤제오 블로그,https://blog.naver.com/caffemuseo,20210707
"주말일상, 파타고니아 쇼츠 팬츠 구입 <b>쇼핑</b>은 즐거웡~",https://blog.naver.com/lemon3761?Redirect=Log&logNo=222430993621,"후다닥 <b>쇼핑</b> 하고나왔다! 헬렌카민스키 모자사고싶엇는데,, 아니 나 모자 잘어울리는 편인데 그건 왜 때문에 안어울리는지 ㅠㅠ 강제로 돈아꼈다(??) 이날의 <b>쇼핑</b>은 모자3개 바지3개 남자바지 여자바지 남자꺼... ",MING BLOG,https://blog.naver.com/lemon3761,20210714
2021FW 까레<b>쇼핑</b>,https://blog.naver.com/ayamyam9?Redirect=Log&logNo=222430279251,프공홈 직구를 시작으로 2021FW 까레 <b>쇼핑</b>이 시작되었다. 패피도 아니면서 한계절 앞서나가는척 이번시즌에는 꼭 두 장! 단 둘! 두장을 사기로! 약속했다. 그리고 디자인공개됐을때도 음.. 그닥~ 느낌. 은... ,따뜻한 개똥이네,https://blog.naver.com/ayamyam9,20210713
