title,link,description,bloggername,bloggerlink,postdate
군대 간 아들과 그린비로 화상 <b>통화하기</b>,https://blog.naver.com/leeminae1101?Redirect=Log&logNo=222377112234,아들이 자대 배치를 받고 택배로 보낸 핸드폰으로 <b>통화하기</b> 전에는 그린비로 화상 통화를 할 수 있다. 그린비? 이건 또 뭔가~~ 아들이 자대 배치받은 후 아들 이름으로 문자 하나가 발송되었다. 스팸인 줄 알고... ,물 꼬 방,https://blog.naver.com/leeminae1101,20210601
구글 듀오(DUO)로 그룹 영상 <b>통화하기</b>,https://blog.naver.com/avix2004?Redirect=Log&logNo=221835561450,"그런데 전화로만 하자니 현장감이 떨어지고, 직접 만나서 얼굴보고 말하자니 나갈수가 없고, 그렇다면 대안은 그룹 영상 <b>통화</b>다. 그룹 영상<b>통화</b>가 가능한 앱이 여러개 있지만 믿고 보는 구글, 듀오( DUO )를... ",센서 기반 IOT 정보통신기기  개발 · 제조 - 아빅스,https://blog.naver.com/avix2004,20200303
카카오톡 그룹콜 여러명 <b>통화하기</b>,https://blog.naver.com/missleeyu2020?Redirect=Log&logNo=222185194188,여러명 <b>통화하기</b>에 대해서 알고 있으신가요?? 요즘은 워낙 자주 만날 수가 없다보니까 영상전화나 온라인회의에 대해서 관심이 많은데요!! 카톡같은 경우에는 아주 간편하게 여러명 통화가 가능하기 때문에... ,미쓰리 IT 공간,https://blog.naver.com/missleeyu2020,20201225
[변ㅂㅐ켠] 출장 간 남편이랑 영상<b>통화하기</b>,https://blog.naver.com/glue0413?Redirect=Log&logNo=221831467100,[변백현] 출장 간 남편이랑 영상<b>통화하기</b> ; 제(목이) 곧 내(용) w. 딱풀 오후 11시. 곧 전화가 올 때가... 출장 첫날부터 나에게 영상통화를 한 남편에게 전화비가 많이 든다고 잔소리했지만 남편은 아랑곳하지 않고... ,풀 향기가 풀풀풀,https://blog.naver.com/glue0413,20200301
캐나다 이민성과 <b>통화하기</b> 2021년 6월 버전,https://blog.naver.com/sumbodi?Redirect=Log&logNo=222414762296,"이전에 이민성과 <b>통화하기</b> 글을 올린 적이 있는데, 최근에 다시 전화해보니 무언가 상당히 바뀌었다 - 개 짜증나는쪽으로 바뀜 먼저 본인 UCI넘버와 파일넘버 바로 입력할 수 있게... ",Maple Country (Yenna's Ver.),https://blog.naver.com/sumbodi,20210630
microsoft 사용자 휴대폰 PC에서 <b>통화하기</b> PC에 전화 통화를... ,https://blog.naver.com/juicehwa?Redirect=Log&logNo=222337049196,휴대폰이랑 pc랑 연결하는 방법은 유투브에 많이 나와있으니 참고하시면 되겠습니다 본론으로 microsoft 사용자 휴대폰 PC에서 <b>통화하기</b> PC에 전화 통화를 방해하는 앱이 있습니다 폰과 pc는 연결되서 알림... ,♬ 달콤한 두 딸 이야기,https://blog.naver.com/juicehwa,20210504
[방탄/태형 빙의글] 출장 간 남친이랑 영상<b>통화하기</b>,https://blog.naver.com/twinstar0613?Redirect=Log&logNo=221776498952,"공감 50개 이상시 다음편 작성.(다음편:질투,만남.) -자기전에 <b>통화하기</b> &quot;여보세요?&quot; &quot;여본데요!&quot; &quot;ㅎㅎ뭐야~.출장은 재밌어?&quot; &quot;아니.너 없어서 별로야..&quot; &quot;너 왜 이렇게 바쁜거냐고!&quot; &quot;미안..그래도 꼬박꼬박 <b>통화하</b>... ",Je vous invite à mon propre espace romantique.,https://blog.naver.com/twinstar0613,20200118
터치무선이어폰)필스전자FEBQ1900으로 <b>통화하기</b>,https://blog.naver.com/nhsr4943?Redirect=Log&logNo=222437707105,자유롭게 <b>통화</b>를 하니까 예전보다 훨씬 편하고 음질도 더 좋긴 하더라구요!ㅋㅋ 오늘 포스팅은... 다른 무선 이어폰을 사용하다보면 배터리 잔량을 확인할 수 없어서 수시로 충전기에 꽂아놓고 <b>통화</b>중에도... ,희와함께,https://blog.naver.com/nhsr4943,20210719
[국제연애/커플] 영상<b>통화하기</b> 좋은 어플? 얼굴 어떻게 볼까?,https://blog.naver.com/dianeingod?Redirect=Log&logNo=222405825230,"여기서 <b>통화하기</b>를 클릭! 아이폰 유저라면 다음 화면은 밑에 그림이 떠요 마찬가지로 영상통화를 하고 싶다면 페이스톡 클릭! 그냥 음성통화를 하고 싶다면 보이스톡 클릭! 제가 사용해본 결과, 커플 모두가... ",Let’s Learn English,https://blog.naver.com/dianeingod,20210705
"[현장한담]한전, <b>통화하기</b> 특히 더 힘든 월요일, 호접란이... ",https://blog.naver.com/interfice?Redirect=Log&logNo=221977786368,"한전, <b>통화하기</b> 특히 더 힘든 월요일 20.5.25 드디어 호접란이 활짝 피었다 피기들 시작들 했다 올망졸망... 아까 통화는 되는줄 알았다 8분17초를 기다리고 있었는데(자동녹음중) 지가 알아서 끊어버린다. 무한... ","부동산 파주현장, 금촌역에이스부동산",https://blog.naver.com/interfice,20200525
외할머니를 만날 수 없다면? 편지 쓰기와 영상<b>통화하기</b>,https://blog.naver.com/penny1001?Redirect=Log&logNo=222007286859,전화 통화를 해 보세요 3. 편지를 써서 보내 보세요 4. 소중한 가르침을 아이에게 전해주기 https://cafe.... 영상 <b>통화하기</b> - 아이가 직접 영상 <b>통화하기</b> 이제는 익숙한 영통하기! 직접 카톡으로 들어가서... ,"연년생남매&아빠, 쿼터제이",https://blog.naver.com/penny1001,20200620
[직톡] 하루 1시간 원어민과 <b>통화하기</b>,https://blog.naver.com/lyj4763?Redirect=Log&logNo=222193220229,"20210101_100일의 도전 요즘 원서 읽기와 원어민과 하루에 한 시간 <b>통화하기</b>로 영어 공부에 푹... 언제든 통화할 수 있어요! 직톡앱들 다운받아 이름, 자기소개 등 간단하게 작성하고 나면 #직톡#언어교환플랫폼... ",다채로운 유니의 세상,https://blog.naver.com/lyj4763,20210102
아리스노보 오디오 인터페이스로 음성<b>통화하기</b>,https://blog.naver.com/joypad1004?Redirect=Log&logNo=222407526623,"안녕하세요~ 오늘은 저희 아리스노보 오디오 인터페이스를 통해 상대방과 전화<b>통화하</b>는... ※ 통화시, 이펙트 효과를 사용하지 마세요. 노이즈의 원인이 됩니다. 아리스노보 UMB-MIX4 오디오... ",아리스노보 공식블로그,https://blog.naver.com/joypad1004,20210623
전화영어 | 하루 30분 외국인과 <b>통화하기</b> 맨프화상영어 1주차... ,https://blog.naver.com/livewell_365?Redirect=Log&logNo=222398292783,"이영미 작가가 말한 절대로 배신하지 않는 세 가지: 독서, 운동 그리고 외국어. 그중에서도 내가 제일 좋아하고 제일 잘하고 싶은 건 외국어인데, 맨프화상영어에서 먼저 체험단 문의를 주셔서... ",livewell,https://blog.naver.com/livewell_365,20210614
[일상/꿀팁] T전화로 간단하게 그룹<b>통화하기</b> (보이스 톡이... ,https://blog.naver.com/wlsdml93?Redirect=Log&logNo=221990657378,"참고로 내 요금제는 SK끼리 통화 무제한, 집 전화 이동통신 간 전화 무제한이라서 한 번도 저 100분을 다 써본 적이 없다..ㅋㅋ그룹<b>통화하기</b> 딱 좋은 조건인 듯하다.",지니세상,https://blog.naver.com/wlsdml93,20200605
중간에 말씀 끊어서 죄송한데요. 지금 <b>통화하기</b> 어렵습니다.,https://blog.naver.com/ukario?Redirect=Log&logNo=222021638459,지금 <b>통화하기</b> 어렵습니다. 네이버 까페 [스페인어 민원실]에는 그곳 까페지기님이... 지금 회의 중이라서 <b>통화하기</b> 어렵습니다. 회의가 끝나는 대로 연락 드릴께요.... ,브라이튼의 블러그,https://blog.naver.com/ukario,20200705
가성비 블루투스이어폰 노이즈캔슬링 <b>통화하기</b> 편해요,https://blog.naver.com/tongpari3?Redirect=Log&logNo=222010348743,가성비 블루투스이어폰 노이즈캔슬링 <b>통화하기</b> 편해요 평소 남편은 일하는 도중 통화가 잦아요 바쁜 상황에 전화기 들고 통화를 장시간 하려니 꽤나 불편했던지 가성비 블루투스이어폰 하나 알아봐 달라고... ,완벽하게 사랑한 그대와 함께,https://blog.naver.com/tongpari3,20200624
착용했다면 전화기를 보청기 본체 가까이에 두고 <b>통화하기</b>,https://blog.naver.com/moon_0322?Redirect=Log&logNo=222263024206,"보청기를 착용하고, 전화<b>통화</b>를 잘 하는 방법을 소개합니다. 보청기 오픈형보청기를 사용하시는 분에게 전화를 걸어서 <b>통화</b>를 해보았습니다. 위의 사진처럼 외이도(귀구멍) 옆에 전화기를 두고 <b>통화</b>를... ",문스의 드림히어링,https://blog.naver.com/moon_0322,20210303
[방탄소년단 BTS 진] 석지니랑 영상<b>통화하기</b> (life goes... ,https://blog.naver.com/luvawake?Redirect=Log&logNo=222251569455,[방탄소년단 BTS 진] 석지니랑 영상<b>통화하기</b> 또로로 또로로 (석진이를 김석진이라고 저장할리 절대 X) 어느 날 세상이 멈췄어 (하는데 김석진 너무 귀여워서 내 심장이 멈췄어....) 넘 예뿐 햄스터가 짜잔... ,참치맛 오이 블로그,https://blog.naver.com/luvawake,20210221
캐나다 이민성과 <b>통화하기</b> - 엄청난 인내심을 요하는 작업,https://blog.naver.com/sumbodi?Redirect=Log&logNo=222214519175,이민성과 <b>통화하기</b> 1. 이민성 콜센터 번호: 1-888-242-2100 자동응답으로 나오는 음성... 디테일 듣고 직원과 <b>통화하기</b> 위해 *press 0* 질문의 종류 What is my Visa Office? Is Eligibility... ,Maple Country (Yenna's Ver.),https://blog.naver.com/sumbodi,20210121
[방탄/태형 빙의글] 출장 간 남친과 영상<b>통화하기</b>(외전-1),https://blog.naver.com/twinstar0613?Redirect=Log&logNo=221784391496,"출장 간 남친과 <b>통화하기</b> w.잠자는 숲속의 alice 사진 저장은 공감후 가능합니다. 공감 50개 이상시 담편 작성.(다음편:데이트, 집에서 보내는 하루.) &gt;&lt; 참여해주세요. -질투 &quot;여보세요!태야.&quot; &quot;여치나! 오늘 뭐했어?... ",Je vous invite à mon propre espace romantique.,https://blog.naver.com/twinstar0613,20200125
사람이 많은 장소에서 <b>통화하기</b>가 너무나 힘들어요!,https://blog.naver.com/vkdnjvj?Redirect=Log&logNo=222158935254,지하철과 같은 대중교통 이용중에 에어팟으로 <b>통화</b>를 하게 되면 주위 소리를 잘 들려줘 정작 목소리는... 저는 이어팟을 정말 잘 사용해 단자 불량이 날 때까지 쓰고 새로 한 개를 더 구매해서 지금도 <b>통화</b>용... ,윤댕's various world,https://blog.naver.com/vkdnjvj,20201130
에이아이웍스&gt; : 꿀미션 '대본 읽고 상담사와 <b>통화하기</b>' 추천!!,https://blog.naver.com/phk2621?Redirect=Log&logNo=222195607132,상담사와 <b>통화하기</b>' 입니다!! 보시다시피 페이가 꽤 괜찮습니닷!! 2015.01.15 24:00까지 진행되는... 대본대로 통화를 진행하면 됩니다~^^ 녹취는 상담사쪽에서 하니까 신경쓸 필요 없어용ㅎ 제일 중요한거!!... ,집요정 박도비,https://blog.naver.com/phk2621,20210104
210710(토)(생후589일) 할머니랑 <b>통화하기</b>,https://blog.naver.com/maro78?Redirect=Log&logNo=222432202618,오늘은 할머니랑 <b>통화</b>를 하는데 동하가 &quot;여보세요&quot;랑 비슷한 발음을 하면서 마치 대답을 하는 듯한 목소리를 내내요. ㅎㅎㅎ 오후에는 배다리 도서관에 책을 반납하러 왔습니다. 1층 아동도서실에서 밖을 보니... ,곰도리 story,https://blog.naver.com/maro78,20210715
[SKT/LGU+ (KT제외)] 다자간 그룹 <b>통화하기</b> 기능 사용해보세요... ,https://blog.naver.com/totalcmd?Redirect=Log&logNo=222185929174,옵션 중 &quot;다자간 <b>통화하기</b>&quot; 버튼틀 눌러주세요. 오른쪽의 사람 모양 버튼을 눌러서 그룹 통화를 할 연락처를 선택해주면 됩니다. 핸드폰 내 연락처 항목 중에서 선택을 해주세요~ 총 9명까지 그룹 통화를 할 수... ,파이어 울프의 IT 리뷰,https://blog.naver.com/totalcmd,20201226
한중커플500일~중국 거래처랑 <b>통화하기</b>~중국인들과의 비즈니스~,https://blog.naver.com/parknayon?Redirect=Log&logNo=222208064745,"너무 홀라당 가버린 1월3쨋주 이번주에 가장 큰 화두는 중국인 거래처와 <b>통화하기</b> 정말 큰 회사랑 거래하는데도 영어가 서툴러서 놀랐다 카탈로그를 중국어로 몰라서 파파고 찬스 사용,,,, 진짜 더... ","하늘을나는 나연,Fly high_Tiffany",https://blog.naver.com/parknayon,20210115
아이폰12에서 갤럭시 버즈 라이브로 <b>통화하기</b> (통화연결),https://blog.naver.com/snowberry1226?Redirect=Log&logNo=222142452274,버즈라이브를 연결한 상태에서도 통화가 가능합니다. 아이폰에서 버즈 라이브로 <b>통화하기</b> 버즈라이브를 사용하던 중 전화가 와서 받으면 위에서 보는 화면에서 처럼 응답을 누르고 통화를 하게 됩니다. 하지만... ,심심한블로그,https://blog.naver.com/snowberry1226,20201112
[미국 생활] <b>통화하기</b> 어려운 EDD 전화 연결 대행업체까지,https://blog.naver.com/pax2102?Redirect=Log&logNo=222382032788,[미국 생활] <b>통화하기</b> 어려운 EDD 전화 연결 대행업체까지 실업수당 신청을 위한 캘리포니아... 사람들이 통화당 적게는 20달러 많게는 80달러를 지불하고 있다고 전했다. 이 서비스는 자동으로 계속... ,런런대디의 얼바인 스토리,https://blog.naver.com/pax2102,20210603
가족과 <b>통화하기</b>,https://blog.naver.com/gajang6777?Redirect=Log&logNo=222276103507,그래서 다소나마 위로를 드리는 차원에서 주기적으로 '가족과 <b>통화하기</b>' 프로그램을 운영하고 있습니다. 어서 빨리 코로나 19가 종식되기를 기원하며 다시 편하게 만나는 날까지 서로 건강을 유지하기를... ,굿데이케어센터입니다.,https://blog.naver.com/gajang6777,20210315
"음악듣기, 무선이어폰으로 <b>통화하기</b>,이어클리너, 커널형이어폰",https://blog.naver.com/commung82?Redirect=Log&logNo=221685573780,첨에는 음량의 초기설정이 크게 설정되어있어서 멋모르고 음악 틀었다가 깜놀.이어폰으로 엄마랑 <b>통화</b>해봤는데 제목소리가 잘 들린다고 하더라구요.여러모로 굿입니다요~^^전원끄고 케이스에 넣으니... ,맛잼 블로그,https://blog.naver.com/commung82,20191022
어버이날!작은 효도(밝은 목소리로 전화<b>통화하기</b>),https://blog.naver.com/skylake1004-?Redirect=Log&logNo=222342842525,#어버이날_작은효도밝은목소리로전화<b>통화하기</b> #5월8일째일상일기 오늘 하루만큼은 일찍이 울아빠와 울엄마께 안부인사 전하는 작은 효도로 ☎전화통화를 하였습니다. 최대한 밝은 목소리로 통화버튼을 꾹... ,하늘호수의 세상이야기~,https://blog.naver.com/skylake1004-,20210508
지민] 지민이랑 3분39초동안 눈맞추고 영상<b>통화하기</b>!!!,https://blog.naver.com/hiderella?Redirect=Log&logNo=222250466082,영상<b>통화하기</b>!! 2탄 (움짤&amp;고화질 모음)  &amp; #방탄소년단 #방탄소년단지민 #JIMIN #방탄지민 #지민 #지민이 #우리지민 #BTS #지민전화 #방탄지민영상통화 #방탄지민핸드폰 #LifeGoesOn #방탄영상통화 #지민영상통화... ,하냥이의 최애앓이 라이프,https://blog.naver.com/hiderella,20210220
쇼핑하기! 와인마시고 중국친구와 2시간넘게 <b>통화하기</b>,https://blog.naver.com/yexxl?Redirect=Log&logNo=221816029956,"와인마시고 중국친구와 2시간넘게 <b>통화하기</b> 아침 날씨는 또 얼마나 좋게요! 제가 요즘에 매일 이런... 중국친구랑 <b>통화하</b>면서 혼자서 끄적끄적, 원래 <b>통화하</b>면서 막 아무 종이에다가 의식의 흐름대로 적는... ",예슐리?예슐리!,https://blog.naver.com/yexxl,20200220
솔로 앨범 음악방송 활동 비하인드_애인이랑 방송용 <b>통화하기</b>.,https://blog.naver.com/yuki486dud?Redirect=Log&logNo=222055918774,&lt;막방기념 멤버들과 <b>통화하기</b>&gt; 켄 : 라비한테 전화하고 있습니다.. 라비 : 여보세요? 켄 : 어 라비야! 라비... 근데 이 영상 킬링파트는 부끄러워 하는 이재환 ㅋㅋㅋㅋㅋㅋㅋㅋㅋㅋㅋㅋㅋㅋㅋㅋ 아니 전화<b>통화하</b>고... ,*Bin-Dung ♪,https://blog.naver.com/yuki486dud,20200809
[중국어 회화]  020 - 그랑 <b>통화하기</b> 정말 어렵네요... ,https://blog.naver.com/hobby-explorer?Redirect=Log&logNo=222429779342,"저는 왕밍입니다, 그랑 <b>통화하기</b> 정말 어렵네요. 请 给我 留言。 저에게 메모 남겨주세요. 给您... 找 A A를 바꿔주세요 A를 찾다 不用 ~할 필요가 없다 첨부파일 020-그랑 <b>통화하기</b> 정말 어렵네요.mp3 파일... ",나의 사랑하는 생활,https://blog.naver.com/hobby-explorer,20210713
친구에게 한국어 가르쳐주기 / 타이완 친구와 1시간 <b>통화하기</b>,https://blog.naver.com/hlrespect?Redirect=Log&logNo=221716058431,"가량 <b>통화</b>를 하게 됐다. 결론은... 真厲害！！！ 뭐랄까, 동아시아 국가 중에 우리나라랑 가장 정서가 비슷하게 느껴지는 국가가 타이완인 것 같다. 1시간 <b>통화</b>한 것도 서로 통하지 않으면 그럴 수 없다.... ",Give a Reason for Life,https://blog.naver.com/hlrespect,20191123
TV에서 스카이프 <b>통화하기</b> - 사전준비,https://mushman.co.kr/2691399?category=394056,이번에는 스카이프 영상통화를 즐길 수 있는 화상카메라를 연결하는 작업입니다. TV에서 스카이프를... 스카이프 <b>통화하기</b> - 영상<b>통화하기</b> (0) 2010.07.02 TV에서 스카이프 <b>통화하기</b> - 음성<b>통화하기</b> (0) 2010.07.01... ,버섯돌이의 인사이드 소셜웹,https://mushman.co.kr/,20100630
갤럭시노트9 활용 LG U+ 다자간 <b>통화하기</b> 그룹통화 단체통화... ,https://blog.naver.com/kmec9700?Redirect=Log&logNo=221362020499,갤럭시노트9 활용 LG U+ 다자간 <b>통화하기</b> 그룹통화 단체<b>통화 하</b>는 법 코치로 활동하면서 중요하게 필요한 것 그것은 바로 그룹통화 기능입니다. 그런데 SK텔레콤을 사용하는 분들은 잘 사용하고 있으나 LG U+를... ,부자 만드는 코칭연구소,https://blog.naver.com/kmec9700,20180919
KT 인터넷전화로 얼굴보며 <b>통화하기</b>,https://blog.daum.net/dlrlfl0980/8495675,"KT 인터넷전화로 얼굴보며 <b>통화하기</b> 댓글 0 리뷰 2008. 11. 8. SOIP , kt , 영상통화 , 인터넷전화 KT 인터넷전화로 얼굴보며 <b>통화하기</b>! 인터넷전화의 최대 강점! 집에서 저렴한 가격으로 영상통화를 할 수 있다는... ",뉴에이디_전국 종합광고 회사,https://blog.daum.net/dlrlfl0980,20081108
"YP-GB1,스카이프로 <b>통화하기</b>/갤럭시플레이어 어플 추천",https://blog.naver.com/mistyluv78?Redirect=Log&logNo=130102743882,"[갤럭시플레이어 YP-GB1,스카이프로 <b>통화하기</b>] 갤럭시플레이어 YP-GB1,스카이프로 <b>통화하기</b>.... 그렇지 않을 경우 스카이프 앱에서 앱으로의 무료 통화 혹은 채팅만 가능합니다. 국내전화가 가능한 유무선300을... ","얼리어답터, 그 뽐뿌의 시작",https://blog.naver.com/mistyluv78,20110212
[수다폰] 안드로이드 추천어플 옵티머스마하로 무료<b>통화하기</b>,https://blog.naver.com/dicagallery?Redirect=Log&logNo=140129777539,"와이파이를 이용한 무료통화가 가능했으며 통화 음질은 <b>통화하기</b>에 나쁜 편은 아닙니다. 푸쉬 알림, 노티를 통해 상대방이 수다폰을 실행하지 않은 상태에서도 전화를 받는 것이 가능했습니다. 음성사서함... ",함영민의 디카갤러리,https://blog.naver.com/dicagallery,20110515
외국에서 한국 델타항공 사무소 전화번호로 <b>통화하기</b>,https://blog.naver.com/collectjin?Redirect=Log&logNo=220292618223,외국에서 한국 델타항공 사무소 전화번호로 <b>통화하기</b> 수신자 부담 전화번호는 한국에 거주하는 한국인에겐 참 좋은 제도이지만 외국에서는 저런 007번호로 시작하면 전화를 걸 수가 없습니다. 참고로 02... ,프로스트의 익사이팅스팟 시즌4,https://blog.naver.com/collectjin,20150307
3분39초동안 눈맞추고 영상<b>통화하기</b>!! 2탄 (움짤&amp;고화질 모음),https://blog.naver.com/hiderella?Redirect=Log&logNo=222250757677,방탄소년단 지민이랑 영상<b>통화하기</b> 2탄이예요 지민이한테 전화왔어요~~~ 게다가 영상통화가 왔어요~ 다정한 울 지민이한테요 조금만 기다려~ 기다려~  빙글빙글 지민이 손가락 싱그럽게 웃으면서도 뒤로... ,하냥이의 최애앓이 라이프,https://blog.naver.com/hiderella,20210221
비즈니스 영어: 전화 <b>통화하기</b>,https://blog.naver.com/seuryo?Redirect=Log&logNo=100204773290,"슬예의 쓸모있는 외국어 : Your New Language Learning Partner : 비즈니스 영어: 전화 <b>통화하기</b>... (상대 이름)과 통화할 수 있을까요?) A - Give me one second, please. Let me transfer the call for you.... ",슬예의 쓸모 있는 외국어,https://blog.naver.com/seuryo,20140202
"화장품마사지하기,전화<b>통화하기</b>",https://blog.naver.com/eunsol1119?Redirect=Log&logNo=220473977104,"화장품마사지하기,전화<b>통화하기</b> +654 2015.9.4.금요일 우리딸이 좋아하는 놀이?중 하나가 뭔지아세요?... ㅋㅋㅋ 가슴팍엔 물티슈 입구에 붙어있는거 붙혀놓고 ㅋ 이모랑 전화<b>통화하</b>고 있어요. 애기때부터 ㅋㅋ... ",★똑순이 쇼리맘의 행복한공간★,https://blog.naver.com/eunsol1119,20150907
무전기 어플 TiKL 설치하고 공짜 <b>통화하기</b>,https://blog.naver.com/kounbal7?Redirect=Log&logNo=130115067725,서로 <b>통화하기</b> ＊아래 왼쪽①번 그림을 손까락으로 누르고 말을하면 무선을 받는②번 그림은 딩동딩동 신호음이 울리며 상대방의 목소리를 들을 수 있습니다. ＊아래 오른쪽②번 그림 역시 통화를 할때는... ,야기의 이야기 소리,https://blog.naver.com/kounbal7,20110806
아무나 쉽게 볼 수 없는 바로 그 영상! 파니와 영상<b>통화하기</b>!,https://www.teamtiffany.net/125,파니와의 통화죠....ㅠ_ㅠ 그것도 오늘은 바로 영상통화! 네. 별로 나온적은 없지만 영상통화 모음편... 파니와 영상<b>통화하기</b>! (2) 2009.10.25 노래하는 티파니의 아름다운 손 with MIC (6) 2009.10.11 [091010] 소워언~Put... ,팀티파니닷넷,https://www.teamtiffany.net/,20091025
영어 제 51회 (5월 9일 월요일 ) - 아빠와 <b>통화하기</b>(가정),https://blog.naver.com/yes780715?Redirect=Log&logNo=220704752422,2016년 5월 9일 월요일 EBS 왕초보영어 51회 - 아빠와 <b>통화하기</b> (가정) 안녕하세요~ 어린이날 부터 긴 연휴를 보내고 월요일이 시작 되었네여^^ 다시 힘찬 시작을 해볼까요? 오늘의... ,"""복많은 여자""",https://blog.naver.com/yes780715,20160509
해외에서 국내전화로 <b>통화하기</b>,https://blog.naver.com/freetourman?Redirect=Log&logNo=80166501459,"해외에서 국내로 <b>통화하기</b> 입니다. 보통은 카톡을 하면 되지만, 은행이나 공공기관 또는 아고다나 익스페디아 에 전화를 할 경우 일반전화가 필요합니다. 070휴대전화는 음질이 좋지않아 통화는 할 수 있지만... ","꽃보다 감자의 마닐라 게스트하우스, 하니 하숙",https://blog.naver.com/freetourman,20120812
TV에서 스카이프 <b>통화하기</b> - 음성<b>통화하기</b>,https://mushman.co.kr/2691400?category=394056,좋아요 4 댓글달기 0 728x90 지난 글에서 TV에서 스카이프 통화를 하기 위한 사전 준비사항 에 대해서... [관련글] TV에서 스카이프 <b>통화하기</b> - 사전준비 스카이프 새 정액요금 선보여.. 국제전화 더 싸게 건다... ,버섯돌이의 인사이드 소셜웹,https://mushman.co.kr/,20100701
[리뷰] 본격_자이언티와_<b>통화하기</b>_리뷰,https://blog.naver.com/kirsty1214?Redirect=Log&logNo=220451055552,"본격_자이언티와_<b>통화하기</b>!! 일단, 번호를 저장합니다. &quot;언티오빠&quot; 라고 저장한다. 떨리는 손으로 통화 버튼을 누릅니다. 저는 꺼져 있을 줄 알았거든여? 근데 아니었어.. (부들부들) &quot;....여보세요? ... 여보세요?... ",24/7 ALWAYS,https://blog.naver.com/kirsty1214,20150814
공유 갤러리 웰페이퍼에 <b>통화하기</b> 까지 :) BC카드와 함께 ♡,https://blog.naver.com/zaawoo?Redirect=Log&logNo=220985619856,공유 <b>통화하기</b>~~ 공유 홀릭인 분들 많으신데요. 꼭 한번 통화해보시고 봄 설레임에 폭 빠져보세요~~ BC카드와 함께 빨간날 데이트도 하고 할인혜택도 누리면~! 절약도 되고 데이트도 할 수 있으니 이보다 좋을... ,"자애, 행복하기에도 모자란 날들",https://blog.naver.com/zaawoo,20170417
