title,link,description,bloggername,bloggerlink,postdate
교환학생]+105 데식이덜 컴백했다! 오랜만에 친구들과 <b>통화하기</b>,https://blog.naver.com/thwjd98bb?Redirect=Log&logNo=221959881212,맨날 친구한테 쩜이 보고 싶다고 찡찡댔는데 친구가 오늘 영상<b>통화</b>로 보여줬다. 내가 진짜 왕 좋아하는 강아지인데 나도 내 강아지 자랑해주면서 서로 강아지가 더 귀엽다고 난리난리. 쩜이 보고싶다. 쩜이... ,쏠챙이의 우물밖 이야기,https://blog.naver.com/thwjd98bb,20200513
외국인 친구와 보이스톡으로 <b>통화하기</b>-Day5 &lt;Free... ,https://blog.naver.com/firststep22?Redirect=Log&logNo=221467644253,"자, 지금부터는 다시 본론으로 돌아와서 통화 후기를 남겨 볼게요~ 오늘도 역시... 보이스톡으로 <b>통화하기</b>-Day5&gt; 포스팅을 마치겠습니다. 이 리뷰가 도움이... ",채니의 소소한 일상,https://blog.naver.com/firststep22,20190217
어이 없네. 휴대폰도 없나? 상황실에 휴대폰 한 <b>통화하기</b>가 힘드나?,https://blog.naver.com/jedgar?Redirect=Log&logNo=221174187468,무전기 문제라니...어이 없네. 휴대폰도 없나? 상황실에 휴대폰 한 <b>통화하기</b>가 힘드나? 위키트리 연합뉴스│2017-12-29 15:27:36 “2층 빨리빨리 다죽어” 절박한 요청... 구조대는 지하 수색,심심산천(深深山川),https://blog.naver.com/jedgar,20171230
바이토 / 일식먹고 한식먹기 / 또 인출 / 일본인이랑 <b>통화하기</b>,https://blog.naver.com/chaeun_lee?Redirect=Log&logNo=222169764802,201209(水) +283 냠냠 휴게 + 신메뉴 마시깅 이 날은 끝나고 ㅌㅋㅌ상이랑 밥먹기로 한날 ! 아무곳이나 들어갔는데 가격이 조금 쎄서ㅠ 오차즈케랑 사와한잔씩만 마시고 나왔다 그리고 신옵으로... ,チェウンのブログ,https://blog.naver.com/chaeun_lee,20201210
계약 연애 스타트 / 눈물의 고백…&quot;엄마와 1분 <b>통화하기</b>가 소원,https://blog.naver.com/cwmylee?Redirect=Log&logNo=221836164538,"엄마와 1분 <b>통화하기</b>가 소원 이라는 말 듣고 나도 눈물이 주르륵 ㅠㅠ 안혜경 좋은남자 만나서... 안혜경♥구본승, 3개월 계약 커플 “내 사랑이라 저장” 출처 #불타는청춘 #안혜경 #엄마와1분<b>통화하기</b>가소원",RIA's 링링's,https://blog.naver.com/cwmylee,20200304
외국인 친구와 보이스톡으로 <b>통화하기</b>-Day7 &lt;My first... ,https://blog.naver.com/firststep22?Redirect=Log&logNo=221473200275,벌써 통화를 7일 연속으로 했네요! 그렇지만 화요일부터 금요일까지는 못했어요.... 이상으로 &lt;외국인 친구와 보이스톡으로 <b>통화하기</b>-Day7&gt; 포스팅을 마치겠습니다. 이... ,채니의 소소한 일상,https://blog.naver.com/firststep22,20190223
네이트온 무료<b>통화하기</b>.,https://blog.naver.com/hplove32?Redirect=Log&logNo=120188065465,무료<b>통화</b>를 하려면 당연히 네이트온을 사용해야겠지 ㅋㅋ 근데 메신저를 사용하는 사람치고 네이트온을 안써보거나 아이디가 없는 사람은 없을 듯. 우선 네이트온이 없다면 설치를 해주고 무료<b>통화</b>를 할 대상과... ,정우는캠핑중,https://blog.naver.com/hplove32,20130416
외국인 친구와 보이스톡으로 <b>통화하기</b>-Day4 &lt;Today's diary&gt;,https://blog.naver.com/firststep22?Redirect=Log&logNo=221466971106,"오늘의 단어 : prejudice (편견) 이상으로 &lt;외국인 친구와 보이스톡으로 <b>통화하기</b>-Day4&gt; 포스팅을 마치겠습니다. 이 리뷰가 도움이 되었다면, 공감 버튼(하트)을 꾹! 눌러주세요... ",채니의 소소한 일상,https://blog.naver.com/firststep22,20190216
영국국제전화번호 싸게 <b>통화하기</b>,https://blog.naver.com/digitalfront?Redirect=Log&logNo=120149406621,영국국제전화번호 쉽게 <b>통화하기</b> 영국에 장기간 머물러야 하는 일이 있어서 영국으로 떠날 준비를... 그래서 일단 두 가지 국제전화번호로 1분 동안 통화를 하고 나면 요금이 얼마가 되는지 알아보니까... ,my daily report,https://blog.naver.com/digitalfront,20120106
014. <b>통화하기</b>,https://blog.naver.com/tpspvnf12?Redirect=Log&logNo=220401875265,"<b>통화하기</b> -나, 괜찮아? 자기랑 결혼 할 사람으로. 새벽에, 느닷없이, 돌직구로 날아오던 그 말에 화닥 잠이 깨어버렸다. 꾸밀 줄 몰라서 애둘러 얼버무리지 않는 그 남자의 말 한마디는 그래서 더더욱 따갑게 와... ",A U Happy?,https://blog.naver.com/tpspvnf12,20150626
[도깨비]♥ 공유랑 영상<b>통화하기</b> ♥,https://blog.naver.com/happymoon315?Redirect=Log&logNo=220917733173,영상<b>통화하기</b> 다들 그 사진 한장정도는 있잖아요?ㅋㅋㅋㅋ 전혀 어렵지 않아요~ Pics Art 어플를 받아요... 있어요~ 공유사진에 제사진을 추가하면 끝! 공유랑 영상통화 저도 해봤어요 ㅋㅋㅋ 도깨비관련 포스팅,달토깽이랑 놀자♡,https://blog.naver.com/happymoon315,20170122
"와, 전화<b>통화하기</b> 참 어렵답니다.",https://blog.naver.com/hksong60?Redirect=Log&logNo=220769757333,"피로에 스트레스가 가장 안 좋다고 하네요^^ 우리 다 같이 재미있게 소통하면서 힘내 보아요~ 와, 전화<b>통화하기</b> 참 어렵답니다. 전화 잘 받는 노하우를 깨닫고 싶었죠. 제가 이야기를 잘 못하긴 합니다. 그래서... ",hksong60님의블로그,https://blog.naver.com/hksong60,20160723
오늘도 민용세상 _ 17일차 : 퇴근하면서 <b>통화하기</b>,https://blog.naver.com/llmy0202?Redirect=Log&logNo=221285557265,오늘도 민용세상 _ 17일차 : 퇴근하면서 <b>통화하기</b> 퇴근할 때 기분이 너무 좋아요 그리고 좋아하는 사람이랑 <b>통화하</b>면 더 좋아요 ꒰◍ˊ◡ˋ꒱੭ु⁾⁾♡ 새로운 붓을 써봤는데 배경으로 한 번 쓱 칠하기... ,똥그리의 좋은 날,https://blog.naver.com/llmy0202,20180527
"비대면 모임, 스마트폰 웹캠으로 단체영상<b>통화하기</b>ㅋㅋㅋ",https://blog.naver.com/lader80?Redirect=Log&logNo=222185104277,"ZOOM 설치 (화상<b>통화</b> 앱) 공식사이트다. 들어가면 '번역'이 안되있을수도 있다. 상관없다. 밑으로 그냥 쭉 내려라. '회의클라이언트'를 눌러서 받아주면 된다. 로그인해도 되고, 하기 싫으면 한명만 빼고... ",지퍼팩쿠키의 일기장,https://blog.naver.com/lader80,20201225
가족소통] 일일미션 1일차_ 가족과 영상<b>통화하기</b>,https://blog.naver.com/vitaminjung2?Redirect=Log&logNo=222140633013,영상<b>통화 하기</b>&quot; 같은 집에서 살면서도 영상통화를 시도해 보는 나... 색다른(?) 소통 이었슴다 ㅋㅋㅋㅋㅋㅋㅋㅋㅋㅋ 창원거리페스티벌이 매년 있었던 것 같은데 저는 올해 처음 알게 되었네용! 올해는... ,달려라밍또니,https://blog.naver.com/vitaminjung2,20201110
[뚱주] 포코팡 이종석과 <b>통화하기</b>♡♡전화번호 다이아몬드... ,https://blog.naver.com/cyvk0919?Redirect=Log&logNo=120201445059,안녕하세요 뚱주에요ㅎ.ㅎ♡♡♡ 짜잔~~~~~ 포코팡 오늘접속해 보니!!! 다이아 이벤트가~~~~ 저 지금 29개인데 번쩍ㅋㅋㅋㅋ 마지막 슬롯을 열기위해 45개 모으는중이였는데 엄청 흥분하며 이종석... ,명랑블로그 뚱주♥,https://blog.naver.com/cyvk0919,20131108
[KGB택배]대통령보다 <b>통화하기</b> 힘든 KGB택배..,https://blog.naver.com/amdis?Redirect=Log&logNo=20200014688,"[KGB택배]대통령보다 <b>통화하기</b> 힘든 KGB택배.. 세상 살다 살다 이런 택배회사는 처음봅니다.. 쇼핑몰 10년... 이거원 고객센타 전화기가 전국에 1개있나봐요,, 하루종일 통화중이며, 기사는 절대 절대 신호가 가도... ",일상의 잔재미,https://blog.naver.com/amdis,20131125
아이폰끼리 영상<b>통화하기</b>,https://blog.naver.com/choosunghee?Redirect=Log&logNo=80184676191,일도 어느정도 마무리 되고 일주일에 중간쯤 이라 그런지 나의 무기력함이 아주 정점을 찍을 때 나와 같은생각인 그녀와 영상<b>통화</b>! 게다가 오늘은 특별한 이벤트 왠만한 남자보다 이벤트 잘하는 여자예여 님이... ,잡육다식한 일상,https://blog.naver.com/choosunghee,20130313
아기랑 영상<b>통화하기</b> 영상통화어플 Tango,https://blog.naver.com/o_queen_o?Redirect=Log&logNo=220067656239,"아기랑 영상<b>통화하기</b> 영상통화어플 Tango 하루에 한번씩은 꼭 조카랑 영상통화를 해요~ 뭐하고있나 궁금하기도 하고, 조카가 놀이중의 하나로 영상<b>통화하</b>는거 좋아해요 ㅋ 거울도 잘보고 ㅋㅋ 울 마미도... ",+ 마리언니의 소소한 일상 +,https://blog.naver.com/o_queen_o,20140722
"와, <b>통화하기</b> 참 어렵습니다.",https://blog.naver.com/almondblackbox?Redirect=Log&logNo=221169766493,"와, <b>통화하기</b> 참 어렵습니다. 길을 찾기가 최근 너무 쉽습니다. 예전에는 물어물어, 먼저 찾아보거나 그렇게 하여야 하는데 요즘에는 휴대폰만 있으면은 앱 하나로 그냥~ 아주 쉽게 찾아가지고 요즘에는... ",아몬드블랙박스,https://blog.naver.com/almondblackbox,20171227
일반전화 착신전환해서 휴대폰으로 <b>통화하기</b>,https://blog.naver.com/jhm8270?Redirect=Log&logNo=222261739812,집전화 착신<b>통화</b>전환이란? 부재중에 걸려오는 전화를 다른 전화기로 착신전환해주는 서비스 오늘은... 집전화 착신전환이란 말그대로 오는전화를 다른 집전화나 휴대폰으로 연결해서 <b>통화</b>할수 있게 하는... ,올리부아줌마의 IT놀이터,https://blog.naver.com/jhm8270,20210302
"연결 방법, error 에러 10074 예매 오류, CGV 상담원 <b>통화하기</b>",https://blog.naver.com/hellooff?Redirect=Log&logNo=222017371512,<b>통화</b> 내용 나: 아시아나 마일리지로 2D 예매하려 하는데 10074 오류가 떠요 원인이 뭔가요? 상담원... ㅜㅠ 무지가 죄네 오전에 전화 <b>통화</b>를 했고 <b>통화</b> 후 오후에야 메일 답변이 왔고 이미 지친 나는 영화... ,For My Future (feat. 나만의 최소주의),https://blog.naver.com/hellooff,20200701
"애플 고객센터 전화번호, 맞춤 서비스로 <b>통화하기</b>!",https://blog.naver.com/nu5589?Redirect=Log&logNo=222267821805,번 <b>통화</b>를 하더라도 개운치 않은 느낌?? 이었거든요 아마 이 포스팅을 읽고 계신 분들도 080 - 3333 - 4000... <b>통화</b>를 시도하면 바로 연결되는 것도 아니고 많은 문의량으로 인해 기다리기도 해야 하며 연결이 된다고... ,중고차수출 전문업체 엔유무역,https://blog.naver.com/nu5589,20210308
외국인 친구와 보이스톡으로 <b>통화하기</b>-Day6&lt;National... ,https://blog.naver.com/firststep22?Redirect=Log&logNo=221469151804,의미전달이 잘되었는지 모르겠네여 ㅎㅎ 이건 통화 끝나고 친구가 고쳐준 내용이에요!... 이상으로 &lt;외국인 친구와 보이스톡으로 <b>통화하기</b>-Day6&gt; 포스팅을 마치겠습니다. 이 리뷰가... ,채니의 소소한 일상,https://blog.naver.com/firststep22,20190219
[27개월/846일]전화<b>통화하기</b>,https://blog.naver.com/artmaum?Redirect=Log&logNo=20141648563,일상대화는 어느정도 가능하나 전화통화중에는 알 수없는 외계어를 말하곤 했는데 할머니랑 전화<b>통화하</b>는데 대화가 가능해졌다. &quot;맘마 먹었어요~&quot; &quot;엄마 맘마먹어요~&quot; &quot;아가 코~자요&quot; 옆에서 듣기에 뭘... ,즐겨라 세상을~~~펼쳐라 꿈을!!!,https://blog.naver.com/artmaum,20111028
전화앱으로 <b>통화하기</b>,https://blog.naver.com/star-candy?Redirect=Log&logNo=222149065742,"- 키패드 : 전화 <b>통화</b> 시 숫자키를 활용하여 <b>통화</b>할 수 있다. - 최근기록 : 최근 <b>통화</b>, 문자(어플에 따라 없을 수도 있음) 내역을 확인할 수 있다. - 연락처 : 저장된 연락처를 확인할 수 있다. 전화연결 1.... ",별사탕,https://blog.naver.com/star-candy,20201119
"강남보청기 - 귀걸이형 사용 방법, 보청기 착용 시 전화 <b>통화하기</b>",https://blog.naver.com/minibal7?Redirect=Log&logNo=10151106836,그렇다면 보청기를 착용한 상태에서 전화 통화를 잘 하려면 보청기 모델에 따른 전화 <b>통화하기</b> 방법을 알아두시면 된답니다. 보청기 착용 시 전화 <b>통화하기</b> 자동 전화 모드 가능 모델 귀걸이형 보청기 자동 전화... ,소리샘보청기 강남센터 공식 블로그,https://blog.naver.com/minibal7,20121102
"와, <b>통화하기</b> 정말 어렵네요잉.",https://blog.naver.com/honggs88?Redirect=Log&logNo=220636011576,"하하^^ 와, <b>통화하기</b> 정말 어렵네요잉. 전화 잘 받는 방법을 알아버리고 싶었습니다. 내가 얘기를 잘 못 하네요^^ 그~래서 어떠한 이야기를 할까 걱정을 하다가 늦게 받곤 하는~데 그렇게 할 때마다 늦~게 받아... ",창원 감계덕산아내2차 분양정보,https://blog.naver.com/honggs88,20160317
정은이 열차에서 <b>통화하기</b>가 힘들고 도..,https://blog.naver.com/ttonggee2000?Redirect=Log&logNo=221480807560,"정은이 열차에서 <b>통화하기</b>가 힘들고 도청 당할까봐서... 평양가면 전화통화 해서 ..상황파악 할껄 '하노이 결렬' 나흘…靑, 아직도 상황파악 못했다 지난달 27~28일 베트남 하노이에서 열린 제2차... ",ttonggee2000님의블로그,https://blog.naver.com/ttonggee2000,20190305
외국인 친구와 보이스톡으로 <b>통화하기</b>-Day19,https://blog.naver.com/firststep22?Redirect=Log&logNo=221509365027,2019.04.08 오늘부터 보이스톡으로 <b>통화하</b>는 시간을 1시간으로 늘리기로 했어요~ 제가... 이상으로 &lt;외국인 친구와 보이스톡으로 <b>통화하기</b>-Day18&gt; 포스팅을 마치겠습니다. 이 리뷰가... ,채니의 소소한 일상,https://blog.naver.com/firststep22,20190409
12월집콕일상 / 스카이프영상<b>통화하기</b> / 레녹스 홀리데이... ,https://blog.naver.com/nj614?Redirect=Log&logNo=222171797521,12월 연말의 첫째주 주말이 가고있네요 ㅠㅠ요즘 아이들 가정보육 으로 하루가 어떻게 가는지 몰라요 ㅎㅎㅎ 와중에 연쟈 스카이프로 수업하는거 보고 아이디어 천재 ㅋㅋㅋㅋ 칭구한테 우리도 화상<b>통화 하</b>자구... ,ROMANCE,https://blog.naver.com/nj614,20201212
[197일]201008 인스타 영상<b>통화하기</b>,https://blog.naver.com/loeyb0?Redirect=Log&logNo=222110139923,"영상통화를 했다. 친구가 피규어 조립하는거,빨래너는거,일기쓰는거 다 구경하고 내 옷중에 버릴 옷 놔둘 옷 물어봐가면서 정리도하구 재밌었다. 다같이 구미호뎐 첫방 기다리면서 영상<b>통화하</b>다가 시작하자마자... ",loeyB의 평범한 나날들,https://blog.naver.com/loeyb0,20201008
#1/ 존댓말 <b>통화하기</b>,https://blog.naver.com/handwoven?Redirect=Log&logNo=140055748125,"좀 있다 자려구요' 언제부턴가 장난스럽게 누군가에 의해 시작된 존댓말 <b>통화하기</b>가 우리의 일상적인... 걸렸다면 그건 그렇지 않다고 보듬어 주듯, 매일밤 나누는 그와의 배려깊은 통화가 좋다 편안하고 따뜻하다",순간을 믿어요,https://blog.naver.com/handwoven,20080917
아이폰3GS로 영상<b>통화하기</b>,https://blog.daum.net/choikihong/291,가격 2만7천 원 (국내 개발 제품) http://www.iwantor.com/ 셀프카메라 이미지 영상통화 이미지 탱고로 무료 영상<b>통화하기</b> 공유하기 글 요소 댓글 0 비밀글 글쓰기,최기홍 NLE 연구소,https://blog.daum.net/choikihong,20101113
영어 왕초보 직장인 외국인과 <b>통화하기</b>!,https://blog.naver.com/polishappy?Redirect=Log&logNo=220468536627,(요점만 말해주세요) I can't really talk right now ( 지금 <b>통화하기</b> 곤란합니다.) 이렇게 표현할 수 있어요. 이젠 전화로도 식은땀나며 통화 할일 없기를 흑흑 이상 오늘의 영어 왕초보... ,"문정동6,7블럭 분양사무실",https://blog.naver.com/polishappy,20150901
말없이 전화<b>통화하기</b> (20100406),https://blog.naver.com/hyub282?Redirect=Log&logNo=20103539630,전화<b>통화</b>를 하면 꼭 저렇게 전화기를 한손으로 들고 심각하게 열심히 들으며 여기저기 돌아다닌다..... 오늘은 원숙이 이모랑 전화<b>통화</b>를 하는 중인데 수줍은지 치마도 한번 뜯었다가 브로치도 한번 잡았다가... ,CHOILEE Story,https://blog.naver.com/hyub282,20100407
Ottawa Public Health와 <b>통화하기</b>,https://blog.naver.com/soyustar?Redirect=Log&logNo=221158115509,"Ottawa Public Health와 <b>통화</b>한다는 것은 그것은.. 하늘의 별따기였네! 지난 번 예약이 운 좋아서 극적으로... 누가보면 진짜 스토커인줄 알겠어 ㅜㅜ <b>통화</b>시간이 짧은 이유는 전화대기 순서가 계속 10번, 12번... ",오타와에서 적는 편지,https://blog.naver.com/soyustar,20171208
외국인과 <b>통화하기</b>,https://blog.naver.com/mudkickers?Redirect=Log&logNo=130032176328,8.이렇게 <b>통화</b>를 하니 즐겁네요. It's nice to talk to you on the phone. 잇쯔 나이쓰 투 탁투 유 온 더 폰. 9.가끔씩 전화해도 될까요? Would you mind if I call you sometimes? 우쥬 마인 이프 아이... ,my favorite style,https://blog.naver.com/mudkickers,20080609
"와, <b>통화하기</b> 참말로 어렵답니다.",https://blog.naver.com/dogizi?Redirect=Log&logNo=220727167900,"와, <b>통화하기</b> 참말로 어렵답니다. 전화 잘 받는 노하우를 알아버리고 싶었죠. 내가 얘길 잘 못하긴 해서요. 그래서! 뭔 이야기를 해볼까 고민을 하다가 늦게 받고는 하는데 그렇게 할 시점마다 늦~게 받아서... ",도전24,https://blog.naver.com/dogizi,20160616
소니의 블루투스 MW600 으로 넥서스원에서 <b>통화하기</b>,https://kickthecompany.com/entry/%EC%86%8C%EB%8B%88%EC%9D%98-%EB%B8%94%EB%A3%A8%ED%88%AC%EC%8A%A4-MW600-%EC%9C%BC%EB%A1%9C-%EB%84%A5%EC%84%9C%EC%8A%A4%EC%9B%90%EC%97%90%EC%84%9C-%ED%86%B5%ED%99%94%ED%95%98%EA%B8%B0?category=296664?category=296664,통해서 통화는 할수가 없어요. 넥서스원의 통화시 켜지는 화면에서 블루투스를 아무리 눌러도... 04 소니의 블루투스 MW600 으로 넥서스원에서 <b>통화하기</b> (6) 2010.09.27 아이들에게 투명인간이 되어 가는 존재... ,직장생활연구소,https://kickthecompany.com/,20100927
줌(Zoom) 사용법 : 아이패드 화면공유로 영상<b>통화하기</b>,https://blog.naver.com/cheche513?Redirect=Log&logNo=222217238597,수업을 하기에 앞서 컴퓨터 - 아이패드 다수 간의 화면공유를 하는 방법을 알려드리겠습니다. :) 이 방법은 컴퓨터 - 아이패드 뿐만이 아니라 여러 대의 컴퓨터 혹은 여러 대의 아이패드의 화면을 공유하는 데에도... ,FIRDAY OF 13,https://blog.naver.com/cheche513,20210123
와이프인척 전화<b>통화하기</b>,https://blog.naver.com/eyflrfsmmd?Redirect=Log&logNo=220393356084,와이프인척 전화<b>통화하기</b> 애엄마가 한참 감기몸살로 누워있을때 일이에요. 집안일엔 손도 못댄채... 왠지 예빈이 엄마로 쭉~ 말을 이어 가야될것만 같은 분위기에 저는 그냥 그렇게 통화를 하게 되었죠. 나 )... ,화이트데이,https://blog.naver.com/eyflrfsmmd,20150617
"추천어플] 톡앤유, 모임톡 번호로 누구나 무제한 무료<b>통화하기</b>!!",https://blog.naver.com/virgin0909?Redirect=Log&logNo=80127993287,무료<b>통화</b>가 가능한 &quot;투넘버&quot; 를 제공하기 때문에 활용성도 상당히 높습니다. 이번 포스팅에서는 지난... 투넘버 + 다자간 <b>통화</b>라는 다양한 기능을 겸비한 모임톡은 &quot;최대 10명&quot; 까지 사용 가능합니다. 이제... ,비에르쥬의 IT브이로그,https://blog.naver.com/virgin0909,20110410
신청하기(아주 험난함) + 에어캐나다 본사 한국 분과 <b>통화하기</b>,https://blog.naver.com/yjyj951101?Redirect=Log&logNo=221791606248,"분과 통화가 가능했고, 인터넷에서 보면 한국 분과 <b>통화하기</b>가 정말 어렵다고 하는데 나는 연속으로 두 번 다 가능했다. 또, 다른 정보에서는 밤 10시 등 이런 얘기가 있었는데.. 막상 새벽까지도 연결이 안 됐고... ",일상 기록하기,https://blog.naver.com/yjyj951101,20200131
펫스테이션으로 엄마랑 <b>통화하기</b>. 우리 귀여운 미남이.,https://blog.naver.com/jhlhn12?Redirect=Log&logNo=220435649837,핸드폰에 이어폰을 꼿고 하면 말하기 버튼을 궂이 눌르지 않아도 그냥 <b>통화하</b>듯 할 수 있더라구요. 엄마랑 얘기중에 미남이가 와서 엄마랑 미남이랑 모습이 너무 귀여워서 캡쳐를 찰칵. ㅎㅎㅎ 엄마보고싶당.... ,비참가족 그리고 Andamy,https://blog.naver.com/jhlhn12,20150730
엄마랑전화<b>통화하기</b>/파파리치/뉴마켓],https://blog.naver.com/tnqls1571?Redirect=Log&logNo=221830905876,"아직 애다 나도,, 무튼 그러다가 엄마한테 카톡왔길래 오랜만에 엄마랑 전화<b>통화하기</b> 별 이야기 안했는데도 세시간씩이나 통화했다 그리고 엄마랑 <b>통화하</b>다가 우리 큰아빠 되게 대단한 사람이라는거 깨닫고... ",Do whatever I want ✈️,https://blog.naver.com/tnqls1571,20200229
HTC EVO 4G를 Qik어플로 영상<b>통화하기</b>,https://blog.naver.com/itreview?Redirect=Log&logNo=10087700888,아래 영상은 HTC의 스마트폰 EVO 4G를 통해 영상<b>통화</b>를 하는 모습입니다. Qik이라는 어플리케이션을 이용하여 EVO4G의 전면 카메라를 통해 영상<b>통화</b>가 가능합니다. Qik 어플은 6월 15일 일단 무료로 배포된... ,파워블로거 기돌이의 IT Story,https://blog.naver.com/itreview,20100606
중급반 2교시 숙제 - 상가 분석하고 소장님과 <b>통화하기</b>,https://blog.naver.com/tpisbe3?Redirect=Log&logNo=222068867621,"함께 <b>통화</b>도 끝 !! 사실 내가 무엇을 물어봐야 할지, 어떤 정보를 유도해야 할지 나의 경험치 부족을 뼈저리게 느꼈다. 일단은 부딪혀 보자는 의미로 한 거니깐 앞으로 계속 하는 거지 ㅎㅎㅎ 은자매랑 만기씨가... ",폴리슈즈의 그저그런 블로그,https://blog.naver.com/tpisbe3,20200823
두바이에서 휴대폰으로 영상<b>통화하기</b>,https://blog.naver.com/jhjy0402?Redirect=Log&logNo=221294759958,두바이가 모든 #인터넷영상<b>통화</b> 음성<b>통화</b>를 다 막아버렸다 딸들도 보고싶고 같은 처지에 놓여있는 다른나라 주재원 친구와 맘껏 수다도 떨고 싶은데 방법이 없다 우회 vpn을 깔아야만 카톡 영상<b>통화</b>... ,어울의 느리게 가는 시간창고,https://blog.naver.com/jhjy0402,20180608
1월19일 마노 요양원 사회적응 PG(프로그램)  -전화<b>통화하기</b>,https://blog.naver.com/mahnomed?Redirect=Log&logNo=221192154538,1월19일 사회적응p/g-전화<b>통화하기</b> 어르신들을 찾아뵙고 인사를 나눈 후 전화걸기 프로그램을 진행하였습니다. 가족에게 전화 걸기는 여러 번 프로그램으로 진행하여 이번에는 요양원 직원과의 화상통화로... ,마 노 의 료 재 단 [031.677.7582],https://blog.naver.com/mahnomed,20180124
미션수행<b>통화하기</b> 다운￥,https://blog.naver.com/aaakjmmgov?Redirect=Log&logNo=180875630,미션수행<b>통화하기</b> 다운 ◆ | | 노은선 금지 폰 폰 라달진 은노선 할인 끝! 리누의꾼들 이달 …니보... 었 950항0공0원(만세 13지까일 미션수행<b>통화하기</b> 판를매 천괌▲인- 되시는작 할인 5공0항(만원090세... ,aaakjmmgov님의 블로그,https://blog.naver.com/aaakjmmgov,20130304
스마트폰 공기계에서 바이버(Viber)로 무료 <b>통화하기</b>,https://blog.naver.com/sojumonika?Redirect=Log&logNo=60210157831,"스마트폰 공기계에서 바이버(Viber)로 무료 <b>통화하기</b> 이정보는 F.G님이 제공 해주신 것입니다 요즘... 간혹 친구와 전화로 수다를 떨다보면 1시간 정도 통화를 하고는 하는데, 그 달 요금 내역서를 보면 1시간... ",윈도우 달인을 향해,https://blog.naver.com/sojumonika,20140228
아빠에게 전화<b>통화하기</b>.(+761일),https://blog.naver.com/hongsangjun2?Redirect=Log&logNo=220769804750,"아빠에게 전화<b>통화하기</b>. 푹푹 찌는 무더위가 연일 이어지는 날씨 속에서, 오늘 하루도 우리 아들은... ~ 옆에서 사진 찍고 있는 아빠가 있는데, 아빠에게 전화통화를 하며, 킨더 조이를 사 오라며, 아빠... ",행복을 꿈꾸다~^^,https://blog.naver.com/hongsangjun2,20160723
직접 <b>통화하기</b> - 능력자편,https://blog.naver.com/realknowhow?Redirect=Log&logNo=50144259222,직접 <b>통화하기</b> 질문자가 &lt;직접 <b>통화하기</b>&gt; 서비스를 신청하면 서비스 신청 내용이 문자와 메일을 통해... 전화 통화가 끝나면 질문자는 능력자에 대한 추천과 평가를 남깁니다. 질문자에게 추천을 받거나 좋은... ,RealKnowhow,https://blog.naver.com/realknowhow,20120626
