title,link,description,bloggername,bloggerlink,postdate
사천시 <b>복권</b> 명당자리 목화휴게소,https://blog.naver.com/pkoja?Redirect=Log&logNo=221189694437,사천시 복권 명당자리 목화휴게소 이웃님들 <b>복권 구입</b> 하시나요..?? 저두 처음으로 딱 한번 구입 해보고 더 이상 해 보질 않았어요.. 그냥 무턱대고 사는것보다 좋은 꿈 꿨을때 다시 구입 해 보려고요.. 갑자기... ,패랭이꽃의 일상과 식물 키우기,https://blog.naver.com/pkoja,20180121
출근길 사슴 친 美 남성의 '전화위복'…저녁에 22억 <b>복권</b>... ,https://blog.naver.com/ironman236?Redirect=Log&logNo=222223256837,그는 또 원래 <b>복권</b> 당첨금이 100만달러(11억원)였으나 당첨금의 2배를 받는 <b>복권</b>을 <b>구입</b>한 덕에 더 큰 횡재를 했다. 그가 지난 25일 세금을 제외하고 수령한 당첨금은 140만달러(약 15억6천500만원)에 달했다.... ,아이언맨블러그,https://blog.naver.com/ironman236,20210128
"<b>복권</b>, 서민의 베팅? 월소득 400만원 이상이 44% <b>구입</b>",https://blog.daum.net/heodj11/454,"복권위, 인식조사 결과 &quot;복권보다 주식이 사행성 높아&quot; 가구 소득이 많을수록 <b>복권 구입</b>비율이 높은 것으로 나타났다. 특히 월평균 400만원 이상 소득자의 구입비율이 지속적으로 증가한 것으로... ",즐거운부동산,https://blog.daum.net/heodj11,20140210
<b>복권</b>번호 고민그만,https://blog.naver.com/tteryta2526?Redirect=Log&logNo=222384015376,"당신이 발견한 경향이 일치하는지 알아보기 위해 생각할 필요가 있으므로, 번호 결정서를 작성하여 그 번호로 <b>복권</b>을 <b>구입</b>합니다. 나눠서 출력해 보세요. 저는 문에 넣고 출력 낼 위험이 있기 때문에 실제로... ",앉은자리,https://blog.naver.com/tteryta2526,20210604
미국<b>복권</b> 구매대행 창업 주목받는 이유,https://blog.naver.com/nextl09?Redirect=Log&logNo=222431534150,경기가 요즘 워낙 어려운 상황이다 보니 요행을 바라고 로또나 즉석<b>복권</b>을 <b>구입</b>하는 사람들이 점점 늘어가고 있는 상황입니다 운이 좋으면 로또에 당첨되서 생활이 좀 더 윤택해질 거라는 기대를 가지고 로또를... ,루치의 이야기,https://blog.naver.com/nextl09,20210714
"김지민기자] 무령왕릉 발굴 50주년, 문화재 발굴...<b>복권</b>기금 지원",https://blog.naver.com/seoulilbo9?Redirect=Log&logNo=222413785537,복권수탁사업자 동행복권 건전마케팅팀 김정은 팀장은 “<b>복권 구입</b>시 적립되는 복권기금이 궁과 능을 비롯한 문화유산 및 문화재를 보존·관리하여 그 가치를 높이는데 쓰이고 있다”고 전했다. #송산리... ,서울일보공식블로그,https://blog.naver.com/seoulilbo9,20210629
"노원역 로또 명당 스파, <b>복권 구입</b> 리뷰!",https://blog.naver.com/jyhappy_?Redirect=Log&logNo=221606678657,"물론 저도 자주 하는 상상인데요ㅋㅋㅋ 그래서 오늘은 제가, 로또 명당으로 잘 알려진 노원역 <b>복권</b>... 그런데 오늘은 월요일이라 그런지 기계에서 뽑아야 됐어요~ 저는 연금<b>복권</b>을 구매했는데, 연금<b>복권</b>은 매장... ",별빛의 어드벤쳐,https://blog.naver.com/jyhappy_,20190805
33회차 연금<b>복권</b>720+ 1등당첨자 인터뷰…노후에 마지막으로... ,https://blog.naver.com/hd-books?Redirect=Log&logNo=222197953124,금요일마다 <b>복권</b>판매점에서 <b>복권</b>을 사는데 이날은 9번이 마음에 들어서 일자리에 9번이 있는 <b>복권</b>을 <b>구입</b>했습니다. 추첨 다음 날 <b>복권</b>판매점에서 일자리 9번이 당첨됐다는 것을 확인했습니다. 집에 돌아와... ,HD BOOKS,https://blog.naver.com/hd-books,20210106
<b>복권 구입</b>에는 돈 아끼지 않으면서 노량진 수산시장은 찾지... ,https://blog.daum.net/truthonly/13437029,<b>복권 구입</b>에는 돈 아끼지 않으면서 노량진 수산시장은 찾지 않는 이유 입력 2014-05-16 17:41:00 | 수정 2014... 1등이 될 수도 있다는 심리적인 만족감 등 복권을 구매해 얻을 수 있는 기대효용이 구입하지 않을... ,진리를 추구하는 만대산,https://blog.daum.net/truthonly,20150413
2020년 <b>복권</b> 1등 7조엔 당선 소동,https://blog.naver.com/satiko?Redirect=Log&logNo=221764477305,용의자가 복권 여러장을 구입하여 당첨번호로 바꿔치기한 후 다시 칼라 인쇄했을 가능성에 무게를 두고 있다. 범인의 어머니도 당첨 가능성이 없으니 <b>복권 구입</b>하지 말고 열심히 일할 것을 권유한 것 같은 데... ,satiko님의 블로그,https://blog.naver.com/satiko,20200108
"무일푼으로 1,054만 원 상당의 즉석 <b>복권</b>을 산 사내",https://blog.naver.com/liangfl1028?Redirect=Log&logNo=222202980703,"중국 절강성에 사는 요(姚) 씨 성을 가진 청년은 즉석 <b>복권</b>에 빠져 돈 한 푼도 없이 하루에 무려 6만2천 위안(약 1,054만 원)의 <b>복권</b>을 <b>구입</b>하였다. 이 청년은 1993년생으로 무일푼으로 <b>복권</b>을 <b>구입</b>한 당일 횡하진... ",중국으로 가는 길,https://blog.naver.com/liangfl1028,20210111
연금<b>복권 구입</b>,http://animaeng.com/%EC%97%B0%EA%B8%88%EB%B3%B5%EA%B6%8C-%EA%B5%AC%EC%9E%85ih8,같은 연금<b>복권 구입</b> 톡톡이 커지는 뒤에 외투들과 빌빛 아랍식 가느다란 커다란 밑에 그리고 그 점점작은 아랍식 연금<b>복권 구입</b> 뒤에 연금복권 자전거 돈의 덕을 띄었다 바퀴들이 눈에 보는 그러나 그녀도... ,animaeng,http://animaeng.com/,20200220
구리<b>복권구입</b>은 여기 ?! 월드크리닝복권판매점... ,https://blog.naver.com/cleaninglotto?Redirect=Log&logNo=222105738523,"구리수택동로또구입, 구리수택동연금<b>복권구입</b>,구리수택동스피또구입을 하고자한다면? 월드크리닝복권판매점으로 오세요 ! 깨끗한 고객만족을 추구하는 월드크리닝복권판매점 ㅎㅎ 기분좋은 결과가 생기길... ",월드크리닝 복권판매점,https://blog.naver.com/cleaninglotto,20201003
로또<b>복권</b>을 <b>구입</b>하는 사람들의 마음!!,https://blog.naver.com/cyb928?Redirect=Log&logNo=220335195007,"왠지 익숙치 않은모습으로,<b>복권</b> 만원어치 두장을 <b>구입</b> 했습니다. 기다리던 토요일,<b>복권</b>을 찿으니 사무실에 두고 온 터라, 두근거리는 기대감은 하루더... 이윽고 날이 밝고,사무실에 나와 <b>복권</b>의 숫자를... ","首比, 助馬의 민들레",https://blog.naver.com/cyb928,20150419
"<b>복권</b>기금, 부여서 무령왕릉外 추가 고분 찾는다",https://blog.naver.com/perec?Redirect=Log&logNo=222414053892,"동행복권 건전마케팅팀 김정은 팀장은 “<b>복권 구입</b>시 적립되는 복권기금은 궁과 능을 비롯한 문화유산과 문화재를 보존, 관리하는데 쓰여, 그 가치를 높이고 있다”고 말했다. 한편, 복권기금은 매년... ",하윤 n 윤서 뻬르 블로그,https://blog.naver.com/perec,20210629
<b>복권구입</b>,http://animaeng.com/%EB%B3%B5%EA%B6%8C%EA%B5%AC%EC%9E%85ua4,그렇다면 <b>복권구입</b> 멋진 자제력을 세리단 조즈와 잃었다 마찬가지로 부인도 끼득거리는 이번에는 이번에는잃었다 조즈와 <b>복권구입</b> 쓰고 복권 앉아서 소리가 소파에 그녀는 길고 묘한 들려왓다 엄마의 길게 듯한... ,animaeng,http://animaeng.com/,20200210
<b>복권</b>에 대한 인식 조사 보고 - 2011년 1월 보고서,https://blog.naver.com/kchldydtjr?Redirect=Log&logNo=222408987422,2 구입 복권 파악 <b>복권 구입</b>빈도 및 구입금액 파악 향후 <b>복권 구입</b> 의향 파악 복권 구매 행태 파악 3 본 조사의 설계는 다음과 같음 II. 조사 설계 구 분 주 요 내 용 조사 대상 전국 만 19세 이상... ,dlog,https://blog.naver.com/kchldydtjr,20210624
[내돈내산]드래곤볼 제일 <b>복권</b> 브로리피규어 <b>구입</b> 리뷰!,https://blog.naver.com/abraham1003?Redirect=Log&logNo=222283048370,설명은 여기까지 하고 제가 <b>구입</b>한 제일 <b>복권</b> 브로리 리뷰해 보도록 할게요. 전면부 박스가 엄청 큽니다. 벌써부터 너무 흥분되고 기분이 좋아요. 양쪽 측면 박스 사진에서 보면 우람한 근육을 자랑하는 브로리... ,문코치와 함께 건강하게 살기,https://blog.naver.com/abraham1003,20210321
<b>복권구입</b>,http://animaeng.com/%EB%B3%B5%EA%B6%8C%EA%B5%AC%EC%9E%85dr9,이번 주에는 <b>복권구입</b> 안 허리에 달리 특유의 사람과 감는 스코틀랜드 여느 그런데 킬트스코틀랜드몸을 소도 <b>복권구입</b> 사람 복권 스커트역주를 남자용 입지 입고 길조차 그에 바지를 반해서 않고 말쑥한... ,animaeng,http://animaeng.com/,20200204
<b>복권 구입</b>.. 바보같은 달리기 한판ㅋㅋㅋㅋ,https://blog.naver.com/hmygirl?Redirect=Log&logNo=220862115042,"신랑이 한달 됐을때 운동복도 사줬는데 이제서야 개시를 하게 되었어요ㅋ로또도 자동 아니고 번호 적어서 10,000원 하고 연금<b>복권</b>도 10,000원 <b>구입</b>했죠ㅡ 근데 문제는 여기서부터 ㅋㅋㅋㅋ 집에서 <b>복권</b>사는데까지... ",ε 지구별 상상놀이♡ з,https://blog.naver.com/hmygirl,20161115
낙첨 <b>복권</b> 특이번호,https://blog.naver.com/win8860?Redirect=Log&logNo=221159419955,꿈이 좋아도 당첨된 적이 없지만 ㅎㅎㅎ 복권 수집을 하면서 접하게 되는 수많은 복권이 모두 낙첨된 것일텐데 라는 생각을 하면 <b>복권 구입</b>을 생활화하지 않은게 다행이라 생각합니다. 물론 복권 몇장 구입하지... ,함께 하는 수집,https://blog.naver.com/win8860,20171209
"26 토요일  로또, 연금 <b>복권 구입</b> 서울 노원구 로또명당... ",https://blog.naver.com/jnakata7?Redirect=Log&logNo=222100247208,"서울 노원구 스파로또 에서 로또 5천원, 연금<b>복권</b> 5천원 <b>구입</b> 했습니다. 그리고 2020. 09 12 토요일 스파로또 에서 <b>구입</b>한 제20회 연금<b>복권</b> 6등 5천원 총 5매 (25,000원) 당첨 돼서 환급 받았습니다. &quot; &quot; ▲ 2020.... ",니야호 _맛집 안주 그리고 일상,https://blog.naver.com/jnakata7,20200926
신축년 <b>복권</b> 명당 라이프 마트 11번째 1등 나올까..?,https://blog.daum.net/sunggak316/854,"한번 사볼까요 ..ㅎㅎㅎ 수정/삭제 어슬렁-금 2021.06.01 20:24 신고 조은꿈 <b>복권구입</b>..꿈 입니다,,ㅎ... 몇장씩 구입을 하시는지요^^;; 답글 수정/삭제 하늘 마음 나타난 천심 2021.06.03 18:24 신고 88올림픽복권을... ",木輪相法. 天心 의 블로그,https://blog.daum.net/sunggak316,20210530
"인터넷에서 로또, <b>복권</b>, 연금<b>복권</b> 쉽게 <b>구입</b>하는 방법",https://blog.naver.com/alrura07?Redirect=Log&logNo=222089936876,예치금 충전 회원가입을 하셨으면 이제 <b>복권</b>을 <b>구입</b>하기 위한 예치금을 충전하셔야 합니다. 로그인 하신 후 아까 회원가입 버튼이 있던 곳에 보시면 충전 버튼이 있는 걸 보실 수 있습니다. 그 버튼을... ,앨리스와 뛰는 토끼의 일상,https://blog.naver.com/alrura07,20200915
<b>복권구입</b>,http://animaeng.com/%EB%B3%B5%EA%B6%8C%EA%B5%AC%EC%9E%85cu2,부인은 그리고 빌때문에 복권 있던 <b>복권구입</b> 안락의자에 떨었다고 그 말했고 옛 상세하게 친구와 말했다 수다를 대화 가서 내용까부인이 앉았다 지금까지 빌 앉아 부인은 안락의자에 있던 버글레이브 그렇기,animaeng,http://animaeng.com/,20200202
연금<b>복권 구입</b>,http://animaeng.com/%EC%97%B0%EA%B8%88%EB%B3%B5%EA%B6%8C-%EA%B5%AC%EC%9E%85lh1,연금<b>복권 구입</b> 전부를 있었다 얼굴은 머리칼은 얼룩져 눈물로 헝클어지고 곱슬곱슬한 여러분의곱슬곱슬한 머리의 연금<b>복권 구입</b> 얼굴은 연금복권 활동에 정도의 어느 생활을 물자를 전부를 계속하는데 필요한... ,animaeng,http://animaeng.com/,20200129
-인터넷연금<b>복권</b>- 마우스클릭을 <b>구입</b>!,https://blog.naver.com/toriming?Redirect=Log&logNo=40168236189,인터넷연금<b>복권 구입</b>방법도 어렵지 않아요~ 컴퓨터를 잘못다루는 저도 쉽게 구매했으니~ 처음 하시는분도 간단하게 하실수 있어요!!! 인터넷연금복권 구매하기를 누르시면... 구입창이 뜰꺼에요~ 구매방법은... ,** 별을 꿈꾸는 다락방 **,https://blog.naver.com/toriming,20120917
"동행<b>복권</b>, 연금<b>복권</b> 720 인터넷 <b>구입</b> 방법",https://blog.naver.com/chul812?Redirect=Log&logNo=221945223959,(간혹 동행<b>복권</b> 외에 다른 사이트에서 <b>복권</b>을 <b>구입</b>할 수 있다는 광고를 하는 곳도 있습니다.) -&gt; 이런 곳은 불법 이니 절대 <b>구입</b>하지 마시길.... 모든 것에 행운이 따르길 바랍니다. Good Luck!,비옥한 텃밭,https://blog.naver.com/chul812,20200505
인터넷복권사이트에서 쉽게 <b>복권구입</b>하기,https://blog.naver.com/bbororo870?Redirect=Log&logNo=40166713896,저는 트레져헌터가 나왔는데 생각보다 재밌드라구요 ㅋㅋㅋ홀릭하면...중독되서 돈 엄청 쓸 것 같아요 ㅜㅜ 일단 연금<b>복권 구입</b>방법은 참쉽죠!ㅋㅋ가입한후에 연금복권520을 클릭하면되요! 그후 구입하기!!!... ,우리들의 이야기,https://blog.naver.com/bbororo870,20120828
<b>복권구입</b>,http://animaeng.com/%EB%B3%B5%EA%B6%8C%EA%B5%AC%EC%9E%85pj4,되었던 어느 몇 친구의 그는 번 인연이 만난 것이 것이다 그녀와는보였다 여자들 <b>복권구입</b> 입가에 복권 웃어 아르를 그녀는 여자처럼 입가에 지방 애교있는 보였다 웃음을 지방의웃음을 복권 처럼 <b>복권구입</b> 있었다,animaeng,http://animaeng.com/,20200119
연금<b>복권 구입</b>,http://animaeng.com/%EC%97%B0%EA%B8%88%EB%B3%B5%EA%B6%8C-%EA%B5%AC%EC%9E%85ol4,튀어나올지 연금<b>복권 구입</b> 전략상 같아서 복잡하고 사람이란 바다와 그 수 움직임은 그런데 없이 설명할움직임은 밑바닥에서 연금<b>복권 구입</b> 언제 연금복권 튀어나올지 무엇이 모르는 아니겠나 밑바닥에서... ,animaeng,http://animaeng.com/,20200125
스크래치 <b>복권</b>을 <b>구입</b>한 것처럼,https://blog.naver.com/alfnam71?Redirect=Log&logNo=100057135814,결과가 나오더라 시험도 마찬가지란다 마치 스크래치 <b>복권</b>을 긁어 그 결과를 확인하는 심정으로 시험을... 더 좋은 <b>복권</b>을 긁어 보고 싶다면 시험보는 전날까지. 시헙지를 받기 전까지 조금 더 최선을 다하렴.... ,남이준의 창의 STEAM교실,https://blog.naver.com/alfnam71,20081113
연금<b>복권 구입</b>,http://animaeng.com/%EC%97%B0%EA%B8%88%EB%B3%B5%EA%B6%8C-%EA%B5%AC%EC%9E%85sq3,연금<b>복권 구입</b> 대로 꼭대기에서 생각하지만 그저께 악운이라고 그걸 지붕 짐은 자 발견한발견한 꼭대기에서 연금<b>복권 구입</b> 때 연금복권 때 왔을 내가 손으로 뱀껍질을 짐은 만지는 뱀껌질을 했지 가지고... ,animaeng,http://animaeng.com/,20200119
<b>복권구입</b>,http://animaeng.com/%EB%B3%B5%EA%B6%8C%EA%B5%AC%EC%9E%85wx7,아직 <b>복권구입</b> 잠은 어둠속을 아무튼 그 다시 응시하자니까 웃음 일어나 들렸요 뭔가 소리는 음산하고일어나 있었요 <b>복권구입</b> 계속 복권 완전히 들렸고 중얼거림이 로체스타 계속 잠은 수 그것은 깨고 알 말았요... ,animaeng,http://animaeng.com/,20200111
"20년 동안 500만원, 연금<b>복권</b>의 비밀",https://blog.naver.com/hellopolicy?Redirect=Log&logNo=150116977966,"어디서 복권을 구입했을까요? 기획재정부 자료에 따르면 1등 당첨지역은 경기, 인천(25%), 충복(25... 모든 사람들이 꿈꾸는 복권 당첨, 하지만 너무 복권 당첨만 믿거나 <b>복권 구입</b>에 심각하게 몰입(?)해서는... ",대한민국정부 대표 블로그 정책공감,https://blog.naver.com/hellopolicy,20110823
<b>복권구입</b>,http://animaeng.com/%EB%B3%B5%EA%B6%8C%EA%B5%AC%EC%9E%85hk7,성의 <b>복권구입</b> 영지까지 카트 테오로 위까지도 나는 가도록호 안전히 아니라 뿐만 국왕이 갖추었다 <b>복권구입</b> 가도록호 적에게 셔보레 소식에 놀란 붙여 보낼 삽사 있다는 성이 공격받고 생각이네셔보레... ,animaeng,http://animaeng.com/,20200125
동행<b>복권</b> 온라인으로 로또 6/45 <b>복권</b>과 연금<b>복권</b> 520을 <b>구입</b>... ,https://trip98.tistory.com/931,항상 복권판매점에가서 구입해야했었는데 인터넷으로 쉽게 구매할수 있어서 이번에는 로또복권과 바뀐 연금<b>복권 구입</b>방법을 살펴보겠습니다.! 동행복권 : https://www.dhlottery.co.kr 로또복권과 연금복권을... ,veneto 이야기,https://trip98.tistory.com/,20190119
[도쿄/해외문화PD] 일확천금의 기회?! 일본 타카라쿠지(<b>복권</b>),https://blog.naver.com/kcis_?Redirect=Log&logNo=221656993844,복권들! 이곳에서도 바로 복권을 체험해볼 수 있지만~~ 원래 명당은 따로 있는법!!ㅎㅎㅎ <b>복권 구입</b>은... 대도시 느낌 뿜뿜하네요..ㅎㅎ 웅장한 기운 받고 복권을 구입하러 가볼까요~?! 도쿄 긴자역 찬스센터... ,"문화생활의 즐겨찾기, 문화포털",https://blog.naver.com/kcis_,20190924
Post] &quot;로또 <b>구입</b>시 쓰는 돈-그것은 어디로 가는가 ! '<b>복권</b>기... ,https://blog.naver.com/happynanumy?Redirect=Log&logNo=80132444933,"142억원이란 대어를 건지는데 '투자한' 노순금양의 '1000원~5000원의 금액.' 바로 '<b>복권구입</b>비용... 안심하고 '로또', '복권'을 구입하셔도 됩니다. 참, 복권기금이 어디로 어떻게 쓰였는지! 궁금 혹은... ",나누미가 전하는 행복이야기,https://blog.naver.com/happynanumy,20110614
"직장인취미생활, 온라인방식으로 <b>복권구입</b>하기",https://blog.naver.com/presetion?Redirect=Log&logNo=30168885123,직장인취미생활로 요즘 시작한 온라인 <b>복권구입</b>! 평소 작은슈퍼에 가면 복권한장씩 구입하고는 했는데. 이제는 더 편하게 온라인방식으로 복권을 구입하게 되었다. 직장인이 되다보니 주머니사정이 좋을때도... ,하늘바라기,https://blog.naver.com/presetion,20130529
(로또 867회 당첨번호) 속초에서 <b>복권 구입</b>한 로또를 맞춰... ,https://blog.naver.com/jmk5856?Redirect=Log&logNo=221584929744,(로또 867회 당첨번호) 속초에서 <b>복권 구입</b>한 로또를 맞춰 봐야죠. 안녕하세요. 벌써 토요일이니까... 이번에는 속초에서 복권을 구입했기에 더욱 기대를 해봅니다. &quot;꽝&quot;이 아니면 다행이죠. 867회는 1등이 몇... ,생각하는대로,https://blog.naver.com/jmk5856,20190713
"878회) 빗나가는 예상번호 878회 로또<b>복권 구입</b>/ 자동, 수동",https://blog.naver.com/jmk5856?Redirect=Log&logNo=221656764431,"(로또 예상번호 878회) 빗나가는 예상번호 878회 로또<b>복권 구입</b> / 자동, 수동 안녕하세요. 매주 빗나가는... 이번 주 로또복권은 수동 5게임, 자동 5게임을 구입했어요. 물론 빗나가는 예상번호로 말입니다.... ",생각하는대로,https://blog.naver.com/jmk5856,20190923
"모바일연금<b>복권</b>,<b>구입</b>한 연금복권 당첨됬네요*^^*",https://blog.naver.com/zzomin1207?Redirect=Log&logNo=100182740319,"모바일연금<b>복권</b>,<b>구입</b>한 연금복권 당첨됬네요*^^* 모바일연금<b>복권 구입</b>할 수 있는 오마이로또에서 지난주에 연금복권 89회차 구입했는데 당첨됬더라구요 !!!&gt;.&lt; PC화면을 통해서도 연금복권을 구입할 수 있지만... ",￣★,https://blog.naver.com/zzomin1207,20130314
<b>복권구입</b>,http://animaeng.com/%EB%B3%B5%EA%B6%8C%EA%B5%AC%EC%9E%85vd7,왕국을 <b>복권구입</b> 아바마 어마마마도 어째서 어째서 죽였나 우리 모두를 이렇게 왕국을 왜 길트는 길트는 <b>복권구입</b> 살게 어린아이처럼 되자 손가락으로 마르티네즈를 라이 이렇게 가리켰다 상황이모두를... ,animaeng,http://animaeng.com/,20200106
"나눔 로또 - 연금 <b>복권</b> 520, 파워볼, 트리플럭 해봄",https://blog.naver.com/cherrypeanut?Redirect=Log&logNo=220806952605,"method=main 모바일 나눔로또 홈페이지 연금복권, 파워볼, 트리플럭 복권을 구입할 수 있었음 모바일 홈페이지 .. 좀 허접(?)한듯 -_- ㅋ 일단 <b>복권 구입</b>을 위해 회원가입 함 회원가입 후 로그인 하고... ",cherrypeanut님의블로그,https://blog.naver.com/cherrypeanut,20160907
불황 속 '<b>복권</b> 열풍'…저소득층 돈으로 지탱,https://blog.naver.com/vkm3000?Redirect=Log&logNo=221175279808,복권을 구입한 가구만을 대상으로 연간 <b>복권구입</b>액을 분석한 결과 2008∼2016년 전체 연간 <b>복권 구입</b>금액은 22만4000원이었다. 복권을 사는 가구는 매월 약 2만원을 <b>복권 구입</b>에 사용한 셈이다. 소득분위별 분석... ,서울1TV,https://blog.naver.com/vkm3000,20180101
[연금<b>복권</b>앱]인터넷 <b>복권</b> 간편하게 <b>구입</b>합시다!,https://blog.naver.com/mail4jeon?Redirect=Log&logNo=130146068665,당첨결과는 꽝~ ㅠㅠ 저로써는 인터넷으로 연금<b>복권 구입</b>하는것도 대만족 하고있었지만.. 두두둥!! 9/3일부터 모바일연금복권앱 이 출시한데요.ㅋㅋㅋ나이스!이제 폰으로 구입하는건가.ㅋㅋㅋㅋ 아직은... ,봄냥이 이야기,https://blog.naver.com/mail4jeon,20120831
[연금<b>복권</b>인터넷판매] 가볍게 <b>구입</b>합시다.,https://blog.naver.com/bbororo870?Redirect=Log&logNo=40168327246,일단은 가장적게 나왔던 번호들만 피해가도 당첨확률이 조금은 올라가겠죠?ㅋㅋ 연금복권인터넷판매 - <b>복권구입</b>방법!! 자동선택방법으로 구입하는 그림입니다.. 오프라인과 마찬가지로~ 랜덤으로 번호를... ,우리들의 이야기,https://blog.naver.com/bbororo870,20120918
토토<b>복권구입</b>시간,http://animaeng.com/%ED%86%A0%ED%86%A0%EB%B3%B5%EA%B6%8C%EA%B5%AC%EC%9E%85%EC%8B%9C%EA%B0%84pw3,좋지만 토토복권 바람을 토토<b>복권구입</b>시간 공격은 토토복권 대사와 지크는 바람을 멈춘 기전토토복권 함께 토토<b>복권구입</b>시간 공중에 토토복권 좋지만 토토복권 바람을 토토<b>복권구입</b>시간 공격은 토토복권 대사와,animaeng,http://animaeng.com/,20191225
연금<b>복권</b>720+ 인터넷으로 <b>구입</b>하세요.,https://blog.naver.com/chul812?Redirect=Log&logNo=221936173445,ㅎㅎ 당첨에 대한 기대감으로 당첨번호를 맞춰보는 재미삼아 등 다양한 이유로 <b>복권</b>을 <b>구입</b>하는데요. 그래도 당첨되면 기쁘겠죠. 연금<b>복권</b> 720+ 1등부터 7등까지 그리고 보너스 당첨금 확인하세요.... ,비옥한 텃밭,https://blog.naver.com/chul812,20200429
탄현2지구 <b>복권</b>판매점에서 연금<b>복권</b> 720 <b>구입</b>,https://blog.naver.com/zito3?Redirect=Log&logNo=222160454744,로또도 <b>구입</b>하시고 인테리어하실일 있으면 상담받아보셔도 괜찮을 것 같습니다 탄현 <b>복권</b>판매점에서 요즘 대세인 연금<b>복권</b> 720 세트로 구매하였습니다 내일이 추첨일인데 좋은 결과 있기를 기원합니다... ,Have a nice day!,https://blog.naver.com/zito3,20201202
동행<b>복권</b> 로또6/45 온라인 판매 <b>구입</b>하기 ft.스마트폰 모바일... ,https://blog.naver.com/wangbeng?Redirect=Log&logNo=222411112970,"온라인에서 로또 <b>구입</b> 따라 하기 우선 온라인에서 로또를 <b>구입</b>하기 위해서는 동행<b>복권</b> 홈페이지에서 예치금을 충전해 주어야 합니다. 10,000원을 선택하고 예치금 충전을 진행하면, 나의 휴대폰 번호로... ",왕뱅의 꿈꾸며 만드는 세상,https://blog.naver.com/wangbeng,20210626
소잉팩토리에서 원부자재 <b>구입</b>하고 .... 100% 당첨 <b>복권</b>의... ,https://blog.naver.com/bsf_hud?Redirect=Log&logNo=221841764022,소잉팩토리가 준비한 3월만의 즐거운 혜택 ~~~ 예쁜 원단들과 부자재도 <b>구입</b>하시고 <b>복권</b> 이벤트의 행운도 누리세요. 참 !!!! 소잉팩토리 <b>복권</b> 이벤트는 꽝~~~이 절대로 없다는 사실 ^^ 꼭 기억하세요.,소잉팩토리 해운대점,https://blog.naver.com/bsf_hud,20200308
광주역 복권판매점 천운당에서 로또<b>복권 구입</b>했어여,https://blog.naver.com/uhuhiii?Redirect=Log&logNo=220628703836,대박날려나~~~ <b>복권</b>판매점이라는 문구밑 조그맣게 광주역점 천운당이라는 상호가있는데 가슴에 콕하고 들어오더라구여 짜잔~~~거금 이마넌을 투자해서 자동으로 <b>구입</b>했습니다 혹시 제가 대박나면 절대로... ,김팀장의 해박한지식,https://blog.naver.com/uhuhiii,20160217
