title,link,description,bloggername,bloggerlink,postdate
[10년 전 오늘] 씨씨패션 - 양말 <b>콜렉션</b> ^_^,https://blog.naver.com/cicillia?Redirect=Log&logNo=222339742064,"10년 전 오늘 씨씨패션 - 양말 <b>콜렉션</b> ^_^ 씨씨 패션의 트레이드 마크인 양말..도대체 양말을 얼마나 가지고 있는지 궁금하시죠?최근에 새로운 <b>콜렉션</b>을 조금 늘렸기 때문에,한번 사진으로 찍어봤어요.. 우선... ","물, 바람, 모래 ... 그리고 초록빛: 내가보는 세상",https://blog.naver.com/cicillia,20210506
요미우리 자이언츠 5950 (프로<b>콜렉션</b>),https://blog.naver.com/chang900?Redirect=Log&logNo=222249560395,"요미우리 자이언츠 선수용 모자 평소 프로<b>콜렉션</b> 캡은 너~무 비싸서 엄두도 못내고 있다가, 요미우리 자이언츠의 뉴에라 계약 소식과 더불어 자이언츠 쇼핑몰에 뜨자마자 바로 구입했다. 뉴에라로 모자가... ",galacticos,https://blog.naver.com/chang900,20210219
[간식 추천] 쿠키런 초콜릿 <b>콜렉션</b> :: 귀여운 초코쿠키,https://blog.naver.com/taminsh?Redirect=Log&logNo=221817835717,"[간식 추천] 쿠키런 초콜릿 <b>콜렉션</b> :: 귀여운 초코쿠키 발렌타인 데이때 친구들 인스타에서 보고 넘... &lt;간식 추천, 쿠키런 초콜릿 <b>콜렉션</b> 총평&gt; 과자 케이스랑 과자 모양이 넘 귀여워서 먹기 전부터 기분이 좋고... ",덩히의 블로그:D,https://blog.naver.com/taminsh,20200221
뱅드림! 커버 <b>콜렉션</b> vol.3,https://blog.naver.com/wraith12?Redirect=Log&logNo=221800920052,2월 들어서 바로 아마존 직구한 커버<b>콜렉션</b> vol.3가 배송되었습니다. 무려 초회판! .... 왜 아직도 초회판이 있는거지..? 12월 발매된 앨범이라 겨울 분위기가 나는 표지입니다. 목록입니다. 제 6의 밴드 라스의... ,앱글빠 블로그,https://blog.naver.com/wraith12,20200208
"하늘과 바다 '바이오쇼크 <b>콜렉션</b>', 트레일러 공개",https://blog.naver.com/uncharted662?Redirect=Log&logNo=220750594108,The Bioshock Collection 바이오쇼크 <b>콜렉션</b> 발표 트레일러 어제까지만 해도 저는 루머였던 게임의 글을 올렸는데 오늘은 루머가 아닌 발매될 예정인 바이오쇼크 리마스터 <b>콜렉션</b>을 주제로 글을 쓰자니 기분이... ,게임 View,https://blog.naver.com/uncharted662,20160701
호텔침구 <b>콜렉션</b> 코튼렛 고급지네~,https://blog.naver.com/poohrang_kr?Redirect=Log&logNo=220969035810,<b>콜렉션</b> 코튼렛 고급지네~ 요즘 호텔침구 스타일로 많이들 하시죠?^^ 저 역시 침구 스타일에 관심이 너무나 많지만....^^ 그 동안 계속 바꿔야지 하면서 못바꾸고 있다가 이번 기회에 너무나 예쁜 호텔<b>콜렉션</b> 제품... ,★슈가슈가★,https://blog.naver.com/poohrang_kr,20170328
"돌아오는 크리스마스, 나에게 줄 선물 1호 스마트 <b>콜렉션</b>",https://blog.naver.com/cjhmk?Redirect=Log&logNo=20200983851,스마트<b>콜렉션</b>으로 정해봤습니다 물론 우리나라에서는 구할 수 없기에 해외에서 구해야겠습니다 별루 이쁜 것도 없을 것같아서 찾아보지도 않았지만... 맙먹고 찾아보니 스마트도 <b>콜렉션</b>이 이쁜게 많더군요... ,올드타이머의 즐거운 라이프,https://blog.naver.com/cjhmk,20131211
중년여성의류 프라다 다운패딩 신재호<b>콜렉션</b>,https://blog.naver.com/kwc3388?Redirect=Log&logNo=222205004958,중년여성의류 프라다 다운패딩 신재호<b>콜렉션</b> https://smartstore.naver.com/shinjaeho_collection 다운패딩의 기능성에 밍크의 고급이 더해진 상품입니다. 넓은 카라에 충전재는 다운으로 추운날에 몸을... ,삶에 대해 너그러움을~~,https://blog.naver.com/kwc3388,20210112
드래곤볼 메카<b>콜렉션</b>.,http://tokang.egloos.com/5890721,"메카<b>콜렉션</b>이다!! 토리야마 아키라의 메카닉 디자인 아주 좋아함. 그래서 발표 때부터 기다려왔던... 만화책처럼, 메카<b>콜렉션</b>도 박스 옆면이 차례로 이어진다. 폰트 디자인도 만화책이랑 비슷하게 꾸며서 재밌다.... ",♠또깡이 窮狀 茶飯事♠,http://tokang.egloos.com/,20170527
언차티드: 네이선 드레이크 <b>콜렉션</b> / 저니 무료 배포 진행 중.,https://blog.naver.com/jwa00700?Redirect=Log&logNo=221911517366,현재 플레이스테이션 스토어에서 언차티드: 네이션 드레이크 <b>콜렉션</b>과 저니의 무료 배포를 진행... 언차티드: 네이선 드레이크 <b>콜렉션</b>과 저니는 한국 시간으로 4월 16일 정오 12시 부터 5월 6일 정오 12시 까지... ,Groovy,https://blog.naver.com/jwa00700,20200416
"[Tomytec]트레일러 <b>콜렉션</b>8탄, UD 쿠온 CNC 라인 컨테이너",https://blog.naver.com/fmspf14?Redirect=Log&logNo=221839419206,트레일러 <b>콜렉션</b> 8탄. 학수 고대하던 40피트 컨테이너 운반 차량이 나왔네요. UD 쿠온 트레일러 캡과 CNC(cheng lie navigation Co. Ltd)사의 컨테이너 조합입니다. CNC이 회사는 찾아보니 대만 회사이군요. 일본 회사와... ,The Sharp Blog,https://blog.naver.com/fmspf14,20200305
토니모리  홀리데이<b>콜렉션</b>! 부팡 콜라보 아이섀도우 요물이네,https://blog.naver.com/chois909?Redirect=Log&logNo=221739570299,토니모리 홀리데이 <b>콜렉션</b> !/ 부팡 콜라보 아이섀도우 요물이네 이제 연말이 다가와 다양한 뷰티브랜드에서도 홀리데이 <b>콜렉션</b>의 제품들이 나오네요! 저는 구중에서도 홀리데이 <b>콜렉션</b> 중에서 토니모리의 2019... ,"까르멩 뷰티, 패션",https://blog.naver.com/chois909,20191219
이니스프리 미키와 친구들 <b>콜렉션</b>. 미키&amp;미니 파우치,https://blog.naver.com/jiminihoi86?Redirect=Log&logNo=221764893501,"(나이먹고 이직하는게 힘든거구만..) 여튼 좀 늦어지게 된 2020년 새해 첫 포스팅은 1월1일 새해 첫 날, 새해 첫 지름이었던 #이니스프리 #미키마우스 <b>콜렉션</b>! 이니스프리 Hello 2020 미키와 친구들 <b>콜렉션</b> 선공개... ",Maximal Life,https://blog.naver.com/jiminihoi86,20200109
다이소 <b>콜렉션</b> 케이스 구매 후기,https://blog.naver.com/namfb?Redirect=Log&logNo=221562958963,"친구 집 근처 다이소에서 발견한 <b>콜렉션</b> 케이스입니다! 계단형, 와이드형으로 총 2개 있는데 아쉽게도... ㅎㅎ 이렇게 모든 니이텐고를 다이소 <b>콜렉션</b> 케이스에 넣었습니다. 가격도 저렴해서 나쁘지 않은 것... ",남하루의 공간,https://blog.naver.com/namfb,20190615
"COLLECTION 디 <b>콜렉션</b> 런칭, 여자 구두 쇼핑은 현대백화점... ",https://blog.naver.com/tlswlgprjt?Redirect=Log&logNo=221950237929,"COLLECTION 디 <b>콜렉션</b> 런칭, 여자 구두 쇼핑은 현대백화점 판교점에서! 안녕하세요, 딘디입니다. 오늘은 닥스 슈즈 D. COLLECTION 디 <b>콜렉션</b> 런칭 소식과 함께 현대백화점 판교점 매장 소개해드릴게요. 신발들이... ",딘디 패션 블로그,https://blog.naver.com/tlswlgprjt,20200507
시골집 욕실리모델링 이누스바스 포항대리점 스톤<b>콜렉션</b> 포항욕실,https://blog.naver.com/kmn7313?Redirect=Log&logNo=222087029558,신광읍 신광주택 시골집 욕실리모델링 이누스바스 포항대리점 스톤<b>콜렉션</b> 포항욕실 안녕하세요. 이누스바스 포하대리점 입니다. 최근 작업을 마친 신광읍 시골집 욕실리모델링 현장입니다. 욕실이 엄청나게... ,이누스바스 포항 북구 대리점 010.8589.7313,https://blog.naver.com/kmn7313,20200911
"실물샷 OST x 카드캡터체리 2차 <b>콜렉션</b> 별의 열쇠시계, 꿈의... ",https://blog.naver.com/tjddn900?Redirect=Log&logNo=221839619687,"실물샷 OST x 카드캡터체리 2차 <b>콜렉션</b> 별의 열쇠시계, 꿈의 지팡이 멀티참 키링 저의 생활 반경에서 걸어서 2분 거리에 OST가 있거든요!! 제가 또 카드캡터체리 2차 <b>콜렉션</b>을 놓칠 수가 없어서...오에스티가 멀리... ",★핑스우먼★,https://blog.naver.com/tjddn900,20200306
REISS 윈터 럭셔리 <b>콜렉션</b> - 양털 가죽 &amp; 울 코트,https://blog.naver.com/rosie_kwon?Redirect=Log&logNo=221714085207,럭셔리 <b>콜렉션</b>의 에비에이터 스타일의 레더 자켓 입니다. 안쪽은 양털이고 바깥은... 겨울 <b>콜렉션</b> 세일 가격 저희 샵에서 확인하시고 구매도 샵에서 진행해주세요 :) http... ,런던스토어 since 2011,https://blog.naver.com/rosie_kwon,20191121
포항 송도동 주택 욕실 리모델링 이누스바스 스톤 <b>콜렉션</b>... ,https://blog.naver.com/kmn7313?Redirect=Log&logNo=222102018381,포항 송도동 주택 욕실 리모델링 이누스바스 스톤 <b>콜렉션</b> 이누스바스 포항대리점 안녕하세요.이누스바스 포항대리점입니다. 추석 연휴전 마지막 현장입니다. 송도동에 위치한 주택욕실이구요. 2층계단밑에... ,이누스바스 포항 북구 대리점 010.8589.7313,https://blog.naver.com/kmn7313,20200928
"강변역 횟집 아니 숙성회집, 구의동 맛집 찜하다. 쉐프의<b>콜렉션</b>",https://blog.naver.com/cp_md?Redirect=Log&logNo=221714399782,"강변역 숙성회 쉐프의<b>콜렉션</b> 우리집, 강변역근처에 맛집을 발견했다. 이날저녁은 친구님께서 한턱쏘는... 숙성회 <b>콜렉션</b> 나왔습니다. 조금 먹다보니 방어도 또 나오고~ 앞사진은 2인용, 뒷사진은 3인용. 1명... ",용과장의 캠핑 스토리~,https://blog.naver.com/cp_md,20191121
RE-MENT 포켓몬 플로랄 컵 <b>콜렉션</b> -이상해풀-,https://blog.naver.com/good201133?Redirect=Log&logNo=221451237835,안녕하세요~ 저번 포스팅에서는 리멘트에서 나온 플로랄 컵 <b>콜렉션</b>의 '뮤'를 소개해드렸습니다. 뭔가... (아무래도 홀케이스 박스 사진은 계속 애용할 듯.ㅋㅋㅋㅋ) RE-MENT 포켓몬 플로랄 컵 <b>콜렉션</b>... ,두근두근 리뷰랜드,https://blog.naver.com/good201133,20190125
한남동 밥집 <b>콜렉션</b> - 한식편 ②,https://blog.naver.com/tqfa1604?Redirect=Log&logNo=221549129028,지난번 올려드렸던 한남동 밥집 <b>콜렉션</b> 한식편의 마무리를 해보려 합니다. 거두절미하고 바로 시작할게요 ㅎㅎ 컬리너리 맨션 - 88 부대찌개 혼밥 부대찌개가 가능한 곳 한남동 밥집 <b>콜렉션</b> 두번째에서 처음으로... ,고독한 미식가,https://blog.naver.com/tqfa1604,20190529
몽우조셉킴<b>콜렉션</b>소식( &quot;어디서나그리미다&quot;展 파주헤이리마을 ),https://blog.naver.com/mongwookim?Redirect=Log&logNo=221305787755,"-전시기간: 6,17(일)~7,1(일) -전시주최: (사)헤이리 -전시주관: (사)헤이리 예술위원회 -전시후원: 문화체육관광부, 파주시 몽우조셉킴<b>콜렉션</b>은 갤러리와 컴프하우스,류재은베이커리에서 진행됩니다.미리... ",Mongwoo JosephKim Collection 몽우 조셉킴 콜렉션,https://blog.naver.com/mongwookim,20180624
이영주2013 SS <b>콜렉션</b> &quot;협력과 상생을 통한 새얼굴&quot;,https://blog.naver.com/semisung?Redirect=Log&logNo=222168001096,"#세미성 #이영주<b>콜렉션</b> #이영주쇼 #디자이너주얼리 #도산공원주얼리 #세자매 Location: Ilumina... 2013년 이영주SS<b>콜렉션</b>은 바로 이웃들과 함께 협업으로 만들어낸, ‘콜라보레이션’ 의... ","아름다운 디자인 세상 ""세미성""",https://blog.naver.com/semisung,20201209
더킹 영원의 군주 이민호 시계 론진 마스터 <b>콜렉션</b>,https://blog.naver.com/azpace?Redirect=Log&logNo=221924866282,마스터 <b>콜렉션</b> 문페이즈입니다. 더킹 영원의 군주 1회에서 론진 마스터즈 시리즈의 매력을 확실하게 보여주는 장면이 등장합니다. 이민호의 승마 장면에 등장하는 마스터 <b>콜렉션</b>... ,Watchcloser,https://blog.naver.com/azpace,20200423
미쳐따...이니스프리 미키와친구들 <b>콜렉션</b> 전제품입니닷... ,https://blog.naver.com/cchokkong?Redirect=Log&logNo=221754276272,신년 <b>콜렉션</b>을 려고 합니다. (제 블로그에서 처음 소개하는 2020년 뷰티템이네요) 바로바로 이니스프리 디즈니콜라보 &lt;HELLO 2020 미키와 친구들 <b>콜렉션</b>&gt; 역시 비주얼이 예상대로 아기자기 귀여움 그... ,쵸콩,https://blog.naver.com/cchokkong,20191230
다라이어스 코즈믹 <b>콜렉션</b>,https://blog.naver.com/jotaro78?Redirect=Log&logNo=221478386859,다라이어스 <b>콜렉션</b>이 드디어 발매가 됐습니다. 아마존과 에비텐 한정 티아트 버전 오디오 트랙으로... 코즈믹 <b>콜렉션</b>은 원래 언션트(ancient) <b>콜렉션</b>이라는 타이틀로 내려 했다더군요. ancient=고대(古代)의.... ,SUPER CD-ROMROM,https://blog.naver.com/jotaro78,20190302
장폴 고티에 패션쇼 2012년 봄-여름 <b>콜렉션</b>,https://blog.naver.com/rewlonghui?Redirect=Log&logNo=80145980730,이번 Jean Paul Gaultier 장폴 고티에의 2012년 봄 여름 프레타 포르테(기성복) <b>콜렉션</b>이 그의... 벨기에 타투예술작가 Wim Delvoye 빔 델보이가 장폴 고티에의 2012년 봄 여름 시즌 <b>콜렉션</b>에... ,시크먼트 블로그,https://blog.naver.com/rewlonghui,20111119
"[코너의 게임블로그]헤일로 마스터 치프 <b>콜렉션</b>, PC 버전 출시... ",https://blog.naver.com/kdww1203?Redirect=Log&logNo=221487621364,"지난 몇년간 꾸준히 PC버전 출시 루머가 돌던 헤일로 시리즈의 합본 버전, 헤일로:마스터 치프 <b>콜렉션</b>의 PC버전 출시가 확정되었다는 소식이 전해졌습니다. △헤일로 마스터 치프 <b>콜렉션</b> PC 버전 공식... ",코너의 게임블로그,https://blog.naver.com/kdww1203,20190313
"아우구스틴(어거스틴), 어 럭셔리 <b>콜렉션</b> 호텔... ",https://blog.naver.com/cztseoul?Redirect=Log&logNo=222057730680,"©Augustine hotel Prague 아우구스틴, 어 럭셔리 <b>콜렉션</b> 호텔 프라하 (어거스틴, 어 럭셔리 <b>콜렉션</b> 호텔 프라하) 는 프라하 성 아래, 카를교 근처에 위치한 5성급 #호텔 입니다. 마치 #프라하 중심부의 오아시스... ",체코관광청 공식 블로그,https://blog.naver.com/cztseoul,20200811
Mother of Pearl 런던 디자이너 - 합리적인 가격대의 <b>콜렉션</b>,https://blog.naver.com/rosie_kwon?Redirect=Log&logNo=221929243431,Mother of Pearl 런던 디자이너 <b>콜렉션</b>은 100만원이 넘는 쉽게 입어보기 힘든 브랜드 이지만 저렴한 가격으로 백화점에 론칭된 <b>콜렉션</b>으로 만나보세요 ~ Mother of Pearl 런던 디자이너... ,런던스토어 since 2011,https://blog.naver.com/rosie_kwon,20200425
신상입고)네스트로브 2021SS <b>콜렉션</b> 북 사은품/네스트로브... ,https://blog.naver.com/ionezung?Redirect=Log&logNo=222258423678,"일본은 브랜드별로 가끔 <b>콜렉션</b> 북을 출시하는데, 사은품이 정말 좋죠. 착한가격에 품질좋은... 네스트로브 <b>콜렉션</b> 북은 출시되면 언제나 인기있는거 아시죠. 오늘 방금 출시되었습니다. 착한 가격에... ",도쿄몽키,https://blog.naver.com/ionezung,20210227
어머니의 냉장고 자석 <b>콜렉션</b>&quot;,https://blog.naver.com/sneedle?Redirect=Log&logNo=220938068866,(어머니께서 525일간 품에 넣고 다니셨던 누나 사진도 있네요 ㅋㅋ) 자석 말고 기념품 <b>콜렉션</b>도 어마어마합니다. 어머니 그냥 박물관 오픈하셔도 될 것 같아요 ㅋㅋ 각국에서 공수해온 작은 기념품들과... ,"여행작가 태원준""",https://blog.naver.com/sneedle,20170217
FC서울 레트로 <b>콜렉션</b> 1995★1996 서울 시민들의 함성으로... ,https://blog.naver.com/freesun978?Redirect=Log&logNo=222433906689,FC서울 레트로 <b>콜렉션</b> 1995★1996 서울 시민들의 함성으로 가득했던 1995년. 동대문운동장에서의 추억을 기억하며 FC서울 레트로 <b>콜렉션</b> 1995★1996 판매기간: 7월 20일 (화) 13시 ~ 7월 24일 (토)... ,선문학의 비바스포츠,https://blog.naver.com/freesun978,20210716
[tea collection] 티<b>콜렉션</b>...미국브랜드,https://blog.naver.com/and241?Redirect=Log&logNo=220143801011,tea collection 티 <b>콜렉션</b> 요즘 브랜드 소개하는 재미에 저도 덩달아 카트놀이에 버닝하고 있어요. 오늘 소개할 브랜드는 티컬렉션/ 티<b>콜렉션</b> 머라고 써야할지 ㅋㅋ 요건 제가 아마존 직구에 한참 불붙었을때 정말... ,힘내 데이빗!,https://blog.naver.com/and241,20141007
"어쌔신 크리드 에지오 <b>콜렉션</b>, 다시 돌아온 에지오",https://blog.naver.com/uncharted662?Redirect=Log&logNo=220814170330,"에지오 <b>콜렉션</b>입니다. 유비소프트 공식 유튜브 채널에서 트레일러가 공개되었으며 현재... 에지오 <b>콜렉션</b>에는 어쌔신크리드 2, 어쌔신크리드 브라더후드, 어쌔신크리드 레벨레이션이 포함되어있으며... ",게임 View,https://blog.naver.com/uncharted662,20160917
남코 <b>콜렉션</b> 6월 18일 발매! 추억의 레트로 게임들을 닌텐도... ,https://blog.naver.com/ideungam?Redirect=Log&logNo=221882385083,남코 <b>콜렉션</b>( NAMCOT COLLECTION)은 남코에서 NES(패미컴) 소프트로 발매되었던 NAMCOT 시리즈의 모음집이라고 할 수 있는데요. 당시의 타이틀들을 닌텐도 스위치에서 자유롭게 골라서 즐기실 수 있는 <b>콜렉션</b>... ,게임앤리뷰,https://blog.naver.com/ideungam,20200331
잇츠룸 <b>콜렉션</b> 매거진,https://blog.naver.com/hj5864?Redirect=Log&logNo=222425733023,"나날이 늘어가는 It's room만의 색깔 있는,, 2021년 7월의 여러 <b>콜렉션</b> 신간 잡지들을 소개합니다. '잡지들의 표지색' 만으로도,, 올 여름의 쨍함이 내려쬐는 듯 합니다. 언제나... ",It's room,https://blog.naver.com/hj5864,20210709
원피스 아카이브 <b>콜렉션</b> 쥬라클 미호크,https://blog.naver.com/mugiwarajin?Redirect=Log&logNo=221225603174,"플렉스 원피스 아카이브 <b>콜렉션</b> 쥬라클 미호크 ワンピースアーカイブコレクション ジュラキュール・ミホーク 원피스 아카이브 <b>콜렉션</b>의 신제품은 왕하칠무해,세계 최강의 검사! 쥬라클 미호크。 검정... ",무기와라장터,https://blog.naver.com/mugiwarajin,20180310
3번째 꾸먕다꾸 <b>콜렉션</b>,https://blog.naver.com/yesull?Redirect=Log&logNo=222130245276,쉴 새 없이 1번째 <b>콜렉션</b>부터 우다다 포스팅 중인 꾸먕사장... 미리미리 꾸준히 포스팅 해오지 않은 것에 대한 업보가 쌓인 것..! 꾸먕다꾸 <b>콜렉션</b>은 사진이 늘 많기 때문에! 이번에도!! 무제한... ,"꿈꾸는 양, 꾸먕 블로그",https://blog.naver.com/yesull,20201029
[넨도로이드] 함대<b>콜렉션</b> - 공모 오급,http://rosen0.egloos.com/3107729,"넨도로이드로 나온 함대<b>콜렉션</b>..칸코레시리즈 공모 오급 입니다. 항공모함인 적 캐릭터죠.. 오~ 오... 함대<b>콜렉션</b> 포스트 메타 정보 퍼블리싱 및 추천 내보내기 밸리 : 토이 2014/08/16 10:51 태그 : 칸코레 , 넨도... ",무제..,http://rosen0.egloos.com/,20140816
강변역 쉐프의 <b>콜렉션</b> 숙성회/사시미바,https://blog.naver.com/gnffk0353?Redirect=Log&logNo=222412389599,쉐프의 <b>콜렉션</b>으로 갔어요 1년전에도 왔었던 곳인데.. 그때는 고등어봉초밥이 맛있었던 기억과 가격이... 쉐프의<b>콜렉션</b>은 분위기와 술을 즐기며 간단하게 배채우기에는 너무 좋은 곳 :) 나 같이 많이 먹는 사람은... ,깐따삐아지구별,https://blog.naver.com/gnffk0353,20210628
[넨도로이드] 함대<b>콜렉션</b> - 시마카제,http://rosen0.egloos.com/3090128,"함대<b>콜렉션</b>의 시마카제 입니다. 꽤나 인기가 많은 함선? 이라고 하던데... 뭐 저도 예전에 잠깐 했을땐... 신고 태그 : 피규어 , 넨도로이드 , 넨도 , 칸코레 , 함대<b>콜렉션</b> , 시마카제 포스트 메타 정보 퍼블리싱 및... ",무제..,http://rosen0.egloos.com/,20140511
메가하우스 코스모플리트 <b>콜렉션</b> 네오지온 그와단,https://blog.naver.com/mchjhs?Redirect=Log&logNo=222388464819,메가하우스의 코스모플리트 <b>콜렉션</b> 시리즈의 세번째 소개작... 기동전사 Z건담에 나왔던 엑시즈의 기함인 그와단. 하만칸과 미네바 자비가 탑승했던 바로 그 전함이다...그리고 탑승된 모빌슈트 중 대표격인... ,또정이랑 다영이랑™,https://blog.naver.com/mchjhs,20210611
배트맨1~4 포스터 <b>콜렉션</b>,https://blog.naver.com/connell3?Redirect=Log&logNo=50072302254,"배트맨 씨리즈 포스터 <b>콜렉션</b> 배트맨씨리즈 1탄부터 배트맨과로빈까지의 포스터 <b>콜렉션</b>입니다... 팀버튼의 배트맨 , 배트맨리턴스 그리고 죠엘슈마허의 배트맨포에버,배트맨과로빈 전부 소중한 배트맨... ",일어나라 로보트태권V,https://blog.naver.com/connell3,20090924
하스브로 마블 레전드 시리즈 '샹치와 텐 링즈의 전설' <b>콜렉션</b>,https://blog.naver.com/connell3?Redirect=Log&logNo=222296746150,하스브로 마블 레전드 시리즈 '샹치와 텐 링즈의 전설' <b>콜렉션</b> 마블 시네마틱 유니버스 페이즈 4 극장판 두 번째 영화 '샹치와 텐 링즈의 전설' 개봉이 9월 3일로 미뤄지게 됐다. 따라서 프로모션도 생각보다 늦을... ,일어나라 로보트태권V,https://blog.naver.com/connell3,20210403
주문제작 2021년 다이어리_컬러<b>콜렉션</b>다이어리,https://blog.naver.com/patjjy?Redirect=Log&logNo=222226522471,"작년 연말에 주문이 많아 포스팅을 거의 못하고 있었는데요, 그중 제작을 가장 많이한 컬러<b>콜렉션</b> 다이어리의 표지각인 중 2021 로 요청하셨던 다이어리만 모아봤습니다. 컬러<b>콜렉션</b> 다이어리는 A6,B6&amp;A5... ",POLeSTAR,https://blog.naver.com/patjjy,20210131
[필립스 뉴 비바 <b>콜렉션</b> 블렌더 리뷰] 아사이볼 만들기~,https://blog.naver.com/yichihye?Redirect=Log&logNo=220456874368,[필립스 뉴 비바 <b>콜렉션</b> 블렌더 리뷰] 아사이볼 만들기~ 필립스 뉴 비바 <b>콜렉션</b>으로 만드는 아사이볼 올려봅니다. 우선 필립스 비바 <b>콜렉션</b> 블렌더 리뷰부터.... ^^ 보라보라한 색감의 필립스 뉴 비바 <b>콜렉션</b>... ,슬픈하품의 즐거운 홈베이킹!!,https://blog.naver.com/yichihye,20150820
"아파트화분, 인테리어화분, 조경화분(피오리<b>콜렉션</b>)",https://blog.naver.com/olive_1945?Redirect=Log&logNo=222323006213,"오늘은 피오레<b>콜렉션</b>을 소개하여 드리고자 합니다. 앤틱테라코타 <b>콜렉션</b>에 클래식한 고급스러움이 있었다면, 피오레<b>콜렉션</b>의 경우 모던한 세련됨이 장점입니다. 피오레<b>콜렉션</b>-모던이태리화분... ",이태리 대형화분 직수입 도소매 올리브1945,https://blog.naver.com/olive_1945,20210426
론진 마스터 <b>콜렉션</b> 6498 시계 판매합니다,https://blog.naver.com/cjhmk?Redirect=Log&logNo=222177505520,안녕하세요 론진 마스터<b>콜렉션</b> 6498 수동 태엽 시계를 판매합니다 가로 47.5mm크기로 파네라이 47mm크기만합니다 저 같은 개미손목은 커서 부담스럽죠 무브먼트는 ETA6498-1 입니다 2020년 12월 종로... ,올드타이머의 즐거운 라이프,https://blog.naver.com/cjhmk,20201218
앙리마티스 <b>콜렉션</b> 아트굿즈로 우리집 감성충전 :: 위드굿즈,https://blog.naver.com/topann?Redirect=Log&logNo=221715056881,마리앙티즈 <b>콜렉션</b> 하이볼 유리컵. 취저................. 라인이 완전 블랙컬러 라인이 아니라... 접혀있던 그대로 걸었더니 구깃하지만 앙리마티스 <b>콜렉션</b>의 감각이 느껴지는게 깔끔하고 심플하니... ,리얼부(富)라이어티 라이프,https://blog.naver.com/topann,20191122
[피규어]넨도로이드 함대<b>콜렉션</b>-칸코레- 시구레改2(굿스마일)... ,https://blog.naver.com/canals?Redirect=Log&logNo=220715061383,"넨도로이드 함대<b>콜렉션</b>-칸코레- 신작 시구레改2가 드디어 공개! 스케일 피규어로 나왔던 시구레와 같은 전투 포즈는 물론, 포도 양손으로 바꿔끼는것이 가능. 거기에 발사 이펙트 파츠는 물론, 비오는... ",아키토의 프로젝트C - 피규어&프라모델,https://blog.naver.com/canals,20160520
다니엘웰링턴 남자손목시계 Iconic Link <b>콜렉션</b> 소장각... ,https://blog.naver.com/kiyome24?Redirect=Log&logNo=221661399644,남자손목시계 는 역시 다니엘웰링턴 :) 아이코닉링크<b>콜렉션</b> 심플하면서도 매력 뿜뿜 ~!! 벌써 가을... 링크 <b>콜렉션</b> 2년만에 다니엘웰링턴에서 새롭게 출시한 메탈시계 랍니다 ^^ 남자손목시계와 여자손목시계가... ,지율이의 작은 부엌,https://blog.naver.com/kiyome24,20190927
