title,link,description,bloggername,bloggerlink,postdate
향수추천 르퍼퓸 베르두 <b>콜렉션</b> 그랑크뤼 4종 세트 EDP,https://blog.naver.com/mingming_93?Redirect=Log&logNo=221671195028,베르두 <b>콜렉션</b> 그랑크뤼 4종 세트를 주문해봤답니다 패키지부터도 너무 제 스타일인 베르두 <b>콜렉션</b>이에요 베르두 향수는 세계의 가장 아름다운 장소를 여행하며 받은 영감을 최상의 원료를 사용해 담아낸... ,해피밍의 해피한 일상 ♥ㅅ♥,https://blog.naver.com/mingming_93,20191007
[블루레이] 더티 해리 1.2.3.4.5  <b>콜렉션</b>,https://blog.naver.com/conradmajors?Redirect=Log&logNo=222379857842,더티 해리 1.2.3.4.5 블루레이 컴플리트 <b>콜렉션</b> 세트 . 재입고 상품 [블루레이] 더티 해리 1 (DIRTY... 블루레이 박스 <b>콜렉션</b> (영국판. 코드프리. 총디스크 5장. 영어자막) 비닐도 안 뜯은 밀봉... ,스티브의 해외 DVD,https://blog.naver.com/conradmajors,20210601
JTO AR의 골드 리미티드 에디션과 2021년 SS 선글라스 <b>콜렉션</b>... ,https://blog.naver.com/m_optique?Redirect=Log&logNo=222274281878,뉴 <b>콜렉션</b>이에요 :) Previous image Next image 라운드 형태의 오버사이즈 제품 Previous image Next image 올해 출시된 JTO 선글라스는 실루엣이 얇아 부담없이 착용하기 좋을 거 같아요 ;0 JTO... ,MAISON OPTIQUE,https://blog.naver.com/m_optique,20210313
노리다케 9612 스튜디오 <b>콜렉션</b>,https://blog.naver.com/cherryhs?Redirect=Log&logNo=222005359523,아마도 처음이자 마지막으로 들이는 스튜디오 <b>콜렉션</b>이자 쉐입. 스튜디오 <b>콜렉션</b>은 지금 '노리다케의 숲'이 있는 나고야 노리다케 공장에서 (스리랑카 OEM으로 이전하기 전에) 장인들이 공들여서 만든... ,A L'APRES-MIDI,https://blog.naver.com/cherryhs,20200618
장 뤽 고다르 <b>콜렉션</b> DVD 판매,https://blog.naver.com/flyneo?Redirect=Log&logNo=222290777104,"(1) 장 뤽 고다르 <b>콜렉션</b> DVD : 5만원 사랑과 경멸 2p, 미치광이 삐에로, 네 멋대로 해라 총 4P구성입니다 작은 브로셔도 포함되어 있습니다. 장 뤽 고다르 <b>콜렉션</b> (4디스크) : 3만원 (판매완료) 국외자들, 주말... ",예술을 사랑하는 여자,https://blog.naver.com/flyneo,20210328
[이런 것도 모으냐] '건프라 패키지 아트 <b>콜렉션</b> 쵸코 웨하스... ,https://blog.naver.com/batman691?Redirect=Log&logNo=222125177621,아트 <b>콜렉션</b> 쵸코 웨하스 2' 입니다. 모두 익숙한 단어인데 조합해 놓으니 '엥?!' 이런 느낌이 드는 것도 당연.. 쵸코 맛 웨하스 제품에 들어있는 트레이딩 카드 <b>콜렉션</b>인데 얼마 전부터 건프라 박스아트... ,신무바이 피규어 & 건프라 SHOW,https://blog.naver.com/batman691,20201024
프라우드메리 앰플 미니<b>콜렉션</b> 고민별로 바르니까 좋음!,https://blog.naver.com/goddnsdl89?Redirect=Log&logNo=222073621065,이때 나에게 해결책을 제시해준 화장품이 있는데 #프라우드메리 #앰플미니<b>콜렉션</b> 이다. 프라우드메리 앰플 미니<b>콜렉션</b> 민감쓰한 피부를 위해서 올바른 솔루션을 제시해주는 PROUD MARY는 이미 내가 한번 사용한... ,♥끄적이는나의일상들♥,https://blog.naver.com/goddnsdl89,20200828
나이키 스투시 에어 줌 쿠키니 <b>콜렉션</b> 발매소식,https://blog.naver.com/red_pc?Redirect=Log&logNo=222039333796,나이키 스투시 에어 줌 쿠키니 <b>콜렉션</b> 발매 소식. 국내에서 신발의 경우 카시나를 통해서 응모가... 이전에 나이키 스투시 스피리돈 케이지드2 <b>콜렉션</b>의 경우에도 인기가 많았고 신발은 지금까지도 60만원대의... ,누들킴,https://blog.naver.com/red_pc,20200723
프랑스향수 베르두<b>콜렉션</b> 세계9곳명소의 향기를 모아요,https://blog.naver.com/lovmaria?Redirect=Log&logNo=221658442259,베르두 <b>콜렉션</b> 그랑크뤼 아르즈 엘 라브 100ml 오드퍼퓸 베르두 <b>콜렉션</b> 그랑크뤼 오드퍼퓸은 세계의 이국적인 장소를 향기로 이야기하고 있어요. 향수 자체가 굉장히 로맨틱 하지 않나요?? ㅎㅎ 향기로 하는... ,Beauty Days,https://blog.naver.com/lovmaria,20190925
프리미엄 반다이  주술회전 모듬 <b>콜렉션</b>EX [2차：2021년... ,https://blog.naver.com/mugiwarajin?Redirect=Log&logNo=222396487680,프리미엄 반다이 주술회전 모듬 <b>콜렉션</b>EX [2차：2021년 9월출시] 呪術廻戦 あそーとこれくしょんEX【2次：2021年9月発送】 &quot;주술회전 모음집&quot; 최신탄이 가샤폰 온라인에 등장! 제1탄 가챠폰 오리지널... ,무기와라장터,https://blog.naver.com/mugiwarajin,20210613
"1865와인 셀렉티드 <b>콜렉션</b> 피스코 배럴 에이지드, 칠레와인 추천",https://blog.naver.com/msjh1012?Redirect=Log&logNo=222172604703,1865 셀렉티드 <b>콜렉션</b> 피스코 배럴 에이지드 1865 셀렉티드 <b>콜렉션</b>은 비냐 산 페드로가 가진 150년 이상의 와인 메이킹 노하우를 집대성한 1865 최상위 레인지로 70년 이상 올드바인에서 수확한 포도로 만든 OLD... ,난 그냥 소녀로 남을래,https://blog.naver.com/msjh1012,20201213
지안프랑코 로시 블루레이 <b>콜렉션</b>,https://blog.naver.com/drfacokr?Redirect=Log&logNo=222258428211,너무나 반가운 지안프랑코 로시 블루레이 <b>콜렉션</b> 거금을 들여 구입하고 말았습니다. 조만간 다큐멘터리 번역에서 이제 장인의 경지에 오른 macine 님의 번역으로 만나보겠습니다. JONATHAN...좋은... ,동검도 DRFA 365 예술극장 (예약은 www.drfa.co.kr),https://blog.naver.com/drfacokr,20210227
나만의 다프트펑크 <b>콜렉션</b>,https://blog.naver.com/kimtake85?Redirect=Log&logNo=222174514421,"길다면 길고, 짧다면 짧았던 시간이였지만 조금씩 모으다보니 '다프트펑크 <b>콜렉션</b>' 이라고 부르고싶은 저만의 작은공간을 하나 마련해줬네요 ^^ 다프트펑크 제품자체가 그리 많이 나온편은 아닙니다. 대부분이... ",미노,https://blog.naver.com/kimtake85,20201215
[호주 와인] 로손 리트리트 <b>콜렉션</b> 카베르네 소비뇽,https://blog.naver.com/vivien_jy?Redirect=Log&logNo=222141857780,이마트에서 구입한 로손 리트리트 <b>콜렉션</b> 카베르네 소비뇽 호주와인입니다 요즘 와인에 꽂혀서 와인... 로손 리트리트는 1995년에 출시되었는데요 로손 리트리트 <b>콜렉션</b>은 매해 수석 와인메이커가 기대했던... ,뭘 해도 어설픈 ♥ PARK JI ♥,https://blog.naver.com/vivien_jy,20201111
고품격 프리미엄 베딩 세사리빙 익스클루시브 <b>콜렉션</b>,https://blog.naver.com/sesaliving2022?Redirect=Log&logNo=222149444996,"고품격 프리미엄 베딩으로새롭게 탄생한 세사리빙의 익스클루시브 <b>콜렉션</b>을 소개합니다. 집먼지... 미끄러듯이 닿는 부드러운 터치감, 그리고 99.9%의 항균 기능까지, 프리미엄 <b>콜렉션</b> 세사리빙 프리지아를... ",세사리빙,https://blog.naver.com/sesaliving2022,20201120
[반다이] 주술회전 캡슐 피규어 <b>콜렉션</b>(가챠),https://blog.naver.com/drcpa?Redirect=Log&logNo=222225461123,"&lt;출처: 구글&gt; '주술회전 캡슐 피규어 <b>콜렉션</b>' 라인업은 상당히 준수했습니다. 이타도리 유우지, 후시구로 메구미, 쿠기사키 노바라 고죠 사토루, 고죠 사토루(마스크없음ver.) 일단 중고장터와 일본 대행구매를... ",AMA:Z:ONE,https://blog.naver.com/drcpa,20210130
슈퍼마리오 올스타 <b>콜렉션</b> 인형(마리오),https://blog.naver.com/kyu2733?Redirect=Log&logNo=222074608165,비닐에 싸인 마리오인형 슈퍼마리오 올스타 <b>콜렉션</b> 인형(마리오) 뒷모습은 그저 그렇다. 택앞면(마리오의 그림이 있다.) 택을 열면 일본어로 된 글이 있는데 일본어를 잘모르므로 패쓰 택 뒷면(제조국이 중국이... ,ESSE,https://blog.naver.com/kyu2733,20200829
"메트로시티 귀걸이, 목걸이 추천 꾸오레 주얼리 <b>콜렉션</b>",https://blog.naver.com/tonyforlife?Redirect=Log&logNo=222266108041,"메트로시티 목걸이, 귀걸이 추천 꾸오레 주얼리 <b>콜렉션</b> 가방 맛집으로 유명한 메트로시티에서 신상 주얼리 컬렉션을 출시했어요. 삶의 가치를 빛내주는 이탈리아 헤리티지를 담은 꾸오레 라인이 바로 그... ",리지와 함께 뷰티리셔스,https://blog.naver.com/tonyforlife,20210306
[드래곤볼 메카<b>콜렉션</b>] 야무치의 마이티마우스호,https://blog.naver.com/misti3?Redirect=Log&logNo=222113062687,jpg 짜라 - 넵 드래곤볼입니다ㅎㅎㅎ 드래곤볼 메카<b>콜렉션</b>으로 반다이에서 나오는 프라모델인데요 저는... 메카<b>콜렉션</b> 야무치의 마이티마우스호 이쑤시개 도색 방법 https://youtu.be/Qw05v0S-LjQ 그리고 완성리뷰는... ,도색하는미녀의 건담 콜로니,https://blog.naver.com/misti3,20201012
장루이다비드 2018-2019 FW <b>콜렉션</b> 'DOUBLE JE',https://blog.naver.com/jld2013?Redirect=Log&logNo=221403151025,"장루이다비드 JEAN LOUIS DAVID 2018-2019 FW <b>콜렉션</b> 'DOUBLE JE' DOUBLE JE 2018-2019 FW <b>콜렉션</b> 장루이다비드는 새로운 <b>콜렉션</b>으로 스타일의 교훈을 제공한다. 순수하고, 시원하며, 트렌디한 블랙&amp;화이트... ",장루이다비드 코리아,https://blog.naver.com/jld2013,20181121
[피규어] 배틀 레코드 <b>콜렉션</b> ~ 몽키.D.루피,https://blog.naver.com/ithwlsi55?Redirect=Log&logNo=222053014058,역시나 짝꿍님께 선물 받았던 제품들의 리뷰가 계속 되는 중..!!ㅎ &quot;배틀 레코드 <b>콜렉션</b>&quot;이라는... 시리즈가 계속 이어질지 어쩔지도 모르겠지만... 암튼 만족스런 &quot;배틀 레코드 <b>콜렉션</b> 루피&quot; 였다고 한다!!,♥사과나무♥,https://blog.naver.com/ithwlsi55,20200806
[PS4] 알레스터 <b>콜렉션</b>,https://blog.naver.com/jayp36?Redirect=Log&logNo=222305528628,플레이하다 보면 이걸 내가 왜 플스4로 하고 있나 싶기도 한데... 게임 자체는 재밌으니 하는 거겠죠^^ #플스4 #PS4 #알레스터 #알레스터<b>콜렉션</b> #aleste #m2 #슈팅게임 #레트로게임,TIME2REST,https://blog.naver.com/jayp36,20210410
쿠키런 미스테리 피규어 <b>콜렉션</b> 시즌1,https://blog.naver.com/holyzard79?Redirect=Log&logNo=222087914029,데브시스터즈(Devsisters)에서 서비스 중인 모바일 게임 쿠키런의 등장 쿠키들을 피규어로 발매한 제품으로 제품명은 쿠키런 미스테리 피규어 <b>콜렉션</b> (CookieRun Mystery Figure Collection) 입니다. 제가 올리는... ,holyzard's Blog,https://blog.naver.com/holyzard79,20200913
"테헤란로 237 (르네상스 파크, 강남 메리어트 럭셔리 <b>콜렉션</b>)... ",https://blog.naver.com/lhkny96?Redirect=Log&logNo=222090096318,지난번 메리어트 럭셔리 <b>콜렉션</b> 입점 소식에 이어 아마존이 임차한다는 소문이 있던데 테헤란로... 이번 메리어트 럭셔리 <b>콜렉션</b> 입점도 그렇고 르네상스 파크를 두고 신세계에서 적극 투자를 진행하는... ,YKTM_You Know That Mean,https://blog.naver.com/lhkny96,20200915
"에픽게임즈 무료배포 소식 - 히트맨, 섀도우런 <b>콜렉션</b> (200828)",https://blog.naver.com/dbsgns2011?Redirect=Log&logNo=222073096503,섀도우런 <b>콜렉션</b>(Shadowrun Collection)의 배포를 진행하고 있습니다. 오늘 소개하는 이 두 게임들은 9월... com/store/ko/product/hitman/standard-edition 섀도우런 <b>콜렉션</b> - https://www.epicgames.com/store/ko/bundles/shadowrun... ,청비대제(청룡비둘기)의 휴식공간,https://blog.naver.com/dbsgns2011,20200828
일본전통 인형공예품의 <b>콜렉션</b>. 군마현 우사부로 코케시... ,https://blog.naver.com/shoudai?Redirect=Log&logNo=222275923410,"일본전통 인형공예품의 <b>콜렉션</b> 군마현 우사부로 코케시(卯三郎こけし) 오사카야 료칸에서 받은 작은 할인 쿠폰. 이 쿠폰만으로 봐서는 딱히 엄청 매력적인 장소라는 생각은 들지않았지만, 코케시(일본전통... ",생생한 도쿄와 자동차이야기,https://blog.naver.com/shoudai,20210315
[강변] 쉐프의 <b>콜렉션</b>(CHEF’S COLLECTION),https://blog.naver.com/guity87?Redirect=Log&logNo=221938040128,치킨과 떡볶이를 쳐묵쳐묵했지만 양이 모자라 2차로 쉐프<b>콜렉션</b>을 감;;(운동은 왜함?) 강변에 이런곳이?... 거기가 라임이 반개나 들어가있음 ㅎㅎ개꿀~ 숙성회 <b>콜렉션</b> 타라~~~ 플레이팅도 어찌나 무척 이쁨 ㅎㅎ... ,황고메의 상경기,https://blog.naver.com/guity87,20200430
"메두사 랩소디, 메두사 갈라 <b>콜렉션</b>",https://blog.naver.com/modni_2?Redirect=Log&logNo=222335173581,베르사체의 메두사 <b>콜렉션</b> 중 조금 다른 디자인 제품을 소개할까 합니다. 깔끔함과 고급스러움을... 봄의 화사함처럼 테이블을 화사하게 바꾸어 보고 싶은 분들은 메두사 랩소디 <b>콜렉션</b>을 잘 봐주세요. 우선... ,모드니 분당,https://blog.naver.com/modni_2,20210504
르네상스 호텔 재개발): 조선 팰리스 럭셔리 <b>콜렉션</b> 오픈 예정,https://blog.naver.com/lhkny96?Redirect=Log&logNo=222241250882,"이미 아마존, 페이스북 코리아 등 우량 임차인을 유치하는데 성공하였고, 여기에 신세계 조선호텔과 메리어트가 합작해서 선보일 조선 팰리스 럭셔리 <b>콜렉션</b>도 오픈할 예정인 만큼 강남의 랜드마크로... ",YKTM_You Know That Mean,https://blog.naver.com/lhkny96,20210212
좋고 편하게 입을 수 있는 부산범천동맞춤제작_김태희<b>콜렉션</b>:),https://blog.naver.com/rich9011?Redirect=Log&logNo=222430204815,저희 &quot;김태희<b>콜렉션</b>&quot;의 맞춤제작옷들은 스타일리쉬하고 멋지지만 편하기 까지한 탄탄한 내구성을 가진... 궁금한 사항은 언제든지 서면맞춤제작&quot;김태희<b>콜렉션</b>&quot;의 매장을 방문을 해주신다면 더확실하게 상담을... ,고고킴 KIMTAEHEE STYLE,https://blog.naver.com/rich9011,20210713
세번째 베르사체 <b>콜렉션</b>~~,https://blog.naver.com/modni_2?Redirect=Log&logNo=222335019414,오늘은 베르사체 I ♥ Baroque(아이 러브 바로크) <b>콜렉션</b>을 보여 드릴께요. 엔틱함과 깔끔함을 한 몸에 지닌 그런 <b>콜렉션</b>이랍니다. 아이러브바로크 <b>콜렉션</b>은 유럽의 영광스러운 시대에 대한 매력과 스타일리쉬한... ,모드니 분당,https://blog.naver.com/modni_2,20210503
[에픽게임즈 스토어] 보더랜드 핸섬<b>콜렉션</b> 무료 배포 개시!... ,https://blog.naver.com/wolf5160?Redirect=Log&logNo=221982589299,"핸섬<b>콜렉션</b>을 무료로 배포하기 시작하였습니다. 다운로드 링크는 아래와 같습니다. https://www.... 아울러, 보더랜드 핸섬<b>콜렉션</b>과 함께 이 게임도 청소년이용불가 게임이기에 나이가 안되는 유저라면... ",게임 뮤지엄,https://blog.naver.com/wolf5160,20200529
에미넴 NFT <b>콜렉션</b> 셰이디 콘 발매!!,https://blog.naver.com/yubine?Redirect=Log&logNo=222324193926,에미넴이 자신의 NFT <b>콜렉션</b> 셰이디 콘 (Shady Con) 을 공개했습니다! 더 위켄드 The Weeknd 역시도 NFT를 발매한 적이 있죠 (NFT는 분할 불가능하고 고유한 가치를 지닌 토큰이라는데.. 비트코인 관련 뭐... ,에리어's 타노카와카페 [たのしい&かわいい カフェ],https://blog.naver.com/yubine,20210426
김뙇 S/S <b>콜렉션</b>,https://blog.naver.com/jeuni27?Redirect=Log&logNo=222413738456,"# 6월 27일 일요일 주말 2번 일요일 어느 오후, 방에서 서하 혼자 꽤 조용하길래.. (모지..?ㅎㄷㄷ) 살포시 들다봤드니 인형옷을 리폼중이셨다. 왠닐로 옛날옛적 꼬마때 갖고놀던 토깽이들을 꺼내서는... ",신냥네 :D,https://blog.naver.com/jeuni27,20210629
용과같이 마지마 고로 <b>콜렉션</b> 쿠지,https://blog.naver.com/hiyaa_?Redirect=Log&logNo=222160704740,2019년 8월에 라쿠텐에서 발매한 용과같이 마지마고로 <b>콜렉션</b> 굿즈 (현재 판매 종료) 참고로 이건 랜덤이라 뭐가 나올지 알수없음 S상 후드타입 타올 당첨확률 1/100 S1-후드타입 타올 이레즈미 버전 S2-후드타입... ,도쿄생활 ::★MEGA CAKE★,https://blog.naver.com/hiyaa_,20201202
베르사체 메두사 <b>콜렉션</b>,https://blog.naver.com/modni_2?Redirect=Log&logNo=222330105088,당신의 가장 호화로운 꿈의 세계를 선사할 베르세체의 첫 도자기 <b>콜렉션</b>인 메두사를 소개합니다.... 베르사체 엠블럼으로 장식된 화려한 메두사의 금색머리가 이 <b>콜렉션</b>의 특징입니다. 베르사체하면... ,모드니 분당,https://blog.naver.com/modni_2,20210502
[포커스미디어 12월 이벤트 당첨] 팔레데떼 티 <b>콜렉션</b>... ,https://blog.naver.com/kangta308?Redirect=Log&logNo=222216338507,"(고맙습니다, 포커스 미디어!) 상품은 바로 팔레데떼 티 <b>콜렉션</b> (Palais Des Thes, 프랑스). 수입하는 삼원T&amp;B 사이트를 확인해보니 무려 48,000원 상당의 제품. 네이버 쇼핑에서 검색해도 43,000원. 요즘 커피보다 차를... ",Just the way you are,https://blog.naver.com/kangta308,20210122
2021년 LP <b>콜렉션</b> 방향,https://blog.naver.com/spenne?Redirect=Log&logNo=222180752430,결국 지키지 못할 약속이 될 지언정 실현가능한(?) 2021년 <b>콜렉션</b> 방향을 설정하고 정진해야겠다. 재즈 : 마일스 데이비스 뽀개기 마일스 데이비스를 재즈의 역사라고 한다. 예전에 그의 ING 4부작... ,후회블로그,https://blog.naver.com/spenne,20201222
반다이 마크로스 파이터 <b>콜렉션</b>,https://blog.naver.com/andkek08?Redirect=Log&logNo=222347578296,반다이의 1/250 스케일로 출시된 마크로스 파이터 <b>콜렉션</b> 판매합니다 1탄 3종 - YF-19 이사무 전용기 - VF-19커스텀 바사라 전용기 - VF-22S 감린 전용기 4탄 시크릿 3종 - VF 22s 크랑 전용기 - VF 25F 쉐릴... ,월광(月曠)의 피규어 판매 & 교환,https://blog.naver.com/andkek08,20210512
멘토닉 오딘<b>콜렉션</b> 드로즈 주문했어요~,https://blog.naver.com/qsc2399?Redirect=Log&logNo=221922601172,오딘<b>콜렉션</b> 드로즈 3+1로 주문 했어요 그리고 주문하기에 앞서 사이즈가 L까지 밖에 없어서 문의했더니 사이즈가 크게 나와서 다른 드로즈 XL입으시면 L이 맞다고해서 오딘<b>콜렉션</b> 3+1에서도 스포티브 3Pack로... ,♥알콩달콩 사랑중♥,https://blog.naver.com/qsc2399,20200422
[블루레이] 베버리힐스 캅 1.2.3. <b>콜렉션</b>,https://blog.naver.com/conradmajors?Redirect=Log&logNo=222403431732,베버리힐스 캅 1편 2편 3편이 무삭제로 수록된 특별 <b>콜렉션</b> 세트 !!! 해롤드 폴터마이어. 글렌 프레이. 패티 라벨. 포인터 시스터즈 등등 특급 스타들이 참여한 오리지날 사운드 트랙 !!! 열화와 같은... ,스티브의 해외 DVD,https://blog.naver.com/conradmajors,20210619
[블루레이] 디에나 더빈 걸작 3필름 <b>콜렉션</b>,https://blog.naver.com/conradmajors?Redirect=Log&logNo=222429167556,특별 <b>콜렉션</b> 세트 !!! 고가의 걸작만을 엄선하는 미국 KINO LORBER 출시판 !!! 열화와 같은 성원에 2세트 입고 !!! 디에나 더빈 걸작 3필름 블루레이 박스 세트 (미국 KINO LORBER 출시판.... ,스티브의 해외 DVD,https://blog.naver.com/conradmajors,20210712
[거꾸로 가는 건프라 <b>콜렉션</b>] 최근 입수한 건담 프라모델 공개,https://blog.naver.com/batman691?Redirect=Log&logNo=222081865601,"배리에이션)'으로 <b>콜렉션</b>과 작업 방향을 잡고 (어쭈!) 한발 한발 나아가고 있습니다. ㅎㅎ 최근 중고**를... 올드한 구판 건프라 <b>콜렉션</b> 공개 였습니다. ㅎㅎ 자, 그럼 다음에도, 당신은 살아남을 수 있겠는가.. !!!!",신무바이 피규어 & 건프라 SHOW,https://blog.naver.com/batman691,20200906
고급스러운 선물용초콜릿! 진협제과 로즈 초콜릿 <b>콜렉션</b>,https://blog.naver.com/skstbvjcjqj?Redirect=Log&logNo=222138779833,"진협제과 로즈 초콜릿 <b>콜렉션</b> 안녕하세요, 수댕입니다  저는 주로 선물을 고를 때 먹는 걸 잘 고르는 것... 초콜릿 <b>콜렉션</b>인데요 - 진협제과에서 초콜릿을 ? 싶으신 분들도 있으실거에요 지금까지 진협제과는... ",수댕쓰,https://blog.naver.com/skstbvjcjqj,20201108
REISS 뉴 <b>콜렉션</b> 할인 행사,https://blog.naver.com/rosie_kwon?Redirect=Log&logNo=222256878050,케이블 짜임의 짧은 기장으로 블라우스와도 레이어드 하기에 이쁜 럭셔리 니트 탑 입니다. HETTIE 청키 니트 롤넥 점퍼 런던 직배송 정상 운영 합니다 ! 뉴 스프링 캐쥬얼 <b>콜렉션</b> 만나보세요 ~ London Store [Brands],런던스토어 since 2011,https://blog.naver.com/rosie_kwon,20210226
쥬라기월드 앰버<b>콜렉션</b> 블루,https://blog.naver.com/pperox2?Redirect=Log&logNo=221892594351,6인치 사이즈의 퀄리티 좋은 공룡액션 피규어라인 앰버<b>콜렉션</b>!!! 입은 저만큼 벌려줄 수 있고 입안도... 쥬라기월드 앰버<b>콜렉션</b>의 블루임 사실 일반버젼의 랩터를 구매했는데...예약구매여서 생각보다 늦게 받게... ,클램쉘 패키징,https://blog.naver.com/pperox2,20200405
마블 '샹치와 텐 링즈의 전설' 토이 <b>콜렉션</b>,https://blog.naver.com/connell3?Redirect=Log&logNo=222318116859,마블 '샹치와 텐 링즈의 전설' 토이 <b>콜렉션</b> 누군가가 마블 시네마틱 유니버스 신작과 함꼐 출시 될 제품들을 모두 갖게 된다면 그만큼 즐거운 일은 없을 것이다. 그것이 실제로 일어났다. 마블 신작 '샹치와 텐... ,일어나라 로보트태권V,https://blog.naver.com/connell3,20210421
[Felt&amp;Son Jewellery l 펠트앤손] 어워드 <b>콜렉션</b>,https://blog.naver.com/yourpocket?Redirect=Log&logNo=222413948461,펠트앤손 주얼리의 새로운 <b>콜렉션</b>의 모델 사 진촬영 사진입니다. Award Collection 열정적으로 임한... 상을 받는 느낌을 나타내기 위해 <b>콜렉션</b> 스터드 중 하나인 'curtian call' 목걸이 참을 실제 메달 크기로... ,FELT&SON Jewellery,https://blog.naver.com/yourpocket,20210629
[울트라맨 <b>콜렉션</b>] CCP 1/6 특촬 시리즈 &quot;울트라맨 타로&quot;,https://blog.naver.com/batman691?Redirect=Log&logNo=222314776190,"간간히 소개하는 울트라맨 <b>콜렉션</b>, 오늘의 주인공은 CCP 사의 1/6 특촬 시리즈 중에서 최근에 선보인 '어드밴트' 라인업으로 등장한 &quot;울트라맨 타로&quot; 스토리움 광선 버전 피규어 입니다. '후세에 전하는 입체... ",신무바이 피규어 & 건프라 SHOW,https://blog.naver.com/batman691,20210419
포켓몬 프라모델 <b>콜렉션</b> 포켓프라 빅 잉어킹 만들기,https://blog.naver.com/soso8708?Redirect=Log&logNo=222420956933,저의 포켓몬 최애캐 잉어잉어잉어킹 포켓프라 중에서도 빅사이즈 프라모델이예요. 출시된 날 좋다고 사놓고 박스째로 장식하다가 급땡겨서 만들어봤습니다. 단 30파츠로 만들어지는 20센티짜리 잉어킹이예요.... ,소녀의 블로그,https://blog.naver.com/soso8708,20210705
드디어 “비노레베카의 <b>콜렉션</b>- 2021 써머 에디션 출시!!!”,https://blog.naver.com/mij5070?Redirect=Log&logNo=222407281100,"오랜 기다림 끝에 “비노레베카의 <b>콜렉션</b> - 써머 에디션 오늘 출시합니다~~^^ 그 맛은 가히 데일리... 실패함이 없는 비노레베카의 <b>콜렉션</b>으로 핫써머 쿨하게~~^^ 가격: 157,000/6병 -&gt; 120,000/6병 !!! (24세트... ",상일동와인샵 “와인셀러”,https://blog.naver.com/mij5070,20210623
[대구 골프샵 골때려골프]우드 유틸리티의 명가 로얄<b>콜렉션</b>... ,https://blog.naver.com/yongyoub?Redirect=Log&logNo=222416637554,일본 투어 프로선수들의 60% 이상 사용한다는 로얄<b>콜렉션</b> 우드와 유틸리티 국내에서는 매니아층을... 로얄<b>콜렉션</b> SFD X7 유틸리티 일본에서는 프리미엄급 골프채로 가격도 만만찮은 명품 클럽으로 통하는... ,골때려골프 대구지산점,https://blog.naver.com/yongyoub,20210707
그래인스쿠키 <b>콜렉션</b> 선물세트 개봉기,https://blog.naver.com/jwani84?Redirect=Log&logNo=222018553167,제가 받은 쿠키는 베스트셀러 쿠키들만 모아모아 놓은 <b>콜렉션</b> 세트에요. 총 13종의 쿠키가 들어있어요 젤 큼지막한 쿠키 꺼내봅니다. 코코넛향이 가득한 쿠키에요. 씹을수록 고소했어요. 꽃모양 쿠키를... ,MORE의 일단해보기,https://blog.naver.com/jwani84,20200702
