title,link,description,bloggername,bloggerlink,postdate
[블루투스 이어폰 추천] 유클리어 커맨더로 편한 <b>통화</b>!,https://blog.naver.com/crysta06?Redirect=Log&logNo=220230687660,"운전하면서 <b>통화하</b>실 일이 많거나 요즘같이 추운 날씨에 야외활동이 많아서 손을 꺼내서 <b>통화하기</b> 힘드신 분들, 손쓰는 작업을 해서 통화가 어려우신 분들에게 편한 유클리어 커맨더 블루투스 이어폰 추천을... ",블랙러시안의 문화&패션&뷰티 트렌드,https://blog.naver.com/crysta06,20150105
엄마랑 <b>통화</b>,https://blog.naver.com/lovelbt1202?Redirect=Log&logNo=220808273287,여자들끼리 <b>통화하</b>면 2~3시간씩 수다 떨고 자세한 얘기는 이따 만나서 하자고 하던 얘기가 생각나서 말이다.... ㅋㅋㅋㅋㅋㅋㅋㅋ 예전엔 나보단 이모들이나 친구분들과 <b>통화하기</b> 바쁘셨는데 요즘은 나랑... ,LovelyHWA_러블리화,https://blog.naver.com/lovelbt1202,20160908
"Together with 미국인턴, 혼자 심각했는데 오선생님과 <b>통화하</b>... ",https://blog.naver.com/careerusa?Redirect=Log&logNo=221419265964,오전엔 상황이 안되어 바로 통화를 못했고 퇴근 후 일이 좀 있다고 오후 3시이후로 통화를 하자고 하셔서 통화를 했는데 <b>통화하기</b>전까지 내내 머릿속에는 무슨일일까 하는 걱정이 깔려있었답니다. 통화를 하고... ,커리어매칭 전문가 오선생,https://blog.naver.com/careerusa,20181214
<b>통화</b>어플 중 새로생긴 마음어플후기 ::<b>통화</b>공포증극복 꿀잼,https://blog.naver.com/ij5771?Redirect=Log&logNo=222391361873,<b>통화하기</b> 저는 1232호 강아지 손님이네요 ㅋㅋㅋㅋㅋㅋㅋㅋ 가운데 &quot;대화친구 찾기&quot; 핑크색 동그라미가 뱅글뱅글 도는데요 핑크 동그라미만 누르면 바로 통화가 연결이 됩니다 ㅋㅋㅋ 그전에 핑크 동그라미... ,행복을 찾아 떠난 복치,https://blog.naver.com/ij5771,20210609
아크로텔강남역 오피스텔 현관 도어락 사용설명서(SHS-6601),https://blog.naver.com/goldrealtor?Redirect=Log&logNo=222188270059,상가/사무실/오피스텔/아파트 모든분야 쉴새없이 일하고있으니 필요하신 분들은 이상현과장을 찾아주시기바랍니다^^ ( ***-****-**** <b>통화하기</b> ) 입주하고 도어락 사용법을 잘 모르셔서 헤매이시는 분들이... ,서초 황금부동산,https://blog.naver.com/goldrealtor,20201228
애플워치SE | 7살 아이 엄마 애플워치 사용법,https://blog.naver.com/ppabam2?Redirect=Log&logNo=222412883285,생각보다 소리도 선명하게 잘 들리고 답도 잘 들려서 <b>통화하기</b> 정말 편리. 또한 좋은 카톡 ㅎ 급한 내용이 아니라면 나중에 보겠지만 아이와 함께 있거나 음식을 하거나 할때 급히 답을 해야할때가 있다. 그럴때... ,ppabam2,https://blog.naver.com/ppabam2,20210628
진짜 제일 싼 국제전화로 마음껏 <b>통화하기</b> 00700... ,https://blog.naver.com/hyeja74?Redirect=Log&logNo=50145286669,답변) 한국에서 국내<b>통화</b>시 시내와 시외<b>통화</b>료가 달라집니다. 국제전화거시는 고객님들의 상담내용중 예를 들어 미국에 샌프란시스코로 거는 경우와 뉴욕으로 거는 경우의 국제요금이 달라지는지... ,00700 국제전화,https://blog.naver.com/hyeja74,20120711
인도인과 전화<b>통화</b>,https://blog.naver.com/maypuppy?Redirect=Log&logNo=221607920957,=정말 정말 나아지지 않는 한가지= 바로 인도사람들과 전화 <b>통화하기</b> 이다. 그래도 사람얼굴을 보고 입모양도 보고 표정도 보면서 말하면 좀 알아들을수 있다. 젤네일 받느라 네일샵에서... ,꿈꾸는 지성,https://blog.naver.com/maypuppy,20190806
"핑거, 솔루엠 최적의 공모주 청약 방법(수정완료)",https://blog.naver.com/xuenxu?Redirect=Log&logNo=222213785870,증권사 <b>통화하기</b> 넘나 어려운데... 직원들도 잘 모른다는 것이 함정.ㅠㅠ 아침부터 계속 핸드폰 잡고 있었는데 다들 알아보고 전화주신다는디 함흥차사네요.. 오늘 통화했던 직원분께서... 안그래도 가족수대로... ,재테크의 여왕 슈엔슈,https://blog.naver.com/xuenxu,20210120
헤이미스터브라운 영상<b>통화</b> 이벤트로 블랙빈밀크 겟!,https://blog.naver.com/qtmii?Redirect=Log&logNo=220994514356,"헤이미스터브라운 영상통화 이벤트로 블랙빈밀크 겟! 오늘 오후, 오곡우유 하나 먹으라며 느닷없이... 고퀄 헨리 영통에 살짝 당황스럽지만, 2번:밀어서 영상<b>통화하기</b>를 눌렀습니다! 그리고 짧은 동영상을 다... ",큐티미,https://blog.naver.com/qtmii,20170428
[내가 삼성을 떠난 이유] 스키 타면서도 <b>통화</b> 한다? 박재홍... ,https://blog.naver.com/jobarajob?Redirect=Log&logNo=220864884133,헬멧에 부착해 버튼을 눌러 <b>통화하</b>는 소형 스마트기기다. 2009년 삼성전자에 입사한 박씨는 개발... 전화할 일이 생겨도 추운 스키장에서 <b>통화하기</b>가 쉽지 않죠. ‘그런 불편함을 해소할 기기가 있다면 좋겠다’... ,1등 취업정보 jobsN,https://blog.naver.com/jobarajob,20161118
고객 <b>통화</b> 라우팅을 위한 동적 설계,https://blog.naver.com/dcdcding?Redirect=Log&logNo=222429498142,"Capital One은 NAT이 운영 중인 비즈니스 환경과 대량의 통화 및 네트워크 변경 사항을 고려하여... 또한, 고객이 대리점과 <b>통화하기</b> 위해 대기하고 있기 때문에 전화 공급업체에서 발생하는 비용을... ",dcdcding님의블로그,https://blog.naver.com/dcdcding,20210713
"역할 - 엄마,아빠와 <b>통화하기</b>",https://blog.naver.com/eunvit3?Redirect=Log&logNo=220459623817,,위캔키즈월드 어린이집,https://blog.naver.com/eunvit3,20150823
"계속되는 언택트 시대, 대화면 TV 영상 <b>통화</b>로 가깝게 만나자!",https://blog.naver.com/theham_tv?Redirect=Log&logNo=222262775661,간단하게 영상 <b>통화하기</b> 더함 우버 U751UHD SMART HDR 크롬캐스트를 이용해 영상 통화를 해보자. 가장 간단한 방법은 스마트폰으로 영상 통화를 걸고 크롬캐스트 기능을 활용해 스마트폰 화면을 더함 우버... ,더함TV공식블로그,https://blog.naver.com/theham_tv,20210303
<b>통화</b>2/김기택,https://blog.naver.com/bezital?Redirect=Log&logNo=10188684319,"지금은 모든 상담원이 통화중입니다. 예상대기시간은 4분 29초입니다. 계속 <b>통화하기</b>는 1번, 끊고 다시 하기는 2번, 끊고 안 하기는 3번을 눌러주십시오. 잘못 누르셨습니다. 통화 1번, 끊기 2번, 다시 하기... ",사유의 전복,https://blog.naver.com/bezital,20140403
[ 언니들의꿀팁 ] 술취한 여자친구와 <b>통화하기</b>,https://blog.naver.com/jinhwan1016?Redirect=Log&logNo=220563130177,출처 : &quot;언니들의꿀팁&quot; 페이스북 페이지,TENSIXTEEN,https://blog.naver.com/jinhwan1016,20151209
무료 <b>통화</b>에 묘미 Viber,https://blog.naver.com/vgagirl?Redirect=Log&logNo=60133130991,"가볍게~ <b>통화하기</b> 밀어주시고, <b>통화 하</b>시면 되네요. 참고로 3g 상태에서 전화 받는거랑 동일하다고 보시면 되겠습니다. 상대방쪽에 전화가 안올때, 국가 번호 미설정 하셨거나, 국가번호에서 + 를... ",잇힝!!,https://blog.naver.com/vgagirl,20110628
[안드로이드 어플] U+ 070 모바일로 <b>통화</b>요금 절약하기~!,https://blog.naver.com/skiangels?Redirect=Log&logNo=120123452462,"휴대폰으로 통화를 많이 하실 것 같은 분들은 4000원짜리 요금제를 선택하셔도 되는데 저 같은 경우 여자친구와 서로 070으로 <b>통화하기</b>위해서 가입한 것이기 때문에 2,000원/월 짜리 요금제에... ",살림하는김씨,https://blog.naver.com/skiangels,20110205
"가볍고 편한 블루투스 이어폰, 필립스 TAT2205 사용기",https://blog.naver.com/uju_byul?Redirect=Log&logNo=222340769471,"[좌측 버튼] 통화, 재생/정지, 이전곡 [우측 버튼] 통화, 재생/정지, 다음곡 블루투스 5.1 칩셋이 내장되어 더 향상된 무선 성능으로 음악듣기 &amp; <b>통화하기</b> 특히 통화할때 되울림 현상제거 기능이 장착된... ",# 우주별을 부탁해 :),https://blog.naver.com/uju_byul,20210506
누구나 ‘딱 12분만’ <b>통화하</b>면 용돈을 벌 수 있는... ,https://besuccess.com/startup/_12ish/,당신과 <b>통화하기</b> 위한 예약을 걸 수 있다. 예약된 시간이 되면 12ish는 당신의 전화와 예약한 상대방의 전화를 정확히 12분 30초 동안 연결해준다. 지불된 요금은 통화가 끝나고 처리된 후 자동으로... ,beSUCCESS - Korea's Leading Tech and Startup Media Platform,https://besuccess.com/,20140522
100일째 <b>통화</b> 중(feat. 조카 쭈),https://blog.naver.com/banle1114?Redirect=Log&logNo=221938439233,1월 20일에 얼굴보며 가볍게 시작했던 영어대화 쉬는 동안 하루에 십분씩 영어로 영상<b>통화하기</b>로... 스승의 기쁨은 뛰어난 제자를 길러내는 데 있다고 했던가♥ 육아하다 잠들어버려 통화를 못해... ,먼북소리,https://blog.naver.com/banle1114,20200430
부동산 셀프등기 후기 및 등기 꿀팁,https://bloggertip.com/5360,상담 대기자가 많아 등기소 직원과 <b>통화하기</b> 어려웠다. 시간이 흘러 연결이 됐으나 등기소 직원은... 결국 상담원과 연결하고 매입액을 알아내 채권을 매입했지만 미리 전화<b>통화하</b>고 알아뒀더라면 얼마나... ,블로거팁닷컴,https://bloggertip.com/,20210713
[호주형 필수영어] 전화<b>통화</b> 할 때 사용하는 생활밀착... ,https://blog.naver.com/korean_au?Redirect=Log&logNo=221346941236,오늘은 전화 <b>통화하기</b>전이나 통화중에 사용할 수 있는 영어 회화를 배워볼거에요.마주보고 대화를 할 때에는 입 모양이나 제스쳐를 통해 살짝 흐름을 놓쳤어도 추측해서 대화를 이어나갈 수 있는데요.그래서... ,호주생활 호주형이 도와줄게!,https://blog.naver.com/korean_au,20180827
[백두대간종주] D+38. 혼자가 아닌 길 | 진고개~두로봉~내면... ,https://blog.naver.com/wooltraveler?Redirect=Log&logNo=222435729413,전날 이 내면분소 내려가는 구간이 엄청 지루하고 길다고 얘기를 들었는데 길이 좋으니 이런저런 생각들하며 걷기에도 <b>통화하기</b>에도 딱 좋아서 일처리할 것들 전화<b>통화하</b>고 다음주 플랜 짜고 뭐 그러면서... ,울트래블러,https://blog.naver.com/wooltraveler,20210718
선아랑 라인메신져로 무료 영상<b>통화</b> 캡쳐 2탄,https://blog.naver.com/a73930?Redirect=Log&logNo=220001098324,라인메신져로 일본에서 먹방찍음 한잔 받아 컨셉샷 츄츄츄 헤헿 1시간 7분 이 날도 너무 고마웠던 라인메신져 미국에있는 진이랑도 <b>통화하</b>고 해외에 있는 친구들과 <b>통화하기</b> 정말 유용하네요 헤헤헤 그리고... ,sentimental rider MOMO,https://blog.naver.com/a73930,20140516
귀염주의] 술취한여친과 <b>통화하기</b>,https://blog.naver.com/cdefgab1234?Redirect=Log&logNo=220173956442,zzzㅋㅋㅋㅋ 뭔가 훈훈하네 ㅋㅋㅋ,봉인된 기억,https://blog.naver.com/cdefgab1234,20141107
"일본어 왕초보, 일본인 친구와 줌으로 영상<b>통화하</b>다?!?",https://blog.naver.com/shine2142?Redirect=Log&logNo=222404570418,바로 외국인 친구와의 영상통화 나는 올해 초부터 일본 문화에 관심을 갖게 되며 조금씩 일본어 공부에... 또 <b>통화하기</b>로 약속했다. 만일 나처럼 일본어 왕초보지만 일단 현지인과 소통은 해보고싶은 분들이... ,일기장,https://blog.naver.com/shine2142,20210620
# 53초 _ 아빠와 <b>통화</b> 시간,https://blog.naver.com/1ove_honesty?Redirect=Log&logNo=220749601422,# 53초 아빠랑 1분 이상 <b>통화하기</b> 대실패. 전화 걸기 전에 무슨 얘길 나눌지 공책에 소재거리도 4개나... 통화 종료. # 미친 7월 열흘간 매일 살사 발표회 연습 원고 수정 월수금 출근과 7월부터 새로 하게 된 화목... ,쥬디_여행 부추기는 여자♩,https://blog.naver.com/1ove_honesty,20160630
"아직은 어색하기만한 영상<b>통화</b>, 하지만 재미있는 영상채팅플러스",https://cusee.net/2461860,"티스토리 뷰 리뷰 이야기 아직은 어색하기만한 영상통화, 하지만 재미있는 영상채팅플러스 까칠한... (자녀)들과 <b>통화하기</b>에는 좋을 것 같다. 고향에 계신 부모님과 <b>통화하기</b>에도 다소 무리가 있어 보인다.... ",킬크로그,https://cusee.net/,20090215
주인장과 <b>통화하기</b>,https://blog.naver.com/push1258?Redirect=Log&logNo=220043729725,,줍줍부동산tv,https://blog.naver.com/push1258,20140628
공모주 투자를 위한 필수 주관사 계좌 만들기,https://blog.naver.com/xuenxu?Redirect=Log&logNo=222259054350,아시다시피 공모주 개편안으로 한창 과도기인데다 관련 내용들이 너무 자주 변경되는 통에 헷갈리기 일쑤고 증권사랑 <b>통화하기</b>가 진짜 너무나 힘듭니다. 총대 메고? 알아봐주시면 제가 취합해서 포스팅은... ,재테크의 여왕 슈엔슈,https://blog.naver.com/xuenxu,20210227
스마트폰연동-주인장과<b>통화하기</b>,https://blog.naver.com/childmath?Redirect=Log&logNo=220010649152,,양평주민으로 살아가기!,https://blog.naver.com/childmath,20140526
주인장과 전화<b>통화하기</b>,https://blog.naver.com/ae2666?Redirect=Log&logNo=220009634645,,혁신1번지부동산,https://blog.naver.com/ae2666,20140524
음성으로만 <b>통화</b>가 가능한 한창인터폰 JIS-200을 영상으로... ,https://blog.naver.com/dalcomm119?Redirect=Log&logNo=221023675007,경비실과 <b>통화하기</b> 위해서는 호환되는 인터폰으로 교체를 해야 합니다. 그렇지만 아쉽게도 여러가지 문제로 경비실기는 거의 사용하지 않는 상태입니다. 다시 말하자면 경비실과는 통화할수 없으니 집 앞... ,"인터폰, 비디오폰 교체전문점    - 하은홈테크",https://blog.naver.com/dalcomm119,20170607
"삼성 갤럭시 버즈 사용법, 음질, <b>통화</b>품질 알려줘본다..... ",https://blog.naver.com/ppjjyk?Redirect=Log&logNo=221623736983,캔디팟에는 노이즈 캔슬링이 있어서 통화품질 걱정없이 <b>통화하기</b> 딱이었음~! 한창 블루투스 이어폰 찾아볼 때 친구들한테 이거 어때? 저거 어때?이럼서 많이 물어봤었는데..ㅠㅠ 정작 내가 디자인이나... ,게으른 푸딩맘의 육아일기♥,https://blog.naver.com/ppjjyk,20190821
[호주워홀:오페어 Day+85] NAB 텔러와의 <b>통화</b> / 알찬 수요일,https://blog.naver.com/bjhlove73?Redirect=Log&logNo=221018706580,"사실 영어에 많이 익숙해졌지만, 13년도의 기억 때문에 늘 영어로 <b>통화하</b>는 건 <b>통화하기</b>에 앞서 '혹시나 내가 못 알아들으면 어떻게 하지?' 와 같은 두려운 마음이 먼저 든다. 특히나 이런 관공서와... ",투명한 캔버스 위를 걷는 너,https://blog.naver.com/bjhlove73,20170531
5월 29일: 치킨엔 늘 진심이다/절친과의 <b>통화</b>,https://blog.naver.com/dori_guiri?Redirect=Log&logNo=222373654841,"어젯밤에 대학 동기이자 룸메이트였던, 그 시절 내가 가장 사랑했던 여인 H와 영상 통화를 했다. 못... 그래서 앞으로 자주 <b>통화하기</b>로. 정정. 세 시간 가까이(x) 3시간 넘게(o) 가뜩이나 인간관계가 얄팍한 외국... ",소소한 개인사,https://blog.naver.com/dori_guiri,20210529
"내돈내산, 윙크 학습지로 한글 공부, 수학공부! 그리고 스승의... ",https://blog.naver.com/sprengery88?Redirect=Log&logNo=222346640124,"이른새 들이라...ㅋㅋㅋㅋㅋㅋ 그리고 영상통화도 할 수있는데요~ 윙크 학습기에 카메라가 달려있는데, 엄마랑 <b>통화하기</b> 버튼을 누르면 제 어플에 민성휘가 영상통화를 원한다고 알림이와요 ㅋㅋ 그럼 제가... ","순간을, 소중히",https://blog.naver.com/sprengery88,20210511
할무이랑 전화<b>통화하기</b>~~~,https://blog.naver.com/takc71?Redirect=Log&logNo=60024081920,요사이 부쩍 할무이를 많이 찾네요.. 잠깐 찍고있는사이에 방해공작이 마나서리.. 화면이 제대로 안나와씀다.. (보실땐 배경음악을 정지시키는거 아시죠?),투맘의 놀이터..,https://blog.naver.com/takc71,20060504
아빠랑 <b>통화하기</b> 놀이 ㅋㅌ,https://blog.naver.com/junguihun?Redirect=Log&logNo=140204003215,,지효&지아&지원 이야기,https://blog.naver.com/junguihun,20140103
20110415 아빠랑 <b>통화하기</b>,https://blog.naver.com/myshblue?Redirect=Log&logNo=199444536,"&quot;아빠, 공주, 어제, 삔, 집에, 삔 공주....&quot; 무슨 말인지 알겠어요? 서현이가 말을 참 예쁘게 잘하죠? &quot;아빠, 어제, 삔, 해줬어.&quot; 귀엽게.... ^^.. 지금의 서현이도 예쁜데 계속 옛날 서현이가 그리운 이유가 뭔가? ^^;;;",김서현 김도하의 블로그입니다.,https://blog.naver.com/myshblue,20131126
[핸드폰 노하우] 발신자표시를 제한해서 <b>통화하기</b>,https://blog.naver.com/mizzikko?Redirect=Log&logNo=80014812210,1. 휴대전화 사용시 *23# 누르고 상대방 전화번호를 누르시면 상대방 휴대전화에 &quot;발신자표시제한&quot;으로 표시 예) *23# ***-***-**** 2. 일반전화 사용시 169 누르고 상대방 전화번호를 누르시면 상대방... ,시골한량아재의조용하지만깨어있는靜中動공감블로그,https://blog.naver.com/mizzikko,20050708
비대면 단체 영상<b>통화</b>! 카톡 페이스톡!! 설정 법,https://blog.naver.com/i2lovehappy?Redirect=Log&logNo=222320013156,최근에 카카오톡에서 단체 영상통화를 할 수 있는 '그룹 페이스톡'이 출시되어 알아보았습니다. ※ 카톡 페이스톡 설정 법 1. 일반채팅 클릭! 2. 대화 상대 선택 후 + 클릭 3. <b>통화하기</b>→그룹 페이스톡 (최대... ,패밀리탐구생활,https://blog.naver.com/i2lovehappy,20210423
어플에서 한 남자를 만나고 2년 후... 네덜란드에서 선생님 되다?!,https://blog.naver.com/sum-lab?Redirect=Log&logNo=222323741526,휘수: 근무시간이 아예 정 반대가 돼서 평일에는 잠시 <b>통화하기</b>도 어려웠어요. 얀을 실제로 너무 보고 싶은데 영상통화만 가능하니 너무 답답하고 힘들었던 기억이 아직도 나요. 그렇지만 네덜란드행 비행기... ,네이버 연애·결혼,https://blog.naver.com/sum-lab,20210426
+679 아빠랑 <b>통화하기</b>,https://blog.naver.com/mars9844?Redirect=Log&logNo=120192447156,,해피걸,https://blog.naver.com/mars9844,20130620
직접 써보니 알겠다! HD보이스(VoLTE)의 선명한 <b>통화</b> 품질,https://blog.naver.com/chstns?Redirect=Log&logNo=50148334697,"HD보이스 보이스 설정 &amp; <b>통화하기</b> 현재 HD보이스 즉, VoLTE를 사용하려면 단말기의 왼쪽 목록 버튼을 누르고 통화설정을 클릭합니다. 그러면 아랫쪽에 &quot;음성 통화 발신 설정&quot;이라는 것이 있는데, 여기서 &quot;VoLTE... ",쓸모있는 것들의 모음집,https://blog.naver.com/chstns,20120821
"[월간 이지현_23] 오늘도 나는 노를 젓는다, 열심히.",https://blog.naver.com/choopha0501?Redirect=Log&logNo=222430333818,6월 **일 □ 오전에 병원예약하고나서 막내랑 병원가기 □ 마트가서 간식 쟁여놓기 □ 우체국 가서 등기 보내기 □ 오후에 **도서관 담당자님과 <b>통화하기</b> 7월 *일 □ **담당자님께 메일로 프로필 보내드리기... ,"오늘보다 나은 내일을 꿈꾸는 엄마, 베러맘 bettermom",https://blog.naver.com/choopha0501,20210713
목이 긴 수전 - 거위목 수전교체(스완수전),https://blog.naver.com/homecare9119?Redirect=Log&logNo=222340656504,"불러주세요~~~ <b>통화하기</b> 글자를 누르면 바로통화 됩니다. 배관과 연결된 고압호수들입니다. 정수기, 식기세척기 등등 많은게 연결되어 있네요~~ 그나마 쉽게 분해가 되었습니다. 수전분해용 전용 공구가 있어서... ",홈케어119,https://blog.naver.com/homecare9119,20210507
[괜찮은앱] 실수로 <b>통화</b>되는 것 방지하는 안드로이드앱 &quot;발신제한&quot;,http://badsaarow.egloos.com/10982910,"통화해도 상관없는 사람에게 걸리는 전화면 괜찮은데, 주소록에는 저장되어 있지만, <b>통화하기</b>엔 껄끄러운 상대에게 전화가 걸리기라도 할 때면 좀 난감했다. 실수 통화가 그래도 내가 잘못 건거면... ",언젠가는 마추피추를..,http://badsaarow.egloos.com/,
러시아어로 <b>통화</b>할때 유용한 표현 5가지! (이건 정말로 기본),https://blog.naver.com/fotimahejin?Redirect=Log&logNo=222194675509,Пока пока!  #러시아어배우기 #중앙아시아 #러시아어로<b>통화하기</b> #러시아어통화 #통화표현 #러시아어표현 #포티블로그 #외국어배우기 #러시아어 #<b>통화하기</b>,연세대생 포티의 한국생활,https://blog.naver.com/fotimahejin,20210103
14. <b>통화하기</b>,https://blog.naver.com/shg9904?Redirect=Log&logNo=20180520609,채색법을 좀 바꿔봣어요,칼이무거운블로그,https://blog.naver.com/shg9904,20130226
[2ch괴담/번역]무선<b>통화</b>,https://blog.naver.com/rainbow_eco?Redirect=Log&logNo=222041732816,무선통화 나는 트럭 운전수로 일한 적이 있다. 언제나처럼 깊은 산속으로 들어가는 길이었다. 그런데... 그리고 상사에게 무선으로 <b>통화하기</b>로 했다. &quot;사고 현장에서는 아무 일도 없었습니다. 후...&quot; 빠직... 갑자기... ,산골짜기에 핀 백합 한 송이,https://blog.naver.com/rainbow_eco,20200725
18개월 아이를 키운다는 것,https://blog.naver.com/ses9964?Redirect=Log&logNo=222410395091,"상대 피해부모가 나와 <b>통화하기</b>를 원한다고 하여, 정말 죄송한 마음으로 전화를 드렸었다. 처음해보는 전화에 많이 떨리기도 했는데 최대한 차분한 척 전화를 했다. 얼마나 속상하셨을까, 진심으로 죄송한... ",항상 엔진을 켜둘게,https://blog.naver.com/ses9964,20210625
"보이스톡 폭발, 그룹<b>통화</b>가 이끌것 (카카오톡 그룹콜)",https://brucemoon.net/1198142093,"채팅방에 모여있는 친구들끼리, 그냥 상단에 친구들과 <b>통화하기</b>를 누르면 그 친구들과 보이스톡을 통해 그룹통화 (그룹콜, 다자간 통화) 가 연결되는 것이다. 메시지로만 채팅하던 것을 '음성으로 수다떠는 것... ","bruce, 와이프 몰래 오븐을 지르다",https://brucemoon.net/,20120824
[레전드 일상 베트남어] #97 베트남어로 <b>통화하기</b>,https://blog.naver.com/languagebook?Redirect=Log&logNo=221288616132,,랭귀지북스,https://blog.naver.com/languagebook,20180531
2021.5.3 전화<b>통화</b> 극복하자!,https://blog.naver.com/nice9464?Redirect=Log&logNo=222335240002,전화<b>통화하기</b>는 너무 겁이 난다 콜센터업무가 처음이기도 하고 미숙하기도 해서 아직도 많이 낯설다 좋게 받아주시는 분들도 계시지만 일단 썽부터 내시는분들도 종종 있다ㅋㅋㅋㅋ 2분이상 통화를 하는걸로... ,간호사가 하는 DB손해보험 설계사,https://blog.naver.com/nice9464,20210503
"美-中, 국방장관 <b>통화</b> 놓고도 양보없는 신경전",https://blog.naver.com/bubsa0701?Redirect=Log&logNo=222365618727,"美국방, 中부주석과 세번 통화시도 中, 급이 안맞다고 판단해 모두 거절 “통화 원한다면 국방부장에 하라” “미국 국방장관이 중국과 <b>통화하기</b>를 원한다면 중국 국방부장(장관)에게 전화하라.” 로이드... ",정현법사,https://blog.naver.com/bubsa0701,20210525
화웨이 <b>통화</b>가능 저가형 7인치 안드로이드 태블릿... ,https://ocer.kr/6955,"브랜드에서는 통화 가능한 태블릿은 잘 보이지 않고 있습니다. 화웨이 미디어패드 x1이 갤럭시탭 7.7 보다는 작긴 하나, 손으로 들고 <b>통화하기</b>엔 부담스러운 크기입니다. 중국 시장이 워낙 크다 보니... ","IT, 사진, 자동차, 리뷰로 보는 세상 이야기",https://ocer.kr/,20140202
월간 &lt;공무원연금&gt; 2021년 1월 호 [앱보관함] 우리 사이 ON!,https://blog.naver.com/geps_hongbo?Redirect=Log&logNo=222270879211,"하단의 ‘친구랑 <b>통화하기</b>’를 눌러 다른 사람들에게 초대 메시지를 보냅니다. 단, 상대방도 ‘나를’ 앱에 가입되어 있어야 합니다. 3. 영상통화 화면 하단의 다양한 필터와 3D 아바타를 활용해 영상 통화를... ",연금플러스,https://blog.naver.com/geps_hongbo,20210310
아이와 영상<b>통화하</b>는 가장 적합한 시간은?,https://blog.naver.com/zest999?Redirect=Log&logNo=50181249852,"아이들이 학교 가기 전 <b>통화하기</b>. 아침이 바쁘니, 감성적인 통화가 될 가능성이 없다. 오늘도 활기찬 하루를 시작할 수 있게 서로 아자아자! 외쳐줄 수 있다. 아이들과 <b>통화하기</b> tip 2. Skype이 제일... ",공부하는 엄마,https://blog.naver.com/zest999,20131015
