title,link,description,bloggername,bloggerlink,postdate
온라인<b>원예</b>강사 자격증반과정 전국<b>원예</b>치료수업4번째 강의... ,https://blog.naver.com/ynj0127?Redirect=Log&logNo=222229232001,마음<b>원예</b>교육지도사로 활동하는 꽃놀이샘 책놀이샘입니다. 이번 온라인으로 전국에 계신 선생님들과 함께 하는 수업은 노인<b>원예</b>치료에 대한 내용입니다. 실버<b>원예</b>! 노인<b>원예</b>테라피 - 고무신을 이용한... ,"꽃이야나무야 본사 (원예치료, 원예키트 전문)",https://blog.naver.com/ynj0127,20210202
나비의 한살이 꽃상자 만들기 초등/유아 <b>원예</b>활동,https://blog.naver.com/paltrow2?Redirect=Log&logNo=222435481718,그래서 생태교육과 <b>원예</b>의 융합체험활동이 되는 '나비의 한살이 꽃상자 만들기'는 유아와 초등학생에게... 좋은 <b>원예</b>체험활동이랍니다. 더불어 나비의 한살이 과정을 통해 때로는 기다림과 인고의 시간이... ,긍정심리 원예치료,https://blog.naver.com/paltrow2,20210718
동탄사회복지관 힐링<b>원예</b>프로그램 스칸디아모스 led정원... ,https://blog.naver.com/miyaa1212?Redirect=Log&logNo=222280343969,"힐링<b>원예</b>프로그램 스칸디아모스 led 입체정원 만들기 식물디자인공방 MIMI그라스... 힐링<b>원예</b>프로그램에 들어가는 재료들은 스칸디아모스와 프리저브드 소재들, 그리고 피규어와 꾸밈재료들이 함께... ",원예통합교육 미미그라스,https://blog.naver.com/miyaa1212,20210319
서울경기그림책<b>원예</b>테라피/그림책알사탕/경기<b>원예</b>힐링수업... ,https://blog.naver.com/yaeun55?Redirect=Log&logNo=222404871106,그림책과 함께하는 <b>원예</b>테라피 입니다 서울경기그림책<b>원예</b>테라피/그림책알사탕/경기<b>원예</b>힐링수업/분당그림책<b>원예</b>테라피 마리의정원 ***.****.**** 수업시엔 전화를 받을수 없어요 메세지 남겨주셔요... ,마리의 정원(그림책원예테라피),https://blog.naver.com/yaeun55,20210621
[감동성남] 편백나무 조각 활용 힐링<b>원예</b>드로잉키트 제작... ,https://blog.naver.com/sntjdska123?Redirect=Log&logNo=222177618784,힐링<b>원예</b>드로잉 키트를 제작해 성남시의료원 의료진에 기부를 계획했습니다. 펀딩이 무사히 끝나고 계획한 50개의 힐링<b>원예</b>드로잉 키트를 제작해 성남시의료원 의료진에 전달하기 위해 방문했습니다. 키트가... ,성남시 공식 블로그,https://blog.naver.com/sntjdska123,20201218
"5월 남해여행, <b>원예</b>예술촌 지금 가면 딱 좋아!(+독일마을)",https://blog.naver.com/0623ky?Redirect=Log&logNo=222349377014,"이번 기회에 오빠랑 함께 관광객 모드로 <b>원예</b>예술촌과 독일마을을 다녀왔답니당 섬마을 해물칼국수 남해 도착하자마자 <b>원예</b>예술촌, 독일마을 가기 전 집 들러서 엄마빠 보고, 어버이날 선물 드리고, 엄마가... ",굥's 博客 / blog,https://blog.naver.com/0623ky,20210513
"my tastes 취향산책; 유튜브 오늘도삽질, <b>원예</b>예능",https://blog.naver.com/gloryoflord?Redirect=Log&logNo=222402179899,"<b>원예</b>예능 “오늘도 삽질” 너모 좋다!! 진짜 삽질하고, 식물심는 예능~ 유튜브에서 볼 수 있다. 작업 후 모습 화단의 모습이 뭔가 부족?해 보일수도 있지만 이거 진짜 어려운건데… 무에서 유를... ",solitary place,https://blog.naver.com/gloryoflord,20210618
<b>원예</b>치료-노인들의 손기능과 인지능력향상을 위한 <b>원예</b>활동,https://blog.naver.com/lifemoa?Redirect=Log&logNo=222200061436,"노인<b>원예</b>치료 손기능향상 <b>원예</b>활동 <b>원예</b>치료(HorticulturalTherapy)란 꽃장식과 식물기르기 등 다양한 <b>원예</b>활동을 통하여 사회적,교육적,심리적,신체적 적응력을 키우고,정신과육체의 장애를 개선하고... ",수원대 화훼조형학 원예치료 과정,https://blog.naver.com/lifemoa,20210107
테라리움 키트[<b>원예</b>프로그램],https://blog.naver.com/bijo972?Redirect=Log&logNo=222236192710,"#테라리움키트 #<b>원예</b>키트 코로나로 모두 힘드시죠~ 잘 될 거라고, 잘 할 거라고, 생각하고 다짐하고 스스로를 응원하는 시간이 필요한 듯해요. 코로나로 인해 수업이 취소가 되고 비대면 키트로 납품이... ",인사이트9교육연구소 [Insight Horticulture Therapy],https://blog.naver.com/bijo972,20210208
"전남대 학부생(<b>원예</b>생명공학과), 과일·채소 씻어내는 신기술 개발",https://blog.naver.com/yeschonnam?Redirect=Log&logNo=222324924233,전남대 송현종 학생(<b>원예</b>생명공학과 4년. 지도교수 구강모)은 오존수와 계면활성제를 활용해... *문의: 062)530-2060 (전남대학교 <b>원예</b>생명공학과) *논문:A Double-Edged Sword of Surfactant Effect on... ,전남대학교 공식 블로그 전대미인(全大美人),https://blog.naver.com/yeschonnam,20210427
"비누향과 함께하는 <b>원예</b>활동, 대전성세재활학교 비누꽃 꽃바구니",https://blog.naver.com/serimflower?Redirect=Log&logNo=222262387742,&quot;대전성세재활학교 비누꽃 꽃바구니&quot; 저희 세림<b>원예</b>연구소는 대전의 성세재활학교에 방문하여 <b>원예</b>활동으로 비누꽃 꽃바구니를 만들어보았습니다. 오늘의 <b>원예</b>활동 테마는 '향기' 본 프로그램을 하기 앞서... ,행복한 세상의 숲,https://blog.naver.com/serimflower,20210302
<b>원예</b>테라피,https://blog.naver.com/423739?Redirect=Log&logNo=222178057808,하모니카 동아리반과 <b>원예</b>테라피반 같은날 같은시간이라 참 고민이다 하모니카를 권하는친구가 있었지만 난 <b>원예</b>테라피를 선택했습니다 식물을 만지고 심고 기르는 개성이 다른 식물의 성장과정과... ,꿈을키우는 단비의뜨락~~~^^*,https://blog.naver.com/423739,20201218
노숙인의 삶의질 향상 을 위한 <b>원예</b>치료,https://blog.naver.com/lifemoa?Redirect=Log&logNo=222260761272,"노숙인 재활을 위한 <b>원예</b>프로그램 경제악순환으로 인한 실업률 증가,불안정한 가정환경,각종 질병 및... 노숙인을 대상으로 집단<b>원예</b>치료를 진행했을 때 구성원간의 대화시간,타인을도와줄 수 있는 기회... ",수원대 화훼조형학 원예치료 과정,https://blog.naver.com/lifemoa,20210301
다이소 <b>원예</b>용품 득템후기,https://blog.naver.com/hjkwon1110?Redirect=Log&logNo=222436451081,위사진은 다이소 <b>원예</b>용품 전체샷이랍니다! 위 화분은 토분은 아니고 도자기?재질의 화분이에요.... (바닥에 홀도 있으니 더 좋죠?!) 로얄블루 색상 정도 되니 참고 하세요^^ 옆에 있는 <b>원예</b>용 철끈은 색상이 너무... ,Johnny home,https://blog.naver.com/hjkwon1110,20210718
<b>원예</b>교육복지사 1급,https://blog.naver.com/kkk2082k?Redirect=Log&logNo=222166020323,힐링<b>원예</b>치료센터의 <b>원예</b>교육복지사 1급 취득~ 2020년 코로나 19로 인해 올상반기 체험진행 프로그램들이 연기되어 여러가지 공부하는 시간을 가질 수 있었어요. 아직까지는 국가자격증이 없어 민간가격증을... ,와송약초나라,https://blog.naver.com/kkk2082k,20201207
배달 오는 <b>원예</b> 컨설팅 &lt;시민기자 정덕현&gt;,https://blog.naver.com/osan_si?Redirect=Log&logNo=222166767210,11월 20일부터 12월 12일까지 <b>원예</b> 전문 강사가 각 가정을 직접 방문하여 가정의 <b>원예</b> 환경을 진단하고 홈 가드닝 기법을 알려주는 '1 대 1 맞춤 <b>원예</b> 컨설팅'이 있습니다. 코로나로 방문이 꺼려지기도 하지만 각... ,오산시 블로그,https://blog.naver.com/osan_si,20201208
가정<b>원예</b>:: 화분에서 키운 인동초도 겨울한파 잘 이겨 내고... ,https://blog.naver.com/syspapa?Redirect=Log&logNo=222281829801,"블로그 9년차, 가정<b>원예</b> 6년차입니다. 가정<b>원예</b>라고 굳이 내세울 거는 없고 전문성도 없습니다. 꽃작물과 밭작물 위주로 소소하게 화분 키우기에 재미를 제법 붙였습니다. 화분개수가 많을 때는 자잘한 거 까지... ",풀꽃처럼,https://blog.naver.com/syspapa,20210320
(원격) * 엄마와 함께 <b>원예</b> 아트 *  [군위군청소년상담복지센터],https://blog.naver.com/myhouse72?Redirect=Log&logNo=222246554360,농부는 추운 겨울과 코로나19로 인하여 집콕 중인 쪼꼬미 조카들을 위해 새로운 경험인 <b>원예</b> 아트 수업에 참가하였습니다!! 사실 저도 <b>원예</b> 치료에 관심이 있는데 원격으로 진행되는 수업이 있다는 소식에 얼른... ,덕동칠이농원,https://blog.naver.com/myhouse72,20210217
[대전<b>원예</b>치료사/대전독서<b>원예</b>치료사/그림책플라워테라피... ,https://blog.naver.com/skyee10?Redirect=Log&logNo=222346990712,그리고 그 미자에게 하고 싶은 말을 적어 보았어요 우리의 미자를 환하게 밝혀주는 하바리움과 꽃 엽서를 만들어보았어요 오늘도 수고하셨습니다 다음시간에 만나요~~~ 대전<b>원예</b>치료사/대전독서<b>원예</b>치료사... ,그림책플라워공방 작은숲,https://blog.naver.com/skyee10,20210511
[ 트렌드 ] <b>원예</b>서비스를 제공하는 환경 변화 어떻게 대처하고... ,https://blog.naver.com/ppi74?Redirect=Log&logNo=222289218566,자연누리는 2002년부터 <b>원예</b> (화훼/과수/채소/정원)학과 심리학를 배우고 익히며 정서심리프로그램과 <b>원예</b>프로그램을 교육하는 일을 해오고 있습니다. 이 분야 일을 하신분들은 아시겠지만 <b>원예</b>는 수업을 위해... ,자연누리,https://blog.naver.com/ppi74,20210327
대전<b>원예</b>치료/대동종합사회복지관 공기정화식물심기/<b>원예</b>치료... ,https://blog.naver.com/serimflower?Redirect=Log&logNo=222265860251,&quot;대동종합사회복지관 공기정화식물 심기&quot; 저희 세림<b>원예</b>연구소는 대전의 대동종합사회복지관에... 저희 세림<b>원예</b>연구소는 아이들의 행복한 미래를 위해 오늘도 힘차게 달려나갑니다. #대전<b>원예</b>치료... ,행복한 세상의 숲,https://blog.naver.com/serimflower,20210305
에덴  앞치마/예쁜 여름용 앞치마/<b>원예</b> 공방 까페 에이프런,https://blog.naver.com/mhssuk7979?Redirect=Log&logNo=222323595593,"시켜주세요^^ 주방에서~~ 공방에서~~ <b>원예</b>하시는 분들께도 추천드려요. 네 이 비 예쁘게 퍼지는 플레어 스타일로 활동하기 편하고, 구김이 잘 가지않는 원단으로 홈웨어로도... ",쉐비블랑체 shabby blanche,https://blog.naver.com/mhssuk7979,20210426
<b>원예</b>심리상담사 자격증 인강으로 취득했어요,https://blog.naver.com/taixun5429?Redirect=Log&logNo=222088937783,그러다가 알게 된 곳이 바로 한국자격검정평가진흥원인데 저는 그 중에서도 <b>원예</b>심리상담사 자격증에... <b>원예</b>심리상담사 자격증을 딴다고 해서 바로 취직도 하고 전망이 그렇게 밝느냐고 하는 의문은 생길... ,하늘을 나는 슈퍼맨,https://blog.naver.com/taixun5429,20200914
2기_그린<b>원예</b>지도사 2급 양성과정 수강생 모집,https://blog.naver.com/yeason?Redirect=Log&logNo=222224223143,한국사이버<b>원예</b>대학입니다. 코로나 시대에 대응하기 위해 한국사이버<b>원예</b>대학이 2021년 시행한 첫번째 프로젝트! 그린<b>원예</b>지도사 2급 양성과정 줌강좌가 절찬리에 1기 모집을 마감하였습니다. 2월부터... ,한국사이버원예대학 도시농업 전문인력 양성기관,https://blog.naver.com/yeason,20210129
1310 도슨목련 '클라크' - 중국 광엽옥란의 <b>원예</b>품종,https://blog.daum.net/tnknam/1756,1310 도슨목련 '클라크' - 중국 광엽옥란의 <b>원예</b>품종 댓글 0 목련과 옥란속/기타옥란속 2021. 1. 20.... 도슨목련의 <b>원예</b>품종이다. 도슨목련 즉 Magnolia dawsoniana의 원산지 중국명은 길이 14cm인 이... ,낙은재 (樂隱齋),https://blog.daum.net/tnknam,20210120
비대면 체험키트  이천 매곡초 병설유치원 꽃바구니 <b>원예</b>수업 재료,https://blog.naver.com/miyaa1212?Redirect=Log&logNo=222251982579,유치원 비대면 체험키트 체험재료 꽃바구니 봄 <b>원예</b>수업 식물디자인공방 MIMI그라스 이천 매곡초 병설유치원으로 꽃바구니 <b>원예</b>수업 체험재료가 배송되었어요 1인 1키트로 제작되어 이른 봄을 물씬 느낄 수... ,원예통합교육 미미그라스,https://blog.naver.com/miyaa1212,20210222
비대면 <b>원예</b>치료 줌화상수업 LED캔들 넬솔다육아트,https://blog.naver.com/miyaa1212?Redirect=Log&logNo=222177445399,"비대면 <b>원예</b>치료 넬솔로 만드는 다육아트 식물디자인공방 MIMI그라스 건강가정다문화가족지원센터의 <b>원예</b>치료사되기, 2기 수업중입니다. 6회기중 5회기 수업이 줌화상으로 이루어졌네요. 매 회기별 다양한... ",원예통합교육 미미그라스,https://blog.naver.com/miyaa1212,20201218
핫딜쇼핑 <b>원예</b>가위 판매 순위 비교,https://sulpibat.tistory.com/entry/%ED%95%AB%EB%94%9C%EC%87%BC%ED%95%91-%EC%9B%90%EC%98%88%EA%B0%80%EC%9C%84-%ED%8C%90%EB%A7%A4-%EC%88%9C%EC%9C%84-%EB%B9%84%EA%B5%90,핫딜쇼핑 <b>원예</b>가위 판매 순위 비교 추천하는 <b>원예</b>가위 정리해 봤어요. 인기도 및 판매도 순위 1위 제품이 포함되어있는 <b>원예</b>가위 제품의 리스트중 제품 선택해보세요.... ,https://sulpibat.tistory.com,https://sulpibat.tistory.com/,20210530
이오난사 테라리움 <b>원예</b>테라피로 더운 여름을 시원하게,https://blog.naver.com/ongdalsaemhealing?Redirect=Log&logNo=222437184310,야자수가 있는 바닷가로 함께 힐링여행 떠나요 다양한 프로그램 안내는 홈페이지를 참고해주세요~ 옹달샘힐링<b>원예</b> 교육협동조합 odshealing.com 옹달샘힐링<b>원예</b>는 각지역 <b>원예</b>수업 <b>원예</b>강사들의 협동조합입니다.... ,옹달샘힐링원예 교육협동조합법인,https://blog.naver.com/ongdalsaemhealing,20210719
"농어촌공사,  친환경 연료전지-시설<b>원예</b> 융합 비즈니스 모델 개발",https://blog.naver.com/coq?Redirect=Log&logNo=222288201390,"시설<b>원예</b> 농가의 경우 생산비의 40%를 차지하는 난방비 문제를 해결하는 것이 시급한 과제다. 이에... 이 시스템은 연료전지발전 과정에서 발생한 이산화탄소를 포집해 시설<b>원예</b>에 시비하고, 발생한 열은 온실... ",coq,https://blog.naver.com/coq,20210326
남촌<b>원예</b>(플로리아) 단독 하우스로 이사 가요!,https://blog.naver.com/myfloria?Redirect=Log&logNo=222172189011,"지금까지 용인 남사 '에르베플라워아울렛' 내에 입점되어 있던 저희 남촌<b>원예</b>(플로리아)가 이번 달... 이전과 마찬가지로 관엽, 허브, 분갈이는 물론이고 저희 남촌<b>원예</b>(플로리아)는 생화도 판매하고 있어요.... ",남촌원예(FLORIA) 꽃과 식물이 있는 공간,https://blog.naver.com/myfloria,20201213
<b>원예</b>치료 수업을 위한 방산시장 투어 ~~,https://blog.naver.com/lifemoa?Redirect=Log&logNo=222221621376,<b>원예</b>재료 및 기타여러가지 장식소품 파는 곳을 방문하고 여러가지수업아이템을 개발하기 위해서... *제과제빵 재료 *포장지재료 및 <b>원예</b>수업에 필요한 용기 *천연염색 손수건 만들기 재료. *나무공예및... ,수원대 화훼조형학 원예치료 과정,https://blog.naver.com/lifemoa,20210127
유치원 꽃놀이수업 연간계획안 활동 <b>원예</b>체험 자동차꽃길... ,https://blog.naver.com/ynj0127?Redirect=Log&logNo=222248147066,"마음<b>원예</b>교육지도사로 활동하는 꽃놀이샘 책놀이샘입니다. 유치원 및 학교 그리고... 꽃수업, <b>원예</b>체험수업을 찾아오는 방문체험학습으로 결정하시고 수업일정을 미리 예약하시느라 분주하답니다. 이번엔... ","꽃이야나무야 본사 (원예치료, 원예키트 전문)",https://blog.naver.com/ynj0127,20210218
"힐링 <b>원예</b>/ 우리 집 다육 정원... 화성 <b>원예</b> 수업, <b>원예</b> 강의... ",https://blog.naver.com/aseun611?Redirect=Log&logNo=222361821120,날이 따뜻한 토요일 오전 <b>원예</b> 수업을 하기 위해 가족들과 함께합니다 토요일이면 놀러 가기 좋은데... 감사합니다 밝은해바라기의 모든 프로그램은 키트 구성이 가능해요 키트 금액과 <b>원예</b> 강의 관련... ,밝은해바라기 감성원예,https://blog.naver.com/aseun611,20210524
안양안일초/삼각꽃케익/그림책<b>원예</b>테라피/경기<b>원예</b>힐링수업,https://blog.naver.com/yaeun55?Redirect=Log&logNo=222386572562,#분당<b>원예</b>테라피 #분당그림책<b>원예</b>수업 #경기그림책<b>원예</b>수업 #<b>원예</b>키트납품 완벽셋팅!! 5회기 마지막 수업이네요. 너무나 친절한 선생님 두분과 함께 있는 6명 학생들. 벌써 5회기 라니 시간이 정말 빠릅니다... ,마리의 정원(그림책원예테라피),https://blog.naver.com/yaeun55,20210606
<b>원예</b>치료-정신지체장애인 <b>원예</b>치료,https://blog.naver.com/lifemoa?Redirect=Log&logNo=222210004353,정신지체장애인 <b>원예</b>치료 <b>원예</b>는 예로부터 인간에게 매우 익숙하고도 보편적인 활동으로 선호도가 매우높고 스트레스 상태를 감소시키는 기능을 가지고 있다. 또한 Lewis(1978)는 인간은자연 환경 내에서 비... ,수원대 화훼조형학 원예치료 과정,https://blog.naver.com/lifemoa,20210117
창원 치매안심센터에 <b>원예</b>치료 다녀왔어요,https://blog.naver.com/jflower2376?Redirect=Log&logNo=222392815709,오랜만에 <b>원예</b>치료 포스팅이네요 ^^ 창원 상남동 시내에 위치한 치매 안심 센터에 <b>원예</b>치료를 다녀왔어요 새로 생긴 시설만큼 시설이 깨끗하고 좋더라고요 치매예방을 위한 여러 가지 수업들이 이루어지는... ,보네르 플로르,https://blog.naver.com/jflower2376,20210610
남현유치원 <b>원예</b>수업 재료 세팅중입니다 꽃놀이수업  <b>원예</b>체험... ,https://blog.naver.com/ynj0127?Redirect=Log&logNo=222294860027,식물은 햇빛과 물이 있어야 잘 자라듯이 아이들은 사랑과 즐거운 놀이수업과 행복한 경험을 많이 해야 빛이 나는 사람으로 성장하겠지요? 내일 남현유치원에서 꽃바구니 <b>원예</b>수업활동으로 만나요!!,"꽃이야나무야 본사 (원예치료, 원예키트 전문)",https://blog.naver.com/ynj0127,20210401
키즈<b>원예</b> .키즈가드닝 .관엽식물심기 .엄마표놀이,https://blog.naver.com/hyein4472?Redirect=Log&logNo=222313620688,정해주고 2개씩심은 관엽식물들은 커피캐리어에 담아들고 집으로 고고씽 집에서 의 하루일과 물주기 예쁜말해주기 ㅋㅋㅋ21년 현재는 다죽고ㅠㅠ 쿠키만이 살아있다는 슬픈이야기 ㅠㅜ 키즈가드닝 .키즈<b>원예</b>,세상에서 가장쿨하고 심플한엄마되기,https://blog.naver.com/hyein4472,20210417
<b>원예</b>치료- 어르신을 위한 <b>원예</b>활동,https://blog.naver.com/lifemoa?Redirect=Log&logNo=222209114528,"노인 <b>원예</b>치료 노인은 생리적・생물학적인면에서퇴화기에있는사람으로심리적인면에서정신기능과... <b>원예</b>치료는 노인들의 건강 유지와 증진,만성질환이나 장애가 있는 노인들의 재활,그리고치매와 같은... ",수원대 화훼조형학 원예치료 과정,https://blog.naver.com/lifemoa,20210116
남해 독일마을과 <b>원예</b>예술촌 산책,https://blog.daum.net/shadha/13758105,남해군청과 지족항을 지나서 <b>원예</b>예술촌 주차장에 당도하였다. 가족들과 <b>원예</b>예술촌과 독일마을이 만나는 곳에 위치한 &lt;도이처파크&gt;야외 테라스에 앉아서 유자아이스크림을 먹으며 쉬다가 독일마을... ,행복한 여행자의 독백,https://blog.daum.net/shadha,20210712
<b>원예</b>치료-정신장애인 <b>원예</b>치료,https://blog.naver.com/lifemoa?Redirect=Log&logNo=222209088963,"정신장애인 <b>원예</b>치료- <b>원예</b>치료는 원래 정신장애인이나 지적장애아에게 <b>원예</b>활동을 시키는 과정에서 그 효과가 주목된 데서 비롯되었으며(Relf,1981),<b>원예</b>활동을 통해신체적 기능적 훈련과 더불어 인지... ",수원대 화훼조형학 원예치료 과정,https://blog.naver.com/lifemoa,20210116
지자체 드림스타트 비대면 체험프로그램 아동<b>원예</b>교육키트,https://blog.naver.com/miyaa1212?Redirect=Log&logNo=222065558635,집콕놀이 키트를 통해 비대면 <b>원예</b>활동을 체험하고 또 반려식물의 의미와 가족들과의 즐거운 추억을 함께 만들게 됩니다. 한 분 한 분의 집으로 드림스타트 아동<b>원예</b>프로그램키트가 소중하게 배송됩니다.... ,원예통합교육 미미그라스,https://blog.naver.com/miyaa1212,20200820
제주도 도시형 텃밭 생활<b>원예</b> 프로그램 운영,https://blog.naver.com/humanvillage?Redirect=Log&logNo=222347633541,제주농업기술센터가 농업을 기반으로 한 「도시형 텃밭 생활<b>원예</b> 프로그램」 운영을 통해 공동체문화... 매년 제주농업기술센터에서는 도시농업 활성화를 위한 도시<b>원예</b>텃밭 조성에 나서고 있다.... ,제주도시인의 부동산,https://blog.naver.com/humanvillage,20210512
군산<b>원예</b>농협 뽀사뿌까 [라면 완전정복 1059화] - 라면스낵,https://blog.naver.com/pikich89?Redirect=Log&logNo=222222780138,"라면 완전정복 1059화에서는 군산<b>원예</b>농협 뽀사뿌까 라면스낵 제품을 소개해 드릴게요 :D 2020년 1월에 출시된 군산짬뽕라면과 뽀사뿌까 라면스낵 제품. 이 제품은 전북 군산시와 전북 군산<b>원예</b>농협, 군산지역... ",라면 완전정복,https://blog.naver.com/pikich89,20210128
[대전<b>원예</b>치료사/대전독서<b>원예</b>치료사/그림책플라워테라피... ,https://blog.naver.com/skyee10?Redirect=Log&logNo=222338020112,^^ 대전<b>원예</b>치료사/대전독서<b>원예</b>치료사 /그림책플라워테라피/그림책<b>원예</b>심리 . 어서오세요그대 . 수업 및 키트문의 . *** - **** - **** #어서오세요그대 #대전<b>원예</b>치료사 #대전독서<b>원예</b>치료사... ,그림책플라워공방 작은숲,https://blog.naver.com/skyee10,20210504
<b>원예</b>초보는 날이면 날마다 분갈이 (부제 - 이쯤되면 감자에... ,https://blog.naver.com/oksusubread?Redirect=Log&logNo=222321819760,(땀) <b>원예</b>초보는 힘들다(땀) 며칠전 봉선화 ↑ 오늘자 봉선화 ↓ 파릇파릇해지긴 했는데 너무 빽빽한것 같기도 하고. 장로님이 거의 다한 감자 옮기기ㅋㅋㅋㅋㅋㅋㅋㅋ &quot;아직 감자 안 열렸네!?!?! 2-3달이면 감자... ,마왕과 악마와 장로와 동거하는 용자,https://blog.naver.com/oksusubread,20210424
문화예술치유 <b>원예</b>치료와 미술치료의 만남 비대면 체험놀이,https://blog.naver.com/miyaa1212?Redirect=Log&logNo=222206819666,"<b>원예</b>활동과 그림이 만나면 자아의 지금 내면이 표현되고 또 치유로 이어집니다. 문화예술치유 프로젝트 식물디자인공방 MIMI그라스 MIMI그라스 new콘텐츠, <b>원예</b>치료와 미술치료의 만남. 문화예술치유... ",원예통합교육 미미그라스,https://blog.naver.com/miyaa1212,20210114
원린이의 야매 가정<b>원예</b>... 나가도록 <b>원예</b>용 폴대를 세우고... ,https://blog.naver.com/syspapa?Redirect=Log&logNo=222370152135,원린이의 야매 가정<b>원예</b> 가정<b>원예</b> 초보입니다. 몇일 전에 꽃피기 시작한 힌색 인동초는 비 온 뒤 활짝 피어나고 있습니다. 힌색 인동초를 힌동초라고 일컫는 이웃도 계시던데 저는 처음 듣지만 참 재미는 말... ,풀꽃처럼,https://blog.naver.com/syspapa,20210527
[대전<b>원예</b>치료사/대전독서<b>원예</b>치료사/그림책플라워테라피... ,https://blog.naver.com/skyee10?Redirect=Log&logNo=222337968110,다음에 또 보이요 대전<b>원예</b>치료사/대전독서<b>원예</b>치료사 /그림책플라워테라피/그림책<b>원예</b>심리 . 어서오세요그대 . 수업 및 키트문의 . *** - **** - **** #대전<b>원예</b>치료사 #대전독서<b>원예</b>치료사 #그림책플라워테라피... ,그림책플라워공방 작은숲,https://blog.naver.com/skyee10,20210504
<b>원예</b>예술치료지도사 개강안내,https://blog.naver.com/vkxlfk?Redirect=Log&logNo=222237244840,등 <b>원예</b>치료 활동을 필요로 하는 곳이 많다 갈수록 매마르고 자기중심적으로 되어가는 현실속에 우리의 삶속에 진정한 쉼과 회복이 있도록 <b>원예</b>치료사들의 활동이 매우 필요한 때가 아닌가 싶다... ,cksflower/cksflorist academy,https://blog.naver.com/vkxlfk,20210209
