title,link,description,bloggername,bloggerlink,postdate
스텝퍼 <b>걷기</b> 운동 해야 하는 이유,https://blog.naver.com/iksoo1818?Redirect=Log&logNo=222371665752,뛰기는 귀찮고 <b>걷기</b>라도 해야 하는데 그냥 저냥 시간만 보내고 늘어나는 뱃살은 스트레스만 쌓이게... <b>걷기</b>는 가장 쉽고 편한 유산소운동입니다. 걷는 것 만으로도 100개가 넘는 근육을 움직여 우리몬의 긴장을... ,아이에스코리아,https://blog.naver.com/iksoo1818,20210528
허리디스크. 물리치료. 견인치료부작용. <b>걷기</b>운동 다시 시작.,https://blog.naver.com/smilecat83?Redirect=Log&logNo=222415826315,느껴서 이 언니 영상보고 10분정도 추가 운동 했다 (서서 할 수 있는 운동을 찾다보니) 내일 오늘보다 더 나아 있기를 바래본다 ㅠ #허리디스크 #허리4번5번디스크 #허리견인치료부작용 #<b>걷기</b>운동 #ABS10분운동,소소한이야기 :),https://blog.naver.com/smilecat83,20210630
<b>걷기</b>운동 다이어트효과와 칼로리,https://blog.naver.com/hhj1004w?Redirect=Log&logNo=222277935880,<b>걷기</b>운동 다이어트효과와 칼로리 많이 걷는게 좋다는걸 알지만 말처럼 쉽지 않은 요즘 날씨가 풀리기... 준비물이 있는것이 아니라 누구나 쉽게 접근할 수 있는 운동중에 하나라 오늘은 <b>걷기</b>운동에 대해... ,쫑알쫑알이야기공장♥,https://blog.naver.com/hhj1004w,20210316
"제주 봄에 <b>걷기</b>좋은곳, 신화전설탐방로 '신나락만나락'",https://blog.naver.com/fly_jam?Redirect=Log&logNo=222319062980,"제주 봄에 <b>걷기</b>좋은곳, 신화전설탐방로 '신나락만나락' 오늘은 제주 봄에 <b>걷기</b>좋은곳 신나락만나락을 소개해요! 벌써 5월이 코앞으로 성큼 다가온만큼 푸릇푸릇한 봄기운을 만끽하며 걷는 것만큼 힐링되는... ",제주항공우주박물관,https://blog.naver.com/fly_jam,20210426
"“신나게 걷고 건강도 챙기고 선물도 챙기고” 시흥시, <b>걷기</b>王... ",https://blog.naver.com/siheungblog?Redirect=Log&logNo=222328831665,증진시키고자 <b>걷기</b>王 선발이벤트를 개최합니다. <b>걷기</b>왕 선발이벤트는 시흥시민을 대상으로 진행합니다. 월별 누적 걸음 수를 확인 할 수 있는 <b>걷기</b> 어플을 설치한 다음 5월 1일부터 5월 31일까지 한 달 간... ,"행복한 변화, 새로운 시흥",https://blog.naver.com/siheungblog,20210430
행사] 비대면으로 참여하는 「2021 한마음 치매극복 <b>걷기</b> 행사」,https://blog.naver.com/wonju_city?Redirect=Log&logNo=222371439734,<b>걷기</b>는 우울감 회복에도 좋고 치매 예방에도 좋답니다~ <b>걷기</b>를 좋아하시거나 걷는 습관을 만들고 싶은 분이라면 원주시 치매안심세터와 함께 한마음 치매극복 <b>걷기</b> 행사에 참여해보세요~ 스마트폰에... ,원주시 공식 블로그,https://blog.naver.com/wonju_city,20210528
2021년 비대면 북구 <b>걷기</b>대회 참여하세요!,https://blog.naver.com/buk_daegu?Redirect=Log&logNo=222318039117,"2021년 비대면 북구 <b>걷기</b>대회 참여하세요! 여러분 우리 일상 속에서 특별한 것을 따로 하지 않아도, 올바른 <b>걷기</b> 운동으로 건강을 지킬 수 있다는 사실 알고 계신가요? 우리 북구보건소에서는 꾸준히 <b>걷기</b>... ",대구 북구청 공식 블로그,https://blog.naver.com/buk_daegu,20210422
[맨발<b>걷기</b>10일차]때죽나무 꽃길 맨발<b>걷기</b>,https://blog.naver.com/whlee0517?Redirect=Log&logNo=222362479612,오름 맨발 <b>걷기</b> 40분. 한적한 오솔길. 처음에는 혼자 오기 무서웠던 곳인데 자주 오다보니 이제... 덕분에 나의 맨발 <b>걷기</b>는 꽃길 <b>걷기</b>가 되었다! 초록초록 꽃이 떨어진 숲길. 꽃길을 맨발로 걷고 내려오는 동안... ,세상을 밝히는 빛,https://blog.naver.com/whlee0517,20210523
<b>걷기</b> 수행 ; 그렇게 걷고 나면 막혔던 호흡이 뻥 뚫립니다.,https://blog.naver.com/simplebean33?Redirect=Log&logNo=222424119066,그렇게 걷고 나면 막혔던 호흡이 뻥 뚫립니다. 169 호흡이 자유로워지니까 허리에 힘도 생기고 집중력도 높아지고 정신 또한 맑아집니다. 그래서 처음 좌선을 시작할 때는 먼저 <b>걷기</b> 수행을 하면 좋습니다.,Here&Now,https://blog.naver.com/simplebean33,20210708
"가볍게 <b>걷기</b> 좋은 길, 서울 보라매공원 데이트",https://blog.naver.com/fromrei8?Redirect=Log&logNo=222285227154,"가볍게 <b>걷기</b> 좋은 길 서울 보라매공원 데이트 나무들이 아직 가지만 앙상하다 생각했더니만, 나무 위를... 가까운 곳에서 가볍게 <b>걷기</b> 좋은 길을 찾아 보라매공원으로~! 도심 속 공원, 꽤 크다 도심 속... ",프롬레이의 여행잡화점,https://blog.naver.com/fromrei8,20210323
송촌생활체육공원 <b>걷기</b>,https://blog.naver.com/daedeokgu?Redirect=Log&logNo=222276163354,송촌생활체육공원 <b>걷기</b> 정부는 3월 14일로 종료예정이었던 현재의 사회적 거리두기 단계를 3월... 가장 쉬우면서도 효과가 좋은 <b>걷기</b> 운동의 경우 1주일에 3회에서 5회정도 30분이상 걸어주는것이 가장 큰... ,주민행복 대덕 이야기,https://blog.naver.com/daedeokgu,20210318
아침 <b>걷기</b> 이틀째,https://blog.naver.com/nencobus?Redirect=Log&logNo=222389305401,"중랑천 아침 <b>걷기</b>운동 2일차 운동친구들과 수,금빼고 매일<b>걷기</b>로 한지 이틀째^^ 비온다는 예보에 위기가있었지만, 다행이 비가안와 함께 걸을수있었다. 사실 옷 다갈아입고 나가려는데, 비와서 취소얘기나올땐..... ",여우의 탈을 쓴 곰이 사는방,https://blog.naver.com/nencobus,20210608
"상주여행, 여름나들이, 드라마 촬영지 :: 함께 <b>걷기</b> 좋은 곳... ",https://blog.naver.com/gbnadri?Redirect=Log&logNo=222398857669,공원 내부에는 출렁다리가 있으며 단순히 <b>걷기</b>만 하던 사람들에게 변화를.. 그리고 재미를 선물합니다. 이런 거 보이면 누구나 한 번쯤 올라가 보잖아요? 낙동강변에 가까워지면 드라마&lt;상도&gt;를 촬영한 촬영지도... ,가장 '자연'스러워지는 여행::경북관광 공식 블로그,https://blog.naver.com/gbnadri,20210615
만보 <b>걷기</b>,https://blog.naver.com/wjdgnl10?Redirect=Log&logNo=222394298260,오랫만에 만보걸었어요 ㅠㅠ 더워서 <b>걷기</b>포기하다가 오늘은 큰맘먹고 걸어보았어요 다행히 바람이... 만보<b>걷기</b>가 이리도 힘들어서 . . . 겨울에는 만보<b>걷기</b>가 수월했는데 더우니 걷는것조차 숨이 턱턱 차네요... ,하루한끼의 건강밥상,https://blog.naver.com/wjdgnl10,20210611
망월천~황산숲길 <b>걷기</b>,https://blog.naver.com/elrizabeth70?Redirect=Log&logNo=222367084976,"제가 작년 12월에 이사를 와서 <b>걷기</b> 시작한 망월천이 여름으로 들어서면서 초록 초록으로 변했어요 걷는... 평지만 <b>걷기</b>는 아쉬워서 황산숲길로 들어섭니다. 숲길이 거의 평지라서 아쉽지만, 아스팔트 깔린 길을... ",즐거운 인생,https://blog.naver.com/elrizabeth70,20210525
[100일 만보 <b>걷기</b> 프로젝트] 만보<b>걷기</b> #25일차,https://blog.naver.com/joshua_jinmk?Redirect=Log&logNo=222436334740,[100일 만보 <b>걷기</b> 프로젝트] 만보<b>걷기</b> #25일차 안녕하세요. 주말 마무리 잘 하고 계신가요? 주말에 운동하는게 쉽지 않네요. 매번 주말에 목표를 달성하는게 그리 쉽지만은 않은 것 같아요. 오늘 목표인 만보... ,그루터기의 친구들,https://blog.naver.com/joshua_jinmk,20210718
함께 걸어요 구리~ <b>걷기</b>운동하고 선물받자!!,https://blog.naver.com/song3558?Redirect=Log&logNo=222357132102,"구리시에서 <b>걷기</b>운동 캠페인을 하는건지 이벤트가 있어서 저도 신청해봤어요. play 앱스토어에서 워크온을 깔고 가입한다음에 이벤트 신청하고 그냥 날마다 <b>걷기</b>만 하면되요. 100,000보 걸으면 5/17~5/30일까지... ",쏭이의 작은 집에 놀러오신걸 환영합니다.,https://blog.naver.com/song3558,20210519
6Km <b>걷기</b>,https://blog.naver.com/miso79zzang?Redirect=Log&logNo=222397474980,2021 03 03 작년 11월 말에 아이들의 자발적인 의사로 2만원이라는 후원금을 각자 내고 6Km<b>걷기</b> 캠페인에... #월드비젼 #6Km<b>걷기</b>캠페인 #참여상은메달 #아이들의자존감뿜뿜 #다음에도참여하겠다는너희들 #마음을... ,그대 마음 속에 핀 꽃은 여전한가요..,https://blog.naver.com/miso79zzang,20210614
신안 섬 순례길 <b>걷기</b>,https://blog.daum.net/djdnfjd/2273,"섬 여행 80 신안 섬 순례길 <b>걷기</b> (대기점도, 소기점도, 소악도, 진섬, 딴섬) 0. 2021년 6월 30일 좋은 사람들과 신안에 있는 섬 순례길 을 <b>걷기</b>로 하였다. 신안 섬 순례길은 스페인의 순례길 산티아고에서 이름을... ",어우렁 사진기행문,https://blog.daum.net/djdnfjd,20210708
#6/10 - 1530건강<b>걷기</b> 8주 <b>걷기</b> 목표 달성~,https://blog.naver.com/dkfmarhc70?Redirect=Log&logNo=222393278630,"양산 보건소가 함께하는 1530건강<b>걷기</b> 운동(1주일에 5일 이상 30분 이상 만보 <b>걷기</b>)에 나는 2019년부터 매년 참여하고 있는데, 올해는 코로나의 영향으로 단체 모집 같은 것은 없이 혼자서 <b>걷기</b> 운동하는 방식으로... ",네잎클로버의 꿈,https://blog.naver.com/dkfmarhc70,20210610
210524-210530 가볍게 <b>걷기</b> 좋다더니 순개뻥이네,https://blog.naver.com/muzirang2?Redirect=Log&logNo=222413427994,"30 일 일요일에는 위례에 라떼 맛있다는 카페에서 커피 한잔 때리고 남한산성 둘레길 <b>걷기</b>로 함. 햐... 그랬는데 분명히 블로그 후기 올린 사람들이 쉬엄쉬엄 갈 수 있다, 가볍게 <b>걷기</b> 좋은 코스다 &lt;-라고 했단... ",Ordinary Days,https://blog.naver.com/muzirang2,20210628
<b>걷기</b>운동,https://blog.naver.com/wsl0523?Redirect=Log&logNo=222433446855,대부분 나이가 들면 건강보존식품이나 의약품에 의존하는 경우가 많지만 나는 따로이 챙겨 먹는 약이 없으니 몸 놀리지 말고 부지런히 <b>걷기</b>운동이라도 해야지 하는 심정으로.,팡팡코알라,https://blog.naver.com/wsl0523,20210716
"[아침<b>걷기</b>32] 오산천 원추리, 지칭개, 개망초",https://blog.naver.com/hjinmaum?Redirect=Log&logNo=222368336424,"노랗게 원추리 꽃으로 가득할 때까지 멈추지 않고 아침 <b>걷기</b>를 계속해야겠지요. 요즘 길에서 많이... 그래도 계속 이렇게 걷는게 좋은지, 조금 <b>걷기</b>를 줄여야 하는 건지 고민이 되기도 해요. 한계를 뛰어넘어... ","마음나눔 홈스쿨, 홈스쿨링",https://blog.naver.com/hjinmaum,20210526
부산 온천천<b>걷기</b>,https://blog.naver.com/prettyma67?Redirect=Log&logNo=222360216473,온천천<b>걷기</b> 오늘은 친구를 만나 온천천길을 걸었다 센텀시티를 바라보는 수영천과 비교하면 뷰는... 건강 위하자는 얘기로 마무리하고 들어오니 몸이 개운하다 오늘은 요만큼 #온천천<b>걷기</b> #만보<b>걷기</b> #오늘은요만큼,Emma가 꿈꾸는 소확행,https://blog.naver.com/prettyma67,20210521
해파랑길8코스 <b>걷기</b>여행,https://blog.naver.com/72mjjang?Redirect=Log&logNo=222366584533,또 다른 여행...<b>걷기</b>여행...해파랑길8코스 <b>걷기</b> 몸과 맘의 균형을 위해... 시간을 쓰가며 몸과 맘을 받쳐 돈을 벌었지만... 이제 그 돈으로 다시 시간을 사서 병든 몸과 맘을 추스려야 할듯하다...ㅠㅠ 건데 다시... ,창호컨설팅,https://blog.naver.com/72mjjang,20210525
만보<b>걷기</b> 세로토닌 키토제닉 오븐돌리기 고급진 티그레♡,https://blog.naver.com/babepoohjin?Redirect=Log&logNo=222433343912,만보<b>걷기</b> 세로토닌 키토제닉 오븐돌리기 고급진 티그레♡ 어제도 오븐과 한몸!!^^ 오븐도 고생했어!!... 만들어서 보내드릴 생각입니다~ 기대해주세요~^♡ 어제도 덥고 할일이 많았지만 만보<b>걷기</b> 400일 완료~~까오♡,진트리오맘의 행복한 베이킹&쿡킹,https://blog.naver.com/babepoohjin,20210716
맨발 <b>걷기</b>/문경새재,https://blog.naver.com/ace4558?Redirect=Log&logNo=222359638041,"'맨발로 <b>걷기</b>' 맨발로 맨땅을 밟는 행위, 즉 접지(接地,Earthing)가 건강에 많은 도움을 준다는 얘기를... ~ 아래 링크한 맨발<b>걷기</b> 시민운동본부장인 박동창씨의 이야기를 접한 후, 길 전체에 황토를 깔아 맨발로... ",♧ 산으로 떠나는 여행,https://blog.naver.com/ace4558,20210521
<b>걷기</b>의 철학,https://blog.naver.com/mujurbar?Redirect=Log&logNo=222399190334,"<b>걷기</b>의 철학 PETITE PHILOSOPHIE DU MARCHEUR 크리스토프 라무르 @ `<b>걷기</b>의 철학`을 읽으며... 족저근막염이 호전되고 있다. 다시 <b>걷기</b>를 준비하고 있다. 새 신발을 사고, 새 길을 설계하고 있다. `느림`이란 말은 참을 수... ",바람이 바람이다.,https://blog.naver.com/mujurbar,20210615
눈 건강을 위한 <b>걷기</b>_sudarshan walking in the sun,https://blog.naver.com/indiasun?Redirect=Log&logNo=222404048961,역시 <b>걷기</b>는 여행!!! 내가 보려는 세상과 보여지는 세상에 대한 새로운 감각을 즐기며 <b>걷기</b>. 다~좋았다. 근데 집에 오니 모기에게 엄청 헌혈했다는... 미처 모기의 입질에는 깨어있지 못했다니. 쯧쯧.반성하자!!!... ,소마요가. 소마틱스.휄든크라이스. 소마 테라피.명상,https://blog.naver.com/indiasun,20210620
서귀포 치유의 숲 <b>걷기</b> / 맛집별점 조작하지마여...,https://blog.naver.com/freebird327?Redirect=Log&logNo=222413909095,일요일 오후의 일정은 #치유의숲 <b>걷기</b>  여기서 미리 예약해야 입장할 수 있다. 해설사와 함께 걷는 2시간 정도의 코스도 있고 자유 탐방도 가능한데 나는 체력이 어찌 될 지 몰라서 자유탐방으로 예약했다. 시간을... ,"또라, 여행을 떠나다",https://blog.naver.com/freebird327,20210629
[<b>걷기</b>좋은길]서울둘레길6코스-안양천 벚꽃길,https://blogger.pe.kr/897,꽤 긴 거리이긴 하지만 잘 포장된 평지를 따라 <b>걷기</b>에 힘은 그리 들지 않는 초보 수준의 코스다. 다만 강변을 따라 <b>걷기</b>에 조금은 지루한 감이 없지 않다. 그리고 여름에는 그리 추천하고 싶지 않다. 땡볓을 걷는... ,taeho's life logger,https://blogger.pe.kr/,20210402
"<b>걷기</b>, 일주일(2021.5.17.~5.23.) 간의 기록",https://blog.naver.com/pakkim79?Redirect=Log&logNo=222364135541,"2021.5.17.(월)~5.23.(일) <b>걷기</b>, 지난 일주일 간의 기록입니다. 이번 주는 월요일 첫날부터 몸이 아파 2만... 2021년 5월 17일(월) 이날은 2만 보 달성은커녕 제대로 <b>걷기</b>도 힘들었네요. 아침에 자고 일어나니... ",느리게 살고싶어,https://blog.naver.com/pakkim79,20210524
"[책 읽는 서대문] <b>걷기</b>, 두 발로 사유하는 철학 &quot;나는 걷는다... ",https://tongblog.sdm.go.kr/5505?category=529066,"네이버 블로그 페이스북 트위터 유튜브 RSS TOP [책 읽는 서대문] <b>걷기</b>, 두 발로 사유하는 철학 &quot;나는 걷는다, 고로 철학한다&quot; 본문 [책 읽는 서대문] <b>걷기</b>, 두 발로 사유하는 철학 &quot;나는 걷는다, 고로 철학한다... ",서대문구청 티스토리 블로그,https://tongblog.sdm.go.kr/,20210628
도쿄 골목 길 <b>걷기</b> 요요기 공원 ~ 요요기 우에하라,https://likejp.com/4107,"코로나가 시작 할 때 쯤 작년 봄의 도쿄 골목 길 <b>걷기</b> 요요기 공원에서 요요기... 벚꽃과 함께 초속 5센치미터 배경지 <b>걷기</b> 흩날리는 벚꽃과 함께 애니메이션의 장면 속으로, 도쿄여행 초속... ",트립캣(베쯔니),https://likejp.com/,20210711
다이어트식단+<b>걷기</b>운동 성공해야지,https://blog.naver.com/0627lolo?Redirect=Log&logNo=222390282429,그래서 가장 돈안들이고 할 수있는 것이 무엇이 있을까 싶어서 <b>걷기</b>운동 그리고 계단오르는 운동을... 지키면서 <b>걷기</b>운동을 하게 되었습니다. 이전에 2주동을 계속 하염없이 걸으면서 2주에 5키로그램을 뺀적이... ,하루일기,https://blog.naver.com/0627lolo,20210608
만보<b>걷기</b>다이어트 22일,https://blog.naver.com/nuna0124?Redirect=Log&logNo=222361058843,후 <b>걷기</b>라 오랜만에 이곳까지 왔네요 제가 좋아하는 곳인데 등원 시키고 오면 가능한 거리인데 등원... 만보 <b>걷기</b> 시작 몸무게 72kg 4월 30일 다이어트 일기 시작 몸무게 65.6kg 5월 21일 현재 몸무게 63.3kg 대략... ,BERRY MOM's,https://blog.naver.com/nuna0124,20210522
어린이집 <b>걷기</b>대회 : 알콩아 대단해! 수고했어!,https://blog.naver.com/sangnangja?Redirect=Log&logNo=222368751143,"알콩이 어린이집에서 <b>걷기</b>대회를 했다. 준비물은 어린이날에 선물받은 하복과 모자, 음료수! 차를 타고 이동하여 공원에 가서 어린이집 <b>걷기</b>대회를 하고 온다고 하니 알콩이가 엄마, 아빠 없이 다른 차를... ","Please, Find red in my heart.",https://blog.naver.com/sangnangja,20210526
"함께하는 <b>걷기</b> 운동 걷쥬, 내포문화숲길 16코스 둘레길 도전!",https://blog.naver.com/dangjin2030?Redirect=Log&logNo=222407177512,"함께하는 <b>걷기</b> 운동 걷쥬, 내포문화숲길 16코스 둘레길 도전! 자유로운 시간을 정해서 평소에 하고 싶었던 일중의 하나인 <b>걷기</b> 운동 실천을 위해 걷쥬를 켜고 백제부흥군길을 걸어봤습니다. 하지가 지난 후라... ",당진시 공식블로그,https://blog.naver.com/dangjin2030,20210623
제주 <b>걷기</b> 좋은곳 사려니숲길과 비자림,https://blog.naver.com/everything91?Redirect=Log&logNo=222383158148,"제주 <b>걷기</b> 좋은곳 사려니숲길과 비자림 제주 <b>걷기</b> 좋은곳 힐링이 되는 숲길이 여기저기 포진해 있습니다. 대표적인 힐링 숲길로 삼나무가 가득한 사려니숲길, 숨만 쉬어도 몸과 머리가 건강해지는 곳. 오늘은... ",★한량이의 배낭메고 지구정복★,https://blog.naver.com/everything91,20210603
(대구)골목투어 근대로의 여행 비대면 <b>걷기</b> 대회,https://blog.naver.com/haeun0615?Redirect=Log&logNo=222371575945,도보길'에서 <b>걷기</b> 대회를 개최한다고 합니다. ▶행사기간 2021.6.1(화)~6.30(수) ▶신청기간 2021.5.17(월)... ※ 참가 신청서 작성→ <b>걷기</b> 앱 설치→ <b>걷기</b> 및 인증→ 설문조사 참여→ 모바일 상품권 발송... ,어쩌다 물멍 어쩌다 트레킹,https://blog.naver.com/haeun0615,20210528
[아침<b>걷기</b>30] 낮에 남편과 함께 걷다,https://blog.naver.com/hjinmaum?Redirect=Log&logNo=222363166553,"주일에는 아침<b>걷기</b>를 쉬어요. 대신 낮이나 밤에 시간을 내어 걷지요. 오늘은 특별히 남편과 함께... 남편은 저녁에 <b>걷기</b>로 했는데, 일이 생겨 못 걸을 때가 많아 미안하기도 해요. 마음은 그렇다고요. 많이 걸은 것... ","마음나눔 홈스쿨, 홈스쿨링",https://blog.naver.com/hjinmaum,20210523
#01. <b>걷기</b> 첫 주,https://blog.naver.com/506project?Redirect=Log&logNo=222386486971,하루에 보통 300보 내외로 걷는 걸 보고 다른 운동도 안 하는데 <b>걷기</b>도 이 정도 밖에 안 하면 안 될 것 같아서 6월 1일(화)부터 <b>걷기</b> 체크 시작. 6월 첫 날이기도 해서 마음먹고 '걸어야지' 했는데 오전에 헌혈을... ,한태금사진관,https://blog.naver.com/506project,20210605
만보<b>걷기</b>다이어트 26일(인바디),https://blog.naver.com/nuna0124?Redirect=Log&logNo=222367012628,역시 몸무게가 쉽게 빠져주지는 않네요ㅋㅋㅋㅋ 3월 3일 만보 <b>걷기</b> 시작 몸무게 72kg 4월 30일 다이어트... 마당에서 같이 뛰었더니 그래도 만보 <b>걷기</b> 안 한 거 치고는 생활 <b>걷기</b>가 제법 높네요:-) 내일도 화이팅!,BERRY MOM's,https://blog.naver.com/nuna0124,20210525
사색하며 <b>걷기</b> 좋은 당남리섬,https://blog.naver.com/yeojuhangul?Redirect=Log&logNo=222379854481,"꽃은 피었으나 외출을 자중해서 사색하며 <b>걷기</b> 좋은 당남리섬입니다. 노란 유채꽃 속 분홍의... 지금은 일부만 심었지만, 천천히 사색하며 <b>걷기</b> 좋은 곳으로 꽃 감상하기 좋습니다. 겨자과에 속하는 유채.... ",여주시블로그,https://blog.naver.com/yeojuhangul,20210601
재경정중동창회 '서울대공원 <b>걷기</b>',https://blog.naver.com/sonjson?Redirect=Log&logNo=222395472796,* 2021년 6월 12일 (토) 10시 * 4호선 대공원역 4번출구 만남 * <b>걷기</b>코스 : 대공원둘레길(아랫방죽까지) - 장미원 - 현대미술관 야외조각장 - 호반의 벤치 - 대공원역 * 조 편성 : 4명씩 4개조 (1조-고영희 박명순... ,달하 노피곰 도드샤,https://blog.naver.com/sonjson,20210612
[오늘일기]2만보<b>걷기</b> 그리고 동대문현대아울렛 소소한 먹거리,https://blog.naver.com/spiriti?Redirect=Log&logNo=222395756904,#오늘일기 #청계천산책 #더위 #운동 #다이어트 오늘은 청계천 <b>걷기</b> 땡볕~ #청계천은 당분간 못오겠다... 아침저녁으로 #16km<b>걷기</b> #600kcal소비 #2만보 걸은 날 #2만보성공 덥지만 운동효과 좋은 날 오늘운동도 성공... ,줄라이의 임장맛집,https://blog.naver.com/spiriti,20210612
나를 위한 시간 312일차-2021.5.29.토-<b>걷기</b> 예찬~*,https://blog.naver.com/gidothink?Redirect=Log&logNo=222374017331,한때 둘레길 <b>걷기</b>가 유행이었다. 꼭 차를 타고 이름 있는 길을 걷지 않아도 된다고 생각한다. 어느 곳이든 걸을수 있는 곳이면 된다. 우리 동네를 <b>걷기</b> 전에는 그걸 몰랐다. 요즘은 다른 동네도 걸어볼까 라는... ,*~혜랑아랑미랑 사랑해~*,https://blog.naver.com/gidothink,20210529
[아침<b>걷기</b>41] 구름도 예쁘고... 개 때문에 힘들었던 <b>걷기</b>,https://blog.naver.com/hjinmaum?Redirect=Log&logNo=222392288231,"새벽 2시 넘어 잠을 잤더니 아침에 일어나지 못해서 오늘은 <b>걷기</b>를 쉰다. 어제는 그동안 <b>걷기</b> 중 가장 힘들었던 날이 아니었을까 싶다. 달리기 구간을 걷고 있는데, 갑자기 큰 개가 앞에서 오고 있는게 아닌가.... ","마음나눔 홈스쿨, 홈스쿨링",https://blog.naver.com/hjinmaum,20210610
춘천 청평사 솔숲길따라 <b>걷기</b>좋은길,https://blog.naver.com/jbm993?Redirect=Log&logNo=222284340005,춘천 청평사 솔숲길따라 자박자박 <b>걷기</b>좋은길 솔숲길따라 <b>걷기</b>좋은길~ 춘천으로 다녀온 1박 2일 여행은 오후시간엔 춘천 청평사를 찾았어요. 오래전부터 가보고 싶었던 곳으로 기대하며 갔는데요. 그날따라... ,열씨미 카메라세상,https://blog.naver.com/jbm993,20210324
<b>걷기</b> 운동 효과 높이는 법 7가지,https://blog.naver.com/imagineer7?Redirect=Log&logNo=222368637765,#<b>걷기</b>운동효과 건강을 위해 가장 손쉽게 실천할 수 있는 <b>걷기</b> 운동. 저도 되도록 일터까지 공원 길을 따라서 <b>걷기</b>를 좋아하는데요. 꽃과 나무가 예쁜 길을 걷다 보면 기분도 좋아지지만 무엇보다 <b>걷기</b> 운동... ,셔니의 건강한 탐구생활...,https://blog.naver.com/imagineer7,20210526
"울진 통고산 자연휴양림 캠핑과 숲길 <b>걷기</b>, 제1야영장~2야영장... ",https://blog.naver.com/hhs653409?Redirect=Log&logNo=222414063044,마침 화창한 날씨예보에 이곳 통고산휴양림 산책로 길을 걸으며 주말마다 행해지는 숲길 <b>걷기</b>를... 예전에 비포장이었던 산길이 말끔하게 포장되어 <b>걷기</b>좋게 되어있고 수량이 풍부하진 않지만 계곡의 물소리와... ,남은 인생 좌충우돌 살아가는 이야기,https://blog.naver.com/hhs653409,20210629
"원주 치악산 둘레길, <b>걷기</b> 좋은 길",https://blog.naver.com/pinkplum80?Redirect=Log&logNo=222375230256,등산은 못 해도 트레킹은 가능하거나 청정 자연을 누리며 쉬엄쉬엄 <b>걷기</b> 좋은 길을 찾는다면 원주시가... 계단을 오르다 보면 과연 이 길이 <b>걷기</b> 좋은 길인지 의심이 가기도 하지만 이 계단만 다 오르면 편안한... ,확장되는 공간,https://blog.naver.com/pinkplum80,20210530
봄에 <b>걷기</b> 좋은 거제 옥포 이순신 만나러 가는 길,https://blog.naver.com/geojecity?Redirect=Log&logNo=222253254035,봄기운이 살랑살랑~ 지금 딱 <b>걷기</b> 좋은 길을 소개합니다. 옥포 이순신 만나러 가는 길 거제 소셜미디어 시민홍보단 장민주 시원하게 펼쳐진 바다를 보며 가볍게 <b>걷기</b> 좋은 거제도 옥포의 이순신길을... ,거제시 공식 블로그,https://blog.naver.com/geojecity,20210223
