title,link,description,bloggername,bloggerlink,postdate
[영화] <b>고스톱</b> 살인,https://blog.naver.com/sekchi?Redirect=Log&logNo=220080784502,"<b>고스톱</b> 살인 감독 김준권 출연 이승준, 김홍파, 권남희 개봉 2013 대한민국 리뷰보기 나는 목장주인인... 미스 정이 갑자기 죽고 김씨 아저씨가 화장실에 간 사이 처음 대타로 <b>고스톱</b>을 치게 된다.큰 돈은 아니지만... ",Austin의 홍콩에서 한 일,https://blog.naver.com/sekchi,20140804
"선생님 나눔, VAK토의&amp;엄지탑, <b>고스톱</b> 복습, 랜덤 워드, 소감)",https://blog.naver.com/kingofnsb?Redirect=Log&logNo=221307448606,선생님은 어떻게 문재인 대통령의 답장을 받았을까?) http://www.cmbkj.co.kr/ab-991-9431 &gt; &gt; □ VAK토의&amp;엄지탑 □ <b>고스톱</b> 복습(4장을 모아라!) □ 랜덤 워드 □ 소감 나눔과 신록(오늘의 사관 : 김보아 선생님),함께 있어 행복한 우리,https://blog.naver.com/kingofnsb,20180626
北 `<b>고스톱</b>' '태왕사신기' 온라인게임 홍보,https://blog.daum.net/biz-plus/8124940,北 `<b>고스톱</b>' '태왕사신기' 온라인게임 홍보 댓글 7 이슈 앤 뉴스 2009. 2. 22. &lt;北 `<b>고스톱</b>' '태왕사신기' 온라인게임 홍보&gt; 2009년 02월 22일 (일) 06:00 연합뉴스 北상품 대외홍보 사이트..&quot;저작권.상표권 문제... ,행복을 찾는 사람,https://blog.daum.net/biz-plus,20090222
"스크랩 국민의힘, 방역수칙 어기고 <b>고스톱</b> 친 제천시의원에... ",https://blog.daum.net/1231723/20807,"스크랩 국민의힘, 방역수칙 어기고 <b>고스톱</b> 친 제천시의원에 징계(종합) 자동요약 음성 기사 듣기 번역... 이 의원은 지난 25일 제천시 송학면의 한 주택에서 속칭 '<b>고스톱</b>'을 친 혐의(도박)로 주민 3명과 함께... ",김포종점열쇠,https://blog.daum.net/1231723,20210127
삼땡토퍼 #<b>고스톱</b>토퍼  #토퍼주문제작 #30살기념 #아내생일선물... ,https://blog.naver.com/happy50529?Redirect=Log&logNo=222427042225,#케이크토퍼맞춤제작 #포토토퍼 #케이크토퍼 #남자친구선물 #여자친구선물추천 #기념일이벤트 #삼땡토퍼 #<b>고스톱</b>토퍼 #토퍼대량제작 #30살기념 #아내생일선물 #결혼기념일토퍼 #용돈토퍼... ,"토퍼주문제작, 마스크스트랩, 라벨스티커, 시트지제작",https://blog.naver.com/happy50529,20210710
<b>고스톱</b>~~,https://blog.naver.com/moryta?Redirect=Log&logNo=100010577824,온가족이 모였다하면 <b>고스톱</b>.. 울어무이 너무 조아라하시지.. 울아부이 단돈천원으로 비비시지.. 나 어리벙벙 계속 잃고... 피박 광박은 일쑤... ㅜ.ㅜ 부부도박단.. 온냐랑형부... 흥흥 !! <b>고스톱</b>을 꼭 배워.. 내... ,답없는도전,https://blog.naver.com/moryta,20050225
신년맞이 화합도모 가족 <b>고스톱</b> 게임한판~,https://blog.naver.com/han4869?Redirect=Log&logNo=220587399419,신년맞이 화합도모 가족 <b>고스톱</b> 게임한판~ 16년 맞이하여 기념으로 신라네 가족 저녁먹고 둘러앉아 <b>고스톱</b> 한판하기로했습니다~ㅋ 연말이나 명절때 빼놓을수없는 이 게임 돈이 왔다갔다하는거라 그런가 다함께... ,신라가 만드는 이야기,https://blog.naver.com/han4869,20160105
"갤러리아 마일리지, 시댁 김장, 첫눈, <b>고스톱</b>, 맥도날드 선데이",https://blog.naver.com/sora0821?Redirect=Log&logNo=220872606605,"(쏠의일상) 생장면 출시, 8개월 도준이, 옥돔구이, 갤러리아 마일리지, 시댁 김장, 첫눈, <b>고스톱</b>... 고모부랑 <b>고스톱</b>판을 열었는데 사진이 없네.......잼났는데..... 대신 <b>고스톱</b>의 교육적 효과를 남겨본다.... ",쏠쏠한일상,https://blog.naver.com/sora0821,20161128
:210101 일상 : 새해/ 만둣국/ <b>고스톱</b>/ 버거킹,https://blog.naver.com/eunseon3570?Redirect=Log&logNo=222192760999,소화시킬 겸 엄마 아빠랑 <b>고스톱</b>을 쳤다 나는 똥광이 그렇게 좋더라 하루 종일 뒹굴거리다가 어제 편의점에서 사온 떡볶이 먹기 맛없었음 햄버거 땡겨서 햄버거 사러 고고 룰루랄라 크리미모짜롤 맛있넴... ,매일 놀고 먹으면 얼마나 좋을까,https://blog.naver.com/eunseon3570,20210101
음식점(식당)에서 손님들이 <b>고스톱</b>(화투) 도박 적발단속 되어... ,https://blog.daum.net/ds4aen/11510647,"손님들이 <b>고스톱</b>(화투) 도박 적발단속 되어 식품위생법위반 영업정지 45일에 갈음한 과징금(벌금) 360만원 행정처분 , 행정심판 청구를 하여 과징금 240만원으로 감경 된 사례 (음식점,식당,<b>고스톱</b>,화투,도박... ",밝은 세상을 꿈꾸는 블로그,https://blog.daum.net/ds4aen,20140721
점 100원 짜리 <b>고스톱</b>의 행복,https://blog.naver.com/hkkroni?Redirect=Log&logNo=221209625635,점 100원의 <b>고스톱</b> 한판ㅋㅋㅋㅋㅋㅋ 셋이 앉아 두시간은 족히 친듯. 결국은 아빠가 돈 제일 많이 땄고... 하하호호 <b>고스톱</b>도 치고하니 좋으다. 점 1000원을 쳐도 점 10000원을 쳐도 다 잃어드릴테니 앞으로 딱... ,노조미의 움직이는 성,https://blog.naver.com/hkkroni,20180216
<b>고스톱</b>과 주식,https://blog.naver.com/bachsonaten?Redirect=Log&logNo=100199157753,내돈은 내가 지키겠다는 일념으로 주식을 본격적으로 공부한 이래 내가 주식 투자하는 스타일이 <b>고스톱</b>하는 스타일과 참 비슷하다는 걸 느낀다. <b>고스톱</b>을 즐기는 편이 아니라서 지금은 안 하는데 예전에... ,개미의 발악,https://blog.naver.com/bachsonaten,20131104
"[<b>고스톱</b> 살인] <b>고스톱</b> 고수들, 알고보니 연기고수? 연극무대... ",https://blog.naver.com/fornest?Redirect=Log&logNo=140207995720,대국민 오락 <b>고스톱</b>에 숨겨진 기발한 살인비밀을 통해 기상천외한 한국형 판타지 스릴러를 선보일 영화 &lt;<b>고스톱</b> 살인&gt;의 보석같은 배우 4인방이 떴다. 개성있는 외모와 철인 3종경기 선수 출신답게 강인한... ,자신이 하는 일에 최선을 다하자,https://blog.naver.com/fornest,20140305
"썸머 워즈(summer wars) - <b>고스톱</b>,원기옥은 가족사랑과... ",https://blog.naver.com/jangbaeksan?Redirect=Log&logNo=50073340390,"조심할것) 가족끼리 보기에 좋은 영화라고 하지만 너무 뻔한 스토리가 눈에 거슬리지만, 만인의 스포츠 <b>고스톱</b>으로 지구의 운명을 구하고, 난데 없는 드레곤볼의 원기옥 스킬을 사용하는 재미까지 주었다.... ",모든 비인간적인 것에 저항하라,https://blog.naver.com/jangbaeksan,20091007
대구시-대성에너지 혹 짜고치는 <b>고스톱</b>?,https://blog.naver.com/5115019?Redirect=Log&logNo=220069583741,대구시-대성에너지 혹 짜고치는 <b>고스톱</b>? 市도시가스 정책 하세월 32년 독점…대성에너지 도시가스공급 천차만별 달서구'보급률' 99.9% 중구는 62.6% '쥐꼬리' 4년간 40% 보급률 편차 대구시의 행정이 무책임하다.... ,대구광역일보,https://blog.naver.com/5115019,20140723
<b>고스톱</b>,https://blog.naver.com/hdh3317?Redirect=Log&logNo=50176972811,잔머리 <b>고스톱</b> 덕에 항상 제가 용돈대신 수금? 해옵니다만 여전히 건강하시고 요즘 점점 옛적에 많이... 물론 현재 어머니께서 좋아하시는것이 <b>고스톱</b>인거 같지만 저의 효를 받고자 하시는 마음이 더 많으실... ,신 주 단 지,https://blog.naver.com/hdh3317,20130806
<b>고스톱</b> 한판,https://blog.naver.com/leeeddy?Redirect=Log&logNo=120001128828,2.29일 쩡과 옥이가 놀러와 간만에 <b>고스톱</b>을 쳤죠...요것이 아마도 정화패였던거 같은데 기집애 <b>고스톱</b>은 잘 쳐... 내돈 돌리도~~~ㅠ.ㅠ 3.4...커튼을 져치는 순간 입이 따아악~~~ 함박눈이 오고 있었다...춘삼월에... ,★ 수빈 세상 ★,https://blog.naver.com/leeeddy,20040304
<b>고스톱</b>/디자인<b>고스톱</b>/코로나취미/방구석혼자놀기/시간순삭... ,https://blog.naver.com/lovelystraw7?Redirect=Log&logNo=222274581257,어느날 신세계를 맛봤다 그리고 취미가 되어버렸다 그것은 바로 고.스.톱 태어나서 한번도 쳐본적 없는 <b>고스톱</b>을 엄마가 한게임으로 맞고하고있을때마다 저걸왜하는걸까 하며 생각하던 그 <b>고스톱</b>을 30대가 된... ,어제보다 더 새롭게,https://blog.naver.com/lovelystraw7,20210314
<b>고스톱</b>으로 1억 벌다?,https://blog.naver.com/youha0214?Redirect=Log&logNo=222130830743,코로나 때에는 역시 맞고 ㅎㅎㅎ <b>고스톱</b> 쳐서 이틀만에 1억 벌다. 진차루. ㅋㄷㅋㄷ 눈이 핑핑... 많이 버니 기분은 좋군 ㅋㅋㅋ #맞고#시간떼우기#코로나심심해#치매예방#뇌운동#<b>고스톱</b>#고스탑#<b>고스톱</b>으로1억벌다,행복의 향기,https://blog.naver.com/youha0214,20201030
<b>고스톱</b> 올나잇!,https://blog.naver.com/1shotgirl?Redirect=Log&logNo=7735794,흑~ ㅎㅎㅎ 내가 챙겨간 <b>고스톱</b> 덕분에 션양 집에서 오랜시간 즐거움을 공유할 수 있었다 밤 10시에 시작해서 새벽 6시 넘어 끝난 <b>고스톱</b> 파뤼~;; 매진아.. <b>고스톱</b> 왜케 못하는거야? 빚진채로 파산해버렸다..;;,매진아 매진아[골라먹기],https://blog.naver.com/1shotgirl,20041121
"펌] 짜고치는 <b>고스톱</b>중 하나, 전세자금대출",https://blog.naver.com/bcjin0?Redirect=Log&logNo=70037881413,"짜고치는 <b>고스톱</b>중 하나, 전세자금대출 송곳니(intolaw) 2008.11.21 10:50 요즘 대출 받기 참 힘듭니다. 아니라구요? 은행 한번 가세요. 은행 문턱이 얼마나 높은지요..ㅎㅎ 오늘도 가서 환전했습니다. 소액으로 약... ",자유롭게 살기를 원하는 이를 위하여,https://blog.naver.com/bcjin0,20081125
한게임 <b>고스톱</b> 설치하기,https://blog.naver.com/nagneya777?Redirect=Log&logNo=222013478171,<b>고스톱</b>은 우리에게 친숙하게 느껴질 정도로 많은 이들이 모임이나 가족끼리 하는 경우가 많이... 이 다양한 부분 중 오늘은 한게임 <b>고스톱</b> 설치하기라는 제목으로 정리를 해봤는데요. P사나 N사 등 많은 곳들에서... ,nagneya777님의블로그,https://blog.naver.com/nagneya777,20200627
납골당미니어처 [티비 + <b>고스톱</b> + 개별음식] 주문제작,https://blog.naver.com/mini-ble?Redirect=Log&logNo=221921322535,티비 / <b>고스톱</b> / 음식 한 상차림 한화 팬이셔서 한화가 이기는 장면으로 연출해드렸어요. <b>고스톱</b> 역시 이기고 계시네요~ 현금 역시 두둑이 있으십니다! ^^ 시루떡/ 고동 / 편육 / 홍어 / 고추 양파 마늘 / 새우젓 초장... ,미니블 미니어처 :D,https://blog.naver.com/mini-ble,20200421
<b>고스톱</b> '탄'수법 화투목,https://blog.naver.com/sericolor?Redirect=Log&logNo=220577654654,ㅋ <b>고스톱</b> '탄' 수법 [fr 네이버 지식인] 탄은 사기도박사들이 여러차례 일부러 져주다가 판돈이 커지면 한방에 상대를 KO시킬때 주로 사용된다. 사기 화투목을 주머니에 숨기고 있다가 ‘기리’(선이 섞은... ,"나의 사랑, 나의 자랑들...",https://blog.naver.com/sericolor,20151224
하이 <b>고스톱</b>,https://blog.naver.com/timer78?Redirect=Log&logNo=60175376117,하이 <b>고스톱</b> 작가 김원호 출판 북치는마을 발매 2012.09.26 평점 리뷰보기 지금의 엄마들은 잘 모르겠지만 내가 어렸을 때 엄마들의 취미(?)는 <b>고스톱</b>이었던 것 같다. 돈을 많이 걸지는 않았고 아줌마들의 아지트인... ,물개가 되자~!!,https://blog.naver.com/timer78,20121110
[부평]  은사님과 <b>고스톱</b>..,https://blog.naver.com/hkj5383?Redirect=Log&logNo=221186393337,영화&quot;신과 함께...&quot;을 관람하였고 저녁에 오시우 선생님이 종택이네 집으로 오셔서 식사를 나눈 후. 정말 오랜만에 <b>고스톱</b> 화투놀이를 하면서 즐거운 시간을 보내었다.,캠핑카 집시 부부,https://blog.naver.com/hkj5383,20180116
시의원 재·보궐 공천두고 '자중지란'...짜고 치는 <b>고스톱</b>이다 반발,https://blog.daum.net/lin13031303/12994,"더불어민주당 세종시당, 시의원 재·보궐 공천두고 '자중지란'...짜고 치는 <b>고스톱</b>이다 반발 댓글 0... 짜고 치는 <b>고스톱</b> 이라고 비난했다. 최종 결정된 후보는 출마가 거론되는 상황에서 중립을 지켜야할 공관위... ",임규모 기자의 세상 알기,https://blog.daum.net/lin13031303,20200305
"PC카드게임 윈조이 포털, 맞고 <b>고스톱</b> 후기",https://blog.naver.com/best03077?Redirect=Log&logNo=221882181383,"맞고, <b>고스톱</b> 같은 게임들도(전통 민속놀이) 준비되어 있습니다. 그런데 카드게임류는 4월 7일부터 정식 서비스 예정. 그래서 오늘은 민속놀이 후기를 남겨봅니다. 20년 만에 해보는 <b>고스톱</b> 후기 윈조이 포털은... ",KBROS BLOG,https://blog.naver.com/best03077,20200331
[4년 전 오늘] 이벤트 유감 (짜고 치는 <b>고스톱</b>),https://blog.naver.com/hyj494?Redirect=Log&logNo=222066706276,4년 전 오늘 이벤트 유감 (짜고 치는 <b>고스톱</b>) 이 요리블로거 운좋게 당첨된 분들이 누구인지 알려달라고 한번 더 댓글 남겼는데 아직까지도 감감무소식! 처음에 8월 5일 발표인데.. 어디다 발표했냐고... ,Somewhere over the Rainbow~,https://blog.naver.com/hyj494,20200821
화투 <b>고스톱</b> 점수 계산 룰 모르면 .... ( 제대로 잘치는 법),https://blog.naver.com/honeykim1002?Redirect=Log&logNo=222103725846,"제사 음식 차리느라 너무너무 바쁜 명절인데요 ㅠㅠ 또 그리고는 밤새 <b>고스톱</b> 화투 치는 분들이 많으시죠!! 하지만, 이럴때 화투 <b>고스톱</b> 점수 계산 룰을 잘 모르면?? 화투 잘 치는 법을 모르면?? 노노입니다 ㅠ.... ",하니닝,https://blog.naver.com/honeykim1002,20200930
할만한게임은 역시 무료 <b>고스톱</b> 피망 맞고가 딱이지,https://blog.naver.com/mchan21?Redirect=Log&logNo=221360945854,무료 <b>고스톱</b> 피망 맞고가 딱이지! 무료하거나 잠깐 짬이 나는 시간 할만한게임 하면 떠오르는 무료 <b>고스톱</b>이 있으니 피망 맞고입니다. 올인이 되어도 무료 충전되어 즐길 수 있고 크게 한판 이기기라도 한다면 그... ,불량의 A-Z itメ [아지트],https://blog.naver.com/mchan21,20180917
명절엔 <b>고스톱</b>!,https://blog.naver.com/armdaunai?Redirect=Log&logNo=221110767756,이밤이 짧을듯! ㅋ 연휴 끝나고 중간고사인 넘도 수능준비중인 수험생도 한밑천 잡을라꼬 눈이 반짝반짝~~!! #고스돕에서_배우는_인생공부가_더_크니까_뭐 #명절엔_<b>고스톱</b> #광만_팔아도_한밑천,초록생각의 탐구생활,https://blog.naver.com/armdaunai,20171004
미켈란젤로 광장에서 노을보며 힐링하기 feat. <b>고스톱</b>..,https://blog.naver.com/fridayjjoo?Redirect=Log&logNo=222344938567,ㅋㅋㅋㅋㅋㅋㅋㅋㅋㅋㅋ 마지막 날 밤이라서....ㅎ 다들 계속 피곤해서 한번도 못했던 <b>고스톱</b>.. 마지막날이라고 한 판이라도 해야한다고 꾸역꾸역 꺼내서 했다. ㅋㅋㅋㅋㅋㅋㅋㅋㅋㅋㅋㅋㅋ 아 다음날 아침... ,Vida de judy,https://blog.naver.com/fridayjjoo,20210510
부천상동호수공원에서 <b>고스톱</b> 한판,https://blog.naver.com/tjdahtjs?Redirect=Log&logNo=220314937187,배부른데 맛있어 자꾸자꾸 손이가요 손이가~~저희는 공원와서 전혀 걷지는 않고 텐트치고 <b>고스톱</b>을 쳤어요 ㅋㅋ 쑥언니의 손놀림은 정말이지 최고!!<b>고스톱</b> 초짜인 저는 탈탈 털렸죠ㅎ.ㅎ 근데 큰일남ㅋㅋ... ,생각을 담는 블로그 by.마이썬,https://blog.naver.com/tjdahtjs,20150330
큰아이 <b>고스톱</b> 과외..,https://blog.naver.com/softwoman68?Redirect=Log&logNo=220478093772,"영화도 보고, 맛있는 음식도 엄마하고 먹으러 다니고 코가 좋지않아 이비인후과도 다녀오고, 나 피부과 가는데도 따라가고..ㅎㅎ 나중엔 내가 <b>고스톱</b>을 가르쳐주겠다고 짝도 안맞는 화투를 꺼냈는데 등뒤에서... ",따뜻한 시선으로 바라보기!,https://blog.naver.com/softwoman68,20150911
[글쓰기 타임머신] 심부름 내기 <b>고스톱</b>,https://blog.naver.com/jua423?Redirect=Log&logNo=222204128205,"“<b>고스톱</b> 칠까? 심부름 내기하자. 한 판에 열 개야.” 판이 크다. 이길 생각을 하니 눈이 커지고... 밤 열시까지 신나게 열리던 <b>고스톱</b>이 끝날 무렵, 우루묵 띠기가 깻돈(계돈)을 모아서 통닭을 사 먹자고 했다.... ",달려라 원더혜숙,https://blog.naver.com/jua423,20210111
청주 사직동 조립컴퓨터 i3-10100 아버님 사무용 <b>고스톱</b>,https://blog.naver.com/unoinssa?Redirect=Log&logNo=222267881397,주사용 목적은 온라인 영상 감상과 <b>고스톱</b>이 주 목적이셨습니다. SPEC CPU : I3-10100 RAM : DDR4 2666MH SAMSUNG 8GB M/B : ASROCK H410M-HVS VGA : INTEL HD SSD : TAMUZ GK300 240GB P/W : 에너지 옵티머스 600W 싱글레일 정격 CASE... ,기계형 인간의 블로그,https://blog.naver.com/unoinssa,20210308
<b>고스톱</b>에서 배우는 인생,https://blog.naver.com/snuhsicu2?Redirect=Log&logNo=221920790042,"*최소 <b>고스톱</b> 칠 줄 알아야 이해되는 글... ^^* 명절 때나 여행 가서 종종 <b>고스톱</b>을 칩니다. 가족 까리.. 패를 돌리죠. 어떤 패가 들어올지 아무도 몰라요. 광(光) 두어 개, 혹은 보너스 몇 개가 들어오면 입꼬리가... ",빨강머리앤의 #야따영#기적의엄마표영어#엄마의소신,https://blog.naver.com/snuhsicu2,20200421
<b>고스톱</b>,https://blog.naver.com/rm5611?Redirect=Log&logNo=60172876270,어제 외출에 돌아와서 컴을 열어보고 시간이 남어서 피망 <b>고스톱</b>을 치고 있으려니 텡구가 뭐하냐고 묻길래 치매방지 <b>고스톱</b>을 친다고 하니 뭐라고 뭐라고 하더니만 ... 10시가 되어서야 자려고 들어가는 저를... ,사랑마루,https://blog.naver.com/rm5611,20121007
<b>고스톱</b> 이론과 교훈,https://blog.daum.net/rldhr912/8100028,<b>고스톱</b> 이론과 교훈 / 야구나 축구 실전에 강하다고 해설이나 명감독이 되는 것은 아니고 해설 이론에... / <b>고스톱</b> 9 단이 패를 까보면서 너는 왜 고했는데 이것을 안 풀어 주냐며 누구에게 질책도 했는데... ,초막,https://blog.daum.net/rldhr912,20170604
"화투, <b>고스톱</b>, 단(丹)도리, 고도리, 섯다 등에 관하여,,,",https://blog.naver.com/chang92002?Redirect=Log&logNo=222274869706,"{민화투ㆍ<b>고스톱</b>ㆍ섯다(섰다) 등}”을 하지 아니하고자 하나, 현재 이것을 대체할 놀이를 발굴하기가... “도리”이며, <b>고스톱</b>(Go-Stop)을 일반적으로 “고도리(다섯마리 새:네이버 지식백과에 상세히 기재되어... ",단월(丹月:RedMoon)의 블로그,https://blog.naver.com/chang92002,20210314
"피터 파스타 배달 , 디저트 케이크 , <b>고스톱</b> , 부루마블 까지 ღ",https://blog.naver.com/tjgus9013?Redirect=Log&logNo=222303023428,"우리집에 오는 이유 = <b>고스톱</b> <b>고스톱</b> 안쳐주면 이서휘는 안 올거다 아마.. ㅋㅋㅋㅋㅋㅋㅋㅋㅋㅋㅋㅋ 항상 진심으로 치는데, 난 돈을 따본 적이 없다 사주에서 꽁돈 벌 사주는 아니라던데 그 말이 맞나보다..... ",하준이랑 콩달콩알 ෆ,https://blog.naver.com/tjgus9013,20210408
땅 속에서 <b>고스톱</b> 치는 씨앗이~~~,https://blog.naver.com/yeppi60?Redirect=Log&logNo=20065754987,강북구님이 씨앗들이 땅속에서 <b>고스톱</b>치고 노느라 안나온다 하시길래 우리집도 그렇다고 했더니만 쌍피 한 장 숨겨 놓으면 찾으려고 고개를 내민다고 하더이다~~~~ㅎㅎㅎ 어제 밤에 한장을 숨겨 놓고 지금 나가... ,나의 쉼터~,https://blog.naver.com/yeppi60,20090415
<b>고스톱</b> 대결 = 회쏘기 내기!!,https://blog.naver.com/jinwoo1931?Redirect=Log&logNo=222224165283,<b>고스톱</b> 대결로 회쏘기 내기를 하기로했는데요? . . 출처 결과는 . . . . . . . . . . . . 패.... 젠장... (사실 일부러져줌?ㅎ) 그래서...제가 광어 + 우럭 그리고 산낚지를 시켰어요 ㅎ . . 현재시간 pm 11:07 이네요 ㅎ . 배달... ,햄복,https://blog.naver.com/jinwoo1931,20210129
<b>고스톱</b> 점수계산 전국공통버전,https://blog.naver.com/adbell0216?Redirect=Log&logNo=222104054309,<b>고스톱</b> 점수계산 전국 공통 기본을 알려드려요. 명절 식구들이 모이면 맛있는 밥도 먹고 같이 음식도... 광은 3개가 모으면 3점이지만 비광이 붙으면 2점으로하고 비광포함 4개일때는 4점 <b>고스톱</b> 점수계산을... ,시샘달의 사계절,https://blog.naver.com/adbell0216,20201001
이제 <b>고스톱</b>은 그만치시죠!,https://blog.naver.com/bestbestkr?Redirect=Log&logNo=120197516659,지인집에 여럿이 모여 <b>고스톱</b>이나 치며 시간을 의미없이 죽이는것보다 자신이 원하는 취미. 예를들면... <b>고스톱</b>은 이제 멀리하시고 정신적 유희를 찾을수있는 일을 찾아보는것은 어떨까요? P.S. 모든... ,인도네시아 플랜트 배관기자재 공급 전문,https://blog.naver.com/bestbestkr,20130904
흔한 7세 놀이 - <b>고스톱</b> ㅋㅋㅋ,https://blog.naver.com/destiny1001?Redirect=Log&logNo=222284666065,"너무 할게 없어서 <b>고스톱</b>으로 기억력 게임을하다 한번 가르쳐 줬는데... 이제는 머....타짜 수준이네;;;... 할머니, 할아버지만 보면은 놀이의 일상이 되버림 <b>고스톱</b>.ㅋㅋㅋ 할아버지 할머니 치매 예방은 이제... ",도도님의 블로그,https://blog.naver.com/destiny1001,20210323
<b>고스톱</b>에서 배우는 인생,https://blog.naver.com/jsjm99?Redirect=Log&logNo=70133705896,<b>고스톱</b>에서 배우는 인생 대한민국의 국민 오락 <b>고스톱</b> 속에도 심오한 인생철학이 담겨 있다. ① 낙장불입 : 인생은 되돌릴 수 없다. 한번 실수로 크나큰 결과를 초래하는 지 알 수 있다. ② 비풍초똥팔삼... ,원한다는 것은 가능하다는 것이다,https://blog.naver.com/jsjm99,20120314
9시간 만남 및 <b>고스톱</b>,https://blog.naver.com/livinginaus1024?Redirect=Log&logNo=222144780070,카드게임과 <b>고스톱</b>을 치자고 온 친구들은 1시 도착 - 먹방시작 2시부터 취하기 시작하더니 역시 모이면 회사욕 이 최고지 :) 4시까지 자신이 당한 회사갑질을 토해내고 비로소 <b>고스톱</b>을 시작하게되었다.... ,피톤치드 넘치는,https://blog.naver.com/livinginaus1024,20201115
<b>고스톱</b> 예찬,https://blog.daum.net/rldhr912/8100030,<b>고스톱</b> 예찬 / <b>고스톱</b> ? 돈이 좀 나가 그렇지 잼 있기는 잼 있지 잘하면 따는 수도 있으니 일거양득 그렇지만 국 쏟고 거시기도 딜 때가 더 많고 누군가는 그렇게 되어야 하니 조심해야 하구 마음 다스리는 거도... ,초막,https://blog.daum.net/rldhr912,20170606
일반음식점 식당에서 손님이 도박(카드/화투) 포커(<b>고스톱</b>)등을... ,https://blog.daum.net/ds4aen/11510668,"일반음식점 식당에서 손님이 도박(카드/화투) 포커(<b>고스톱</b>)등을 할수 있도록 장소를 제공으로... (일반음식점,식당,도박,카드화투,포커<b>고스톱</b>,장소제공,약식명령,벌금,영업정지,행정심판) 일반음식점 형태의... ",밝은 세상을 꿈꾸는 블로그,https://blog.daum.net/ds4aen,20140725
59.전두환 <b>고스톱</b>과 전×중 고도리,https://blog.naver.com/knea96?Redirect=Log&logNo=141911615,전두환 <b>고스톱</b>과 전×중 고도리 나는 기박(棋博)을 비롯하여 오락을 좋아하지 않는다. 심지어는 지금... ‘고도리’(<b>고스톱</b>)를 치고 있었다. 삼봉까지가 전부인 내가 그들을 당해낼 수 있겠는가. 몇 번 어울린... ,안녕하세요!,https://blog.naver.com/knea96,20111031
<b>고스톱</b>의 교훈,https://blog.naver.com/cch4817?Redirect=Log&logNo=221210562793,"<b>고스톱</b>의 교훈 http://blog.daum.net/cch4700/7098 1통 2통 3통은 만사형통을 구하는 공식이 됩니다. 부디 상통(相通)하셔서 만사형통 하시기 바랍니다. 흐르지 않는 물은 썩고, 바람 통하지 않고 공기가... ",바람처럼 구름처럼,https://blog.naver.com/cch4817,20180308
피망<b>고스톱</b> 설치방법 알아봅시다,https://blog.naver.com/aromidkfha?Redirect=Log&logNo=222207394022,피망<b>고스톱</b> 설치하는법에 대해서 알려드리려고 합니다. 자세한 내용은 이곳을 참고해주세요 피망 홈페이지로 들어오면 현재 서비스하고 있는 상당히 많은 종류의 게임들이 보입니다. 이 중에서 PC게임 - <b>고스톱</b>... ,아라미슈,https://blog.naver.com/aromidkfha,20210114
