title,link,description,bloggername,bloggerlink,postdate
"4단계 시행(사적모임, 행사·집회, 학교, <b>종교활동</b> 등 주요내용)",https://blog.naver.com/sdmstory?Redirect=Log&logNo=222425850276,"(수)부터) <b>종교활동</b> ■ 비대면 예배만 가능 ■ 각종 모임/행사·식사·숙박 금지 직장근무 제조업 제외한 사업장에 시차출근제, 점심시간 시차제, 재택근무 30% 권고 기타 ■ 스포츠 관람 등 무관중 경기만... ",서대문구청 공식 블로그,https://blog.naver.com/sdmstory,20210709
서울시 <b>종교활동</b> 집회 행사 20인미만 가능하다 대면허용... ,https://blog.naver.com/xonejinsu?Redirect=Log&logNo=222434728476,대면 종교 행사를 일절 금지한 서울시 방역 지침의 효력을 일부 정지했기 때문에 다른 <b>종교 활동</b>도 일정 범위 내에서 허용한 것”이라고 했다. 아오 모르겠다 큰 비중의 숫자가 아니라서 다행이긴 하지만 모든... ,백돌이의 개인블로그,https://blog.naver.com/xonejinsu,20210717
"과도한 <b>종교 활동</b>에 빠진 배우자, 이혼 사유될까",https://blog.naver.com/zihen?Redirect=Log&logNo=221881564052,포교 활동이 수면 위로 올라왔습니다. 종교로서 인정되지 않은 '신천지'가 단순히 종교적 문제를 넘어... 종교 모임에 데리고 나가자 불화가 심해졌습니다. 결국 남편은 아내를 상대로 자신의 <b>종교 활동</b>에만 신경... ,가사 · 손해배상 소송의 새 강자 법무법인 새강,https://blog.naver.com/zihen,20200330
수도권 학교 학원 헬스장 식당 결혼식 <b>종교활동</b> 거리두기 격상,https://blog.naver.com/jndpark?Redirect=Log&logNo=222425422710,"<b>종교활동</b> 비대면 <b>종교활동</b>만 가능하벼 모임 및 행사, 식사, 숙박이 금지됩니다. 무료급식과 공부방 등 취약 계층 돌봄 활동 운영은 가능합니다. (무료봉사) 3.5. 전시회 및 박람회 시설면적 6m2당 1명으로... ",준도,https://blog.naver.com/jndpark,20210709
<b>종교활동</b>을 목적으로 건물 취득하는 경우 취득세는?!,https://blog.naver.com/dkfhskals14?Redirect=Log&logNo=222396726155,오늘은 <b>종교활동</b>을 목적으로 건물을 취득하는 경우 취득세에 대해 알아보겠습니다. 여러분들께서는... <b>종교활동</b>을 목적으로 하는 비영리단체인데요. 지방세특례제한법 제50조를 보면 <b>종교활동</b> 또는 제사를... ,뉴대성 경호팀장,https://blog.naver.com/dkfhskals14,20210613
"사회적 거리두기 4단계(학원,학교,사적모임,출근,헬스장,<b>종교활동</b>)",https://blog.naver.com/2nomsa?Redirect=Log&logNo=222425794640,"돌봄 활동을 수행하는 경우와 임종으로 모이는 경우에만 예외가 인정이 됩니다. 거리두기 4단계에서의... 이에 따라, ▲직계가족 모임, ▲사적모임·행사, ▲다중이용시설, ▲<b>종교활동</b> 및 성가대·소모임 등에... ",유명한 이노무사의 해고&·산재&,https://blog.naver.com/2nomsa,20210709
군대에서 <b>종교활동</b>,https://blog.naver.com/firean?Redirect=Log&logNo=222078558842,지금은 어떻게 군대에서 <b>종교활동</b>이 이루어지는 모른다. 내가 겪은 2000년 1월부터 2년 2개월간의... 원래 나는 종교를 싫어했다. 지금도 그렇다. 신???? 신이 있는데 내가 이렇게 살아??? 뭐 대부분이 내가 자초한... ,Untung~ At this moment~,https://blog.naver.com/firean,20200902
방역수칙 준수하며 <b>종교활동</b> 하기로 약속..~(부활절 &amp; 라마단),https://blog.naver.com/mofakr?Redirect=Log&logNo=222330691773,줄이면서 <b>종교활동</b>이 가능하다&quot; 라고 모범사례를 바탕으로 종교계에 방역수칙 준수를 요청했습니다. - 그렇다면! 올해 종교행사는 과연 어떻게 이루어졌을까요? 2021년 부활절 행사 모습 먼저 온라인으로... ,모파랑,https://blog.naver.com/mofakr,20210501
"&quot;코로나 집단감염, 야외 <b>종교활동</b>에서 비롯됐다는 어떠한... ",https://blog.naver.com/p9730043?Redirect=Log&logNo=222358220064,"정상적인 종교행사로 허가 대상이 아니다. 다만 정규 <b>종교활동</b>을 제외한 각종 대면 모임 활동 및 행사, 숙박, 음식제공 및 단체 식사는 모두 금지된다. 김해시는 이번 이슬람 <b>종교활동</b>과 관련한 사안은... ",김해일보,https://blog.naver.com/p9730043,20210520
실내체육시설 노래방 유흥시설 <b>종교활동</b> 8가지 살펴보기!,https://blog.naver.com/jxvictory3?Redirect=Log&logNo=222151676095,"사회적 거리두기 2단계 <b>종교활동</b> 방역 조치 기준 * 종교행사 참석 인원은 좌석수의 20% 이내로 제한. 8. 사회적 거리두기 2단계 사우나, 영화관, 이.미용업 등 방역 조치 기준 *사우나.찜질방 등 목욕장업과... ",에리의 건강나누미,https://blog.naver.com/jxvictory3,20201123
"거리두기 2단계 실시, 연말연시 모임 자제, 모든 <b>종교 활동</b> 비대면",https://blog.naver.com/yeongju_city?Redirect=Log&logNo=222181538367,"연일 종교시실에서 확진자가 계속 발생을 하고 있는 가운데, 영주교회에서만 12명의 확진자가 발생을... 일곱, 예배, 미사, 법회 등 모든 <b>종교 활동</b>은 비대면으로 실시하도록 조치를 강화합니다. ※ 정부안... ",힐링중심 행복영주 영주시청 공식 블로그,https://blog.naver.com/yeongju_city,20201222
한교총 “4단계 <b>종교활동</b> 새 지침 즉시 마련해야”,https://blog.naver.com/gcn2020?Redirect=Log&logNo=222438096146,"앞서 16일 서울행정법원 제11행정부는 관련 가처분 신청에 대해, 코로나19 확진자 발생으로 인해 폐쇄된 전력 등이 있는 종교단체를 제외하고 최대 19명까지, 전체 수용인원의 10%만 대면 <b>종교활동</b>을 할 수... ",GCN(Global Christian News),https://blog.naver.com/gcn2020,20210720
"신천지이혼, 배우자의 <b>종교활동</b>으로 이혼할 수 있을까?",https://blog.naver.com/zx1991zx?Redirect=Log&logNo=221948058134,&quot;이혼이 가능했던 사례&quot; 아내 A씨는 남편 B씨의 <b>종교활동</b>에 지쳐 이혼소송을 청구하였습니다. 남편 B씨는 특정한 종교를 믿기 시작하면서 생활을 유지하기 어려운 상황 속에서도 아내 A씨에게 상의하지 않고... ,"이혼변호사, 법무법인 테헤란을 택해라!",https://blog.naver.com/zx1991zx,20200506
독일 교회의 <b>종교 활동</b> 재원은? - 교회세(Kirchensteuer),https://blog.naver.com/ger-pci?Redirect=Log&logNo=222299607946,"운영이나 <b>종교 활동</b>에는 별 어려움이 없다. 교회세(Kirchensteuer)라고 하는 종교세 때문이다. 그러면... 교회세는 <b>종교 활동</b>이외에 교회 건물 유지 보수, 문화활동, 학교 운영, 사회 시설 운영 등에 사용된다.... ",독일정치문화연구소German Politics & Culture Inst.,https://blog.naver.com/ger-pci,20210405
"부산 동구, 교육시설서 <b>종교활동</b>한 신천지에 27억원 추징",https://blog.naver.com/hosabi55?Redirect=Log&logNo=222019280822,동구는 &quot;당초 신천지가 세금 면제를 신청할 때 <b>종교활동</b>을 한다고 주장해 종교시설로 보고 유예기간을 둔 것&quot;이라며 &quot;2년이 끝나가는 지금 용도와 다르게 쓰고 있다는 사실이 확인돼 세금을 징수하기로... ,"예수님 믿으면 천국, 부처님 믿으면 극락 간다",https://blog.naver.com/hosabi55,20200702
"캄보디아 선교, <b>종교활동</b> 금지령 후 첫 번째 주일",https://blog.naver.com/bada7175?Redirect=Log&logNo=221867739060,캄보디아 모든 <b>종교활동</b> 금지령 후 첫 번째 주일 오늘(2020.03.22) 아침은 일찍부터 부산을 떨지 않았다. 아침에 일찍 호수마을로 가지 않아도 되기 때문이었다. 이유는 오늘부터 당분간 호수마을에 주일아침... ,캄보디아 씨엠립기독교문화원(DEMSTAR),https://blog.naver.com/bada7175,20200323
비대면 온라인 <b>종교활동</b> 지원 내년 2월까지 연장,https://blog.naver.com/with_msip?Redirect=Log&logNo=222190326379,"‘비대면 온라인 <b>종교활동</b> 지원사업’은 200인 이하 중소 종교단체 <b>종교활동</b>의 신속한 비대면 전환을 위해 실시간 방송 플랫폼 이용 방법을 안내하고, 실시간 방송에 필요한 월 50기가의 이동통신 데이터... ",과학기술정보통신부 블로그,https://blog.naver.com/with_msip,20201230
기쁜 세계로...정치-<b>종교 활동</b> 지도자..,https://blog.naver.com/gameydh?Redirect=Log&logNo=222184202992,좋고 나쁨을 떠나 신흥 정당의 정치 활동이나 신흥 종교의 <b>종교 활동</b>은 공통점이 많기도 하고 보다 널리 퍼트리기 위해 대단히 노력하기도 한다.. 정치를 개혁하려는 것처럼 종교 개혁가도 많고 기독교는 정말... ,한일 교류(韓日)··자본주의로부터 가치 주의에,https://blog.naver.com/gameydh,20201224
9년만에 <b>종교활동</b> 재개하며 병역거부한 여호와증인…유죄 확정,https://blog.naver.com/hjkam23?Redirect=Log&logNo=222095091914,입영 미루다 '대체복무 필요' 헌재 결정 직후 <b>종교활동</b> 재개 '양심적 병역거부자' 대체복무 제도 본격 시행 종교적 신념 등 양심의 자유에 따른 대체복무 제도가 본격 시행된 지난 6월 30일 오후 영등포구... ,행정사 감흥조 사무소,https://blog.naver.com/hjkam23,20200921
"7월 거리두기 개편 4단계 - 결혼식, 장례식, <b>종교활동</b>... ",https://blog.naver.com/ksoekmh?Redirect=Log&logNo=222429194275,"친족은 8촌 이내의 혈족, 4촌 이내의 인척, 배우자만 해당 스포츠 관람 무관중 경기 <b>종교활동</b> 비대면 <b>종교활동</b>만 가능함. 종교모임, 행사, 식사, 숙박 금지 요양 병원·시설 방문 면회 금지 사업장 제조업... ",그래서 이차는 어디죠?,https://blog.naver.com/ksoekmh,20210712
"은퇴하고도 현역처럼 즐기며 경제활동, 정치활동, <b>종교활동</b>으로... ",https://blog.naver.com/sjhannah?Redirect=Log&logNo=222402061612,"즐기며 은퇴를 현역처럼 행동하는 경제활동, 정치활동, <b>종교활동</b>으로 사회정의를 내세우는 걸음을 함께 뛸 사람들이면 누구든지 일자리 가족 현역에 복귀하는 일을 만들고 나눌려고 한다 의욕이 있는 분은... ",함께하는 사회(송세준): 서로 나누고 봉사하고 어울림,https://blog.naver.com/sjhannah,20210618
[아산충무노인주간보호센터] 7월 2일 <b>종교활동</b> 및 만들기.,https://blog.naver.com/asan0606?Redirect=Log&logNo=222418114920,"(<b>종교</b>가 다른분들은 자유<b>활동</b> 시간을 보냈습니다.) 오후에는 거북이를 만들었습니다. 거북이에 색칠을 하고, 거북이등은 색종이를 잘라서 모자이크로 붙였습니다. 가위로 오리고, 풀로 붙이는 작업을 마쳐서... ",아산충무노인주간보호센터,https://blog.naver.com/asan0606,20210702
"18 ~ 1.31까지) ｜ 방역 수칙, 코로나19, 식당, 카페, <b>종교활동</b>",https://blog.naver.com/dgdonggu?Redirect=Log&logNo=222211085397,"[정부안] 비수도권 공통 방역수칙 - 5명부터 사적모임 금지 및 예약 · 동반입장 금지 - 대면 <b>종교활동</b> 좌석수 20% 이내 허용, 정규활동 외 모든 모임 · 식사 금지 - 숙박시설 객실 수 2/3이내 예약 제한 및... ",대구 동구청 좋아요 블로그,https://blog.naver.com/dgdonggu,20210118
"페치 생활 : 취미, <b>종교활동</b>, 학생회 활동",https://blog.naver.com/pote_koreans?Redirect=Log&logNo=222314939636,"취미활동 : 평일에는 개인학업에 대부분의 시간을 투자 하지만 주말에는 스포츠활동, <b>종교활동</b> 등으로 스트레스 해소, 학우들간 친목 도모를 합니다. 특히 축구, 농구, 테니스 등 스포츠를 좋아하는... ",헝가리 페치 의과대학교 한인 학생회(공식),https://blog.naver.com/pote_koreans,20210419
"&quot;무극대도 등 민족<b>종교</b> 지도자들, 독립을 기본 목표로 <b>활동</b>..... ",https://blog.naver.com/kohj007?Redirect=Log&logNo=222263792816,&quot;일제강점기에 <b>종교활동</b>을 통해 일제에 저항한 이들 종교지도자들에 대한 업적을 잊어서는 안된다&quot;는... 민족종교지도자들의 활동을 더욱 확신하게 됐다”며 “민족 종교지도자들의 숨은 공로는 이번 기회에... ,"제주도 사랑, 그리고 환경 사랑",https://blog.naver.com/kohj007,20210304
코로나19 대응을 위해 비대면 온라인 <b>종교활동</b> 지원,https://blog.naver.com/withbupyeong?Redirect=Log&logNo=222067586915,"온라인 <b>종교활동</b>에 어려움이 있는 중소 종교단체는 한국통신사업자연합회(KTOA) 홈페이지를 통해 매뉴얼을 다운로드받을 수 있으며, 국번 없이 콜센터(☎1433-1900)로 전화하면 상세한 안내를 받을 수... ",부평구청 블로그 공감부평,https://blog.naver.com/withbupyeong,20200822
5월 2일 오늘 일기 <b>종교활동</b>,https://blog.naver.com/9261022?Redirect=Log&logNo=222333744512,일요일은 <b>종교 활동</b>하는 날. 나는 무속 신앙을 믿는다. 무속 신앙을 믿는다고 맹신하고 아침마다 물 떠... 무슨 종교든 내가 마음에 편안을 찾고 기댈 수 있는 곳이 나한테 맞는 종교가 아닐까 싶다. 사진은... ,맛있는 인생,https://blog.naver.com/9261022,20210502
"조혜련, 교회 예배 인증 논란, 요즘 대면 <b>종교활동</b> 금지 아닌가?",https://blog.naver.com/africaphoto?Redirect=Log&logNo=222195675220,"전국 <b>종교</b>시설에는 2.5단계가 적용된다. 정규 예배, 미사, 법회, 시일식 등은 비대면으로 실시해야 하며 <b>종교</b>시설이 주관하는 모임, 식사는 금지되고 있습니다. 조혜련은 1970년생 으로 올해 52세입니다.... ",www.Africaphoto.net,https://blog.naver.com/africaphoto,20210104
"캄보디아 선교, <b>종교활동</b> 금지령 조건적 해제",https://blog.naver.com/bada7175?Redirect=Log&logNo=222088732956,캄보디아 <b>종교활동</b> 금지령 조건적 해제 지난 2020년 3월 17일(씨엠립은 3월 7일부터)에 캄보디아에 내려졌던 모든 종교들에 대한 활동금지령이 캄보디아 최대의 명절이자 국민 대부분이 절간으로 가는... ,캄보디아 씨엠립기독교문화원(DEMSTAR),https://blog.naver.com/bada7175,20200914
누구를 위한 <b>종교 활동</b>인가?,https://blog.naver.com/iknowiknow?Redirect=Log&logNo=222062710699,그중에서도 광화문에서 진행된 광복절 (<b>종교</b>?)집회를 보고 충격을 받앗다. 그래서 다시 한번 요즘 고등학교 사회 교과서에 나오는 <b>종교</b>에 대해 살펴보니 아래와 같이 설명이 되어 있었다. 왜 교과서도 나와있는... ,"I know, I know...... but",https://blog.naver.com/iknowiknow,20200817
예방접종 완료자 정부 지원 방안(<b>종교활동</b>)을 안내합니다~,https://blog.naver.com/djjunggu8?Redirect=Log&logNo=222371677684,부터 <b>종교활동</b>에 관한 지원 방안이 포함되어 있습니다. 본격적으로 시작된 예방접종에 동참하고... ㆍ정규 <b>종교 활동</b> 시 인원 제한에서 제외 ㆍ실외 다중이용시설 이용 시 인원 제한에서 제외 ㆍ사적모임 인원... ,효문화 중심도시 대전 중구,https://blog.naver.com/djjunggu8,20210528
코로나19확산으로 인한2.5단계 에서 비대면 <b>종교활동</b>,https://blog.naver.com/namhee4016?Redirect=Log&logNo=222165715607,"정부의 수도권 사회적 거리두기 2.5단계에 따라 내일(12월 8일)부터 <b>종교</b>행사를 비대면으로 진행하고, 참석인원을 20명으로 제한하게 됩니다. 이에 따라 앞으로 우리 본당에서는 3주간 동안 평일 및 주일 모든... ",미소,https://blog.naver.com/namhee4016,20201207
"허석 순천시장, 코로나19 지역확산에 모임·<b>종교활동</b> 자제 호소",https://blog.naver.com/youngjin6690?Redirect=Log&logNo=222067706730,최용진 기자 승인 2020.08.22 14:39 - 모임·체육행사 등 외부<b>활동</b> 자제 및 <b>종교</b>시설 대면예배 제한 - 22일 코로나19 확진자 4명 추가발생 【순천=강산뉴스】 최용진 기자 =허석 순천시장은 코로나19 지역 확산에... ,강산뉴스 최용진 기자 (기사제보 010-3613-6690),https://blog.naver.com/youngjin6690,20200822
"<b>종교활동</b> 중단하고 전투게임과 음주 여호와의증인, “양심적... ",https://blog.naver.com/hosabi55?Redirect=Log&logNo=222204298612,"입영통지서 받고 나서 <b>종교 활동</b>...징역 8개월에 집행유예 2년 선고 <b>종교 활동</b>을 중단한 채 음란물을 시청하고, 전투 게임을 즐긴 20대가 종교적 신념을 내세워 입영을 거부했지만 법원이 양심적 병역거부로... ","예수님 믿으면 천국, 부처님 믿으면 극락 간다",https://blog.naver.com/hosabi55,20210111
방역관리 방안 및 주요 시설(스포츠경기/<b>종교활동</b> 등) 방역 조치,https://blog.naver.com/martinok1103?Redirect=Log&logNo=222132608362,"5단계 : 무관중 3단계 : 경기 중단 <b>종교활동</b> 1단계, 1.5단계 : 좌석 띄워앉기 및 모임/식사 자제 2단계 : 모임/식사 금지 및 정규 행사 인원 30% 제한 2.5단계 : 정규 행사 인원 20% 제한 3단계 : 비대면 고위험... ",디테기CE의 블로그 세상,https://blog.naver.com/martinok1103,20201101
모든 <b>종교활동</b> 잠시 중단 중국 기독교(신교) 삼자교회... ,https://blog.naver.com/panxie?Redirect=Log&logNo=222061906351,"시종교국에서는 심천 코로나19 확진자 발생으로 <b>종교활동</b>과 관련한 천주교, 개신교의 모든 활동장소에 대해 잠시 문을 닫고 종교 행사를 금지하며, 불교 역시 법회를 목적으로 모이는 것을 금하며.... ",簕杜鹃在深圳的故事,https://blog.naver.com/panxie,20200816
부활절 집단발생 우려 <b>종교활동</b> 소모임후 가족 직장등 추가... ,https://blog.naver.com/mky5?Redirect=Log&logNo=222287538544,"감소했고 <b>종교</b>시설 관련 방역체계도 잘 갖추어지고 있는 상황이지만, 예배 이후의 소모임과 식사 등을... 권 부본부장은 “필수적인 예배<b>활동</b>을 하신 뒤에는 사적인 모임과 식사 등은 하지 말아주시기 바라며... ",안산폰싸요 전국대리운전 1811-1979,https://blog.naver.com/mky5,20210325
코로나19 대응을 위해 비대면 <b>종교활동</b>을 지원합니다!,https://blog.naver.com/with_msip?Redirect=Log&logNo=222067023175,"교회의 대면 예배금지 등 상황의 급박함을 고려하여 종교단체가 조속히 활용할 수 있도록 바로 이번 주말부터 2개월간 시행할 계획이고, 온라인 <b>종교활동</b>에 어려움이 있는 중소 종교단체는... ",과학기술정보통신부 블로그,https://blog.naver.com/with_msip,20200821
"구정기간 중국 광동성 내 모든 <b>종교활동</b>, 민간 신앙장소... ",https://blog.naver.com/golife88?Redirect=Log&logNo=222235669006,"광동성 종교단체는 2월10일부터 2월26일까지, 광동성 각 <b>종교 활동</b>장소와 민간 신앙장소는 대외적 개방을 중지하며 집단 <b>종교활동</b>을 중지한다'고 발표하였다. 《광동성 <b>종교활동</b>장소 코로나방역 일상화... ",라이프매거진,https://blog.naver.com/golife88,20210207
"대전지부, 정기 <b>종교</b>교화 <b>활동</b> 진행",https://blog.naver.com/1004daejeon?Redirect=Log&logNo=222424272777,한국법무보호복지공단 대전지부(지부장 김대기)는 7월 6일(화) 삼육기독교위원회 신원호 회장이 방문하여 숙식제공대상자를 위하여 <b>종교</b>교화 <b>활동</b>을 실시하였다. <b>종교</b>교화 <b>활동</b>을 통하여 본인의 잘못된 과거를... ,한국법무보호복지공단 대전지부,https://blog.naver.com/1004daejeon,20210708
한민고등학교 기독교 <b>종교활동</b>-(코로나로 인해 온라인 설교와... ,https://blog.naver.com/skypark405?Redirect=Log&logNo=222014575596,"목사님이 오시고, 신부님이 오시고, 스님이 오셔서 3개 종교의 <b>종교활동</b>을 진행한다. 오늘은 내가... 기독교 <b>종교활동</b>은 학생들이 대부분의 활동을 주관해서 활동한다. 1. 예배시간: 09:00~10:30 2. 장소... ",밀키 에듀,https://blog.naver.com/skypark405,20200628
"캄보디아 선교, 다시 내려진 <b>종교활동</b> 금지령",https://blog.naver.com/bada7175?Redirect=Log&logNo=222279140946,캄보디아에 다시 내려진 <b>종교활동</b> 금지령(2021년 3월 17일) 오늘(2021.03.17) 캄보디아에 또 다시 <b>종교활동</b>... 모든 종교에 대한 활동(예배와 모임 등 종교에서 행하는 모든 활동들) 금지령이 공고된 것이다. 이번... ,캄보디아 씨엠립기독교문화원(DEMSTAR),https://blog.naver.com/bada7175,20210318
[효담재가복지센터]<b>종교활동</b> &amp; 운동 &amp; 덧셈공부,https://blog.naver.com/hyo5261000?Redirect=Log&logNo=222431407635,kr 오늘 오전 저희 어르신들께서는 <b>종교활동</b>을 하셨어요. ‘보이는 세계와 보이지 않는 세계’에 대해 이야기를 나누고 보이지 않는 세계가 더 중요하다는 말씀을 해주셨답니다. <b>종교활동</b>을 원하지... ,효담재가복지센터,https://blog.naver.com/hyo5261000,20210714
사회적 거리두기 (<b>종교활동</b>),https://blog.naver.com/radiate?Redirect=Log&logNo=222411991697,<b>종교활동</b> 처럼 다수의 사람들이 모이는 곳은 그래도 올바른 마스크 쓰기와 손소독 그리고 거리두기 지키기가 필요 합니다. 마스크는 얼굴의 눈을 제외한 부분들이 잘 가려져 있는지 확인합니다. 또 종교 시설의... ,radiate님의블로그,https://blog.naver.com/radiate,20210627
"김해시,외국인 <b>종교활동</b> 관련 코로나19 감염",https://blog.naver.com/hairb9606?Redirect=Log&logNo=222358596676,"다양한 종교들은 현재‘정규 <b>종교활동</b>’을 실시하고 있으며 따라서 이는 허가의 대상이 아님. 다만, ‘정규 <b>종교활동</b>’을 제외한 그밖의 각종 대면 모임 활동 및 행사, 숙박, 음식 제공 및 단체... ",김해인터넷신문,https://blog.naver.com/hairb9606,20210520
연말부터 새해까지 꼭 지켜주세요! ② &lt;<b>종교</b>·사회<b>활동</b> 방역수칙&gt;,https://blog.naver.com/hellopolicy?Redirect=Log&logNo=222183089014,"#연말부터_새해까지 일도 <b>종교활동</b>도 집에서! ① 예배·미사·법회 비대면으로 진행해주세요. ②... *지자체별로 완화된 조치 시행 불가능하며 조치 강화만 가능 올해는 종교 행사는 가급적 취소하고, 경제활동도... ",대한민국정부 대표 블로그 정책공감,https://blog.naver.com/hellopolicy,20201223
"서울시, 불교와 천주교의 대면 <b>종교활동</b> 금지 방안도 검토",https://blog.naver.com/hosabi55?Redirect=Log&logNo=222083728907,대면 <b>종교활동</b>을 금지하는 방안을 정부에 건의하겠다고 8일 밝혔다. 김경탁 서울시 문화정책과장은 이날 서울시청에서 열린 브리핑에서 &quot;현재 교회에서만 대면 예배가 금지되고 다른 종교시설은 규정상... ,"예수님 믿으면 천국, 부처님 믿으면 극락 간다",https://blog.naver.com/hosabi55,20200908
코로나19 대응을 위한 온라인 <b>종교활동</b> 지원,https://blog.naver.com/ddm4you?Redirect=Log&logNo=221911040738,온라인 <b>종교활동</b>이 어려운 200인 이하의 중소 종교단체 내 용 (기술 지원) 인터넷 생방송 플랫폼 매뉴얼 제작·배포 (한국통신사업자연합회 홈페이지 http://www.ktoa.or.kr/) 전용 콜센터 운영(필요시... ,동대문구청 공식 블로그,https://blog.naver.com/ddm4you,20200416
사회적 거리두기 2.5단계 실내체육시설 노래연습장  <b>종교활동</b>... ,https://blog.naver.com/jxvictory3?Redirect=Log&logNo=222165199656,"5단계 <b>종교활동</b>: 비대면, 20명 이내 인원 제한, 모임 식사 금지 *사회적 거리두기 2.5단계 KTX, 고속버스: 50% 이내 예매 #사회적거리두기2.5단계 #거리두기2.5단계",에리의 건강나누미,https://blog.naver.com/jxvictory3,20201207
하나님은 <b>종교 활동</b>이 아닌 옳은가 바른가를 보십니다.,https://blog.naver.com/vwm?Redirect=Log&logNo=222077080560,"&quot;하나님은 절대 <b>종교 활동</b>을 보시지 않고 옳은가 바른가를 보십니다.&quot; 19.나는 감추어진 곳과 캄캄한... 다시 한 번 말씀드리지만 예배당이 없어서, 예배가 없어서, 말씀이 없어서, 기도가 없어서 이러한 종교... ",vision,https://blog.naver.com/vwm,20200901
<b>종교활동</b>(묵주기도 모임),https://blog.naver.com/samsungfamily01?Redirect=Log&logNo=222356084431,코로나 바이러스로 외부인 출입 금지에 따라 지역사회 연계로 진행하던 <b>종교활동</b>이 무기한 연기되었습니다. 평소 신앙심이 있으시나 활동이 어려우신 어르신들을 안타깝게 생각하는 마음에 천주교 교리교사... ,삼성훼밀리요양원,https://blog.naver.com/samsungfamily01,20210518
