title,link,description,bloggername,bloggerlink,postdate
[<b>라디오</b>광고] <b>라디오</b>20초광고 <b>라디오</b>광고비용 안내,https://blog.naver.com/thdwlaks4?Redirect=Log&logNo=221859732401,<b>라디오</b>CM광고는 <b>라디오</b>를 <b>청취</b>하시다광고듣고 오겠습니다~ 라는 멘트와 함께 20초간 광고가 나오는 CM 광고 입니다. <b>라디오</b>CM광고는20초간 제작한 소재를 <b>라디오</b>프로그램에 송출하여<b>청취</b>하는... ,"세상모든광고[TV,라디오,지하철광고]",https://blog.naver.com/thdwlaks4,20200318
하루의 끝에서,https://blog.naver.com/chayoomi127?Redirect=Log&logNo=222433150832,"이야기 &quot;야근하고 지친 몸으로 퇴근해 뒤늦은 저녁 챙겨먹고 나니 피곤했지만 그래도 샤워 싹 하고 나와 남편이랑 침대에 누워 같이 <b>라디오</b> 듣고 있으니 참으로 좋네요.&quot; 12시, <b>라디오</b> <b>청취</b> 끝. 이제 자야지. 굿나잇!",차쌤 Blog,https://blog.naver.com/chayoomi127,20210716
[<b>라디오</b>광고] <b>라디오</b> 상품 협찬광고,https://blog.naver.com/alove218?Redirect=Log&logNo=222422034470,근래 코로나이슈로집안에서 활동을 많이 하기때문에<b>라디오</b> <b>청취</b>자가 매우 많아졌습니다. 인터넷이나 주파수를 통하여<b>라디오</b>를 <b>청취</b>하며사연도 보내고퀴즈도 맞추며 사은품을 받아가시는... ,럭키의 광고월드,https://blog.naver.com/alove218,20210706
실시간) 무도<b>라디오</b> <b>청취</b>중 ♩,https://blog.naver.com/wldls0925?Redirect=Log&logNo=220119236505,꺄오! 오늘무도<b>라디오</b>데이라는거! 낮에부터알앗는데! 이제 듣는다요! 유재석님 의 <b>라디오</b>듣는중 다음은 하하 씨 라면서요!! 다 듣구자야겟다 같이들어요 괜.사 마지막이라 둘다틀엇는데 집중안돼 이런;;;;된장,지인' Happyday♬,https://blog.naver.com/wldls0925,20140911
"KBS, 사랑의소리방송 <b>청취</b>권역 확대",https://blog.naver.com/qkrtmddn10?Redirect=Log&logNo=80096777819,"KBS 한국방송은 7일(월), 현재까지 수도권 일부와 경남, 전남, 전북, 강원 등으로 한정된 제3<b>라디오</b>의 <b>청취</b> 권역이 내년 1월 1일부터 대폭 확대될 예정이라고 밝혔다. 이는 KBS가 송신소 위치를... ",쟁이와 함께하는 방송통신(기술)산책,https://blog.naver.com/qkrtmddn10,20091208
대구광고대행 <b>라디오</b>광고 종류와 효과,https://blog.naver.com/johnnyhoney72?Redirect=Log&logNo=222304179291,"세대가 바뀌어 가면서 과거보다 <b>라디오</b>를 듣는 <b>청취</b>자가 줄어들었다고 생각할 수 있지만 최근에는 <b>라디오</b> 없이도 스마트 TV나 컴퓨터, 휴대폰 어플을 통해서도 언제 어디서든 <b>라디오</b> <b>청취</b>가 가능해진데다... ",종합광고홍보 전문기업 붐팩토리,https://blog.naver.com/johnnyhoney72,20210409
애플 팟캐스트 유료 구독 추가 후,https://blog.naver.com/eradication?Redirect=Log&logNo=222436706862,(애플뮤직 내 <b>라디오</b> <b>청취</b>는 심지어 공짜인데!!) 라인업 역시 애플 팟캐스트 초기 안착을 위해 오픈 전에 공들여 모집했을 텐데도 너무 빈약하다. 반응 역시 악플보다 무서운 무플처럼 아무런 바이럴이... ,클라우드 게이머,https://blog.naver.com/eradication,20210719
18년 4월 <b>라디오</b> 극장 &lt;스프린터 언더월드&gt; <b>청취</b> 후기~,https://blog.naver.com/kiracho?Redirect=Log&logNo=221364243336,"올 4월 한 달 동안 <b>라디오</b> 극장으로 방송된 작품은 정이안 작가님의 &lt;스프린터 언더월드&gt;였다. 현대... 총 3부작으로 이번 <b>라디오</b> 극장은 1부작으로 만들어졌다. 2, 3부는 금년과 내년에 출시될 예정이라는데 얼른... ",자유 공간,https://blog.naver.com/kiracho,20180922
노벨뷰 SD6000 어머니 사드린 <b>라디오</b> : <b>라디오</b>냐 ? 휴대용... ,https://blog.naver.com/littlefeet?Redirect=Log&logNo=220461814502,고감도 <b>라디오</b> <b>청취</b>를 위한... 전선형 안테나... 장시간 <b>라디오</b> <b>청취</b>를 위한... 추가 배터리... 그리고 usb 충전 아답타 까지... 이렇게 풀로 구성하고도... 이전에 사 드린 손<b>라디오</b>보다 저렴한 가격...^^ 본품... ,탕수육맛껌,https://blog.naver.com/littlefeet,20150825
[<b>라디오</b>광고]KBS에 2만원도... 수 있는 <b>라디오</b>프로그램이 있다???,https://blog.naver.com/fhuhic?Redirect=Log&logNo=221622845332,"대박 대박 대~~~박~ 자~ 왜 대박인지 알려드릴께요~ 우리나라 <b>라디오</b> <b>청취</b>율 1위 프로그램은 뭘까요?? 위 두 프로그램이 1, 2위를 다투고 있습니다. 작년까지만 해도 컬투쇼가 독보적인 1위였는데~ 작년부터... ",미디어하프 광고대행 CM송 공익광고 버스광고,https://blog.naver.com/fhuhic,20190820
MP3P로 위성<b>라디오</b>를 <b>청취</b>하고 녹음한다,https://blog.naver.com/ngriffyjr?Redirect=Log&logNo=90001617864,"지금까지 위성 <b>라디오</b>방송을 <b>청취</b>하려면 위성 <b>라디오</b>방송 전용 <b>라디오</b>를 구입해야 했으나, 이제는 MP3P만으로 다양한 위성 <b>라디오</b> 방송 <b>청취</b>가 가능해졌다. &quot;&quot;XM Satellite Radio社&quot;&quot;의 위성 <b>라디오</b>방송은... ",ㅇㅇ,https://blog.naver.com/ngriffyjr,20060210
"채권양도, 운전자 보험에 대해서 tvn 교통시대 <b>라디오</b> <b>청취</b> 사연",https://blog.naver.com/82642?Redirect=Log&logNo=221485409721,https://blog.naver.com/82642/221485216041 앞서 아버님께서 교통사고로 사망하신 내용이 길어서 형사합의에 대해서는 따로 말씀 드립니다. 우선 가해자 측 하고의 형사합의에 대한 대처에 대해 물어 보셨는데... ,손해사정사 사명,https://blog.naver.com/82642,20190311
LC-200Q 블루투스 스피커 조명 알람 수유등 LED조명등 <b>라디오</b>!,https://blog.naver.com/ssfunny?Redirect=Log&logNo=220730898582,"음질로 <b>라디오</b> <b>청취</b> 가능합니다! 메모리 기능을 사용하면 미리 설정한 채널을 편리하게 사용하실 수 있습니다. lc-200q는 블루투스 칩셋을 탑재하여 스마트폰 태블릿pc,노트북 등 블루투스가 내장된... ",에스퍼니님의블로그,https://blog.naver.com/ssfunny,20160608
브리츠<b>라디오</b>로 감성 뚝뚝 BZ-CR9910,https://blog.naver.com/kks620305?Redirect=Log&logNo=221270075003,<b>라디오</b><b>청취</b>모드에서 취침 타이머 설정 밤시간 <b>라디오</b><b>청취</b>시에는 취침 타이머 설정도 가능해요. 90.60.30.15분 단위로. 전 밤시간에는 <b>라디오</b> 들을 겨를은 없지만.. 좋은 기능입니다. <b>라디오</b> 잔잔하게 들으며... ,처음한과,https://blog.naver.com/kks620305,20180507
[<b>라디오</b>광고] <b>라디오</b>상품협찬광고 비용 및 효과안내,https://blog.naver.com/thdwlaks4?Redirect=Log&logNo=221907448335,"동영상에 나온 멘트와 같이프로그램을 진행하는 진행자 혹은 담당자,성우,게스트등이협찬사를 소개하여 <b>라디오</b>를 <b>청취</b>하는 <b>청취</b>자분들에게직접적인 브랜드명 혹은 제품명을 소개할 수 있는 광고매체... ","세상모든광고[TV,라디오,지하철광고]",https://blog.naver.com/thdwlaks4,20200414
손해평가사 합격후기 준비부터 취득까지!,https://blog.naver.com/hyuna1177?Redirect=Log&logNo=222430407905,스마트폰 스트리밍이 유용한 것은 낮에 운전을 할 때 이동 시간에 그리고 청소나 빨래 등 집안일을 할 때도 TV 켜놓듯 볼륨을 더 올려서 <b>라디오</b> <b>청취</b>를 하는 것처럼 자꾸 들으면서 단어와 최대한 친해지기 위해서... ,행복한 이지's ezi LIFE,https://blog.naver.com/hyuna1177,20210713
[방송출연 안내] YTN <b>라디오</b> '황보선의 출발새아침-여의도... ,https://blog.naver.com/with_wraenoh?Redirect=Log&logNo=222416646844,"35분~ YTN <b>라디오</b> '황보선의 출발새아침-여의도 중계석'에 생방송(스튜디오) 출연합니다. 많은 관심 부탁드립니다. 감사합니다. - 채널 안내 - FM 94.5MHz <b>청취</b>, YTN<b>라디오</b> 앱, 유튜브에서 시청할 수 있습니다.",국민과 더불어민주당,https://blog.naver.com/with_wraenoh,20210701
방수 블루투스스피커 :: <b>라디오</b> + 알람시계 + 스피커 KISS H1... ,https://blog.naver.com/wjdgus1662?Redirect=Log&logNo=221047646409,"또한 LED 시계가 장착되어있어서, 알람시계는 물론 LED 밝기조절도 가능하고 유선과 무선으로 음악이 감상함은 물론, FM <b>라디오</b> <b>청취</b>도 가능해서 아침 샤워하면서 <b>라디오</b>를 듣는것도 가능하답니다! 그밖에... ",코딩하는 트레이너의 IT 이야기,https://blog.naver.com/wjdgus1662,20170709
"어버이날 선물, 효도<b>라디오</b> A300II",https://blog.naver.com/digital-saymart?Redirect=Log&logNo=222340919484,<b>라디오</b> <b>청취</b> 외에도 음원 다운로드 받아서 마이크로SD카드와 USB에 담아서 들으시는 것이 가능하세요. 파일재생은 MP3와 WAV 방식이 가능하시며 WMA는 변환하셔서 재생하셔야 합니다. 또 착탈식 배터리를... ,효도라디오/녹음기/소형가전은 세이마트 입니다!,https://blog.naver.com/digital-saymart,20210507
[알아봅시다] 디지털 <b>라디오</b>,https://blog.naver.com/ullppang?Redirect=Log&logNo=70012375448,실제로 젊은 세대인 10대~20대의 <b>라디오</b> <b>청취</b>시간이 2000년에 비해 지난해 크게 감소한 조사 결과도 나왔습니다. 그러나 <b>라디오</b>도 디지털 시대에 발맞추려고 노력하고 있습니다. `콩' `미니mbc' `고릴라' 같은... ,ullppang님의 블로그,https://blog.naver.com/ullppang,20061227
양아치 <b>라디오</b> <b>청취</b>방법 영상,https://blog.naver.com/jdlino?Redirect=Log&logNo=220803343873,양아치 공식 홈페이지 http://yangachi.co.kr,Drummer LINO PARK,https://blog.naver.com/jdlino,20160902
[안드로이드 추천 어플] 다양한 SBS <b>라디오</b> 방송을 <b>청취</b>해보... ,https://blog.naver.com/ehehald?Redirect=Log&logNo=80154371048,그리고 <b>라디오</b>는 채널이 있기 때문에 'POWER FM''LOVE FM' 2가지로 선택해서 다양하게 <b>청취</b>할 수 있습니다. 그리고 재미있는 사연에 대한 사진들도 확인할 수 있고 방송의 편성표도 확인 할 수 있고 사연을... ,바라니의 it 파헤치기,https://blog.naver.com/ehehald,20120229
여성시대 <b>라디오</b> <b>청취</b>하며 달성군노인복지관//오후... ,https://blog.naver.com/minjeong2071?Redirect=Log&logNo=221643667958,오전 달성군노인복지관으로 하하호호 강사 손민정 계단 이용은 청춘 시작~~^^ 리본막대로 기분좋게 올리고 내리고.... 오후 진명복지센터 독거노인친구만들기 개운죽심기 추석 선물로 직접 심어서... ,웃음. 뇌건강.힐링체조 손민정강사,https://blog.naver.com/minjeong2071,20190909
<b>라디오</b>광고 기업 마케팅 최고의 효율~!,https://blog.naver.com/qkrwpgus80?Redirect=Log&logNo=222430298331,"Previous image Next image 낮 프로그램 <b>라디오</b>광고도 주부님들, 그리고 직장에서 <b>라디오</b>를 <b>청취</b>하시면서 작업하시는 분들도 많아 이시간대에 맞는 <b>라디오</b>광고라면~ 출퇴근 때 시간보다 저렴한 비용으로 진행이... ",전국 종합광고 [모든 광고 진행] 010-3065-7530,https://blog.naver.com/qkrwpgus80,20210713
빈티지진공관<b>라디오</b>(판매완료),https://blog.naver.com/fbi108?Redirect=Log&logNo=221736993508,입니다 일반 <b>라디오</b>도 <b>청취</b>는 되지만 딱히 <b>청취</b>하실일 있으실까싶고요 am방식입니다 전압은 옛날 진공관<b>라디오</b> 다보니 110볼트 랍니다 작은트랜스 필요합니다 220볼트 꽂으심 안된답니다 꼭 이요~~~ #빈티지소품,게인하이트 빈티지 (Gain height vintage ),https://blog.naver.com/fbi108,20191214
등산<b>라디오</b> 효도<b>라디오</b> 브리츠 BA MK17 소형<b>라디오</b>,https://blog.naver.com/freeisi?Redirect=Log&logNo=222288660450,저렴한 제품이다보니 고용량을 지원하지는 않네요~ <b>라디오</b> <b>청취</b>시에는 안타나... 갬성 돋네요. 데이터 기반의 <b>라디오</b>가 아닌 주파수에 따른 <b>청취</b>법이라서 장소에 따라 수신율차이가 심하니... 진짜 <b>라디오</b>라고... ,Mr.봉쓰리의 Review Life,https://blog.naver.com/freeisi,20210327
"[맥]인터넷 <b>라디오</b> <b>청취</b>,녹화 프로그램 FStream 사용법",https://eknowhow.kr/archives/7941,맥에서 iTunes로 한글 인터넷<b>라디오</b> 방송을 들을 때 한글이 깨지는 문제때문에 인터넷 <b>라디오</b> 방송만을 위한 프로그램으로 맥 한글화 글 말미에 FStream 을 소개한 적이 있습니다. FStream을... ,e노하우,https://eknowhow.kr/,20100302
[인터넷<b>라디오</b>]인터넷<b>라디오</b>에 광고하는 방법,https://blog.naver.com/thdwlaks4?Redirect=Log&logNo=221221916102,"인터넷<b>라디오</b>는 스마트폰,PC등으로 <b>라디오</b>를 <b>청취</b>하는 <b>청취</b>자들에게 20초간 CM송을 송출하여 광고하는 매체 입니다.주파수를 맞추어 수신기로 듣는 <b>라디오</b>와 동일한 방송이 송출되지만, 광고시간대에는... ","세상모든광고[TV,라디오,지하철광고]",https://blog.naver.com/thdwlaks4,20180305
아날로그 감성을 담은 미니오디오/미니<b>라디오</b> 코비(COBY)... ,https://blog.naver.com/soundsonic?Redirect=Log&logNo=40201622213,"하지만, 외부 활동(등산, 낚시, 운동 등)을 즐기시는 분, 집안 일 하시는 주부, 작은 사무실에서 일하시는 분들이 음악이나 <b>라디오</b> <b>청취</b>를 목적으로 이용하는 기기로서는 부족함이 없습니다. 저의 경우는... ",이웃집딴따라의 생각상자,https://blog.naver.com/soundsonic,20131127
우현이 내게 오나봐~잘테면 자~~<b>라디오</b>  <b>청취</b>~~,https://blog.naver.com/woohyunimiso?Redirect=Log&logNo=220995233993,우현이 내게 오나봐 잘테면 자 라 디오 ㅋㅋㅋㅋ 우현님도 잘 자요~~♡ 목소리 들려줘서 고민들어줘서 응원해줘서 고마워요~~♡ 굿 나잇~~이 아닌 굿 모닝이 되어버렸어 ㅎㅎ,"우혀니미소바다(INFINITE,남우현)",https://blog.naver.com/woohyunimiso,20170430
녹음/해외안전여행 <b>라디오</b> <b>청취</b>/MBC <b>라디오</b> 시민세상]... ,https://blog.naver.com/dreamqwer?Redirect=Log&logNo=100164402867,"저희가 드디어~첫 언론활동을 하게 되었는데요 바로, MBC 부산 - <b>라디오</b> 시민세상에 출연하게 되었습니다!! 오!! 저희 해외안전여행이 떡하니 나오네요 모두 박수한번 짝짝짝!! <b>라디오</b> 시민세상은 매주 토요일... ",다시,https://blog.naver.com/dreamqwer,20120810
<b>라디오</b> 단독 수신이 가능한 블루투스 이어폰 브리츠 BRITZ... ,https://blog.naver.com/jsa369369?Redirect=Log&logNo=220424301936,이어폰 단독적으로 마그네틱 방식으로 보관하고 FM<b>라디오</b> <b>청취</b> 그리고 고급 기종에만 있던 스포츠 이어훅까지 운동할때 편리한 블루투스 이어폰 거기다가 스포츠 이어훅까지! 사진에서 보이는것처럼 마그네틱... ,@5nigiri,https://blog.naver.com/jsa369369,20150719
인켈(inkel) 무선충전 wireless 미니 오디오 <b>라디오</b>... ,https://blog.naver.com/hanrim1704?Redirect=Log&logNo=222435783100,좋아하시거나 <b>라디오</b> 챙겨서 <b>청취</b>하시는 분들 하나쯤 가지고 있으면 좋을 것 같은 미니 오디오네요~^^ 소장가치가 있는것같아요 요즘 일한다고 2일 1포는 고사하고 포스팅을 아예 못하고 있는데요 가뭄에... ,하늘아래 다지기한판 역전시대,https://blog.naver.com/hanrim1704,20210718
인터넷 <b>라디오</b> <b>청취</b> 프로그램 NCRADIO,https://blog.naver.com/hanbt01?Redirect=Log&logNo=221159832659,인터넷 <b>라디오</b> <b>청취</b> 프로그램입니다. 프로그램을 등록해 올리려다가 사이트를 링크합니다. http://computertiptools.tistory.com/117 한번쯤 이용해보시면 될듯 싶네요.,모기네..,https://blog.naver.com/hanbt01,20171210
블루투스 이어폰으로 FM<b>라디오</b> 듣기,https://blog.naver.com/cstrike?Redirect=Log&logNo=220035420571,"(있는것은 해외구매품인데 사용자 리뷰가 없어서 패스/ 약5시간 재생시간) 스마트폰을 통한 FM <b>라디오</b> <b>청취</b>시 문제점 - 음질이 비교적 떨어지고 , 밧데리 문제 - 밧데리를 하나 더 사거나 배터리팩을... ",코로나 치유 되도 후유증 심각-안걸리는게 최고,https://blog.naver.com/cstrike,20140619
20140918 컬투쇼 <b>라디오</b> 출연,https://blog.naver.com/braxton75?Redirect=Log&logNo=220128857916,오후 2시에 한창 집중해서 업무처리 해야하는 시각 이었지만 실시간으로 <b>라디오</b> <b>청취</b>를 하고픈 맘이 굴뚝 같았다. 업무 시간이라 절대 그럴수 없었지만 자꾸만 궁금한 맘이 드는건 어쩔수 없었다. 퇴근 후... ,MINO- Min Ho. 그에게 중독되다.,https://blog.naver.com/braxton75,20140922
무한도전 395회 :: <b>라디오</b>스타 / 9월 11일 무한도전 <b>라디오</b>데이... ,https://blog.naver.com/honeyrequest?Redirect=Log&logNo=220118279453,"하루종일 <b>라디오</b> <b>청취</b>해야겠네요^^;; 무한도전 <b>라디오</b>데이, <b>라디오</b>스타! 많이 기대해주시고 많이 <b>청취</b>해 주세요~^^ ※ 이미지출처 : MBC 무한도전 방송화면 캡쳐 이미지에 대한 저작권은 MBC에 있음을 밝힙니다.",연못부부의 세상피크닉,https://blog.naver.com/honeyrequest,20140911
눈감고 <b>라디오</b><b>청취</b> 좋아,https://blog.naver.com/mfjjg93dsfw?Redirect=Log&logNo=220770948589,"여름휴가도 가고 싶고이리저리 가족들과도 시간을 보내지 못해서 안타까웠는데,그냥 오랜만에 옛 기억을 되살려보고자<b>라디오</b><b>청취</b>를 해봤답니다. 요즘은 어플로도 듣는게 가능해서다양한 콘텐츠를 접할 수 있는... ",솔라의 뜨거운 블로그,https://blog.naver.com/mfjjg93dsfw,20160725
[<b>라디오</b>협찬 광고]MBC <b>라디오</b> 상품협찬,https://blog.naver.com/hooong42?Redirect=Log&logNo=222428933943,"- 주5회 프로그램 내에서 광고주명 / 상품명 노출 - <b>라디오</b> 수신기, 다시 듣기, 인터넷 <b>라디오</b>로도 <b>청취</b> 가능 <b>라디오</b> 듣다보면 사연이 선정되신분께 혹은 저희 프로그램에서 드리는 선물입니다~ 라면서... ",홍의블로그,https://blog.naver.com/hooong42,20210712
세이<b>라디오</b>(Say Radio) 인터넷 음악방송 다운로드 / 위젯담기,https://blog.daum.net/kimjin3257/428,그래서 홈 뮤직에서 사 온 블로그 배경 음악과는 달리 세이<b>라디오</b> 방송은 쉽게 끊어지지 않고 끊어 놓으면 다시 살아나는 번거로움이 있어서 <b>청취</b>하기가 불쾌한 이웃님들께서 세이<b>라디오</b> <b>청취</b>를... ,Eun ha su blog,https://blog.daum.net/kimjin3257,20121121
영화한편그램#장시간운전은쉼운전으로#시간대별라이도<b>청취</b>,https://blog.naver.com/rlfem1wls?Redirect=Log&logNo=220488425068,그리고 컬투랑 명수형꺼 <b>라디오</b> <b>청취</b>.. 이번에 새로 다운 받은 멜론 100곡 휴게소는 2군데 정도 들리면서 쉬엄쉬엄 내려가려고 합니다. 조금씩 가다보면 어느덧 도착해 있겠죠~~ ^^ 여러분들도 즐거운 귀성길... ,힐링터치 건강운동센터,https://blog.naver.com/rlfem1wls,20150922
인터넷없이 듣는 <b>라디오</b> ... 팟캐스트(수정본),https://blog.daum.net/mindyleesong/13722257,"여름날, 장난스런 눈빛을 띠고 <b>라디오</b>를 품에 안고 사라지던 아버지의 모습이 짧은 영상처럼 떠오르는데, 아마도 <b>라디오</b> <b>청취</b>를 위해 호젓한 곳으로 피난(?)가셨던 것이 아닌가싶다. <b>라디오</b>와 함께한... ",민디가 전하는 캐나다 이야기,https://blog.daum.net/mindyleesong,20150110
18년 2월 <b>라디오</b> 극장 &lt;시간을 마시는 카페&gt; <b>청취</b> 후기,https://blog.naver.com/kiracho?Redirect=Log&logNo=221242014669,"2018년 02월 KBS <b>라디오</b> 한민족방송 <b>라디오</b> 극장 시간을 마시는 카페 원작 최지운, 각본 김민정 북유럽신화 신들의 이름을 지닌 메뉴를 판매하는 신비로운 카페 아스가르드. 그곳에서는 시간이 정상적으로... ",자유 공간,https://blog.naver.com/kiracho,20180331
<b>라디오</b>21.....JYJ특집방송!!,https://blog.naver.com/sinxath?Redirect=Log&logNo=150114114693,(채널 기입은 선택사항이나 기입하지 않을 경우 <b>청취</b>하기에 약간의 불편함이 있을 수 있습니다.) 저장을 누른후 추가한 채널을 선택하여 ▶를 누르면 <b>라디오</b> <b>청취</b> 됩니다... ,어쩌란 말이냐 트위스트 추면서⁷,https://blog.naver.com/sinxath,20110720
경비지도사 전략적인 공부법,https://blog.naver.com/dlwjdwn1101?Redirect=Log&logNo=222413035938,길지 않아서 일상 생활을 하면서 휴대폰으로 스트리밍 해놓고 다른 일을 하면서 <b>라디오</b> <b>청취</b>하듯 듣기만 했습니다. 지겨울 정도로 반복 하다 보면 금방 문제의 정답을 찾을 수 있게 되고 문제집 또한 빈출... ,비비드캣츠 Beauty and Brain,https://blog.naver.com/dlwjdwn1101,20210628
당신이 생각하는 <b>라디오</b>의 매력은?,https://blog.naver.com/kprizia25?Redirect=Log&logNo=220288636565,'<b>라디오</b>'라는 단어를 들을때 떠오르는 이미지는 따뜻한 소식들과 커피한잔이 어울리는 음악들이예요 임신했을때 태교를 <b>라디오</b> <b>청취</b>로 했었는데 선진국에서는 <b>라디오</b>로 태교를 많이 한다고 하더라구요 그때... ,프리지아 소확행^^,https://blog.naver.com/kprizia25,20150303
"IA20의 알람기능, 모닝콜 그리고 FM<b>라디오</b> 노이즈 해방!",https://blog.naver.com/clubkang?Redirect=Log&logNo=220387717273,"볼륨 20상태에서 FM <b>라디오</b> <b>청취</b> 영상입니다. 노이즈 없는 깨끗한 소리를 확인할 수 있습니다. 참고로 효도용 <b>라디오</b>로 똑같은 장소에 FM <b>라디오</b>를 켜면, 작지만 지지직거리는 노이즈가 발생합니다. ▲ 2가지... ",워터포르의 디지털 시간여행&와포TV,https://blog.naver.com/clubkang,20150612
부모님께 선물하기 좋은 브리츠 효도<b>라디오</b>에요.,https://blog.naver.com/starwith79?Redirect=Log&logNo=220380112333,<b>라디오</b> <b>청취</b> 스마트폰에 담긴 음악 재생 꽃사슴 파파께서는 색소폰 취미가 있으세요. 본인이 연주하신 색소폰 음악을 스마트폰으로 녹음하셔서 듣고 다니시더군요. 이 스피커를 선물해드리면 정말 좋아하실... ,살짝 미치면 인생이 즐겁다!,https://blog.naver.com/starwith79,20150604
영국 앰배스더 진공관 <b>라디오</b>를 블루투스 스피커로,https://blog.naver.com/minkangkim?Redirect=Log&logNo=221483265590,요즘은 스마트폰에 <b>라디오</b> 앱만 깔면 <b>라디오</b> <b>청취</b> 가능해서 라다오도 <b>청취</b> 가능하지요. 사이즈가 가로 48.5cm 세로 27cm 이며 높이 49cm라 라다오로는 중대형 사이즈 이고 소리도 아주 좋네요. #진공관... ,*** 빈티지앤틱하우스 ***,https://blog.naver.com/minkangkim,20190308
위성 <b>라디오</b> 회사 시리우스 XM (1/3),https://blog.naver.com/keonlee0324?Redirect=Log&logNo=120204911780,"위성 <b>라디오</b> 회사 시리우스 XM(Sirius XM) (2013-11) 배런즈Barron's 번역: 투자전문번역가 이건 1990년대 말, ‘시리우스 XM Sirius XM’은 위성 <b>라디오</b> <b>청취</b> 범위를 미국 전역으로 넓혔지만, 월스트리트의 반응은... ",투자서 번역가 이건,https://blog.naver.com/keonlee0324,20140113
"중국 <b>라디오</b> 산업, 미래가 있는가?",https://blog.naver.com/kyoweon?Redirect=Log&logNo=222199500635,"CSM(CSM媒介研究) 발표자료에 따르면, 최근 5년간의 <b>라디오</b> <b>청취</b>자들은 2015년 5.35억 명에서 2019년 6.07억 명으로 5년 동안 7200만 명이 증가하면서 13.5%의 성장율을 기록하고 있다. 2015년부터 2020년까지 중국... ",윤교원님의 블로그,https://blog.naver.com/kyoweon,20210107
피플<b>라디오</b> 코너기획 응모,https://blog.naver.com/dungah?Redirect=Log&logNo=110024997211,"kr/people2)에 접속 - 왼쪽 상단에 있는 피플<b>라디오</b> 버튼을 클릭하여 피플<b>라디오</b> <b>청취</b> - 각 자키의 이미지에 맞는 코너기획을 자유로운 형식으로 기획 (ex. 쟈키명, 코너명, 진행내용과 방법을... ",special day,https://blog.naver.com/dungah,20071204
