title,link,description,bloggername,bloggerlink,postdate
코로나 방역보다 <b>종교 활동</b> 관련 뉴스(2020-11-27),https://blog.naver.com/r-maru?Redirect=Log&logNo=222155939997,방역보다 <b>종교활동</b> 이 우선한다는 판결을 내렸다. AP통신 등에 따르면 미 연방대법원은 25일(현지시간) 코로나 19 확산 방지를 위해 종교 행사 참석자 수를 제한한 앤드루 쿠오모... ,알-마루,https://blog.naver.com/r-maru,20201127
사직요양병원-♥<b>종교활동</b>프로그램♥,https://blog.naver.com/geri47?Redirect=Log&logNo=222080143203,"프로그램은 #<b>종교 활동</b> 프로그램 입니다 ~♥ #종교를 가진 어르신들의 #심신의 안정과 평안을... 미술활동, 음악 활동, 인지활동, 신체활동 등 외에도 여러 가지 프로그램과 #지역사회 프로그램도 함께 운영하고... ",부산사직요양병원(SajicGeriatricHospital),https://blog.naver.com/geri47,20200904
"'민심 동요 막자' 중국, 외국인 <b>종교 활동</b> 규제 강화",https://blog.naver.com/bonsng?Redirect=Log&logNo=222153251830,"'민심 동요 막자' 중국, 외국인 <b>종교 활동</b> 규제 강화 극단주의 옹호·불법 종교 제재 (베이징... 분리주의 활동을 위해 종교를 가장하는 일부 세력이 중국에 침투하는 것을 막는 데 도움이 된다&quot;면서 &quot;새... ",코베캄포럼,https://blog.naver.com/bonsng,20201124
"정부, 비대면 온라인 <b>종교활동</b> 지원 내년 2월까지 연장",https://blog.naver.com/sisa5992?Redirect=Log&logNo=222189428592,‘비대면 온라인 <b>종교활동</b> 지원 사업’은 200인 이하 중소 종교단체가 <b>종교활동</b>을 신속하게 비대면으로 전환할 수 있도록 실시간 방송 플랫폼 이용 방법을 안내하고 실시간 방송에 필요한 월 50기가의... ,시사상조신문,https://blog.naver.com/sisa5992,20201229
"<b>종교활동</b>, 인지활동 - 인천 서구 두드림 주간보호 센터(6/11)",https://blog.naver.com/dodrim7733?Redirect=Log&logNo=222428742759,"인천 서구 두드림 주간보호 센터는 매주 월요일 신체<b>활동</b> 수업으로 다양한 스포츠나 몸을 움직이는 하는 실버스포츠하고 있습니다. 오늘의 <b>활동</b> &quot;볼링, 피구&quot; 어르신들께서 볼링 핀에 공을 던지며 공을... ",.,https://blog.naver.com/dodrim7733,20210712
코로나19 재확산 방지 온라인 <b>종교활동</b> 지원 안내,https://blog.naver.com/1004hanada?Redirect=Log&logNo=222071207792,"첨부파일 1598401886868.pdf 파일 다운로드 <b>종교활동</b>으로 인한 코로나 확진자가 다수 증가하는 추세입니다. <b>종교활동</b>시 온라인으로 진행부탁드리며, 교육도 진행하고 있사오니 위의 <b>종교활동</b> 가이드파일... ",윤꼬의 잡다한 이야기,https://blog.naver.com/1004hanada,20200826
입영통지서 받자 <b>종교활동</b> 재개한 병역거부 여호와의증인 유죄,https://blog.naver.com/hun4339?Redirect=Log&logNo=222203875477,입영통지서를 받고 나서야 종교 생활을 다시 시작한 양심적 병역 거부는 인정할 수 없다는 법원... A씨는 여호와의 증인 신도인 부모님 사이에서 태어나 신앙 생활했으나 2016년 이후 <b>종교 활동</b>을 중단했다.... ,힐링캠프,https://blog.naver.com/hun4339,20210111
군대 <b>종교활동</b> 알아보기,https://flatsun.tistory.com/1197,오후 종교행사가 있기 때문에 <b>종교활동</b> 열심히 하는 사람들은 토요일이나 일요일에는 아침먹고 교회로 가서 저녁먹고 돌아오는 경우가 잦은데 부대에서 잠이나 자지 뭐하러 저기서 삽질하나 싶겠지만... ,Flat Sun,https://flatsun.tistory.com/,20200307
봉담중앙요양원_<b>종교활동</b> (예배),https://blog.naver.com/bongdamcenter?Redirect=Log&logNo=222174673121,"1번 <b>종교활동</b>을 진행하는데 그 중에 예배를 드리는 모습입니다. 어르신들이 함께 소리 내어 찬양을 하면서 화합하고, 또 가사를 읽고 함으로 뇌 활동에도 도움을 주는 그런 시간입니다. 또한 종교적으... ",봉담중앙요양원,https://blog.naver.com/bongdamcenter,20201215
종교시설이 비대면 예배 온라인 영상 <b>종교활동</b> 지원단,https://henameo.tistory.com/1494,"종교시설이 비대면 예배 온라인 영상 <b>종교활동</b> 지원단 종교생활/기독뉴스 2020. 8. 26. 16:50 사진=전주시 제공 ㅇ종교시설이 비대면 온라인 영상을 통해서 예배와 미사, 법회 등의 <b>종교활동</b>을 영위할 수 있도록... ",헤나메오,https://henameo.tistory.com/,20200826
카페내 취식 되고 헬스장·노래방 문연다…<b>종교활동</b> 제한적 허용,https://blog.naver.com/k8420985?Redirect=Log&logNo=222209932436,"<b>종교활동</b>은 수도권은 좌석 수의 10%, 비수도권은 20% 이내에서 정규예배·법회·미사의 대면 활동이... 종교시설의 대면 활동도 일부 인원에 한해 허용된다. 정규예배·법회·미사 등은 마스크 착용, 거리두기 등... ",꼬닝의 핫이슈!,https://blog.naver.com/k8420985,20210117
[D-80] Recharge / <b>종교활동</b>,https://blog.naver.com/sumeen21?Redirect=Log&logNo=177170602,"[D-80] Recharge / <b>종교활동</b> 식단 0730 물 한잔. 비100 한알 0740 사과 반쪽 0800 게이너 한 스쿱 0830... 11시 예배를 마치고 오후1시 청년부 예배도 같이 드려서, 이제부터 청년부에 속해서 활동을 할 예정입니다.... ",건강을 전하는 꿈꾸는 베니,https://blog.naver.com/sumeen21,20130127
<b>종교활동</b> 시작했어요,https://blog.naver.com/bioangel?Redirect=Log&logNo=221305789281,50세쯤 되면 <b>종교활동</b>을 해야지라고 생각했어요 그리고 한편으로는 지금 하고 싶은 걸 생각중이었어요 다시 생각해보니 지금 하고 싶은 건 모르면서 나중에 하고 싶은 건 있더라구요 그래서 시작했어요 나중에... ,SURRENDER,https://blog.naver.com/bioangel,20180624
<b>종교활동</b> 하면 지갑이 두둑하게 된다?,https://blog.naver.com/ok24?Redirect=Log&logNo=40018898123,<b>종교활동</b> 하면 지갑 두둑하게 만들어 준다? 워싱턴 로이터=연합뉴스 입력 : 2005.10.26 09:59 50' &lt;!!--bodystart... 그루버는 ’종교 시장 구조와 종교 참여 및 그 결과 : 종교는 유익한가’라는 제목의 이 논문에서... ,Noosphere,https://blog.naver.com/ok24,20051026
<b>종교</b>갈등이혼 소송이 성립된 사례는?,https://blog.naver.com/armarryetty1065?Redirect=Log&logNo=222415412529,"참고로, 앞에서 살펴본 경우 외에도 - 어려운 가정 형편 속에서도 생활비를 <b>종교 활동</b>에 사용하거나 과도하게 헌금하는 경우, - 자신의 종교적 믿음을 배우자에게 지나치게 강요하는 경우, - <b>종교 활동</b>을... ",길변호사 이혼/가사 실무기록,https://blog.naver.com/armarryetty1065,20210701
"[의뢰인 상담사례] <b>종교</b>갈등이혼 위자료 2,000만원 인용된 사례",https://blog.naver.com/kimwise2005?Redirect=Log&logNo=222341430391,"경제활동을 포기한 경우 - 자신의 종교를 배우자에게 강요하고 배우자 몰래 <b>종교활동</b>을 하면서 아파트를 담보로 대출받은 경우 종교갈등이혼, 심각성을 서면에 잘 녹여내야 코로나 19바이러스는 비단 경제에... ",길인영 변호사,https://blog.naver.com/kimwise2005,20210508
육군3사관학교 사관후보생 <b>종교활동</b> 보장해야,https://blog.naver.com/humandg?Redirect=Log&logNo=10034415152,등의 활동으로 가용시간이 부족해 <b>종교활동</b>은 제한하고 있다고 답변했습니다. 그러나... 실시하는 활동내용은 충분히 예측가능하고 통제가능한 일정이라는 점에서 사관 후보생들의 종교행사 참석이 부대의... ,국가인권위원회 대구인권사무소,https://blog.naver.com/humandg,20080826
"숨만 쉬어도 <b>종교활동</b>, 목사님들이 세금 못 내겠다는 이유.",https://www.leejeonghwan.com/3633,= 월급쟁이들은 투명하게 세금이 빠져나가는데 종교인들은 <b>종교활동</b>비를 늘리면 세금이 줄어듭니다.... 목사님의 목회 활동이 노동보다는 훨씬 고귀한 활동이라고 생각하는 걸 텐데요. 법적으로는 생계를... ,https://www.leejeonghwan.com/,https://www.leejeonghwan.com/,20190404
"서울시 교육청, 학교내 <b>종교활동</b> 금지",https://blog.naver.com/stubble?Redirect=Log&logNo=70005012759,재량활동 시간에 특정 종교 교육을 금지시키고 있다. 또 수행평가 과제로 특정 <b>종교 활동</b>을 제시하는 것도 금지했다. 교목전국연합회(회장 김용관 목사)가 5월 29일 한국기독교총연합회을 방문해 최희범... ,생명의 빛,https://blog.naver.com/stubble,20060610
방역 단계 완화별 대상과 내용! 모임 &amp; <b>종교</b>행사 등!,https://blog.naver.com/gkstkfkd2015?Redirect=Log&logNo=222389851551,"제외, <b>종교활동</b> 등도 활발히 참여 가능해집니다. 기존에 금지되었던 성가대, 종교 소모임 참여도... 실외 활동의 경우 한 번이라도 백신을 접종한 사람(1차 접종자와 예방접종 완료자)이면 마스크 착용 의무가... ",독일 레하우 공식인증파트너 공식 블로그,https://blog.naver.com/gkstkfkd2015,20210608
"취미,<b>종교</b>,정당<b>활동</b>에 시간을 더 할애할 생각",https://blog.naver.com/maria1970?Redirect=Log&logNo=70155229280,"세가지 활동은 취미활동, <b>종교활동</b>, 정당활동에 더 내 시간을 할애해볼까한다. 살사댄스를 좀더 열심히하고, 성당가는 거 빼먹지 않고, 진보정의당에 입당했으니 예전처럼 페이퍼당원으로만 살지는 않을... ","얼굴엔 미소, 마음엔 평화",https://blog.naver.com/maria1970,20130104
"<b>종교</b>갈등이혼, 서로를 존중할 수 없다면",https://blog.naver.com/tnflsdl1?Redirect=Log&logNo=222215908318,"지난 해 봄, 코로나 확산의 주된 원인으로 꼽힌 어느 종교의 경우 배우자가 신앙활동을 방해한다면 가출까지도 서슴지 않는 행태를 보였습니다. 이렇듯 <b>종교활동</b>에 몰두하여 가족을 방치하는 것은 '악의적 유기... ",So 通(소 통)하는 테헤란 가사전담센터,https://blog.naver.com/tnflsdl1,20210124
[2020 북한종교자유백서 발간]... 북한의 <b>종교 활동</b> ···,https://blog.naver.com/nkdbi2017?Redirect=Log&logNo=222135323328,"세계 종교 박해지수 1위 북한. 그럼에도 불구하고 북한의 <b>종교 활동</b>은 지속되고 있다. <b>종교 활동</b>이... 적극적으로 활동하고 있는 것으로 파악되었으며, 기독교를 접한 것으로 의심되는 주민들을 체포하기 위해... ",북한인권정보센터,https://blog.naver.com/nkdbi2017,20201104
1.5단계 <b>종교활동</b> 어찌될까요,https://blog.naver.com/sjjn0517?Redirect=Log&logNo=222144327780,코로라 확진자 수 증가로....1.5단계로 갈까말까 중입니다 <b>종교활동</b> 어찌되는 지 알아봐야겠죠.. 1단계에서는 좌석 한칸 띄우기였는데요 1.5단계에서는 좌석 수 30% 이내입니다.. 참석인원..필히 사전 예약이... ,sjjn0517님의블로그,https://blog.naver.com/sjjn0517,20201114
[ <b>종교 활동</b> / 사람과의 만남/ Healing time ],https://blog.naver.com/sumeen21?Redirect=Log&logNo=177171844,"[ <b>종교 활동</b> / 사람과의 만남/ Healing time ] 오늘은 주일입니다. 진선생님께서 세미나가 예정되어있어서... 하지만, 지금은 <b>종교활동</b>의 의미를 조금은 이해가 되고 있습니다. 조건이 있는 만남이 아니라... ",건강을 전하는 꿈꾸는 베니,https://blog.naver.com/sumeen21,20130127
<b>종교활동</b>에 참석하는 이유,https://blog.naver.com/prayinrain?Redirect=Log&logNo=30022486511,우리 부대 역시 기독교 천주교 불교 세개의 <b>종교 활동</b>을 하고 있는데. 야간 불교 종교행사를 가면 법당 옆 어느 방안에 들어가앉아 하고 싶은걸 마음대로 할 수 있다. 티비도 보고 잠도 자고 전우들과 떠들기도... ,버스가 오지 않는 정류장에서＊Rain From Heaven..,https://blog.naver.com/prayinrain,20070925
[청솔요양벼원/김해]2017년 9월20일 <b>종교활동</b>-수요예배,https://blog.naver.com/cjdthfquddnj?Redirect=Log&logNo=221101299956,"[<b>종교활동</b>-수요예배] 청솔복지교회 반갑습니다. 오늘은 수요일! 청솔복지교회 수요예배가 강당에서 모였습니다. 어르신들께서 목사님을 만나며 반가워 하셨습니다. 기도하며, 찬양하며, 말씀을 들으면서 마음에... ",청솔요양병원 님의블로그,https://blog.naver.com/cjdthfquddnj,20170920
백신 맞으면 7월부터 <b>종교활동</b> 인원제한서 배제(종합)!!,https://blog.naver.com/wjsekf10?Redirect=Log&logNo=222369808654,"백신 맞으면 7월부터 <b>종교활동</b> 인원제한서 배제(종합)!! 야외서 `노마스크` 가능... 6월엔 백신 1차... 경로당, 복지관 모임.활동에도 제약이 줄어든다. 김 총리는 &quot;국민의 70% 이상이 1차 접종을 마치는 9월 말... ",진실한 사랑,https://blog.naver.com/wjsekf10,20210527
"정부, 비대면 <b>종교활동</b> 지원사업 내년 2월까지 연장...... ",https://blog.naver.com/todaynewspaper?Redirect=Log&logNo=222189088471,"한편, 비대면 온라인 <b>종교활동</b>을 시작하고자 하는 종교단체는 한국통신사업자연합회 누리집을 통해 ‘온라인 <b>종교활동</b> 이용 안내서(매뉴얼)’를 확인할 수 있다. ▼▼▼ 자세한 기사 보기 ▼▼▼ http... ",'내일을 여는 오늘' 투데이신문,https://blog.naver.com/todaynewspaper,20201229
병영내 소수종파 신자 <b>종교활동</b> 신장될까,https://blog.naver.com/byoungil36?Redirect=Log&logNo=90000464713,"병영내 소수종파 신자 <b>종교활동</b> 신장될까 군봉사부, 국방위 의원과 간담회 갖고 개선방안 논의... 관련 종교 장병들의 신앙활동 개선을 위한 의견을 나누었다. 1시간여 동안 진행된 이날 간담회에서 김낙형... ",진리가 자유케하리라,https://blog.naver.com/byoungil36,20051226
중화인민공화국 경내 외국인<b>종교활동</b>관리규정 및 실시 세칙,https://blog.naver.com/galtensh?Redirect=Log&logNo=221180647454,"(4) 비준없이 법적으로 등록된 <b>종교활동</b>장소 이외의 장소에서 경전 강독, 강도하거나 종교집회 활동을 진행; (5) <b>종교활동</b>임시장소에서 중국공민이 참가하는 <b>종교활동</b>을 거행하는 것, 초청받은 중국교직원... ",Make story,https://blog.naver.com/galtensh,20180108
코로나19 방역보다 <b>종교활동</b>이 우선…보수로 기운 미국 대법원,https://blog.naver.com/yilove3410?Redirect=Log&logNo=222156145247,해석했다.’ 종교 단체 측 변호인은 &quot;대법원이 자유로운 <b>종교활동</b>을 보호하기 위해 신속하게 결정해 준 데 감사하다&quot;고 논평했다. 반면 소수의견을 낸 존 로버츠 대법원장은 &quot;치명적인 코로나19 감염병... ,국민문화신문,https://blog.naver.com/yilove3410,20201127
[<b>종교활동</b>]브롬브롬브로미.,https://blog.naver.com/kaze4004?Redirect=Log&logNo=150187131862,오늘은 일요일 침대에서 절대 나오지 않는 날이지만 특별히 <b>종교활동</b>을 위해 나옵니다. 짜잔. 브롬브롬. 매달매달. 환하게 웃는 애란님. 나 혼자 자출하겠다고 자전거 사서 초큼 그랬는데 다행. 샀으면 타야죠.... ,kaze.....그리고 그 이후...,https://blog.naver.com/kaze4004,20140318
춘천 남부노인복지관의 <b>종교활동</b> 강요 등 논란,https://blog.daum.net/swk3951/415,춘천 남부노인복지관의 <b>종교활동</b> 강요 등 논란 댓글 1 인간다운 삶 구현에 필요한/인권 및 권리 2016.... 조사 결과 <b>종교활동</b> 강요와 책 강매 및 독후감 쓰기 등이 사실로 드러나는 경우 위탁계약 해지까지... ,사회복지사 가치 성장,https://blog.daum.net/swk3951,20161201
<b>종교활동</b> / 관악구 노치원 나눔재활데이케어센터,https://blog.naver.com/hiver1114?Redirect=Log&logNo=221817255564,"<b>종교</b> 프로그램 참여는 의무는 아니며 어르신들의 희망에 따라 참여하실 수 있고, 참여하시지 않는 어르신들은 분리된 생활실에서 다른 <b>활동</b>을 하실 수 있습니다. 사실 불교 신자이신 어르신들도 계셔서 인근... ",관악구 주간보호센터 나눔재활데이케어센터,https://blog.naver.com/hiver1114,20200220
[연말연시] 슬기로운 <b>종교</b>생활을 위해 이것만은 지켜주세요!,https://blog.naver.com/haechiseoul?Redirect=Log&logNo=222178042040,"종교시설 집단감염 발생사례 *실제 사례를 바탕으로 정리해보았습니다. 첫 번째 : <b>종교 활동</b> 시 설교자, 성가대, 신도가 마스크를 착용하지 않은 경우 두 번째 : 성가대·합창 모임, 기도 모임, 성경공부 모임... ",서울특별시 공식블로그,https://blog.naver.com/haechiseoul,20201221
“예수님을 닮고 싶어요!!” -<b>종교활동</b>과 교리-,https://blog.naver.com/stellapopera?Redirect=Log&logNo=222101732748,“예수님을 닮고 싶어요!!” -<b>종교활동</b>과 교리- 언뜻 들으면 굉장히 믿음 좋은 기독교적인 멘트처럼... 우리는 너무나 오랫동안 거짓자아로 행하는 <b>종교활동</b>과 교리 때문에 우리 안에 창조된 새로운 본성을... ,"""Classic Crossover Vocalist""스텔라 헤세드 칼리 팍",https://blog.naver.com/stellapopera,20200928
춘천 대면 <b>종교 활동</b> 지속...‘집단감염’ 우려 확산,https://blog.naver.com/mstoday10?Redirect=Log&logNo=222067055892,방식의 <b>종교활동</b> 협조 공문을 보낸 것으로 확인됐다. 하지만 해당 공문은 강제사항이 아닌 당부 요청으로 해당 종교시설들이 얼마나 비대면 활동을 진행할지는 미지수다. 춘천시 관계자는 “이번주 주말이... ,ms투데이(엠에스투데이) 공식블로그,https://blog.naver.com/mstoday10,20200822
유럽에서의 <b>종교활동</b>(2004.12.16),https://blog.naver.com/dahnpark?Redirect=Log&logNo=80099836792,"-<b>종교활동</b>의 감소도 또한 매우 뚜렷하다. 터키는 95%가 이슬람 신봉자인데, 그 가운데 72%가 종교규율을 준수한다고 대답한다. 그러나 서유럽에서의 종교이탈은 매우 뚜렷하다. 68%의 신앙인 가운데 24%만이... ",단의 블로그,https://blog.naver.com/dahnpark,20100118
노년기에 <b>종교</b>를 가지는 것이 죽음 불안을 낮출 수 있을까?,https://blog.naver.com/63252114?Redirect=Log&logNo=222202984020,본 연구에서도 종교의 종류나 종교인과 비종교인 간 그리고 <b>종교 활동</b>이 삶의 질이나 죽음 불안에 있어서 유의미한 차이를 보이지 않고 있다. 따라서 향후 한국교회가 삶의 질이나 죽음 불안에 직접적으로... ,웰다잉문화연구소,https://blog.naver.com/63252114,20210110
구리시 노인주간보호센터 모두케어 - 인지 활동 및 <b>종교활동</b>,https://blog.naver.com/happydoumy?Redirect=Log&logNo=221717312062,앞으로도 어르신들과 좋은 얘기도 나누는 기도 시간을 꾸준히 갖을 계획이랍니다`^^ 인지활동 한켠에서는 <b>종교활동</b>을 하시는 동안 종교가 다르거나 종교가 없으신 어르신들은 인지활동을 하세요. 우리나라는... ,모두케어 주야간보호센터 (방문요양),https://blog.naver.com/happydoumy,20191124
6월<b>종교활동</b>/신앙생활,https://blog.naver.com/ejvusgks77?Redirect=Log&logNo=222403420448,"일정 <b>종교</b>생활/예배 감사한 하루~^^ 찬송가도 부르며 사랑하는 가족,본인을 위하여 오늘도 소중하고... 일상 #좋아요 #좋반 #L4L #repost #슬기로운<b>종교</b>생활#<b>종교</b>예배#감사해요전도사님#방역소독#방역수칙준수",더편한요양병원 공식블러그,https://blog.naver.com/ejvusgks77,20210619
"연재1:  포스트 코로나 시대에서의 <b>종교</b>, 제4차혁명, 힐링문화",https://blog.naver.com/satidhamma?Redirect=Log&logNo=222324442587,대면적 활동에 기반한 문화/<b>종교활동</b>이 매우 심각한 수준으로 위축되었다. 코로나 불안뿐만 아니라 인공지능이 중심이 되는 제4차 산업혁명 시대에서 발생할 인간소외와 경제적 스트레스 문제 등으로 종교집... ,명상상담,https://blog.naver.com/satidhamma,20210427
신앙서적 추천_팬인가 제자인가_Chapter.5 <b>종교 활동</b>을... ,https://blog.naver.com/psynjado?Redirect=Log&logNo=222237912490,"Chapter.5 <b>종교활동</b>을 잘한다고 될 일이 아니다 팬들은 열심히 따르고 있다. 문제는 그들이 따르는... 그들은 예수님이 아닌 종교적 규칙과 의식을 따르고 있다. not a fan. 팬인가, 제자인가?_카일아이들먼... ","하요미 귀요미 , 요미맘 ♡",https://blog.naver.com/psynjado,20210209
노년기 건강 <b>종교 활동</b>,https://blog.naver.com/k281025?Redirect=Log&logNo=221101064344,국내의 많은 연구들을 통해 &quot;<b>종교</b>&quot; 와 &quot;행복한 노년&quot; 간 관련성이 확인되고 있습니다. 저희가 백세인... 어르신들에게 <b>종교</b>는 몇 가지 심리적. 사회적 기능을 한다고 하는데요. 심리적 기능으로는 첫째. 임박한... ,건강 도시 강남구,https://blog.naver.com/k281025,20170920
모두케어 구리시 노인주간보호센터 -인지<b>활동</b> 및 <b>종교</b>생활,https://blog.naver.com/happydoumy?Redirect=Log&logNo=221691481106,개인별 맞춤 난이도 활동지로 인지 활동을 진행하십니다. 하다가 모르는것이 있을때는 저희 센터 선생님께 문의 하면서 열심히 하나씩 해결해 나가고 계십니다. <b>종교활동</b> 또 이렇게 종교가 같으신 어르신들과... ,모두케어 주야간보호센터 (방문요양),https://blog.naver.com/happydoumy,20191029
[자덕편]2014.03.17 <b>종교활동</b>,https://blog.naver.com/kaze4004?Redirect=Log&logNo=150187056057,바쁜 일상속에 잊고 살던 <b>종교활동</b>을 하였습니다. 3월달부터 자출을 실시하여 부끄럽던 내 머리를... 추후 &quot;오늘손이 한일을 왼손이 모르게 하여라&quot;에 충실하였던 <b>종교활동</b>을 차차 공개하도록 하겠습니다.... ,kaze.....그리고 그 이후...,https://blog.naver.com/kaze4004,20140317
국어 연구와 한글 보급 &amp; 교육 운동 &amp; <b>종교 활동</b>,https://blog.naver.com/sbcd1223?Redirect=Log&logNo=130116676769,"참여, 신사 참배 거부 3)천주교: 만주 무장 투쟁단체 '의민단'<b>활동</b> 4)천도교: 제2의 3 1운동 계획, 개벽 잡지 발행, 5)원불교: 박중빈이 창ㅅ시, 개간 사업, 저축, 생활개선운동 5)대<b>종교</b>: 중광단-&gt; 북로 군정서",나밖에 없는 듯한 블로그,https://blog.naver.com/sbcd1223,20110824
여행중 <b>종교 활동</b>,https://blog.naver.com/pbys2h?Redirect=Log&logNo=110113337855,여행사를 운영하다 보니 성당이나 교회에 다니시는 분들께서 여행 중에 <b>종교 활동</b>에 참여하시고자 하는 분들이 꽤 많더군요. 그래서 오늘은 푸켓에서 성당 미사나 교회 예배를 드리고자... ,아논과 푸켓,https://blog.naver.com/pbys2h,20110714
"북한의 심각한 <b>종교</b> 탄압, 문 대통령 방미, 인권 배우고 오기를",https://blog.naver.com/davidycho?Redirect=Log&logNo=222355669090,또 “(미 국무부의 국제종교자유보고서는) ‘2020한국 내에서도 정부가 코로나19를 이유로 <b>종교 활동</b>을 제한했다고 지적한다”고 했다. 이들은 “이런 상황들이 왜 벌어지고 있는가? 인권변호사 출신이라는... ,"창조신학연구소(옛kictnet.net/17.11.12/1,055,370)",https://blog.naver.com/davidycho,20210518
[사회지표] 종교 인식 조사 – <b>종교 활동</b> 및 종교의 영향력,https://blog.naver.com/hrc_opinion?Redirect=Log&logNo=222141158544,"By 이동한|2020년 11월 11일|카테고리: 사회지표|태그: #한국리서치, #정기조사, #여론속의여론, #기획조사, #사회지표, #종교인식, #종교영향력, #<b>종교활동</b>, #종교인구, #천주교, #불교, #개신교, #기독교... ",한국리서치 정기조사 여론속의 여론,https://blog.naver.com/hrc_opinion,20201112
강제로 끌려간 <b>종교 활동</b>.,https://blog.naver.com/myharvard1?Redirect=Log&logNo=222162454432,이때부턴 <b>종교활동</b>도 보장된다. 주말에 각자 믿는 종교 예배에 참석할 수 있기 때문에 종교가 없는 사람은 대기이다. 나는 잘 됐다 싶어서 4주동안 갈아 입지못한 옷 좀 빨아 입어야겠다고 벼르고 있었다. 그런데... ,산타마리아,https://blog.naver.com/myharvard1,20201204
