title,link,description,bloggername,bloggerlink,postdate
송파<b>피부관리</b> 홍조잡은후기 @THE한결피부,https://blog.naver.com/hoho9294?Redirect=Log&logNo=222415824056,만족했던 관리 랍니다! ⛱ 한 시간 조금 넘게 소요된 거 같아요! 넉넉하게 한시간 사십분 정도 생각하면 될 거 같고 꼭 예약 하시고 가세용 #방이동<b>피부관리</b> / THE한결피부 02-449-6466 평일 09:00 ~ 19:30 목요일만 12... ,여느때와 다름없이,https://blog.naver.com/hoho9294,20210630
김포 풍무동<b>피부관리</b> 아르떼루즈 맞춤서비스,https://blog.naver.com/ericashin?Redirect=Log&logNo=222404042617,및 관리로 피부고민에 맞게 케어해주시더라구요 <b>피부관리</b>맛집 Before &amp; After (근데 나 비포사진 왜 입벌리고 있음? 넘칙칙해서 깜놀하셨나봄) 상담이 끝나면 프라이빗한 공간에서 케어를 받기 시작합니다 요즘... ,뷰티 꿈디자이너's 꿈꾸는 저금통,https://blog.naver.com/ericashin,20210620
인천<b>피부관리</b>샵 ‘미엘에스테틱’/D's Bucket list,https://blog.naver.com/dadada832?Redirect=Log&logNo=222402207376,"인천<b>피부관리</b>샵 미엘에스테틱은 학익사거리 gs편의점 건물 3층에 위치해있어요! 피부 기본 관리는 1회에 35,000원이고 10회에 300,000원 이래요 가격 진짜 저렴하고 괜찮죠? 가게 내부 모습과 안에 마사지 하는... ",D's Bucket list,https://blog.naver.com/dadada832,20210618
"LED <b>피부 관리</b> 제품 특허, 차별화되었다면 더욱 전략적으로!",https://blog.naver.com/nanumcomm?Redirect=Log&logNo=222424210885,"피부 홈 케어 제품 중 LED <b>피부 관리</b> 제품도 다양하게 출시되고 있으며 관련 특허 출원도 많이... 흔히 알고 있는 LED <b>피부 관리</b> 기기도 두피, 얼굴 목 등 부위별 관리가 가능하게끔 세분화되었고 이런 LED... ",천아모/천안아산모든소식,https://blog.naver.com/nanumcomm,20210708
"천안 직산 <b>피부관리</b>, 프랑스 정통 에스테틱 마리꼬 화장품... ",https://blog.naver.com/nanumcomm?Redirect=Log&logNo=222425834490,"그 중에서도 뜨거운 자외선의 노출로 자극받고 열이 오르는 <b>피부관리</b> 어떻게 하고 계신가요? 집에서... 웨딩관리, 산후관리로 피부는 물론 바디관리를 함께 원하시는 분~! 미업하이푸 페이스&amp;바디 관리로... ",천아모/천안아산모든소식,https://blog.naver.com/nanumcomm,20210709
피부탄력 수분앰플로 여름철<b>피부관리</b> 하기!,https://blog.naver.com/anica891004?Redirect=Log&logNo=222409611584,때문에 피부탄력관리에 좋은 수분앰플이고 그만큼 여름철<b>피부관리</b>에 사용하기 좋은 제품 입니다 :D 이 수분앰플이 워낙에 피부탄력 관리 아이템으로 사용하기 좋다고 하길래 솔직히 얼마나 수분감이... ,욜로기록장,https://blog.naver.com/anica891004,20210625
부평<b>피부관리</b> 로비엘에스테틱 추천해요!,https://blog.naver.com/hausberlin?Redirect=Log&logNo=222404442923,#부평<b>피부관리</b> #로비엘에스테틱 #문제성피부전문 #윤곽관리 요즘 날씨가 오락가락 하면서 비도 오고 하면서 더워지는데 어떻게들 지내고 계세요? 벌써 6월도 중반이 넘어가고 2021년도 6개월이나 흘렀어요... ,아기상어뚜루의 행복한 공간,https://blog.naver.com/hausberlin,20210620
연예인 <b>피부관리</b> 코레지셀핏 + 수소토닝 찐후기!,https://blog.naver.com/boram1646?Redirect=Log&logNo=222390740321,이 날 저는 마크뷰 진단으로 얼굴 피부에 수분이 굉장히 부족한 상태라는 진단을 받았고 원장님께서는 저에게 추천하는 관리로 이 피부과에 있는 웬만한 <b>피부관리</b>를 한 번에 몽땅 받은 것과 비슷한 효과라는... ,bbo’s beauty & daily,https://blog.naver.com/boram1646,20210609
상동<b>피부관리</b> :: 로비엘... 두드러지는 상동에스테틱의 윤곽관리!,https://blog.naver.com/712gram?Redirect=Log&logNo=222410241382,"피부 어디가 고민인지, 어떤 부분을 개선했으면 하는지 요런 것들을 중점적으로 상담해주신 ㅎㅎ Previous image Next image 상동<b>피부관리</b> 로비엘 에스테틱의 관리 종류... 진짜 진짜 다양했다! 페이스 관리부터 해서... ",일상의 기록 ♪,https://blog.naver.com/712gram,20210625
일산여드름관리/웨돔<b>피부관리</b> 비비에스테틱에서 플라즈마 관리... ,https://blog.naver.com/min_hai?Redirect=Log&logNo=222434131562,"1:1 맞춤 관리 전문의 일산여드름관리로 유명한 웨돔<b>피부관리</b> 비비에스테틱은 기본 관리 프로그램부터 전문 필링 프로그램, 여드름/홍조 등 문제성 프로그램, 웨딩과 바디, 성형/피부과 시술 후 프로그램 등... ",미내미월드♥,https://blog.naver.com/min_hai,20210716
"해운대 <b>피부관리</b> 해운대 에스테틱, 세스티끄 센텀 본점 (VL... ",https://blog.naver.com/monthly_bag?Redirect=Log&logNo=222427781401,"센텀 에스테틱, 센텀 <b>피부관리</b>로 유명한 세스티끄 센텀 본점에 방문했다 이번 방문에서 받은 관리는 VL... VL-Change 관리 얼굴피부와 근육 뿐만 아니라 근육 속까지 근본관리한다는 문구에 신뢰도 팍팍 각자... ",autumn,https://blog.naver.com/monthly_bag,20210711
페이스팩토리 셀라이너 하루3분이면 <b>피부관리</b> OK!,https://blog.naver.com/jensksj?Redirect=Log&logNo=222402067175,칙칙해진 피부톤과 얼굴라인이 늘어지는 느낌... 40대가 되니 확실히 피부가 예전 같지 않더라구요.... 셀라이너 고주파 마사지기 3분 <b>피부관리</b>. _얼굴라인 관리. _부결 개선. _수분&amp;광채. 시중에 홈케어마사지... ,소소한 육아 살림 일상이야기,https://blog.naver.com/jensksj,20210618
대구 월성동 <b>피부관리</b> 추천,https://blog.naver.com/jinjangj?Redirect=Log&logNo=222408722751,매끄럽게 관리해드립니다 물론 내 피부를 정확히 알고 열심히 대구남자<b>피부관리</b> 받는분들도 많아졌지만 아무래도 남자들이 피부노화가 빨리오는 이유는 호르몬으로 인한 수분부족 유분과다 등이 제일 큰... ,대구 헤어그리라,https://blog.naver.com/jinjangj,20210624
여름철 <b>피부관리</b> 지성도 건성도 퍼펙트답안,https://blog.naver.com/ks_god11?Redirect=Log&logNo=222405397353,여름철 <b>피부관리</b>도 그냥 지나칠 수 없더라구요 특히 여~름 하면 찰랑거리는 바닷가 아니냐구요 ㅠㅠ 휴가도 있겠다 야외활동은 필수인데 원래 피불 유지하려면 적절한 관리는 필수라는 점! 하지만 이 말 했던... ,셀린's Beauty - log,https://blog.naver.com/ks_god11,20210622
여름철 <b>피부관리</b> 어렵지 않아요,https://blog.naver.com/kjhskincare?Redirect=Log&logNo=222407457629,피부를 피부답게 관리한다 <b>피부관리</b>는 잠시만 방심해도 금방 티가 나게 됩니다. 특히 여름철 피부는 환경적인 특성으로 노화가 쉽게 진행될수 있어요 꾸준한 관리와 올바른 <b>피부관리</b>법 실천이 오래오래... ,대구피부관리실,https://blog.naver.com/kjhskincare,20210623
[일산 <b>피부관리</b> 후기] 아그니아,https://blog.naver.com/party_tasty?Redirect=Log&logNo=222394961662,"#일산<b>피부관리</b> #일산작은얼굴관리 #아그니아 또또 아그니아 후기 !ㅋㅋㅋㅋ 4년째 다니고 있는 일산 <b>피부관리</b>, 작은얼굴관리 #내돈내산 오늘은 다른방으로 안내받았다 1인1실 (또는 커플관리 받을때는 2인1실)... ",맛있는 블로그,https://blog.naver.com/party_tasty,20210612
[마곡<b>피부관리</b>] 미더베스트 마곡아쿠아필과 크라이오테라피로... ,https://blog.naver.com/jja2896?Redirect=Log&logNo=222423927741,마곡<b>피부관리</b>하면 피부과만 알고있었는데 에스테틱도 있어서 좋더라구요 여긴 동반으로 왔을때 커플도 여기서 관리한다고 하더라구용! 전 일끝나고 혼자와서 1인 룸으로 ㅎㅎ 제가 하드렌즈를 착용하는데... ,쮸나로그,https://blog.naver.com/jja2896,20210711
안양<b>피부관리</b> 범계 새라본 경락잘해요,https://blog.naver.com/gmldi_di1615?Redirect=Log&logNo=222403315499,"무슨 관리 받았냐고, 얼굴이 엄청 작아지고 피부도 좋아졌다구요 범계<b>피부관리</b> 새라본 찾아가려면 범계역 바로 옆에 있기 때문에 찾기 쉬우실 거에요. 주차를 하려면 건물 주차장에 세우시면 된답니다.... ",하얀비요일,https://blog.naver.com/gmldi_di1615,20210619
동대문 <b>피부관리</b> 트로이필 페스티벌 앤올리브에스테틱,https://blog.naver.com/zoonam2?Redirect=Log&logNo=222413020836,피부 속에 넣고 산소와 영양을 피부속에 전달해서 피부재생을 유도하는 필링의 한 종류 인만큼 피부 건강에 도움이 되니까요. 여름철 <b>피부관리</b> 트로이필로 관리해 피부나이 먹는 거 조금 늦쳐보는 것은 어떨까요?!,엄마가 너희에게 준 최고의 선물~바로 형제이길....,https://blog.naver.com/zoonam2,20210628
이수<b>피부관리</b> / 윤실네츄럴스... 아름답게 민낯관리 해보세요 :),https://blog.naver.com/kje830830?Redirect=Log&logNo=222426149748,오늘은 민낯의 자신감을 찾아보려고 이수<b>피부관리</b> 윤실네츄럴스킨케어를 방문해보았어용!... 피부타입에 따라서 관리후 사용하게 주는 제품들이 다 다르더라구요~ 이렇게 관리후에도 마음씀씀히가 느껴져서... ,(-:,https://blog.naver.com/kje830830,20210709
신림역 <b>피부관리</b> 비타C13 광채뿜뿜!,https://blog.naver.com/ailee06?Redirect=Log&logNo=222398307811,일주일 가까이 피부가 확실히 다름을 느껴서 일주일에 한번 이상은 관리받으러 열심히 찾아야겠구나 마음먹게되네요! 운동도 열심히 하고 <b>피부관리</b>도 열심히 해야지!! 톤업크림 사용하고 남은거라고 집에... ,예쁘게! 스타일나게!! ˘◡˘,https://blog.naver.com/ailee06,20210614
일산<b>피부관리</b> 맞춤형 관리!,https://blog.naver.com/sofushgdma87?Redirect=Log&logNo=222403523764,피부 관련해서도 저처럼 예민한 피부를 가지고 계셔서 타 <b>피부관리</b>샵에 가서 관리를 받고 나면 얼굴이 뒤집어진 적이 있으신 분들에게 강력히 추천해 드려요. 제 얼굴 상태를 보자마자 예민하고 얇은 피부라는... ,꿈꿈꿈과 함께하는 리뷰스토리,https://blog.naver.com/sofushgdma87,20210620
수원<b>피부관리</b> 탱탱함 회복하기,https://blog.naver.com/one12701010?Redirect=Log&logNo=222273144042,"수원<b>피부관리</b> 받으려고 오시는 분들이 많이 선호되고 있는 프로그램 중 하나는 바로 얼굴축소 관리인데, 항상 마지막 단계로 <b>피부 관리</b>가 들어가는데 피부 타입에 딱 맞추어서 케어가 들어가는 것이라서 확실히... ",한결은결맘의 ものがたり。,https://blog.naver.com/one12701010,20210312
전주<b>피부관리</b> 나를 위한 투자!,https://blog.naver.com/kya7702?Redirect=Log&logNo=222416449998,"관리 받은 후 거울을 보면 마치 시술 받은 것처럼 볼륨감이 생긴답니다! 전주<b>피부관리</b> , DALIA SPA 전주점은 피부와 바디를 동시에 받을 수 있어서 정말 좋더라구요. 시간적 여유가 없어 동시에 받아야 하거나... ",달리아스파,https://blog.naver.com/kya7702,20210701
남천동 <b>피부관리</b> : 제이데이뷰티바 물방울리프팅,https://blog.naver.com/sunmin8877?Redirect=Log&logNo=222405824000,주차가능하다고해요 #남천동왁싱 #남천동<b>피부관리</b> #대연동왁싱 #대연동<b>피부관리</b> #광안리왁싱 #남천동스킨플래닝 #부산브로우바 #여름모공관리 #물방울리프팅 #부산에스테틱 #부산<b>피부관리</b> #건조피부... ,Off You,https://blog.naver.com/sunmin8877,20210622
마곡 <b>피부관리</b> 역시 에스테티아 마곡1호점!,https://blog.naver.com/yoojinhwang9?Redirect=Log&logNo=222406737436,(물론 것은 개인차가 있지요) 뿐만 아니라 앰플을 사용하여 <b>피부관리</b>를 진행해주셔서 피부에 쏙쏙 들어가며 피부결 개선이 되는 기분 춤추는 윤곽관리 이후 마무리는 몰딩 마스크로! 엄청 시원하고... ,레이첼에너지 RachelEnergy,https://blog.naver.com/yoojinhwang9,20210622
주안<b>피부관리</b> 정유진스킨케어 스킨플래닝 블랙헤드제거 최고:),https://blog.naver.com/kejej0409?Redirect=Log&logNo=222410886116,"주안<b>피부관리</b> 주안피부샵 정유진스킨케어 스킨플래닝 관리 후기 제가 곧 바디프로필 촬영 예정이라., 몸도 몸이지만 얼굴이 엉망이라 주안<b>피부관리</b> 정유진스킨케어에서 스킨플래닝 관리 받고 왔어요!... ",꽃 이 되 자 ♥,https://blog.naver.com/kejej0409,20210626
"수지 <b>피부관리</b> 더 게이트 스파, 힐링의 시간",https://blog.naver.com/qbic10161?Redirect=Log&logNo=222280722247,프라이빗한 공간에서 꼼꼼하고 편안하게 <b>피부관리</b> 부터 바디관리까지 가능한 프리미엄 스파 더게이트스파였어요 휴식이 필요할때 나의 피부과 바디의 관리가 필요할때 이곳을 다시 찾게 될 것 같아요,FACTORY _ by min,https://blog.naver.com/qbic10161,20210319
분당<b>피부관리</b> 스파더쉼에서 게리종 리프팅 관리,https://blog.naver.com/jihye0212?Redirect=Log&logNo=222404384993,모공이랑 탄력이 항상 문제인 피부.. 여름이라 더워서 모공이 더 열리는 거 같구.. 해서 분당<b>피부관리</b>... 분당<b>피부관리</b> 관리실 내부도 엄청 취저였다. 쉼에 포커스 되어 있는.. 노래도 약간 휴식 같은 비지엠이... ,제니는 세계일주중,https://blog.naver.com/jihye0212,20210620
LPG 슬림 관리 로 가벼운 다리로  | 대전 용산동 <b>피부관리</b>,https://blog.naver.com/chdl89?Redirect=Log&logNo=222425946538,"대전 용산동 <b>피부관리</b>, 더벨스파 관리실 내부 LPG 슬림 관리 관리실로 안내 받고, 우주복 같은 LPG 관리 복으로 환복한 뒤 벨을 눌러 호출하는 시스템. 안내해주시는 직원분도 너무도 친절하고, 질문도 이것저것... ",채영테이블 :: 필라테스 강사의 건강한 식탁,https://blog.naver.com/chdl89,20210709
비타민C앰플 비마이셀프 보습앰플 집에서 <b>피부관리</b>,https://blog.naver.com/tnstnqorqo?Redirect=Log&logNo=222426645982,"비타민C앰플 비마이셀프 보습앰플 집에서 <b>피부관리</b> 인체적용시험 완료 7일만 사용해도 피부 밝기가 좋아지고 잡티제거, 탄력효과까지 참가자 만족도가 높은 비타민C앰플이라고 한다. 미백앰플, 잡티앰플로도... ",이런 귀한 곳에 이런 누추한 분이,https://blog.naver.com/tnstnqorqo,20210710
청주 얼굴라인 잡아주는 <b>피부관리</b>,https://blog.naver.com/whdgkaks?Redirect=Log&logNo=222420725287,모든 관리가 가능한 <b>피부관리</b>실 #청주<b>피부관리</b> #청주<b>피부관리</b>실 #청주얼굴관리 이렇게 사각턱의 경우!... 청주<b>피부관리</b> 이렇게 트러블이 있던자리에는 반짝반짝 윤이나는 물광효과까지!! 탱글탱글 예쁜 피부... ,CRAZY FOR LINE,https://blog.naver.com/whdgkaks,20210705
"신논현<b>피부관리</b>, 역시 만족한 후기❤️",https://blog.naver.com/hyeyooncheon?Redirect=Log&logNo=222401305585,"신논현<b>피부관리</b> 만족 후기 신논현<b>피부관리</b> 가인미가 강남신논현점 위치! 주차도 바로 건물 밑에 무료로... 17가지 피부타입별 맞춤관리로 진행하고 직접 개발한 화장품으로 작은 얼굴과 비대칭, 피부톤, 탄력... ",♥헤일리스 플라워♥,https://blog.naver.com/hyeyooncheon,20210617
신논현<b>피부관리</b> &quot; 스파도향 &quot; 윤곽관리 받고왔어용,https://blog.naver.com/monopoly15?Redirect=Log&logNo=222402759898,"4층에는 개별 샤워실과 파우더룸까지 있어서 관리후에 마무리까지 할 수 있다 ㅎㅎ 보통 네일은 네일샵에서, <b>피부관리</b>는 피부과에서, 마사지는 스파나 에스테틱 가서 받는 등 이곳 저곳 따로따로 방문해야해서... ",dorable,https://blog.naver.com/monopoly15,20210619
중요한 산후 <b>피부관리</b> 방법,https://blog.naver.com/nanami_0406?Redirect=Log&logNo=222418534445,호르몬이나 면역체계 변화로 인해 찾아오는 일시적인 현상이기 때문에 너무 걱정하지 말고 제가 위에서 언급한 <b>피부 관리</b> 방법 꼭 실천해 임신 전 피부로 되돌리시길 바랍니다. 출산 후 관리를 제대로 하지... ,살기좋은 세상 만들기,https://blog.naver.com/nanami_0406,20210703
&lt;세스티끄 교대본점&gt; 강남 <b>피부관리</b> VL-CHANGE-윤곽관리,https://blog.naver.com/hanstella226?Redirect=Log&logNo=222410087518,요새 얼굴관리에 맛들려서 이번에는 서초 <b>피부관리</b> 맛집 세스티끄 교대본점을 방문했습니다 교대역 8번 출구로 나가면 금방 찾을 수 있어요 서울 서초구 서초중앙로 125 2층 평일 10:00-22:00 주말 및 공휴일 09:00... ,한가온별,https://blog.naver.com/hanstella226,20210625
일산<b>피부관리</b> 시작한 후 달라졌어요,https://blog.naver.com/kya7702?Redirect=Log&logNo=222416161072,"바디와 피부를 가꾸고, 제 심신을 안정시키면서 내면까지 아름다워지는 기분이에요! 앞으로 남은 관리를 받은 후 어떻게 변화되어 있을지 제 자신이 너무도 기대가 된답니다! 일산<b>피부관리</b> , DALIA SPA... ",달리아스파,https://blog.naver.com/kya7702,20210701
"판교경락, 힐링<b>피부관리</b>에서 몸을 시원하게 관리해주는 힐링경락",https://blog.naver.com/rlathfus1995?Redirect=Log&logNo=222418526171,오늘은 경락 마사지 소개로 판교경락 효과로 추천드리는 힐링<b>피부관리</b> 다녀왔습니다 수기로 잡아주는 기가막힌 경락 후기 시작 :D 제가 받을관리는 복부집중관리 입니다 원래 제가 폭식등으로 인해 살이 엄청... ,류치루,https://blog.naver.com/rlathfus1995,20210703
"대구스페셜 <b>피부관리</b>, 콜라겐 벨벳 관리",https://blog.naver.com/kjhskincare?Redirect=Log&logNo=222401432111,"건강 <b>피부관리</b>실의 vip 관리프로그램 100% 콜라겐 벨벳 관리는 피부 보약 관리라 할 수 있습니다. 콜라겐 벨벳 관리 추천 피부 지긋지긋한 건조함으로 고생이 신분 주목! 좋다는 비싼 앰풀, 크림 등 많은 제품을... ",대구피부관리실,https://blog.naver.com/kjhskincare,20210617
"[탄방동<b>피부관리</b>] 예쁜 인테리어에 한번, 관리에 두번놀래는... ",https://blog.naver.com/happykimju?Redirect=Log&logNo=222416530519,"탄방동 <b>피부관리</b> 예쁜 인테리어에 한번, 관리에 두번놀래는 곳! 세스티끄 오빠가 저 세스티끄... 제가 얼굴 옆이 꺼져있고 광대도 좀 내려가있는데 리프팅이 완전 제대로 되서 감동 또감동 ㅠ,.ㅠ 피부 윤나는거... ",7월의 크리스마스,https://blog.naver.com/happykimju,20210701
영통<b>피부관리</b> 고급 관리로 예뻐져요!,https://blog.naver.com/k17481708?Redirect=Log&logNo=222401325388,흑흑 어쩐지 집에서 뭘 해봐도 피부 자극이 심했었는데 이게 다 이런 이유가 있었던 거였군요! 그래서 저는 상담을 통해 이곳에 있는 여러 영통<b>피부관리</b>프로그램 중에서 인트라슈티컬스관리를 받아 보기로... ,민브라더스의 하루하루♡,https://blog.naver.com/k17481708,20210617
[대치동<b>피부관리</b> / 강남 <b>피부관리</b>] 에스테티아 대치1호점,https://blog.naver.com/89121m?Redirect=Log&logNo=222412303823,(대치동<b>피부관리</b>샵은 다르구나.. ) 관리받는 곳 안쪽으로 들어오면 어마어마한 양의 석고팩들이 진열되어 있고 이름이 적힌 락커안을 열면 가운이 빼꼼 가운으로 환복 하고 배드에 누우면 관리 시작 ! 정말... ,인생은 아람다워,https://blog.naver.com/89121m,20210627
지성<b>피부 관리</b> 이건 주의해,https://blog.naver.com/tet1968nam?Redirect=Log&logNo=222393871965,피부가 하얘지는건 누구나 꿈꾸는 일이죠 근데 지인은 그것까진 바라지도 않고 광광대고 번들대는거나 멈췄으면 좋겠다며 여름철 지성<b>피부 관리</b> 힘들어 죽겠다고 한숨을 푹푹 쉬는겁니다 그럴만도 한 게... ,반즈의 하비라이프,https://blog.naver.com/tet1968nam,20210611
압구정<b>피부관리</b> : 기미&amp;블랙헤드 정돈받고 톤업했어요,https://blog.naver.com/sowon_3?Redirect=Log&logNo=222403296364,"압구정<b>피부관리</b> : 미백관리 @도나에스테틱 요즘 부쩍 늘어난 기미잡티 ㅠㅠ 마스크가 흰색이라 빛을... 내 피부..왜들 그리 다운돼있어.. 뭐가 문제야.. say something.. 이대로는 안 돼, 피부톤업시키러... ",인생 _퀘스트_ ing,https://blog.naver.com/sowon_3,20210619
강서구에스테틱/강서구<b>피부관리</b> 가양 에스테티아 후기,https://blog.naver.com/ljh5344?Redirect=Log&logNo=222423890704,가양역 바로 앞에 있는 가양 에스테티아 다녀와봤어요 :) 강서구<b>피부관리</b> 샵 찾으시는 분들은 역이랑... 이날 피부상태가 안좋았었는데 관리 받고 나니까 많이 진정됐더라구요 파우더룸에서 거울 보고 나왔어요... ,Chez JINA,https://blog.naver.com/ljh5344,20210707
남포동 <b>피부관리</b> 상체관리 남다른 라프로메사,https://blog.naver.com/kikihui?Redirect=Log&logNo=222400586209,"손맛 좋고 인심까지 좋은 남포동 <b>피부관리</b> 상체관리 받고 나니 몸도 가볍고 피부도 맑아 지는 느낌이네요 #라프로메사 부산시 중구 흑교로 35-1 (부평동 3가, 볼로니아 빌딩 2층) ***-****-****",떵이의 하루,https://blog.naver.com/kikihui,20210616
강남구청 <b>피부관리</b>는 서윤피부맑음 강남구청점에서 뱀부테라피... ,https://blog.naver.com/jisu_0210?Redirect=Log&logNo=222417763591,강남구청 <b>피부관리</b>는 서윤피부맑음 강남구청점에서 뱀부테라피 받고왔어요 서윤피부맑음 서울 강남구... 프라이빗하게 <b>피부관리</b> 받았어요 클렌징을 먼저 해주시고 뱀부테라피 들어가기전에 수기로 관리를... ,나에게 확실한 행복,https://blog.naver.com/jisu_0210,20210702
<b>피부관리</b> 정자동<b>피부관리</b> 받고 만족!,https://blog.naver.com/ssowood?Redirect=Log&logNo=222320630732,제 피부고민이나 상태에 대해 꼼꼼하게 체크까지 하며 상담을 받고나니까 편하게 받을 수 있었어요 상담을 마치고 관리룸으로 안내를 해주셨는데요 와 정말 너무 좋아요 정자동<b>피부관리</b>를 받으러 왔는데 여긴... ,쏘우드( ssowood ),https://blog.naver.com/ssowood,20210423
[안양] <b>피부관리</b> 가꾸는동안 뷰티나,https://blog.naver.com/blackredsky?Redirect=Log&logNo=222394452596,"안양가꾸는동안뷰티나 대기실 가꾸는동안 네가 제일 예뻐 가꾸는동안 뷰티나 <b>피부관리</b>는 #문제성피부전문 관리실 이에요. 특히 v라인페이스, 바디 슬리밍, 림프 순환케어를 주력으로 하고 계셨답니다.... ",꼬니아트 창작의 즐거움,https://blog.naver.com/blackredsky,20210611
일산<b>피부관리</b> 오르스파에서 힐링했던 날,https://blog.naver.com/yangjinss?Redirect=Log&logNo=222404786028,제가 받았던 아르케스킨메이트 프로그램은 매 번 똑같이 진행되는 프로그램들과 달리 바뀌는 피부 컨디션에 맞추어 일대일 처방으로 이루어지는 관리에요. #일산<b>피부관리</b> 갈 때마다 매 번 새로운 관리를 받는... ,yangjinss daily,https://blog.naver.com/yangjinss,20210621
대전 <b>피부관리</b>실 둔산동스파 몽끌로아스파,https://blog.naver.com/yookjihye?Redirect=Log&logNo=222398726958,상담실에 들어가 고객 설문지 작성 후 제가 필요한 관리에 대해 알아보았어요. <b>피부관리</b> + 스파를... 대전 <b>피부관리</b> 몽끌로아스파 다음날 화장은 진짜 말할 필요도 없어요. 꿀피부 부들부들해서 화장할 맛 나요.... ,꼬마새댁,https://blog.naver.com/yookjihye,20210615
시작하세요 / 군산 신부관리 / 군산 여드름관리 <b>피부관리</b>실 추천,https://blog.naver.com/blossom2721?Redirect=Log&logNo=222422139862,피부과에서 관리를 받아보셔야 해요. 그래야 좀 더 빨리 피부가 정상적으로 돌아올 수 있답니다. 하지만 첨부터 강한 레이저는 시작하지 마시고 <b>피부관리</b>부터 서서히 시작해보세요. 레이저는 정말 최후의... ,롱이로그,https://blog.naver.com/blossom2721,20210706
건선치료제 의존 끝내버린 <b>피부관리</b>비결!,https://blog.naver.com/1wise1?Redirect=Log&logNo=222355158976,"특별 <b>피부 관리</b>법을 알려드리려고 해요:D 특히, 저처럼 건선치료제를 달고 산 분들이라면 정말 피가... 그러면서, 언니처럼 건선이 심한 피부는 피부장벽부터 튼튼하게 해줘야 한다면서 피부장벽 관리식품류들을... ",반짝반짝 오늘,https://blog.naver.com/1wise1,20210518
