title,link,description,bloggername,bloggerlink,postdate
반다이 용자열전 <b>콜렉션</b> 1탄,https://blog.naver.com/ithwlsi55?Redirect=Log&logNo=222423496224,(...를 참 일찍도 하지요??;;;;;;;;;;;;;;ㅋㅋㅋㅋㅋㅋㅋㅋㅋㅋㅋ) 반다이에서 나온 &quot;용자열전 <b>콜렉션</b>&quot; 1탄... 다간X 요 용자열전 <b>콜렉션</b> 시리즈 중에서 제일 좋아하는 로봇을 하나만 고르라면 아마 나는 다간 고를 것... ,♥사과나무♥,https://blog.naver.com/ithwlsi55,20210707
닌텐도 스위치 그란디아 HD <b>콜렉션</b> 오픈 및 간단 소감,https://blog.naver.com/ps3player?Redirect=Log&logNo=222368299874,"닌텐도 스위치 그란디아 HD <b>콜렉션</b> 오픈 및 간단 소감 앞표지 닌텐도 스위치로 출시된 그란디아 HD <b>콜렉션</b>입니다. 1,2탄 합본으로 리미티드 런 게임즈를 통해 패키지화 되었고 일본이나 한국에서는 패키지... ",스파이크의 무한 잡설 공간,https://blog.naver.com/ps3player,20210526
닌텐도 스위치 그란디아 HD <b>콜렉션</b> : 이게 패키지로 나오긴... ,https://blog.naver.com/ps5player?Redirect=Log&logNo=222421445814,닌텐도 스위치 그란디아 HD <b>콜렉션</b> : 이게 패키지로 나오긴 나오네 앞표지입니다. 닌텐도 스위치로 출시된 그란디아 HD <b>콜렉션</b>입니다. 리미티드 런 게임즈를 통해서만 패키지화가 되었죠. 그보다 한참 앞서 DL... ,봉짱의 쉼터,https://blog.naver.com/ps5player,20210705
"포켓몬 크레인 인형뽑기 장난감, 인형뽑기기계 몬스터<b>콜렉션</b>... ",https://blog.naver.com/monami02?Redirect=Log&logNo=222407315839,"가지고 있는 몬스터<b>콜렉션</b>EX, 몬스터<b>콜렉션</b>GET 시리즈를 포켓몬 크레인에 넣어서 같이 가지고 놀면 돼요. 많은 수의 포켓몬 몬스터<b>콜렉션</b>을 넣을수록 더 재미있지만, 피규어를 너무 많이 넣어도 크레인이... ","그냥, 그대로 레레한 Life",https://blog.naver.com/monami02,20210623
[성수 핫플레이스 샤넬 팩토리5 <b>콜렉션</b>] 샤넬매니아라면 꼭... ,https://blog.naver.com/blk_lg_ryan?Redirect=Log&logNo=222415708123,샤넬 팩토리5 <b>콜렉션</b>이라는 이름으로 6월30일부터 7월18일까지 운영해요. 오픈 첫날에 예약해서 다녀왔어요. 성수동 S 팩토리에서 만날 수 있는 샤넬 팩토리 5 <b>콜렉션</b>은 정오부터 8시30분까지 운영해요. 성수동... ,푸드섹서 라이언의 정보창고,https://blog.naver.com/blk_lg_ryan,20210701
[인테리어 자료] 이탈리아의 여름을 담은 세라믹 타일 <b>콜렉션</b>,https://blog.naver.com/artlife?Redirect=Log&logNo=222342017524,타일 <b>콜렉션</b> Italian Summer를 선보였다. 이탈리아 여름을 장식하는 대자연에서 영감을 받은 도자기-석기 타일 <b>콜렉션</b>으로 어떤 타일에서는 나폴리 연안을 여행하는 기분을 또 어떤 타일에서는 이태리 남부... ,하늘소 블로그,https://blog.naver.com/artlife,20210507
캐트리스 더 <b>콜렉션</b> 아이섀도 팔레트 코랄누드 신규컬러... ,https://blog.naver.com/jaesunlee94?Redirect=Log&logNo=222324364785,캐트리스 더 <b>콜렉션</b> 아이섀도 팔레트는 쉬머한 펄과 매트 색상의 조합으로 이루어졌어요. 제가... 갓성비를 자랑하는 만큼 입문용 아이템으로 추천하고 싶은 캐트리스 더 <b>콜렉션</b> 섀도우 팔레트 코랄누드 리뷰는... ,솔리테르의 기록소,https://blog.naver.com/jaesunlee94,20210427
고보습탄력앰플 더마펌 바이오<b>콜렉션</b>앰플콜라겐R4,https://blog.naver.com/hanstar_94?Redirect=Log&logNo=222371872409,더마펌 바이오 <b>콜렉션</b> 앰플 콜라겐 R4 잃어버린 탄력을 위한 앰플입니당! 탄력 앰플 찾으셨던 분들은 오늘 포스팅 주목하셔야할듯!! 탄탄한 보습과 피부의 탄력을 줄 저분자의 콜라겐 앰플이기 때문에 피부... ,별밤의 뷰티&패션,https://blog.naver.com/hanstar_94,20210528
"몰튼브라운 샤워젤 트래블 <b>콜렉션</b>, 특급호텔 어메니티",https://blog.naver.com/jwani84?Redirect=Log&logNo=222423015491,이번에 이사 하면서 잊고 있던 트래블링 <b>콜렉션</b> 아이들을 다시 찾게 되었어요. 색상도 너무 이쁨 트래블링 <b>콜렉션</b>에는 5가지 향의 샤워젤이 들어있습니다. Costral Cypress &amp; Sea fennel 100ml 향의 키워드는... ,MORE의 일단해보기,https://blog.naver.com/jwani84,20210707
"09년도 <b>콜렉션</b> 사진들, 스케치, 네이버 오늘일기 6일차",https://blog.naver.com/kyty77?Redirect=Log&logNo=222374061429,"네이버 오늘 일기 6일차, 09년도 <b>콜렉션</b> 사진들 6일차.. 드디어 오늘.. 새벽 5시부터 기상하여 너무 빡쎈... <b>콜렉션</b> 초창기의 레고, 큐브릭 수집품들이라 참.. 감회가 새롭더군요.. 성인이 되서 가장 처음 만진 레고... ",Paper film의 잡블로그,https://blog.naver.com/kyty77,20210529
웨딩피부관리 아리더마 아리젠 72h 프리미엄필<b>콜렉션</b>,https://blog.naver.com/hyoyeons?Redirect=Log&logNo=222283249389,프리미엄필<b>콜렉션</b>을 사용해보게 되었어요. 제 첫번째 웨딩피부관리 홈케어템 :) 진짜 아리더마 프리미엄필<b>콜렉션</b> 한 눈에 봐도 체계적이고 전문적이어 보이지 않나요? 아리더마라는 브랜드는 에스테틱 전용... ,"Beauty & life, 효니스타일♥",https://blog.naver.com/hyoyeons,20210322
가샤퐁! <b>콜렉션</b> 가면라이더 04,https://blog.naver.com/dfffffgrgt?Redirect=Log&logNo=222423872175,<b>콜렉션</b> 가면라이더 03입니다. *첫 발매 : 2021년 6월 가챠 랜덤 판매(일본 기준) *가격 : 각 300엔(세금 포함)... <b>콜렉션</b> 가면라이더 01(제로원)도 어느 덧 1년 차에 접어 들면서 4번째 시리즈까지 무사히... ,K's의 블로그 Type.Force,https://blog.naver.com/dfffffgrgt,20210709
반다이 용자열전 <b>콜렉션</b> 2탄,https://blog.naver.com/ithwlsi55?Redirect=Log&logNo=222430292380,"늦으막히 또 이어지는 얼음달님 선물리뷰^^a(계속 늦어져서 머쓱타드...ㅋ) 이번엔 용자열전 <b>콜렉션</b> 2탄!!!! 크으~~ 1,2탄을 다 모아서 이렇게 다 챙겨보내주신 얼음달님 센스ㅜㅠbb 진짜 또 한 번 감사인사... ",♥사과나무♥,https://blog.naver.com/ithwlsi55,20210713
[NS] 닌자가이덴 마스터 <b>콜렉션</b>,https://blog.naver.com/lige3?Redirect=Log&logNo=222424866605,마스터 <b>콜렉션</b>을 다운받으니 게임 3개가 추가되네요. 제일 먼저 닌자가이덴3 레이저스 엣지를 해봤는데... 게임 자체는 재밌어서 너무 안타깝습니다. 개인적인 점수는 6/10입니다. #닌자가이덴 #마스터<b>콜렉션</b>,김뀨뀨잉의 취미공간,https://blog.naver.com/lige3,20210708
영어그림책 스콜라스틱픽처북<b>콜렉션</b> 다들 사셨나요?,https://blog.naver.com/rabu_rabu?Redirect=Log&logNo=222254222095,<b>콜렉션</b> 판매하고 있다는거 아시나요? 선물용으로도 좋고 소장용으로도 좋은 영어원서!!! http://item.gmarket.co.kr/Item?goodscode=2034785114 지금 지마켓에서 판매되고 있는 스콜라스틱픽처북은 총 3가지의 <b>콜렉션</b>으로... ,나옴의 세상,https://blog.naver.com/rabu_rabu,20210223
조말론 런던 코롱 <b>콜렉션</b> (유자 코롱 / 워터릴리 / 오스만투스... ,https://blog.naver.com/orquidia?Redirect=Log&logNo=222420253902,조말론 런던 코롱 <b>콜렉션</b> 유자 코롱 / 워터릴리 / 오스만투스 / 넥타린 허니 / 오렌지 블라썸 친구가... #조말론블로썸컬렉션 #조말론향수 #조말론코롱 #조말론런던트래블코롱<b>콜렉션</b> 하나씩 향을 맡아... ,Given In Love For Protection,https://blog.naver.com/orquidia,20210704
론진 마스터<b>콜렉션</b> 문페이즈 신형 : 클래식 드레스워치!!,https://blog.naver.com/twostarwoo?Redirect=Log&logNo=222230006849,구입한 적도 없으면서 몇 번이나 포스팅을 했을 정도로 너무나 갖고 싶었던 론진 마스터<b>콜렉션</b>... 론진 마스터<b>콜렉션</b> 문페이즈 L2.909.4.78.6 무브먼트:오토매틱 L899 (ETA2892 수정 무브먼트) 방수: 30m / 3ATM 케이스... ,"WATCH, SHOES, DRAMA,",https://blog.naver.com/twostarwoo,20210203
우쿨렐레책 지브리 스튜디오 <b>콜렉션</b>♥ 게드전기 테루의 노래 연주,https://blog.naver.com/seaminlover?Redirect=Log&logNo=222397103476,물이라도 많이 마셔야 겠어요 ㅎㅎㅎㅎㅎㅎㅎㅎ 벌컥 벌컥 ♥ 오늘은 우쿨렐레 지브리<b>콜렉션</b>에 있는... 지브리 <b>콜렉션</b>에 나오는 곡이랍니다 스튜디오 지브리 컬렉션 우쿨렐레 연주하는 분들은 대부분 알고... ,러블리우쿨샘's story,https://blog.naver.com/seaminlover,20210614
[영어 그림책 추천] 스콜라스틱 픽처북 <b>콜렉션</b> - 너무 행복한 책... ,https://blog.naver.com/pholive21?Redirect=Log&logNo=222186802404,[영어 그림책 추천] 스콜라스틱 픽처북 <b>콜렉션</b> - 너무 행복한 책 선물이예요 연말이 되면 아이들에게... 픽처북 <b>콜렉션</b> 바로 아이들도 어른들도 기분좋게 만들어주는 스콜라스틱 픽처북 <b>콜렉션</b>! 선물함처럼... ,달콤채앤완맘,https://blog.naver.com/pholive21,20201227
칼날 월드콜렉터블 피규어 '카마도 네즈코' <b>콜렉션</b> vol.01 5종,https://blog.naver.com/drcpa?Redirect=Log&logNo=222400379249,귀멸의 칼날에서 귀요미를 담당하는 '카마도 네즈코(竈門禰豆子)' 그 귀요미로 몰빵한 월드콜렉터블 시리즈 &lt;출처: 구글&gt; 월드콜렉터블 피규어 '카마도 네즈코' <b>콜렉션</b> 이 되겠습니다. 다양한 포즈의 네즈코를... ,AMA:Z:ONE,https://blog.naver.com/drcpa,20210616
일본 곤충매니아의 외국곤충 사육 <b>콜렉션</b>,https://blog.naver.com/insect_21?Redirect=Log&logNo=222094148821,오늘은 제가 소통하고 지내는 일본 매니아 빅비틀씨의 외국곤충 사육<b>콜렉션</b> 소식 입니다. 외국곤충... 각설하고 그럼 빅비틀씨의 사육<b>콜렉션</b> 감상하시지요 : ) 역시 꾸준한 사랑을 받는 헤라클레스 장수풍뎅이... ,쥬라기스쿨,https://blog.naver.com/insect_21,20200919
종로맞춤정장 H<b>콜렉션</b> 핏좋은 예복,https://blog.naver.com/sj2g?Redirect=Log&logNo=222433761997,H<b>콜렉션</b>! 현업에서 25년의 경험으로 베테랑급 의상 장인이 남여 양복과 특수 패턴의 옷을 제작. (무대복 연미복 턱시도 승마복 캐쥬얼 특수복 등.) #종로맞춤정장 #종로맞춤예복 #H<b>콜렉션</b> #종로 #맞춤정장 #정장... ,EJ 이제이제화,https://blog.naver.com/sj2g,20210716
뱅드림! 커버<b>콜렉션</b> Vol.5 통상판,https://blog.naver.com/wraith12?Redirect=Log&logNo=222262340277,"커버<b>콜렉션</b> Vol.5'의 통상판이 오늘 드디어 도착했습니다. 배송과정에서 문제가 있었는지 박스가... 혹시 좀만 더 인심써서 보컬로이드 커버<b>콜렉션</b>처럼 cd 1, 2로 내주면 안되나... 비닐을 벗기고... ",앱글빠 블로그,https://blog.naver.com/wraith12,20210302
라프레리 퓨어골드 <b>콜렉션</b> ! 비대면 뷰티클래스로 만나본... ,https://blog.naver.com/ym9240?Redirect=Log&logNo=222437435276,퓨어골드 <b>콜렉션</b>을 만나볼 수 있는 기회를 가졌어요 :) 직접 라프레리 교육팀 부장님께 제품에 대한... 피부의 골든아워를 찾아주는 라프레리의 퓨어골드 <b>콜렉션</b>! 어떤 매력이 있는지 궁금하시다면 쭈욱... ,새벽 네시의 손톱달,https://blog.naver.com/ym9240,20210719
"인디아나 존스 4-Film <b>콜렉션</b>, 정발 UBD 오픈 케이스",http://knousang.egloos.com/3603806,6월 9일에 국내 정식 발매된 [ 인디아나 존스 4-Film <b>콜렉션</b> ]의 4K UltraHD Blu-ray 일반판 (초도 한정 슬립 케이스 동봉)의 간단한 오픈 케이스를 올려 봅니다. 일반판 초도 한정으로 주어지는 슬립형 아웃... ,無錢生苦 有錢生樂,http://knousang.egloos.com/,20210609
"[jomashop]  론진 마스터 <b>콜렉션</b> 문페이즈 신형 $1,649... ",https://blog.naver.com/azpace?Redirect=Log&logNo=222312924713,론진 마스터 <b>콜렉션</b> 문페이즈 신형 청판 조마샵 해외직구 실구매가 225만원 LONGINES Master... 같은 마스터<b>콜렉션</b> 이지만 화이트 다이얼과 비교하면 다이얼이 선레이 블루 다이얼에 인덱스도... ,Watchcloser,https://blog.naver.com/azpace,20210417
[Tomytec]건물 <b>콜렉션</b> 040-4.분양주택 A4,https://blog.naver.com/fmspf14?Redirect=Log&logNo=222286283843,"2021년 2월 토미텍에서 발매된 N스케일 지오코레 건물 <b>콜렉션</b> 040-4 분양 주택 A4입니다. 4번째 재탕이라는 소리죠. 발매가는 1,700엔. 아담한 주택 두채가 세트인 제품입니다.박스는 작례로 심플. 내용물은 주택 2개... ",The Sharp Blog,https://blog.naver.com/fmspf14,20210324
&lt;NS&gt; 캐슬배니아 애니버서리 <b>콜렉션</b>,https://blog.naver.com/modory?Redirect=Log&logNo=222317196618,"※ 게임명 : 캐슬배니아 애니버서리 <b>콜렉션</b> ※ 장르 : 액션 ※ 게임종류 : 디지탈 다운로드 ※ 특징... 솔직히 이 게임 하나때문에 애니버서리 <b>콜렉션</b> 질렀다. ▲ 스핀오프 작품이지만, 패미컴 시절에 정말 재밌게... ",M O D O R Y IV,https://blog.naver.com/modory,20210604
보석<b>콜렉션</b> 자랑,https://blog.naver.com/bluevitriol?Redirect=Log&logNo=222392151056,모든 <b>콜렉션</b>을 다 올리는 건 아니고 이런 돌도 있어요? 위주로 올려봄! 페리도트나 아콰마린 같은 건 사진 뺌! 1. 몰다바이트 moldavite 체코 지역에 충돌한 운석의 열로 인해 생성된 천연 유리!... ,blue vitriol,https://blog.naver.com/bluevitriol,20210610
진안 마이산 [오페라하우스] 마이 <b>콜렉션</b>(13a) 완등기,https://blog.naver.com/difranco425?Redirect=Log&logNo=222419017977,마이 <b>콜렉션</b>(13a) 마이 <b>콜렉션</b> 코스는 인(12c) 코스로 출발해서 왼편 오페라 탱고(12d)의 크럭스 부분을 트래버스해서 꿈과 희망(14b)의 완등 앵커로 이어지는 코스이다 강력한 크럭스보다는 지구력 안배가... ,달에취한나비,https://blog.naver.com/difranco425,20210703
조말론 마멀레이드 <b>콜렉션</b>,https://blog.naver.com/espoir3772?Redirect=Log&logNo=222396842123,블루 깅엄체크를 무척이나 좋아하는 저는 이번 <b>콜렉션</b>이 칼라감만으로도 너무 맘에 들더라구요. 정말... 새콤달콤이 느껴지며 머스크가 살짝 안정되게 잡아줍니다. *로즈브러쉬. #조말론 # 마멀레이드 <b>콜렉션</b>,espoir3772님의 블로그,https://blog.naver.com/espoir3772,20210613
예쁜 접시 추천 - 레녹스 홀리데이 <b>콜렉션</b> ❤,https://blog.naver.com/zzan323?Redirect=Log&logNo=222232286143,"여러가지 <b>콜렉션</b>과 라인업이 있지만, 저의 픽은 바로 홀리데이 ! 미연 과장님이 인스타 스토리에... 식기세척기는 사용 가능 1974년에 출시 된 홀리데이 <b>콜렉션</b>은 크리스마스 느낌을 물씬 담은 고급스러운... ",르모의 일기장,https://blog.naver.com/zzan323,20210205
칠레와인 : 1865 셀렉티드<b>콜렉션</b> 올드바인 까베르네소비뇽,https://blog.naver.com/ljblkd?Redirect=Log&logNo=222377198870,2021.5 아버지께서도 이제 본인이 #와인 좋아하는것을 익히 아셔서 #청주현대백화점 가시는 길에 생일선물로 구입해주신 #칠레와인 #1865 #셀렉티드<b>콜렉션</b> #올드바인 #까베르네소비뇽 대중적인 와인인 #1865와인 을... ,"여행을 통해 세상을 보고, 책을 통해 인생을 본다.",https://blog.naver.com/ljblkd,20210609
<b>콜렉션</b> 완성의 길,https://blog.naver.com/smile8967?Redirect=Log&logNo=222403330193,지금은 좀 허접한 <b>콜렉션</b>같지만 꾸준히 모아나가고 싶다. 벽을 가득 채운 책장을 만화책으로 꽉채우는 것이 소원. 올 초에 코로나로 인해 홍대에 있던 북새통 문고가 결국 폐업한다는 소식에 슬퍼했었는데... ,둥글고 모난 일기,https://blog.naver.com/smile8967,20210619
필립스 데일리 <b>콜렉션</b> 토스트기 사용해본 후기,https://blog.naver.com/sakurasake2?Redirect=Log&logNo=222424441399,필립스 데일리 <b>콜렉션</b> 토스트기 사용 후기를 모아보았습니다. 애플워치를 구매하려고 하셨다면 쿠팡에서 구매하셔서 로켓배송으로 하루만에 빠르게 받아보세요! ▼▼필립스 데일리 <b>콜렉션</b> 토스트기 사러가기... ,요나의 일상,https://blog.naver.com/sakurasake2,20210710
강변 맛집 |  쉐프의 <b>콜렉션</b>  숙성회 &amp; 우니파스타,https://blog.naver.com/acmejh91?Redirect=Log&logNo=222296583621,근처 &quot;쉐프의 <b>콜렉션</b>&quot; 인기가 많아서 자리가 없으면 어쩌나 했는데 다행히 평일이여서 한시간전쯤 전화로 예약 하고 가니 자리에 앉을 수 있었다. 뭔가 호그와트스러운 쉐프의 <b>콜렉션</b> 입구 내부도... ,record space,https://blog.naver.com/acmejh91,20210402
1865 셀렉티드 <b>콜렉션</b> 까베르네소비뇽 피스코 배럴... ,https://blog.naver.com/gejjh01?Redirect=Log&logNo=222183204801,심지어 샴페인에서는 빈티지별로 섞기도 하지 않습니까?ㅎ 1865 셀렉티드 <b>콜렉션</b>? 셀렉티드 빈야드... ps_ctid=01060100 중간에 나인라이브스가 왜 여기 껴있지 ㅋㅋ &quot;셀렉티드 <b>콜렉션</b>&quot; 이라는 프리미엄... ,촉촉한 와인,https://blog.naver.com/gejjh01,20201223
캐슬 <b>콜렉션</b> 34 타마키,https://blog.naver.com/skymecca1220?Redirect=Log&logNo=222221121406,별 생각 없었던 캐슬 <b>콜렉션</b> 시리즈에 롤머리가 나온다고 알려주셔서 주문을 넣을수 있었어요 감사합니다 츄츄님!! 그리하여 받게 된 캐슬 <b>콜렉션</b> 34 타마키 일반 버전과 특별 감사 버전 입니다~~ 메이크업... ,하늘신전의 취향,https://blog.naver.com/skymecca1220,20210126
느낌 원한다면! 헬렌스타인 호텔<b>콜렉션</b> 80수양면 양모이불세트,https://blog.naver.com/goodgirlsun?Redirect=Log&logNo=222341181415,저는 호텔<b>콜렉션</b> 80수양면 양모이불세트와 모던클래식 60수 실속커버세트. 이렇게 두 세트를... 그래서 호텔<b>콜렉션</b>보다 가격도 훨 저렴해요. 하지만 진짜 호텔침구스럽기는 요아이가 더 호텔침구스럽다는 점 ㅋㅋ... ,나무봄이 블로그♡,https://blog.naver.com/goodgirlsun,20210507
입구 비엔나인형박물관 내 제 <b>콜렉션</b> 전시 피규어들,https://blog.naver.com/smartjy67?Redirect=Log&logNo=222436741083,제 <b>콜렉션</b> 전시 피규어들 보시지요. 주말에 가족과 다녀왔는데 일부는 다른 곳으로 옮겨졌네요..... 하비플렉스 코너의 제 <b>콜렉션</b>들입니다. 제 세검정 갤러리와 곳곳에 산재된 <b>콜렉션</b>들 중 일부로 언제 모두 같이... ,스마트의 7080 취미 이야기,https://blog.naver.com/smartjy67,20210719
[마감] DK 마이 퍼스트 <b>콜렉션</b> 공구 오픈 !!,https://blog.naver.com/alstusl0655?Redirect=Log&logNo=222429804878,"저도 진짜 몇개월 기다려 받은책 ㅎㅎ 보셨으면 꼭 하셔야하는책이니 놓치지 마시고 구매하셔요 ^^ DK 마이 퍼스트 <b>콜렉션</b> 공구 오픈 !! [DK] My First Collection - 정가 : 99,000원 - 공구가 : 59,800원 [DK] My First... ",심플하게 산다,https://blog.naver.com/alstusl0655,20210713
&lt;NS&gt; 디아블로 3 - 이터널 <b>콜렉션</b>,https://blog.naver.com/modory?Redirect=Log&logNo=222317207609,"MODORY BLOG ME ※ 게임명 : 디아블로 3 - 이터널 <b>콜렉션</b> ※ 장르 : 액션RPG / 핵앤슬래시 ※ 게임종류 : 디지탈 다운로드 ※ 특징 : 온라인으로 큰 할인을 하길래 전격 구매, 사실 확장팩을 안해봤거든... ▲ PC로... ",M O D O R Y IV,https://blog.naver.com/modory,20210610
김수정<b>콜렉션</b> 아기공룡둘리 애장판 만화책 엔딩결말 스포,https://blog.naver.com/lv5photo?Redirect=Log&logNo=222362430532,김수정<b>콜렉션</b> 아기공룡둘리 애장판 판매하기전에 찍은 사진 포스팅입니다. 키딕키딕에서 출판한... 책의 상태 김수정<b>콜렉션</b> 아기공룡둘리 애장판 만화책 엔딩결말 스포 구매시기가 2004년 8월달인거 같네요.... ,LV5 Photographer,https://blog.naver.com/lv5photo,20210523
가성비와인 요리오 패밀리 <b>콜렉션</b> 치킨엔 요리오!,https://blog.naver.com/hyoniholic?Redirect=Log&logNo=222304239877,패밀리 <b>콜렉션</b> 3만병 한정 판매하는 스페셜한 와인인데 그 중 3병이 우리집으로~ ^^ 요리오 2018 빈티지로... 패밀리 <b>콜렉션</b> 레뱅드매일 창립 20주년 한정 와인 라벨에 딱! 도수는 13.5%입니다 치킨엔 요리오!... ,사랑.. 함께 했던 시간에 대한 예의,https://blog.naver.com/hyoniholic,20210409
패키지에 반하고 향에 반하는[베르두 <b>콜렉션</b> 그랑크뤼 썸머... ,https://blog.naver.com/mjm5475?Redirect=Log&logNo=222326758190,"선물용으로 줘도 감동이고 자신이 그냥 뿌리고 다녀도 향기때문에 감동받는 [베르두 <b>콜렉션</b> 그랑크뤼 썸머 에디션]이에요 먼저, 베르두 <b>콜렉션</b> 그랑 크뤼 칼비 비치 부터 볼께요 딱보자마자 보이는... ",바이오알파(코스모스),https://blog.naver.com/mjm5475,20210428
TWG 그랜드 티 테이스터 <b>콜렉션</b>을 받은 하루 #생일선물... ,https://blog.naver.com/happymina?Redirect=Log&logNo=222388534455,생일 때 TWG 그랜드 티 테이스터 <b>콜렉션</b>을 선물받았어요. 선물하기에 위시리스트가 있는데 제가 이걸... 먹어봐야겠어요! #twg #카카오톡선물하기 #twg티<b>콜렉션</b> #TWG그랜드티테이스터<b>콜렉션</b> #그랜드웨딩티,✧*.◟미나비 블로그◞.*✧,https://blog.naver.com/happymina,20210607
[BT21] BT21 스탠딩 피규어 <b>콜렉션</b>(L),https://blog.naver.com/mariegnosys?Redirect=Log&logNo=222403832613,BT21스탠딩 피규어 라지 사이즈 <b>콜렉션</b> 완성~ 망이 아범은 방탄소년단의 제이홉~ 아범을 닮아서... 스탠딩 피규어 <b>콜렉션</b>도 3개만 더 구하면 드래곤볼이라서 기회되면 다 구하고 싶어요. 품절... ,푸푸의감성공간,https://blog.naver.com/mariegnosys,20210620
영화 <b>콜렉션</b> 2012 (미국),https://blog.naver.com/seotaijiyg?Redirect=Log&logNo=222324045488,감독 마커스 던스탠 조시 스튜어트 (아킨) 엠마 피츠패트릭 (엘레나) 랜달 아처 (더 콜렉터) Randall Archer 리 터게슨 (루셀로) 개봉 2013-05-02 The Collection 영화 더 <b>콜렉션</b> #<b>콜렉션</b> #<b>콜렉션</b>결말 #더<b>콜렉션</b> #콜렉터... ,1Day 1Movie,https://blog.naver.com/seotaijiyg,20210426
이마트와인장터 겟한 로손 리트리트 <b>콜렉션</b> 까베르네쇼비뇽... ,https://blog.naver.com/bumsy?Redirect=Log&logNo=222359993020,리트리트 <b>콜렉션</b> 까베르네쇼비뇽 2016 되겠다 처음부터 궁금하게 별도의 라벨을 붙여 대한민국 대표 소믈리에 5인의 선택 이라고 마케팅도 적극적이다 이마트 단독 <b>콜렉션</b> ㅎㅎ 자세히 보면 펜폴즈 다 금양에서... ,"음식,문화 그리고 와인의 마리아주",https://blog.naver.com/bumsy,20210521
원피스 피규어 킨에몬 배틀 레코드 <b>콜렉션</b> BATTLE RECORD... ,https://blog.naver.com/jylove0407?Redirect=Log&logNo=222379477731,"레코드 <b>콜렉션</b>). 펑크 하자드 편에서 최초로 등장하여 드레스로자, 모코모 공국, 그리고 와노쿠니에서... = [반프레스토 정품] 원피스 피규어 킨에몬 배틀 레코드 <b>콜렉션</b> BATTLE RECORD COLLECTION 제조사 및... ",피규어월드,https://blog.naver.com/jylove0407,20210601
가샤퐁! <b>콜렉션</b> 가면라이더 03,https://blog.naver.com/dfffffgrgt?Redirect=Log&logNo=222312793131,"<b>콜렉션</b> 가면라이더 03입니다. *첫 발매 : 2021년 3월 가챠 랜덤 판매(일본 기준) *가격 : 각 300엔(세금... <b>콜렉션</b> 가면라이더 01(제로원), 이후 02가 발매되고 거기서 또 3개월만에 03까지 출시하였습니다. 01과 02 때의... ",K's의 블로그 Type.Force,https://blog.naver.com/dfffffgrgt,20210417
[괴수 피규어 <b>콜렉션</b>] 반다이 S.H. 몬스터아츠 'KONG' from... ,https://blog.naver.com/batman691?Redirect=Log&logNo=222405995035,"같은 시리즈로 출시된 적이 있는데, 지금은 어마무시한 프리미엄을 자랑하는 바람에 넘사벽이었는데 이번에 '콩'이 나와주면서 S.H.몬스터아츠 <b>콜렉션</b>도 한층 재미있어졌습니다. :) 자, 다음에도 써비스, 써비스~~!!!!",신무바이 피규어 & 건프라 SHOW,https://blog.naver.com/batman691,20210622
쉐프의<b>콜렉션</b>. 찐 숙성회. 강변역. 구의동 존맛탱 맛집.,https://blog.naver.com/jangdbfla?Redirect=Log&logNo=222401221712,드디어 쉐프의<b>콜렉션</b>을 가다. ㅠㅠ 예~~~ 전 부터 너무 와보고 싶던 곳인데 드 디어 쉐콜을..^.ㅠ... 쉐프의<b>콜렉션</b> 가게 정문(?) ㅋㅋ 이제 저녁 7시 인데도 이렇게 밝아용 일단 너무 배고프니까 음식부터 시키자.... ,유림이 이야기,https://blog.naver.com/jangdbfla,20210617
