title,link,description,bloggername,bloggerlink,postdate
크리스탈클라우드 <b>피부관리</b>기 무선 LED마스크,https://blog.naver.com/js2y86?Redirect=Log&logNo=222266828846,피부와 적정거리를 유지하고 얼굴전체를 부드럽게 감싸주는 곡선형구조로 LED가 피부를 안전하고... 이제부터 엄마도 저도 부지런히 관리해보기로 하고 #<b>피부관리</b>기 LED마스크 후기를 마칩니다. 제품보러가기,슬기로운 덕빛생활★,https://blog.naver.com/js2y86,20210307
시메스 노르딕버치 에너지 자작나무 에센스 봄철<b>피부관리</b>에... ,https://blog.naver.com/hanyeriha?Redirect=Log&logNo=222335102888,시메스 노르딕버치 에너지 자작나무 에센스 봄철<b>피부관리</b>에 좋아요:) 글.사진: 오옐 겨울에는 너무 건조했는데 봄이 되면서 환절기가 시작되어서 그런지 피부 트러블이 자꾸 일어나고 거칠거칠 해서... ,오옐's Life 〃,https://blog.naver.com/hanyeriha,20210503
천수윤진 셀프<b>피부관리</b> 마스크팩추천,https://blog.naver.com/todrkr08?Redirect=Log&logNo=222263596372,구매 가능하니 가격 및 제품 문의는 위의 링크를 참고해주세요 #천수윤진 #마스크팩추천 #건조한피부 #피부탄력관리 #셀프<b>피부관리</b> #천수윤 #천수윤진후기 #안티에이징 #마스크팩 #겨울철<b>피부관리</b> #피부홈케어,점프하는 적토마,https://blog.naver.com/todrkr08,20210303
강남역 <b>피부관리</b> 가인미가 신논현점,https://blog.naver.com/j_j_girl?Redirect=Log&logNo=222258815053,헤어스타일 정리도 한번 하고 나갈 수 있어 약속 전에 다녀오기도 참 좋은 이곳! 2020년 서비스관리부문 최우수지점인 만큼 역시나 강남역 <b>피부관리</b>는 단연 가인미가 신논현점이라는 생각이 드네요 ㅎㅎ,Jim Jam Girl's Blog,https://blog.naver.com/j_j_girl,20210227
쾌적했던 송도 <b>피부관리</b>,https://blog.naver.com/ekwjd3946?Redirect=Log&logNo=222274453630,이렇게 관리해 주면서 피부의 영양을 주고 건조를 예방할 수 있답니다. <b>피부관리</b>의 다양한 제품과 기기를 사용해서 관리를 해주셨어요. 봄철 꽃샘추위에도 끄떡없이 이겨낼 영양 보습이겠어요. 듬뿍듬뿍... ,Luna's Life,https://blog.naver.com/ekwjd3946,20210313
언주에서 <b>피부관리</b> 받고 왔어요,https://blog.naver.com/eppy77?Redirect=Log&logNo=222249636677,부쩍 푸석한 피부탓에 추천받고 언주역 <b>피부관리</b>실 다녀왔어요 제가 받은 관리는 수분관리!! 궁금하신 분들을 위해 가는길부터 내부사진까지 알차게 찍어왔답니다.. 그럼 함께 고고!! 지하철을 타고 방문하기로... ,바베드샤,https://blog.naver.com/eppy77,20210219
청주<b>피부관리</b> 꾸준한 관리효과!,https://blog.naver.com/whdgkaks?Redirect=Log&logNo=222317678098,위한 관리 청주<b>피부관리</b> 특히 피부트러블은 혼자 관리하기 힘든 부분중 하나에요 왜냐하면 어디서부터 무슨 문제로인해 피부에 트러블이 생기는지 원인을 파악해야 하거든요 잘못된자세로인한 순환의... ,CRAZY FOR LINE,https://blog.naver.com/whdgkaks,20210421
잠실나루<b>피부관리</b> 얼반스킨 재방문,https://blog.naver.com/violetdevil3?Redirect=Log&logNo=222203781413,"노쇼는지옥에나가버려 잠실나루<b>피부관리</b> 샵 얼반스킨은 네일아트, 속눈썹연장, 왁싱, 피부바디관리까지 하는 토탈뷰티샵이예요. 영국 런웨이 및 살롱출신 대표님의 철학으로 1:1 뷰티 프로그램만... ",보라앙마 일상맛집미용 블로그,https://blog.naver.com/violetdevil3,20210112
[관저동 <b>피부관리</b> 맛집] <b>피부관리</b> 뭣이 중헌디?,https://blog.naver.com/deonni?Redirect=Log&logNo=222316025386,온갖 피부 문제로 거울 들여다보면 짜증 많이나시나요? <b>피부관리</b>에서 가장 중요한 것은 바로 유.수.분.발.란.스 입니다. 누가 그걸 모르냐구요? 맞습니다. 다들 잘 알고 계시지요. 그런데도 관리가 잘 안되니 정말... ,화이트스킨케어,https://blog.naver.com/deonni,20210419
환절기 <b>피부관리</b> 여신티켓 팁 알아봐요,https://blog.naver.com/dngusghk?Redirect=Log&logNo=222273473649,받아볼래요 :) ▼여신티켓 앱 다운하러 바로가기▼ #여신티켓 #피부과 #환절기<b>피부관리</b> #<b>피부관리</b> #피부고민 #마스크트러블관리 #피부시술정보 #근처피부과 #피부시술비용 #피부좋아지는법 #피부시술 #피부보험,mrs.woo's home story,https://blog.naver.com/dngusghk,20210312
홍대 <b>피부관리</b> 아르케스파 트로이필,https://blog.naver.com/cya4749?Redirect=Log&logNo=222277878420,홍대 <b>피부관리</b> 아르케스파에서의 내 피부 처방! 진짜 꼼꼼하다. 트로이 아르케 제품으로 관리를 진행하는 동안 제품들이 전반적으로 순하고 건조함에 도움이 많이 되어 좋았다. 특히 오일 클렌징 제품과... ,스마트토끼의 0:long_log,https://blog.naver.com/cya4749,20210316
수원<b>피부관리</b> 처진턱 살리는 법,https://blog.naver.com/gkskqkqhdi?Redirect=Log&logNo=222417879288,그런지 피부도 칙칙하고 전체적으로 문제가 있는 것 같아서 수원<b>피부관리</b> 전문점을 알아봤어요. 집에서... 무엇보다 사이즈를 줄이기만 하는 게 아니고 균형을 맞춰주면서 피부 결도 살려줬어요. 윤곽만 관리... ,샤이니's Log 피규어_전시회_맛집_일상_정보공유,https://blog.naver.com/gkskqkqhdi,20210702
연수동<b>피부 관리</b>받기 좋은 미주뷰티피부,https://blog.naver.com/justpar?Redirect=Log&logNo=222264459985,"미주뷰피피부 주차도 가능했습니다 관리실 들어가자마자 향기로운 냄새와 따듯한 햇볕이 가득했어요 편안한 분위기더라고요 연수동<b>피부 관리</b>받기 좋은 미주뷰티는 네일아트, 속눈썹, 왁싱 모두 가능한... ",Bling J,https://blog.naver.com/justpar,20210304
"범계 <b>피부관리</b>, 메종드다이아",https://blog.naver.com/sungeunholic?Redirect=Log&logNo=222259491280,"범계 <b>피부관리</b> 메종드다이아는 범계역 근처 에메랄드 빌딩 6층에 위치해있어요 네일, 속눈썹, 피부까지 관리하는 토탈 뷰티샵이라 인기 만점인 곳! 철저한 방역, 소독에 공기 청정기는 물론 모든 시술을 손... ",성은이 망극,https://blog.naver.com/sungeunholic,20210228
김포<b>피부관리</b> 만족도가 높아요,https://blog.naver.com/atbdtm638?Redirect=Log&logNo=222430188255,김포<b>피부관리</b> 스파머시는 몸 전체 피부를 관리해주는 업체로 보시면 더 좋을 거 같네요 뭔가 항상 촉촉해져있는 느낌 피부깊숙한곳까지 전달되는 제품 수분들 때문에 오랜시간 유지를 합니다. 다른곳에서... ,반려동물정보,https://blog.naver.com/atbdtm638,20210713
집에서 손쉽게 하는 환절기 <b>피부관리</b>! #LG 프라엘!,https://blog.naver.com/lg-bestshop?Redirect=Log&logNo=222315627165,일교차와 일조량이 많아져 피부 컨디션이 많이 바뀌니 각별한 관리가 필요해요. LG전자 베스트샵과 함께하는 환절기 예민한 <b>피부관리</b> 어떠세요? 예민해진 피부를 케어해줄 힐링 아이템 추천 푸석한 피부는... ,LG전자 베스트샵 공식블로그,https://blog.naver.com/lg-bestshop,20210419
강남<b>피부관리</b> 세심하고 꼼꼼함에 반해요,https://blog.naver.com/kya7702?Redirect=Log&logNo=222316740392,그리고 복부를 받고 나면 기분탓인지 소화도 잘되는 것 같아요.ㅋㅋㅋ (참고로 복부를 진행해주어야 피부가 더 좋아진다고 해요) 중간중간 원장님이나 관리사분께서 <b>피부관리</b> 꿀팁이라든지 제게 필요한 관리법... ,달리아스파,https://blog.naver.com/kya7702,20210420
[도곡동 <b>피부관리</b>] 작은얼굴관리는 약손명가 타워팰리스... ,https://blog.naver.com/jasminedream?Redirect=Log&logNo=222325401405,작은 얼굴 관리도 너무 좋았고 피부도 좋아 보여서 완전 만족. 펜 구해서 설문지 작성하기! 내가 오늘 받은 도곡동 <b>피부관리</b> 관리사님들 다 너무 좋으셨고 도곡동 <b>피부관리</b> 잘 받고 갑니다 :) 그리고 케어 받고... ,D A I L Y J A S M I N E,https://blog.naver.com/jasminedream,20210428
[강남스킨케어] 압구정<b>피부관리</b>실 진여워터테라피에서 수분충전,https://blog.naver.com/jasminedream?Redirect=Log&logNo=222313118698,관리받고 나가기 전에 클로즈업으로 찍은 사진이네 진심 피부가 처음이랑 너무 달라 보인다 ㅋㅋㅋㅋㅋ 너무 좋았음 ㅠㅠㅠㅠ 압구정 <b>피부관리</b>실 찾고 계신 분들이나 수분 관리가 필요하신 분들에게 진짜... ,D A I L Y J A S M I N E,https://blog.naver.com/jasminedream,20210420
봄맞이 <b>피부관리</b> 테라스인스킨에서 &lt;달팡관리&gt; 받고오다!,https://blog.naver.com/712gram?Redirect=Log&logNo=222342960866,"종각<b>피부관리</b> 테라스인스킨 #종각<b>피부관리</b> #테라스인스킨 #달팡관리 요즘 마스크 때문에 입 주변에 트러블도 많이나고, 미세먼지 때문에 피부도 너무 건조해져서 봄 맞이 기념 <b>피부관리</b>를 받아보러... ",일상의 기록 ♪,https://blog.naver.com/712gram,20210512
"반포<b>피부관리</b> 스페셜케어, 가인미가 !",https://blog.naver.com/mys2k?Redirect=Log&logNo=222266416811,"가인미가 신논현점 : 반포<b>피부관리</b> 작은얼굴 스폐셜케어! 꾸준히 관리하기로 마음먹고, 반포<b>피부관리</b>로... 피부는 관리받는것도 중요하지만 홈케어로 유지하는게 더 중요하다! 선크렘은 꼭 꼭 필수! 아무래도... ",Jessy♥,https://blog.naver.com/mys2k,20210306
범계 <b>피부관리</b> 세레니끄 골드디톡스관리,https://blog.naver.com/podo7497?Redirect=Log&logNo=222437082502,세레니끄 다녀왔어요~~ 방문할때마다 그날의 제 피부 상태를 체크해주셔서 프로그램을 추천해주시는게... 관리받을 준비가 끝나고 이제 관리사분을 기다리면서 한컷. 기존에 얼굴 <b>피부관리</b> 받을 때는 수분충전... ,스윗라리's Diary,https://blog.naver.com/podo7497,20210719
미사<b>피부관리</b> 미사더스킨에서 확실하게~,https://blog.naver.com/zinniakje?Redirect=Log&logNo=222262450161,"이런 디테일이 남다른 미사<b>피부관리</b>샵이더라구요:) 관리를 받고 나서 전후를 비교해보니 확실히 전보다 후가 피부가 투명해지고 라인들도 정리가되고, 쇄골뼈도 훨씬 더 이뻐진 것 같더라구요. 온몸의 혈이... ",지니아 Diary,https://blog.naver.com/zinniakje,20210302
신사동 <b>피부관리</b> 요즘 핫하다는 스킨플래닝 받고 옴!,https://blog.naver.com/elmimir?Redirect=Log&logNo=222308483972,#스킨플래닝 #바롬라인 #신사동<b>피부관리</b> #강남스킨플래닝 #가로수길<b>피부관리</b> 스킨플래닝이 요즘... 이후에 수분 관리를 잘 해주면 피부톤이 눈에 띄게 맑아질 거라고 하셔서 기대 가득.. 특히 얼굴에 잔털이 많은... ,EGOIST,https://blog.naver.com/elmimir,20210413
안양<b>피부관리</b> 매끈하게 만들어요,https://blog.naver.com/htingting?Redirect=Log&logNo=222258302792,전체적으로 관리가 잘 되어있는 세레니끄라서 안양<b>피부관리</b>로 제가 애정하는거에요 ^^ 케어할때 사용하는 제품들인데 그동안 한번도 트러블이 난다던지 피부에 안맞다던지 한적없이 너무도 잘 맞았어요 시작은... ,TINGTING,https://blog.naver.com/htingting,20210227
환절기 <b>피부 관리</b>하기 좋은 록시땅 뿌리는 에센스,https://blog.naver.com/hlee600?Redirect=Log&logNo=222301763379,ㅎㅎ 저는 만족스럽게 잘 사용하고 있답니다❤️ 모두들 꿀피부 되세요~ :) #록시땅 #환절기 #환절기피부 #환절기<b>피부관리</b> #환절기<b>피부관리</b>법 #건조한피부 #건성에센스 #건성미스트 #뿌리는에센스... ,제주꽁지의 일상블로그,https://blog.naver.com/hlee600,20210407
목동<b>피부관리</b> 작은얼굴경락 만족해요,https://blog.naver.com/gpfud81?Redirect=Log&logNo=222271934075,특히 광대가 많이 나와서 얼굴모양에 자신감이 없어요 목동<b>피부관리</b> 새라본이 얼굴경락도 되면서 피부케어까지 가능하다는 말에 그럼 올인원 관리로 받을 수 있을 것 같아서 선택하게 되었어요 11년이나 된... ,GOMZI's STORY,https://blog.naver.com/gpfud81,20210311
<b>피부관리</b> 클로이에스테틱에서 진정 트러블SOS!! 지금 관리 50... ,https://blog.naver.com/kje830830?Redirect=Log&logNo=222380952226,더운 날씨인만큼 제 피부는 열이 올라와용.. 그래서 대치동 <b>피부관리</b> 클로이에스테틱에서 트러블 SOS 관리를 받아보기로했어요~ 저는 민감성이지만 수분이 부족해서 좁쌀이 나는 피부라 늘 관리를 해줘야... ,(-:,https://blog.naver.com/kje830830,20210602
여름<b>피부관리</b> 티큐라로 해요!,https://blog.naver.com/orangezrzr?Redirect=Log&logNo=222032087703,"원래 <b>피부 관리</b>를 제대로 하려면 클렌징, 토너, 세럼, 크림까지 한 라인의 제품을 사용하는 것이... 저는 항상 유분과 피지를 관리하는 것이 힘들었는데 자극없이 피부 진정성분이 피부에 닿으니 데일리로... ",메이티엔 룰루랄라♬,https://blog.naver.com/orangezrzr,20200716
울산 <b>피부관리</b> 경락과 함께 받는 에스테틱,https://blog.naver.com/orange7347?Redirect=Log&logNo=222152524223,항상 얼굴형 관리만 받다가 피부결관리는 처음 받아봤어요! 울산 에스테틱 에이프릴로제는 <b>피부관리</b> 뿐만아니라 얼굴 경락도 가능하기 때문에 얼굴축소에 관심있는 분들에게도 추천하고 싶어요. 정말 아프긴... ,♩ 지혜로운 블로그,https://blog.naver.com/orange7347,20201123
송도 에스테틱 <b>피부관리</b> 남자도 꼼꼼하게 by 스파아루카,https://blog.naver.com/lv3009?Redirect=Log&logNo=222433169490,송도 에스테틱 전문점 <b>피부관리</b>샵 스파아라쿠 방문리뷰 예전에 두피관리로 방문 한 이후 여기가 전신... 도자기로 피부순환관리 아루카 시그니처로 물방울 리프팅 관리도 받았다 정말 시원한 느낌가득 시술... ,'광사마'다이어리,https://blog.naver.com/lv3009,20210717
[파우치인증] 건성<b>피부관리</b> 이게 찐으로 잘 돼,https://blog.naver.com/ks_god11?Redirect=Log&logNo=222141474592,때마다 관리해 주었던 루틴인데 좋더라구요 다른 건 몰라도 건성<b>피부관리</b>할 때 진짜 자칫 잘못하면... ㅎㅎ 건성 아니더라도 모든 피부 사용 가능하니까 부담 같지 말고 써보시면 좋을 듯싶어요~ 기초... ,셀린's Beauty - log,https://blog.naver.com/ks_god11,20201112
피부장벽강화 필요한 봄철 <b>피부관리</b>에 에센스 추천해요... ,https://blog.naver.com/blingnas?Redirect=Log&logNo=222278616428,관리할 때도 가 필수인데요. 저의 고민을 해결해 줄 구원투수 등판!! 요즘 #동인비 #1899싱글에센스 로... (자세한 내용은 상기 이미지 참조) 봄철<b>피부관리</b>에 좋은 피부장벽강화 에센스 추천 후기! 나눔... ,딜리아니's 컬러풀 뷰티 패션블로거♡,https://blog.naver.com/blingnas,20210317
봄철 <b>피부관리</b>엔 랑콤 어드밴스드 제니피끄 에센스 &amp; UV... ,https://blog.naver.com/invu1657?Redirect=Log&logNo=222323689505,할 <b>피부관리</b> 팁이 있다면 봄철에는 뭐니뭐니 해도 자외선 차단이 아닐까 싶어요. 얼마 전에 여행갔다가 느낀거 지만 매년 햇빛이 더욱 따가워지는 게 피부로 와 닿는데 단순히 까맣게 타는 것을 넘어서 색소... ,낭만소녀의 워너비걸즈,https://blog.naver.com/invu1657,20210426
디올 슈퍼 포텐트 세럼 &amp; 아이세럼으로 여름 <b>피부 관리</b>,https://blog.naver.com/hani5080?Redirect=Log&logNo=222428623832,여름 <b>피부 관리</b> 아이템으로 추천하죠! 눈가 피부는 슈퍼 포텐트 아이 세럼으로~ 피부 전반적인 컨디션을... 매끈하게 피부 결을 관리해 주고 흡수가 빠르면서 피부를 윤기나게 케어해주는 사용감이... ,뷰티블로거 하니씨,https://blog.naver.com/hani5080,20210712
"산본얼굴관리, <b>피부관리</b> 잘하는 곳 - 약손명가산본점",https://blog.naver.com/ninjagirl?Redirect=Log&logNo=222286121517,요즘 봄이 되니까 얼굴도 까칠하고 특히나 마스크를 자꾸 쓰니 피부도 엉망... 이가 아파서 한쪽으로만 씹었더니 얼굴도 비대칭인것 같고.. 이래저래 얼굴관리도 신경을 써야할 것 같아서 큰 맘먹고 <b>피부관리</b>... ,멀티주부 호빵맘,https://blog.naver.com/ninjagirl,20210324
안양<b>피부관리</b> 안양신부관리 블루밍 에스테틱,https://blog.naver.com/n9121?Redirect=Log&logNo=222433946011,"여신관리 결혼전에 저도 받았었는데 새록새록하네요~ 안양<b>피부관리</b>에서 차한잔 먹으면서 고민인 피부 상태에 대해 상담을 했어요 평소 메르시는 모공과 미백,탄력에 관심이 많아서 모공과 화이트닝에... ",✔️AND MINIAIN,https://blog.naver.com/n9121,20210716
영등포<b>피부관리</b> 상체슬리밍 케어로 날씬해지자,https://blog.naver.com/eorifi5?Redirect=Log&logNo=222390338877,고민을 하던 중 관리만한 게 없다는 생각이 들었어요. 그래서 바로 영등포<b>피부관리</b> 샵에 예약을 했답니다~! 제가 피부나 몸에 문제가 생겼을 때마다 방문을 하는 샵이 있어요. 바로 노블스토리인앤양인데요... ,서든어택 얼음스나,https://blog.naver.com/eorifi5,20210608
청라<b>피부관리</b> 당당하게 피부고민 해결!,https://blog.naver.com/gpfud81?Redirect=Log&logNo=222026758177,여러분에 피부는 어떠신가요? 예전에 모습 그대로 유지하고 계신가요? 누구나 하는 고민일 수 있습니다. 어떤 관리를 했는지 어떻게 관리를 했는지 중요하답니다. 청라<b>피부관리</b> 잘하는 곳을 찾고 계신가요? 그럼... ,GOMZI's STORY,https://blog.naver.com/gpfud81,20200710
<b>피부관리</b> 허니부쉬추출분말 강성연 화려화 마시며 피부영양... ,https://blog.naver.com/zoonam2?Redirect=Log&logNo=222310120646,"나이를 먹을수록 <b>피부관리</b>,피부영양에 대한 고민이 더 많아지게 되는 것 같아요. 나날이 늘어나는 주름~ 주름은 늘어나는데 탄력은 떨어지고 그럼에도 항상 한결같은 미모와 동안을 유지하는 한 배우님이 눈에... ",엄마가 너희에게 준 최고의 선물~바로 형제이길....,https://blog.naver.com/zoonam2,20210414
일산<b>피부관리</b> 여기 가볼만,https://blog.naver.com/ysjung0128?Redirect=Log&logNo=222257731848,"스킨케어에 관심이 있는 편이고 관리도 게을리하지 않는다고 생각했는데, 세월의 힘이란 게 이렇게... 현재의 피부 컨디션을 고려한 발 빠른 대처가 필요하거든요. 그래서 전 일산<b>피부관리</b> 추천샵으로... ",피부지킴이,https://blog.naver.com/ysjung0128,20210226
부평<b>피부관리</b> 키웰부평점 등관리 최고넹!,https://blog.naver.com/my1002?Redirect=Log&logNo=222266913675,"부평구 더 베스트 우수피부 미용업소 그럴줄 알았어!ㅎ 부평<b>피부관리</b> 키웰부평점 관리를 보면 얼굴관리, 바디관리, 슬리밍&amp;다이어트, 웨딩패키지로는 신부관리,혼주관리가 있고 맘스케어로는 산전관리... ",커피한잔,https://blog.naver.com/my1002,20210307
백석<b>피부관리</b> 작은얼굴 알리에스테틱,https://blog.naver.com/kimsdaepyo?Redirect=Log&logNo=222261985465,가슴복부관리 선택후 데골테 <b>피부관리</b> 파워트리 작은얼굴관리 팩 마무리 순으로 두시간정도 예상하면 될꺼같아요 등관리로 결정하고 고객관리차트에 간단한 신상을 적고 탈의실로 가서 등관리는 사위탈의하면... ,Amazing premium gimbap,https://blog.naver.com/kimsdaepyo,20210302
겨울<b>피부관리</b> 겟잇뷰티 페이스오일  나도 하나 추천할게여,https://blog.naver.com/chinoshioya?Redirect=Log&logNo=222200640149,겨울<b>피부관리</b>를 제대로 안해주시면 피부트러블 및 각질도 자주 올라올수 있으니 미리 미리 관리하는것도 좋을것 같아요 https://www.ojosookorea.com/product/detail.html?product_no=238&amp;cate_no=48&amp;display_group=1 위 제품을... ,새로미 뷰티공간 ♡,https://blog.naver.com/chinoshioya,20210108
화명동 학생 여드름 관리 추천 <b>피부관리</b>샵,https://blog.naver.com/pqpq201?Redirect=Log&logNo=222262357911,"화명동 학생 여드름 관리 1:1 상담부터 관리까지 강윤승닥터큐:-) #화명동<b>피부관리</b>, #화명동피부샵, #화명동<b>피부관리</b>샵, #화명동트러블피부, #화명동여드름, #화명동여드름잘하는곳, #화명동예민성<b>피부관리</b>... ",트러블피부관리전문 강윤승닥터큐,https://blog.naver.com/pqpq201,20210305
고질문제 해결해주는 집에서 건성<b>피부관리</b>,https://blog.naver.com/mini187?Redirect=Log&logNo=222265419810,지성피부라고 해도 건조할 때가 한번쯤은 있을꺼라 생각해 그럴때마다 건성<b>피부관리</b>는 어떻게... 보통 화이트닝 에센스류나 미백 제품에 들어가 있는거라 들었는데 크림에 들어가 있어서 칙칙한 피부를 관리해... ,구르미's #Creator,https://blog.naver.com/mini187,20210308
마산<b>피부관리</b> 올가뷰티에서 편안하게 받아요!,https://blog.naver.com/ruha_thanks?Redirect=Log&logNo=222275694566,<b>피부관리</b>는 대부분 피부를 편안하게 하고 몸과 마음의 휴식을 위해서 찾는 곳이기에 1시간 반정도의... 팩을 올린 후에 엄마는 기기 장치의 앞에서 더욱 관리효과를 높이는 시간을 가졌어요. 엄마의... ,"다시, 생각해",https://blog.naver.com/ruha_thanks,20210315
강남<b>피부관리</b>실 피부고민 걱정 끝!,https://blog.naver.com/kya7702?Redirect=Log&logNo=222429005282,강남<b>피부관리</b>실에서는 관리 받는 날 피부 컨디션에 따라 팩을 다르게 선택해서 진행해주신답니다! 그래서 저는 이전 관리 회차 때는 트러블에 도움되는 약초팩 종류로 초록팩을 올렸었는데 이번엔 수분을... ,달리아스파,https://blog.naver.com/kya7702,20210712
첨단 <b>피부관리</b> 모공쪼이고! 매끈하게 예쁠래에스테틱,https://blog.naver.com/kimna2007?Redirect=Log&logNo=222292316740,첨단 <b>피부관리</b> :: 예쁠래에스테틱 세멘시트부스팅먼트 관리로 모공과 각질 정리해서 매끈한 피부로 안녕하세요. 꽃비서에요:) 날씨 좀 괜찮다~ 싶더니 황사 실화인가용? 미세먼지인지 황사인지 초미세먼지인지..... ,꽃비서 Blog,https://blog.naver.com/kimna2007,20210330
강남신사<b>피부관리</b>실 : 하이푸관리 DPL리프팅 @블랑뷰티,https://blog.naver.com/sowon_3?Redirect=Log&logNo=222174695914,강남신사<b>피부관리</b>실 : 블랑뷰티 20대 후반.. 곧 서른도 멀지 않은 나이..! 원래도 피부가 얇고 탄력이... 나는 피부층이 얇고 쉽게 건조해지는 피부라 각질관리는 1-2주에 한 번만 해주면 된다고 한다. 무조건... ,인생 _퀘스트_ ing,https://blog.naver.com/sowon_3,20201215
동탄<b>피부관리</b> 피부결이 달라지네요,https://blog.naver.com/hn9431?Redirect=Log&logNo=222020047566,여러군데의 <b>피부관리</b>샵에 다녀봤지만 여기만큼 효과가 좋은곳은 못본것같아요. 아무래도 제 친구들이 외모에 관심이 많으니까 저도 덩달아 관리를 받기 시작한것같은데요. 요즘에는 피부뿐만 아니라... ,one day,https://blog.naver.com/hn9431,20200703
강서구<b>피부관리</b> - 제일에스테틱,https://blog.naver.com/sulbe3000?Redirect=Log&logNo=222259707475,"제일에스테틱은 토탈 에스테틱이라, 전신관리, 윤곽관리, <b>피부관리</b> 외에도 네일 관리, 두피 관리 등 모든 관리를 받을 수 있는 곳이더라구요ㅎㅎ 윤곽관리 비교를 위한, 석고모형도 창가에 쭉~ 저는... ",백곰의 생활백서,https://blog.naver.com/sulbe3000,20210228
운정<b>피부관리</b> 고민 싹 해결!,https://blog.naver.com/fdhana?Redirect=Log&logNo=222137411989,보통은 육안으로 보고 대충 어떤 관리를 할지 선택하잖아요. 근데 운정<b>피부관리</b> 전문샵은 정확한 피부 IT 분석을 진행했어요. 그래서 본인 피부를 좀 더 자세히 알 수 있었는데요. 어떠한 문제를 가지고 있는지... ,알흠다운생활-마메르,https://blog.naver.com/fdhana,20201106
영통<b>피부관리</b> 작고 갸름한 V라인의 꿈!,https://blog.naver.com/zizibebe21?Redirect=Log&logNo=222107159795,"영통<b>피부관리</b>실 랑스파, 꽤 오래 피부 및 바디관리를 하고 있는 곳인데, 얼마 전 얼굴축소 윤곽 관리에 대한 이야기를 듣게 됐어요. 로비 장식에 즐비한 얼굴 석고본을 볼 때마다 궁금했습니다. 저건 누가 하는... ",zizibebe's,https://blog.naver.com/zizibebe21,20201005
