title,link,description,bloggername,bloggerlink,postdate
19년 5월 <b>뮤지컬</b> <b>관람</b> 일기,https://blog.naver.com/jeonghee46?Redirect=Log&logNo=222262902345,(이날보고 재밌어서 6월에도 또 봤던 기억이 ㅋㅋㅋㅋ) 5월 25일에는 부산 벡스코 오디토리움에서 한 <b>뮤지컬</b> 레미제라블 프랑스 오리지널팀 내한 콘서트 <b>관람</b> <b>관람</b> 전에 벡스코 안에 스벅에서 신메뉴 체험하기... ,일상그리기,https://blog.naver.com/jeonghee46,20210303
<b>뮤지컬</b> 위키드 <b>관람</b> _ 6월 16일,https://blog.naver.com/gyjun18?Redirect=Log&logNo=222403206532,같은 사무실 선생님은 이 공연을 <b>관람</b> 하셨다. 어떤 모습이었을지 궁금하긴 하다. 2층 공연장 입장을 하러 올라왔더니 <b>뮤지컬</b> 전용 극장의 특성 답게 <b>뮤지컬</b> 라이브러리를 꾸며놨다. 한쪽 코너는 우리나라... ,행복한 날들로 채워가자,https://blog.naver.com/gyjun18,20210619
<b>뮤지컬</b> 드라큘라(김준수 &amp; 조정은) <b>관람</b> 후기 - 블루스퀘어... ,https://blog.naver.com/snflgg?Redirect=Log&logNo=222437326264,"안녕하세요 동그리 입니다 :-) 이번 포스팅은 성황리에 진행 중인 <b>뮤지컬</b>, 드라큘라 <b>관람</b> 후기 입니다 <b>뮤지컬</b>티켓은 네이버예약을 통해 구매했고, 저흰 7월1일 김준수&amp;조정은 배우님 공연을 <b>관람</b>했습니다 좌석은... ",동그리의 들려주고 싶은 이야기 :D,https://blog.naver.com/snflgg,20210719
[<b>관람</b>]2021년 <b>뮤지컬</b> 시카고,https://blog.naver.com/hgf0917?Redirect=Log&logNo=222432518004,문화생활 중 돈이 제일 많이 들지만 그만큼 기를 받고 오는 느낌이어서 ㅎㅎ 올해는 제가 보고 싶은 <b>뮤지컬</b>은 시간. 교통 신경 쓰지 않고 시간이 되면 바로 보러 갈 생각입니다. 다들 즐거운 <b>뮤지컬</b> <b>관람</b>하세요~,예린이의 좌충우돌 우당탕탕 계란말이,https://blog.naver.com/hgf0917,20210715
"내셔널갤러리, 코벤트가든, 타워브리지, 라이온킹 <b>뮤지컬</b> <b>관람</b>",https://blog.naver.com/celine324?Redirect=Log&logNo=222190399882,"오늘 떠나볼 방구석 추억 여행으로는 런던 비행시 방문했었던 내셔널갤러리와 코벤트가든, 타워브리지 방문기, 라이온킹 <b>뮤지컬</b> <b>관람</b>을 포스팅 하려 합니다. 내셔널 갤러리는 대영박물관과 함께 런던 여행시... ",너와 나의 하루,https://blog.naver.com/celine324,20201230
런던여행 #12 마이리얼트립으로 예매해 <b>관람</b>한 <b>뮤지컬</b> 위키드... ,https://blog.naver.com/rano_0114?Redirect=Log&logNo=222197042734,브로드웨이 작품이기에 영국이 본고장은 아니지만 영국 런던에서의 <b>뮤지컬</b> <b>관람</b>이 버킷리스트에 있는 사람도 많길래 영국만의 뭔가가 있지 않을까 싶어서 보게 되었던 위키드. 솔직히 다 이해는 못했지만... ,Rano의 멋대로 살아가기,https://blog.naver.com/rano_0114,20210105
[Musical] 'Wicked 위키드' <b>뮤지컬</b> 뒤늦은 <b>관람</b> 후기,https://blog.naver.com/sohyun2205?Redirect=Log&logNo=222431323068,고등학생 때 갔던 유럽여행에서 <b>뮤지컬</b> <b>관람</b>을 스킵했던 기억이 있는데 반성하게 되었네요ㅠㅠ 딱 한 가지 아쉬웠던 점은 오직 좌석뿐이라고 할 수 있을 것 같아요. 막바지에 급하게 예매한 탓에 3층... ,The most beautiful moment,https://blog.naver.com/sohyun2205,20210714
<b>뮤지컬</b> 비틀쥬스 VIP석 <b>관람</b> 후기 (세종문화회관),https://blog.naver.com/fleurdemimosa?Redirect=Log&logNo=222427486149,BeetleJuice 비틀쥬스ㅣ 팀버튼 감독 ㅣ 1988 작년 초 '오페라의 유령' 이후 거의 1년 만의 <b>뮤지컬</b> <b>관람</b>.. 팀 버튼의 어둡고 기괴한 판타지를 좋아하는 사람으로서 솔직한 후기는 좀 아쉬웠는데.. 1988년 제작된... ,TITA,https://blog.naver.com/fleurdemimosa,20210711
<b>뮤지컬</b> [위키드] 손정페어 <b>관람</b> 후기  (+ 공연 보기 전 알아두면... ,https://blog.naver.com/paichaiuniv?Redirect=Log&logNo=222286820015,<b>뮤지컬</b> <b>관람</b> 전에 '오즈의 마법사'를 꼭 꼭 보고가세요!!! 안되면 줄거리라도...!!! 생각보다 연관된 부분이 훨씬 훨씬 많답니다!! &quot;아 이래서 오즈의 마법사에서 그랬구나!!&quot;하는 장면이 정말 많기 때문에... ,최초에서 최고로! 배재대학교 공식블로그,https://blog.naver.com/paichaiuniv,20210325
시크릿쥬쥬 <b>뮤지컬</b> 별의여신 4살 아이와 <b>관람</b>후기,https://blog.naver.com/vividy88?Redirect=Log&logNo=222437877692,첫 <b>뮤지컬</b> <b>관람</b>으로 추억도 쌓았어요 공연중에는 사진을 찍을 수 없어서 마지막 포토타임 쯤 찍은 사진이에요 예전에는 주인공들이 객석에도 왔다고 하는데 코로나 때문에 너무 아쉬웠어요 너무 예쁘신... ,@쏠쏠랄라 귀여운 남매일상,https://blog.naver.com/vividy88,20210720
[<b>뮤지컬</b> 창업] 21.06.22 공연 / 대학로 <b>뮤지컬</b> 창업 <b>관람</b>후기... ,https://blog.naver.com/jangji0613?Redirect=Log&logNo=222418762342,"나는 <b>뮤지컬</b>이나 연극 등의 공연을 상당히 좋아하는데, 여러 이유로 오랜 시간동안 공연을 즐기지 못했다가 오랜만에 대학로에서 만족스러운 <b>뮤지컬</b>을 <b>관람</b>해 후기를 남기고자 한다 :) 이 날 내가 <b>관람</b>했던... ",Living in the moment,https://blog.naver.com/jangji0613,20210703
"드림씨어터 <b>뮤지컬</b> 위키드... 38, 39번 좌석, 시야 / <b>관람</b>후기",https://blog.naver.com/pya0815?Redirect=Log&logNo=222409411106,<b>뮤지컬</b> <b>관람</b>시 5시간 동안 무료주차입니다. 사실 옥정페어를 구하고 싶었는데 연차일정이 맞질 않아 손정페어로 예매하게 되었습니다. 근데 기사를 보니 옥주현씨가 건강문제로 중도 하차했다고 하시더라구요.... ,작은 공간,https://blog.naver.com/pya0815,20210625
용산 북카페 : 블루스퀘어 북파크 라운지 (<b>뮤지컬</b> <b>관람</b> 할인),https://blog.naver.com/chocobinu215?Redirect=Log&logNo=222428731357,"종일 무제한 + 음료1잔 = 9,900원에 이용하실수 있어요 블루스퀘어에 있어서 당일 <b>뮤지컬</b> <b>관람</b>권이 있으면 현재 3,000원 할인중! 저도 할인 받아 6,900원에 다녀왔습니다. 당일 내에 언제든 재입장이 가능하기... ",송송의 착한블로그,https://blog.naver.com/chocobinu215,20210712
대신 망원경카메라 파워샷 줌으로 <b>뮤지컬</b> 시카고 <b>관람</b> OK!,https://blog.naver.com/hanbitnuri?Redirect=Log&logNo=222327543410,해가 길어져서 2시간 전에 미리 도착했더니 실내가 밝아서 사진찍기도 좋고 더 잘 나오더라고요 이게 얼마만의 <b>뮤지컬</b> <b>관람</b>인지 설레는 마음 가득 안고 열심히 포토월 등에서 인증 사진 찍으면서 시작하기를... ,멜로래빗의 홈뷰티,https://blog.naver.com/hanbitnuri,20210429
<b>뮤지컬</b> 시카고 첫<b>관람</b> 2층 끝자리 에서 봤어요!,https://blog.naver.com/jiyeyejin06?Redirect=Log&logNo=222311466175,제가 가장 큰 걱정이었던건 저랑 남친냥 둘다 첫 <b>뮤지컬</b> <b>관람</b>이라서 과연 잘 볼 수 있을지! 그게 걱정이었어요. <b>뮤지컬</b> 배우분들도 잘 모르다보니 예매도 한번 취소하고 다시 예매하면서 시카고 <b>뮤지컬</b> 2층... ,떠나고 싶은 오늘,https://blog.naver.com/jiyeyejin06,20210415
<b>뮤지컬</b> 위키드 2차 <b>관람</b> 후기 in 부산 드림씨어터 ; 옥주현... ,https://blog.naver.com/imsky_83?Redirect=Log&logNo=222413315141,"<b>뮤지컬</b>을 <b>관람</b>할 경우 무료 주차시간이 5시간이라 여유있게 가서 <b>뮤지컬</b> <b>관람</b>하고 커피 한 잔 하는 것 까지 가능하다. 층별 안내 중 지하 1층에 적힌 '보타닉 아덴'이 카페인데, 굉장히 널찍하고 인테리어가... ",열심히 살아요,https://blog.naver.com/imsky_83,20210628
"센트럴 부산 호텔&gt; 숙박 후기+조식(주차,숙박후 <b>뮤지컬</b><b>관람</b>)",https://blog.naver.com/limje100?Redirect=Log&logNo=222390350871,연달아 <b>뮤지컬</b>까지 보고 갈 계획이기 때문에 자차로 호텔에 갔습니다! 건물이 아주 세련됐군용ㅋㅋㅋ 다음날 볼 <b>뮤지컬</b> 위키드도 크게 현수막 걸려있어요! 주차하니 ifc몰로 가는 입구와 호텔로 가는 입구가... ,임징징의 징징대는 블로그,https://blog.naver.com/limje100,20210612
매진행렬 <b>뮤지컬</b> 맨오브라만차 조승우 캐슽 <b>관람</b> 후기(조승우가... ,https://blog.naver.com/wise9140?Redirect=Log&logNo=222255468609,#맨오브라만차 #조승우<b>뮤지컬</b> #샤롯데2층C구역 안녕하세요 여러분 수냥입니다 :) 오늘 간만에 <b>뮤지컬</b> <b>관람</b>을 하고 와서 후기를 적어보려고해요ㅎㅎ 진짜 좌석 거리두기 시작된 이후로는 공연 자체를 안하기도... ,ROSEBERRY,https://blog.naver.com/wise9140,20210224
[2021 <b>뮤지컬</b> 팬텀]... 팬텀 <b>관람</b>후기 (feat. 오페라의 유령... ,https://blog.naver.com/dltjgus93?Redirect=Log&logNo=222306691569,"참고로 내가 <b>관람</b>한 회차에선 내 <b>뮤지컬</b> <b>관람</b> 경험 최초로 음향 장치 고장으로 인해 공연 자체가 30분이 지연되었는데 사과 방송으로 2시 30분에 공연 재개를 안내했고, 커튼콜 후에 최고령인 윤영석 배우가... ",현꾸월드,https://blog.naver.com/dltjgus93,20210412
2021.05.29 <b>뮤지컬</b> 드라큘라 <b>관람</b> 후기 및 나만의 <b>관람</b> 팁!,https://blog.naver.com/vigor8467?Redirect=Log&logNo=222375675869,티켓이 이뻐서 너무 맘에 들었어용!!ㅎㅎ <b>관람</b> 후기 #<b>뮤지컬</b>드라큘라 #김준수가 잘한다는 말을 들어가지고~ 우연히 YES24에 티켓이 있어서(티켓 구하기 힘들더라구용 ㅜㅜ) 가기 전에 사전 공부! 중요하죠!... ,스무살 여자의♡,https://blog.naver.com/vigor8467,20210530
안산 ) 시크릿쥬쥬<b>뮤지컬</b> 티켓구매 및 <b>관람</b>후기,https://blog.naver.com/thekeynote?Redirect=Log&logNo=222391789201,공식적 선언 요술봉은 5000원 주고 결국 <b>뮤지컬</b> <b>관람</b>후 구매하였습니다. 카드는 안되고 계좌이체가 가능하나 빠른 결제를위하여 현금을 준비하시길... 하루종일 해 피 시크릿 쥬쥬 <b>뮤지컬</b>공연을 볼까말까... ,THEKEYNOTE,https://blog.naver.com/thekeynote,20210609
[<b>뮤지컬</b><b>관람</b>후기] 대학로 <b>뮤지컬</b> &lt;박열&gt; <b>관람</b>후기,https://blog.naver.com/haeinn2?Redirect=Log&logNo=222436017579,어차피 <b>뮤지컬</b>을 <b>관람</b>하러 왔다면 5층에 올라가도 화장실이 있으니 이용하면 좋을듯! (나도 1층에서 한참 기다림..) 5층에 올라가서 가장 중요한 qr체크인을 한 후에 여기저기 둘러보았다 포스터가 크게 붙어 있고... ,Hi haan,https://blog.naver.com/haeinn2,20210718
Let’s Play 앤서니 브라운 <b>뮤지컬</b> 〈신비한 놀이터〉 <b>관람</b>... ,https://blog.naver.com/lkh84?Redirect=Log&logNo=222348039679,"<b>뮤지컬</b> <b>관람</b> 후, 자연스럽게 스크린 앞에서 사진 찍겠다는 가을 이번엔 예전부터 염두에 두고 있던 앤서니 브라운의 &lt;신비한 놀이터&gt; <b>뮤지컬</b>에 도전 아이들이 참여하는 <b>뮤지컬</b> 형식으로 알려져 있어서 중간에... ",두근두근 콩닥작가,https://blog.naver.com/lkh84,20210512
<b>뮤지컬</b> 그레이트코멧 유니버셜아트센터 2층 <b>관람</b> 후기,https://blog.naver.com/yipi1000?Redirect=Log&logNo=222282190683,그자리 예매하셨던 분들은 무슨 봉변 코로나로 제작사측도 업무 처리에 바쁘겠지만 너무 서두른 나머지 허술한게 한두가지가 아닌 것 같아요 아..그리고 코로나 바이러스 방역을 위해 <b>뮤지컬</b> <b>관람</b>하기 전에... ,아무도 모르는 블로그,https://blog.naver.com/yipi1000,20210321
포항4차산업교육 진로<b>뮤지컬</b> <b>관람</b>,https://blog.naver.com/sesjaebum?Redirect=Log&logNo=222104022311,작년 11월 포항4차산업교육 진로<b>뮤지컬</b> <b>관람</b> 했던날 중국 코로나가 터지기 한달전 그때만 했어도 전국민이 마스크스고 다닐줄은 상상도 못했지요.ㅠㅠ 휴대폰으로 확인하다가 그때 사진이 남아 있어서 포스팅... ,울산 장지원한복,https://blog.naver.com/sesjaebum,20200930
베이비버스 아기 <b>뮤지컬</b> <b>관람</b> 후기❤(+좌석 예매 꾸르팁),https://blog.naver.com/lahak?Redirect=Log&logNo=221769680135,베이비버스<b>뮤지컬</b> <b>관람</b> 후기 솔직히 #아기<b>뮤지컬</b> 이라고 만만하게 생각했거든요. 쉽게 말해 허접할 거라는... 내가 완전 잘못 생각했다!! 캐릭터랑 배우들 합쳐 15명정도 되는 인원이 쉴틈없이 춤추고 노래하며... ,엄마가 되는 이야기,https://blog.naver.com/lahak,20200113
간만에 박물관도 가고 공연 <b>관람</b>도 했다. &lt;창작<b>뮤지컬</b> 백범&gt;,https://blog.naver.com/jalsalabose?Redirect=Log&logNo=222112494260,은빈양 생일 기념 2차 <b>뮤지컬</b> <b>관람</b> 마침 한글날이고 재작년 한글박물관 어린이 해설사를 할 때 담당선생님께 인사드리려 잠시 한글박물관으로 갔다. 작년에는 어린이해설사 같이 했던 친구들과 만나서... ,멀리보자!!,https://blog.naver.com/jalsalabose,20201011
[<b>뮤지컬</b>]CGV 몬테크리스토 <b>관람</b>,https://blog.naver.com/haram4th?Redirect=Log&logNo=222283201637,"몬테크리스토 이야기만 하게 될 줄 알았는데, 캐스팅 배우들에 대해 이야기하다보니 <b>뮤지컬</b> <b>관람</b> 후기가 산으로 갔네요ㅎㅎㅎ 코로나 바이러스 때문에 여행업계가 가장 큰 피해를 보았지만 공연계도 정말 큰... ",돌스의 맛있고 즐거운 여행,https://blog.naver.com/haram4th,20210322
[<b>뮤지컬</b> 드라큘라 <b>관람</b> 후기]샤롯데씨어터 드라큘라 ~,https://blog.naver.com/mimiiam?Redirect=Log&logNo=221968247596,정말 처음에는 이렇게 가지고 다니는 사람들 이해가 잘 안되었는데 이젠 <b>뮤지컬</b> <b>관람</b>에서 없으면 안되는 아이템이 되어버렸다. 쿠팡 구매링크를 올렸는데 필요한 사람은 참고하면 좋을 것 같다. 클릭하면... ,★아싸랜드,https://blog.naver.com/mimiiam,20200520
신비아파트 <b>뮤지컬</b> <b>관람</b> : 비명동산의 초대장 - 경기아트센터,https://blog.naver.com/jh228?Redirect=Log&logNo=222380967847,#신비아파트<b>뮤지컬</b> #신비아파트비명동산 #신비아파트<b>관람</b>후기 #어린이<b>뮤지컬</b> #신비아파트공연 #구하리티셔츠 #금비야광봉 #신비아파트선풍기 #신비아파트아이템,유긍정's 오지랖 넓은 이야기,https://blog.naver.com/jh228,20210602
꼬마버스 타요 <b>뮤지컬</b> <b>관람</b>. (2021.4.3.),https://blog.naver.com/pinknury84?Redirect=Log&logNo=222297654930,"☆ 우리가 <b>관람</b>하게 될 공연은, #꼬마버스타요 <b>뮤지컬</b>! #하하호호 노래자랑 타요 스토리엔 관심이 1도 없는 아이이지만, 타요 캐릭터는 좋아하니까 열심히 잘 봐주었으면 하는 마음으로 공연장엘 입장하였다.... ",뿡이쌤의 친절하고 지혜로운 특수교육,https://blog.naver.com/pinknury84,20210403
"<b>뮤지컬</b> 시카고 <b>관람</b> 후기 (<b>뮤지컬</b> 추천, 시카고 <b>뮤지컬</b> 예매 및... ",https://blog.naver.com/wlstlf0702?Redirect=Log&logNo=222399356711,<b>뮤지컬</b>을 <b>관람</b>할때 무대위에 밴드의 모습을 본 것은 처음이었다. 공연장에서 악기하나하나의 소리를 자세히 듣다보면 재즈 공연에 빠지고 만다. 중간중간 아주 멋있는 지휘자님이 감초역할도 해주시는데... ,드림컴트루,https://blog.naver.com/wlstlf0702,20210615
2021.06.19 <b>뮤지컬</b> 프리다 <b>관람</b> 후기,https://blog.naver.com/vigor8467?Redirect=Log&logNo=222403597659,친구의 제안으로 보러 가게 된 <b>뮤지컬</b>! EMK 인스타에서도 많이 봐서 보러 갈까? 싶었는데 다녀왔습니다... #티켓 예매시에 할인 50%까지 받는 방법 많으니 꼭 받으시고 즐거운 <b>관람</b>하세요~^^ P.S 관크 금지(폰... ,스무살 여자의♡,https://blog.naver.com/vigor8467,20210619
서울 어린이 공연 타요 <b>뮤지컬</b> 하하호호 노래자랑 솔직 <b>관람</b> 후기!,https://blog.naver.com/geniusm?Redirect=Log&logNo=221760002298,"타요 <b>뮤지컬</b> <b>관람</b>후기 이벤트도 하고 있으니, 혹시 인터파크에서 예매하신 분들은 참여하세요~ 타요 붕붕이 장난감 몇 개와 미끄럼틀이 있으나 아이들이 한 번 올라타면 내려올 생각을 안하니, 일찍 가지 않는... ",궤변술사의 쓸모있는 잡담 블로그..,https://blog.naver.com/geniusm,20200104
주말일상! 딸과 신비아파트 <b>뮤지컬</b> &lt;비명동산의 초대장&gt; <b>관람</b>,https://blog.naver.com/love_jeehyun?Redirect=Log&logNo=222395684066,오후에는 우리 공주님과 신비아파트 <b>뮤지컬</b> <b>관람</b>! 아주 꼬맹이 때부터 <b>뮤지컬</b>을 많이 보여줬었는데 코로나19 때문에 한참을 공연장에 못가다가 드디어 가게 되었어요. 일주일전부터 <b>뮤지컬</b> 보러 가기만을... ,새벽기상으로 내 안의 가능성을 발견하는 프로N잡러,https://blog.naver.com/love_jeehyun,20210612
"[<b>뮤지컬</b>] 맨오브라만차 <b>관람</b> 후기(샤롯데, 2층 시야)",https://blog.naver.com/fuji_?Redirect=Log&logNo=222310660550,개인 편차가 심하긴 한 모양이다^-ㅜ 기억을 되살려 쓰다보니 또 보고 싶네.. 방패 뱃지 아직 남아있을까.. 흑ㅠ 표 줘요..ㅠ_ㅠㅋ #맨오브라만차 #조승우 #<b>뮤지컬</b><b>관람</b>,자꾸 오면 습관되는 블로그,https://blog.naver.com/fuji_,20210415
마호야쿠 무대(<b>뮤지컬</b>) <b>관람</b>,https://blog.naver.com/mzh91?Redirect=Log&logNo=222391716611,(<b>뮤지컬</b>?) 같이 빠진 친구가 2.5차원 무대도 보고싶다해서 나도 첨이기도 하고 같이갔다옴 결론 대만족ㅎ__ㅎ https://youtu.be/IiGDJRBc5AM 3월달인가부터 추첨 시작했는데 보고싶다고 다 갈수있는게 아니고 추첨해서... ,ほしつきたいよう,https://blog.naver.com/mzh91,20210609
"<b>뮤지컬</b> 문외한 드뎌 킹키부츠 <b>관람</b>하다 박은태,김성규,김환희",https://blog.naver.com/joyarmygirl?Redirect=Log&logNo=222123704401,"킹키부츠 <b>뮤지컬</b> <b>관람</b> 김성규,박은태,김환희 인터파크 블루스퀘어와 지하철 바로 연결장소에 포스터! 15년만에 아니 그 이상 못봤던 <b>뮤지컬</b>을 드디어 보게 되었다 이날 사이트 오픈 전날이라 진짜 늦게 퇴근하게... ","빵양,민양,서군♥",https://blog.naver.com/joyarmygirl,20201022
베이비버스 <b>뮤지컬</b> <b>관람</b> 후기~,https://blog.naver.com/shkwon1207?Redirect=Log&logNo=221751646738,"사실 요즘은 베이비버스 뜸하게 봤는데, <b>뮤지컬</b> <b>관람</b>을 앞두고 일주일 전부터 조금씩 보여줬어요 ㅋ 그러면 확실히 더. 더. 좋아하더라구요 키키 묘묘 보러 가자고 말하자마자 뿜이가 좋다고 방방 뛰었어요.... ",나의 하루,https://blog.naver.com/shkwon1207,20191227
"공연, 골프존 조이마루 아트홀에서 가족<b>뮤지컬</b> <b>관람</b>해 보세요.",https://blog.naver.com/yuseonggu?Redirect=Log&logNo=222309657983,"대전 유성구 공연, 골프존 조이마루 아트홀에서 가족<b>뮤지컬</b> <b>관람</b>해 보세요. 코로나 19 상황이 장기회되면서 공연 업계에도 많은 타격을 받았는데요, 얼마 전부터 소독 및 <b>관람</b> 인원 축소 등 방역 수칙을... ",유성구 공식 블로그,https://blog.naver.com/yuseonggu,20210414
2019 맘마미아 <b>뮤지컬</b> 대전 공연 <b>관람</b> 후기!!,https://blog.naver.com/soonog012?Redirect=Log&logNo=221712792719,천안에서 대전 가는 길은 <b>뮤지컬</b> <b>관람</b>에 신나기보다 폭우가 쏟아져 우중충하기까지 했다. 공연장인 대전 &quot;예술의전당 아트홀&quot; 전경이다. 위 사진은 공연 마치고 한 장 남겼다. <b>관람</b>객들이 줄 서서 대기했던... ,백조의 세계여행 프로젝트!!,https://blog.naver.com/soonog012,20191119
2020 <b>뮤지컬</b> 썸씽로튼 충무아트센터 <b>관람</b>후기 (2020.08.07... ,https://blog.naver.com/dunteang2?Redirect=Log&logNo=222071025978,코로나 이후 어쩌면 해피엔딩을 시작으로 <b>뮤지컬</b> <b>관람</b>을 시작했다. 그 두번째 썸씽로튼. 이 작품은 오롯이 이지훈 배우 때문에 보게 됨. 왜냐면 어렸을 때부터 덕후였으므로. .. 팬된지 20년 된 거 같다... 어허... ,일상다반사,https://blog.naver.com/dunteang2,20200826
<b>뮤지컬</b> 박정희 솔직 <b>관람</b> 후기,https://blog.naver.com/mt653?Redirect=Log&logNo=222266832756,"<b>뮤지컬</b> 박정희 포토존 ▲ <b>뮤지컬</b> <b>관람</b>이 처음이시라는 울 마미, <b>뮤지컬</b> 박정희 포토 스팟 앞에서 기념사진 찍어드림. 나는 그동안 신흥무관학교, 웃는 남자. 박열, 영웅, 유관순, 3일간의 비, 망원동 브라더스... ",HAPPY DAY,https://blog.naver.com/mt653,20210306
백희나 작가의 알사탕 <b>뮤지컬</b> <b>관람</b> 후기,https://blog.naver.com/alouete?Redirect=Log&logNo=222054433218,코로나 때문에 벼르고 벼르다가 이제야 <b>관람</b>을 하게 되었다. 알사탕 <b>뮤지컬</b> 티켓 금액은 인터파크에서 3인 가족 할인권이 있어서 약 2만 원 정도의 티켓을 끊었다. 여러 가지 할인 프로모션이 있는 것 같으니... ,매일매일 꼼지락!,https://blog.naver.com/alouete,20200808
"투어 -  근위병 교대식, 라이언킹 <b>뮤지컬</b> <b>관람</b>, 런던 시내 구경",https://blog.naver.com/ibluemintn?Redirect=Log&logNo=222423314909,"이날은 런던 시내를 구경하면서, <b>뮤지컬</b> 라이언킹을 보는 일정이기 때문에 근위병 교대식을 구경하고... 라이언킹 <b>뮤지컬</b>을 보러 라이시움 극장으로 갔다! 그 유명한 라이온 킹의 오리지널 <b>뮤지컬</b>이라고 해서... ",킴블,https://blog.naver.com/ibluemintn,20210707
내돈<b>관람</b> <b>뮤지컬</b> 마리앙투아네트 김소현 이석훈 김연지 김준현... ,https://blog.naver.com/techwriting?Redirect=Log&logNo=222435885608,"가수지만 <b>뮤지컬</b> 배우처럼 성량 좋고 연기가 어색하지 않았다. 원래 <b>뮤지컬</b> 배우만 나오는 회차를 선호하는데, 이분은 보컬선생님이라 그런가 <b>뮤지컬</b> 창법도 잘하셨다. * 김연지: 중요 역할인데 어금니를 꽉물고... ",닥치고 라이팅,https://blog.naver.com/techwriting,20210718
우리의 첫번째 심야데이트 : <b>뮤지컬</b> <b>관람</b>,https://blog.naver.com/kangsiro?Redirect=Log&logNo=222113110750,"시간에 <b>뮤지컬</b>을 <b>관람</b>하러 왔을까? 차라리 &lt;불후의명곡&gt;을 거실 1열에서 <b>관람</b>하지... 그래도 우리의 첫 번째 심야 데이트인데 인증샷은 남겨야지.. 시간 여유가 있어서 기획특별전 &lt;빛의 과학, 문화재의 비밀을... ",우리는~~행복한 가족,https://blog.naver.com/kangsiro,20201012
[공연] 서울 예술의전당에서 <b>뮤지컬</b> 인더하이츠 <b>관람</b>하고 왔다,https://blog.naver.com/zxorolxz?Redirect=Log&logNo=222199219368,정말정말 무대 바로 앞이었고~ 무대가 안보이거나 목이 아프거나 그런거 전혀 없어서 전 너무너무 만족했던 <b>뮤지컬</b> <b>관람</b>이었습니다~ㅎㅎ 오히려 더 생생했고ㅋㅋ 이 시즌이 키범오빠가 지구를지켜라... ,응그래의 상태메세지 :: 여전히 내 삶의 Everything,https://blog.naver.com/zxorolxz,20210107
"[공연리뷰] <b>뮤지컬</b> 캣츠 내한공연, 2층 <b>관람</b> 시야",https://blog.naver.com/hoyilovekj?Redirect=Log&logNo=222125389348,오늘도 나를 사랑하는 하루되세요♡ #캣츠 #<b>뮤지컬</b> #<b>뮤지컬</b>캣츠 #<b>뮤지컬</b><b>관람</b> #샤롯데씨어터 #인터파크 #인생딜 #샤롯데씨어터시야 #<b>뮤지컬</b>시야 #샤롯데씨어터2층시야 #샤롯데씨어터A석시야 #샤롯데씨어터A석... ,Alea iacta est,https://blog.naver.com/hoyilovekj,20201024
[2021] 흔한남매 어린이 <b>뮤지컬</b> <b>관람</b>했어요~,https://blog.naver.com/hunje000?Redirect=Log&logNo=222410692861,"대세 흔한남매 <b>뮤지컬</b> 대세는 대세인가 보다. 아이가 자라면서 장난감이나 어린이 프로그램에 대한... 2층은 좀 멀다 그리고 그 인기에 힘입어 <b>뮤지컬</b>로도 나왔다. 작년인가부터 했던 것 같은데, 이번에 집에서... ",최정구단의 소소한 취미생활,https://blog.naver.com/hunje000,20210626
