title,link,description,bloggername,bloggerlink,postdate
"계양구 만화<b>카페</b> 두꺼비, 이색 놀거리 <b>VR</b><b>체험</b>과 식사까지",https://blog.naver.com/polar2795?Redirect=Log&logNo=222295747925,<b>VR</b><b>체험</b>은 친구랑 같이 해도 재밌을 것 같다는 생각이 들었고요. 가까운 곳에서 재미있는 계양 놀거리를 찾으시는 분들을 위해 살짝 소개해 드려볼게요. 계양구 만화<b>카페</b> &amp; 놀거리 두꺼비 만화<b>카페</b> 주말 주차 무료... ,백곰의 빼꼼 내다보기,https://blog.naver.com/polar2795,20210402
정선 벅스랜드<b>VR</b><b>체험</b> 어른들도 재밌는 <b>체험</b>,https://blog.naver.com/ekoh72?Redirect=Log&logNo=222377365701,근처에 마땅히 쉴 곳이 없으니 <b>카페</b>가 정상 운영을 했으면 좋겠네요... 벅스랜드!! 너 정말 오랜만이다!!!! ㅎㅎ 휴~~ 오늘은 정상운영이라고 하네요.. 드디어 오늘에서야 벅스랜드의 <b>VR</b><b>체험</b>을 할 수 있게... ,감성돋는 까칠갱이,https://blog.naver.com/ekoh72,20210531
기장 정관 키즈<b>카페</b> 신나는 <b>VR</b><b>체험</b>! 조이앤프렌즈,https://blog.naver.com/mungmung_i?Redirect=Log&logNo=221788831765,기장 정관 키즈<b>카페</b> 에서는 5~6가지의 <b>vr</b><b>체험</b>이 가능했는데 기계 고장으로 <b>체험</b>하지 못한 것도 있었다. 입장료에 포함되지 않는 <b>vr</b><b>체험</b>은1기계당 3천원으로 쿠폰을 산 뒤 이용가능하다. 6장 쿠폰 구매후... ,귀요미 MJ WJ SJ랑~♡,https://blog.naver.com/mungmung_i,20200129
"키즈<b>카페</b> - 풀패키지로 뷰티, 클라이밍, <b>VR</b>, 승마<b>체험</b>(겨울... ",https://blog.naver.com/mssim1987?Redirect=Log&logNo=221738610308,"2층 락커에 신발이랑 짐을 보관하면 된다 아이들 놀이하는 구역 주변으로 엄마아빠 쉴 수 있는 테이블이 많아 :-) 1층에는 뷰티, <b>VR</b>, 승마 <b>체험</b>존, 레스토랑 &amp; <b>카페</b>가 있고 2층에는 신나게 점프할 수 있는 방방이... ",꿈꾸는 엄마 스마일의 일상 도서관,https://blog.naver.com/mssim1987,20191216
[동굴/광명] 광명동굴 - <b>VR</b><b>체험</b>,https://blog.naver.com/y2cherry?Redirect=Log&logNo=222242401424,&lt; <b>VR</b> <b>체험</b> &gt; 점심 전후로 갔을 당시에는 사람이 없었는데 오후 2시 지나고 사람들이 마구 몰려왔다.... ㅋㅋ 그리고 광명동굴 와인동굴 입구로 쭈욱 들어가서 <b>카페</b>까지 꼭 들르시라~ 그러면 이렇게 예쁜 글자... ,냥쌤,https://blog.naver.com/y2cherry,20210213
부평<b>VR</b><b>카페</b> <b>체험</b>!! 엄마와 부평이색데이트 후기! 부평역... ,https://blog.naver.com/virni1011?Redirect=Log&logNo=221647230644,엄마와 <b>VR</b><b>체험</b> 다녀온 후기입미당♡ 도착!! 여기에요!! bad <b>VR</b>은 부평이 직영점 이네요!! 건물로 들어가면... 등 #부평<b>VR</b><b>카페</b> #부평놀거리 #부평방탈출<b>카페</b> #부평이색데이트 #인천<b>VR</b><b>카페</b> #badVR #갈만한곳 #이색데이트... ,포인랜드의 포인,https://blog.naver.com/virni1011,20190913
"드론조종,오토마타 등 놀거리,볼거리 가득! <b>카페</b>,<b>VR</b><b>체험</b>도 있어요!",https://blog.naver.com/leesje41?Redirect=Log&logNo=222378191439,"있던 <b>카페</b>와 1층에 있는 <b>VR</b>체함관, 오락실도 함께 포스팅할게요! 애니메이션 박물관 포스팅 2개도 구경해보세요! *** 춘천 토이로봇관 <b>체험</b>가능한 재미있는 박물관 *** 놀거리, 볼거리 가득한 <b>체험</b>가능한... ",Good ole Days,https://blog.naver.com/leesje41,20210601
김천데이트 김천혁신도시 <b>VR</b><b>체험</b> 오락실 퍼니<b>카페</b>,https://blog.naver.com/prince_ss?Redirect=Log&logNo=222036108566,"김천데이트 김천혁신도시 율곡동 <b>VR</b><b>체험</b> 오락실 퍼니<b>카페</b> 김천 아이랑 가볼 만한 곳 바로 옆 동네라서 정말이지 자주 가는 김천혁신도시, 오며 가며 봤었던 김천 율곡동 오락실 퍼니<b>카페</b> 이번에 김천 아이랑... ",기억을 담는 공간,https://blog.naver.com/prince_ss,20200720
"하남 미사 키즈<b>카페</b>, &quot;효정패밀리아<b>카페</b>&quot; <b>vr</b><b>체험</b>도 있음!",https://blog.naver.com/2dmd2?Redirect=Log&logNo=222413115223,"효정패밀리아<b>카페</b>가 다른<b>카페</b>랑은 다르게 <b>체험</b> 공간이 여러개가 있거든요 asmr룸이랑 <b>vr</b>룸, 크로마키룸 레코팅스튜디오 등등 이 있어요 아기가 완전빠져가지고 집중해서 놀더라고요 엄마도 안찾고 초 집중해서... ",이응소리,https://blog.naver.com/2dmd2,20210628
홍대<b>카페</b> ) 홍대 L7 호텔 / 호텔 컨셉 <b>카페</b> / 홍대 <b>VR</b> <b>체험</b> <b>카페</b>... ,https://blog.naver.com/syh5524?Redirect=Log&logNo=221741199038,좌석이 불편한데 사진 찍다보니 커피 마실 시간도 없더라구요 <b>카페</b>가 아니더라도 <b>VR</b> <b>체험</b>존이 있으니 홍대 놀거리로 추천해요 ! 커플끼리 가면 직원분께서 사진도 찍어주고 친구끼리 가도 너무너무 즐거웠어요,그대 내맘에 들어오면은,https://blog.naver.com/syh5524,20191219
"강다니엘 <b>VR</b> 팬미팅, <b>카페</b>드커넥트에서 미리 <b>체험</b>해 볼까요?",https://blog.naver.com/ptj333?Redirect=Log&logNo=222411050954,"강다니엘 솔로데뷔 2주년 기념 <b>VR</b> 팬미팅에 앞서 사전에 <b>VR</b> <b>체험</b>을 진행하는 이벤트라 놓치지 말고... 당첨자는 6월 30일 수요일에 합니당!!!진행장소는 <b>카페</b>드커넥트, 날짜는 7월5일 오후 2시!... ",스토리블라썸,https://blog.naver.com/ptj333,20210626
강다니엘 <b>VR</b>팬미팅 사전<b>체험</b> 하고 왔어요!!!!,https://blog.naver.com/openupdaniel?Redirect=Log&logNo=222420993796,<b>VR</b>에 생소할 팬들을 위해 추첨으로 <b>VR</b><b>체험</b> 기회를 만든 커넥트 엔터! 일잘한다~ 근데 제가 당첨됐으니 팬... ㅋㅋㅋ ❤앞으로 <b>VR</b>컨텐츠는 계속 될거래요❤ ❤1회용이 아니라는 점❤ 두근두근 약속한 시간에 <b>카페</b>... ,강다니엘 합니다,https://blog.naver.com/openupdaniel,20210705
2020년부터 <b>VR</b><b>체험</b> 종료...소식에 프렌즈<b>카페</b>만 방문... ,https://blog.naver.com/feelingituh?Redirect=Log&logNo=221823402696,제주점 + <b>카페</b> (유일하게 개방된 공간) 카카오 본사 전경 몽쉘게스트하우스에서 체크아웃하고 나온 뒤... 무료 <b>VR</b><b>체험</b>이 없어 아쉬웠지만 그냥 제주 콜라보 제품 구경한다고 가봐도 괜찮고... 커피숍도... ,* 매일 알차게 채움 *,https://blog.naver.com/feelingituh,20200225
일상생활/송도트리플스트릿/<b>VR</b><b>체험</b>하기/다시태어나기,https://blog.naver.com/syloveml?Redirect=Log&logNo=222287164749,"어린아이들은 쇼핑센타와 맛집이 줄지어 있는 이 곳에선 오락실, 키즈<b>카페</b>,,<b>VR</b><b>체험</b>이 제일 좋아할거 라고 생각합니다. 저희 둘이 데이트를 하기 위해서 키즈 <b>카페</b>로 바로 데려갑니다. 물론 그 전에 저희는... ",라블리,https://blog.naver.com/syloveml,20210325
"부산 아이와 갈만한곳 -남포동 K-live X (MR스포츠, <b>VR</b><b>체험</b>)",https://blog.naver.com/violetjjung?Redirect=Log&logNo=221595623878,항상 고민이다 저녁반찬 뭐먹지 처럼ㅋㅋㅋㅋㅋ 이번에 다녀온곳은 키즈<b>카페</b>랑은 다른곳인데... 게임형식^^ <b>VR</b><b>체험</b> 4회중에 통통라이더 2회하심ㅎ 컬링ㅎ 2인 대결방식이라서 입장만했어도 보호자가 같이... ,달빛을 켜다 on°,https://blog.naver.com/violetjjung,20190725
김천 혁신도시 퍼니<b>카페</b>... 4D <b>VR</b> <b>체험</b>을 할 수 있는곳 4D <b>VR</b>... ,https://blog.naver.com/youni7647?Redirect=Log&logNo=221989166090,여러 장르를 선택 할 수 없어 무엇인가 항상 <b>VR</b><b>체험</b>은 아쉬움이 있었는데... 퍼니<b>카페</b>의 4D <b>VR</b>은 너무 재미 있었습니다. ~~ 2번 연속으로 탔는데.. 어떨땐 정말 무서웠습니다. ~~ 은근히 롤러코스터 재미있고..... ,youni Lee,https://blog.naver.com/youni7647,20200603
광주 수완지구 <b>VR</b> 플러스 키즈<b>카페</b>보다 더 추천함 <b>VR</b><b>체험</b>... ,https://blog.naver.com/dbfyzjavbxj?Redirect=Log&logNo=222402373579,아주 즐거워하고 할 게 많아서 100분도 괜찮겠더라구요 . 이상 <b>VR</b> 플러스 수완점 이용 솔직후기 였습니당~ #<b>VR</b><b>체험</b> #진로<b>체험</b> #진로교육 #광주진로<b>체험</b> #광주<b>VR</b> #수완지구<b>VR</b> #수완지구키즈<b>카페</b> #수완지구어린이<b>체험</b>,어썸월드❤️,https://blog.naver.com/dbfyzjavbxj,20210618
"광주 남부대 ICT<b>체험</b>관 <b>VR</b><b>체험</b> / 주차, 기간, 장소",https://blog.naver.com/merryhunter?Redirect=Log&logNo=221595151192,"광주 남부대 ICT<b>체험</b>관 <b>VR</b><b>체험</b> / 주차, 기간, 장소 DIVE INTO PEACE 2019FINA광주세계수영선수권대회... 로봇 <b>카페</b> b:eat도 아메리카노를 만들어주는데 역시 늦게 참가하여 이용해보진 못해 아쉬워요 힐링존에서는... ",요원비의 엄마수업☆ 남매육아♡,https://blog.naver.com/merryhunter,20190725
"하이주, 하이롤 롤러장, 하이온 <b>VR</b><b>체험</b>) + 할인 + 주차 팁",https://blog.naver.com/lllpeach?Redirect=Log&logNo=222240858055,(아빠가 더 신남 주의) 쥬스 하나 사먹고 키즈<b>카페</b>로 다시 돌진 약속했던 <b>VR</b><b>체험</b>도 한번 더! 이번에는 맵 난이도 높여서 도전 역시나 재미있었다고...ㅋㅋㅋㅋㅋㅋ 라스트는 동전 회전목마로 오늘 하루 너무... ,탱구어른이의 기억보관함,https://blog.naver.com/lllpeach,20210212
신촌 <b>VR</b> <b>카페</b> : 브라이트 (VRIGHT),https://blog.naver.com/ssibar1188?Redirect=Log&logNo=221886968409,이상 생애 첫 <b>VR</b><b>카페</b> <b>체험</b>이었습니다. <b>VR</b>화면 영상을 카메라에 담을 수 없는 점이 넘나 아쉽 ㅜ 정말 <b>VR</b>은 눈 앞에 보이는 화면이 다했는데... 아무튼 재미는 있었지만 또 갈지는 잘 모르겠다. 난 너무 답답하고... ,킴찹의 하루살이,https://blog.naver.com/ssibar1188,20200402
디지털 실감 영상관 <b>VR</b><b>체험</b> 초등<b>체험</b> 추천 야간개장,https://blog.naver.com/june_be?Redirect=Log&logNo=222291144193,그대로 <b>카페</b>라고 해도 좋을만큼 멋스럽고 고즈넉해서 정말 좋았다 <b>VR</b><b>체험</b>룸들이 있는 곳도 한옥의 느낌 심지어 밤에도 예쁘다 ❤️ 의자와 테이블마다 놓인 동그란 판들은 핸드폰 무선 충전기다 아니 세상에 이... ,오늘도 밝음♡,https://blog.naver.com/june_be,20210329
서울여행 추천 ♬ 명동 <b>VR</b> <b>체험</b> / 남산타워 <b>카페</b> / 서울타워... ,https://blog.naver.com/syh5524?Redirect=Log&logNo=221626151235,생각보다 <b>VR</b> <b>체험</b>존이 작고 평일이라 사람이 많이 없었어요 방문하는 사람들은 주로 관광객이... 라이언 치즈볼 어드벤처 <b>카페</b> 여기 좀 특이한 커피머신이 있어요 모르고 들어갔다가 좋은 구경했습니다... ,그대 내맘에 들어오면은,https://blog.naver.com/syh5524,20190824
신촌 문화발전소) <b>VR</b> <b>체험</b>전시&amp;영화 &quot;가상이상&quot;,https://blog.naver.com/tjwlsvmflxl?Redirect=Log&logNo=222265229982,전시이다 #<b>VR</b><b>체험</b> #XR<b>체험</b> #가상현실 #가상이상 #3월전시회 #3월전시추천 #3월영화 #3월영화추천 #신촌문화발전소 #<b>카페</b>바람 #신촌루프탑<b>카페</b> #서울전시회 #서울전시회추천 #전시회추천 #<b>vr</b>영화 #<b>vr</b>기기... ,We Are One,https://blog.naver.com/tjwlsvmflxl,20210305
방이동호텔 딜라이트 스위트룸 <b>VR</b><b>체험</b>패키지 조식까지 퍼펙트!,https://blog.naver.com/goldpfeil?Redirect=Log&logNo=222122656380,딜라이트 호텔 1층에 노천 <b>카페</b>가 있는데요.. 여기 분위기가 어마어마하게 좋아서~~ 날씨 좋은날은... <b>VR</b><b>체험</b>패키지 할인이벤트 중이니까 저처럼 꼭 한번 이용해보세요!! ▼▼▼ https://delighthotel.modoo.at/ &quot; &quot; 주소... ,허브허브의 여행 & 패션,https://blog.naver.com/goldpfeil,20201021
[서울/용산] 디지털 파노라마와 <b>vr</b> <b>체험</b>으로 아이들이 가보면... ,https://blog.naver.com/mk345?Redirect=Log&logNo=222402308610,"https://www.museum.go.kr/site/main/reserve/realistic/list 아쉬운 건 <b>vr</b><b>체험</b>은 8세 이상, 130센치의 아동부터... 뭔가 깔끔 그 자체 이미지 내부로 들어가면 마치 <b>카페</b>에 온 것 같은 느낌이 든다. 안락하고 한국적인 한옥에 온... ",내 마음대로 즐기는 공간❤️,https://blog.naver.com/mk345,20210618
잠실 실내 데이트 <b>VR</b><b>체험</b>후기,https://blog.naver.com/mjislove102?Redirect=Log&logNo=221950849016,시국이다보니 이렇게 실내에서 즐길 수 있는 데이트 코스가 필요했거든요. <b>VR</b>하러 오길 참 잘한 것 같네요 아이들 데리고 오기에도 좋은 샤크브이알<b>카페</b>~! 여러분들도 꼭 한번 와서 <b>체험</b>해보시기를 바랄게요 :,ღ웬디의 보물창고ღ,https://blog.naver.com/mjislove102,20200507
[SKT × T프렌즈]메타버스 소셜월드 JUMP <b>VR</b>로 <b>체험</b>하기!,https://blog.naver.com/cocoly00?Redirect=Log&logNo=222303392832,"JUMP <b>VR</b>을 <b>체험</b>한 후기를 말씀드리려고 합니다 JUMP <b>VR</b>이란? Jump <b>VR</b> - Virtual Meetup은 아바타를 기반으로... ㅋㅋ 주스, 응원봉, 탬버린도 상호작용 가능 이외에도 바, 컨퍼런스홀, 클럽, <b>카페</b>, 영화관 등 다양하고... ",앵두의 놀이마당,https://blog.naver.com/cocoly00,20210408
오큘러스 퀘스트2 - 추천 <b>VR</b>게임 무료 14일 <b>체험</b>... ,https://blog.naver.com/zhuda?Redirect=Log&logNo=222342578368,viveport.com 개인적으로 게임을 즐기는 것도 아니어서 우선은 14일 <b>체험</b>을 신청하고... 아래는 <b>VR</b><b>카페</b>에서도 추천 게임으로 많이 알려진 게임 중 바이브포트에 있는 것이다. Synth Riders ON SHAPE CREED Gun... ,나누고 싶은 생각,https://blog.naver.com/zhuda,20210508
구로청년공간 청년이룸의 <b>VR</b>/AI <b>체험</b> 프로그램 이용해보고... ,https://blog.naver.com/digital9ro?Redirect=Log&logNo=222264160157,"이룸<b>카페</b>도 있답니다. 이곳은 자유롭게 이야기를 나누는 나눔공간인데요. 테이블로 된 좌석도 있고, 좌식룸으로 된 곳도 있는 아주 근사한 공간이었습니다. 자 이곳이 이루 JOB <b>VR</b>/AI <b>체험</b> 프로그램이... ",구로구청 공식블로그,https://blog.naver.com/digital9ro,20210304
철산호텔  <b>VR</b> <b>체험</b> 할 수 있는  광명 제이에스부티크호텔,https://blog.naver.com/dltmfsla0402?Redirect=Log&logNo=222279272256,1층 라운지 <b>카페</b> 및 조식 공간 이곳에서 잠시 쉴 수 있도록 머무는 공간과 든든한 하루를 시작 할 수... 혜택바로 <b>VR</b> 기계!!!! 무료함을 날려 줄 <b>VR</b>기기가 있어서 이날 슈리 혼자서 어찌나 잘 놀았는지요. 다양한... ,이슈리의 특별한 하루 :),https://blog.naver.com/dltmfsla0402,20210318
해운대 키즈<b>카페</b> 키즈앤패밀리 <b>VR</b>테마파크 무료 <b>체험</b> 하실분~?,https://blog.naver.com/nowababa?Redirect=Log&logNo=221701816602,해운대 키즈<b>카페</b> 키즈앤패밀리 <b>VR</b>테마파크는 단순한 키즈<b>카페</b>가 아닌 아이들이 가상 현실(<b>VR</b>)+증강 현실(AR)을 <b>체험</b>해 보면서 미래를 꿈꿔볼 수 있는 프리미엄 키즈<b>카페</b>인데요. 해운대 키즈<b>카페</b>... ,알콩달콩 뚱딴지네,https://blog.naver.com/nowababa,20191108
"<b>VR</b>,<b>카페</b>,독서를 한번에? - 민송도서관 <b>체험</b>기",https://blog.naver.com/semyung1991?Redirect=Log&logNo=222312067333,"따라서 공부, 독서 하는 공간뿐만 아니라 <b>VR</b>, <b>카페</b>, 편집실 등 다양한 시설을 갖추고 있습니다.... CHARM<b>체험</b>교육센터 안내 내부 크로마키실 모습(출처: 세명대학교 공식홈페이지) CHARM경험교육센터에서 <b>VR</b>... ",세명대 공식 블로그,https://blog.naver.com/semyung1991,20210422
브리즈브이알<b>카페</b>(<b>VR</b><b>체험</b>) - 주말에 가볼만한 곳,https://blog.naver.com/zkvpdls0536?Redirect=Log&logNo=221285921796,가격은 참고하고 이번 주말 뭔가 특별하게 놀고 싶다면 브리즈<b>VR</b><b>카페</b> <b>체험</b>도 재밌는 경험으로 추억 쌓고 올 수 있다. &quot; 본 포스팅은 해당업체로부터 소정의 고료를 지급받아 주관적으로 작성되었습니다. &quot;,카페인의 게임 라이브러리™,https://blog.naver.com/zkvpdls0536,20180528
강남 <b>VR</b><b>카페</b> - 솔직한 <b>체험</b>후기,https://blog.naver.com/oh_cafeware?Redirect=Log&logNo=221223217477,오늘은 강남 <b>VR</b><b>카페</b> <b>체험</b>기를 나눌까 해요 밥먹고 뭘할까 하던중 눈에띈곳! <b>카페</b>이름은 RED <b>VR</b>인데요. 이름답게 화려한 LED간판이 맞이해주네요. 그것도 이름답게~ 시~~뻘겋게 위치는 이곳이였어요. CGV... ,은환씨 X 레어케어,https://blog.naver.com/oh_cafeware,20180306
"넓은 키즈 <b>카페</b> 추천, 플레이티카 구리 <b>VR</b> <b>체험</b>까지~",https://blog.naver.com/lemontree1116?Redirect=Log&logNo=221513392248,있도록 <b>카페</b>테리아를 딱 중앙에 둬서 이리저리 즐거워 땀나도록 뛰는 모습을 보며 아이스아메리카노를 마시며 잠시 앉아 책도 읽을 수 있어 슬며시 추천드려요. 워낙 큰 실내 놀이터라 암벽 등산이나 <b>VR</b> <b>체험</b>... ,레몬트리1116,https://blog.naver.com/lemontree1116,20190414
홍대 <b>VR</b><b>카페</b> :: 홍대... 추천하는 샵브이알 2호점에서 <b>VR</b><b>체험</b> XD,https://blog.naver.com/iruka235?Redirect=Log&logNo=221088452889,이라는 표정 ㅋㅋㅋ 귀신이랑 마주쳤을 때 피하면 안 되는 거였는데나도 모르게 도망가 버렸다가 죽음 ^.^ㅋㅋㅋㅋㅋ 그래도 참 즐거운 홍대 <b>VR</b><b>카페</b> <b>체험</b>이었습니다 ㅋㅋㅋ 홍대 <b>VR</b><b>카페</b>에서 게임해보고 싶은... ,BREATHE,https://blog.naver.com/iruka235,20170903
<b>VR</b> 키즈<b>카페</b> 몬스터타운 <b>체험</b>후기,https://blog.naver.com/gardenhair?Redirect=Log&logNo=221366196932,있지만 스태프분들 너무나 친절하시고 아이들이 살짝 경험해보기엔 나쁘지 않은 것 같아요 #몬스터타운 #위례<b>vr</b> #위례가볼만한곳 #<b>vr</b><b>체험</b> #키즈<b>카페</b> #롤라장 #실내테마파크 #스크린야구 #게임방 #위례몬스터타운,가든헤어 휴이,https://blog.naver.com/gardenhair,20180927
<b>VR</b> <b>카페</b>: <b>VR</b> <b>카페</b>에서 <b>VR</b>게임 <b>체험</b>하자!,https://blog.naver.com/kinxtime?Redirect=Log&logNo=221090878215,"오늘은 가족, 친구, 연인과 함께 <b>VR</b>을 <b>체험</b>할 수 있는 <b>VR</b> <b>카페</b>에 대해 알아보겠습니다! &lt; 누구나 손쉽게 조립할 수 있는 <b>VR</b> 카드보드&gt; <b>VR</b>(Virtual Reality)이란 말 그대로 가상현실을 말합니다. 소니의 PS <b>VR</b>... ",KINX 공식 블로그,https://blog.naver.com/kinxtime,20170906
수내역 <b>vr</b><b>카페</b> BiKi 아이들과 함께 <b>vr</b><b>체험</b>하기 좋아요.,https://blog.naver.com/majara78?Redirect=Log&logNo=221258174242,<b>vr</b><b>체험</b> <b>vr</b><b>카페</b> <b>vr</b><b>체험</b><b>카페</b> 요즘 핫한 <b>vr</b><b>카페</b>를 가보았어요. 수내역 근처에 몇 군데 <b>vr</b><b>카페</b>가 생겼는데요. 그중 이미지로 볼때 가장 환해보이던 비키<b>카페</b>를 셀렉~~!! 어린이와 함께 <b>체험</b>해보았습니다. 30분 70분... ,두근두근일상여행중,https://blog.naver.com/majara78,20180421
대구<b>vr</b><b>체험</b>/ 경대북문플레이<b>vr</b>게임 / <b>vr</b>룸<b>카페</b>,https://blog.naver.com/lkhhwa?Redirect=Log&logNo=221333591926,다양한 <b>vr</b>게임이 있는 경대북문플레이<b>vr</b>게임 더운여름에 시원한 실내<b>체험</b>장소로 <b>vr</b>룸<b>카페</b> 딱이였답니다. 그리고 나오는길에 봤는데 원하는 게임있으면 미리 쿠폰예약해두시면 좋구요. 그리고 담에는 우리딸이... ,알콩 달콩 두아이의 소소한 이야기,https://blog.naver.com/lkhhwa,20180806
"만들기 장소. 자바라 낚시<b>카페</b>, 한국전통문화전당 <b>VR</b><b>체험</b> 공간",https://blog.naver.com/jeonju_city?Redirect=Log&logNo=221282013258,되어가면서 <b>VR</b> <b>체험</b><b>카페</b>와 <b>VR</b>을 이용한 게임기기가 아이들에게 큰 인기를 끌고 있습니다. 하지만 <b>VR</b> <b>체험</b><b>카페</b> 비용과 게임기의 가격이 만만치는 않아 쉽게 접하기는 어려운데요. 전주에 전국 3곳에서만... ,전주시 공식 블로그,https://blog.naver.com/jeonju_city,20180523
"[홍대 이색데이트 <b>VR</b> <b>카페</b>] 홍대 <b>VR</b> <b>체험</b>, 게임이 가능한... ",https://blog.naver.com/mcteens?Redirect=Log&logNo=220887043159,해봐야지만 알 수 있지요 얘는 자동차게임~ 흔한 게임 같으면서도 <b>VR</b> 게임은 다른 느낌입니다 ㅋㅋ 홍대 샵브이알은 <b>VR</b> 게임을 눈치안보고 맘껏(?) 즐길 수 있는 <b>카페</b>입니다 강남에 <b>VR</b> 무료 <b>체험</b> <b>카페</b> 갔을때는... ,"슈퍼문 Fashion, Golf, Life Log",https://blog.naver.com/mcteens,20161215
"서현 샾플레이스, <b>VR</b> <b>체험</b><b>카페</b>",https://blog.naver.com/annie6023?Redirect=Log&logNo=220970605100,<b>VR</b> <b>체험</b><b>카페</b>!를 포스팅해보려고 합니다~~ 이름하야 서현 샾플레이스! 먼저 가게 인테리어 살짝쿵 보고 가시죠. 가게 인테리어 넘나 내 방으로 꾸미고 싶은 스타일이라능 손님 빠지는 순간 재빠르게 찍었다능... ,지파로그,https://blog.naver.com/annie6023,20170330
"<b>VR</b><b>체험</b> in <b>카페</b>, 쇼핑몰",https://blog.naver.com/dlckato109?Redirect=Log&logNo=221047207793,"이제 CGV 공사도 끝났으니 쇼핑, 먹방 모든 걸 해결할 수 있잖아요ㅋㅋㅋㅋㅋㅋ 그리고 기억남는 데이트로 <b>체험</b>도 하고 <b>VR</b> <b>카페</b>는 아직 가보지 않아 모르겠지만 개인적으로 꺼려지는 이유가 저희 동네의... ",여니블로그,https://blog.naver.com/dlckato109,20170709
"위례몬스터타워 - <b>VR</b> <b>체험</b> , 전동킥보드 등 신세계 위례 키즈<b>카페</b>",https://blog.naver.com/tjd03200320?Redirect=Log&logNo=221457335196,위례몬스터타워 <b>VR</b>만있는줄 알았는데 너무 다양한 <b>체험</b>거리가 있어서 두배로 재미있었네요. 키즈<b>카페</b>에 전동키보드까지 그리고 매점에도 Cctv가 각 놀이공간에 보여지니 아빠들이 많이 누워서 보시고ㅋㅋ... ,시아시후맘 육아 일상 인테리어 맛집 반려견 배우,https://blog.naver.com/tjd03200320,20190202
강남 <b>VR</b><b>카페</b> 더리얼에서 <b>VR</b><b>체험</b> 해보기~,https://blog.naver.com/1eunnue?Redirect=Log&logNo=221051772308,이번에 강남에서 초대형 커브드 스크린과 <b>VR</b>기기를 <b>체험</b>할 수 있는 <b>VR</b><b>카페</b> 더리얼에 다녀왔어요~~ 무려 200인치 초대형 커브드 스크린이 있다는 소문에 기대를 많이 하고 갔어요~ 엘리베이터를 타고 4층에... ,으농블로그 ♡ 손그림 일러스트 그리기,https://blog.naver.com/1eunnue,20170716
[대학로<b>VR</b><b>카페</b>]대학로이색데이트 &lt;EVR그라운드&gt;에서 <b>VR</b><b>체험</b>... ,https://blog.naver.com/hj16653?Redirect=Log&logNo=221446092568,"옴니룸은 발동작 감지를 위해 센서가 부착된 신발을 착용하게 된다 대학로<b>VR</b><b>카페</b> &lt;EVR그라운드&gt; 초코, 라떼를 마시며~ 대학로<b>VR</b><b>카페</b> &lt;EVR그라운드&gt; <b>체험</b>중 사장님의 친절한 안내로 <b>VR</b><b>체험</b> 시작!! 요... ",jee diary,https://blog.naver.com/hj16653,20190119
서울<b>VR</b><b>체험</b><b>카페</b> : '영<b>VR</b> 성신여대점' 데이트하기 좋은... ,https://blog.naver.com/wooshim90?Redirect=Log&logNo=221235876578,서울<b>VR</b><b>체험</b><b>카페</b> 영<b>VR</b> 성신여대점 데이트하기 좋은 성북구<b>카페</b> 요즘 <b>VR</b><b>체험</b>이 방송에서 많이 나오는데 하는 사람 보는 게 웃겨서 해보고 싶었다 그래서 성북구<b>카페</b>를 중에 데이트하기 좋은 서울<b>VR</b><b>체험</b><b>카페</b>가... ,심지썸띵,https://blog.naver.com/wooshim90,20180323
