title,link,description,bloggername,bloggerlink,postdate
"거참, <b>통화하기</b> 힘들군요",https://blog.naver.com/sarauu01?Redirect=Log&logNo=220793623795,고객센터(123번)로 전화하면 '가까운 지점으로 연결해드리겠슴미당~ 띠로링(<b>통화</b>종료음)'해버리는데.. 가까운 지점이 없는건가요? 고객센터의 상담사분께서 바쁜건 알겠지만 '좀있다 다시하셈' 이나 'X나... ,이웃집 청순가련병약미소녀,https://blog.naver.com/sarauu01,20160822
"[D+47,48]饿了么황먼지가 제일조아,친구들이랑 위챗<b>통화하기</b>... ",https://blog.naver.com/yj5229948?Redirect=Log&logNo=221259921153,오랜만에 <b>통화</b>했다 여기에 김아영까지 있으면 우리진짜 시끄럽고 난리난다 보고싶은 내 칭구들(● ˃̶͈̀ロ˂̶͈́)੭ꠥ⁾⁾ <b>통화</b>를 후다닥 마치고 운동 긔긔 오늘 스피닝수업은 남자선생님이셨다 파워풀해서... ,美好一天！,https://blog.naver.com/yj5229948,20180424
안드로이드와 아이폰 영상<b>통화하기</b>,https://blog.naver.com/mainter?Redirect=Log&logNo=60116401344,그리고 저렇게 누르면 그냥 <b>통화</b>만 되요. 가운데에 위치해 있는 Tango를 눌러야 영상<b>통화</b>가 됩니다. 그런데요 참 재미있는게 제가 저 버튼을 누르면 누른 사람의 카메라를 통해서만 보내져요. 상대방도... ,TEA HOUSE,https://blog.naver.com/mainter,20101011
알바찾는데 <b>통화하기</b> 부끄러운 사람들을 위한 알바어플,https://blog.naver.com/gkwjd518?Redirect=Log&logNo=221596554141,낯선 사람들과 <b>통화 하기</b> 떨리시는 분들 계시죠? 이런 분들을 위한 알바 어플이 나왔습니다 이 곳은 서류전형 없이!! 바로 면접을 볼 수 있게 도와주는 어플인데요 이렇게 프로필 입력 후 면접 가능 시간을 선택... ,태쥬베베♥,https://blog.naver.com/gkwjd518,20190726
네이버 고객센터와 <b>통화하기</b>,https://blog.naver.com/anyk0930?Redirect=Log&logNo=220006002019,(그리고 개인정보 변경하는것도 뭔가 잘 안되서 한참을 버벅댔다.) 혹시나 고객센터 <b>통화</b>를 원한다면 이 번호를 검색해서 편해지길 바라며... 네이버 고객센터 전화번호 평일 9시~6시 1588-3820,I me myself ♥♡♥,https://blog.naver.com/anyk0930,20140521
여러명이서 <b>통화하기</b>,https://blog.naver.com/ghtnqlc1004?Redirect=Log&logNo=130019231912,M-&gt;A 그리고 연결이 되면 [<b>통화</b>버튼]한번 누르고 B 전화번호를 적습니다. 그리고 [<b>통화</b>] 그러면 B와 연결이 됩니다. 이 상태에서 [<b>통화</b>]를 한번더 눌려줘야만 3자<b>통화</b>가 가능해집니다. 그리고 3명 이상의... ,이쁜건 너무 많아요..히히,https://blog.naver.com/ghtnqlc1004,20070623
"[책] 터틀트레이딩 1 (재무제표, 다트시스템, 주담 <b>통화</b>법... ",https://blog.naver.com/dicecasts?Redirect=Log&logNo=222150296084,"(주담) <b>통화하기</b> 전에는 매우 망설여지지만, 막상 해보면 별거 아님 중요한 것은 내용을 잘 모르면... 주담통화법 등에 대해 적어 보았습니다. 시간이 되면 각각의 아아템들을 좀 더 세부적으로 정리해 보도록... ",지적호기심.활자중독.새로운 시도,https://blog.naver.com/dicecasts,20201121
부천중동 리틀베어 키즈카페에서 세이뷰070으로 영상<b>통화하기</b>,https://blog.naver.com/say_view?Redirect=Log&logNo=60112412337,꺼내 <b>통화</b>를 시도해보려고 합니다. 전화기의 무선랜검색 버튼을 누릅니다. 무선랜 서비스를 검색하고... 이제 무선랜이 연결되어 안테나가 잘 잡혔어요^^ 영상전화를 걸 번호를 누르신 후 [영상<b>통화</b>] 버튼을... ,세이뷰070 - 뷰걸의 인터넷전화 세상,https://blog.naver.com/say_view,20100804
전화<b>통화하기</b> 2,https://blog.naver.com/daesuns?Redirect=Log&logNo=11628011,<b>통화</b>할 수 있어요? A: 제인은 지금 자리에 없어요. B: When can I speak with her? ------------------------------ A: She's on another line. B: 킴이 전화했다고 전해주세요. A: 지금 <b>통화</b>중... ,L'Elisir d'amore,https://blog.naver.com/daesuns,20050407
이야기 [날씨탓인가? 서울은 미세먼지ㅠㅠ 부모님과 <b>통화하기</b>],https://blog.naver.com/docver?Redirect=Log&logNo=220669850907,"그렇게 한달여만에 약 20분이라는 <b>통화</b>를 했다. 엄마를 통해 아부지의 이야기도 짧게 들을 수 있었다. 엄마와 <b>통화</b> 후, 아부지와도 <b>통화</b>를 해보았다. 아부지는 여태 아프다고 하신적이 한번도 없었는데. 지난날... ",경태의 자전거 이야기 (서울시 광진구 자양동 582-13),https://blog.naver.com/docver,20160330
전화기만들기와 친구와 <b>통화하기</b> 활동을 해보았습니다~^-^,https://blog.naver.com/kks8857?Redirect=Log&logNo=222216314082,,세상의 빛이 되는 사동세광어린이집입니다.,https://blog.naver.com/kks8857,20210122
스피커폰으로 <b>통화하기</b>,https://blog.naver.com/waterforest-na?Redirect=Log&logNo=221805241721,제일 이해할 수 없는 것 중 하나가 공공장소에서 스피커폰으로 <b>통화하</b>는 사람이다. 아무리 생각하고 이해를 하려고 해도 이해할 수 없다.,waterforest-na님의블로그,https://blog.naver.com/waterforest-na,20200211
밴드 멤버들과 그룹콜로 <b>통화하기</b>!,https://blog.naver.com/jamesoft?Redirect=Log&logNo=220862076006,최대 30명까지 밴드 채팅방에서 그룹콜로 <b>통화</b>할 수 있어요. 음질은 보통입니다. 그룹콜은 채팅방에 있는 메뉴입니다. 그룹콜을 시작하면 멤버들에게 알림이 갑니다. 스피커폰이나 이어폰을 사용해서 <b>통화</b>할... ,행동은 말보다 그 소리가 크다,https://blog.naver.com/jamesoft,20161115
퀵충전/좋은음질/<b>통화하기</b>좋은무선이어폰/좋은착용감,https://blog.naver.com/gslook?Redirect=Log&logNo=221266665419,"전작 아이콘X는 짧은 배터리시간, <b>통화</b>시 한쪽만 들린다는 점 등... 아쉬운 점이 많았습니다. 2018년형... <b>통화</b>품질, 음악음질 모두 양호 (무선이어폰 특성상 비슷한 금액의 유선이어폰과는 비교할 수 없겠지요?... ",일상 BLOG,https://blog.naver.com/gslook,20180502
카카오톡 5.0 업데이트  : 페이스톡 : 카톡으로 영상<b>통화하기</b> :D,https://blog.naver.com/hoishym?Redirect=Log&logNo=220391855714,카톡에서도 영상<b>통화</b> 영통이 가능하데요!!!!!!!!ㅎㅎㅎㅎㅎㅎ 앱스토어에 가셔서 '카카오톡' 검색하시면... 무료<b>통화</b> 눌러주세요. 보이스톡 말고 '페이스톡' 영상필터효과 가능 **** 영상 필터는 5가지 있어욥!!!... ,: 오늘도 뜨겁게 후회없게 죽을힘을 다해 :,https://blog.naver.com/hoishym,20150616
[돼끼맘의 엄마표영어] 산타와 영상<b>통화하기</b>,https://blog.naver.com/fresh419?Redirect=Log&logNo=221748822519,"타이밍을 놓쳐서 좀 늦게 찍었네요. ㅎㅎ 아빠가 산타와 영상<b>통화</b>를 시켜주었어요. 5학년은 대답도 안하지만 1,3학년은 열심히 대답하네요. 이런어플도 있고 MERRY Christmas ~☆ -돼끼맘의 엄마표 영어-",돼끼맘의 엄마표영어,https://blog.naver.com/fresh419,20191225
&quot;미소금융 <b>통화하기</b>도 힘드네&quot;_ 이건호KDI교수 관련,https://blog.naver.com/kdi_school?Redirect=Log&logNo=70076796460,이건호 한국개발연구원(KDI) 국제정책대학원 교수는 &quot;미소금융 사업이 성공하려면 금융전문가 뿐만 아니라 사회복지 업무를 수행할 수 있는 전문가들도 충원돼야 한다&quot;며 &quot;은행원과 민간 자원봉사자들로... ,KDI국제정책대학원 공식블로그ㅤㅤ,https://blog.naver.com/kdi_school,20091228
그룹<b>통화하기</b>에 꽤 편한 어플 T그룹on 사용했네요..,https://blog.naver.com/cnswk112743?Redirect=Log&logNo=20201270450,그룹<b>통화 하기</b> 꽤 편한 어플인데요. T그룹on이라고 하는 거예요.. 여기에서 다운 받을 수 있는 무료어플입니다. http://goo.gl/xd2SNV 예전에 있던 그룹통화의 경우에는 일초씩 늦거나 와이파이 터지는 곳에서만... ,윤지쓰 하우쓰,https://blog.naver.com/cnswk112743,20131215
"공매 담당자 및 구청 담당자,공인중개소 전화 <b>통화하기</b>",https://blog.naver.com/juhan65?Redirect=Log&logNo=222077180839,"1. 공매 담당자 : 물건을 자세하고 친절하게, 건물에 대해서 체크해야할 부분까지 설명을 아주 잘해주셨음. 2. 구청 담당자 : 역시 공무원은 공무원, 사무적인 말투. 뚜렷하게 얻어낸 정보는 없다 3. 공인중개소... ",한윤재(심상사성) 블로그,https://blog.naver.com/juhan65,20200901
조카랑 callar <b>통화하기</b>,https://blog.naver.com/pbcsa423?Redirect=Log&logNo=221648308299,callar 어플로 <b>통화하</b>면 오이로 산타로 공주로 등등 여러가지 모습으로 변신할 수 있어서 조카가 너무 좋아한다 조카와 놀아주기 기술이 없는 나는 이 어플을 좋아한다ㅠㅠ,리사하우스 LisaHouse :),https://blog.naver.com/pbcsa423,20190915
페이스북 메신저: 폴란드 친구와 무료 영상<b>통화하기</b>!,https://blog.naver.com/crazystylesh?Redirect=Log&logNo=221224370540,"가끔 <b>통화</b>를 하곤한다! 둘다 페북을해서 종종 연락을 하곤한다! 이친구들이랑은 노르웨이애서 만났다가... 암튼, 지금은 그런 친구들과 <b>통화</b>를 하곤한다. 울 엄마랑도 <b>통화</b>를 시켜줬었는데 엄마한테 보내는... ",고릴라의 맘 가는 대로!,https://blog.naver.com/crazystylesh,20180308
(회화) 이해표현 / <b>통화하기</b>,https://blog.naver.com/anjimade?Redirect=Log&logNo=221982835119,"이해해? ¿Me entiendes? ¿Me comprendes? 들려? ¿Me oyes? 이해못했어 No entiendo. No comprendo. 더 천천히 부탁해요 Más despacio, por favor. 다시한번 Otra vez ## 있어요? ¿Está ##, por favor?... ",Small TALK,https://blog.naver.com/anjimade,20200529
전화 <b>통화하기</b>도 힘들고... 히딩크님 앞에서 뵙는 데까지 5개월... ,https://blog.naver.com/kkpshy?Redirect=Log&logNo=221491517103,첫 <b>통화</b>로 강의 가능하냐고 물어보셨습니다. 첫 <b>통화</b>에서 제가 바로 거절을 했었습니다. &quot;죄송하지만 제가 강의 따로 하지 않습니다.&quot;라고 말이죠.. 근데 며칠 지나 다시 그룹장분께 전화가 왔습니다. “블로그를... ,히딩크의 토지투자 트레이닝,https://blog.naver.com/kkpshy,20190318
"와, <b>통화하기</b> 진짜 어렵답니다.",https://blog.naver.com/bmasterlbw?Redirect=Log&logNo=221167594344,전에는 춤에 대한 흥미가 별로 없었는데 요즈음 노래만 듣는다면은 춤이 저도 모르게 납니다. 아이돌 춤은 조금 복잡하지만 그래도 열~심히 홀로 배워보고 있습니다. 정말로 어렵죠. 얘들은 어떻게 추지?... ,뉴스타트,https://blog.naver.com/bmasterlbw,20180104
[DAY 002] 아빠와의 <b>통화</b>_2021년5월25일 화요일_3분2초,https://blog.naver.com/daran_s?Redirect=Log&logNo=222368039502,어쩐 일인지 통화 음질이 좋지 않은데다 아빠가 말씀하기가 힘들다 하셨다. 말이 잘 안나온다고 쉰 목소리로 뻥긋 거리신다. <b>통화하기</b> 전에 이런 저런 얘길 해야겠다 생각했는데 막상 말을 못하는 아빠에게... ,나의 달다란 하루_,https://blog.naver.com/daran_s,20210526
카카오톡 영상<b>통화</b> (페이스톡) 하는 방법-어르신들 사용법,https://blog.naver.com/kksjyc?Redirect=Log&logNo=222185319016,"<b>통화하기</b>를 누릅니다. 6. 페이 스톡을 누릅니다. 그럼 띵띠띵띠딩 하면서 영상통화가 연결됩니다. 간단하지만, 저도 자주 사용하지 않으면 알아도 잊어버린답니다. 조금이나마 도움에 되었으면 좋겠습니다. 그럼... ",마포프레스티지자이 단지내 중앙부동산,https://blog.naver.com/kksjyc,20201225
[무료전화] 바이버로 무료로 <b>통화하기</b>,http://googler.pe.kr/wordpress/index.php/archives/5440,[무료전화] 바이버로 무료로 <b>통화하기</b>,구글오프라인 사용자모임(Googler),http://googler.pe.kr/wordpress,20111103
pc로 스마트폰 문자 및 <b>통화하기</b>,https://blog.naver.com/goodcine?Redirect=Log&logNo=220885869475,이 앱으로 pc에서 스마트폰(안드로이드)의 문자 수발신은 물론 <b>통화</b>까지 된다. 현재까지는 <b>통화</b> 기능이 SK에만 제한돼 있다는게 아쉽다면 아쉽다. 1. 스마트폰 앱 깔기 안드로이드... ,굿씨네의 영화 이야기:내 멋대로 영화보기,https://blog.naver.com/goodcine,20161214
"05, 수요일) 빨래 하는 법을 배워요!! 아빠랑 영상<b>통화하기</b>!!",https://blog.naver.com/ksdjjang1212?Redirect=Log&logNo=221369426661,재밋었어용? ㅎㅎ 오늘은 할머니랑 교회 갔지요? ㅎㅎ 리듬감 있게 치네 ㅎㅎㅎㅎ 집에 와서는 아빠랑 영상<b>통화 하</b>지요? 우리 딸! 아빠가 얼른 갈게요!! 코 자자 ㅎㅎ 안뇽 뿅!,하루하루 즐겁고 행복하게 ^^,https://blog.naver.com/ksdjjang1212,20181002
베트남국제전화 시골에서는 <b>통화하기</b> 힘들어요.,https://blog.naver.com/blue7377?Redirect=Log&logNo=50125264962,"입금하면 몇분내로 카드번호도 빨리 보내주고 <b>통화</b>도 잘된다고 글을 봤는데.. 인터넷에서 사는거... 구입할수있지만, <b>통화</b>음질도 떨어지고 요금도 좀 비싸다는 얘기가 많아요. 사는곳이 시골이라서... ",추억의 바램,https://blog.naver.com/blue7377,20111102
커피마시기 친구랑 <b>통화하기</b>,https://blog.naver.com/numsue?Redirect=Log&logNo=220086580509,커피마시기 친구랑 <b>통화하기</b>,별이어멈,https://blog.naver.com/numsue,20140809
카카오톡 업데이트 !!! 페이스톡~ 카카오톡으로 영상<b>통화하기</b>♡,https://blog.naver.com/girlsize23?Redirect=Log&logNo=220392391546,카카오톡으로 드디어 영상<b>통화</b>를 할 수 있게 되었어요! 헐헐헐 페이스톡이라는거예요! 업데이트를... 그럼 5.0.0으로 업데이트 하시면 됩니당 ㅋㅋ 이번 업데이트에는 영상<b>통화</b> 서비스와 카카오TV 서비스와... ,MJO,https://blog.naver.com/girlsize23,20150617
채용정보-인사담당자와 <b>통화하기</b>,https://blog.naver.com/4yourwork?Redirect=Log&logNo=221115830238,"삼성폰과 아이폰의 차이 처음 삼성폰과 애플폰이 출시되었을 때, 시계앱은 큰 차이가 있었다. 위의 붉은색 원에 있는 앱 이미지를 보면 어떤 차이가 있는지 알겠는가? 가장 큰 특징은 표준시간대(UTC+09:00, 서울)... ",4yourwork님의블로그,https://blog.naver.com/4yourwork,20171013
인터넷으로 핸드폰 영상<b>통화하기</b>,https://blog.naver.com/jsykorea1900?Redirect=Log&logNo=80044725705,첫 번째는 SHOW를 지원하는 상대방 휴대폰 전화번호를 눌러서 <b>통화하</b>는 것과 SHOW 웹사이트 영문 ID를 입력해 웹 상으로 영상전화를 하는 방법이다. 먼저 숫자/폰 통화를 이용해 SHOW폰과 영상전화를 연결해보자... ,아빠와 아들,https://blog.naver.com/jsykorea1900,20071113
외국에서 저렴하게 <b>통화하기</b> - 현지 심카드 구매,https://blog.naver.com/juny21c?Redirect=Log&logNo=220868965007,"그리고 line등과 같은 메신저를 활용하면, 데이터를 이용해서 <b>통화</b>도 가능하다. 현지의 가장 최신 정보는 현지에 있다. 그런 정보는 자국어로 찾아 보면 된다. 그럼 구글 번역기를 사용하여 현지에서 검색을... ",Transporter,https://blog.naver.com/juny21c,20161123
와이브로(WIBRO)폰으로 VoIP <b>통화하기</b>... Fring,https://blog.naver.com/lucetius?Redirect=Log&logNo=40082588414,"기본적으로 VoIP <b>통화</b>를 하기 위해서는 사용자 단말이 다음과 같은 조건만 갖고 있으면 된다. 1)... VoIP <b>통화</b>를 시도해보았다. 사용한 프로그램은 Fring (http://www.fring.com), 이스라엘에서 만든 모바일... ",여유로운 삶,https://blog.naver.com/lucetius,20090729
"필리핀영어캠프, 베스트영어캠프 아이와 <b>통화하기</b>~",https://blog.naver.com/docgidong?Redirect=Log&logNo=110188220607,전화통화는 토요일에만 가능합니다. 꼭 <b>통화하</b>셔야 될 내용이 있으시다면 저희 베스트영어캠프 홈페이지에 글을 올려주시거나 서울사무실로 연락주시면 수업시간이 아닌 때에 바로 연락을 드리고 있으니... ,♬빙글빙글크리쓰,https://blog.naver.com/docgidong,20140401
COFFEE (번나비 커피) 에서 세이뷰070으로 영상<b>통화하기</b>,https://blog.naver.com/say_view?Redirect=Log&logNo=60113630480,신호세기도 강하고 인제 세이뷰070으로 영상<b>통화</b>할 일만 남았네요. 세이뷰070을 갖고 있는 친구에게 영상<b>통화</b>를 하려고 합니다. 번호를 누르시고 화면의 [영상<b>통화</b>]를 가볍게 터치하세요~~ 영상전화로 연결... ,세이뷰070 - 뷰걸의 인터넷전화 세상,https://blog.naver.com/say_view,20100823
22개월.유플러스 아이들나라 핑크퐁과<b>통화하기</b> 신박육아템,https://blog.naver.com/valls?Redirect=Log&logNo=221233485462,밥먹이기 새로운 아이템발견 핑크퐁과 <b>통화하</b>며 밥먹이기ㅋㅋㅋㅋ . 육아에 잔기술도같이는다 . #핑크뽀오오옹 #핑크퐁사랑 #육아는아이템빨 #그렇게핑크퐁과밥한그릇다먹음 #내가밥을같이못먹는게함정... ,아키맘의 Life Magazine,https://blog.naver.com/valls,20180320
10분 영어공부 : 외국인과 <b>통화하기</b>,https://blog.naver.com/sonsk329?Redirect=Log&logNo=222112576183,1. He is speaking to the teacher right now. 2. Could I leave a message for him? 3. I'm afraid Sera's on another line. 4. I think you've got to the wrong number. 5. I don't understand.... ,아름답고 즐거운 세상,https://blog.naver.com/sonsk329,20201011
"건강보험공단 전확번호, 전화해도 <b>통화하기</b> 어려운 이유",https://blog.naver.com/tkd1065?Redirect=Log&logNo=222228808826,건강보험공단 대표번호 1577-1000 건보 상담사에게 지역건강보험공단 전화번호 알려달라하면 감점을 먹는군요... 처음알앗네요,오늘과 다른 내일(부의성장),https://blog.naver.com/tkd1065,20210202
완전 IT초보의 아이폰 사용기(2) - <b>통화하기</b>-,https://blog.naver.com/insmen?Redirect=Log&logNo=70075429297,- 최근<b>통화</b> 목록 중에 다시 걸고 싶은 번호를 살짝 터치하면 됩니다. 전 처음에 깜짝 놀랐습니다. 보통의 전화는 목록에서 전화번호를 확인하면.. 수신 / 발신 혹은 <b>통화</b>시간 이런 것들을 확인할 수 있었는데..... ,우물안 올챙이 세상 엿보기!!,https://blog.naver.com/insmen,20091210
"와, 전화<b>통화하기</b> 진짜 어렵지요.",https://blog.naver.com/silver0f1?Redirect=Log&logNo=221359003740,오늘은 핸드폰으로 글을 써가고 있네요.^^ 타자가 쫌 어색하네요. 너무 손글씨로 긴 글을 쓰고 심지어는 계약서도 손글씨로 쓸 때가 많으니까 타자로 글을 쓸 때 틀리는 것도 많고 부담스럽기까지 하네요. 그다지... ,(주)캐시로드 부천 협력사,https://blog.naver.com/silver0f1,20180914
1339 질병관리본부랑 <b>통화하기</b>,https://blog.naver.com/anajiyoung?Redirect=Log&logNo=221821610691,"코로나씨 때문에 내 몸이 어느때보다 예민하다. 일상의 소중함을 깨고 싶지 않은데, 평소에 그냥 넘어갈 것들이 참고 있던 질문 본능을 깨웠다. 1339를 시도했다. 일반인이면 1번, 의료진이면 2번 나는 일반인... ",ANA BANG,https://blog.naver.com/anajiyoung,20200223
HD VOICE를 말하다13-스마트알림 부재중으로 HD<b>통화하기</b>,https://blog.naver.com/mfgproject?Redirect=Log&logNo=50147577655,"스마트 알림이란 책상등에 올려져 있다가 사용자가 손으로 들면, 자동으로 화면에 부재중<b>통화</b>, 메세지... <b>통화</b>!!! 스마트 알림이 있어서 더욱 편리해서 좋았던 HD보이스 <b>통화</b>였습니다 다음 포스팅을... ",mfgproject님의블로그,https://blog.naver.com/mfgproject,20120812
iKON 아이콘 바비 BOBBY 영상<b>통화</b> 후기 #영통팬싸,https://blog.naver.com/highe?Redirect=Log&logNo=222239854096,iKON BOBBY 2ND FULL ALBUM 바비 정규 2집 영상통화 사인회 2021. 02. 05 PM6 첫날 첫타임 극초반 n번째 순서였고 무슨 정신으로 팬싸 했게요.. 오전은재택 오후는외근 정신 1도 없던 금욜 <b>통화하기</b> 2시간 전 쯤 도착해서... ,BOTTON,https://blog.naver.com/highe,20210211
4일차 세부아노 전화 <b>통화하기</b>.,https://blog.naver.com/mirasol1987?Redirect=Log&logNo=220411889947,전화<b>통화</b> 대화에 쓰이는 문장을 공부하겠습니다. 지금은 모르겠지만 국민학교 시설 책에 많이 등장했던 만인의 연인인 철수와 영희를 대역으로 등장시키겠습니다.ㅋㅋㅋ 철수가 영희를 찾는 전화<b>통화</b>... ,열심히 살자!,https://blog.naver.com/mirasol1987,20150706
스카이프로 무료<b>통화하기</b> (pc 버전으로 설치후 아이폰으로 통화),https://blog.naver.com/akira_kid?Redirect=Log&logNo=80119560790,skype 시험<b>통화</b>를 눌러보시면 아이폰용 스카이프 <b>통화</b>품질을 테스트 해보실 수 있고. PC버전에서 친구추가를 해놓은 사람이 있으면 밑에 ^_^ 님처럼 친구가 추가되어 있습니다. 8. 이제 인터넷이 가능한... ,'머피'의 블로그,https://blog.naver.com/akira_kid,20101128
도깨비 공유랑 영상<b>통화하기</b>ㅋㅋㅋ,https://blog.naver.com/xx0_0xx6?Redirect=Log&logNo=220897118674,공유씨랑 어떻게 영상<b>통화</b>를 하느냐구요? ㅎㅎㅎㅎㅎ 바로바로 짜잫...ㄴ....ㅎㅎ.... 사진에 내사진을 넣으면 끝납니다ㅎㅎ..... 낚시솜씨가 기레기급^^^ 그냥 재밌어서 올려봤어요ㅎㅎㅎㅎ 우리 이렇게라도... ,니니네 블로그,https://blog.naver.com/xx0_0xx6,20161228
전화 통화도 가능합니다만... 이라서 <b>통화하기</b>가 어려울수... ,https://blog.naver.com/lcs1127?Redirect=Log&logNo=221437292012,"전화 통화도 가능합니다만 이번 출장길은 단기간에 바쁜일정 이라서 <b>통화하기</b>가 어려울수 있습니다. 베어링박사 ***-****-**** 산업기계베어링 ,특수환경용베어링 ,감속기베어링 ,최저가베어링... ",베어링박사 010-8228-1127,https://blog.naver.com/lcs1127,20190109
"그린비2 :: 군인이랑 문자, 영상<b>통화하기</b> 어플 :3",https://blog.naver.com/gggo0307?Redirect=Log&logNo=220911299730,영상<b>통화</b>도 가능하다는데 저는 뭐 남자친구도 아니고~ 바쁜 친구라 패스ㅋㅋ 이런식으로 문자를 주고 받을 수 있어요 :3 친구목록! 곰신님들 화이티잉 ㅇㅅㅠ! ＊폰트정보 Aa기우뚱,솔미월드,https://blog.naver.com/gggo0307,20170114
2017/09/04 ~ 2017/09/06 - 등굣길 추억/영어로 <b>통화하기</b>,https://blog.naver.com/wken1219?Redirect=Log&logNo=221447815319,물론 언어는 영어였다..^^ 아이엘츠 시험볼 때 빼고 개인적인 일로 외국인이랑 이야기를 해본 적이 단한번도 없었고 나와 대화가 가능할까 좀 걱정이 되었는데 전화 연결 30여분을 기다려 2번을 <b>통화</b>했다. 말도... ,Carpe Diem,https://blog.naver.com/wken1219,20190122
필룩_플립커버다이어리 하드케이스_커버 열지 않고 <b>통화하기</b>!!,https://blog.naver.com/myroads?Redirect=Log&logNo=100170590695,않고 <b>통화</b>가 가능 다이어리케이스를 종종 볼 수 있는데 삼성 정품을 구매하려는 가격이 좀... 후에도 <b>통화</b>가 가능한 것들이 몇가지 더있는데 상단에 구멍이 나있으면 <b>통화</b>가 가능하다고 하네요.... ,살림하는 남자,https://blog.naver.com/myroads,20121031
2014년 2월 6일   부천사다리차 <b>통화하기</b>.네이버 모바일... ,https://blog.naver.com/ksmh7324?Redirect=Log&logNo=203841542,사다리차 전화 <b>통화하기</b> ***-****-****,"평범하게 살아가기,스카이차,사다리차,",https://blog.naver.com/ksmh7324,20140206
아우디 A5 중고가격 상담<b>통화하기</b>,https://blog.naver.com/carz50?Redirect=Log&logNo=220823166343,A5 중고차 알아보세요 며 레터링이 선택하시는것이 졸업시즌이죠 깔끔한 디자인 완젼히 좋아 하는대요 사람들이 고급스러 움을 버튼 바로 큰 하려거든 인증평가 더 위를 하는거라 도시적인 흰색계열에... ,나이스 중고차,https://blog.naver.com/carz50,20160928
SK텔레콤 T그룹on -여럿이서 <b>통화하기</b> 딱 좋아요,https://blog.naver.com/is5190?Redirect=Log&logNo=220000972325,"SK텔레콤 T그룹on 여러명이 동시에 <b>통화</b>가 가능한 그룹<b>통화</b> 어플리케이션으로, 전화를 거는 발신자만 앱을 설치하면 수신자는 'T그룹on’ 설치 유무와 관계없이 피처폰·유선전화와도 그룹<b>통화</b>가 가능한... ",행복해지고싶은 나..,https://blog.naver.com/is5190,20140516
