title,link,description,bloggername,bloggerlink,postdate
"신비한 <b>라디오</b> 이벤트 공략 (풍상여도, 온정수후)",https://blog.naver.com/miracle-nikki?Redirect=Log&logNo=222203743707,"⭐ 1월 15일 ~ 1월 21일 이벤트 지도 <b>라디오</b> 배지 수집하기 위해 이동하시면 <b>라디오</b> <b>청취</b> 가능이야기, 아름다운 세트를 모아 [풍상여도] , [온정수후]! ⭐ 세트 모두 새로운 메이크업과 아름다운 진자... ",니키공략 블로그,https://blog.naver.com/miracle-nikki,20210111
레트로 카세트<b>라디오</b> (판매완료),https://blog.naver.com/fbi108?Redirect=Log&logNo=221987526292,FM <b>라디오</b>를 모두 <b>청취</b>하실수있습니다 휴대용이긴하지만 사이즈 확인해보시면 사이즈가 소형은 아닌지라 디스플레이 하실때도 좋고요 아주 귀엽고 예쁘게 사용하실수도 있답니다 뒷부분도 보시면 아주... ,게인하이트 빈티지 (Gain height vintage ),https://blog.naver.com/fbi108,20200602
드디어 뮤지 나왔던 <b>라디오</b> 모두다 <b>청취</b>.,https://blog.naver.com/naahrm95?Redirect=Log&logNo=50117402774,"드디어 스모킹존이랑 옹꾸라를 모두다 뮤지나온편은 모두다 <b>청취</b>하였음. ㅋㅋㅋㅋㅋㅋㅋㅋㅋㅋㅋ... 옛날에 무적<b>라디오</b>에서 게스트로 나온거랑, 김희철 영스트리트랑 현영씨 꺼는... 못받았음...흙...ㅠㅠ... ",법무법인 태신 공식블로그,https://blog.naver.com/naahrm95,20110803
<b>라디오</b> 휴대폰 개발 진전,https://blog.naver.com/jijon627?Redirect=Log&logNo=60003105057,"<b>라디오</b> <b>청취</b> 가능한 휴대폰 개발 진전 KITA 2004.06.10 美 애플社의 디지털 뮤직 플레이어인 ‘iPod’가 출시되기 이전에는 워크맨과 대형 휴대용 카세트 <b>라디오</b>, 그리고 트랜지스터 <b>라디오</b>가 젊은... ",메울이의 세상이야기[Telecom],https://blog.naver.com/jijon627,20040610
[2020.04.01] 최일구의 허리케인 <b>라디오</b> 출연 _ 서울형... ,https://blog.naver.com/herbo01?Redirect=Log&logNo=222197238686,"<b>라디오</b> <b>청취</b>를 많이 해주셨으리라 믿지만~^^ 주요 내용을 몇 자 적어보려 합니다. □ 유급병가지원제도, 누가 대상인가요? - 비정규직, 영세자영업자,특수형태고용종사자등 질병치료를 위한 유급휴일의... ","현장중심, 정책중심 오현정입니다",https://blog.naver.com/herbo01,20210105
"“북, 자유아시아방송 <b>청취</b>한 어선 선장 처형”",https://blog.daum.net/007nis/15880562,외부<b>라디오</b>방송 <b>청취</b>는 곧 죽음을 의미한다는 것을 주민들에게 다시 한번 각인시키려는 의도로 보인다”고 강조했다. 이와 관련 2018년 입국한 한 탈북민은 17일 자유아시아방송에 “많은 북한주민들이... ,Asia-Pacific Region Intelligence Center,https://blog.daum.net/007nis,20201219
최근의 AFN AM<b>라디오</b> 방송순서,https://blog.naver.com/sutosuto?Redirect=Log&logNo=221058892006,(이곳에서는 오전 8시~오후6시 정도까지만 AFN AM<b>라디오</b> <b>청취</b>가 가능하기 때문에 아래와 같이 작성함) 1. 화~토요일 08~11시 Sean Hannity Show 11~14시 Thom Hartmann Show 14~17시 Rush... ,흐르는 강물처럼,https://blog.naver.com/sutosuto,20170725
모노 김보희님 KBS 2<b>라디오</b> '임백천의 백뮤직' 생방송... ,https://blog.naver.com/hidden75?Redirect=Log&logNo=222284055638,"7(삼매봉) PC를 이용하시는 분들은 KBS <b>라디오</b> 홈페이지에서 ON-AIR <b>청취</b> 가능하며, 스마트폰으로 들으시는 분들은 KBS 제2 <b>라디오</b> 모바일 홈페이지 ON-AIR, KBS 앱 KONG을... ",Touch the Heartstrings,https://blog.naver.com/hidden75,20210322
모바일<b>라디오</b>로 음악만 듣자! 뮤직앱 딩가<b>라디오</b>,https://www.leaderyou.co.kr/5053?category=292492,728x90 반응형 <b>라디오</b> <b>청취</b>시 음악만 듣고 싶을때가 있죠~ 음악 듣고 싶은데 말만 나와서 <b>라디오</b> 안듣는 사람들이 많은데요~ 이런 사람들을 위해 모바일<b>라디오</b> 딩가<b>라디오</b>가 나왔습니다. 딩가<b>라디오</b>는... ,리더유의 IT리더,https://www.leaderyou.co.kr/,20161125
[인터넷<b>라디오</b>]인터넷<b>라디오</b> 광고 비용 및 진행안내,https://blog.naver.com/thdwlaks4?Redirect=Log&logNo=221141128406,오늘은 PC와 모바일등을 이용해 <b>라디오</b>를 <b>청취</b>하는 인터넷<b>라디오</b>에 대해 안내드리도록 하겠습니다.인터넷<b>라디오</b>는 주파수를 맞추어 <b>라디오</b>를 <b>청취</b>하는게 아니라 pc나 모바일을 통해 어플리케이션... ,"세상모든광고[TV,라디오,지하철광고]",https://blog.naver.com/thdwlaks4,20171116
[마장소식] 마장축산물시장 방송안내 '통통<b>라디오</b>' / 마장도시재생,https://blog.naver.com/majangregen?Redirect=Log&logNo=222025870083,[ 통통<b>라디오</b> <b>청취</b>방법 ] - 1) <b>라디오</b> 방송시간에 마장축산물시장 스피커를 통해서 실시간 듣기! 2) 팟빵 통통<b>라디오</b>를 통해서 실시간 듣기! 3) 팟빵 통통<b>라디오</b>를 통해서 다시듣기! 마장축산물시장에 오신... ,마장도시재생 현장지원센터,https://blog.naver.com/majangregen,20200709
아이폰 <b>라디오</b> 어플 로니<b>라디오</b> 써보니,https://blog.naver.com/jhbksgi?Redirect=Log&logNo=221762200745,한창 지진 때문에 우리나라가 떠들썩 했을 때 한국의 스마트폰 제조사들은 어플을 통하지 않아도 공중파 <b>라디오</b> <b>청취</b>를 할 수 있는 기능을 넣어 주기 시작했습니다. 만약에 데이터가 터지지 않는 국가... ,곰T의 IT트러블슈팅,https://blog.naver.com/jhbksgi,20200106
"노벨뷰, 부모님 선물용으로 좋은 효도 <b>라디오</b> SD7000 출시",https://blog.naver.com/novelview?Redirect=Log&logNo=220157034004,"이에 더해 MicorSD 카드와 USB 메모리에 저장된 음악파일을 자동 재생할 수 있으며, FM <b>라디오</b> 수신기가 탑재되어 <b>라디오</b> <b>청취</b>도 가능하다. 제품 전면에 위치한 숫자 키패드로 간편하게 MP3 음악 파일의 곡... ",노벨뷰 :: IT 및 디지털 전문 제조유통기업,https://blog.naver.com/novelview,20141021
[<b>라디오</b>광고] <b>라디오</b>광고종류와 비용안내,https://blog.naver.com/thdwlaks4?Redirect=Log&logNo=221131893937,"기업이나 브랜드, 상품을 CM송으로 제작하여 <b>라디오</b>를 <b>청취</b>하시는분들에게 20초간 광고를 하는 광고매체 인데요.20초동안 광고가 노출되기때문에, 광고효과가 매우 높으며, 재미있는 문구나 음악을... ","세상모든광고[TV,라디오,지하철광고]",https://blog.naver.com/thdwlaks4,20171103
갬성돋는 <b>라디오</b> 캔스톤 TR-2200 내돈내산 <b>라디오</b>추천,https://blog.naver.com/best_seul?Redirect=Log&logNo=222188705629,FM <b>라디오</b> <b>청취</b>시 후면에 장착된 안테나를 확장하면 수신율을 높일 수 있어요. 저희 집에선 따로 안테나를 세우지 않아도 매끄럽게 잘 들려서 안테나를 세울 일은 없었어요. 주파수 맞추는 부분에서 조명이... ,알콩달콩 곰네마리:),https://blog.naver.com/best_seul,20201229
프랑스어 어플 ③ - 프랑스어 <b>라디오</b> Live 녹음도...,https://blog.naver.com/tonbonami?Redirect=Log&logNo=110098481465,"오늘은 프랑스어 <b>라디오</b>를 <b>청취</b>할 수 있는 아이폰용 어플을 소개해 드리려 합니다. 주변에 안드로이드 폰 가지고 계신분이 없어서, 안드로이드에도 있는지는 확인할 방법이 없네요. 소개해 드리려는 어플은... ",프랑스어 한스푼,https://blog.naver.com/tonbonami,20101205
CRI <b>라디오</b>방송 분야별 <b>청취</b>,https://blog.naver.com/qian0130?Redirect=Log&logNo=50013960496,"http://gb.cri.cn/chinese_radio/ CRI 의 각종 <b>라디오</b> 프로그램을 분야별로 (예 : 경제, 평론, 연예....) 제공한다. 프로마다 제공되는 방송 대본 전체를 보면서 <b>청취</b>할 수 있어서 내용을 놓칠 염려가 없으며 얼마든지... ",인터넷 중국 탐험,https://blog.naver.com/qian0130,20070205
윤정수 남창희의 미스터<b>라디오</b> 당첨선물 필터샤워기,https://blog.naver.com/cosmosstar00?Redirect=Log&logNo=222385922652,(이렇게 또 마케팅에 넘어가고야 마는.... 좋은건 뭐 그래도 되지뭐. 그래야 마케터들도 보람이 있지.) 윤정수남창희의 미스터<b>라디오</b> 식구들 좋은 선물 주셔서 감사합니다. 앞으로도 <b>라디오</b> 열심히 <b>청취</b>할께요.,☆étoile☆,https://blog.naver.com/cosmosstar00,20210605
[인터넷<b>라디오</b>광고]인터넷<b>라디오</b> 광고 진행비용 금액 효과,https://blog.naver.com/thdwlaks4?Redirect=Log&logNo=221190472085,요즈음은 <b>라디오</b>를 <b>청취</b>할때 수신기로 <b>라디오</b>를 <b>청취</b>하기보다는 PC나모바일로 <b>라디오</b>를 많이 <b>청취</b>하는데요. PC나모바일로 <b>라디오</b>를 <b>청취</b>할 수 있는 프로그램이 바로 인터넷<b>라디오</b> 입니다. SBS고릴라... ,"세상모든광고[TV,라디오,지하철광고]",https://blog.naver.com/thdwlaks4,20180122
효도<b>라디오</b> 얼리봇 LHV700 휴대용FM<b>라디오</b> 마음에 드신데요,https://blog.naver.com/hwan64288?Redirect=Log&logNo=222190940398,"동시에 <b>라디오</b> <b>청취</b>가 가능한거죠 휴대용에 적합한 핸드스트립 안테나가 FM<b>라디오</b> 안테나 역할을 하구요 기능 버튼을 눌러서 FM<b>라디오</b> 모드로 변경을 해주세요 89.1HZ인 경우 8,9,1 을 누르면 잠시 후 채널로... ",눈이 부시게 행복한 날들 ♬,https://blog.naver.com/hwan64288,20201230
05.20 조상완원장님 바다의향기  <b>라디오</b>인터뷰 <b>청취</b>하세요^^,https://blog.naver.com/buanbreeze?Redirect=Log&logNo=100188329967,전북은 지금/2013.05.20 조상완원장님 바다의향기 <b>라디오</b>인터뷰 <b>청취</b>하세요^^ 바다의향기에 많은 관심과 사랑을 부탁드려요^^ http://jeonju.kbs.co.kr/radio/radio_now_aod.html,"착한 사람,행복한 기업 바다의향기입니다.",https://blog.naver.com/buanbreeze,20130521
"[대만 뉴스] 인터넷, 어플을 통해 대만어 <b>라디오</b> 뉴스 듣기",https://blog.naver.com/yiping1004?Redirect=Log&logNo=220184900019,▲ BCC <b>라디오</b> 뉴스 <b>청취</b>중 BCC 공식 어플을 통해 <b>라디오</b> 뉴스도 <b>청취</b>할 수 있고 스마트폰으로 뉴스를 읽을 수 있다. ▲ BCC <b>라디오</b> 뉴스 읽기 &lt;사진 출처: 대만 BCC <b>라디오</b> 방송국&gt;,원어민강사 설희의 대만 이야기,https://blog.naver.com/yiping1004,20141118
[문학감성프로젝트]한 줄 필사_그래서 <b>라디오</b>,https://blog.naver.com/tjsqosla107?Redirect=Log&logNo=222204866976,"귀신소리 같다며 <b>라디오</b> <b>청취</b>를 거부하는 아들녀석의 진지한요청으로 지금은 무음악 식사를 하고 있죠~ㅋㅋ 온/오프 서점을 기웃대며 다음 책은 무얼 읽지? 하고 고민할 때, 앞서 전해드린 기억이 떠올라 고른... ",센스더센트,https://blog.naver.com/tjsqosla107,20210112
2017년 3월 7일 <b>라디오</b> 당첨 :: 두시의 데이트 지석진입니다... ,https://blog.naver.com/s_06_11?Redirect=Log&logNo=220952654813,"전에 지석진 씨 몇 달 안 됐을 때 <b>라디오</b> <b>청취</b>율조사하던 도중 2시에 뭐 듣냐고 하니까 정재형 문희준의 즐거운 생활, 이하 정문즐생 듣는다고 하셨던 사람들ㅋㅋㅋㅋㅋ 물론 나도 정문즐생 굉장히 많이 들었다.... ",카페인벡터,https://blog.naver.com/s_06_11,20170308
SBS 고릴라 <b>라디오</b> 광고 소개와 비용 안내,https://blog.naver.com/dlqhdk0223?Redirect=Log&logNo=222402366724,"전체 <b>라디오</b> <b>청취</b>자 4명 중 1명은 인터넷 <b>라디오</b>를 이용하고 있으며, 매체 특성상 남성보다는 여성의 이용률이 더 높고, 주요 경제활동 인구인 3050세대의 이용률이 높습니다. 그렇기 때문에 저예산으로... ",슬기로운 광고생각,https://blog.naver.com/dlqhdk0223,20210618
◎ <b>라디오</b> 방송의 역사,https://blog.naver.com/hipost2021?Redirect=Log&logNo=222280681475,"방송이 처음으로 등장한 이래로 <b>라디오</b> <b>청취</b>인구는 엄청나게 증가했고, 이에 힘입어 오락과 정보 프로그램 방송을 목적으로 한 방송국이 설립되었다. 최초의 상업방송국은 피츠버그의 KDKA로, 1920년 11월... ",Forester의블로그,https://blog.naver.com/hipost2021,20210319
"삼성전자, 휴대단말기의 <b>라디오</b> 방송 <b>청취</b> 방법 및 장치 특허출원",https://blog.naver.com/yskim2021?Redirect=Log&logNo=10181696087,"방송기술 특허 / 정보통신 특허조회 [직무발명 특허출원 잘하는 변리사 무료상담] 삼성전자, 휴대단말기의 <b>라디오</b> 방송 <b>청취</b> 방법 및 장치 특허출원 특허의 명칭 : 휴대 단말기의 <b>라디오</b> 방송 <b>청취</b> 방법... ",특허법인메이저★[상담 1800-9166],https://blog.naver.com/yskim2021,20131219
<b>라디오</b>(99.9) 돈키오테가 종영되었습니다.그동안 <b>청취</b>해주... ,https://blog.naver.com/adue00?Redirect=Log&logNo=221899912920,생방송으로 <b>청취</b>자 여러분들의 보험에 관한 고민을 풀어드렸는데요 이렇게 갑자기 방송이 끝나서 너무나 아쉽습니다. [돈을 키우는 오전 30분 테크닉] 매주 <b>청취</b>자 여러분들께 보험가입 그만하시고... ,미래자산극대화 연구소,https://blog.naver.com/adue00,20200409
<b>라디오</b><b>청취</b> 프로그램,https://blog.naver.com/myksj7911?Redirect=Log&logNo=30015138401,☆설명서☆ 1. <b>라디오</b> <b>청취</b>프로그램을 다운한다. 2. 프로그램을 깐다. 3. 깐다음 프로그램을 실행한다. 4. 메모 옆에있는 불로오기 버튼을 눌른다. 5. 원하는 <b>라디오</b> 프로그램을 선택한다. 6. 끝 감사합니다..,잡종 프로그램,https://blog.naver.com/myksj7911,20070305
eton frx4 이튼비상<b>라디오</b> 가죽케이스 리폼.,https://blog.naver.com/seokart1209?Redirect=Log&logNo=221539916575,이튼 비상<b>라디오</b>...아지트에서 <b>라디오</b> <b>청취</b>에 참 좋다. 만들었던 가죽케이스 ..자주 사용해보니 결속스트랩은 필요없고.. 쏠라패널을 가리고 있으니 매번 탈착도 귀챦고 안끼워 놓게됨.. . . . 이짝을 없애야 것다!... ,쌤~ 수작?부리기...,https://blog.naver.com/seokart1209,20190517
[YTN<b>라디오</b>] 안전한일터 캠페인 14편 - 하청업체안전,https://www.hanjeoungae.com/3803?category=463724,* <b>라디오</b>를 <b>청취</b>하기 어려우신 분들을 위해 음성파일을 업로드하였으니 게시물 하단부를 참고해주시기 바랍니다. ▽ 음성 듣기 좋아요 공감 공유하기 글 요소 구독하기 한정애 닷컴... ,한정애 닷컴 - 동행하실까요!,https://www.hanjeoungae.com/,20170918
일본어 듣기 공부 &quot;<b>라디오</b>-Simul Radio&quot;,https://blog.naver.com/milee0707?Redirect=Log&logNo=150154518852,지금은 안된다..왜안되는지 모르겠지만....이걸 통해서 들으면 유명한 공영 <b>라디오</b> 방송 <b>청취</b>가 가능했는데... 아무튼 다른 퐐로를 찾아서 듣고있다 Simul Radio (사이마루 라지오) 다. -메인화면 이런식으로... ,milee0707님의 블로그,https://blog.naver.com/milee0707,20121221
졸음운전에 특효약은? 화물차 운전자 자주 듣는 <b>라디오</b> 1위!,https://blog.naver.com/boronia?Redirect=Log&logNo=220692823035,"한국도로공사가 화물차 운전자들을 대상으로 진행한 설문조사에서 졸음운전 예방을 위해 필요하거나 효과를 본 것에 껌, 수면, 생수 등과 함께 <b>라디오</b> <b>청취</b>가 꼽혔고, 그 중 제일 많이 듣는 프로그램으로... ",글쓰는 워킹맘의 성장클래스,https://blog.naver.com/boronia,20160425
"스마트 <b>라디오</b>를 더 스마트하게 듣는 방법! 아리아, BTN울림... ",https://blog.naver.com/btnii?Redirect=Log&logNo=221569247912,이 모든 것들이 다 울림을 아끼고 사랑해준 불자님들의 성원 덕분이 아닐까합니다 ㅠㅠ 다시 한번 진심으로 감사인사드립니다 ♥ SK '누구'를 통해 BTN불교<b>라디오</b>를 <b>청취</b>하려면 먼저 간단한 사용법을... ,한국불교 대표방송 BTN,https://blog.naver.com/btnii,20190624
던킨도너츠 킷캣<b>라디오</b> 레트로 감성 가득!,https://blog.naver.com/hongteaho?Redirect=Log&logNo=221749316733,"스피커 부분은 앞쪽, 뒤쪽에 있어서 빵빵하게 음악감상, <b>라디오</b> <b>청취</b>가 가능! 레트로 <b>라디오</b> 답게! 쭈우우욱 늘어나는 안테나선! <b>라디오</b>가 잘안터지면 안테나 끝부분을 살포시 잡아주면 빵빵하게 <b>라디오</b>를... ",홍씨네'맛있는야구이야기',https://blog.naver.com/hongteaho,20191225
네덜란드어 <b>라디오</b>/ TV/ 어학원/ Inburgeringsexamen... ,https://blog.naver.com/eekhoorn?Redirect=Log&logNo=220849518448,fm 모든 <b>라디오</b> 채널이 모여 있는 웹사이트로 간단히 클릭 한번을 통해 다양한 <b>라디오</b>를 <b>청취</b>할 수 있습니다 NPO1 / BNR : 뉴스 NPO 4 / Classic FM : 클래식음악 538 / Q music : 최신음악 SKY Radio... ,화란댁의 사랑살롱,https://blog.naver.com/eekhoorn,20161031
"가성비 대비 좋은 음질/ 선물용, 휴대용, <b>라디오</b>, 알람, 취침설정...",https://blog.naver.com/akratang?Redirect=Log&logNo=222154835572,"그밖에 <b>라디오</b> <b>청취</b> 가능, 알람 설정 가능, 취침 설정 가능하다. 조작법도 상당히 간단하고 직관적이어서 설명서 한 번만 읽으면 금방 익힌다. +온라인 강의 듣는 중고등학생 대학생들 겸사겸사 블루투스... ",!,https://blog.naver.com/akratang,20201126
<b>라디오</b> 사이트 &quot;라디코(radiko)&quot;에서 VPN우회 없이 <b>라디오</b>... ,https://blog.naver.com/yuzzz1356?Redirect=Log&logNo=222030863654,<b>라디오</b> <b>청취</b> 하면 짠! 바로 들을 수 있어요. 가운데의 파란 재생 버튼을 눌러주세요. 라이브 옆의 타임프리에서 최근 일주일 내에 방송된 <b>라디오</b> 컨텐츠에 한해서 다시 들을 수도 있습니다. + 타임프리 방송... ,-,https://blog.naver.com/yuzzz1356,20200714
[<b>라디오</b> 협찬] 장수이야기 &quot;도라지배즙&quot;,https://blog.naver.com/rokaroll?Redirect=Log&logNo=222006867256,"경인방송 박현준의 <b>라디오</b>가가(매일 정오~2시)에 참여하는 <b>청취</b>자분들께 &quot;장수이야기 도라지배즙&quot;을 협찬해주셨는데요~ 매일 매일 <b>라디오</b> <b>청취</b>하시면서, 문자 #9070(단문 50원, 장문 100) 또는 경인방송... ",박현준의 라디오 가가,https://blog.naver.com/rokaroll,20200620
[<b>라디오</b>광고]팟캐스트 광고 안내,https://blog.naver.com/thdwlaks4?Redirect=Log&logNo=221035722681,"방송3사 <b>라디오</b>중 가장 <b>청취</b>율이 높은 SBS 컬투쇼 같은경우 월 1,000만회가 넘는 다시듣기가 송출된다고하니, 정말 많은분들께서 <b>라디오</b> 다시듣기를 <b>청취</b>하고 있습니다. 또한, 1번 송출당 1원으로 매~~우... ","세상모든광고[TV,라디오,지하철광고]",https://blog.naver.com/thdwlaks4,20170623
통신망(3G/LTE)으로 KBS<b>라디오</b> 콩서비스이용시 데이터은... ,https://blog.naver.com/qkrtmddn10?Redirect=Log&logNo=220205937880,그러면 kbs<b>라디오</b> 콩서비스를 이용하여 <b>라디오</b>를 <b>청취</b>할 때 데이터가 얼마나 소진될까요? 계산한번 해 봤습니다. 서비스비트레이트 128kbps을 기준으로 하면 1사간 동안 3G/LTE망을 통해 <b>청취</b>할 경우 약... ,쟁이와 함께하는 방송통신(기술)산책,https://blog.naver.com/qkrtmddn10,20141210
알람기능은 기본 <b>라디오</b> 스피커 브리츠 BA-R100,https://blog.naver.com/2pnn?Redirect=Log&logNo=220527643140,FM 케이블 안테나도 있기 때문에 신호가 잘 잡히는 곳에 위치해주면 선명하게 FM <b>라디오</b>를 <b>청취</b>할 수 있다. 필자가 좋아하는 배철수 아저씨의 ' 음악캠프' 나 정지영 아나운서의 목소리를 들을 수 있다는... ,아이작군의 Life 속으로,https://blog.naver.com/2pnn,20151103
[Coms] 효도<b>라디오</b> 스피커 -어르신 선물용 스피커로 강추!,https://blog.naver.com/fjfjdj?Redirect=Log&logNo=221810029084,또 자동 채널검색 및 메모리기능 지원을 해서 스테레오 FM <b>라디오</b> <b>청취</b> 가능합니다. FM <b>라디오</b> 주파수를 자동으로 검색해 준다고 하니 실시간으로 쉽게 방송 <b>청취</b>가 가능하겠네요 ! 포장도 3중 포장이어서... ,싱승생승,https://blog.naver.com/fjfjdj,20200215
사운드룩 레트로 블루투스 스피커 <b>라디오</b> 무료체험단 모집 중 !!!,https://blog.naver.com/mfhdfz44?Redirect=Log&logNo=222277383191,"엔틱한 대형 주파수 표시부로 클래식 감성을 표현하며 선명한 고감도 <b>라디오</b> <b>청취</b>도 가능해요. 혹시 LP를 사고 싶은데, 어떤 노래가 좋을지 고민 중이신가요? 그렇다면, 많은 분들이 선택한 사운드룩의 베스트... ",mfhdfz44님의블로그,https://blog.naver.com/mfhdfz44,20210316
PC로 실시간 TV 보기 및 실시간 <b>라디오</b> 듣기,https://mongri.net/3239,TV도 볼 수 있으니 당연히 실시간 <b>라디오</b> <b>청취</b>도 가능하겠지요. 오늘 소개하는 실시간 TV 사이트는 PC를 이용해야만 실시간 TV를 볼 수 있습니다. 스마트폰으로 실시간 TV를 보고 싶으신 분들은 아래의 관련... ,꿈속으로,https://mongri.net/,20181109
[<b>라디오</b>광고] <b>라디오</b>협찬 하는 방법,https://blog.naver.com/thdwlaks4?Redirect=Log&logNo=221044550522,"그만큼 <b>라디오</b> <b>청취</b>율도 올라가고, 협찬광고에 대해 효과가 많기때문에 꾸준히 협찬사가 늘어나고 있는것 같습니다. 특히, <b>청취</b>율이 높은 인기프로그램은 협찬사를 더이상 받지 않을만큼 협찬사가... ","세상모든광고[TV,라디오,지하철광고]",https://blog.naver.com/thdwlaks4,20170705
"[EBS 봄 개편] 책 읽어 주는 <b>라디오</b> EBS FM, 봄 맞이 새단장 소식",https://blog.naver.com/ebsstory?Redirect=Log&logNo=50164286786,"내 귓가에서 가장 가까운 책방을 찾으신다면 '책 읽어주는 <b>라디오</b>'를 <b>청취</b>해주세요! - ePD 책 읽어주는 <b>라디오</b> 새단장 소식! -&lt;<b>라디오</b> 소설&gt;, &lt;주제가 있는 책방&gt;, &lt;안지환이 읽어주는 교과서&gt;, &lt;화제의 베스트... ",EBS 스토리,https://blog.naver.com/ebsstory,20130227
일본<b>라디오</b> YAMAMAN presents MUSIC SALAD from U-kari Studio,https://blog.naver.com/imountinei?Redirect=Log&logNo=70177565967,일본어공부를 하시는 방법 중에 일본<b>라디오</b> <b>청취</b>는 회화실력에 많은 도움이 됩니다. 어려운 것은 그냥 지나가세요. 그래야 일본어실력도 향상이 될테니까요 松本英子 「おもてなしサラドレ！」 10月17日（木)... ,에버유학,https://blog.naver.com/imountinei,20131017
[판촉물] <b>라디오</b>와 무선충전을... 블루투스스피커 <b>라디오</b>,https://blog.naver.com/brightmanblog?Redirect=Log&logNo=222191610757,앞서 설명드렸듯이 이번 무선 충전기는 단순한 무선충전기가 아닌 <b>라디오</b> <b>청취</b>가 가능한 무선 충전기입니다! 자유로운 휴식시간도 CLASSIC과 함께 하세요! 5번째 기능은 바로 자체적으로 Micro SD 음악 파일을... ,주식회사 우리같이,https://blog.naver.com/brightmanblog,20210104
MBC TV 실시간 보기 &amp; <b>라디오</b> <b>청취</b>,https://blog.naver.com/dorlehdqkd?Redirect=Log&logNo=220814399201,안녕하세요 ^_^ 컴퓨터로도 실시간 TV를 볼 수 있는 방법을 알려드릴게요~ MBC 홈페이지에 접속한다 1. www.imbc.com 2. 로그인 (회원가입은 하셔야 무료로 실시간 TV를 볼 수 있습니다) 3. 온에어를... ,올라의 꼼지락 ing,https://blog.naver.com/dorlehdqkd,20160918
[<b>라디오</b>광고] 인터넷<b>라디오</b>광고 비용 진행 방법!,https://blog.naver.com/thdwlaks4?Redirect=Log&logNo=221340444757,인터넷<b>라디오</b>는 주파수로 <b>라디오</b>를 <b>청취</b>하는 방식이 아닌 스마트폰 어플리케이션 혹은 PC프로그램으로 다운받아 <b>청취</b>를 하게되는 플랫폼 입니다. SBS고릴라 MBC미니 KBS콩 CBS레인보우 위와같이 각 방송사별... ,"세상모든광고[TV,라디오,지하철광고]",https://blog.naver.com/thdwlaks4,20180817
