title,link,description,bloggername,bloggerlink,postdate
신규<b>모바일게임</b> 파이널기어 초반 공략 겸 여름 이벤트 소개,https://blog.naver.com/operation146?Redirect=Log&logNo=222391369411,"신규<b>모바일게임</b> 파이널기어 초반 공략 겸 여름 이벤트 소개 신규<b>모바일게임</b> 파이널기어는 출시 이후... <b>게임</b>을 처음 플레이하면 레벨업은 어떻게 하고, 무엇을 플레이하는 게 좋을지 고민이 많을 텐데 개인적인... ",헤드샷 원킬,https://blog.naver.com/operation146,20210609
슈프림 배틀 드디어 오픈! 신작<b>모바일게임</b> 유저들에게 추천하다,https://blog.naver.com/dbsgns2011?Redirect=Log&logNo=222402346454,신작<b>모바일게임</b> 추천 작품으로 명성을 높이고 있는 본 <b>게임</b>은 건담이라는 기체를 플레이어가 직접적으로 운영하면서 상대방과 대결을 벌여 승리를 쟁취하는 것입니다. 원작에 맞는 현란한 액션과 기체를... ,청비대제(청룡비둘기)의 휴식공간,https://blog.naver.com/dbsgns2011,20210618
신작 방치형<b>모바일게임</b> 프린세스 테일 런칭 후기 &amp; 쿠폰,https://blog.naver.com/jjang986?Redirect=Log&logNo=222346594534,"아름다운 미소녀 일러스트와 귀여운 SD 캐릭터, 캐주얼한 방치형 시스템 등 출시 전부터 남심을 흔들었던 방치형<b>모바일게임</b>인데요. <b>게임</b>펍에서 자체 개발된 국산 IP라 저도 기대를 많이 했습니다. 과연 실제 그... ",주리오의 겜잇이야기,https://blog.naver.com/jjang986,20210511
<b>모바일게임</b> 대작 트릭스터M 오픈 일정 확정,https://blog.naver.com/bdh4489?Redirect=Log&logNo=222346241306,많은 유저들의 기대를 한 몸에 받고 있는 MMORPG <b>모바일게임</b> 트릭스터M은 과연 어떠한 <b>게임</b>성을 가지고 게이머들에게 공개될까요? 엔씨소프트 측에서 최근 트릭스터M의 론칭 일정을 확정 지었습니다. 5월 20일... ,게임종결자의 Magazine Games,https://blog.naver.com/bdh4489,20210511
"<b>모바일게임</b>추천 백야극광 등급표, 글로벌 200만 다운로드 돌파... ",https://blog.naver.com/obama8775?Redirect=Log&logNo=222406811145,"색다른 방식의 전투, 매력 넘치는 세계관과 캐릭터들을 통해 글로벌 대세 <b>게임</b>으로 자리매김하고 있는 백야극광, <b>모바일게임</b>추천을 원하시는 분들이라면 등급표를 참고하셔서 꼭 플레이에 도전해보시길... ",선비의 엣헴블로그,https://blog.naver.com/obama8775,20210622
<b>모바일게임</b>사전예약 퍼즐 오브 Z 좀비물 좋아한다면 주목!,https://blog.naver.com/fun3200?Redirect=Log&logNo=222360268833,"그래서 요즘 부쩍 좀비에 대한 관심이 많아졌는데, 이런 저의 눈에 든 <b>게임</b>이 있습니다. 바로 현재 <b>모바일게임</b>사전예약 중인 퍼즐 오브 Z 인데요! 같이 한번 살펴보겠습니다. <b>모바일게임</b>사전예약 중인 퍼즐 오브... ",사라한,https://blog.naver.com/fun3200,20210521
<b>모바일게임</b>추천 파이널기어 파일럿 등급표 공략 및 전투력... ,https://blog.naver.com/jjang986?Redirect=Log&logNo=222394369486,파이널기어가 출시되고 구글 플레이 인기차트와 앱스토어 인기 <b>게임</b> 1위치를 차지하는 등 <b>모바일게임</b>추천을 받으며 상승세를 보이고 있습니다. 남성 게이머들이 좋아하는 미소녀와 메카닉을 집어넣을 뿐만... ,주리오의 겜잇이야기,https://blog.naver.com/jjang986,20210611
"RPG<b>모바일게임</b>순위 순조롭다! PVP 맛집 천상나르샤, 전투력을... ",https://blog.naver.com/subome?Redirect=Log&logNo=222415756341,최근 새로운 <b>모바일 게임</b>이 많이 출시되어 RPG<b>모바일게임</b>순위가 변동되었는데 기존의 순위를 깰 만큼 아주 파격적이거나 매력적인 <b>게임</b>들이 출시된 것 같더라고요. 필자는 그중 화려한 그래픽을 보유하고... ,봄딩 게임,https://blog.naver.com/subome,20210630
<b>모바일게임</b>매출순위 상승? 원펀맨: 최강의 남자 비 쿠폰 받고... ,https://blog.naver.com/rkdgns4517?Redirect=Log&logNo=222402620257,원펀맨 원작 애니메이션을 모르는 분들이라도 스토리 모드에서 삽입된 애니메이션 컷씬과 연출로 충분히 즐기실 수 있는 <b>게임</b>입니다. <b>모바일게임</b>매출순위의 유지와 함께 지속적으로 출시되는 한정 소환과... ,G조커의 인생게임,https://blog.naver.com/rkdgns4517,20210618
"진정한 로그라이크의 재미, 최신 <b>모바일게임</b> X2: 이클립스... ",https://blog.naver.com/kkeangel?Redirect=Log&logNo=222423584187,RPG <b>게임</b>이다. 액션 RPG 장르에 로그라이크 요소가 가미 되어 중독성 있는 전투를 즐길 수 있다고 한다. 오늘은 최신 <b>모바일게임</b> X2: 이클립스의 세계관으로 들어가보려 한다. X2: 이클립스는 메인 스토리를... ,전생했더니개돼지가된건에대하여,https://blog.naver.com/kkeangel,20210707
[핢겜소/<b>모바일게임</b>] 트리플판타지(Triple Fantasy),https://blog.naver.com/z00o0o?Redirect=Log&logNo=222427982128,"핢겜소를 시작하고 보니, 계속 <b>모바일</b> 위주로 가는 것 같은데 <b>모바일 게임</b>만을 소개하는 컨텐츠는 아닙니다. 조만간 pc와 ps, 닌텐도, 보드<b>게임</b>까지 다양하게 진행할 예정입니다. 할만한 <b>게임</b> 소개, 핢겜소의... ",「 날개를 준비 」           Wintersky,https://blog.naver.com/z00o0o,20210711
수집형<b>모바일게임</b> 여왕천하 집에서할수있는취미를 가져보고... ,https://blog.naver.com/dbsgns2011?Redirect=Log&logNo=222367241037,여왕천하를 처음 접해보는 유저 분들의 경우에는 소셜을 통해 다른 플레이어들과 소통을 하면서 본 수집형<b>모바일게임</b>에 대한 숙련도를 늘려보는 쪽으로 <b>게임</b>을 해보세요. 그리고 타 플레이어가 꾸며놓은... ,청비대제(청룡비둘기)의 휴식공간,https://blog.naver.com/dbsgns2011,20210526
"할만한<b>모바일게임</b> 찾는다면 소녀X헌터!, 요즘 대세인 이유?!!",https://blog.naver.com/dewichien?Redirect=Log&logNo=222394185769,또한 즐길만한 콘텐츠도 많기에 자꾸만 손이 가는 매력을 지니고 있었는데요. 할만한<b>모바일게임</b>을 찾고 있다면 이만한 <b>게임</b>은 찾기 힘드니 꼭 한 번 플레이해보시길 바랍니다. 다운로드 공식카페,절망에 복종하라!,https://blog.naver.com/dewichien,20210611
엑솔라(Xsolla) 솔루션을 활용해 <b>모바일 게임</b> 개발 사업을... ,https://blog.naver.com/jjang986?Redirect=Log&logNo=222378011737,"Unity처럼 유명한 <b>게임</b> 엔진조차 <b>모바일</b> 투 PC, <b>모바일</b> 투 웹에 대해 진지하게 고민하며, <b>모바일 게임</b> 유저를 쉽게 확보하기 위한 수단을 자사 툴에 구축하고 있는 상황입니다. 이렇게 엑솔라(Xsolla)와 함께 하게... ",주리오의 겜잇이야기,https://blog.naver.com/jjang986,20210601
<b>모바일게임</b> 드래곤라자 오리진 사전예약 &amp; 프리뷰 소식,https://blog.naver.com/subome?Redirect=Log&logNo=222391522743,본론으로 돌아와 <b>모바일게임</b> 드래곤라자 오리진은 원작의 스토리를 <b>게임</b>에 고스란히 담고자 소설 속 영웅들을 <b>게임</b>에 담아냈다. 드래곤라자 소설을 읽은 독자라면 후치와 샌슨의 이야기를 다시 한번... ,봄딩 게임,https://blog.naver.com/subome,20210609
"<b>모바일게임</b> 사전예약 V4 오디세이 액트2 업데이트, 브이포티비... ",https://blog.naver.com/jinyh97?Redirect=Log&logNo=222430491407,로드맵을 통해 하반기 큼직큼직한 소식들을 예고했던 <b>모바일게임</b> V4에 최근 대규모 업데이트... 친구에게 소식을 공유하고 이용권을 통해 인<b>게임</b> 아이템부터 구글 기프트 카드 등 다양한 경품에 도전해볼 수... ,미릭 로그,https://blog.naver.com/jinyh97,20210713
"<b>모바일게임</b>추천, 킹스레이드 시즌 마지막.. 더 파이널 사전예약",https://blog.naver.com/kkodug9?Redirect=Log&logNo=222356056396,"베스파가 자체 개발한 <b>모바일</b>RPG 킹스레이드는 완성도 높은 스토리와 <b>게임</b>성, 콘텐츠 등으로 글로벌... <b>모바일게임</b>추천, 킹스레이드 더 파이널 사전예약은 업데이트가 진행되는 5월 25일까지이며, 참여 시... ",영원한도시 블로그,https://blog.naver.com/kkodug9,20210518
수집형 방치 RPG 드래곤라자EX <b>모바일게임</b> 사전등록... ,https://blog.naver.com/fun3200?Redirect=Log&logNo=222404977112,<b>게임</b>을 플레이하면서 재밌는 점이 있다면 상점에서 다양한 무기들을 인 <b>게임</b> 재화로 어렵지 않게 구매를 할 수 있다는 점이었습니다. 대부분의 일반적인 수집형 <b>모바일게임</b>들은 상점에서 판매하는 아이템을... ,사라한,https://blog.naver.com/fun3200,20210621
신규<b>모바일게임</b> 퍼니싱:그레이 레이븐 사전예약 &amp; CBT 소식,https://blog.naver.com/playmyworld?Redirect=Log&logNo=222355985676,바로 퍼니싱:그레이 레이븐인데 현재 사전예약 진행 중이고 1차 CBT를 앞두고 있는 신규<b>모바일게임</b>이다. 정식 오픈전이지만 이제 곧 CBT를 통해 맛보기 <b>게임</b>을 플레이해볼 수 있고 공식 홈페이지나 카페를... ,"IT, 게임, 그리고 육아 이야기",https://blog.naver.com/playmyworld,20210518
"신작<b>모바일게임</b> 추천 원더아레나, 방치형 배틀을 3D로 즐긴다",https://blog.naver.com/dbsgns2011?Redirect=Log&logNo=222375940938,<b>모바일</b>이라는 특수적인 환경을 고려해본다면 방치형 장르가 아무래도 유저들 입장에서는 편할 수... Previous image Next image 신작<b>모바일게임</b>이라는 특성에 맞게 최신화가 된 <b>게임</b>성을 가지고 있는 것은 물론이고... ,청비대제(청룡비둘기)의 휴식공간,https://blog.naver.com/dbsgns2011,20210531
"신규<b>모바일게임</b> 백야극광 후기, 리세마라 방법!",https://blog.naver.com/foxc987?Redirect=Log&logNo=222401429277,펼치는 <b>모바일</b> RPG라 생각하시면 쉽습니다. 같은 색의 칸을 연결해서 전투 루트를 만들면 루트에 따라서... 신규<b>모바일게임</b> 백야극광 지금 시작해보시죠. 플초 (*******@*****.***) &lt;&gt; 본 포스팅은 해당 <b>게임</b>사로부터... ,제목없음,https://blog.naver.com/foxc987,20210617
미소녀 신규<b>모바일게임</b> 백야극광 사전예약,https://blog.naver.com/bdh4489?Redirect=Log&logNo=222350881603,CBT 소식과 함께 사전예약을 진행하고 있는데 어떤 매력이 있는 <b>게임</b>인지 알아보겠습니다. 백야극광은 세기말적인 배경을 가진 신규<b>모바일게임</b> 입니다. 17년간 땅을 밟아보지 못한 주인공은 다시 지상으로 나온... ,게임종결자의 Magazine Games,https://blog.naver.com/bdh4489,20210514
출시가 기다려지는 신작<b>모바일게임</b> 파이널기어,https://blog.naver.com/bdh4489?Redirect=Log&logNo=222337683355,할만한 <b>게임</b>이 없어 신작<b>모바일게임</b>의 출시를 기다리고 계신다면 파이널기어의 사전예약에 참여해 보시는 것은 어떨까요? 파이널기어 사전 예약 파이널기어 공식 카페 본 포스팅은 해당<b>게임</b>사로부터 소정의... ,게임종결자의 Magazine Games,https://blog.naver.com/bdh4489,20210504
<b>모바일 게임</b> 순위 21년 5월 3주차,https://blog.naver.com/sun0799dh?Redirect=Log&logNo=222357546723,<b>모바일</b> 배틀그라운드가 지난주 20위 내에 없었으나 이번 주에 10위로 올라왔습니다. 워낙 PC에서도 인기가 있는 <b>게임</b>이지만 5월을 맞이하여 패치노트를 공개하면서 다양한 업데이트 소식을 유튜브로... ,최선웅의 게임 이야기,https://blog.naver.com/sun0799dh,20210519
<b>모바일게임</b> 추천! 간단하게 즐겨요,https://blog.naver.com/88163tree?Redirect=Log&logNo=222357531663,풀이로 할만했어요 보상은 좀 짜더라구요 ㅎ 컨트롤<b>게임</b>을 좋아하신다면 이<b>게임</b> 정말 괜찮은거같아요 여기까지 간단하게 즐길만한 <b>모바일게임</b> 추천 해드렸구요 전 다음에 다시 새로운걸 들고 찾아오겠습니다 !,언제나 맑음,https://blog.naver.com/88163tree,20210519
<b>모바일게임</b>추천 파이널기어 전용기 얻는 법 / 딜러 등급표 공략,https://blog.naver.com/ideungam?Redirect=Log&logNo=222392898244,"그래서 출시 이후, 양대 마켓 1위를 차치했었고 여전히 매출 상위권을 유지하며 <b>모바일게임</b>추천으로 꾸준히 언급되고 있습니다. 저도 최근 가장 꾸준히 하고 있는 <b>게임</b>인데요. 미소녀 파일럿의 수집과 메카닉... ",게임앤리뷰,https://blog.naver.com/ideungam,20210610
<b>모바일게임</b>추천 킹스레이드 쿠폰에다가 코스튬까지!?,https://blog.naver.com/114632?Redirect=Log&logNo=222414242627,"인<b>게임</b> 보상을 위해 [ 쿠폰 ]을 공개 하였답니다. 뿐만 아니라 신규 코스튬 중 하나를 무료로 배포하여, 플레이하기 정말 좋은 타이밍이라 볼 수 있는데요. 덕분에 <b>모바일게임</b>추천으로 거듭 거론되고 있는... ",소냉순,https://blog.naver.com/114632,20210629
"신작<b>모바일게임</b> AFK 삼국지, SD라서 귀여운 수집형RPG추천",https://blog.naver.com/meniereman?Redirect=Log&logNo=222370212880,"군단전과 서버 대전, 보스 레이드 등의 대규모 전투까지 스마트하게 즐길 수 있어 요즘 시대에 딱 맞는 신작<b>모바일게임</b>이라는 생각이 드네요. 타 <b>게임</b>들과는 다르게 전례 없는 무차별 지급을 약속하기도... ",매니에르의 게임 블로그,https://blog.naver.com/meniereman,20210527
롤플레잉 수집형 <b>모바일 게임</b> 여왕천하 집에서할수있는취미로... ,https://blog.naver.com/mastermyth?Redirect=Log&logNo=222364828371,"특히 집에서할수있는취미라고 소개 드렸는데 <b>게임</b>이 무겁다면 마음이 가질 않으실 텐데, 롤플레잉 수집형<b>모바일게임</b>의 가장 중요한 매력을 가지고 있으니 걱정하지 않으셔도 됩니다. 바로 '쉽다'라는 거죠. SD... ",겜군의 게임 매뉴얼,https://blog.naver.com/mastermyth,20210524
백야극광 쿠폰과 5성 로빈 얻기 [<b>모바일게임</b> 사전예약],https://blog.naver.com/meniereman?Redirect=Log&logNo=222391729231,"참신한 시스템 덕분에 지난 26일까지 진행된 CBT에서도 호평이 쏟아지고 있으며, <b>모바일게임</b> 사전예약... 100만 돌파한 <b>모바일게임</b> 사전예약 <b>모바일게임</b> 사전예약에 참여한 인원수가 100만 명을 돌파하여, 누적... ",매니에르의 게임 블로그,https://blog.naver.com/meniereman,20210609
<b>모바일게임</b>추천 킹스레이드 지금이 복귀할 타이밍이다!!,https://blog.naver.com/totogi777?Redirect=Log&logNo=222370218261,"이 외에도 여러 업데이트가 있었고, 업데이트로 인해 보상을 받을 수 있어 <b>모바일게임</b>추천을 원한다면 <b>게임</b>을 하기 가장 좋은 타이밍이라 할 수 있습니다. 먼저 [영웅 특별 던전 - 에피소드 : 이사야] 가 오픈... ",건빵이 블로그,https://blog.naver.com/totogi777,20210527
할만한<b>모바일게임</b> 찾고 있다면 새로 나온 퍼즐 오브 Z!,https://blog.naver.com/fun3200?Redirect=Log&logNo=222383371316,장르 자체가 많은 편이라 지루할 일이 없어 오픈 전부터 할만한<b>모바일게임</b>이라는 생각이 들었는데 그 생각이 맞았던 거 같아요. 우선 <b>게임</b>에서 중요한 역할을 하는 영웅들에 대해서 알아보도록 하죠. 영웅은... ,사라한,https://blog.naver.com/fun3200,20210603
"원더아레나 쿠폰공유, 방치형 <b>모바일 게임</b> 괜찮네요.(등급표x... ",https://blog.naver.com/hyjueng?Redirect=Log&logNo=222366979126,방치형 <b>모바일 게임</b> 원더아레나 안녕하세요. 다양한 <b>게임</b> 소식을 알려드리는 꿈의왈츠입니다. 요새 정말 많은 방치형 <b>모바일 게임</b>이 출시되는 것 같습니다. 오늘 소개해드리는 원더아레나도 방치형... ,꿈속에서도 게임을!!,https://blog.naver.com/hyjueng,20210525
<b>모바일게임</b>매출순위 주목 기적의 검 X 외모지상주의 콜라보... ,https://blog.naver.com/zzminuda?Redirect=Log&logNo=222393176583,과연 이런 판타지적인 요소가 가득 담긴 웹툰을 기적의 검과 어떻게 콜라보 했으며 <b>모바일게임</b>매출순위가 왜 상승하게 되었는지 지금 바로 알아보겠습니다! 먼저 <b>게임</b>을 접속하기만 해도 어마어마한 아이템을... ,늘늘 블로그,https://blog.naver.com/zzminuda,20210610
<b>모바일게임</b> 서머너즈워 백년전쟁 이거 재밌나요?,https://blog.naver.com/fun3200?Redirect=Log&logNo=222334179678,요즘 <b>모바일게임</b>을 매일 하고는 있지만 하다말다 하다말다 진짜 재밌는 <b>게임</b>을 찾는 게 너무 어려운 거 같아요. 현재 하고 있는 찐 <b>게임</b>은 쿠키런킹덤과 바람의나라연인데 쿠키런킹덤 같은 경우 과금없이는... ,사라한,https://blog.naver.com/fun3200,20210503
"<b>모바일게임</b>추천 AFK 삼국지 초보 공략 쿠폰, 방치형RPG추천",https://blog.naver.com/doek11?Redirect=Log&logNo=222388413817,"얼마 전 출시되어 큰 인기를 누리고 있는 AFK 삼국지는 <b>모바일게임</b>추천 리스트에 이름을 올릴만하다.... 정식 오픈을 기념하여 <b>게임</b> 내에서도 다양한 이벤트가 진행 중이지만, 공식 카페에도 만만치 않게... ",네오필 블로그,https://blog.naver.com/doek11,20210607
"<b>모바일게임</b>순위 2021년 6월 3주차, 제2의나라 VS 리니지... ",https://blog.naver.com/kkodug9?Redirect=Log&logNo=222401769898,"하지만 둘 다 한 번씩 타격을 줬다는 것만으로도 한국 <b>모바일게임</b>에서 꽤나 흥미로운 일이었다고 볼 수 있겠는데요. 제2의나라는 신규 캐릭터, 업데이트, 이벤트 등 앞으로 날개를 달 수 있는 <b>게임</b>이기에 다음... ",영원한도시 블로그,https://blog.naver.com/kkodug9,20210618
"<b>모바일게임</b>순위 -5월 셋째주(역시 트릭스터M, 소녀X헌터... ",https://blog.naver.com/useful1102?Redirect=Log&logNo=222366174585,(출처 : 원신 공식카페) 지금까지 5월 3주차 <b>모바일게임</b> 순위였습니다. TOP30 순위권 밖의 <b>게임</b> 중 아쉽게 순위권 안에 진입못한 <b>게임</b>들 중에서는 지난 4월에 출시한 신명2 : 아수라가 33위를 기록하였다는 소식을... ,생각들이 모여 철학이 된다.,https://blog.naver.com/useful1102,20210526
RPG<b>모바일게임</b>순위 원펀맨: 최강의 남자 후부키 획득,https://blog.naver.com/tsuken?Redirect=Log&logNo=222348279710,더불어 <b>게임</b> 자체의 몰입도를 높이기 위한 더빙과 스토리 연계성을 보유하고 있는 관련 RPG <b>모바일 게임</b>을 찾고 있었다면 원펀맨: 최강의 남자 플레이를 권장한다. (구글 플레이 / 공식 카페) 해당 <b>게임</b>사로부터... ,츠켄의 게임노트,https://blog.naver.com/tsuken,20210512
<b>모바일게임</b> 5월 기대작 TOP4 총정리(추억의 명작 등장),https://blog.naver.com/cowai?Redirect=Log&logNo=222339402044,"(최근 스트리트 파이터와 콜라보를 진행했는데 춘리가 좋다는 소문이...) <b>모바일 게임</b>은 돈이 된다고, <b>게임</b> 장르는 수집형RPG 캐릭터 뽑기다. 필자처럼 만화를 잘 모르는 요즘 세대라도 <b>게임</b> 플레이를 통해서... ",cowai 코와잉,https://blog.naver.com/cowai,20210505
오리진] 판타지소설 끝판왕! <b>모바일게임</b> 출격 준비!! 사전예약 리뷰,https://blog.naver.com/sachiel5?Redirect=Log&logNo=222391437725,드래곤라자 오리진 영상 이렇게 기대 많이 되는 <b>모바일게임</b> 관련 이야기해봤는데 원작이 워낙 대박이라서 <b>게임</b>도 덩달아 기대가 많이 된다. 원작에서 보여줬던 그 판타지의 리얼한 현실감을 <b>게임</b> 속에서도 잘... ,사키엘의 블로그,https://blog.naver.com/sachiel5,20210609
신작<b>모바일게임</b> 프린세스테일 리뷰 간단하게 즐기는 <b>모바일</b>RPG,https://blog.naver.com/dewichien?Redirect=Log&logNo=222356200481,"가장 먼저 개발사가 국산 개발사 '<b>게임</b>펍'이다. 방치형 <b>모바일</b> RPG나, 신작<b>모바일게임</b>을 접하는 과정에서 여러분들은 늘 '먹튀'에 대한 고민을 하곤 한다. 프린세스테일은 그러한 걱정에서 다소 자유로운 편이다.... ",절망에 복종하라!,https://blog.naver.com/dewichien,20210518
넷마블의 신규 <b>모바일게임</b> 제2의나라 사전예약 후기,https://blog.naver.com/sanmax0519?Redirect=Log&logNo=222390370834,민수르입니다~ 넷마블의 신규 <b>모바일게임</b>인 제2의나라 출시가 얼마 남지 않았는데요. 제2의나라는... 있고 <b>모바일</b> 기기인 아이폰 혹은 아이패드에서만 가능합니다. 아이폰 앱스토어에서 사전예약 중인 <b>게임</b>에... ,민수르의 추억창고,https://blog.naver.com/sanmax0519,20210608
하반기 최고의 기대작 미니어스를 <b>모바일게임</b>추천하는 이유!,https://blog.naver.com/haleejjang1?Redirect=Log&logNo=222437421402,평소 <b>모바일 게임</b>에 관심이 있거나 할만한 <b>게임</b>을 찾고 있다면 지금부터 미니어스를 <b>모바일게임</b>으로 추천하는 이유를 들어보시고 사전예약에 참여하여 출시 후 재밌게 즐겨보시길 바라겠습니다! 미니어스는... ,발컨아 게임블로그,https://blog.naver.com/haleejjang1,20210719
미소녀와 메카닉의 만남 파이널기어 <b>모바일게임</b>추천,https://blog.naver.com/arisukawa?Redirect=Log&logNo=222389096596,미소녀와 메카닉의 만남 파이널기어 <b>모바일게임</b>추천 메카닉 디자인의 거장 카와모리 쇼지가 직접 디자인한 메카닉과 고급 미소녀 일러스트가 어우러진 <b>게임</b> 파이널기어가 <b>모바일게임</b>추천에 오르며 큰 관심을... ,바이탈포스의 소소한일상,https://blog.naver.com/arisukawa,20210608
<b>모바일게임</b>)워킹데드: 서바이버즈 플레이,https://blog.naver.com/dn98172?Redirect=Log&logNo=222434853313,이런 <b>모바일게임</b>류는 혼자서 하는 편이지만 원채 워킹데드가 프렌차이즈가 크고 해서 한 번 영상으로 올려본 겁니다. 물론 일반적인 <b>모바일게임</b>과 차이는 없다고 봐도 되겠지만요;;;... ,딩고의 게임과 여러가지 관찰소,https://blog.naver.com/dn98172,20210717
<b>모바일게임</b>모니터링 운영대행으로 관리하기,https://blog.naver.com/dearhanq?Redirect=Log&logNo=222296133717,"모니터링의 저비용 고효율 운영이 가능해짐으로써 기업의 부담이 훨씬 덜해지는 장점이 있죠. <b>게임</b>유저들을 위한 <b>모바일게임</b>모니터링, 문의주시면 친절한 상담 도와드리겠습니다. :) 대표문의: 070-7009-6118",함께하는 에드업,https://blog.naver.com/dearhanq,20210402
"<b>모바일게임</b>추천 V4 업데이트, 프로젝트 솔져 참전용사 기부한다",https://blog.naver.com/tsuken?Redirect=Log&logNo=222391612282,더 나은 <b>게임</b>을 만들기 위해 확 바뀐 <b>모바일게임</b>추천 V4가 최근 업데이트와 더불어 호국 보훈의 달을 맞이하여 프로젝트 솔져라는 한국전쟁 참전용사 기부 캠페인에 적극 참여한 소식이 공개됐다. 프로젝트... ,츠켄의 게임노트,https://blog.naver.com/tsuken,20210609
<b>모바일 게임</b> 순위 5월 3주 차 주말 유료 간략하게 보시죠.,https://blog.naver.com/fun3200?Redirect=Log&logNo=222359339215,엊그제가 휴일이라서 그런지 오늘 금요일인데도 불구하고 주말 <b>모바일게임</b>순위를 작성하는데... 간단한 <b>게임</b>이더군요. 9위 풋볼 매니저 2021 <b>모바일</b>입니다. 이건 항상 상위에 있는데 참 신기합니다! 축구를... ,사라한,https://blog.naver.com/fun3200,20210521
"신규<b>모바일게임</b> 여왕천하, 롤플레잉 혜자<b>게임</b>으로 이건 어때?!",https://blog.naver.com/greedady?Redirect=Log&logNo=222372052943,특히 신규<b>모바일게임</b>으로 출시되는 <b>게임</b>들이 슬슬 식상하고 지겹게 느껴지신다면 조금은 색다른 경험을 해볼 필요도 있을 것 같은데요. 그런 면에서 이번 포스팅을 통해 소개해 드릴 롤플레잉 혜자<b>게임</b>... ,인포머의 웨어하우스,https://blog.naver.com/greedady,20210528
