title,link,description,bloggername,bloggerlink,postdate
"02102014(월) 금연 내기턱 점심 먹다, 나무 하다, <b>고스톱</b>... ",https://blog.naver.com/hoang802?Redirect=Log&logNo=70184683948,"오후에 우리집에 사람들 모여 일부는 옆산에서 나무 자르고, 일부는 <b>고스톱</b>하다 *** - 오늘아침까지... - 점심을 함께 먹은 사람들이 모두 우리집으로 모여 일부는 나무를 베고, 일부는 <b>고스톱</b>을 친다. <b>고스톱</b>을... ",hoang802님의 블로그,https://blog.naver.com/hoang802,20140211
쪼꼬의 <b>고스톱</b>,https://blog.naver.com/chocoo_o?Redirect=Log&logNo=110094261776,쪼꼬 나이 20살때 까지 <b>고스톱</b>을 할 줄 몰랐어요. 거짓말 같다고요?? 진짜입니다!! 하지만 어릴때 간간히 고모들이 놀러 오실때면 새벽까지 <b>고스톱</b>으로 시끌벅쩍... 고모 셋이랑 고모부랑.. 언니들이랑 형부들이랑... ,Choco's Andromeda,https://blog.naver.com/chocoo_o,20100921
구경하고 구룡포과메기랑 <b>고스톱</b>바지사왔어여 ㅎㅎ,https://blog.naver.com/kjh60133?Redirect=Log&logNo=50127955813,만난 <b>고스톱</b>바지~ 5000원 사왔어여 ㅋㅋ 벨로라... 부들부들하지만 따듯하진 않을듯 <b>고스톱</b>칠때 오래앉아있어도 무릅이 나오지않아서 그런가요..<b>고스톱</b>바지..라는 이름이 붙었어요 음..<b>고스톱</b>치면 기본... ,예삐언니 유럽자동차여행 또다시 꿈꾸다.,https://blog.naver.com/kjh60133,20111201
현금<b>고스톱</b> 행복해지는하루 qf6kv1,https://blog.naver.com/monger87346?Redirect=Log&logNo=222403316669,"현금<b>고스톱</b> 행복해지는하루 qf6kv1 올라가겠습니다. 지금 가져오죠. 빨리 말했어요. 쿵쿵거리며 장기를... 그 소리는 현금<b>고스톱</b> 소비되었고, 사형은 한때 구겨졌고, 그녀는 252세가 아니었고 냉소적이었다. 이제... ",✅✅홀Z덤K바M둑j이9✅✅,https://blog.naver.com/monger87346,20210619
Le 18 septembre 2017 - Jeu truqué 짜고 치는 <b>고스톱</b>,https://blog.naver.com/miarodo?Redirect=Log&logNo=221100064495,이번 경기는 그 결과가 시작 전부터 조작돼 있던 짜고 치는 <b>고스톱</b>이었다. 미국인들이 손을 대는 순간부터 모든 게 썩는다. 미국인들은 뭐든지 조직질할 수... ,Montreal Guerilla Gorilla!,https://blog.naver.com/miarodo,20170919
"[일상] <b>고스톱</b> 퍼즐과 밤, 로켓 종이접기!",https://blog.naver.com/gratias531?Redirect=Log&logNo=222263959608,계속 놀아주려 하다 보니 슈퍼마더도 지쳐가지고 ㅋㅋㅋㅋㅋ &lt;<b>고스톱</b> 퍼즐 / 화투 퍼즐 / 효도 퍼즐&gt; 여러분 <b>고스톱</b> 퍼즐을 본 적이 있으신가요?ㅋㅋㅋㅋㅋ 저희 친정엄마도 사회복지 분야에서 일하셔서... ,꿈꾸는 작은 세상,https://blog.naver.com/gratias531,20210304
2019년 01월 11일(금)~12일(토) <b>고스톱</b>,https://blog.naver.com/tommypage?Redirect=Log&logNo=221553449872,"2019년 01월 11일(금)~12일(토) <b>고스톱</b> 아버님 기일이라서 모인 사촌형제들과 당구장을 가려 했으나, 당구장이 문을 닫아 집에서 1.12(토) 새벽에 <b>고스톱</b> 한판. 이 중에 선수는 따로 있다. 그 선수는 져주기 위해... ",가장사랑하는사람이가장아프게한다,https://blog.naver.com/tommypage,20190609
<b>고스톱</b> 레슨,https://blog.naver.com/ja3114?Redirect=Log&logNo=221724977627,올해 꼭 배우기로 맘 먹은 <b>고스톱</b>!!! 남편에게 사정 사정해서 겨우 배웠어요. 계산 연습해서 치매 예방도 하고 나이 먹어 둘이 심심할 때 놀이라도 할겸!! 남편은 선택과 집중이 중요하다고.. 저는 고 할 때와... ,지나리,https://blog.naver.com/ja3114,20191202
짧은 <b>고스톱</b>(?) 여행,https://blog.naver.com/olivejin21?Redirect=Log&logNo=60055549622,비발디파크에 와서 난 다리를 다쳐서 물에 들어갈 수 없었지만 다들 낮에는 오션월드 간다 하더니 <b>고스톱</b>판에 파묻혀 우리는 새벽까지 달렸다.. 술? 아니.. <b>고스톱</b>...ㅋㅋㅋ 아침 10시 반.. 종합운동장에서... ,올리브 이야기,https://blog.naver.com/olivejin21,20080925
조금은 갑작스런 <b>고스톱</b> 처돌이행,https://blog.naver.com/newnessoh?Redirect=Log&logNo=222173312043,그냥 예쁘기도 하고 엄마 재밌게 해주려고 <b>고스톱</b>알못 주제에 화투장을 사버렸다 근데 생각보다... 돈 대신 칩 걸고 하니까 존나 본격적인 느낌이라 과몰입하게 되고요 암튼 시간 날때마다 벌건 눈으로 <b>고스톱</b>... ,who da fck is romy?,https://blog.naver.com/newnessoh,20201214
<b>고스톱</b> 모바일로 대박을 노려보자! 신맞고 보단 뉴맞고!,https://blog.naver.com/foxc987?Redirect=Log&logNo=220282085419,<b>고스톱</b> 모바일로 대박을 노려보자! 신맞고 보단 뉴맞고! 안녕하세요~ 오늘은 저번에도 한번 소개해드렸던 <b>고스톱</b> 모바일 뉴맞고를 소개해드리려고 합니다. 신맞고와 뉴맞고를 같이 하고 있지만 신맞고에서는... ,제목없음,https://blog.naver.com/foxc987,20150224
부부의 날//<b>고스톱</b>,https://blog.naver.com/lhks1051206?Redirect=Log&logNo=222360744665,화합하는 의미로 <b>고스톱</b>한판하고 가실께요~^ 얼마전부터 치매예방차원에서 배우기시작. 승부욕 발동하긴하네요 ㅎ오늘은 빚을 좀갚았네요 ㅋㅋ. 가상화폐라면서 투덜대는 남편 내일 부부의날 에프터로... ,삶의 향기에 취해,https://blog.naver.com/lhks1051206,20210521
"<b>고스톱</b> 내기에서 루저, 루저는 홍익돈까스를 쐈숩니다(!)",https://blog.naver.com/minyoung__e?Redirect=Log&logNo=130180466080,"<b>고스톱</b> 내기에서 루저, 루저는 홍익돈까스를 쐈숩니다(!) 일요일 오후, 비가 내릴랑 말랑 그래도 주부는... 부부가 더치페이를 할 순 없쟈냐~ 모냥빠지게 ㅋㅋㅋㅋㅋㅋㅋ 결국 <b>고스톱</b> 100점 내기에 돌입. 초반... ",사소함속 특별함 찾기 :),https://blog.naver.com/minyoung__e,20131125
<b>고스톱</b> 좋아하세요?,https://blog.naver.com/kky1296?Redirect=Log&logNo=222253312936,#<b>고스톱</b> #치매예방 #치매 #무서운질병 #슬픈질병 #경증치매 #중등도치매 #중증치매 <b>고스톱</b> 좋아하세요? <b>고스톱</b>이 치매 예방에 도움이 된다는 얘기 들어본 적 있으신가요? 치매가 단순히 머리를 쓰지 않아... ,마음을 더하다 헤 아 림,https://blog.naver.com/kky1296,20210223
법과 돈이 짜고 치는 <b>고스톱</b>에 당한 사람을 함께 구제할 사람은... ,https://blog.naver.com/sjhannah?Redirect=Log&logNo=220771663806,짜고 치는 <b>고스톱</b>에 당한 것이다. 가진 자들과 법을 다루는 사람들 사이에 희생되는 서민들의... 분명 법이 자신들의 편인 줄 알았는데 짜고 치는 <b>고스톱</b>에 고스란히 빼앗기는 일이 비일비재하다. 그들끼리... ,함께하는 사회(송세준): 서로 나누고 봉사하고 어울림,https://blog.naver.com/sjhannah,20160726
개봉예정영화-<b>고스톱</b>살인 소개할께요,https://blog.naver.com/brother501?Redirect=Log&logNo=206323883,"한국영화 : <b>고스톱</b> 살인 개봉예정 D-7 (03.20) 주연 : 이승준, 권남희, 김홍파 ( 두분다 낮선 붙이긴 하지만... 보시면 알아요) 줄거리 목장에선 매일같이 <b>고스톱</b>판이 벌어져요 멤버는 목장청년인 상이(이승준 씨)... ",유소,https://blog.naver.com/brother501,20140316
#추석 #라이트아웃 #왕십리CGV #신안활새우 #슈렉팩 #명절<b>고스톱</b>,https://blog.naver.com/qhr3333?Redirect=Log&logNo=220833643755,"100 <b>고스톱</b>을 정답게 치고, 역시나. 언제나 그렇듯. 타자에겐 못 당함을 깨닫고, 출근 할 때 이뻐보이고 싶어, 슈렉펙도 사서 써봤고, 그 얼굴이 그 얼굴이고, 그 피부가 그 피부고, 라고 생각하던 찰나! 그 얼굴이... ",뵹뵹김치찌개,https://blog.naver.com/qhr3333,20161011
"설날 명절에는 조약돌 화투, 냥투로 <b>고스톱</b> 한 판 / 괄호프로젝트",https://blog.naver.com/nimiralism?Redirect=Log&logNo=220919011492,블로그 이웃이신 '미랑'님이 제가 '냥투'로 <b>고스톱</b> 치는걸 좋아하는걸 너무 잘 아셔서 이 '조약돌 화투... <b>고스톱</b> 칠 때 느낌이 확 다를거 같습니다. 패들을 한 번 살펴봤어요. 불긋불긋하지 않고 바탕이 환해서... ,천사눈망울 Enjoy Your Hobby,https://blog.naver.com/nimiralism,20170124
<b>고스톱</b>에 빠진 새댁 / 맛있는 일상들 / 끝나지 않은 건강이상...!,https://blog.naver.com/jimny_92?Redirect=Log&logNo=222261278595,"첫 설을 맞이한 저는 시댁에가서 <b>고스톱</b>을 배웠습니다.. 너무 내 취향저격인 것..!!!!! 이렇게 재미난걸 서른에 배웠어요!!!! 남편과 배불러서 산책하고 집 들어가서 새벽 2시 까지 시부모님과 남편과,, <b>고스톱</b>... ",jimin | slo-w-ise,https://blog.naver.com/jimny_92,20210302
#센치#쌀쌀#웹툰#<b>고스톱</b>#일상#비그만와#감상,https://blog.naver.com/mokpopandora?Redirect=Log&logNo=220329374760,"친구가 있는데 부르고 싶었습니다,,ㅋㅋ 아무것도 하기 싫었던 저에게 <b>고스톱</b> 설거지내기 도전장을 냅니다!!ㅋㅋㅋ 훗~가소로운,,,, 언제한번 내기를 걸고 한번 당한적이 있어서ㅜㅜ 반드시 이기리라!! 다짐을... ",mokpopandora님의 블로그,https://blog.naver.com/mokpopandora,20150413
<b>고스톱</b> 배우는중욤,https://blog.naver.com/shj223?Redirect=Log&logNo=90041707860,요새 손호준한테 고스돕을 배우고 있는 중입니다 맨날 컴퓨터 앞에 앉아있느니 차라리 <b>고스톱</b>을... 다 <b>고스톱</b>하는데 뒤에서 손가락 빨고 있는게 비참해 보일까봐서가 아님ㅇㅇ 룰도 까다로운게 몇개 있지만... ,빙산이론,https://blog.naver.com/shj223,20090204
인생역전! <b>고스톱</b> 재무설계,https://blog.daum.net/jclub2000/5801044,<b>고스톱</b> 재무설계 » 20대 후반 여성의 조정 전 지출입 내역 국민게임 <b>고스톱</b>과 재무설계는 상당히 닮은 점이 많다!! 필자는 한때 지인들 사이에서 ‘현금지급기’라고 불릴 만큼 <b>고스톱</b>을 못했었다!! 재무설계를... ,jclub,https://blog.daum.net/jclub2000,20080726
한미FTA는 <b>고스톱</b>인가,https://blog.naver.com/kos4042?Redirect=Log&logNo=110122876423,화투판에서 <b>고스톱</b>을 외칠 수 있는 사람은 패를 쥔 자다. 과연 한국은 한미FTA의 <b>고스톱</b>을 외칠 패를 쥐고 있는가? 신탁통치 찬성측과 반대측이 정면 충돌했던 반세기 전처럼.... 오늘날 한미FTA 체결 여부를... ,내 운명의 지배자,https://blog.naver.com/kos4042,20111103
퀼트 동전지갑-<b>고스톱</b>!,https://blog.naver.com/pungkii?Redirect=Log&logNo=80090583114,"<b>고스톱</b>~~! <b>고스톱</b>에 필수인 동전을 넉넉히 넣을수 있는 동전지갑, 실력이 좋으셔서 지폐가 쌓여도 걱정마세요~~ 지폐도 넉넉히 넣을수 있으니까요~~^^ 속도 크고 바닥도 넉넉해서 동전을 넣고 꺼내기가 아주... ",퀴니퀼트,https://blog.naver.com/pungkii,20090914
[보험이야기-<b>고스톱</b>화법] 보험의 6가지 영역을 어떻게... ,https://blog.naver.com/ticojin2?Redirect=Log&logNo=220917379746,"<b>고스톱</b> 화법? 명절이나 장례식장에 빠질 수 없는 종목이 있다면, <b>고스톱</b>이 아닐 수 없다. 여러장의 카드를 조합하여 점수를 내고, 점수에 따라 먼저 획득한 사람이 승리를 하는 게임이다. 이 게임에 돈을... ",항 무 긍 마~~!!!!,https://blog.naver.com/ticojin2,20170122
<b>고스톱</b> 숫자! 비풍초똥팔삼,https://blog.naver.com/leehappy825?Redirect=Log&logNo=220524418891,<b>고스톱</b> 숫자 잘 외웁시다 ㅋ.ㅋ1 2 3 4 5 6 7 8 9 10 11 12 한 때 <b>고스톱</b>에 빠져서 친구와 벌칙으로 점당 윗몸일으키기로........기억이 새록새록 돋네요 ㅋ.ㅋ몇 시간 동안 쳤던... 허리 아파서 누워서 치고..... ,내 삶 누리기,https://blog.naver.com/leehappy825,20151101
<b>고스톱</b>,https://blog.naver.com/jeon5086?Redirect=Log&logNo=140170058391,"<b>고스톱</b>(GOSTOP)... 처음 슬라이드... 고돌이 두장, 구사 두장, 피 열두장, 피로 3점 난상태, 고냐 스톱이냐 당연히 못먹어도 GO지. 찾아온 기회인데... 다음 사진.. 구사로 3점나고 고돌이 두장,,, 피세장 정말... ",소중한 기록들이 모여 한권의 책이 된다,https://blog.naver.com/jeon5086,20121011
트럼프와 짜고 치는 <b>고스톱</b>,https://blog.naver.com/youliebe7?Redirect=Log&logNo=221284164160,"결론부터 말하자면, 이번 트럼프의 북미정상회담 보이콧의 진짜속내는 '짜고치는 <b>고스톱</b>' 쯤 된다는 게 내 짐작이다. 비비꼬인 정치판의 의미론을 분해하고 해체하는 일로 밥을 벌어온 삼류 만평쟁이의 직관이... ",시사만평가 유사랑,https://blog.naver.com/youliebe7,20180525
노예되기<b>고스톱</b>은 과연 누가 이겼을까요?,https://blog.naver.com/bbobbo1125?Redirect=Log&logNo=80170372153,ㅋㅋㅋㅋㅋㅋㅋㅋㅋㅋㅋㅋㅋㅋㅋㅋㅋㅋㅋㅋㅋㅋㅋ 알밥까지 싹싹 긁어먹고 마무리 그리고 집 하루동안 노예가 되기로 하고 <b>고스톱</b> 내기를 했어요 원래는 바에가서 맥주한잔 더하며 다트내기 하려다 아놔... ,제이의 즐거운 나의 집,https://blog.naver.com/bbobbo1125,20121002
무심단상: <b>고스톱</b> 성원(成員),https://blog.naver.com/ilovehills?Redirect=Log&logNo=222337442682,이발하러 가면 항상 이발사의 친구 분들 서넛이 한쪽에 모여앉아 <b>고스톱</b> 화토를 쳤다. 돈 따는 것보다... 그 <b>고스톱</b> 판을 벌이던 분들이 한 사람도 없었기 때문이다. 내 머리를 다듬고 있는 이발사한테 한 번... ,무심 이병욱의 문학산책,https://blog.naver.com/ilovehills,20210504
[에세이]  &quot;<b>고스톱</b>&quot;- 그것은 일본이 전해준 망국병,https://blog.naver.com/vyjang?Redirect=Log&logNo=90153430858,그만 <b>고스톱</b>으로 명절을 보내는 이들이 많은 것을 볼수 있습니다. 밤을 새우는 것은 물론이고 돈을 잃은... 그런데 이 <b>고스톱</b>이 우리나라의 국력을 약화시키기 위해서 日本사람들이 보급시킨 계략이며 음모라는... ,장마당의 사진창고,https://blog.naver.com/vyjang,20121001
[당떨시] <b>고스톱</b>은 그만! 젤리밥과 통크로 하는 윷놀이,https://blog.naver.com/orionblog?Redirect=Log&logNo=220617404613,"[오리온타임/당떨시] 십장생과 함께하는 <b>고스톱</b>은 그만! 통크로 하는 윷놀이로 우리가족 설 연휴 심심타파! 함께하면 더욱 즐거운 명절, 설. 가족들과 어떻게 시간을 보내실건가요? 혹시 TV 편성표만... ",오리온 공식 블로그,https://blog.naver.com/orionblog,20160203
<b>고스톱</b>원리,https://blog.naver.com/itranslator?Redirect=Log&logNo=221251481238,"가끔 핸드폰으로 <b>고스톱</b>을 친다. 넷마블~~하고 나오는 음악소리를 들으면서 한번씩 치는데, 문제는 한번... <b>고스톱</b>도 마찬가지다 ㅋㅋ 대박 패가 들어와도 내가 바보같은 실수를 하면 따도 그닥 많이 못 따거나... ",이비(Evy),https://blog.naver.com/itranslator,20180412
<b>고스톱</b> 그림들의 정체.,https://blog.naver.com/ddstar?Redirect=Log&logNo=221397479942,"<b>고스톱</b> 그림들의 정체. 오늘은 이 <b>고스톱</b>. 화투 패 안에 있는 그림들의 의미를 설명드리겠습니다. 그냥 재미로만 보세요! 1. 1월부터 12월까지 4계절이 모두?? 재뉴어리, 페브류어리, 마치~, 에이프릴, 메이, 준... ","ddstar(거북큰형, 우화등선)님의 블로그",https://blog.naver.com/ddstar,20181113
화투점<b>고스톱</b>의 등장인물들~,https://blog.naver.com/manastone?Redirect=Log&logNo=80023733545,<b>고스톱</b>도 치고 화투점도 평생~ 무료로 볼 수 있는 화투점<b>고스톱</b>! 오늘은 이 게임에 등장하는 캐릭터를 간단히 소개해보도록 하겠습니다~ ㅋㅋ 28년간 솔로로 살아왔다. 여자들에게 퇴짜를 많이 맞아 소심한 면이... ,마나스톤의 재미난 Game~ 재미난 Blog~,https://blog.naver.com/manastone,20060422
"창업칼럼니스트-창업자에게 가장 중요한 자질하나,<b>고스톱</b>?",https://blog.naver.com/ilovediacom?Redirect=Log&logNo=220119008705,"정신이다.이 <b>고스톱</b>을 잘 아느냐 모르느냐에 따라 사업의 승패가 갈린다. 내가 여기서 가야 하는... 그럼,어디서 <b>고스톱</b>을 알수가 있을까...아무리 생각해봐도 그건 공부뿐이지 싶다.사람공부,장사공부... ",창업칼럼니스트 창업블로그,https://blog.naver.com/ilovediacom,20140911
"삼겹살 홈파티, <b>고스톱</b> 후유증",https://blog.naver.com/83yurizzang?Redirect=Log&logNo=222235361281,"반 이상이 남았...ㅠ 남은건 내 일용할 양식으로~ㅋㅋㅋ 1차 삼겹살을 끝낸 후, 우리의 <b>고스톱</b>이 시작됐다.ㅋㅋㅋㅋ 처음엔 어떤 파장을 일으킬지 아무도 몰랐다. 처음 쳐본다는 지쨩은 <b>고스톱</b>의 신이 될듯한... ",율이의 일본생활,https://blog.naver.com/83yurizzang,20210207
<b>고스톱</b>과 피자파티,https://blog.naver.com/teriusj?Redirect=Log&logNo=34160860,우리 마누라가 가장 즐겨하는 게임이다...<b>고스톱</b>...취미생활이기도 하다. 특히 내 돈 따먹는 재미가 가장... 배고파 죽는 줄 알았다... 오늘은 완죤히 피박썻다..... 이눔의 <b>고스톱</b> 다시는 안친다...,정민&원준's home,https://blog.naver.com/teriusj,20070207
1. 브레인 스토밍(<b>고스톱</b> 기법/비주얼브레인스토밍),https://blog.naver.com/pr1878?Redirect=Log&logNo=60009602895,브레인 스토밍(<b>고스톱</b> 기법/비주얼브레인스토밍) | 스킬-브레인스토밍 2004/03/10 17:04 http://blog.naver.com... <b>고스톱</b> 기법 소개 : Go/Stop기법은 브레인 스토밍 과정에서 도출된 아이디어를 1차 평가하여 Action Plan이... ,마케팅홍보연구소,https://blog.naver.com/pr1878,20050126
추석 <b>고스톱</b>,https://blog.naver.com/portugal4?Redirect=Log&logNo=221110506467,모처럼 <b>고스톱</b>을 쳤다. 쓰리고에 양박이 한 번도 안나올 정도로 치열했다. 전에 다들 일이 바쁘고 힘들고 잘 안풀리고 할 때는 <b>고스톱</b>도 재미없더니 생활이 안정되고 여유가 생기니 참 재미있었다. 특히... ,박헌정의 하루한편,https://blog.naver.com/portugal4,20171004
함께 써야죠^^(한율 섬빛 시트 마스크 붙이고 벌이는 <b>고스톱</b> 한판!),https://blog.naver.com/goodluck0515?Redirect=Log&logNo=120115842445,물론 저희 집에서도 일년에 두번(추석과 설날) <b>고스톱</b>판이 펼쳐집니다. 한시간이 족히 넘는 시간~~ 그냥 화투 치는 것보단 피부관리 하면서 <b>고스톱</b>치는게 나을 듯 싶어 한장씩 붙여드렸어요ㅎㅎ 이 기념사진... ,웃으며 Hello:),https://blog.naver.com/goodluck0515,20100929
무료<b>고스톱</b>다운받기 꽁짜,https://harryier.tistory.com/entry/%EB%AC%B4%EB%A3%8C%EA%B3%A0%EC%8A%A4%ED%86%B1%EB%8B%A4%EC%9A%B4%EB%B0%9B%EA%B8%B0-%EA%BD%81%EC%A7%9C,안녕하세요 오늘 이시간에는 심심풀이로는 최고의 게임인 <b>고스톱</b>을 준비를 해보았어요. 컴퓨터와... 바로 무료<b>고스톱</b>다운받기 안내해볼게요. 위에 보이시는 사이트에서 무료로 다운로드 받아보실수가... ,harryier,https://harryier.tistory.com/,20190613
[DL오픈] 심심탈출 게임전집 맞고&amp;<b>고스톱</b> 편 : 두번째로... ,https://blog.naver.com/sso9409?Redirect=Log&logNo=220246973375,심심탈출 게임전집 맞고&amp;<b>고스톱</b> 편 제작사 닌텐도 발매일 2010년 4월 15일 호환기기 닌텐도 DSI... 간단하게 말하면 맞고&amp;<b>고스톱</b> 온라인으로 재미있게 해서 그런지 닌텐도 게임중 이게 생각이나서 궁금해서... ,한 블로거의 작은 공간,https://blog.naver.com/sso9409,20150121
<b>고스톱</b>에서 배울점,https://blog.naver.com/dagne?Redirect=Log&logNo=10079921558,어제 모연구소장에게 할 이야기가 있어 들렀다가 우스게 소리도 하는 이야기가 '5급처럼 바둑 둔다' 라는 이야기와 '<b>고스톱</b>' 치는 이야기가 나와 그중 <b>고스톱</b> 이야기를 적어둔다. #. 남과는 다른 나만의 전략을... ,비단산팔공법사의 생활기록,https://blog.naver.com/dagne,20100202
피망<b>고스톱</b> 알아보자,https://blog.naver.com/dkvmsalfo?Redirect=Log&logNo=221942344846,피망<b>고스톱</b>이라고 하는 게임을 평소에 알아보셨던 분들을 위해 한번 봤습니다. 명절 혹은 친구들끼리 모이는 자리에서 할게 없을때 한번쯤 <b>고스톱</b>이라고 하는 것을 하는 분들이 있습니다. 이는 다양한 기술과... ,만났다는거,https://blog.naver.com/dkvmsalfo,20200503
<b>고스톱</b>,https://blog.naver.com/hsbysjs?Redirect=Log&logNo=60092199291,"차례를 마치고 온 식구가 빈둥빈둥하고 있는데 아름이가 제 엄마한테 <b>고스톱</b>을 가르쳐 준단다. &quot;엄마, 내가 <b>고스톱</b> 가르쳐 줄까? 되게 재밌어.... &quot; 태어나서 집에서 화투 치는 것을 본 적이 없으니 당연하게... ",구루메달,https://blog.naver.com/hsbysjs,20091003
<b>고스톱</b>에 미쳤다...,https://blog.naver.com/dark2728?Redirect=Log&logNo=40008459478,언냐가 <b>고스톱</b> 오랜만에 하지 않을래라는 말에 혹 해서 시작하게 되었다...돈이 없는 빈곤한 삶이라... 첫판부터 내가 25대를 맞고 복수심에 불타 장장 3시간동안 미친듯이 <b>고스톱</b>을 했더랬다...그 결과 내 팔은... ,FULL MOON,https://blog.naver.com/dark2728,20041202
설 특집 <b>고스톱</b> 수련기.,https://blog.naver.com/i870402?Redirect=Log&logNo=100010104181,우리 가족중 <b>고스톱</b>을 칠줄 아는사람이 아부지 뿐.. 그외에 부양식구는 <b>고스톱</b>을 할줄 몰랐다. 그러나.. 심심한 설 연휴를 보내기 위해.. 가족들의 치매예방 차원에서..ㅡ_ㅡ.. 시작했다. 그것이.. 불행의 전주곡.... ,黑白論理,https://blog.naver.com/i870402,20050211
<b>고스톱</b> or 마니또,https://blog.naver.com/saintoh?Redirect=Log&logNo=30088786003,둘 셋만 모이면 <b>고스톱</b> 대신 이벤트를 하자 여러분은 일년 중 어떤 날을 가장 손꼽아 기다리는가?... 아마 대부분 셋만 모여도 즐길 수 있는 오랜 전통을 가지고 있는 <b>고스톱</b>을 들 수 있을 것이다. 온 국민이 다 할... ,캐나다 밴쿠버 마당발 해피셜리스트,https://blog.naver.com/saintoh,20100628
"후기, 탑텐 베이직T 3,900원 득템, 민락 화로상회, <b>고스톱</b> 내기",https://blog.naver.com/dltlsdo666?Redirect=Log&logNo=222375503089,오늘도 잘 먹고 잘 놀았당❤️ #<b>고스톱</b>내기 #티타임당번정하기 이번 주 티타임 당번은 누구???? 일주일 티타임을 걸고 <b>고스톱</b> 내기!!! 월화수금 남편 당첨!!! 나의 완승이다 하하하하하하하 목요일은 야근이라... ,소소한 일상블로그,https://blog.naver.com/dltlsdo666,20210530
대형 <b>고스톱</b>놀이♥청주상당구서원구청원구흥덕구주간보호... ,https://blog.naver.com/zmstkfkd98?Redirect=Log&logNo=222431182492,♥대형 <b>고스톱</b>놀이♥ 청주큰사랑노인주간보호센터 안녕하세요^^! 큰사랑노인주간보호센터 입니다~ 오늘은 맞춤프로그램 융합놀이 시간입니다~~~ 진행 할 프로그램은 대형 <b>고스톱</b>놀이 !!! 어르신들에게 매우... ,큰사랑노인주간보호센터(금천용담용암동☎222-8338 ☎,https://blog.naver.com/zmstkfkd98,20210714
[화투 치는법] <b>고스톱</b> 기본 룰 총정리! 이거 보고 싸우지 말자!,https://blog.naver.com/ilsungconst?Redirect=Log&logNo=222101749369,"오늘은 화투 치는법 기본 중에 기본인 <b>고스톱</b> 룰 총정리를 준비했습니다. 엄마도, 삼촌도 우기기 없기! 화투 치는 법 : <b>고스톱</b> 기본 룰 <b>고스톱</b>의 시작은 3명의 인원이 필요합니다. (2명일 경우에는 맞고로... ",일성건설 공식블로그,https://blog.naver.com/ilsungconst,20200928
짜고 치면 <b>고스톱</b>도 이렇게 될 수 있을까?,https://www.hyongo.com/1064?category=271487,"[ 일본시리즈 결산 ] '어쩜 이럴 수가 있을까?' 짜고 치는 <b>고스톱</b>도 이럴 수 있을까 싶군요. 한미일... 09 짜고 치면 <b>고스톱</b>도 이렇게 될 수 있을까? (0) 2009.11.09 ‘선덕여왕’ 미실의 죽음, 복잡한 남자관계... ",세상을 보는 큰 눈,https://www.hyongo.com/,20091109
"2020.02 기록 _ 눈, 건강, <b>고스톱</b>, 생생톡톡 비타C",https://blog.naver.com/leesong128?Redirect=Log&logNo=221817010751,"치킨 <b>고스톱</b> 배그 수욜 저녁에는 또 타짜들?이 모임 요즘 꿀잼 정타짜, 정할배랑 치킨 먹고 <b>고스톱</b>치고 모바일배그하기 나는 맨날 털리고 우리 정뚜이씨는 맨날 용돈벌이해간다 구여워 죽겠엉 난 매번 잃어... ",여기온걸 환영해,https://blog.naver.com/leesong128,20200220
