title,link,description,bloggername,bloggerlink,postdate
[책자;활동집]<b>종교활동</b>집-토기장이,https://blog.naver.com/idsad?Redirect=Log&logNo=221301455661,▼▼▼ 큰 레이아웃을 제외하고 활동별로 디자인은 다르게 진행되었답니다. <b>종교활동</b>집 1호도 디에스애드에서 작업하셨는데.. 그 때 컨셉은 글 위주였다면 이번 2호 활동집의 컨셉은 활동사진 위주로... ,idsad님의블로그,https://blog.naver.com/idsad,20180618
9사단 장병들 <b>종교활동</b> - 불교편 (펌),https://blog.naver.com/mrtelecom?Redirect=Log&logNo=90017156326,^^ 울장병들 종교행사중 정신수양 하하 나랄위해 믿지두 않는 종교를 저렇케 수양중이네여? ㅜㅜ 먹을거주니 좋아라합니다 후배님들 나라잘지켜여 파이팅 하하 군인들이 보통 <b>종교 활동</b>은 하는 이유는 먹을 것... ,q_box,https://blog.naver.com/mrtelecom,20070504
파주 성심노인전문 요양원 <b>종교활동</b>,https://blog.naver.com/silverpaju?Redirect=Log&logNo=221403233209,오늘 저희 성심요양원에서는 어르신들의 <b>종교활동</b>을 위한 예배와 봉성체가 있었습니다. 예배는 매주... 오랫동안 <b>종교활동</b>을 해오셔서 그런지 예배나 봉성체가 실시되는 날을 기다리십니다. 어떤 어르신들은... ,파주 성심노인전문요양원,https://blog.naver.com/silverpaju,20181121
"미 연방법원, <b>종교활동</b>은 모든 방역보다 우선",https://blog.naver.com/freedominyou?Redirect=Log&logNo=222156732467,연방대법원 판결이 내려진 뒤 종교 단체 측은 “대법원이 자유로운 <b>종교활동</b>을 보호하기 위해 신속하게 결정해 준 데 감사하다”는 입장을 밝혔다. 반면 쿠오모 뉴욕주지사는 언론을 통해 “(이번 판결은)... ,중심,https://blog.naver.com/freedominyou,20201128
"중국, 기독교수와 교사에게 <b>종교활동</b> 중단 서약받아",https://blog.naver.com/khchojh?Redirect=Log&logNo=221372895400,어떠한 종교도 믿지 않고 <b>종교활동</b>도 하지 않고 종교가 전파되는 어떠한 장소에도 가지 않겠다는... 서약서는 또 사회주의 신문명을 외치고 봉건제의 미신을 퍼뜨리거나 미신활동을 하지 말 것을 서약하고 있다.... ,그리스도복음-블로그,https://blog.naver.com/khchojh,20181007
수도권 서울 코로나 2.5단계 총정리 (결혼식 헬스장 학교 <b>종교</b> 등),https://blog.naver.com/123goodgood?Redirect=Log&logNo=222165211006,뉴스원 <b>종교활동</b> 비대면이 기본 <b>종교활동</b>도 비대면 예배·법회·미사·시일식을 원칙으로 하며(참여인원 20명 이내) 종교시설 주관의 모임·식사는 금지된다. 뉴스원 이에 대해 일부 개신교에서는 대응이... ,일상을 예술화하라,https://blog.naver.com/123goodgood,20201207
[다온재활주간보호센터] <b>종교활동</b>,https://blog.naver.com/da5723?Redirect=Log&logNo=221586108436,"안녕하세요 ^ _ ^// [전주 다온재활주간보호센터]입니다.♥ #데이케어 #주간보호 #전주주간보호센터 #전주재활센터 매주 수요일, 목사님이 직접 센터로 오셔서 매주 &quot;<b>종교활동</b>&quot;의 시간을 갖는데요?! 어르신들도... ",다온재활주간보호센터,https://blog.naver.com/da5723,20190715
"좁은 문 (13) 13일차 - 일요일 <b>종교활동</b>, 이발",https://blog.naver.com/knowist?Redirect=Log&logNo=140190683206,<b>종교활동</b>을 통해 다른 중대의 소식을 알 수 있다. 가톨릭군종교구에서는 특별히 세례의 문턱을 낮췄다. 자유의지로 믿기만 하면 5주만에 세례를 주고 신앙생활로 나머지를 채우라고 했다. 그 준비과정으로... ,마취중진담: 무권해석,https://blog.naver.com/knowist,20130607
[2019년 12월]우리사랑-<b>종교활동</b>,https://blog.naver.com/welove0230?Redirect=Log&logNo=221764424507,[<b>종교활동</b>] 12월 <b>종교활동</b> 프로그램입니다.,welove0230님 블로그,https://blog.naver.com/welove0230,20200108
"종교 전능신(全能神) 신도 가정의 몰락, 중국 내 <b>종교활동</b>",https://blog.naver.com/4uinfo?Redirect=Log&logNo=220101252547,신경보 2014.8.22 招远血案检方称3被告应数罪并罚 第一被告人张帆庭审面带笑容，不承认故意杀人；被害者家属撤回索赔要求，称向邪教宣战 新京报讯 昨日上午8点，... ,China365,https://blog.naver.com/4uinfo,20140823
[아산충무노인주간보호센터] 6월11일 <b>종교활동</b> 및 만들기수업,https://blog.naver.com/asan0606?Redirect=Log&logNo=222394085534,안녕하세요~~:) 즐거운 충무센터 입니다~~:) 오늘 오전시간에는 어르신들과 함꼐 찬송가로 예배를 드렸어요~~:) 새로운 찬송가를 배워보고 복습도 하시면서 즐겁고 신나는 찬송가를 새로배워서 보람차다고 말씀도... ,아산충무노인주간보호센터,https://blog.naver.com/asan0606,20210611
파주요양병원 한사랑요양병원 <b>종교활동</b> 시간~,https://blog.naver.com/hsr151001?Redirect=Log&logNo=221408870695,파주요양병원 한사랑요양병원 <b>종교활동</b> 시간~ 안녕하세요? 파주요양병원 한사랑요양병원입니다.... 오늘 소개해드릴 내용은 한사랑요양병원에서 실시하고 있는 <b>종교활동</b> 내용입니다. 치료를 함에 있어서... ,한사랑요양병원,https://blog.naver.com/hsr151001,20181129
"중국' 불법<b>종교 활동</b>,'제보 1000달러 포상금',,기독교 말살... ",https://blog.naver.com/qens6666?Redirect=Log&logNo=221588271569,"불법 <b>종교 활동</b> 제보를 장려하기 위해 1,000달러가량 포상금을 걸었다. 중국 정부에 등록하지 않고 모이는 교회나 ‘수상쩍은 불법 종교 현장이나 활동’을 제보하는 사람은 이제 포상금을 받는다.... ",거친 들소리와 레바논 시냇 물 소리,https://blog.naver.com/qens6666,20190717
자유 민주주의와 <b>종교</b> 다원주의 2,https://blog.naver.com/dadaoang?Redirect=Log&logNo=222234195311,새로운 종교를 세우고 <b>종교 활동</b>을 하는 것이 가능하다 가장 종교의 자유가 보장된 국가는 미국이다... 악마교조차 종교의 자유라는 이름으로 활동이 허용되는 것이 미국이라는 자유 민주주의 국가다 그리고... ,성경연구,https://blog.naver.com/dadaoang,20210206
"코로나19 사회적 거리두기 개편 후 모임, 학교, <b>종교</b>, 직장... ",https://blog.naver.com/gkstkfkd2015?Redirect=Log&logNo=222134389969,"코로나19 사회적 거리두기 개편 후 모임, 학교, 종교, 직장 단계별 기준 최근 정부에서 코로나19에... 그렇다면 사회적 거리두기 각 단계에 따라 모임, 행사, 스포츠관람, 학교 등교, <b>종교활동</b>, 직장근무 등은... ",독일 레하우 공식인증파트너 공식 블로그,https://blog.naver.com/gkstkfkd2015,20201103
<b>종교활동</b>,https://blog.naver.com/cvzx0153?Redirect=Log&logNo=221682787571,"대신 <b>종교활동</b>을 갈 수 있다. 논산훈련소의 <b>종교활동</b>은 조금 특이하다. 기독교 기독교는 초코파이를 먹을 수 있으며, 실로암을 아주 신나게 부를 수 있다. 세상 군대 내에 클럽이 있다면 이런 느낌일 것이다.... ",사는 이야기,https://blog.naver.com/cvzx0153,20191019
[2019년 11월]우리사랑-<b>종교활동</b>,https://blog.naver.com/welove0230?Redirect=Log&logNo=221750192081,[<b>종교활동</b>] 11월 <b>종교활동</b> 프로그램입니다.,welove0230님 블로그,https://blog.naver.com/welove0230,20191226
수도권 ‘5인 이상 사적 모임 금지’… <b>종교활동</b> 제외,https://blog.naver.com/gcn2020?Redirect=Log&logNo=222182991574,때문에 교회 예배 등 <b>종교활동</b> 역시 이번 행정명령 대상에는 포함되지 않는다. 현재 수도권 내 <b>종교활동</b>은 사회적 거리두기 2.5단계에 따라 참여 인원 20명 이내에서 비대면 예배(법회·미사·시일식 등)를... ,GCN(Global Christian News),https://blog.naver.com/gcn2020,20201223
4월 4주차&gt; <b>종교활동</b>,https://blog.naver.com/hatsal2014?Redirect=Log&logNo=221261700751,"&quot;<b>종교활동</b>&quot; <b>종교활동</b>으로 기독교 예배를드리는 시간을 가졌습니다 매주 수요일마다 장안밀알교회 목사님, 전도사님이 오셔서 예배를 드려주고 계십니다. 찬송-기도-성경말씀-기도-찬송-축도의 순서로... ",햇살요양병원,https://blog.naver.com/hatsal2014,20180426
모든 종류의 신앙과 <b>종교 활동</b>을 지칭하는 종교.,https://blog.naver.com/tpwlswjdwjd?Redirect=Log&logNo=222224117851,대게는 <b>종교</b>학적으로도 비체계적이라는 뉘앙스를 내포합니다. 일반적으로는 사이비 <b>종교</b>라는 의미로 쓰입니다. 사이비 <b>종교</b>는 전세계적으로 퍼져있습니다. 공통적으로 수많은 범죄좌 사건사고를 저지릅니다.... ,"법률,법지식",https://blog.naver.com/tpwlswjdwjd,20210129
위헌 주장... 목사들이 <b>종교</b> 자유 황교안을 대통령 몰아줄까?,https://blog.naver.com/violin21?Redirect=Log&logNo=222436970716,내 종교시설 대면활동을 금지한 현 정부의 방역 지침에 대해 &quot;종교의 자유를 허하라&quot;며 이같이... 그러면서 &quot;정부는 다른 시설과는 달리 유독 <b>종교활동</b>에 대해서만 엄격히 제한하고 있다&quot;며 &quot;형평성에... ,김시흔artsy-fartsy,https://blog.naver.com/violin21,20210719
"[생활정보] 코로나19 상황별 안전 수칙 - 외식, <b>종교</b>, 쇼핑 편 -",https://blog.naver.com/icjunggu?Redirect=Log&logNo=222058426015,"종교 안전 수칙 온라인 등 비대면으로 <b>종교활동</b>에 참여하는 것이 좋지만, 대면으로 만나게 된다면 마스크는 필수!! 노래는 마스크를 쓰고 작게 부르고, 가급적 반주로 대신하기를 권해드립니다. 다수가 모이는... ",인천 우리중구 공식블로그♥,https://blog.naver.com/icjunggu,20200812
해밀의 <b>종교활동</b>,https://blog.naver.com/hmsenior?Redirect=Log&logNo=221353988173,사람이 그 마음을 가지기 위해서는 종교의 힘이 아주 크게 작용하기도 합니다. 오늘 해밀의 <b>종교 활동</b> 제2탄 천주교 편을 포스팅 하도록 하겠습니다^^ 와아♡♡♡ 감사하게도 신자들을 위해 매달 첫째주 수요일... ,"해밀 요양원, 주간보호 스토리",https://blog.naver.com/hmsenior,20180906
[동구뉴스] 안전한 <b>종교활동</b>을 위한 핵심 방역수칙 의무화,https://blog.naver.com/incheondonggu?Redirect=Log&logNo=222027076620,"등 종교행사 전/후 시설 소독(대장작성) ●시설 내 이용자 간 2m(최소 1m) 간격 유지 * 예배 시 1m 이상... 결과, <b>종교활동</b>은 중간 위혐도 활동으로 나타났습니다. <b>종교활동</b>을 할 시 밀폐된 공간에서 마스크를 쓰지... ",인천 동구청 블로그,https://blog.naver.com/incheondonggu,20200710
"달서구 유천동 <b>종교</b>용지 토지매매(교회, 성당, 사찰 용지)",https://blog.naver.com/qurals4945?Redirect=Log&logNo=222432566955,"등으로 <b>종교활동</b> 해 보시지 않으시렵니까요,, 달서구 유천동 종교부지 토지매매는 대구광역시 달서구 유천동에 소재하며 월배 아이파크 2차 아파트 동측 인근에 위치하고 있습니다. 주변 일대는 대단지 아파트... ",돈~을 부르는 대구 부동산 웨이!!,https://blog.naver.com/qurals4945,20210715
[경기요양병원] 더원요양병원 8월 3주 <b>종교활동</b>(기독교활동),https://blog.naver.com/theone9834?Redirect=Log&logNo=221628742717,"[경기요양병원] 더원요양병원 8월 3주 <b>종교활동</b>(기독교활동) 안녕하세요. 더원요양병원 사회복지사입니다.^^ 매주 일요일, 기독교 <b>종교활동</b> 시간이 돌아왔습니다~ 여전히 환자분들이 많고, 퇴원하신 환자분이... ",환자가 먼저인 더원요양병원!,https://blog.naver.com/theone9834,20190826
<b>종교</b> 도대체 왜믿어? 성범죄 저지른 후에도 뻔뻔하게 목회<b>활동</b>... ,https://blog.naver.com/ricochetxx?Redirect=Log&logNo=221436656134,딴 종교 왜 믿어? 오늘도 <b>종교활동</b> 한답시고 가서 뻔뻔하게 여성들 성폭행 하고 성추행한 목사놈 밑에서 굽신 굽신 하면서 설교 왜 들어? 범죄자 한남충 밑에서 도덕과 신념을 배우겠다고 발발거리는 그정도 밖에... ,Xx,https://blog.naver.com/ricochetxx,20190108
"강동구, <b>종교</b>시설에 코로나19 방역<b>활동</b> 지원금 지급",https://blog.naver.com/tynews?Redirect=Log&logNo=222318844558,있는 <b>종교</b>시설의 방역<b>활동</b>을 지원한다고 밝혔다. 지난 1년간 코로나19의 확산이 지속되면서 <b>종교</b>계는 정규 예배를 제외한 모든 <b>활동</b>이 중단되고 예배 참여 인원도 제한되는 등 <b>종교</b>시설 운영에 많은... ,토요저널,https://blog.naver.com/tynews,20210422
(문화체육과) 추석연휴기간 <b>종교활동</b> 특별점검,https://blog.naver.com/djjunggu8?Redirect=Log&logNo=222107218948,문화체육과에서는 추석연휴기간 <b>종교활동</b>에 대한 특별점검을 하였습니다. <b>종교활동</b>시 핵심방역수칙을 철저히 준수해주시기 바랍니다.,효문화 중심도시 대전 중구,https://blog.naver.com/djjunggu8,20201005
수도권 거리두기 4단계 <b>종교</b>시설 방역수칙 개선,https://blog.naver.com/htiger31?Redirect=Log&logNo=222438219823,"4단계 종교시설 방역수칙 개선 추진 □ 수도권 거리두기 4단계에서 정규 <b>종교활동</b>은 비대면이... 모임 활동을 제한하는 것을 의미함 - 동창회, 동호회, 야유회, 직장회식(중식 포함), 계모임, 집들이... ",하이거,https://blog.naver.com/htiger31,20210720
<b>종교 활동</b>에 머물지 말라.,https://blog.naver.com/57annamin?Redirect=Log&logNo=222317439777,"예수 그리스도와의 개인적이고, 생생하고, 점점 성장하는 관계보다 <b>종교</b>적인 <b>활동</b>에 만족해서는 안된다. - 매일 아침 하느님을 경험하는 삶 365에서 발췌. 헨리 블랙커비. 리처드 블랙커비 지음-",뜨락,https://blog.naver.com/57annamin,20210421
2019.05.28.<b>종교활동</b>/인지신체프로그램 - 남구노인주간보호센터,https://blog.naver.com/namgu7770?Redirect=Log&logNo=221548591675,어르신들의 상상력으로 나머지 반쪽그림도 멋있게 완성하셨습니다~ ▼▼오후프로그램(<b>종교활동</b>) - <b>종교활동</b>으로 화요예배가 있었습니다.~ 찬송가를 부르고 성경말씀을 읽어보았습니다.~ 블로그의 모든사진을... ,남구노인주야간보호센터,https://blog.naver.com/namgu7770,20190528
"[공군 곰신] 동영상편지 :: 종교편지, 훈련소 <b>종교활동</b> ::",https://blog.naver.com/blooming113?Redirect=Log&logNo=221205228735,"2017.01.29.일요일 입대하면 불교, 기독교, 천주교 중 한 종교를 선택해서 <b>종교활동</b>을 할 수 있다. <b>종교활동</b>을 하는 동안 기본군사훈련단에서 운영하는 종교카페에 편지와 동영상을 올리면 전달을 해준다. 그래서... ",우연처럼 인연으로,https://blog.naver.com/blooming113,20180209
[2019년 10월]우리사랑-<b>종교활동</b>,https://blog.naver.com/welove0230?Redirect=Log&logNo=221704592530,[<b>종교활동</b>] 10월의 <b>종교활동</b> 경건한 마음으로 예배합니다.,welove0230님 블로그,https://blog.naver.com/welove0230,20191111
비대면 <b>종교활동</b> 정부지원 내년 2월까지 연장… 무료... ,https://blog.naver.com/motokim08?Redirect=Log&logNo=222189112043,정부는 신종 코로나바이러스 감염증(코로나19) 확산 방지를 위해 200인 이하 중소 규모 종교단체가 실시간 방송 플랫폼을 이용해 <b>종교활동</b>을 할 수 있도록 월 50기가바이트(GB)의 이동통신... ,참새와 방아간 (리멤버 통기타 클럽),https://blog.naver.com/motokim08,20201229
"우리은행, 비대면 <b>종교활동</b> 지원을 위한‘온라인헌금서비스’",https://blog.naver.com/robert30?Redirect=Log&logNo=222176341914,"우리은행 관계자는 “비대면 <b>종교활동</b>을 지원하기 위해 성도들이 헌금을 전달하는데 편리한 서비스를 개발했다”며,“타 종교, 사회기부단체 등으로 서비스를 점차 확대할 계획”이라고 말했다.",동서경제신문,https://blog.naver.com/robert30,20201217
2월 4주 (금) <b>종교활동</b>,https://blog.naver.com/sukmun7785?Redirect=Log&logNo=221830639030,일주일 사이에 확진자가 1000명이 넘어가고 하루에도 몇백명씩 확진자가 나오네요 ㅠㅠ 우리모두 건강하게 해달라고 목사님과 같이 기도를 했답니다~~ #석문노인복지센터 #석문요양원 #<b>종교활동</b> #화산교회,석문노인복지센터.석문요양원,https://blog.naver.com/sukmun7785,20200229
태안 대군민 담화발표 <b>종교활동</b> 자제 및 사회적 거리두기 동참... ,https://blog.naver.com/sinmunman?Redirect=Log&logNo=221871808243,"태안 대군민 담화발표 <b>종교활동</b> 자제 및 사회적 거리두기 동참 호소 - 가세로 태안군수 23일 대군민... 5)'에 적극 대처하기로 하고, 군민들에게 △예배 등 종교 관련 활동 자제 △실내 체육시설·노래연습장... ",충청남도,https://blog.naver.com/sinmunman,20200325
거리두기 동참 다중시설에 재난지원금 지급 (<b>종교</b>시설) 안내,https://blog.naver.com/hsview?Redirect=Log&logNo=221996342997,"시민 여러분께서는 집단감염사례가 지속적으로 발생하고 있는 만큼 목회자 모임 등 소규모 종교행사, 지역을 벗어난 광범위한 <b>종교활동</b> 및 다중시설 이용을 가급적 자제해 주시길 당부드리며 모든 것이... ",화성시 공식 블로그 '화사함',https://blog.naver.com/hsview,20200610
숙식보호청소년의 정신건강을 위한 <b>종교활동</b> 진행,https://blog.naver.com/jndongbu?Redirect=Log&logNo=221763945888,"한국법무보호복지공단 전남동부지소(지소장 고영훈)는 1.08.(화) 2층 대회의실에서 청소년사랑위원회 배순정 회장, 이형화 고문, 순천동부교회 전도사 및 숙식보호 청소년이 참석한 가운데 <b>종교활동</b>(예배)을... ",전남동부청소년교육센터,https://blog.naver.com/jndongbu,20200108
2월 3주 (금) <b>종교활동</b>,https://blog.naver.com/sukmun7785?Redirect=Log&logNo=221818317090,많은곳에서 난리더라구요 ㅜㅜ 우리 어르신들 및 보호자분들 건강하게 잘 넘어갔으면 좋겠어요 이런 마음을 담아 오늘도 열심히 사모님과 예배를 드렸습니다. #석문노인복지센터 #석문요양원 #<b>종교활동</b> #제일교회,석문노인복지센터.석문요양원,https://blog.naver.com/sukmun7785,20200221
"최창권 곡, 유호 시, 최희준 노래 / 역지사지 / <b>종교</b>의 필요성",https://blog.daum.net/ryuhaeyeong/8746511,"종교를 권하는 이유도 <b>종교활동</b>이 엄청난 공부이기 때문이다. 그래서 적절한 종교를 가지라는 말이다. 오늘 철원 성당에서 미사를 드렸다. 신자들의 기도를 하는데, 본인이 참여했다. 묵주기도, 성가 합창... ",류해영,https://blog.daum.net/ryuhaeyeong,20210516
(D-6(<b>종교</b>) 비자 취득 <b>활동</b> 범위 및 자격 조건은!,https://blog.naver.com/sheepqqq?Redirect=Log&logNo=221510470926,"D-6 (종교) 비자의 활동 범위 국내에서 <b>종교활동</b> 및 종교단체에서의 사회복지활동을 목적으로 받는 사증이 D-6 즉, 종교 비자 입니다. ( 기도하는 종교 모습 ) D-6비자의 활동범위 및 대상자는 다음과... ",한성욱 행정사 사무소,https://blog.naver.com/sheepqqq,20190411
미소요양원 11월 <b>종교활동</b>(3),https://blog.naver.com/silvermisocare?Redirect=Log&logNo=222151263756,안녕하세요. 미소요양원입니다. 오늘은 <b>종교활동</b>을 진행했습니다. 감사합니다. #미소요양원 #평택요양원 #안성요양원 #천안요양원 #노인요양원 #경기도요양원 #요양원 #지제역 #평택역,평택 미소요양원,https://blog.naver.com/silvermisocare,20201122
"中, 모든 <b>종교활동</b>에 국기게양…종교통제 강화되나?",https://blog.naver.com/nashin621?Redirect=Log&logNo=221332450986,김주련(**********@******.**.**) 등록일:2018-08-03 16:35:14 중국의 일부 종교단체들이 <b>종교활동</b>장소에 중국 국기인 오성홍기를 게양하는 방안을 제안하고 나서 논란이 일고 있다. 일각에서는 종교단체에 대한 통제가... ,nasin621님의블로그,https://blog.naver.com/nashin621,20180804
통해 되짚어보는 우리나라에서 <b>활동</b>중인 <b>종교</b>는?,https://blog.naver.com/erai1877?Redirect=Log&logNo=221851605321,"그리고, 이번 '신천지' 라는 종교를 통해 살펴본 우리나라에서 활동중인 종교의 수가 상당히 많고... 이름으로 <b>종교활동</b>을 벌이고 있습니다. 경기도 판교에 위치한 하나님의 교회 ■ 세계평화통일가정연합... ",Life is Light. :),https://blog.naver.com/erai1877,20200313
햇살요양병원 <b>종교활동</b> 예배 드리기,https://blog.naver.com/hatsal2014?Redirect=Log&logNo=221308710077,&quot;<b>종교활동</b>&quot;햇살요양병원에서는 어르신들의 종교적 자유를 지켜드릴 수 있도록 기독교 예배를 진행하고 있습니다. 장안밀알교회에서 수요일마다목사님과 전도사님이 오셔서 예배를 진행해주고 계십니다.... ,햇살요양병원,https://blog.naver.com/hatsal2014,20180628
<b>종교활동</b> 선택기준_퍼온글,https://blog.naver.com/hpe8285?Redirect=Log&logNo=221490877751,군에 오기전 종교가 있었던 병사들은 자신이 믿던 종교를 가지만 군대와서 종교를 처음 접하는 병사들은 쉴수도 있고 <b>종교활동</b>에 참여할 수 있습니다. 그래서 신교대나 훈련소에 있는 종교시설에서는 훈련병을... ,논산훈련소입영심사대펜션,https://blog.naver.com/hpe8285,20190318
코로나19 확산에 따른 <b>종교활동</b> 자제 요청,https://blog.naver.com/pt_story?Redirect=Log&logNo=221829332669,"코로나19 확산에 따른 <b>종교활동</b> 자체 요청 주일미사, 예배 등 종교행사는 가족기도나 가정예배로 대체해주시길 바랍니다. 감염우려를 낮추기 위한 정부의 불가피한 조치임을 이해해주시기 바라며 특히... ",평택시,https://blog.naver.com/pt_story,20200228
[부산여성변호사 이혼소송 변호사상담]<b>종교활동</b>과 이혼사유,https://blog.naver.com/yhjoo02?Redirect=Log&logNo=221466632610,배우자가 <b>종교활동</b>에 몰두하는 것이 재판상 이혼사유가 될 수 있을까요? 최근 부산가정법원에서 배우자의 <b>종교활동</b>과 이혼사유에 관하여 판단한 판결을 소개해드립니다. 부산 경남 이혼 위자료 재산분할... ,주영희변호사의 블로그,https://blog.naver.com/yhjoo02,20190215
<b>종교</b> 비영리법인 설립허가[실전공개],https://blog.naver.com/dldlsgud5805?Redirect=Log&logNo=221264515887,"종교 비영리법인 설립허가[실전공개] 선교활동, 포교활동 등 비영리 공익사업을 영위했던 종교인도 곧... 회원 종교인들로 구성된 발기인과 회원을 구성하여야 한다. 발기인들은 <b>종교 활동</b>과 관련된 사업계획과... ",정재우 행정사사무소,https://blog.naver.com/dldlsgud5805,20180430
[2017년 10월 10일]우리사랑-<b>종교활동</b>,https://blog.naver.com/welove0230?Redirect=Log&logNo=221128736564,"[<b>종교활동</b>] 선생님, 봉사자, 목사님과 참여하는 예배를 진행하였습니다. 오늘도 행복과 사랑이 가득차길 기도드립니다.",welove0230님 블로그,https://blog.naver.com/welove0230,20171030
"이태원, 아프리카 사람들의 <b>종교활동</b> (나이지리아) ^^",https://blog.naver.com/cafri1004?Redirect=Log&logNo=220249258837,이태원에는 많은 외국인들이 있다보니 <b>종교</b>도 제각각인것같다 이태원도 사람이 사는곳이다보니 많은 <b>종교</b>가 공존하고있다 그중에 하나 아프리카의 <b>종교</b>할동은 진짜로 아프리카의 향기가 물신 풍겨난다... ,이태원 이야기,https://blog.naver.com/cafri1004,20150123
전역 - <b>종교활동</b>,https://blog.naver.com/socio-logical?Redirect=Log&logNo=221451434749,"<b>종교활동</b>(혹은 종교행사라고도 부르는 것 같은데)은 매주 일요일에 보장되었다. GOP라 소초에서 대대 본부까지 가야하는데, 군 생활 중반까지 거의 나 혼자만 가다시피 해서 간부랑 운전병에게 미안했던 것, 조금... ",끄적거리,https://blog.naver.com/socio-logical,20190126
일산폐암요양병원 <b>종교활동</b>으로 활력소를,https://blog.naver.com/mij1978?Redirect=Log&logNo=221352273436,"다스람요양병원에서는 <b>종교활동</b>을 비롯하여 댄스, 노래교실, 그림그리기, 원예활동(꽃꽂이), 요가, 필라테스, 우클렐레 등 다양한 프로그램을 운영하고 있습니다 항암 치료는 약만 먹는다고 나아지는 것이... ",다스람병원,https://blog.naver.com/mij1978,20180904
