title,link,description,bloggername,bloggerlink,postdate
노원<b>피부관리</b> 믿고 맡기네!,https://blog.naver.com/thwjd_8672?Redirect=Log&logNo=222433908132,특히나 노원<b>피부관리</b>에 도움이 되는 제품도 정말 아낌없이 듬뿍 듬뿍 사용해주시더라고요. 피부 케어 및 관리에 사용되는 자사 브랜드 화장품의 경우 바쁜 현대인들도 사용할 수 있도록 개발된 제품이라고... ,소종이네,https://blog.naver.com/thwjd_8672,20210718
이대<b>피부관리</b> 이유 있는 선택,https://blog.naver.com/yyso33?Redirect=Log&logNo=222421164941,"외모 관리에 소홀했는데 이제는 좀 바뀌어야겠단 생각이 들어서 이대<b>피부관리</b>를 받으러 다니기 시작했습니다 저는 피부와 페이스라인을 동시에 케어하고 싶었고, 열심히 샵을 알아보던 중 인지도가 높고 가장... ",순이놀다.,https://blog.naver.com/yyso33,20210706
구월동<b>피부관리</b> 편안하게 잘 받았어요,https://blog.naver.com/stella_lucy?Redirect=Log&logNo=222432617505,"환절기라 그런지 요새 피부가 푸석하더라고요. 이럴 때 더 관리를 잘 해줘야 한다고 하던데 구월동<b>피부관리</b> 잘해주는 샵이 있다고 해서 지인을 통해 소개받아 다녀왔었어요. 물론, 가기 전에 예약하고... ",♥조감자♥,https://blog.naver.com/stella_lucy,20210715
먹는 엘라스틴 이너뷰티로 <b>피부관리</b>,https://blog.naver.com/banghak2000?Redirect=Log&logNo=222432927117,먹는 엘라스틴 이너뷰티로 <b>피부관리</b> 최근 다이어트를 무리하게 진행해서 그런지 피부가 많이... 친구를 통해 우연히 알게된 제품인데 제 주변 지인도 대부분 이너뷰티로 관리를 하고 있어서 알아보니 종류가... ,찐돌이의 블로그,https://blog.naver.com/banghak2000,20210716
흡족했던 동탄<b>피부관리</b>,https://blog.naver.com/hulkduck?Redirect=Log&logNo=222423882313,안그래도 피부가 예민해진 상태라 혹시 나에게 제품이 맞지 않아서 트러블이 더 생기면 어쩌나 걱정되기도 했는데요. 동탄<b>피부관리</b>를 오랫동안 해오신 관리사님께서 하나하나 신경써주셔서 믿고 맡길 수... ,세계를 가져라!!,https://blog.naver.com/hulkduck,20210707
강남<b>피부관리</b> 작은 얼굴의 비밀은 경락!,https://blog.naver.com/onlyjjeong_e?Redirect=Log&logNo=222431310699,강남<b>피부관리</b>를 선택했습니다! 사실 평소에 겁도 많고 경락이 처음인지라 아프지 않을까 무서웠는데 괜한 걱정이었습니다 ㅎ 수시로 아프지 않은 지 확인해 주셨는데요. 일대일로 이루어지는 관리는... ,차가운 머리와 따뜻한 가슴♥️,https://blog.naver.com/onlyjjeong_e,20210714
만족한 부천 <b>피부관리</b>,https://blog.naver.com/yangha84?Redirect=Log&logNo=222435871961,부천 <b>피부관리</b>에서 처음 받아보는거라 긴장했는데 순수산소라 쾌적하고 시원해서 좋았어요. 그리고는 말끔해진 피부 위에 실크관리까지 요청했어요. 다른 샵과 다르게 24가지 트리트먼트가 있어서 각자 다른... ,",",https://blog.naver.com/yangha84,20210719
부평 <b>피부관리</b> 트러블 고민에서 벗어나기!,https://blog.naver.com/chuyiyoung?Redirect=Log&logNo=222393946878,부평<b>피부관리</b> 받고자 사바비안부평점에 다녀오게 되었답니다. 내부에 들어갔는데 인테리어도 깔끔하고 환경도 쾌적해서 마음에 들었어요! 아무래도 피부를 관리하는 공간이기 때문에 위생적으로도... ,ღ Tiap hari Senang aja,https://blog.naver.com/chuyiyoung,20210611
광주<b>피부관리</b> 편안하게 받아보니,https://blog.naver.com/chkahee?Redirect=Log&logNo=222366479863,날도 풀렸겠다 기분전환도 할겸 좀 제대로 해보려고 인지도 있는 광주<b>피부관리</b> 샵을 방문하게... 한동안 집에서만 홈케어를 해주었더니 그동안 피부가 많이 상했더라구요. 관리를 받는것과 받지 받지 않는것의... ,불꽃 카리스마 칸,https://blog.naver.com/chkahee,20210525
간석동<b>피부관리</b> ‘뉴본셀 에스테틱’/D's Bucket list,https://blog.naver.com/dadada832?Redirect=Log&logNo=222431375113,조짐) 피부고민들을 해결하러 간석동<b>피부관리</b> 뉴본셀 찾아갔어요~* 뉴본셀 에스트텍 간석오거리... 1:1 관리해주시는 곳이에요~! 아담하고 아늑했던 내부 베드가 두개 있더라구요~ 지금 결혼 준비중인데... ,D's Bucket list,https://blog.naver.com/dadada832,20210714
광교 <b>피부관리</b> : 엄마랑 올만에 <b>피부관리</b> 데이트!,https://blog.naver.com/powerppodea?Redirect=Log&logNo=222432258549,광교 <b>피부관리</b>샵 에스테티아는 이번에 전부 다 관리가 바뀌면서 마사지 할 때도 마사지 크림이 아닌 앰플을 써요! 그래서 거의 앰플 반통을 다 써줘서 그게 좀 좋았어요 ㅎㅎ 피부가 쑥쑥 먹게끔... 제 입장에서는... ,김라희 블로그,https://blog.naver.com/powerppodea,20210715
의정부 <b>피부관리</b> 균형있는 페이스라인 만들기,https://blog.naver.com/daebak2bak?Redirect=Log&logNo=222432747302,확실히 관리를 받는 것과 받지 않는 것에 큰 차이가 난다고 하면서요. 다행히 저는 주변에 피부에 관심이 많은 지인들이 있어서 의정부<b>피부관리</b> 받을 수 있는 곳도 소개를 받아볼 수 있었는데요. 이곳이 다섯가지... ,으아아,https://blog.naver.com/daebak2bak,20210715
강남<b>피부관리</b> 진짜 비밀은 경락!,https://blog.naver.com/bellaostini?Redirect=Log&logNo=222437228707,프로그램의 다양성도 그렇고 차별화된 기술로 모두가 원하는 라인과 피부를 만들어주는 곳이 바로... 얼굴 관리하고자 강남<b>피부관리</b>를 알아본 덕분에 이런 진짜 비밀까지 찾아낼 수 있었어요 ㅎㅎ! 특히나 가격... ,소소한 일상,https://blog.naver.com/bellaostini,20210719
분당<b>피부관리</b> 후회 없는 곳,https://blog.naver.com/thwjd_8672?Redirect=Log&logNo=222433251674,분당<b>피부관리</b>를 알아봤어요. 제가 찾았던 숍은 여러 지점이 있을만큼 브랜드 규모가 컸어요. 이왕... 무엇보다 관리를 꾸준히 받기 시작하면서부터 피부톤이 맑아진 걸 느껴요. 여름철 땀 배출이 많아... ,소종이네,https://blog.naver.com/thwjd_8672,20210716
연신내<b>피부관리</b> 고민 해결했어요!,https://blog.naver.com/zizibe0527?Redirect=Log&logNo=222348580166,"예민한 피부라면 되도록 건들지 않고 연신내<b>피부관리</b>를 받아서 진정이랑 보습도 신경써 주는 게 좋더라구요 꼼꼼하게 세안하는 것도 중요하지만 확실히 직접 와서 관리를 받는 게, 홈케어는 못 따라오는구나... ",china,https://blog.naver.com/zizibe0527,20210514
소양감 잡는 임산부 <b>피부관리</b> 방법 찾았어요,https://blog.naver.com/psyche0412?Redirect=Log&logNo=222425823148,임산부 <b>피부관리</b>는 정말 필요한 거 같아요. 전 드디어 출산해서 요즘은 육아와의 전쟁 중인데요. 아무래도 수유 하다 보니 아직도 피부과 약을 사용하기에는 불안하여 위 제품들로 계속 관리 중이에요. https://bit.... ,하늘루맘 StoRy-하늘루맘의 스케치북,https://blog.naver.com/psyche0412,20210709
강서구<b>피부관리</b> 맞춤 케어 후기,https://blog.naver.com/joraraaa?Redirect=Log&logNo=222369192456,다음 회차는 또 어떤 관리를 받을지 궁금하면서 설레는 마음으로 날짜를 기다리고 있답니다!! 강서구<b>피부관리</b> 봄에스테틱에서 마스크 자극으로 예민해진 피부나 맞춤 케어가 필요하신 분들은 꼭 방문하셔서... ,아일랜드사는 흥부자라라의 만들어 가는 중 입니다♬,https://blog.naver.com/joraraaa,20210527
만족스러운 안양<b>피부관리</b>,https://blog.naver.com/bounce30?Redirect=Log&logNo=222428880524,안양<b>피부관리</b>실을 찾았어요. 주변 지인들이 단골로 다닐 정도로 워 낙 유명한 곳이라 엄청 기대했는데... 제가 받은 안양<b>피부관리</b>는 코리아나 화장품에서 나온 최고급 에스테틱 라인으로만 진행이 되었기... ,TI AMO,https://blog.naver.com/bounce30,20210712
일산<b>피부관리</b> 잘하는 가인미가 등록했어요.,https://blog.naver.com/hayangip42?Redirect=Log&logNo=222416623044,이 관리가 끝나면 본격적인 <b>피부관리</b>를 받게 되는데요. 앰플을 전체적으로 도포한 후에 피부결과 피부톤이 좋아지도록 케어를 해 주신 후 그낭 저의 피부 상태에 맞춰 적절한 팩을 해 주세요. 요즘은 수분팩을... ,하얀집 42,https://blog.naver.com/hayangip42,20210701
운정<b>피부관리</b> 완전 굿!,https://blog.naver.com/lela1001?Redirect=Log&logNo=222428964414,스스로 관리에 소홀했는데 문득 거울을 보니 제가 많이 망가졌다는 생각이 들어서 운정<b>피부관리</b>를... 기초 케어 제품은 물론이고 마스크 팩과 수딩 팩 등 피부 보습이나 관리에 도움이 되는 제품의 종류도 매우... ,슈퍼맘미현의 우당탕탕 지구생활기,https://blog.naver.com/lela1001,20210713
마곡<b>피부관리</b> 수분과 윤곽 토탈관리 후기,https://blog.naver.com/stacy6514?Redirect=Log&logNo=222434163858,모공이 넓어지고 그 주변으로 각질이 심하게 쌓이면서 피부 처짐 증상이 나날이 심해지더라구요. 그래서 마곡<b>피부관리</b> 이번에 방문했을 땐 수분과 윤곽관리를 토탈적으로 받아보기로 했답니다. 턱 주변부... ,"단순 유쾌, Jassooning",https://blog.naver.com/stacy6514,20210716
일산<b>피부관리</b> 꿀팁!,https://blog.naver.com/chkahee?Redirect=Log&logNo=222437552587,일산<b>피부관리</b> 받으면서 써본것들이 제피부에 잘 맞는거 같아 몇개는 구입을 해서 쓰고 있어요. 그리고 한쪽에는 넓은 테이블도 있었는데요 케어를 받기전 이곳에선 어떤식으로 관리가 진행되는지 볼수도 있어서... ,불꽃 카리스마 칸,https://blog.naver.com/chkahee,20210719
광명<b>피부관리</b>는 약손명가작은얼굴 광명점에서 완성해보아요!,https://blog.naver.com/1216g0?Redirect=Log&logNo=222423427637,저는 오늘 약손명가 광명점에서 작은얼굴관리를 받았는데 웨딩케어 프로그램이 있어 결혼 준비중인 신부들의 방문이 특히 많더라고요~ 그냥 <b>피부관리</b>만 해주는 게 아니라 동안얼굴 관리까지 되는 거라... ,초록색깔 베베돔,https://blog.naver.com/1216g0,20210707
청담<b>피부관리</b> 실패하지 않으려면?,https://blog.naver.com/white_0200?Redirect=Log&logNo=222415113242,청담<b>피부관리</b>로 유명한 정본이라는 곳을 말해 주더라고요. 이미 엄청 많은 연예인 분들이 왔다 간 곳!... 단순히 스킨에 대한 부분만 관리하는 것이 아니라 여기가 또 경락으로 대박 친 곳 중 하나더라고요?... ,법률사무소 수,https://blog.naver.com/white_0200,20210630
압구정<b>피부관리</b> 미모 업그레이드,https://blog.naver.com/my1424?Redirect=Log&logNo=222432824871,어디로간건지 피부도 쳐지고.. 나 정말 이렇게 얼큰이로 나이 먹어버린 것인가 싶어 완전 우울했어요.... 압구정<b>피부관리</b> 샵 관리는 이제 제 인생에서 빼놓을 수 없는 중요한 일과가 되어버렸어요. 친구덕에... ,raintree,https://blog.naver.com/my1424,20210715
성신여대 <b>피부관리</b> 받고 깨끗하고 맑게!,https://blog.naver.com/ehfekarlf77?Redirect=Log&logNo=222422131457,"처음으로 저의 피부에 대해 알게 되어 관리비법도 살짝 쿵 전수를 받을 수 있었답니다~ 코로나로 <b>피부관리</b> 받는 게 꺼려지는 분들이 안심할 수 있도록 철저한 비접촉손소독의 사용과 온도체크, 방문기록을... ",지리산and섬진강,https://blog.naver.com/ehfekarlf77,20210706
용산<b>피부관리</b> 이촌동에 떠오르는 핫플!,https://blog.naver.com/agag444?Redirect=Log&logNo=222430219520,"이제 이촌동<b>피부관리</b> 상담 받을 수 있었는데, 제가 요즘 날씨가 덥고 마스크를 착용해서 피부가... 매번 바쁘다는 핑계로 관리를 소홀히 했는데 지금부터라도 꾸준히 이촌동<b>피부관리</b> 받아야겠다 싶더라고요. 홈... ",In the '로즈리's LIFE,https://blog.naver.com/agag444,20210714
[결혼준비] 번외편- 신부 <b>피부관리</b> 포텐자로 도전,https://blog.naver.com/chamchild?Redirect=Log&logNo=222437230413,고생한 피부ㅋㅋㅋ 조오기 구렛나루 근처 볼에는 여드름 흉터도 있음. 이건 포텐자 다 끝난 후 LDM 재생관리 직전에 젤이 발라진 상태예요. 포텐자 시술 순서는 클렌징 - 스팀 - 마취크림 도포 - 신부 <b>피부관리</b>에... ,J.티모시X뉴트로진아,https://blog.naver.com/chamchild,20210719
"빠르게 진행되는 피부노화, 멈추기 위한 셀프 동안 <b>피부 관리</b>법은?",https://blog.naver.com/ebsstory?Redirect=Log&logNo=222409601133,"동안 <b>피부 관리</b>법을 알아봅니다. 포인트 ① 셀프 동안 관리법 한국 여성의 47%가 나이 들 때 가장 걱정하는 피부노화와 주름진 얼굴, 피부 탄력을 신경씁니다. 여성뿐아니라 남성도 피부노화를 고민합니다.... ",EBS 스토리,https://blog.naver.com/ebsstory,20210628
정자동<b>피부관리</b> 빠르게 진정된 피부!,https://blog.naver.com/sxde12?Redirect=Log&logNo=222434080307,ㅠㅠ 제 피부 좀 돌려놔달라고 말씀드렸고 저에게는 크라이오 쿨링 페이스 관리를 추천해주셨어요! 정자동<b>피부관리</b>의 크라이오 쿨링페이스 관리는 태양열로 가속화되는 노화 현상을 크라이오 쿨링 솔루션을... ,초절정님의 블로그,https://blog.naver.com/sxde12,20210719
동탄<b>피부관리</b> 탁월한 효과,https://blog.naver.com/abcd1815?Redirect=Log&logNo=222410269402,항상 피부결이 좋아지더라구요. 이때문에 복합적인 관리가 필요할 때에도 항상 울트라4D로 동탄<b>피부관리</b> 받고 있어요. 관심 있으신 분은 아래 참고하시고 한번 상담받아서 관리 받아보세요~~ <b>피부관리</b>는 시작이... ,네이버ㅡHJ폴댄스 검색,https://blog.naver.com/abcd1815,20210625
화정<b>피부관리</b> 경락 재방문 후기,https://blog.naver.com/heo1028?Redirect=Log&logNo=222436506211,"두달 전, 화정<b>피부관리</b> 받으러 방문했던 곳에 재방문했어요! 휴가를 앞두고 열심히 다이어트를 하고... 어떤 관리인지, 피부에 어떤 도움이 되는지 설명해주셔서 좋았구요 이번 관리사분이 정말정말 친절하고... ",Great day ahead,https://blog.naver.com/heo1028,20210719
남자<b>피부관리</b> 시작은 씻어내는 것 부터!,https://blog.naver.com/fromdk87?Redirect=Log&logNo=222423432113,"남자<b>피부관리</b>에 대한 방법은 상당히 여러 가지로 존재하고 있죠. 물론, 누군가는 식습관을 개선하거나 혹은 피부과를 다니는 중이죠. 하지만 대표적으로 좋은 화장품을 이용하면서 보살피는 경우가 많아요.... ",일상이 사진.,https://blog.naver.com/fromdk87,20210707
배곧 <b>피부관리</b> 내면까지 케어받는 느낌,https://blog.naver.com/ssamw?Redirect=Log&logNo=222398968884,요즘 피부 트러블이 심하다며 다들 걱정이시던데 그래서 저는 얼마전 배곧 <b>피부관리</b>로 유명하다는 힐링명가에스테틱을 다녀왔요! 사실 에스테틱 중에 관리를 잘하는 곳이라고 힐링명가에스테틱을 추천해줬던... ,일러스트레이터 홍승원,https://blog.naver.com/ssamw,20210615
천안<b>피부관리</b> 스토리에스테틱 신불당점,https://blog.naver.com/kim_na23?Redirect=Log&logNo=222426329295,#천안<b>피부관리</b> #천안복부관리 #천안등관리 #신불당<b>피부관리</b> #신불당에스테틱 #천안<b>피부관리</b> #천안산전관리 샤워실도 깔끔하고 각종 샤워 용품도 준비되어 있어요. 특히 아로마 마사지를 하고 나오면 온몸이... ,경리언니 찐나,https://blog.naver.com/kim_na23,20210710
광교<b>피부관리</b> 수분관리 받아 봤어요,https://blog.naver.com/sweetbanya?Redirect=Log&logNo=222417677086,나이가 들다 보니 피부만큼은 꾸준히 관리한 사람과 그렇지 않은 사람의 차이가 크더라고요. 광교<b>피부관리</b> 덕분에 늘어진 모공도 잡을 수 있었고 왠지 이유 모르게 당기던 피부도 수분이 가득 채워져 정말... ,오! 마이 마리아♡,https://blog.naver.com/sweetbanya,20210702
분당<b>피부관리</b> 누구나 말끔하게,https://blog.naver.com/white_0200?Redirect=Log&logNo=222428911057,"관리를 정말 잘 한 것 같아요. 원장님이 미용학과 대학 나오셔서 분당<b>피부관리</b>쪽으로 유명한 만큼 그에 대한 자격증도 따셨는데, 두피케어와 네일아트까지 자격증을 취득하셨다고 들었어요. 이런 샵과 피부과... ",법률사무소 수,https://blog.naver.com/white_0200,20210713
일산<b>피부관리</b> 1:1 맞춤으로!,https://blog.naver.com/amanda07?Redirect=Log&logNo=222433532347,지금은 딱 한번 받고 왔지만 큰 트러블은 많이 가라앉은 상태라 꾸준하게 다니면 깔끔한 피부가 될수 있을거 같은데요 이렇게 자신한테 맞는 관리법이 중요하다는걸 다시한번 느끼게 되었고 일산<b>피부관리</b>를... ,태태맘의 당연한일상,https://blog.naver.com/amanda07,20210716
수원<b>피부관리</b> 페이스 탄력 UP!,https://blog.naver.com/mimi3704?Redirect=Log&logNo=222348583875,"본격적으로 하는 곳이구나 싶은 생각도 들고, 흉내만 내는 곳이 아니라 정말 수원 <b>피부관리</b>샵으로써 스킨케어에 진심이구나! 요런 느낌을 받았달까요 ㅎㅎ 상담실에 도착했고, 쌤과 피부를 어떤 방향으로 관리... ",mimi nail,https://blog.naver.com/mimi3704,20210513
서면 <b>피부관리</b> - 전포동 피부샵 제이민스킨케어 작은얼굴관리,https://blog.naver.com/venus0630?Redirect=Log&logNo=222431278339,"전포동 피부샵 제이민스킨케어는 토탈샵이라서 <b>피부관리</b>뿐만 아니라 속눈썹, 네일, 왁싱도 하지만 그중에서도 피부맛집이에요! 대부분 트로이아르케 제품으로 관리가 진행되고, 바디오일과 데콜테오일은... ",하루하루,https://blog.naver.com/venus0630,20210714
닥터자르트시카페어크림 <b>피부 관리</b> 꿀팁 푼다,https://blog.naver.com/khj980404?Redirect=Log&logNo=222406467236,닥터자르트시카페어크림 <b>피부 관리</b>법 트러블이 정말 없어질 수 있을까? 쨍쨍한 날이 계속 되고있는... 기초템들로 관리를 해주었답니다 +_+ 먼저 처음에는 피부에 쌓인 각종 노폐물! 피지부터 유분까지... ,뷰스타 랑이 :: All about beauty,https://blog.naver.com/khj980404,20210623
광교<b>피부관리</b> 물방울리프팅 받으니 촉촉해요,https://blog.naver.com/mjda20?Redirect=Log&logNo=222416897763,고가의 장비로 체계적으로 피부 맞춤 관리 해주는 광교<b>피부관리</b> 샵이에요. 전문 브랜드 제품 사용하고 에프터 관리도 철저하게 해준다고 하니 믿음이 가더라구요. 내 피부고민 얘기하니 원장님이 꼼꼼하게 다... ,에나의 런치박스,https://blog.naver.com/mjda20,20210701
<b>피부관리</b>기 홈케어로 손쉽게 관리!,https://blog.naver.com/qkrthvkf99?Redirect=Log&logNo=222437062137,물론 사람에 따라 효과는 다를 수 있지만 저처럼 편하게 집에서 피부를 관리하고 싶어 <b>피부관리</b>기를 알아보고 있다면 듀얼소닉을 사용해보시는 것도 추천해드리고 싶어요. :) '본 포스팅은 소정의 원고료를... ,파스텔의 하루일상,https://blog.naver.com/qkrthvkf99,20210719
용산<b>피부관리</b>에서 푸석한 피부 살려줌!,https://blog.naver.com/woohehe33?Redirect=Log&logNo=222428739937,내 피부에 맞는 관리를 받아볼까 싶어 집근처인 용산<b>피부관리</b>를 다 뒤져봤어요! 일단 프로그램들이 여러가지가 있겠지만 지금 내가 필요한 프로그램이 아니면 의미가 없을 것 같았거든요 그런데 딱! 제 맘에... ,THE PLACE,https://blog.naver.com/woohehe33,20210712
강남<b>피부관리</b> 자연스럽게 예뻐지자,https://blog.naver.com/kim8821790?Redirect=Log&logNo=222400260258,바스터즈 멤버들 외에도 이미 많은 연예인들이 방문하는 강남<b>피부관리</b>로 유명한 곳이 바로 정본이었어요. 요즘 펜트하우스로 인기를 끌고 있는 진지희와 임지연 배우도 황금비율관리를 받고 있었는데요.... ,iyn,https://blog.naver.com/kim8821790,20210616
수완지구 <b>피부관리</b> 유니드제이 피부속부터 수분채우기 프로젝트,https://blog.naver.com/lovelysy90?Redirect=Log&logNo=222437265300,수완지구 <b>피부관리</b> 유니드제이 피부 속부터 수분채우기 프로젝트 영업 평일 09:30 - 22:00 &lt;100%예약제&gt; LAST... 신경쓰는 피부상태나 관리받고 싶은곳에대해 상담받고 관리실로 입장!! 증말 이쁜 포토샵도... ,연느의 365일 다이어리,https://blog.naver.com/lovelysy90,20210719
청주<b>피부관리</b> 달라진 윤곽 만족해요!,https://blog.naver.com/goddess504?Redirect=Log&logNo=222422379868,"그만큼 기존에 고객들의 후기가 좋은 청주<b>피부관리</b> 전문샵이에요ㅎㅎ 청주 <b>피부관리</b> 전문샵 방문하기 전에는 그냥 바로 관리에 들어가는 줄로만 알았는데, 피부 타입과 현재 컨디션까지 꼼꼼하게... ",천진난만,https://blog.naver.com/goddess504,20210706
밀크세라마이드 이것만 알면 <b>피부 관리</b> 완료!,https://blog.naver.com/ehsduddlsla?Redirect=Log&logNo=222410004059,제대로 관리하는 게 중요하겠다는 생각이 들었네요 그래서 피부 노화 방지를 위해 밀크세라마이드... 때문에 피부 노화를 촉진시킨다고 하는데요 <b>피부 관리</b>를 위해 사용하는 제품인데 잘못 사용하면 오히려... ,테니를 따라 같이 떠나보는 블로그,https://blog.naver.com/ehsduddlsla,20210625
송도<b>피부관리</b> 쫀쫀 탄력 관리!,https://blog.naver.com/chianti4613?Redirect=Log&logNo=222429123283,더 피부가 흘러내리는 것 같은 느낌이 들더라구요 이제는 투자할 때가 됐다고 생각이 들어서... 송도<b>피부관리</b>의 크라이오 쿨링 페이스 관리순서는 먼저 등관리를 시작으로 후면 밸런스를 맞추고... ,무지개와 구름과 새와,https://blog.naver.com/chianti4613,20210713
대구 수성구<b>피부관리</b> 재방문후 결제까지,https://blog.naver.com/wh77bear?Redirect=Log&logNo=222432700542,아파트 입구 상가에 있어서 찾기 쉬운편 아담한 샵이지만 일인샵이라서 관리받기 딱 좋음 !! 대구 수성구<b>피부관리</b> 잘한다는곳 여러곳 다녀보니 큰 규모의 프랜차이즈 에스테틱도 있고 이렇게 원장님 한분이... ,초록민_다이어리,https://blog.naver.com/wh77bear,20210715
스킨미라클 원주<b>피부관리</b> 여우야 뷰티,https://blog.naver.com/durifoy?Redirect=Log&logNo=222433554304,피부 /왁싱 /스킨플래닝 /패디플래닝 /화장눈썹 상담및 예약 ***-****-**** 100%예약제로 운영됩니다 화~일 11:00-20:00 단계동 스킨미라클 <b>피부관리</b> 여우야 뷰티# 신부관리대신 틈틈히 바디랑 <b>피부관리</b>를 받으려고... ,하루하루 다른 일상,https://blog.naver.com/durifoy,20210716
하남 <b>피부관리</b> 탄력있고 밝게!,https://blog.naver.com/scriabin02?Redirect=Log&logNo=222430018797,"ㅎㅎ 관리 후 뽀샤시해졌네용.ㅎㅎ 촉촉 탱탱해진 피부를 느낄 수 있어요. 톤업 되어서 오늘은 생얼도 가능할듯! <b>피부관리</b> 받을 때 진짜 행복함.ㅋㅋㅋ 오늘도 <b>피부관리</b>에 데콜테, 목 트리트먼트까지 목 어깨에... ",♥️ 내가 사는 이유 ♥️,https://blog.naver.com/scriabin02,20210713
달서구<b>피부관리</b> 남다른 변화 후기,https://blog.naver.com/feelgirl132?Redirect=Log&logNo=222402428548,달서구<b>피부관리</b> 재생관리받고 난 뒤부터 이 홈케어까지 함께 하니 악성 트러블 싹 들어가고 피부가 속부터 촉촉해졌어요 제가 얼굴에 열감이 많은 편이라 트러블에 최악인 열감을 진정팩으로 낮춰주고... ,헬로우뉘씨밀레,https://blog.naver.com/feelgirl132,20210618
마곡<b>피부관리</b> 수분보충과 윤곽정리까지 한번에 받았어요,https://blog.naver.com/sida2244?Redirect=Log&logNo=222425894363,"마곡<b>피부관리</b> 과정 중에서도 저는 초강력 페이스리프팅을 받으면서 관리를 하고 있는 중인데요, 고주파의 열을 이용하여 피부들이 재생력을 좀 더 높게 가질 수 있도록 만들어 줄 수가 있더라구요 처음에는... ",sida2244님의블로그,https://blog.naver.com/sida2244,20210709
