title,link,description,bloggername,bloggerlink,postdate
[블루투스스피커/이지넷유비쿼터스] <b>라디오</b> <b>청취</b>가... ,https://blog.naver.com/oshow0626?Redirect=Log&logNo=221617644441,안녕하세요~ <b>라디오</b> <b>청취</b>가 그리웠던 오쇼입니다^^ 그때는 왜 그리도 노래가 듣고 싶었는지... 교복속에 이어폰을 숨겨서 몰래 몰래 <b>라디오</b>를 듣고 노래를 들었던 철없던 학창시절..... 뭔가 심장 쫄깃한... ,오쇼 찾아 삼만리,https://blog.naver.com/oshow0626,20190815
FM<b>라디오</b> <b>청취</b>가 가능한 무선 블루투스 스피커 브리츠 BA-C7... ,https://blog.naver.com/kyonghun86?Redirect=Log&logNo=222280465396,"BA-C7 블루투스 스피커 내부에는 78mm 풀레인지 유닛 및 베이스를 보강하는 베이스 리플렉스 시스템과 에어덕트가 탑재 되어 있어 <b>라디오</b> <b>청취</b> 시 풍부하고, 선명한 소리로 <b>청취</b>할 수 있습니다. 그리고... ",내일 또 봐요~,https://blog.naver.com/kyonghun86,20210319
이스<b>라디오</b> <b>청취</b>중,https://blog.naver.com/joohyepark?Redirect=Log&logNo=222108251991,"그런 부분을 모두 고려해보았을 때 이슬아가 혼자서 자신의 글을 낭독하는 이스<b>라디오</b>는 통학길에... 중학교 때부터 새벽에 <b>라디오</b> 듣는 걸 즐겨 했고, 집에 가끔 혼자 있으면 심심해서 팟캐스트를 트는데 특히... ",慧,https://blog.naver.com/joohyepark,20201006
울산 인터넷 <b>라디오</b> <b>청취</b> 방법,https://blog.naver.com/getorey?Redirect=Log&logNo=222000148925,"인터넷 <b>라디오</b> <b>청취</b> 방송국에서 인터넷으로 스트리밍하고 있는 방송을 <b>청취</b>할 수 있는 기계가 많다. 컴퓨터, 스마트폰, AI스피커 등 많은 기기들을 활용할 수 있다. 우리집에도 5대는 넘는다. 컴퓨터는... ",언양한우불고기,https://blog.naver.com/getorey,20200614
"북, 10년 동안 자유세계 <b>라디오</b> <b>청취</b>한 선장 공개처형… ‘이런... ",https://blog.naver.com/khchojh?Redirect=Log&logNo=222183344884,"북, 10년 동안 자유세계 <b>라디오</b> <b>청취</b>한 선장 공개처형… ‘이런 곳이 북한이다’ ▲ 자유아시아방송(RFA) <b>라디오</b>를 <b>청취</b>한 혐의로 북한어선 선장이 최근 처형됐다. ⓒ 복음기도신문 북한 함경북도 청진시의 한... ",그리스도복음-블로그,https://blog.naver.com/khchojh,20201223
MBC 미니 <b>라디오</b> 플레이어 다운 및 <b>청취</b> 방법,https://blog.naver.com/dolcevita064?Redirect=Log&logNo=222348444118,"평소 TV를 보는 것을 선호하시는 분들도 조용하게 무언가 듣고싶거나 다른 사람들의 사연, 음악 등을 듣고싶을 때는 <b>라디오</b>를 <b>청취</b>하는 경우가 많습니다. 잔잔하게 듣다보면 마음도 편해지고 진행자의... ",돌비의 거실,https://blog.naver.com/dolcevita064,20210512
"스크랩 &quot;北, 美 <b>라디오</b> 장기 <b>청취</b>한 선장 총살&quot; RFA",https://blog.naver.com/13key13?Redirect=Log&logNo=222181492430,"스크랩 &quot;北, 美 <b>라디오</b> 장기 <b>청취</b>한 선장 총살&quot; RFA 자동요약음성 기사 듣기번역 설정공유글씨크기 조절하기인쇄하기 새창열림&quot;北, '외부 <b>라디오</b> <b>청취</b>는 죽음' 본보기 삼은 것&quot; [서울=뉴시스]김정은 북한... ",김포종점열쇠님(010-3731-1113),https://blog.naver.com/13key13,20201222
<b>라디오</b> <b>청취</b>하며 등산하기,https://blog.naver.com/hloveyolo?Redirect=Log&logNo=222129182787,언제 여기까지 왔나 싶을 정도로 <b>라디오</b> <b>청취</b>에 흠뻑 취해있었다. <b>라디오</b> 내용 중 Netflix회사 내부적으로 상대방에게 feedback을 줄 때 지켜야 하는 예의 &quot;규칙&quot;들이 있는데 그 &quot;규칙&quot;들의 전제는 다음과 같다... ,어또니 Jenna의 업業글文 이야기,https://blog.naver.com/hloveyolo,20201028
기분 전환 / BTS (방탄소년단) 노래 듣기 &amp; SBS <b>라디오</b> <b>청취</b>,https://blog.naver.com/mj_love_ms?Redirect=Log&logNo=222318633149,아침에 눈을 뜨자마자 고릴라 앱을 실행 <b>라디오</b> <b>청취</b> 러브 FM부터 파워 FM까지 다양하게 시간대에 맞게 좀 더 익숙한 프로그램을 <b>청취</b>한다. 파워보다는 러브 쪽을 많이 듣는 거 같다. Am 7~ 9시 = &gt; 이숙영의... ,지구별 소풍의 감성일기,https://blog.naver.com/mj_love_ms,20210422
"스푼<b>라디오</b> X MBC<b>라디오</b>, <b>청취</b> 기반 확대 및 오디오콘텐츠... ",https://blog.naver.com/radioant?Redirect=Log&logNo=222370742230,"오디오 콘텐츠의 미래를 가져오기를 기대한다”고 MOU 체결의 의미를 평가했다. iMBC 김경희 | 사진제공 MBC [출처] 스푼<b>라디오</b> X MBC<b>라디오</b>, <b>청취</b> 기반 확대 및 오디오콘텐츠 공동 개발 위해 MOU 체결 (imbc.com)",방송 트렌드 연구소,https://blog.naver.com/radioant,20210527
[블로그씨질문]당첨_ <b>라디오</b><b>청취</b>의 즐거움... ,https://blog.naver.com/oyanamoo?Redirect=Log&logNo=222250149238,"<b>라디오</b>를 들으면서 그림을 그리다보면 친구질문에 응답하듯이 문자를 보내곤 하는데 횟수가 많다보니 각종 선물쿠폰을 받았어요. 아래는 작년 봄,여름,<b>라디오</b>방송에 문자보내고 받았던 맘스터치싸이버거... ",식물그림,https://blog.naver.com/oyanamoo,20210220
데일리 로그_TBS eFM <b>라디오</b> <b>청취</b> (feat. 커피기프티콘 당첨) :),https://blog.naver.com/everydaywithgod?Redirect=Log&logNo=222172172341,데일리 로그_TBS eFM <b>라디오</b> <b>청취</b> (feat. 커피기프티콘 당첨) 안녕하세요~ 요즘은 출퇴근길에 TBS eFM <b>라디오</b>를 <b>청취</b>하고 있어요 :) 처음에는 스마트폰으로는 DMB처럼 별도 <b>라디오</b> 앱이 있는게 아니다보니... ,Amazing Things Will Happen :),https://blog.naver.com/everydaywithgod,20201213
<b>라디오</b> <b>청취</b> 중,https://blog.naver.com/hanseonsaeng?Redirect=Log&logNo=221875040980,머리도 쉴 겸 이런 <b>라디오</b> <b>청취</b> 시간이 힐링의 시간이 될 지도 모른다는 생각이 듭니다. 가끔은 <b>라디오</b>를 들으면서 눈도 쉬게하고 머리도 식혀보세요... <b>라디오</b>를 듣고 있다보니 따끈한 커피생각이 간절해... ,지산대장의 세상 살아가는 이야기,https://blog.naver.com/hanseonsaeng,20200326
로니 <b>라디오</b> 직관적인 어플로 손쉽게 <b>라디오</b> <b>청취</b>,https://blog.naver.com/three0626?Redirect=Log&logNo=222069719550,책을 읽으며 <b>라디오</b> 듣기 감성이 되살아나 스마트폰으로 <b>라디오</b>를 듣기 위해 '로니 <b>라디오</b>' 를 설치했습니다. 별 이유는 없이 상단에 위치한 어플이라 선택했는데 직관적인 디자인이라 사용이 편리해서 애용하고... ,지극히 소소로운 생활여행자,https://blog.naver.com/three0626,20200824
<b>라디오</b> 칸사이「우에다... (8/30 AM 2시~3시)+우리나라서 <b>청취</b> 방법,https://blog.naver.com/junjieun1012?Redirect=Log&logNo=222062520940,【방송 일시】 2020년 8월 29일（토）26:00～27:00 (☆30일 오전 2~3시) 【<b>청취</b> 방법】 ・<b>라디오</b> 칸사이 주파수：ＡＭ558KHz・FM91.1MHz ・radiko（무료 지상파 <b>라디오</b> <b>청취</b> 앱） 효고 현、오사카 부、교토... ,개인 덕질 블로그,https://blog.naver.com/junjieun1012,20200817
세상 핫이슈 알기 '이진우의 손에 잡히는 경제' <b>라디오</b> <b>청취</b> 추천!,https://blog.naver.com/mitot613?Redirect=Log&logNo=221903155024,프로그램 <b>청취</b>를 추천드립니다! #이진우의손에잡히는경제 #요즘경제이슈 #최근금융이슈 #최근부동산이슈 #경제방송추천 #부동산방송추천 #금융방송추천 #재태크잘하는방법 #MBC<b>라디오</b> #금융상품안내... ,WHERE AM I,https://blog.naver.com/mitot613,20200411
EBS <b>라디오</b> 초급중국어  &quot;生生 중국어&quot; <b>청취</b>리뷰,https://blog.naver.com/jjanji_?Redirect=Log&logNo=222070671105,"이게 눈에 들어오더라구요 저는 눈높이에서 나온 #차이홍도 잠깐 해봤고 인스타에서 유명한 #나의가벼운중국어 도 구매해서 공부했는데 뭐니뭐니해도 <b>라디오</b> <b>청취</b>를 하면서 공부하는게 재미있고, 중국문화에... ",Bravo. My life ♡,https://blog.naver.com/jjanji_,20200825
나의취미생활 <b>라디오</b><b>청취</b> 사연보내기,https://blog.naver.com/jso2679?Redirect=Log&logNo=222045628123,작년에 잠깐 들어봤던 TBC FM<b>라디오</b> 달콤한 오후 이수정입니다 그때는 따뜻한 느낌의 어느날이였는데 올해는 집콕으로 두아들과 우당탕탕 정신없이 보내다보니 <b>라디오</b> 근처도 못가고 <b>라디오</b>를 듣더라도... ,오늘부터 1일 오기날다,https://blog.naver.com/jso2679,20200729
[고급 중국어]중국어 <b>라디오</b> <b>청취</b> TBS eFM&lt;1013신식항&gt;,https://blog.naver.com/wogml26?Redirect=Log&logNo=222200213678,바로 <b>라디오</b>를 듣고 공부할 때였다 내가 소개할 공부법은 중국어 중급에서 고급으로 가고 싶은... 비정상회담으로 유명해진 중국인 장위안이 MC로 있는 <b>라디오</b> 프로그램이다. 신식항안에 월~금 모두 다른... ,이구미 in the area,https://blog.naver.com/wogml26,20210107
<b>라디오</b> <b>청취</b>하시나요,https://blog.naver.com/o4bb25et0?Redirect=Log&logNo=222254908460,"<b>라디오</b> <b>청취</b>하시나요 안녕하세요 여러분~! 여러분들은 <b>라디오</b> <b>청취</b>하시나요? © nittygritty_photo, 출처 Unsplash 저는 사실 <b>라디오</b>를 즐겨 드는 타입은 아니예요. 그런데 회사에서 <b>라디오</b>를 틀어 놓고 있어요.... ",링마벨,https://blog.naver.com/o4bb25et0,20210224
[취향일기]02. <b>라디오</b> <b>청취</b>,https://blog.naver.com/duddls1119?Redirect=Log&logNo=221828179035,#취향일기_Day2 : <b>라디오</b> <b>청취</b> 나는 <b>라디오</b>를 듣는 걸 참 좋아했다. 고등학생 때는 어둑한 공간에서 <b>라디오</b>를 틀어놓고 혼자 생각을 하거나 글을 쓰거나 노래를 따라 부르거나 하는 시간이 꼭 필요했다. 어쩌면 그... ,KANGYOUNGIN,https://blog.naver.com/duddls1119,20200228
[러시아어 <b>청취</b>] 왕초보의 러시아어 <b>라디오</b> <b>청취</b> 이야기,https://blog.naver.com/ekaterinalee?Redirect=Log&logNo=222287318312,이진주 러시아어 정복기 러시아어 <b>라디오</b> <b>청취</b> 혹시 외국어를 공부하면서 외국어로 된 <b>라디오</b>를 <b>청취</b>한적 있나요? 지금이야 스마트폰으로 전세계 다양한 컨텐츠를 실시간으로 볼 수 있다지만 제가 러시아어를... ,3040 1인교육학원 프로젝트,https://blog.naver.com/ekaterinalee,20210327
<b>라디오</b> 실시간 <b>청취</b>와 다시듣기(AOD) 이용행태,https://blog.naver.com/radioant?Redirect=Log&logNo=222226353658,"기반으로 한 <b>라디오</b> <b>청취</b> 방식이 도입됨에 따라, 실시간 <b>라디오</b><b>청취</b>와 <b>라디오</b> 다시듣기(AOD)에 대한 이용행태 차이를 살펴보고자 함 정보통신정책연구원 - 방송서비스 산업·시장 (kisdi.re.kr)",방송 트렌드 연구소,https://blog.naver.com/radioant,20210131
호시노 겐 <b>라디오</b> 올 나이트 닛폰 <b>청취</b> 방법 (星野原 ANN),https://blog.naver.com/gr_0330?Redirect=Log&logNo=222369447907,이 아저씨 화요일에서 수요일 넘어가는 새벽 1시부터 <b>라디오</b>를 진행한다. 인스타그램 링크를 타고 들어가면 한국에서는 <b>청취</b>가 불가능하다고 뜨기 때문에 다음날 유튜브로 찾아보거나 (한국어로 검색하면 안... ,森,https://blog.naver.com/gr_0330,20210527
<b>라디오</b> <b>청취</b> 소감 사연 당첨 꿀팁1,https://blog.naver.com/shadmoon?Redirect=Log&logNo=221683521830,요즘은 <b>청취</b>율 조사 기간이라고 빵빵한 상품도 계속 풀고 있어서 <b>라디오</b> 듣는 재미가 꽤 있다. 나한테 맞는 <b>라디오</b>를 찾아 찐팬으로 고정하려고.. 동시간 대 <b>라디오</b>도 골고루 들어봤는데. 시간대별로... ,하늘바라기,https://blog.naver.com/shadmoon,20191020
<b>라디오</b><b>청취</b> 듣는 플레이리스트있나요,https://blog.naver.com/pam_am1004?Redirect=Log&logNo=222266559693,"<b>라디오</b> <b>청취</b>를 듣다보니 문득 이런 생각이 들었다 나는 그래서 내일,, 태닝을하고 마사지를 하고 여유를 즐길려고 한다 그런데 이번주도 할일이 태산이다. 그래도 플레이리스트 들으면서 편안하게 해볼려고한다... ",마석봉,https://blog.naver.com/pam_am1004,20210307
<b>라디오</b> <b>청취</b>중 '비깡'... 뭐지?!,https://blog.naver.com/bsopia0921?Redirect=Log&logNo=221962197228,<b>라디오</b> <b>청취</b>중~ 계속 비깡 비깡... 하며 웃길래 찾ᆞ아ᆞ보ᆞ니 #웃으면행복이와요 #비깡 #비깡댓글모음 #비깡레전드댓글모음집 걍~ 요즘 웃을 일 없구 잠잠해질만 했던 #코로나19 가 뜬금없이 #이태원클럽 이... ,꽃호랭이~*,https://blog.naver.com/bsopia0921,20200514
"<b>라디오</b><b>청취</b>상품도착,CJB 박관용의 <b>라디오</b>쇼... ",https://blog.naver.com/dongbei?Redirect=Log&logNo=222022734531,#CJB청주MBC<b>라디오</b>방송 중 #박관용의<b>라디오</b>쇼 를 <b>청취</b>하다가 <b>라디오</b> 퀴즈를 즐겁게 풀어보냈더니 DJ박관용씨가 제 사연소개와 상품도 보내주었네요.^^ 하루종일 사육실에서 <b>라디오</b>를 들으면서 일하니 이런... ,농업회사법인(주)벅스유. 박달재치유굼벵이농장,https://blog.naver.com/dongbei,20200706
오늘은 <b>라디오</b> <b>청취</b>~,https://blog.naver.com/burumaworks?Redirect=Log&logNo=221626304735,오늘은 80-90년대 레트로 감성으로 워크맨으로 <b>라디오</b> <b>청취</b>중입니다. ^^ 옛생각도 나고 좋네요..^^ <b>라디오</b>에서는 Gazebo의 ‘I like chopin’ 노래가 나오네요..^^ 가끔은 이런 아날로그 소리가 그리울 때가... ,BuruBeat Sound,https://blog.naver.com/burumaworks,20190823
인터넷으로 프랑스어 <b>라디오</b> <b>청취</b>하기,https://blog.naver.com/tonbonami?Redirect=Log&logNo=110091106477,"바로 프랑스어 <b>라디오</b>이지요~ 프랑스어 <b>라디오</b>를 <b>청취</b>하면 최신 음악과 뉴스를 가장 신속하게 접할 수 있을 뿐 아니라, 더불어 프랑스어 듣기 실력도 함께 올리실 수 있을거에요. 물론 처음에는... ",프랑스어 한스푼,https://blog.naver.com/tonbonami,20100801
<b>라디오</b><b>청취</b> 독서 인생을 바꾸는 생각들,https://blog.naver.com/skdlxh?Redirect=Log&logNo=222407438903,그리고 <b>라디오</b><b>청취</b>! 너무너무 편안하고 힐링된다 이런게 진정한 자유인가^^ 온전히 혼자있는게 얼마만인지 둘째도 어제 원에 다녀오더니 친구들 선생님 만나서 좋다고한다 며칠 더 지켜봐야겠지만 아이가... ,jjun&ah's story,https://blog.naver.com/skdlxh,20210623
아리랑 인터넷 <b>라디오</b> <b>청취</b> -잘들리네-,https://blog.naver.com/stidy?Redirect=Log&logNo=30036035677,음질이 아주 구려 =ㅁ= 그리고 내가 <b>청취</b>한 타이밍의 문제일지 계속 대선 이야기를 하는데 정치쪽... &lt;사진에 홈피 주소를 링크해두었다&gt; TV와 <b>라디오</b>를 고를 수 있는데 TV부분을 클릭해 들어가니 지난... ,흘러가는 인생에게,https://blog.naver.com/stidy,20080925
미국 <b>라디오</b> <b>청취</b> 방송국을 KQED에서 WNYC로 변경했습니다.,https://blog.naver.com/creatiger?Redirect=Log&logNo=220198523852,물론 <b>라디오</b> <b>청취</b>만으로 실력이 올라간 것은 아니고 6개월 정도 따로 집중적인 듣기 공부를 했습니다. 전 원래 잠드는 시간이 오래 걸리는 편입니다. 약간의 불면증을 겪던 어느 시기의 어느 날 잠을... ,아직 널리 알려지지 않은 것들,https://blog.naver.com/creatiger,20141202
데이터 없이 <b>라디오</b> <b>청취</b> 가능한 LG Q6 소개합니다.,https://blog.naver.com/improvise?Redirect=Log&logNo=221388470606,"DMB처럼 이어폰 안테나를 통해서 <b>라디오</b>를 <b>청취</b>할 수 있습니다. 예전에, <b>라디오</b> 기능을 일부러 제외시키는 휴대폰 시장 트렌드에 대해서 포스팅한 적이 있는데, 요즘 삼성 및 LG 일부 모델에서 다시 <b>라디오</b>... ","까닭없이 허전한 마음,,",https://blog.naver.com/improvise,20181031
스마트 시대의 실시간 <b>라디오</b> <b>청취</b>,https://blog.naver.com/radioant?Redirect=Log&logNo=222226287171,첨부파일 스마트 시대의 실시간 <b>라디오</b> <b>청취</b>.pdf 파일 다운로드 ●조사 자료 및 배경 －디지털 컨버전스 환경에서 <b>라디오</b> 방송 서비스는 다양한 플랫폼과 미디어기기를 통한 이용이 가능해지며 매체로서... ,방송 트렌드 연구소,https://blog.naver.com/radioant,20210131
중국어 <b>라디오</b> <b>청취</b>,https://blog.naver.com/pavetheway?Redirect=Log&logNo=221561212577,자꾸 눈이가시는 분들에게는 <b>라디오</b><b>청취</b>가 더 좋을 수 있답니다. 플레이스토어에서 중국어로 中国广播电台 검색하시면 여러 무료어플이 있으니 다운받으셔서 플레이 하심 됩니다. 저는 중국에서 대학교 대학원... ,"[중국어로 :路] 유학,취업,입시전문",https://blog.naver.com/pavetheway,20190613
다용도 부착패드 사용해 주방에서 <b>라디오</b><b>청취</b>...아니 시청해요.^^,https://blog.naver.com/elvira0484?Redirect=Log&logNo=220703856887,다용도 부착패드로 주방에서 <b>라디오</b> 시청해요.^^ 주방에서 이런저렁 일을 하며선 늘 <b>라디오</b><b>청취</b> 하며 일을 하곤 했는데 태블릿PC를 장만하고는 <b>청취</b>가 아닌 <b>라디오</b>시청을 하고 있었지요. 헌데.... 장소가... ,Feel Good....,https://blog.naver.com/elvira0484,20160508
Re..일본<b>라디오</b> <b>청취</b>,https://blog.naver.com/exjik?Redirect=Log&logNo=140107048911,위의 세 가지가 유명하고 이용 방법 또한 간편하므로 간단히 일본의 <b>라디오</b>를 <b>청취</b>하실 수 있을 것 같습니다. ^^ 그럼 좋은 하루 되세요. :) 출처:http://www.karuru.com/board.php?board=mstLifeQA&amp;config=2&amp;page=5... ,봄향기 나는 블로그,https://blog.naver.com/exjik,20100518
"어플 K플레이어(K For iPad) / KBS TV 시청,KBS <b>라디오</b> <b>청취</b>",https://blog.naver.com/hobynara?Redirect=Log&logNo=149184786,"K플레이어와 pooq모두 고화질 N스크린서비스를 기반으로 한 것으로 pooq는 MBC와 SBS채널, K플레이어는 KBSTV시청 및 <b>라디오</b> <b>청취</b>가 가능 합니다. pooq와 가장 큰 차이점은 다시보기의 경우 pooq는... ",ANUNNAKI Re.Ver.3.1™,https://blog.naver.com/hobynara,20120126
레트로 <b>라디오</b> 겸용 블루투스 스피커 캔스톤 TR-3300,https://blog.naver.com/crom234?Redirect=Log&logNo=222346060623,"블루투스 4.1 칩셋 탑재로 스마트폰의 음악을 무선으로 자유롭게 감상할 수 있고, <b>라디오</b> <b>청취</b> 기능으로 음악 및 뉴스를 <b>청취</b>할 수 있다. 캔스톤의 엔지니어가 조율한 정격 9W의 강력한 사운드로 넓은... ",피터팬 캠핑:굳이 편해지려는 이유는 무엇인가?,https://blog.naver.com/crom234,20210511
"컨슈머트렌드, <b>라디오</b> <b>청취</b> 행태와 매체 영향력 조사",https://blog.naver.com/mkresearch?Redirect=Log&logNo=20066972860,"매체별 영향력 평가(1/3) 매체별 영향력 평가(2/3) 매체별 영향력 평가(3/3)-요약 <b>라디오</b><b>청취</b>현황,<b>라디오</b>이용현황,<b>라디오</b>영향력조사,<b>라디오</b><b>청취</b>행태,<b>라디오</b><b>청취</b>시간,선호하는<b>라디오</b>프로그램조사... ",리서치기업 엠브레인 공식 블로그,https://blog.naver.com/mkresearch,20090508
<b>라디오</b> <b>청취</b> 소감,https://blog.naver.com/hmcg72?Redirect=Log&logNo=40172897709,"'<b>라디오</b>가 좋아요' <b>청취</b>소감 &lt;월견초&gt; 動的인 Tv 시청보다는 靜的인 <b>라디오</b> <b>청취</b>에 더 많은 시간을 투자하고 있는 주부입니다. 제가 안동 mbc <b>라디오</b>를 처음 접하게 된것은 1995년, 봄꽃들이 천지산야에 화려하게... ",화향,https://blog.naver.com/hmcg72,20121119
"&quot;北, 美 <b>라디오</b> 장기 <b>청취</b>한 선장 총살&quot; RFA",https://blog.daum.net/kjh-jeonghyun/8514678,"04:46 댓글 136 개 &quot;北, '외부 <b>라디오</b> <b>청취</b>는 죽음' 본보기 삼은 것&quot; [서울=뉴시스]김정은 북한 국무위원장이 지난 11월29일 북한 평양 노동당 본부청사에서 조선노동당 중앙위원회 제7기 제21차 정치국... ","산수간애 ""山水磵 愛 """,https://blog.daum.net/kjh-jeonghyun,20201222
알람으로 간편실행되는 아이폰 <b>라디오</b> <b>청취</b>앱 : RadioApp,https://blog.naver.com/bonamy?Redirect=Log&logNo=220772348073,아이폰은 <b>라디오</b>를 수신해 듣는 기능이 없다보니 앱을 이용해 인터넷 스트리밍으로 듣게됩니다. <b>라디오</b>앱들이 여럿 있지만 꽤 직관적이고 심플한 라이오앱을 소개할께요. 요즘 많이들 추천해 주시네요.... ,보남이의 앱세이(App Say),https://blog.naver.com/bonamy,20160726
LKW-Radio 4.6= 영어 실력 향상을 위한 <b>라디오</b> <b>청취</b>,https://blog.naver.com/theateam?Redirect=Log&logNo=110028723849,"요약 국내에서 만들어진 <b>라디오</b>,인터넷 방송을 <b>청취</b> 및 시청할 수 있는 프로그램으로 깔끔한 인터페이스가 장점이다. 2. 리뷰 국 내에서 만들어진 <b>라디오</b>, 인터넷 방송을 <b>청취</b>, 시청 할 수 있는... ",뚱보의 블로그,https://blog.naver.com/theateam,20080308
"이태리 테이블오디오, 테이블스피커 _블루투스 &amp; FM<b>라디오</b> <b>청취</b>",https://blog.naver.com/newtecaudio?Redirect=Log&logNo=100158851325,또한 원하는 주파수를 선택하여 <b>라디오</b>를 <b>청취</b>합니다. 이뿐만이 아니죠~~ 테이블 아래부분에는 LED가 내장되어 있어 3레벨로 화이트 조명을 컨트롤 할 수 있답니다. 또한 방수가 잘 되어 야외설치도... ,"와이파이,오디오,ISP,뉴텍,스피커,WIiFi,Audio",https://blog.naver.com/newtecaudio,20120525
갤럭시S9로 FM<b>라디오</b> <b>청취</b>하는 방법,https://blog.naver.com/123jhc?Redirect=Log&logNo=221302552566,"갤럭시S9와 갤럭시S9+에는 FM <b>라디오</b> 기능이 있는데, 제공된 이어폰을 장착하여 FM<b>라디오</b> <b>청취</b> 및 녹음이 가능하며 이어폰을 분리하면 <b>라디오</b> <b>청취</b>가 불가능합니다. ※ 녹음된 <b>라디오</b> 저장 위치 : 앱스... ",장샘의스마트폰활용,https://blog.naver.com/123jhc,20180620
방송 3사 <b>라디오</b> <b>청취</b>하기~! [아이팟터치/아이폰],https://blog.naver.com/hot79486?Redirect=Log&logNo=40103123550,"아이팟터치, 아이폰에는 <b>라디오</b> 기능이 없어서 다소 아쉬웠는데 현재 FM<b>라디오</b> 기능을 넣기 위해 펌웨어가 개발중이라고 한다. (그 말인 즉, 이미 아이팟터치에 <b>라디오</b> 튜너가 장착되어 있다는 뜻?;;) 하지만... ",해랑쓰 블로그,https://blog.naver.com/hot79486,20100318
<b>라디오</b> <b>청취</b>와 아마추어 무선의 아름다움,https://blog.naver.com/winfred12?Redirect=Log&logNo=221021734774,무선 <b>라디오</b>로 주파수를 맞추고 아마추어 밴드를 사용해서 전세계의 사람들과 무선통신을 할 수... 무선 <b>라디오</b>(워키터키 같은것)로 통화하는 겁니다. 국제 아마추어 <b>라디오</b> 마크 캐나다에서... ,Rule Maplemuffin!,https://blog.naver.com/winfred12,20170605
10일자) - by 90년대 부터 역대 최고 <b>라디오</b><b>청취</b>를 기록한 싱글,https://blog.naver.com/misoung55?Redirect=Log&logNo=60197359896,이후 <b>라디오</b> <b>청취</b>부문 역대 2위에 해당하고 있다.) 등 하위차트에서 여전히 골고루 선전하면서 8주 정상을 유지할 수 있었다. 반면에 영국 보이밴드 원 디렉션의... ,Music Story,https://blog.naver.com/misoung55,20130804
[<b>라디오</b> <b>청취</b>] 내가 하루를 지내는 방법,https://blog.naver.com/sophia49?Redirect=Log&logNo=221043685574,"내가 사전만한 트랜지스터 <b>라디오</b>에 주먹만한 배터리를 고무줄로 엮어, 부엌으로, 마당으로, 공부하면서 음악을 들은 것은 지금부터 거의 55년 전인 청소년이었을 때부터 였다. 그 때는 <b>라디오</b>를 들으며 아는... ",...the more,https://blog.naver.com/sophia49,20170704
