title,link,description,bloggername,bloggerlink,postdate
sonai's pick #2 A LIFE <b>콜렉션</b> - 아큐리 넥타이,https://blog.naver.com/comman88?Redirect=Log&logNo=221432925127,오늘은 몇 주 전 소개해드렸던 'A Life' <b>콜렉션</b>을 통한 sonai's pick 컨텐츠입니다. 출처 : GOOGLE.CA 이미지 A LIFE <b>콜렉션</b>은 제 10대 후반~20대 초반에 있어서 가장 큰 영향을 준 작품인 영화 나를 책임져 알피(ALFIE)... ,셀렉샵 소나이의 이야기,https://blog.naver.com/comman88,20190103
[런던 여행] 런던의 아침 더 월리스 <b>콜렉션</b>,https://blog.naver.com/riacebamboo?Redirect=Log&logNo=221504052728,더 월리스 <b>콜렉션</b> The Wallace Collection 개장시간 10:00 - 17:00 여기는 미술관인데 동행분이 여기 카페 좋다고해서 난 그냥 아침먹으러 와봤다 이렇게 지붕이 온실처럼 되어있다 날씨가 좋았다면 하늘이 예쁘게... ,즐거운,https://blog.naver.com/riacebamboo,20190403
배리 제이의 새로운 <b>콜렉션</b> - 에미 그레이스,https://blog.naver.com/thequilters?Redirect=Log&logNo=20209691866,배리 제이 (Bari J)의 새로운 <b>콜렉션</b> '에미 그레이스' (Emmy Grace) 입니다. 배리 제이 특유희 대범한 디자인 스케일에 여성스러운 아름다움이 뿜어져 나옵니다. 이번 <b>콜렉션</b> Emmy Grace 는 그녀에겐 의미있는... ,모던 패브릭,https://blog.naver.com/thequilters,20140429
릴리풋 레인 <b>콜렉션</b> - TOP HAT &amp; TAILS 外,https://blog.naver.com/bluequeenkr?Redirect=Log&logNo=220397079705,"릴리풋 레인 <b>콜렉션</b> 입니다.. 전체 영국 생산품, 릴리풋 레인 퍼스트 퀄러티 제품들로... 브로 다웰 - 웰쉬 <b>콜렉션</b> (5cm x 7cm / 상태 완벽 / 25,000) 18. 다리 위 집 (6.5cm x 6cm / 상태 완벽) 19.... ",톰과 실비아의 오두막,https://blog.naver.com/bluequeenkr,20150621
다니엘웰링턴 Iconic Link <b>콜렉션</b> 출시! 남녀메탈시계 추천... ,https://blog.naver.com/loveneet?Redirect=Log&logNo=221661143628,전제품 15% 할인코드도 있으니 밑에까지 꼭 봐주세요:) 다니엘웰링턴 ICONIC LINK <b>콜렉션</b> Silver White 28mm... 다니엘웰링턴 아이코닉 링크 <b>콜렉션</b>은 스트랩 색상이 골드/실버 다이얼 색상이 화이트/블랙 다이얼... ,B E A U T Y - 0ct.g7,https://blog.naver.com/loveneet,20190927
용인 역북동에 간 홈앤슬립 호텔<b>콜렉션</b> 스위트와... ,https://blog.naver.com/lobby6994?Redirect=Log&logNo=222426877845,"용인 역북동에 간 홈앤슬립 호텔<b>콜렉션</b> 강도100 스위트와 원목 조명 침대 프레임입니다. 사이즈는 라지킹, 가로170센치에 세로210센치 홈앤슬립 호텔<b>콜렉션</b> 스위트. 하이브리드 매트리스에 양모를 추가... ",그부부의침대,https://blog.naver.com/lobby6994,20210710
[크리스마스의 악몽] 라지 피규어 <b>콜렉션</b>,https://blog.naver.com/legolras?Redirect=Log&logNo=90000581321,이 라지 피규어 <b>콜렉션</b>은 개당 2000원인 주제에 퀄리티가 트레이딩 피규어 수준을 능가한다!!!! (6개... 의외로 크리스마스 악몽 피규어에선 잘 등장하지 않는 캐릭터인데 이번 라지 <b>콜렉션</b>에서 추가되었다.... ,와사비맛 티타임★,https://blog.naver.com/legolras,20060102
대구 그랜드스타렉스6밴 글라루스 열차단 썬팅 <b>콜렉션</b> 인스톨... ,https://blog.naver.com/sat700?Redirect=Log&logNo=221872178002,"글라루스 <b>콜렉션</b> IR-CUT 70%~72% 품질보증 7년 http://www.glarustint.com/film_auto/collection 그랜드스타렉스... 핸즈카오디오의 얼굴을 보고 찾아주시는 고객님께서 글라루스 <b>콜렉션</b>을 측면,후면을 선택하시게... ",High-End Pro install Multi-Shop 핸즈카오디오,https://blog.naver.com/sat700,20200325
포스터에서 클래식 <b>콜렉션</b> 수록의 티라노몬 등이 공개 !!,https://blog.naver.com/j_freedom?Redirect=Log&logNo=222414235902,"LV.4 / 티라노몬 / DP 4000성숙기 / 데이터종 / 공룡형등장 코스트 5 / 진화 코스트 적색 LV.3에서 2 또는 녹색 LV.3에서 2【진화시】자신의「타이가」가 없을 때, 자신의 패에서「타이가」1장을 코스트를... ",씨네오스의 덱 저장소,https://blog.naver.com/j_freedom,20210629
언차티드: 네이선 드레이크 <b>콜렉션</b> 오픈케이스,https://blog.naver.com/jwa00700?Redirect=Log&logNo=221746049902,"이번에 보여드릴 타이틀은 얼마 전에 국전 한우리에서 구입한 '언차티드: 네이선 드레이크 <b>콜렉션</b>' 입니다. 실은 언차티드 4를 몇년 전에 너무 재밌게 플레이 한지라 요 타이틀도 꼭 사려고 했었는데, 고등학교... ",Groovy,https://blog.naver.com/jwa00700,20191222
실기화면(플레이스테이션) - 캡콤<b>콜렉션</b> 캡콤제네레이션 제4집... ,https://blog.naver.com/cchgoo?Redirect=Log&logNo=222396707346,소장품은 캡콤<b>콜렉션</b>이라는 베스트판으로 많이들 보셨을거 같습니다. PS판으로 공략본과 같이 붙어서 나온것도있고 PS2의 캡콤클래식스<b>콜렉션</b>에도 수록되어있고 여기저기 지겨울 정도로 이식이 되어있습니다.... ,카린카의 레트로게임 아카이브즈,https://blog.naver.com/cchgoo,20210613
[엔틱감상]이태리 무역관장 <b>콜렉션</b>,https://blog.naver.com/seraline?Redirect=Log&logNo=100031487941,"동서양과 10세기를 넘나들며 구입한 엔틱<b>콜렉션</b>을.. 찍어 온 사진은 이 보다 3배 많지만 일부만 올립니다. 거 실 서 재 접 견 실 손 님 침 실 불상이 많길래 '종교가 뭐냐'고 물었더니, '아무것도 안 믿는다'고... ",SERART,https://blog.naver.com/seraline,20061201
스카이캐슬 윤세아 패딩 막스마라 패딩? 지춘희 미스지<b>콜렉션</b>,https://blog.naver.com/playlimssu?Redirect=Log&logNo=221434830075,"#막스마라 큐브 패딩이라는 말이 많아서 찰떡같이 믿고 있었는데 거래처 언니랑 얘기하다가 #지춘희 미스지<b>콜렉션</b> 인걸 알게됨 2018 F/W 헤라서울패션위크 #지춘희미스지<b>콜렉션</b> 맨 오른쪽 맞네, #윤세아패딩... ",임쑤랑놀자,https://blog.naver.com/playlimssu,20190105
★ 핸드메이드인형 38 /네코짱<b>콜렉션</b>,https://blog.naver.com/oha_gori9?Redirect=Log&logNo=20043727925,"서른여덟번째 핸드메이드,_딸랑딸랑~'네코짱<b>콜렉션</b>ㅎ 지난번 구입했던 소리나는부자재들을 100빠센토'활용해보고자, 기껏 머리굴려 생각해냈다는것이,&lt;고양이목에방울달기&gt;,,^-ㅅ-^{냐' 게다가 요즘~ 고리는... ",고리베어,https://blog.naver.com/oha_gori9,20071113
공서영 티스토어 스타<b>콜렉션</b>,https://blog.naver.com/dicagallery?Redirect=Log&logNo=140190745845,"주말매거진, Xtm 베이스볼 워너B 아나운서 공서영, 티스토어 스타<b>콜렉션</b>에 등장한 이유는? 티스토어 스타<b>콜렉션</b> 콘텐츠 받고 3000원 적립 프로야구 시즌이 더해갈수록 야구여신으로 유명한 스포츠... ",함영민의 디카갤러리,https://blog.naver.com/dicagallery,20130608
가성비 좋은 비건아이팔레트 캐트리스 더 엣지 라일락 <b>콜렉션</b>... ,https://blog.naver.com/oup3465?Redirect=Log&logNo=222435388619,"이거이거 기대되는 걸 ~ ♪ 캐트리스 더 엣지 라일락 <b>콜렉션</b> 아이섀도 팔레트 용량 - 10 g / 정가 - 12,000 눈모양과 함께 아이메이크업 팁도 적혀있지만 영어가 아닌 듯 해서 해석불가네요 @,@ 맨 윗줄의 두... ",앙이의 그린 Story,https://blog.naver.com/oup3465,20210717
폴 &amp; 조의 귀여운 고양이들! + 2011 가을 맨하탄 <b>콜렉션</b>.,https://blog.naver.com/reddot13?Redirect=Log&logNo=90122647883,"매시즌 자주 고양이 일러스트가 등장하는데 가장 대박은 ,, 작년 가을 ' Sparkles' 립스틱<b>콜렉션</b>! 세상에 ,, +ㅁ+ 늦게 안게 다행인지 불행인지 ,, 저 귀여운 고양이가 뭉개지는걸 그냥 보고있을수있는... ",공장장의 캐비닛,https://blog.naver.com/reddot13,20110907
알렉산더 헨리 s/s 2014 스톡홀름 <b>콜렉션</b>,https://blog.naver.com/thequilters?Redirect=Log&logNo=220040779045,키즈용 '피핀' 근 5~6년간 인기를 끌었던 알렉산더 헨리의 '개스틀리 <b>콜렉션</b>' 올해를 마지막으로 끝을 낸다고 합니다. 하지만 모르죠 한 10년 쯤 다시 등장할지 그래서 이번 <b>콜렉션</b> 이름도 '개스틀리 엔드' 이... ,모던 패브릭,https://blog.naver.com/thequilters,20140626
빅사이즈엄마옷브랜드-마담의류나정아<b>콜렉션</b>,https://blog.naver.com/kwc3388?Redirect=Log&logNo=130144702740,빅사이즈엄마옷브랜드-마담의류나정아<b>콜렉션</b> 빅사이즈엄마옷브랜드 소개 합니다!! 마담의류 10년 경력의 나정아<b>콜렉션</b>~~ 현재 가두점 전개와 연계하여~ 판매하고 잇고요! 백화점 부띠끄 존의 원단을 사용하는... ,삶에 대해 너그러움을~~,https://blog.naver.com/kwc3388,20120814
떠먹는 피자 만들기!! 필립스 데일리 <b>콜렉션</b> 핸드블렌더,https://blog.naver.com/dusrhkdbs?Redirect=Log&logNo=220675492999,필립스 데일리 <b>콜렉션</b> 핸드블렌더로 쉽게~ 오븐 없을 땐 후라이팬으로 해먹었던 떠먹는 피자!!... 데일리 <b>콜렉션</b> 핸드블렌더 덕분에 더욱 쉽고 빠르게 만들었어요~ 이름처럼 데일리로 쓰이는 필립스... ,야무진 들레씨,https://blog.naver.com/dusrhkdbs,20160406
[피규어] 포켓몬 플라워 컵 <b>콜렉션</b>!,https://blog.naver.com/pigre93?Redirect=Log&logNo=221369264337,플라워 컵 <b>콜렉션</b>! 으오옷! 발매하기만을 기다렸던 또 다른 아기자기하고 샤방한 제품군! 『포켓몬 플라워 컵 <b>콜렉션</b>』!! 아담하고 화사한 느낌을 풍기는 티컵과 평화롭고 아름다운 풍경을 보여주는 듯한 꽃밭의... ,Weaving My Best Story,https://blog.naver.com/pigre93,20181002
COMF-PRO(가구전문유통사)와 몽우조셉킴<b>콜렉션</b>갤러리의... ,https://blog.naver.com/mongwookim?Redirect=Log&logNo=221201773229,&quot;COMF-PRO&quot;는 몽우조셉킴<b>콜렉션</b>의 파트너사이면서 이번 사옥확장으로 이비어화가의 &quot;하늘을... 몽우조셉킴<b>콜렉션</b>(Gallery in Heyri) ☎작품문의: 박기양 갤러리스트(***-****-****) -이메일: binistwo... ,Mongwoo JosephKim Collection 몽우 조셉킴 콜렉션,https://blog.naver.com/mongwookim,20180206
"LK<b>콜렉션</b>, 가정용입식욕조 “왈라왈라샤워보드” 론칭",https://blog.naver.com/agyunin?Redirect=Log&logNo=222402156796,글/김성일 기자 사진/LK<b>콜렉션</b> “반려동물 목욕걱정 끝”. 반려동물의 목욕을 획기적으로 편하게 시킬 수 있는 제품이 LK<b>콜렉션</b>(대표 김철희)에서 나왔다. 제품명은 ‘왈라왈라 샤워보드’로 반려인 집의 욕실... ,펫저널,https://blog.naver.com/agyunin,20210618
체크남방코디 모노로스 ELD <b>콜렉션</b> : 디블로,https://blog.naver.com/ideamode?Redirect=Log&logNo=120185010677,모노로스 ELD<b>콜렉션</b> 체크남방♩ 길 거리마다 '벚꽃엔딩'이 흘러져 나오는 것을 보니 봄인 것 같아요.... ELD <b>콜렉션</b> Seersucker Shirt 모노로스 'ELD' <b>콜렉션</b>은 Wardrobe 아이템 개념의 모노로스만의 새로운 제품 군... ,소현의 취미,https://blog.naver.com/ideamode,20130318
[블루레이] '블랙 팬서' 위트<b>콜렉션</b> 풀슬립(A1 Type) 스틸북... ,https://blog.naver.com/12tuna?Redirect=Log&logNo=221632477062,솔직히 공용판도 나름 괜찮게 보고 있었는데 위트<b>콜렉션</b> 판을 보고 나니 오징어나 다름없어졌습니다. 로고는 음각처리 되어 있습니다. 영리하게도 블랙팬서 슈트의 발광포인트들에 스틸북의 메탈 질감이... ,CAR Home / public,https://blog.naver.com/12tuna,20190829
톰딕슨(Tom Dixon)2015 <b>콜렉션</b>,https://blog.naver.com/chozlove?Redirect=Log&logNo=220391283506,멜트(Melt) 시리즈 가장 눈길 가는 멜트(MELT) <b>콜렉션</b>은 그의 대표작 코퍼쉐이드(Copper Shade) 조명처럼... (MELT) <b>콜렉션</b>만의 특징 이 조명은 스웨덴의 디자인그룹 FRONT와 함께 작업했다고 합니다. 세가지... ,디자인톡톡,https://blog.naver.com/chozlove,20150615
[개봉리뷰] 스타워즈 비클 <b>콜렉션</b> 7,http://urokyh.egloos.com/5821645,격주에 한번 정도 들어가는 f-toys의 홈피에 간만에 들어가 보니 전작인 2012년 11/26일에 발매된 f-toys의 스타워즈 비클 <b>콜렉션</b> 6에 이어 1년 반만에 2014년 3/24일에 비클<b>콜렉션</b> 7이 소리 소문도 없이... ,오늘은 무엇에 감사하며 보냈느냐,http://urokyh.egloos.com/,20140524
"베스트<b>콜렉션</b>,",https://blog.naver.com/brand_spinel?Redirect=Log&logNo=70130071307,"베스트 <b>콜렉션</b>, 드르륵드르륵, ^0^/ 노르딕커플베스트! 커플베스트<b>콜렉션</b>, 재단하고 드르륵드르륵, 빈폴스타일, 어깨와 창구멍만 공그르기해주기, 스피넬표 조끼는 모두모두 양면연출가능해요^^ 소보르 한녀석은... ",쏘잉무드,https://blog.naver.com/brand_spinel,20120130
출산준비물 ) 보리별의 배냇저고리 <b>콜렉션</b> :) / 밍크뮤... ,https://blog.naver.com/bori_hs?Redirect=Log&logNo=220897254954,"출산준비물 ) 보리별의 배냇저고리 <b>콜렉션</b> :) / 밍크뮤, 무루오가닉 등 안녕하세요. 출산이 얼마 남지... 배냇저고리 <b>콜렉션</b>(?)을 소개하려고 해요. 배냇저고리는 아이의 크기나 발육에 따라 한달~100일까지도... ",보리별 블로그,https://blog.naver.com/bori_hs,20170102
동해 망상 메이즈뮤지엄 피규어전시회 제 <b>콜렉션</b> 철수,https://blog.naver.com/smartjy67?Redirect=Log&logNo=221360041057,"기타 <b>콜렉션</b>들을 철수하였습니다. 오랜기간 같이 고생한 강원도 최고의 콜렉터 김태훈씨에게도... ^^ 2017년 8월부터 1,000평이상 부지의 강원도 최고 전시장에 새롭게 인테리어하여 저와 김태훈대표의 <b>콜렉션</b>이... ",스마트의 7080 취미 이야기,https://blog.naver.com/smartjy67,20180916
아크로밧 이어링 <b>콜렉션</b> 출시되었습니다,https://blog.naver.com/jaedongga?Redirect=Log&logNo=221278503574,젬스톤 <b>콜렉션</b>입니다. 자연에서온 천연석의 다양한 텍스쳐와 컬러를 지닌 소재의 조화로... 여러가지 원석의 컬러 블럭킹이 돋보이는 NDBELL 라인은 아크로밧 젬스톤 <b>콜렉션</b>의 대표 아이템으로... ,아크로밧슈즈 & 일상,https://blog.naver.com/jaedongga,20180518
풍기인견이불 침구세트 스칸디<b>콜렉션</b> by 보웰,https://blog.naver.com/reovee?Redirect=Log&logNo=221597200241,"보웰 스칸디<b>콜렉션</b>으로 골랐는데 지금 홈페이지 들어가보니 세일중이네요. 세일가를 놓쳐서 너무도 아쉬운 1인입니다 ㅠ.ㅠ 기존에 사용하던 침구는 이브자리 인견침구로 전체가 다 흰색이었는데요, 이번에는... ",러비액츄얼리,https://blog.naver.com/reovee,20190727
[넨도로이드] no.431 칸코레 함대 <b>콜렉션</b> 오오이,https://blog.naver.com/naman_sarang?Redirect=Log&logNo=221462399909,"오랜만에 하는 듯한 포스팅 :D 이번에 데려온 넨도로이드는 칸코레 함대 <b>콜렉션</b>의 하나인 오오이 넨도로이드입니다. 칸코레도, 함대 <b>콜렉션</b>도 모두 넨도 입문하고 나서 알게 되었는데 함대를 나타내는 소품... ","달달해, 강똥네",https://blog.naver.com/naman_sarang,20190210
우리나라 국산캐릭터 미니피규어 커스텀작 풀<b>콜렉션</b>,https://blog.naver.com/smartjy67?Redirect=Log&logNo=221377196362,70년대부터 이어지는 여러 만화들과 애니메이션 및 웹툰등을 바탕으로 제작된 국산 토종캐릭터들 <b>콜렉션</b>입니다. 아주 오랜기간 전시를 거쳐 내 품에 소장하게 된 유일무이 초미니 국산 캐릭터 피규어 <b>콜렉션</b>... ,스마트의 7080 취미 이야기,https://blog.naver.com/smartjy67,20181014
Whistles - 스프링 <b>콜렉션</b> 세일,https://blog.naver.com/rosie_kwon?Redirect=Log&logNo=221903213156,런던 위슬 브랜드의 스프링 <b>콜렉션</b> 할인 행사 입니다 ! Whistles Mottled 플릿츠 스커트 에니멀 프린트 드레스 오렌지 멀티 프린트의 플릿츠 스커트로 풍성함을 더한 하이 넥 드레스... ,런던스토어 since 2011,https://blog.naver.com/rosie_kwon,20200411
General Idea in NYC : 제너럴아이디어 뉴욕 <b>콜렉션</b> 현장!,https://blog.naver.com/velvtwhip?Redirect=Log&logNo=221060874414,지난번 최범석 디자이너와의 인터뷰를 통하여 General Idea의 뉴욕 <b>콜렉션</b> 이야기를... 뉴욕 <b>콜렉션</b> 현장으로 바로 가시죠!!!! 이곳은.. 제네럴 아이디어 뉴욕 <b>콜렉션</b> 백스테이지 전쟁터입니다... ,AA Batteries,https://blog.naver.com/velvtwhip,20170727
닌텐도 스위치용 어쌔신 크리드 레벨 <b>콜렉션</b> 한국어판 12월... ,https://blog.naver.com/ps3player?Redirect=Log&logNo=221715362307,닌텐도 스위치용 어쌔신 크리드 레벨 <b>콜렉션</b> 한국어판 12월 6일 출시 예정 유비 소프트의 닌텐도 스위치용 '어쌔신 크리드 레벨 <b>콜렉션</b>' 한국어판이 국내에 2019년 12월 6일 금요일 정식 발매될 예정입니다. 11월... ,스파이크의 무한 잡설 공간,https://blog.naver.com/ps3player,20191122
캡콤 벨트 액션 <b>콜렉션</b> : 정말 저렴하고 재밌긴 한데...,https://blog.naver.com/ps3player?Redirect=Log&logNo=221364575902,캡콤 벨트 액션 <b>콜렉션</b> : 정말 저렴하고 재밌긴 한데... 게임 시작 화면 캡콤 벨트 액션 <b>콜렉션</b>이 지난 9월 20일 다운로드 버전만 선행 출시된 것은 다들 알고 계실 겁니다. 저는 원래 패키지를 선호하는... ,스파이크의 무한 잡설 공간,https://blog.naver.com/ps3player,20180923
에스웍스 터보 타이어 사간 <b>콜렉션</b> 입고 #700x26c... ,https://blog.naver.com/kommabike?Redirect=Log&logNo=221537470266,대회용이나 사진용으로 꽂기 딱 좋을 것 같은 에스웍스 터보 코튼 - 사간 <b>콜렉션</b> LTD 정말 소량이라... 내꺼 2개는 일단 빼놓고...ㅋ 스페셜라이즈드 에스웍스 터보 코튼 사간 <b>콜렉션</b> - 로드 타이어 궁금할... ,스페셜라이즈드 서울 서초점(콤마바이크),https://blog.naver.com/kommabike,20190514
카메라<b>콜렉션</b>,https://blog.naver.com/taiyoungpd?Redirect=Log&logNo=40034699782,나중에 박물관을 차릴까 하는데 괜찮겠지요 나중에 후배들한테 좋은 자료도 되지요 스틸카메라도 <b>콜렉션</b> 하는데 외국에 취재 가면 벼룩시장을 꼭 들려서 구해오기도 하지요 러시아나 인도에서는 많이... ,이태영감독,https://blog.naver.com/taiyoungpd,20070223
랑콤 라 <b>콜렉션</b>의 향기,https://blog.naver.com/olive67?Redirect=Log&logNo=140068641441,La Collection Fragrances(2005) 랑콤 라 <b>콜렉션</b>. 랑콤 향수의 시작은 1935년 브뤠셀 월드페어에서 다섯가지의 새로운 향수로 시작되었다. 라 <b>콜렉션</b>은 랑콤 70주년 기념으로 랑콤사에서 오래도록 사랑받는 향수들을... ,애정결핍 불량주부,https://blog.naver.com/olive67,20090524
*중년여성빅사이즈정장*-나정아<b>콜렉션</b>*,https://blog.naver.com/kwc3388?Redirect=Log&logNo=130140261671,*중년여성빅사이즈정장-나정아<b>콜렉션</b>* 중년여성빅사이즈정장-나정아<b>콜렉션</b> 결혼식이네 상견례네 해서 바쁜 시기!! 중년여성빅사이즈정장을 소개 할게여^^ 간혹 사이즈 땜에 못 사입으는 분이 잇더라구요... ,삶에 대해 너그러움을~~,https://blog.naver.com/kwc3388,20120612
[Tomytec]토미텍 더 버스 <b>콜렉션</b> 23탄(미니버스 3탄).,https://blog.naver.com/fmspf14?Redirect=Log&logNo=221901482562,토미텍 버스 <b>콜렉션</b> 23.미니버스 3탄. 좋은 피드백 부탁하는 안내서와...? 서비스로 온 깜찍한 사파리 지우개. 사소하지만 소비자 입장에서는 기분 좋은 이런 서비스를 주다니.정말 센스 좋네요. 자 이제 메인을... ,The Sharp Blog,https://blog.naver.com/fmspf14,20200410
반다이 SH 피규아츠 '어벤져스 : 인피니티 워' <b>콜렉션</b>,https://blog.naver.com/connell3?Redirect=Log&logNo=221220584651,반다이 SH 피규아츠 '어벤져스 : 인피니티 워' <b>콜렉션</b> 마블 스튜디오의 열렬한 기다림을 받아온 최고 기대작 '어벤져스 : 인피니티 워'의 개봉이 이제 2개월 조차도 남지 않았다고 한다. 이런 가운데... ,일어나라 로보트태권V,https://blog.naver.com/connell3,20180303
리멘트 포켓몬 플로랄 컵 <b>콜렉션</b>  -뮤-,https://blog.naver.com/good201133?Redirect=Log&logNo=221448282013,원래 스타일대로면 사진 엄청 올렸을텐데 좀 자제해 봤어요.ㅋㅋㅋㅋ소개해 드리는 것은 각종 캐릭터와 식완관련하여 작지만 고퀄의 작품을 내어주는 RE-MENT의 따끈한 신상인 포켓몬 플로랄 컵 <b>콜렉션</b>!! ( 2019년... ,두근두근 리뷰랜드,https://blog.naver.com/good201133,20190122
SNK 40주년 <b>콜렉션</b> The Final 6 PS4 타이틀 트레일러 영상,https://blog.naver.com/ldhs1020?Redirect=Log&logNo=221484806599,SNK 40주년 <b>콜렉션</b> The Final 6 PS4 타이틀 트레일러 영상 SNK가 정말 잘 나가던 시절에는 킹오브 시리즈... https://www.youtube.com/watch?time_continue=46&amp;v=Q8CloLugjJk 이번에는 40주년 <b>콜렉션</b> The Final 6 트레일러도... ,보름달의 생각과 일상을 담은 블로그,https://blog.naver.com/ldhs1020,20190310
[Sold] 웨지우드 Blue &amp; white <b>콜렉션</b>,https://blog.naver.com/puredia?Redirect=Log&logNo=184722929,[Sold] 웨지우드 Blue &amp; white <b>콜렉션</b> 웨지우드의 퀸즈웨어 블루앤 화이트 <b>콜렉션</b> 접시입니다. 이 접시는 1994년 15000개 한정판으로 만들어진 동양풍의 웨지우드 접시입니다. 영국사람들은 동양에 대한... ,디아인의 Ann's Garden,https://blog.naver.com/puredia,20130405
이브<b>콜렉션</b>의 PassiFlora,https://blog.naver.com/gerbok?Redirect=Log&logNo=120029978971,이브<b>콜렉션</b>에서 본 파지플로라(Passi-Flora) 신세계에서 리모지도자기를 수입해다 파는 이브<b>콜렉션</b>은 한군데꺼만 들여오는게 아니라 리모지 지역의 여러 도자기들을 수입해다 파는 곳인데요. 거복이가... ,gerbok님의 블로그,https://blog.naver.com/gerbok,20061015
21 시즌 New 공방 <b>콜렉션</b> Chanel '귀부인들의 성',https://blog.naver.com/wa6624?Redirect=Log&logNo=222422317359,2021년 6월 25일 금요일 Chanel 공방 <b>콜렉션</b> 캠페인 '귀부인들의 성' 모델 루이즈 드 슈비니와 마하니... 성' <b>콜렉션</b>은 샤넬 공식 홈페이지 부티크에서 찾아보실 수 있어요 오직 Chanel 만이 연출할 수 있는... ,December Paris 디셈버파리,https://blog.naver.com/wa6624,20210706
라이즈 호텔 오토 그래프 <b>콜렉션</b>,https://blog.naver.com/unique_land?Redirect=Log&logNo=221500292514,"Hot place :: 라이즈 호텔 오토그래프 <b>콜렉션</b> 라이즈 호텔 오토그래프 <b>콜렉션</b> (RYSE Autograph Collection by Marriott) 홍대 스트리트 컬쳐와 디자인, 음악, 예술을 결합하여 영감을 주는 라이프 스타일... ",F A V,https://blog.naver.com/unique_land,20190329
세검정의 위즈하우스 갤러리원룸 인형 및 금은화 주화 <b>콜렉션</b>,https://blog.naver.com/smartjy67?Redirect=Log&logNo=221484028703,그득한 인형들과 가면 그리고 추억의 <b>콜렉션</b>들입니다. 드디어 세상 밖으로 나오는군요..ㅋ 2층부터 5층까지 장을 배치한 후에 이 귀여운 인형과 고전 <b>콜렉션</b>을 수납합니다. 추억의 분방구류들과 교양월간지등... ,스마트의 7080 취미 이야기,https://blog.naver.com/smartjy67,20190309
Richard James 런던 <b>콜렉션</b>에 참석한 마틴&amp;아만다 부부,https://blog.naver.com/akaineko18?Redirect=Log&logNo=90161050465,저런 색은 구하기도 쉽지 않을텐데 ㅋㅋ 역시 패션피플ㅋㅋㅋㅋ (사실 제일 궁금한 건 마틴의 넥타이 <b>콜렉션</b>. 진짜 뭐가 있는지 궁금하닼ㅋㅋㅋㅋ 정말 레어함 ㅋㅋㅋㅋ) Amanda Abbington... ,Don't mock my Little Martin!!,https://blog.naver.com/akaineko18,20130109
09/09/04 도쿄걸즈<b>콜렉션</b> 아카니시 진,https://blog.naver.com/difmfmgod?Redirect=Log&logNo=110068700872,"TGC(도쿄걸즈<b>콜렉션</b>) 시크릿라이브로 BANDAGE의 영화의 영상이 나오면서 나왔다고 합니다. 진... 친구들 만나러 간다며 (웃음) +) <b>콜렉션</b> 영상은 오늘 22:00 ~ 부터 방송을 해준다고 하는데, 진이 부분이 나올진... ",more and more Atarax jin,https://blog.naver.com/difmfmgod,20090905
