title,link,description,bloggername,bloggerlink,postdate
에버랜드 러바오의모험 <b>뮤지컬</b><b>관람</b>후기,https://blog.naver.com/sasamall?Redirect=Log&logNo=221719868259,"<b>뮤지컬</b> 러바오의 모험 후기 먼저 올려봅니다! 러바오의모험 <b>뮤지컬</b>은 포시즌스가든 앞 그랜드 스테이지에서 관랍 가능해요 저희는 레니찬스 이용했어요! 난이도 1개짜리라 쉽게 당첨! 로스트밸리랑, 사파리는... ",꿈꾸는요셉,https://blog.naver.com/sasamall,20191129
"서울: <b>뮤지컬</b> 라 레볼뤼시옹,  대학로 자유극장 <b>뮤지컬</b> <b>관람</b> 후기",https://blog.naver.com/hhh4324?Redirect=Log&logNo=222379074377,"오늘의 포스팅은 대학로 자유극장 <b>뮤지컬</b> 라레볼뤼시옹 <b>관람</b>후기 입니다. :D 코로나 전에는 <b>뮤지컬</b> 덕후 동생때문에 <b>뮤지컬</b>&amp;연극을 자주 보러 다녔었는데, 코로나 때문에 힘겹게 티켓팅한 티켓들이 취소되면서... ",M의 하루,https://blog.naver.com/hhh4324,20210601
<b>뮤지컬</b> <b>관람</b> &lt;책갈피 요정 또보&gt;,https://blog.naver.com/traveling22?Redirect=Log&logNo=220998045597,"일부러 평일을 골라 다녀왔는데 유치원 단체 <b>관람</b>이 두 팀이나 있어서 공연장에서 얼음이었던 꼬북이. 근데 신나게 반응해주는 누나, 형들 덕분에 꼬북이도 <b>뮤지컬</b> 속 톰 아저씨 질문에 열심히 대답하고... ",미드나잇 라운지,https://blog.naver.com/traveling22,20170504
[힐링/ 목포 <b>뮤지컬</b>] 명성황후를 <b>관람</b>하다.,https://blog.naver.com/jundogi?Redirect=Log&logNo=220010913785,<b>관람</b> 전 학생들에게 <b>뮤지컬</b> <b>관람</b> 에티켓을 설명하고 계시는 선생님의 모습!! <b>뮤지컬</b>이 역사의 한부분을 보여주는 거라 학생들에게도 좋은 기회인듯 해요!! 공연장 입구에는 지방 선거철이라 선거유세가... ,딴지_하우스♬,https://blog.naver.com/jundogi,20140526
한자시험 끝나고 긴장풀러 레이디버그 <b>뮤지컬</b> <b>관람</b>,https://blog.naver.com/loveeoni?Redirect=Log&logNo=220867561321,나름 화이팅도 해보고 ^^ 블랙캣이 머리 쓰담쓰담도 해주고요. 엄마는 끝나서도 나와서 계속 레이디버그~ 라며 노래를 불렀다죠 ㅋㅋ 시험끝나고 둘만의 데이트 <b>뮤지컬</b><b>관람</b> 아주 재미있게 보고 왔습니다.,너희들 눈속에 맑은세상 그려담기,https://blog.naver.com/loveeoni,20161122
오!캐롤 <b>뮤지컬</b> <b>관람</b>,https://blog.naver.com/hkw0620?Redirect=Log&logNo=220984866901,이전에 큰맘먹고 보러갔던 <b>뮤지컬</b>에 내심 큰 충격을 받아서 내 생에 두번은 없을줄 알았던 <b>뮤지컬</b> <b>관람</b>..... 우연히 표가 생겨서 다녀왔다 ㅋㅋ 다행히도 두번째 <b>뮤지컬</b>은 재미 있었음 ㅠㅠ 정말 다행이다 나... ,━궁시렁 마당。,https://blog.naver.com/hkw0620,20170417
2014.6.19 - <b>뮤지컬</b> <b>관람</b> &lt;마이맘&gt;,https://blog.naver.com/danbiyeye?Redirect=Log&logNo=220035703979,저처럼 놓치지 말고 사진 꼭 같이 찍고 오세용~ 가슴따뜻해지는 <b>뮤지컬</b>이었습니다. 부모님 모시고 '마이맘' <b>관람</b>하시길 추천해드려요~ * <b>뮤지컬</b> &lt;미아밈&gt;은 D씨의 정직한체험단에서 제공받은 상품입니다.,danbiyeye (단비예예),https://blog.naver.com/danbiyeye,20140620
[신나는토요일! 함께하는거양!] 3월2차 <b>뮤지컬</b> <b>관람</b>,https://blog.naver.com/jgwelfare1?Redirect=Log&logNo=220316527255,: <b>뮤지컬</b> <b>관람</b>편] 안녕하세요 ㅎ 3월 4주 활동 이번주는 예술회관 <b>뮤지컬</b>을 <b>관람</b>하였습니다. 날씨가 .. 정말 봄이네요ㅎ 예술회관까지 다같이 대중교통을 이용하기로 했습니다. 아이들에게 각자 1개씩의... ,인천광역시중구장애인종합복지관,https://blog.naver.com/jgwelfare1,20150331
"런던여행 가면 이건 꼭 하자 :: 야경스팟 투어, <b>뮤지컬</b> <b>관람</b>... ",https://blog.naver.com/mcape98?Redirect=Log&logNo=221875745619,다 돌아보기가 힘들다면 위에 소개한 4곳 만이라도 꼭 투어에 추가해서 돌아보면 좋을 것 같습니다^^ <b>뮤지컬</b> <b>관람</b> <b>뮤지컬</b>의 본고장이라 할 수 있는 런던에서 절대 빼놓을 수 없는 볼거리 중 하나가 바로... ,세계로뭉게구름,https://blog.naver.com/mcape98,20200330
[두산아트센터]번지 점프를 하다 <b>뮤지컬</b><b>관람</b>!,https://blog.naver.com/veru0203?Redirect=Log&logNo=150180504615,기회가 되서 찾은 <b>뮤지컬</b><b>관람</b>. 두산아트센터는 처음방문인데요. 건물안에 조각상도 있고 좋더라구요. ㅎ 아트전시도 1층에서 하고 있던데 .무료<b>관람</b>이네요~^^ 시간관계상 후딱 보고 건물로 들어가서 지하로... ,Dont' worry Be Happy,https://blog.naver.com/veru0203,20131202
<b>뮤지컬</b> 터닝메카드 <b>관람</b>~(화이투스의 비밀),https://blog.naver.com/ehee4001?Redirect=Log&logNo=220620564218,"우산, 야광봉, 스티커북등은 여유있게 있어요~^^ 드디어 입장~ 오랜만의 <b>뮤지컬</b> <b>관람</b>!!! 저도 두근두근~ 미스터 K가 신형 메카니멀을 만들기 위한 연구실 장면부터 이야기는 시작되어요. 찬, 이소벨, 리안이... ",엄살쟁이 일상이야기,https://blog.naver.com/ehee4001,20160206
EP.5 일하는 기쁨카드로 <b>뮤지컬</b> <b>관람</b>하기!,https://blog.naver.com/jis4145?Redirect=Log&logNo=222364107697,#일하는기쁨카드 #<b>뮤지컬</b> #위키드 2021.05.21 <b>뮤지컬</b> 위키드 - 부산 평소 <b>뮤지컬</b>을 엄청엄청엄청 좋아하는 나는 (사실 그렇게 오래되지 않음..) 일하는 기쁨카드로 <b>뮤지컬</b>을 <b>관람</b>하게 되었다. 사실 처음 결제할 땐... ,NO BETTER THAN THIS,https://blog.naver.com/jis4145,20210524
10/1 <b>뮤지컬</b> 곤 투모로우 <b>관람</b>후기,https://blog.naver.com/zzz8674?Redirect=Log&logNo=220826879820,10/1 <b>뮤지컬</b> 곤 투모로우 <b>관람</b> 친구가 갑자기 <b>뮤지컬</b> 초대권이 생겼다해서 급 <b>뮤지컬</b> <b>관람</b>하고 왔어요~ 김수로 프로젝트 19탄이라는 곤 투모로우 인데요 공연은 압구정역 근처에 있는 광림아트센터 BBCH홀이었고... ,오늘의하루,https://blog.naver.com/zzz8674,20161003
"<b>뮤지컬</b> 마타하리 <b>관람</b>후기, 옥주현씨 노래에 개소름",https://blog.naver.com/asdffggg2?Redirect=Log&logNo=221046712282,"일단 성량에서 차이가 많이나고, 민영기씨가 훨씬 안정적인 느낌이났어요 그래서 동시에 부를 땐 정택운씨의 목소리가 거의 들리지않더라구요ㅜ 오랜만의 <b>뮤지컬</b> <b>관람</b>에 140분동안 행복했었습니당♥",Show U All★,https://blog.naver.com/asdffggg2,20170708
"아이를 위한 공연 추천, 월드스타 뽀로로 <b>뮤지컬</b> + <b>관람</b> 팁",https://blog.naver.com/skydba?Redirect=Log&logNo=221464137898,그런 우리 아이에게 딱일 것 같은 뽀로로 <b>뮤지컬</b>을 한다고 하길래 바로 티켓을 예약했어요. 공연명... 저희도 공연 <b>관람</b> 후 이곳에서 간식을 먹었답니다. + 추가로 지하 2층에 수유실 및 유아휴게실은 따로... ,수작여행가의 느린여행,https://blog.naver.com/skydba,20190212
[<b>뮤지컬</b> <b>관람</b>] 화려한 무대!! 재미도 쏠쏠~~한 창작<b>뮤지컬</b>... ,https://blog.naver.com/artraving?Redirect=Log&logNo=80170144019,[<b>뮤지컬</b> <b>관람</b>] 화려한 무대!! 재미도 쏠쏠~~한 창작<b>뮤지컬</b> '쌍화별곡' !! 스포이드가 될 수 있으니...그냥 ..적당히 써야겠슴다 ㅎㅎㅎㅎ 하지만 몇일 안남았네요....ㅎㅎ 오랫만에 오햄과 <b>뮤지컬</b> 나들이~~ 아는... ,ARTRAVING:두여자의 일상과 여행.,https://blog.naver.com/artraving,20120928
프린스마이프랜드. <b>뮤지컬</b> <b>관람</b>♥,https://blog.naver.com/whitesky65?Redirect=Log&logNo=220251241476,다시 이마트 들러서 다미도 글라스트데코 사주고~ 저녁은 앞집과 김대표님네랑 오리고기. 가는 길은 너무 빡빡했지만 하루 꽉 채운 거 같아서 뿌듯. ㅎㅎㅎ - 밍크님의 이벤트에 당첨되어 <b>관람</b>한 <b>뮤지컬</b> 후기입니다.,"+ 그랬나요_ 꿈에서 본 거리,",https://blog.naver.com/whitesky65,20150125
[블루스퀘어 인터파크홀]  북파크는 천국 &amp; 킹키부츠 <b>뮤지컬</b><b>관람</b>,https://blog.naver.com/conglim2?Redirect=Log&logNo=221224637439,갈게 아니라 그냥 책읽고 힐링하러 블루스퀘어 북파크에 놀러도 자주 가야겠다 ㅎㅎㅎ 연인들 추운날 실내 데이트코스로 강력추천~!! [블루스퀘어 인터파크홀] 북파크는 천국 &amp; 킹키부츠 <b>뮤지컬</b><b>관람</b>,TIME WILL TELL ★,https://blog.naver.com/conglim2,20180308
<b>뮤지컬</b>&lt;시카고&gt; <b>관람</b>~,https://blog.naver.com/hpcjw?Redirect=Log&logNo=100162343875,(휴식시간 포함) 시간이 짧게 느껴질만큼 너무나 흥미진진 했다~ 이렇게 종종~ <b>뮤지컬</b> <b>관람</b>해주는 센스!! 연극을 처음 봤을 때도 이렇게 들떳는데~ 당분간 <b>뮤지컬</b> 홀릭이 될 듯 ^^ 록시허트 (아이비) 벨마켈리... ,시크스런워니,https://blog.naver.com/hpcjw,20120714
<b>뮤지컬</b>&lt;팬텀&gt; <b>관람</b>후기/샤롯데씨어터 VIP석 1층 시야,https://blog.naver.com/dkw03221?Redirect=Log&logNo=222371179561,팬텀이 가면 벗으면서 뒤로 돌면서 끝... 마무리까지 넘나리 &lt;팬텀&gt;스러웠다. #오늘일기 #블챌 #샤롯데씨어터 #팬텀 #<b>뮤지컬</b> #카팬텀 #카이 #임선혜 #인터파크 #<b>뮤지컬</b><b>관람</b>후기 #석촌호수,S T A Y S T R O N G,https://blog.naver.com/dkw03221,20210528
2018.1.17 그리고 25 <b>뮤지컬</b> &lt;타이타닉&gt; 짧은 <b>관람</b>후기,https://blog.naver.com/wiz_js?Redirect=Log&logNo=221193821967,정말 오랜만에 <b>뮤지컬</b> <b>관람</b> 시간도 없고 요즘 전보다는 관심이 뜸해져 못보다가 울언니의 강력추천으로 보게 된 타이타닉!! 내용은 영화와는 1도 연관이 없으니 참고하세요 ㅎㅎ 그레도 실제 타이타닉호에... ,문화예술기획자 JS의 공간,https://blog.naver.com/wiz_js,20180126
<b>뮤지컬</b> <b>관람</b>,https://blog.naver.com/lbr01?Redirect=Log&logNo=222382936974,<b>뮤지컬</b> #시카고 #단막극 을 연상시키면서 #째즈의선율을 라이브로!! #중학생공연<b>관람</b> #청소년할인 해서 좋은가격에 봤다! #학생증지참 해주시길!! #<b>뮤지컬</b><b>관람</b> #공연<b>관람</b> #예술교육 #어려서부터 #꾸준히 #단계별로,엄마가 너에게 해줄수 있는 일,https://blog.naver.com/lbr01,20210603
대구 광화문연가 <b>뮤지컬</b> 공연 <b>관람</b> 후기:) 계명아트센터 내부... ,https://blog.naver.com/lgegx?Redirect=Log&logNo=221201159060,안녕하세요 은고활력소입니다:) 이번에 광화문연가 <b>뮤지컬</b>이 서울에서 성황리에 마치고 대구에서도 2/2~2/4 까지 3일간 계명아트센터에서 공연을 한다고 해서 엄마랑 오랜만에 <b>뮤지컬</b> <b>관람</b> 데이트 하고 왔어요... ,은고의 일상:) 사라지는것에 대하여 기록하기 ♡,https://blog.naver.com/lgegx,20180205
"런던여행, 런던 <b>뮤지컬</b> 오페라의 유령 <b>관람</b> 및 <b>뮤지컬</b> 예매 방법",https://blog.naver.com/1978mm?Redirect=Log&logNo=198960069,"식사를 마치니 저녁 7시가 다 될 무렵, 가까운 곳에 오페라의 유령 <b>뮤지컬</b> <b>관람</b> 극장이 있다. 여왕 폐하의 극장 Her Majesty's Theatre 이 극장에서는 오로지 오페라의 유령 The Phantom of the Opera <b>뮤지컬</b>을... ",배짱이의 여행스토리 ▒ 배짱두둑한 여행블로거 ▒,https://blog.naver.com/1978mm,20131118
"2014년 1월 5일 : 고래, <b>뮤지컬</b>을 <b>관람</b>하다",https://blog.naver.com/missrim74?Redirect=Log&logNo=150182908911,"아빠는 20대 중반에 <b>뮤지컬</b>을 처음으로 봤는데, 고래는 4살(만으로는 2살)에 <b>뮤지컬</b> <b>관람</b>을 시작하는구나.ㅋ 11시 조금 못되서 극장 도착. 일요일 오전 공연이라 사람이 너무 없으면 어쩌지 걱정했는데, 그래도... ",Whale's Garden,https://blog.naver.com/missrim74,20140111
&lt;해와 달이 된 오누이&gt; 읽고 <b>뮤지컬</b> <b>관람</b>/ 강서NC괜찮은홀... ,https://blog.naver.com/2rool?Redirect=Log&logNo=221054585497,"여튼 이렇게 모두 다같이 책을 읽고 <b>뮤지컬</b> <b>관람</b>~~~ 다니, 룰루만 들여보내고 엄마는 막내 업고 쇼핑 ㅋㅋ 같이보면야 좋겠지만 막내의 집중력. 한계로 인해....라는 좋은 핑계 ..ㅋㅋㅋ *참고* 강서 NC백화점... ",꿈꾸는 이룰맘,https://blog.naver.com/2rool,20170719
유니버설아트센터 출동 슈퍼윙스 <b>뮤지컬</b> <b>관람</b>,https://blog.naver.com/danzzak78?Redirect=Log&logNo=220601557696,아이와 함께 유니버설아트센터 나들이 출동 슈퍼윙스 <b>뮤지컬</b> <b>관람</b> 어른이 봐도 재미있는 아이들 <b>뮤지컬</b> 지난 주말 아이와 함께 첫 공연 <b>관람</b>을 다녀왔습니다. 알로하에게는 생애 첫 <b>뮤지컬</b> 구경이고 저에게는... ,평생공주와 절대미남자의 여행습관,https://blog.naver.com/danzzak78,20160118
"생애 첫 <b>뮤지컬</b> <b>관람</b>, &lt;시카고&gt; 그 현란한 퍼포먼스에 빠져들다 !",https://blog.naver.com/conankun?Redirect=Log&logNo=221390553978,"오늘 드디어, 생애 첨으로~ <b>뮤지컬</b> <b>관람</b>햇땅 +_+ 좌석이 다섯 종류나 있어서 뭘로 선택할지 살짝 내적갈등을 겪었지만;; 첫경험인데다 자주 보는 건 아니니까 큰 맘 먹고 14만원 쓰고 VIP석으로 고고씽 !!! 오늘... ",Grateful Days,https://blog.naver.com/conankun,20181102
어린이 <b>뮤지컬</b> 미녀와 야수 <b>뮤지컬</b> <b>관람</b>,https://blog.naver.com/cruiseforum?Redirect=Log&logNo=220289621456,2015년 첫 <b>뮤지컬</b> <b>관람</b> 어린이 <b>뮤지컬</b> 미녀와 야수 서대문문화회관에서 <b>뮤지컬</b> 공연을 하기에 서둘러 파크 예약 .... 예매시 살짝 염려 했던 것은 송승환의 PMC것이 아니면 다른 제작자의 <b>뮤지컬</b>을 보면 확실히... ,크루즈스캐너 0℃,https://blog.naver.com/cruiseforum,20150304
2018. 10. 27. (토) 오! 당신이 잠든 사이 <b>뮤지컬</b> <b>관람</b> 후기,https://blog.naver.com/yinmei88?Redirect=Log&logNo=221387104886,좋은 기회가 생겨서 <b>뮤지컬</b> '오! 당신이 잠든 사이'를 <b>관람</b>하였다. 이날의 캐스팅은 우지원 배우님! 이 연극에 나오는 배우 중에 유일하게 이름을 아는 배우분이 우지원님이셨다. 10월 27일 토요일이... ,韓耀縉 - 빛나는 분홍빛으로 세상을 물들일,https://blog.naver.com/yinmei88,20181029
<b>뮤지컬</b> 라이온 킹 대구 공연 <b>관람</b>후기 벅찬감동!,https://blog.naver.com/meteorslove?Redirect=Log&logNo=221401209519,"오랜만의 <b>뮤지컬</b> <b>관람</b>이라 어찌나 기분이 들뜨던지....^^ 티켓 오픈 직후 대구공연, 서울공연 모두 빠르게 매진되며 뜨거운 예매 열기를 느낄 수 있었는데요, 좋은 좌석을 예매하기 위한 티켓팅 전쟁, 피켓팅이... ",깜찍이브의 하루하루 신나는 스토리,https://blog.naver.com/meteorslove,20181119
런던 여행 - 내셔널 갤러리 &amp; 레미제라블 웨스트엔드 <b>뮤지컬</b> <b>관람</b>!,https://blog.naver.com/irin1022?Redirect=Log&logNo=221347209211,이 시간만 나 혼자 <b>관람</b>하였다 트래펄가 광장 Trafalgar Square 내셔널 갤러리 앞이 트래펄가 광장이라... 저녁에는 <b>뮤지컬</b> 레미제라블을 예약하였다 영어도 안되면서 할 건 다 한다 일부러 내용 아는 걸로... ,쿠우's,https://blog.naver.com/irin1022,20180827
4. 25. [공연] <b>뮤지컬</b> 위키드 <b>관람</b> 후기_위키드에 감춰진 진실,https://blog.naver.com/yinmei88?Redirect=Log&logNo=222324762898,나는 이 질문을 상기하며 <b>뮤지컬</b>을 <b>관람</b>했다. 두번째. 불륜 이 극에는 두 가지의 불륜이 나온다. 첫번째는 엘파바 모친의 불륜사실. 극에 직접적으로 '보여주기' 식으로 언급된다. 불륜의 결과가 엘파바인 것.... ,韓耀縉 - 빛나는 분홍빛으로 세상을 물들일,https://blog.naver.com/yinmei88,20210427
7Y 유치원에서 <b>뮤지컬</b><b>관람</b>&amp;생일파티 ♩,https://blog.naver.com/iminii0426?Redirect=Log&logNo=220973974853,유치원에서 <b>뮤지컬</b><b>관람</b>도 다녀왔어요 ^^ 마술피리 뭐 였는데... 공주랑 왕자의 슬픈 사랑이야기인지...ㅋㅋ 쭈니는 넘 감동적이어서 울었대용 ㅎㅎㅎㅎ 울 쭈니가 감수성이 참 예민해서 감동도 잘 느끼고 울기도... ,쭈니유니상점♥,https://blog.naver.com/iminii0426,20170403
[소피루비 <b>뮤지컬</b> <b>관람</b>후기] ♡샤르르 마을의 대축제♡,https://blog.naver.com/higoora123?Redirect=Log&logNo=220998169355,ㅎㅎㅎㅎㅎㅎ #4세공연<b>관람</b> #어린이<b>뮤지컬</b> #소피루비<b>뮤지컬</b> #소피루비 #<b>뮤지컬</b>소피루비 #광림아트센터BBCH홀 #어린이날공연 #가족공연 #어린이<b>뮤지컬</b> #가족<b>뮤지컬</b> #가족나들이 #주말나들이 #EBS인기애니메이션,SugarDonut :D,https://blog.naver.com/higoora123,20170504
+514 우리아들의 생애 첫 <b>뮤지컬</b><b>관람</b>~,https://blog.naver.com/doublemh?Redirect=Log&logNo=220030503371,&quot;임금님 귀는 당나귀 귀&quot; 어린이 <b>뮤지컬</b>~ 우리 아들의 첫 <b>뮤지컬</b><b>관람</b>~ 막내고모가 말하길 근혁이 또래 아이들은 한시간 가까이되는 공연에 소리지르거나 찡찡거려서 집중하기 힘들수도 있다그랬는데... 우리... ,티암라탄,https://blog.naver.com/doublemh,20140614
2017 <b>뮤지컬</b> 캣츠 내한공연 <b>관람</b>후기 - 남산 국립극장... ,https://blog.naver.com/dlwnsrms89?Redirect=Log&logNo=221093546973,"' 꽂혀버렸다ㅋㅋ 9월 생일을 맞이하여, 생일선물로 <b>뮤지컬</b> <b>관람</b> 고고싱! 9월 9일의 Today's cast 내한공연이기때문에 사실 아는 배우들은 없었다 ㅠㅠ 뮤알못이라ㅠㅠ <b>관람</b>전에도 대략적인 줄거리만 읽어보고... ",꽃보다 꽃향유,https://blog.naver.com/dlwnsrms89,20170920
캐리와장난감친구들 어린이<b>뮤지컬</b> <b>관람</b>후기,https://blog.naver.com/mocha_unee?Redirect=Log&logNo=220858019009,유니버설아트센터에 어린이<b>뮤지컬</b> 캐리와장난감친구들 <b>관람</b>하러 왔다요- 쌍브이 하며 기분좋음을 마구 표출 말 안들을때마다 &quot;캐리언니보러 엄마 혼자가야겠다&quot; 로 한동안 약발좀 먹혔는데 앞으로 어쩌나 ..... ,☆ 일상 맛집 여행 ☆,https://blog.naver.com/mocha_unee,20161110
여자혼자뉴욕여행 브로드웨이<b>뮤지컬</b> 오페라유령 <b>관람</b>후기... ,https://blog.naver.com/esom1225?Redirect=Log&logNo=221414398836,"JAMES 극장 맞은편 티켓구매를 위해 기다리는 사람들, 티켓교환은 바로 들어가면 된다 - 오페라의 유령 <b>뮤지컬</b> 티켓 교환 - 첫 <b>뮤지컬</b> <b>관람</b>이라 1시간정도 일찍 갔다 공연 10분전에 가도 티켓 교환은 가능하나... ",Highway Star,https://blog.naver.com/esom1225,20181207
<b>뮤지컬</b> <b>관람</b> 즐기고 온 자유부인.,https://blog.naver.com/songee0401?Redirect=Log&logNo=220889094580,안녕하세욧 ㅋㅋㅋㅋㅋㅋ 공대여자에용 무적이가 감기가 걸려서 마음은 불편했지만 오늘 친구와 함께 <b>뮤지컬</b> <b>관람</b>을 하고 왔어요 엄마랑 남편이 다녀오라고 해서 마음은 불편하게 갔지만 즐겁게 놀고 온... ,무적이네 가족이야기,https://blog.naver.com/songee0401,20161218
<b>뮤지컬</b> 드라큘라(한전아트센터) <b>관람</b> 후기 - 브로드웨이 버전과... ,https://blog.naver.com/jaykey0103?Redirect=Log&logNo=221672525599,"전 <b>뮤지컬</b> <b>관람</b>을 하러 올 때는 항상 가방 속에 넣어 다니는걸 잘 활용했습니다^^ 티켓팅을 완료하고, 그 바로 옆 물품보관소에서 주차할인권을 받으면 공연 <b>관람</b> 준비가 끝이 나는 것입니다. 한전아트센터... ","삶을 사랑하며, 배우며...월광",https://blog.naver.com/jaykey0103,20191009
[<b>관람</b>후기] 대구 판소리 <b>뮤지컬</b> &lt;활극 심청&gt; 지오뮤직2021... ,https://blog.naver.com/takworld?Redirect=Log&logNo=222390377511,공연 정보에 대해 더 궁금하다면 지오뮤직 인스타그램을 확인하세요. #대구<b>뮤지컬</b> #지오뮤직 #판소리<b>뮤지컬</b> #활극심정 #판소리<b>뮤지컬</b><b>관람</b>후기 #<b>뮤지컬</b>후기 #판소리<b>뮤지컬</b>활극심청 #대구 #대구봉산문화회관 #판소리,탁은주,https://blog.naver.com/takworld,20210608
[2015.08.04] 방귀대장 뿡뿡이 어린이<b>뮤지컬</b> <b>관람</b>~,https://blog.naver.com/11125bje?Redirect=Log&logNo=220444331881,[2015.08.04] 방귀대장 뿡뿡이 어린이<b>뮤지컬</b> <b>관람</b>~ 소윤이에게 <b>뮤지컬</b>을 보여주고 싶었다~ 영화가 아닌 <b>뮤지컬</b>~~ 검색을 계속하던중에~ 국립중앙박물관 극장 용에서 하는 '방귀대장뿡뿡이' <b>뮤지컬</b>을 <b>관람</b>하기로했다... ,여행떠나는 꼬꼬꼬네집,https://blog.naver.com/11125bje,20150807
핑크퐁과 상어가족 <b>뮤지컬</b> <b>관람</b> 후기(+우리아기 첫 <b>뮤지컬</b>),https://blog.naver.com/hahastudy?Redirect=Log&logNo=221063305119,핑크퐁과 상어가족 <b>뮤지컬</b> <b>관람</b> 후기(+우리아기 첫 <b>뮤지컬</b>) 안녕하세요~봉쥬맘 나루봉입니다~ 이번 주부터 봉쥬의 여름방학이 시작되었어요ㅎㅎ 봉쥬와 즐거운 여름방학을 보내기 위해 열심히 계획을 짰는데 그... ,공부쟁이 나루봉:),https://blog.naver.com/hahastudy,20170731
부산 드림씨어터 태교 <b>뮤지컬</b> <b>관람</b> 공연 위키드,https://blog.naver.com/gorgeous2124?Redirect=Log&logNo=222369070443,그래서 아이들이랑 온 부모님도 계시고 저처럼 태교로 <b>뮤지컬</b> <b>관람</b>하러 온 분들도 계시더라구요. 그래도 태교에서 무엇보다 중요한건 즐겁게 본게 제일 중요한거 아닐까요? 우리 아기가 뱃속에서 엄마눈과 본인... ,il va bien.,https://blog.naver.com/gorgeous2124,20210527
<b>뮤지컬</b> '마타하리' <b>관람</b> 후기,https://blog.naver.com/yw1235?Redirect=Log&logNo=220668499955,2016년 03월 25일 <b>뮤지컬</b> '마타하리' <b>관람</b> 이 얼마만의 <b>뮤지컬</b> <b>관람</b>이더냐.... 엘리자벳 이후로 횟수로 3년만....ㅠㅜㅠㅜ 프리뷰공연 있는거 확인하고 바로 예매하러 들어가니 좋은자린 다 매진....ㅠㅜㅠㅜ 그래도... ,라미파스라미파스 루루루루루~☆,https://blog.naver.com/yw1235,20160329
[<b>뮤지컬</b> <b>관람</b> 후기/<b>뮤지컬</b> 킹아더] 장승조 배우님이... ,https://blog.naver.com/jyj38?Redirect=Log&logNo=221548871978,"<b>뮤지컬</b> 킹아더 <b>관람</b> 후기 - 캐스트: 장승조, 간미연, 임병근, 최수진, 이충주 캐스팅 일정은 아래  http://www.caci.or.kr/Home/Perf/PerfInfoView.aspx?PerfId=1245&amp;SrchType=8&amp;SelectedYear=2019&amp;SelectedMonth=1&amp;SelectedDay=30... ",쭈절주절,https://blog.naver.com/jyj38,20190528
"<b>뮤지컬</b> 팬텀 <b>관람</b> 후기!(규현, 김소현, 윤영석, 신영숙)",https://blog.naver.com/minuj9139?Redirect=Log&logNo=222363061249,<b>뮤지컬</b> <b>관람</b>을 좋아하는 화지입니다. 이틀 전 일요일 날 오랜만에 샤롯데씨어터로 가서 <b>뮤지컬</b>을 보고 왔는데요 그 <b>뮤지컬</b>의 제목은 바로 '팬텀'입니다. 오늘의 포스팅은 이 '팬텀'에 대한 간단한 정보와 제가... ,"채우다, 도화지를",https://blog.naver.com/minuj9139,20210525
[160720] 리디아와 함께 <b>뮤지컬</b> 위키드 <b>관람</b>,https://blog.naver.com/lje910107?Redirect=Log&logNo=220876697456,"ㅇㅅㅇ 커튼콜 시작부터 끝까지 박수치는 사람들 보며 너무 신기했고, 따라서 박수치느라 너무 팔이 아팠다고ㅋㅋㅋㅋㅋㅋ 여튼 그렇게 <b>뮤지컬</b> <b>관람</b>을 마치고!!!! 한국에서의 일정이 얼마 남지 않은 리디아와... ",★잔느예리 꿈꾸는 다락방★,https://blog.naver.com/lje910107,20161203
[1일1포스팅/후기] <b>뮤지컬</b> 드라큘라 <b>관람</b> 후기,https://blog.naver.com/godclue?Redirect=Log&logNo=222215321480,<b>뮤지컬</b> 드라큘라 샤롯데씨어터_ 거리두기 없던 시절 <b>뮤지컬</b> 드라큘라 <b>관람</b>후기 초연부터 삼연까지 이르는 드라큘라 캐스팅에서 내 마음에 드는 캐스팅은 이렇다. 드라큘라 = 김준수 (디폴드값) 미나 = 린지... ,LUCY의 Now or Never,https://blog.naver.com/godclue,20210121
