title,link,description,bloggername,bloggerlink,postdate
인터넷으로 로또를 살 수 있다고? 온라인 <b>복권 구입</b> 방법,https://blog.naver.com/balahk?Redirect=Log&logNo=222192093377,"자, 이제 <b>복권 구입</b>을 위해 예치금에 돈을 충전해봅니다. 여기서부터는 좀 자세히 설명해보겠습니다. 예치금 충전하기 인터넷으로 복권을 구입할 때 신용카드나 간편결제로는 불가능합니다. 그래서 전용 복권... ",발악하는 재테크,https://blog.naver.com/balahk,20201231
미국 <b>복권 구입</b> 플랫폼 등장. 이젠 파워볼 명당도 나올 듯.,https://blog.naver.com/gopdanl?Redirect=Log&logNo=222334071273,"티구라는 플랫폼을 이용하는 사업이라고 설명되어 있다 가게 안에 있는 기계로 파워볼 <b>복권</b>을 구매대행으로 <b>구입</b>하고 결제하면 해당 결제 내역이 문자로 오고, 그 문자에 있는 아아디와 비밀번호로 로그인을... ","나와의 조용한 인터뷰, 칼럼",https://blog.naver.com/gopdanl,20210502
<b>복권구입</b> 신속한진행,https://blog.naver.com/islator76324?Redirect=Log&logNo=222393429642,미국복권을 판매하는 가게 간판이 문이혹시 모르니 애초에 예치금은 조금씩 필요한 불편하다는거의 다름이 없어서 그렇지 오늘은 로또<b>복권 구입</b> 가난함을베스파는 이렇게 타야하는거 아닌가요 어쩌면 지금도... ,거닐던길,https://blog.naver.com/islator76324,20210611
미국<b>복권</b> 구매대행으로 <b>구입</b>하기... 후기,https://blog.naver.com/haeri6?Redirect=Log&logNo=222225720131,처음하는거라 아는 것이 하나도 없는게 당연하지만 현금아닌 카드로만 구입해야하고 번호용지는 안... 잠시 즐거운 고민과 미국가는 상상만~~~ 이상 미국복권 구매대행으로 사기입니다. 미국<b>복권 구입</b>은... ,황금대지를 걸어보자.,https://blog.naver.com/haeri6,20210130
"2020년을 보내며/<b>복권구입</b>, 5대째하나야마우동,브루클린... ",https://blog.naver.com/dlwldms782?Redirect=Log&logNo=222303314782,오늘 긴자에 온 목적이 다이어리도 새로 <b>구입</b>하고 <b>복권</b>도 사고 2020년 사진도 인화하고 나름 바쁘게 돌아다니다 5시쯤 디저트나 먹고 들어가려고 6TH 오리엔탈 호텔 1층바에 갔는데 여기 바스쿠치즈케익이... ,여행 짜는 여자_토토,https://blog.naver.com/dlwldms782,20210408
생애첫 로또<b>구입</b>/안양 대동문고 앞 <b>복권</b>명당,https://blog.naver.com/laughbar?Redirect=Log&logNo=222386054657,"일단 로또에 대해서 아는 지식이 전무 한 관계로 아는 지인분께 전화를 드렸습니다 ㅜㅜ 그래서 한장당 <b>구입</b>가격은 5,000원이고 현금으로만 <b>구입</b>할수 있으며 <b>복권</b> 합격자??... 아니 담청자 발표는 '매주... ",로케트가,https://blog.naver.com/laughbar,20210605
인터넷으로 <b>복권 구입</b> - 동행복권,https://blog.naver.com/bearbooh?Redirect=Log&logNo=222363088410,그래서 인터넷으로 <b>복권</b>을 <b>구입</b>하는 방법을 찾았습니다. 먼저 인터넷 <b>복권</b> 사이트인 동행<b>복권</b>에 접속합니다. 우측 상단의 충전 버튼을 클릭해줍니다. 그러면 바로 금액 입금 란이 나오게 됩니다. 금액은... ,모두 너무 고맙습니다,https://blog.naver.com/bearbooh,20210523
"인터넷 로또 <b>구입</b>, PC는 가능 모바일은 불가 연금<b>복권</b>도 <b>구입</b>... ",https://blog.naver.com/jjugurism?Redirect=Log&logNo=222279417780,#인터넷로또구입 #인터넷연금복권 #동행복권 #로또구입 #로또사는법 #인터넷로또사는법 #1등당첨기원 로또는 복권방에서 구입해야한다? <b>복권 구입</b> 인터넷으로도 가능합니다! 누구나 한번쯤은 꿈꿔본 로또... ,쭈구리 Lab,https://blog.naver.com/jjugurism,20210318
인터넷<b>복권구입</b> 알아둡시다,https://blog.naver.com/mwiza81641?Redirect=Log&logNo=222412773098,"농협은행 본점을 통해 로또<b>복권 구입</b>이나 당첨확인이 빨리 되지 않는 분들도 꽤 계셨고, 사이트에 들어가 보시면 직접 만들면 원화를 구입하실 수 있습니다. 다른 복권을 사용할 때도 모바일 구입방법을... ",장군감,https://blog.naver.com/mwiza81641,20210628
"베스파, <b>복권 구입</b>과 문득 (갬성에 젖은)옛기억",https://blog.naver.com/miripasi?Redirect=Log&logNo=221865818219,나름 용인에선 1등이 제일 많이 나온 집입니다 하지만 1등 많이 나왔다고'나도 될 수 있을거야'란 기대감을 너무 품으면실망감도 크기에...<b>복권</b>은 <b>구입</b>해서 상상하는 그 재미에 중점을 두고 있습니다결과는... ,Jalapeno_mk,https://blog.naver.com/miripasi,20200321
"[복권재테크] 인터넷 로또<b>복권 구입</b>방법, 복테크 본격시작",https://blog.naver.com/eellee20?Redirect=Log&logNo=222332908543,"0이랑 거의 다름이 없어서 그렇지 ㅎㅎ 오늘은 로또<b>복권 구입</b> 방법에 대해서 포스팅 합니다. #복테크 #로또복권 #로또당첨 #로또재테크 #복권재테크 로또는 보통 판매점에서 많이 구매하는데요, 인터넷으로도... ",꿀잠 자는 이야기,https://blog.naver.com/eellee20,20210502
로또와 연금<b>복권</b> 온라인으로 <b>구입</b>하기 @ 동행<b>복권</b> 홈페이지,https://blog.naver.com/wangbeng?Redirect=Log&logNo=222430642191,이번 주 로또와 연금복권을 구입해볼게요. 복권 온라인 구입은 동행복권 홈페이지에서 가능합니다.... PC에서 클릭 몇 번만으로 간단하게 로또와 연금<b>복권 구입</b>을 완료했습니다. 온라인으로 <b>복권 구입</b>하기... ,왕뱅의 꿈꾸며 만드는 세상,https://blog.naver.com/wangbeng,20210713
"시작 쿄다휴게소 (사타안다기, 츄라우미 할인티켓, <b>복권구입</b>)",https://blog.naver.com/unlovete?Redirect=Log&logNo=221639016349,로또 7 자리 숫자도 구매해보고 즉석<b>복권</b>이랑 조+번호로 이루어진 <b>복권</b>도 <b>구입</b>. 다양하게 구매했다....ㅋㅋㅋ 재밌어.....! 결과적으로는 다 꽝이었지만.....ㅋㅋㅋㅋ 잠시나마 당첨의 재미를..? 휴게소 안쪽에... ,하고싶은거 다하는 블로그,https://blog.naver.com/unlovete,20190904
<b>복권구입</b> _ 연금복권 알아보기,https://blog.naver.com/freeidtime?Redirect=Log&logNo=222182176103,"ㅋ 매주 로또,연금,스피또 이렇게 x만원씩 구입중 ㅋ 복터지길 바라며~!!!! 오늘왠지 한편으로... 되리라 믿으면서~ㅋㅋㅋ #연금복권구매후기 #<b>복권구입</b>초보 #연금복권세트 ps. 음.. 꼭 5장 살필요 이쓰까... ",프리타임의 시간속으로,https://blog.naver.com/freeidtime,20201222
[미국 경제] 코로나19에도 <b>복권구입</b> 열기 뜨거워,https://blog.naver.com/pax2102?Redirect=Log&logNo=222188727965,"[미국 경제] 코로나19에도 <b>복권구입</b> 열기 뜨거워 ▶ 현금 수령시 24% 연방세, 37%의 소득세내야 신종 코로나바이러스 감염증(코로나19)에도 미국인들의 복권(사진) 구입 열기는 식지 않고 여전하다.... ",런런대디의 얼바인 스토리,https://blog.naver.com/pax2102,20201229
"온라인 로또 구매, 동행<b>복권</b> 홈페이지에서 편하게 <b>구입</b>하세요!",https://blog.naver.com/limitom?Redirect=Log&logNo=222419513008,동행<b>복권</b> 홈페이지에서 로또 외에도 연금<b>복권</b> 등 다양한 <b>복권</b>들 <b>구입</b>이 가능합니다 :) 2. 로또 구매방법 및 유의사항 우선 로그인을 해주세요. (처음이신 분들은 회원가입 진행 후 로그인!) 상단 '충전' 버튼을... ,루미의 정보 수납장,https://blog.naver.com/limitom,20210704
첫 태국<b>복권 구입</b>!!!,https://blog.naver.com/msuho?Redirect=Log&logNo=221858822123,"처음 만난분에게 한세트(두장) 200바트 주고 샀고, 며칠전에도 <b>복권</b>한장이 내게 손짓하는 것 같아 또 한세트 <b>구입</b>했다. 400바트면 한국돈 16,000원이나 되는 거금!!! 한국에 살 때 조상꿈, 대통령꿈 꿀때마다... ",구리오돈 블로그,https://blog.naver.com/msuho,20200317
<b>복권</b> 명당 논산 왕대박 <b>복권</b>에서 로또 <b>구입</b>,https://blog.naver.com/ami5729?Redirect=Log&logNo=222062143866,"그날도 많은 분들이 로또 <b>복권</b>을 <b>구입</b>하는 모습을 보았습니다. 최고 당첨 금액의 제한이 없는 <b>복권</b>으로, 정식 명칭은 ‘온라인 연합<b>복권</b>’이며 우리나라에서는 2002년 12월에 시작되었고 2018년 12월 2일부터... ",주) 혜강공예*** 한지공예.칠보공예,https://blog.naver.com/ami5729,20200816
| 강릉 로또 명당 | <b>복권 구입</b> 후기 ㅡ 진평양행,https://blog.naver.com/huiwon86?Redirect=Log&logNo=222393116601,이렇게 당첨이 될 수 있다니 강릉 갈 때마다 <b>구입</b>해야겠어요. 연금<b>복권</b>도 판매하고 있으니 강릉에 오시는 분들은 한번 쯤 재미로 <b>구입</b>해봐도 좋을 것 같아요! 결과는? 로또가 되었다면 제가 포스팅 하지... ,일상을 그리는 사람,https://blog.naver.com/huiwon86,20210610
소문난 복권 명당 ‘옆집’에서 로또<b>복권 구입</b>하고 복권 당첨?,https://blog.naver.com/donghanglottery1004?Redirect=Log&logNo=222424204647,"되는 복권을 단체로 구입하였다고 하는데요~ 무려 240장의 로또복권 당첨 확인하기! 과연 어떤 결과가... 복권 명당 옆집 수사대인 김구라, 이진호, 이장준은 옆집을 찾기 위해 탐사에 나섰는데요. <b>복권 구입</b>에... ",동행복권 공식블로그,https://blog.naver.com/donghanglottery1004,20210708
"로또,연금<b>복권</b> 인터넷으로 <b>구입</b>하여 당첨되세요.",https://blog.naver.com/ark621?Redirect=Log&logNo=222021564424,로또복권이나 연금복권에 당첨에 되려면 먼저 복권을 구입을 해야 하기에 복권을 사는 사람만이... 저도 매주 로또복권이나 연금복권을 사는데 행운이 오기를 간절히 기대를 해봅니다. <b>복권 구입</b>하시는... ,굿모닝 의 블로그,https://blog.naver.com/ark621,20200705
[동행 복권] 인터넷으로 로또 구입하는 방법/연금<b>복권 구입</b>하는... ,https://blog.naver.com/atorres?Redirect=Log&logNo=222317849375,(iㅁi)a 동행복권 사이트 바로가기 #동행복권 #인터넷<b>복권구입</b> #인터넷로또구입 #인터넷로또 #연금복권 #인터넷으로로또구입 #인터넷 #연금복권 #파워볼 #로또구매 #인터넷<b>복권구입</b> #인터넷복권,백곰조련사의 일상 가꾸기,https://blog.naver.com/atorres,20210421
"온라인으로 로또구입, 연금<b>복권 구입</b>하기",https://blog.naver.com/joysrainbow3?Redirect=Log&logNo=222275681795,"로또 구입이 가능합니다. 검색창에 '온라인 로또'를 검색하시면, 동행복권 사이트가 뜹니다. 회원가입을 하신 뒤, <b>복권 구입</b>을 위한 예치금을 충전 해주세요. 본인의 휴대폰 번호로 쉽게 계좌번호를 만들고... ",주경야독_주식과 경제를 쉽게 읽어주는 블로그,https://blog.naver.com/joysrainbow3,20210316
* 전국1위 로또명당 스파에서 로또<b>복권 구입</b>하기,https://blog.naver.com/ssung8998?Redirect=Log&logNo=221791482468,중계동에 볼일이 있어서 갔다가 로또가 생각나서 들른 상계동 로또<b>복권</b>명당! 매장 안까지 줄이... 간단한 음료도 많이 팔고있었구요 자동으로 사는 사람들은 미리 뽑아놓은 로또<b>복권</b>을 줄 안서고 바로바로... ,샤인짱의 브런치타임 ♥,https://blog.naver.com/ssung8998,20200131
"로또 복권 사는법, 스피또 복권 사는법(<b>복권구입</b>후기)",https://blog.naver.com/rooroobibichu?Redirect=Log&logNo=222048452474,인생 처음으로 <b>복권</b>을 <b>구입</b>해보았다! 어짜피 안될 거.. 돈이 아까워서 지금까지 안해봤는데 친구가 <b>구입</b>한다니깐 나도 호기심과 재미로 <b>구입</b>해보았다. 당첨은 안됐다.. 2500원 투자했다 로또는 만 19세... ,30살 전에 1억 모으기,https://blog.naver.com/rooroobibichu,20200801
"인생 사진, 더현대서울 포토존, <b>복권 구입</b>, 구디역 이자카야 추천",https://blog.naver.com/highsj0725?Redirect=Log&logNo=222405669310,구디역으로 버스 타고 이동해서 <b>복권</b>도 샀다~ 그리고 오늘의 하이라이트! #구로디지털단지역술집... 햇살이 비친 우리 손이 예뻐서 한 컷♥ 함께 처음 사본 <b>복권</b> 원래 엄마랑 금요일 저녁에 사기로 했는데... ,룰루랄랴의 하루♥,https://blog.naver.com/highsj0725,20210621
[불편한 인터넷 로또] 동행<b>복권</b> 온라인 <b>구입</b> 개선요청,https://blog.naver.com/psybong87?Redirect=Log&logNo=221591457620,"어쨌든 <b>구입</b>후 로또당첨 발표가 있었는데요. 결과 반영이 너무 느리네요. 발표후 10분 정도 동행<b>복권</b> 홈페이지 자체가 느려지고, 당첨결과 반영은 거의 30분이 지나야 갱신됩니다. 또한 자신이 선택한... ",비니비니준 블로그!,https://blog.naver.com/psybong87,20190721
핸드폰으로 연금<b>복권 구입</b>하는 방법,https://blog.naver.com/twins-1004?Redirect=Log&logNo=222056607899,"그래서 집에 편하게 앉아 핸드폰으로 연금복권을 구입해보았답니다. 방법은 아주 쉽답니다. 먼저 검색창에 동행 복권을 검색합니다. 핸드폰으로 연금<b>복권 구입</b>하기,동행복권 동행복권 메인 화면입니다.... ",쌍둥이네 생활정보,https://blog.naver.com/twins-1004,20200810
"좋은 꿈 꿔서 로또 <b>복권 구입</b>, 복권 사기 참 힘들었던 하루",https://blog.naver.com/abckyh1?Redirect=Log&logNo=222364163411,밤새 돼지꿈을 꿔서 생각난 김에 <b>복권</b> 사려고 로또 판매점에 찾아가 봤습니다. 점심시간에 방문했는데... 경기 파주시 청암으로 17번 길 43 1층 111호 다행히 문도 열려 있고 <b>구입</b>할 수 있었습니다. 운정 신도시에는... ,이화N시안,https://blog.naver.com/abckyh1,20210524
오사카생활 day.136 : 당첨만 돼라!!! 연말 점보<b>복권 구입</b>,https://blog.naver.com/mirr13?Redirect=Log&logNo=222173869958,"14.(월) - 오사카살이 136일째 일본의 이벤트<b>복권</b> 중 하나라는 연말 점보<b>복권</b>!! 당첨금은 1등 번호 7억엔, 앞뒤 번호 각각 1.5억엔으로, 총 10억엔이라고 하네요. 아.. 우리는 랜덤으로 <b>구입</b>했는데.. ㅠ 일련번호로... ",행복한 날(我 & 日) 만들기~*^^*,https://blog.naver.com/mirr13,20201214
"[일본워킹홀리데이] D+104 일본 로또 <b>복권 구입</b> 방법, 일본예능",https://blog.naver.com/yonfun?Redirect=Log&logNo=221961947725,"사람 많다 <b>구입</b> 방법은 1. 여러가지 <b>복권</b> 중에 마음에 드는 걸 고른다. 2. 컴퓨터사인펜으로 체크 3. 줄서서 돈내면 끝 종류는 로또6, 로또7, 미니로또 등등 있음 로또7이 7자리 맞추는 당첨금액이 가장... ",욘푼의 잡다한 일상,https://blog.naver.com/yonfun,20200514
길몽꾸고 <b>복권구입</b>하기/ 수유하는꿈해몽/연금<b>복권 구입</b>,https://blog.naver.com/syuki4398?Redirect=Log&logNo=222215140960,<b>복권 구입</b> 한도는 1인 1회 10만원 청소년의 경우 <b>복권구입</b>과 당첨금 수령이 불가능 함. 당첨확률은 1/5... 포스팅은 꾸준히 계속 할테니까 슈기언니네 많은사랑 부탁 드려요 #소확행 #연금복권720 #로또구입... ,일상 리뷰 je's room,https://blog.naver.com/syuki4398,20210121
코로나19로 우울한 나날 <b>복권 구입</b>만 크게 늘었다.,https://blog.naver.com/parkhs43?Redirect=Log&logNo=222308196123,또 '2020년 복권 관련 인식' 조사에 응한 전국 만 19세 이상 1천20명(표본오차 ±3.1포인트 95% 신뢰수준) 가운데 56.9%는 최근 1년 이내 복권을 구입한 경험이 '있다'고 답했다.<b>복권 구입</b> 주기를 보면 로또의... ,박현수기자의 블로그,https://blog.naver.com/parkhs43,20210413
무엇이든 1등하고 싶어 <b>복권</b>을 10년째 <b>구입</b>중입니다... ,https://blog.naver.com/adgj1234zxc?Redirect=Log&logNo=222269754852,수창의 고민 주저하지말고 말해보거라 우승경험x 가을야구경험x 상복없음 비운의 투수 안타까움 1등을 해보고싶어 <b>복권구입</b> 무엇이든 1등해보살? 복권을 10년동안사고있는데 1등은 한번도 안됐죠... ,햄버거콜라,https://blog.naver.com/adgj1234zxc,20210309
<b>복권</b>나눔 기억하기,https://blog.naver.com/thoug0156?Redirect=Log&logNo=222393190388,그래도 <b>복권 구입</b> 금액의 반을 나눠야 해요.제가 노래의 신이 되었다는 점이 너무 많아서 로또가 필요한... 없이 복권을 구입할 때 행운을 기대하며 구입했는데 열심히 살라는 중요한 결과를 얻게 됩니다.... ,행복발란스,https://blog.naver.com/thoug0156,20210610
로또 1등 당첨지역 노원 로또명당 스파 <b>복권 구입</b> 후기,https://blog.naver.com/gjskrj?Redirect=Log&logNo=222340312289,"ㅋㅋㅋㅋㅋㅋㅋㅋ 여기서 <b>구입</b>했으니까, 이번주 1등은 내가 되길 !!! #로또1등당첨 43번째라니요. 진짜 대단한거 같아요. 이쪽 지나칠때마다 사람들이 밖에 줄 서있고, 심할땐 마들역까지도 서 있는거... ",아쿠아블로그:소소하고도 화려한이야기,https://blog.naver.com/gjskrj,20210508
"<b>복권</b>으로 꿈꾸는 인생역전, 가능할까?",https://blog.naver.com/welcomebank1?Redirect=Log&logNo=222424181467,"성인 2명 중 1명은 복권을 구입한 것입니다. <b>복권 구입</b>은 얼마나 자주 할까요? 로또 복권의 경우, ‘한 달에 한 번’ 구입하는 사람이 23.7%로 가장 많았고, ‘매주 한 번(21.8%)’, ‘2주에 한 번(15.9... ",웰컴저축은행 공식 블로그,https://blog.naver.com/welcomebank1,20210708
오늘은 느낌이 좋아! <b>복권</b>에 관한 심리,https://blog.naver.com/mosfnet?Redirect=Log&logNo=222415463152,"그리고 편의점으로 뛰어가 <b>복권</b>을 <b>구입</b>하고 꿈속에서 나타난 숫자를 기재합니다. 싱글벙글, 내려오지 않는 입꼬리에 친구가 무슨 일 있냐 묻기에 말을 할까 하다가 얼핏 꿈 이야기는 남에게 하면 무효가 된다는... ",기획재정부 경제e야기,https://blog.naver.com/mosfnet,20210630
[인터넷으로 로또사기] 동행<b>복권</b>을 온라인에서 <b>구입</b>해보자... ,https://blog.naver.com/psybong87?Redirect=Log&logNo=221585870974,"어찌저찌 충전을 하고 복권을 구입하려는데... 이런! 가장 큰 문제는 바로 모바일에서는 구입이... 어차피 충전한 2만원, 그냥 온라인<b>복권 구입</b>해보기로 했습니다. 눈물의 예치금 2개는 수동, 나머지는 자동으로... ",비니비니준 블로그!,https://blog.naver.com/psybong87,20190715
새로바뀐 연금<b>복권 구입</b>해봤어요.,https://blog.naver.com/kwangpyo82?Redirect=Log&logNo=221941209573,대체 어떤사람이 당첨되는지 궁금하기도 해요.~ 로또여 나에게오라~ 연금<b>복권</b>이여 나에게오라~ 매주산다면 죽기전에 될수있을까요? 아~~요즘같이 힘들때 당첨되면 정말 소원이 없겠네요. 이번에 한세트 <b>구입</b>했... ,광수의 일상,https://blog.naver.com/kwangpyo82,20200502
[알려바바]메가밀리언 <b>복권 구입</b>하는 방법-로또윈7... ,https://blog.naver.com/jee113?Redirect=Log&logNo=222209321318,마감시간을 확인하지 않고 예치금부터 입금하면 원하는 회차에서 복권을 구입하지 못할 수도 있다.... 우리나라에서 대행업체를 통한 해외 <b>복권 구입</b>의 위법성·사행성에 대한 규정은 명확하게 수립되지... ,밀크화이트의 이야기방,https://blog.naver.com/jee113,20210116
"노동절 기념, 노동해방을 위한 <b>복권 구입</b>!!",https://blog.naver.com/insidediary?Redirect=Log&logNo=222331294649,노동절을 기념하여 (지극히 개인적인 김찌의) 노동(으로부터의) 해방을 위해 <b>복권</b>을 <b>구입</b>했다! 진짜 진지하게 기도하면서 샀는데ㅠㅠ ▲ 결과를 맞춰보던 김찌 표정 = 이모티콘 표정 김찌의 노동(으로부터의)... ,언제나 BECHA,https://blog.naver.com/insidediary,20210501
생각나서 올만에 스피또 즉석<b>복권 구입</b>을 했어요.,https://blog.naver.com/love7405?Redirect=Log&logNo=222006915765,요즘 로또는 5000원도 전혀 걸리지 않아서 스피또 즉석<b>복권</b>을 <b>구입</b>했습니다. 로또 2000원치랑 스피또 8000원치 ㅎㅎ 일단 스피또1000부터 5억이 과연?? ㅋㅋ 아 첫판 부터 꽝 ㅠ.ㅠ 이런 젠장 ..!! 또오 꽝... ,Game & Toy,https://blog.naver.com/love7405,20200620
오늘일기 닭가슴살 주문과 <b>복권구입</b>,https://blog.naver.com/adorable_jihye?Redirect=Log&logNo=222381275529,꿈꾸며 구매한 <b>복권</b>2개 6월5일까지 두근두근 행복할수 있다니 1등되면 뭐할지 행복한 고민에 빠져봐야겠어요 ㅋㅋㅋㅋㅋ 스피또는 바로 긁어봤는데 처참한 결과 #오늘일기 #블챌 #토요일당첨 #로또1등기원,민92의 블로그,https://blog.naver.com/adorable_jihye,20210602
동행<b>복권</b> 사이트에서 <b>복권</b>구매 -인터넷으로 로또 <b>구입</b>후기,https://blog.naver.com/yunho0229?Redirect=Log&logNo=222330320361,다들 이런 생각하시는거잖아요?  다음주에 농협본점에 가는 꿈을꾸며! 인터넷 로또 구입후기였습니다. #인터넷로또구입 #동행복권 #로또 #로또구입 #동행복권사이트 #인터넷<b>복권구입</b>,맹윤호본부장(신뢰는 생명이다),https://blog.naver.com/yunho0229,20210501
동행<b>복권</b> 홈페이지에서 온라인로또구매 하는 방법,https://blog.naver.com/8027gusgy?Redirect=Log&logNo=222212946297,<b>복권구입</b>하기 쉽지요? 그런데 복권방에서는 더 쉬워요. 그냥 가서 로또 5천원치 자동으로 주세요하면 1분도 안되서 나옵니다. 번호 선택이 되었다면 마지막으로 구매하기를 클릭하시면 구입이 마무리됩니다.... ,알려주는남자,https://blog.naver.com/8027gusgy,20210119
PC로 로또<b>복권 구입</b>하기,https://blog.naver.com/eastkuk?Redirect=Log&logNo=222204338160,로또 뿐만 아니라 연금<b>복권</b>과 다양한 즉석<b>복권</b> 들도 <b>구입</b>할 수 있는데요 어제 꿈을 잘 꾸셨다면 여러 가지 <b>복권</b> 들 한번씩 다 <b>구입</b>해보세요 ㅎㅎ <b>구입</b>하시기 전에 현금을 충전해야 되는데요 오른쪽 위에... ,아무말 대잔치 -나도 돈 좀 벌자,https://blog.naver.com/eastkuk,20210111
로또<b>복권 구입</b>해서 꽝~ 그래도 동행복권에 기부하니 좋아요^^,https://blog.naver.com/myvipgrace?Redirect=Log&logNo=222242769438,내가 <b>구입</b>한 <b>복권</b>확인을 해봐야하는데 이제 노안이 시작된것인지 숫자들이 빙글빙글 ㅜㅜ 이럴때는 QR코드로 확인하는게 좋아요^^ 낙첨되어습니다 .. 로또<b>복권</b>QR코드 확인결과 5000원 날아갔어요 또 다른... ,잘하고 살자~~,https://blog.naver.com/myvipgrace,20210214
설날이라고 긁어본 <b>복권</b>,http://chiculture.egloos.com/4193872,"중화권에서는 평소에도 복권을 많이 구입하는데, 춘절/연말이 되면 사람들이 더 많이 복권을 구입합니... 대만의 지인들과 서로 <b>복권 구입</b>하고는 당첨했다는 소식을 받고, 꽝이 된 소식을 전한 훈훈한?... ",차이컬쳐,http://chiculture.egloos.com/,20210213
"한국인이 최초 개발한 시계 선물하고, <b>복권 구입</b>!?",https://blog.naver.com/rhdygksalth?Redirect=Log&logNo=222401265786,"김정숙 여사, 한국인이 최초 개발한 시계 선물하고, <b>복권 구입</b>!? 김정숙 여사가 스페인 국빈 방문... 기부와 나눔 실천의 의미가 담긴 온세 <b>복권 구입</b>부터 재단 측에서 준비한 특별한 스카프 선물까지.... ",맑은 하늘에,https://blog.naver.com/rhdygksalth,20210617
연금<b>복권</b>720 판매점에서 오프라인 <b>구입</b>,https://blog.naver.com/psybong87?Redirect=Log&logNo=222027623262,"최근 로또와 병행해서 인터넷으로 연금<b>복권</b>을 <b>구입</b>하고 있는데, 인터넷 충전금 5만원을 다 써가고 있다. 다시 충전하면 그만이지만, 문제는 충전할때 수수료가 들어간다는 사실... 그래서 충전금을 다 쓰면... ",비니비니준 블로그!,https://blog.naver.com/psybong87,20200711
인생역전의 꿈! <b>복권</b>과 당첨에 대한 이야기! #<b>복권</b>당첨꿈,https://blog.naver.com/seouledu2012?Redirect=Log&logNo=222097373253,"만 19세 이상인 자만 <b>복권 구입</b>이 가능하답니다. (2020년 1월 1일 기준 2001년생부터) ② 현금으로만 구입 가능 복권은 신용카드로 결제할 수 없고, 무조건 현금으로만 구입할 수 있습니다. 온라인으로 구매하는... ",서울교육나침반,https://blog.naver.com/seouledu2012,20200923
