title,link,description,bloggername,bloggerlink,postdate
"<b>고스톱</b>, 화투 숫자 월 알기",https://blog.naver.com/couponflower?Redirect=Log&logNo=222222031106,"경로당 인기 게임 민화투, 가족, 친구 사이를 벌어지게 만드는 게임 <b>고스톱</b>, 타짜 영화에서 나온 것처럼... 젊은 층부터 중년층은 <b>고스톱</b>을 즐깁니다. 이름에서 알 수 있듯이 <b>고스톱</b>은 영어로 되어 있는데... ",자유와 매력,https://blog.naver.com/couponflower,20210127
<b>고스톱</b>으로 치매 예방이 가능할까?,https://blog.naver.com/nststory2014?Redirect=Log&logNo=222349293281,치매는 <b>고스톱</b>을 통해 예방 할 수 있다? 중앙치매센터가 발표한 ‘대한민국 치매 현황 2019’ 자료에... 민간에 잘 알려져 있는 대표적인 예방법은 바로 <b>고스톱</b>인데요. <b>고스톱</b>을 치면 뇌의 활동량이 많아져... ,국가과학기술연구회,https://blog.naver.com/nststory2014,20210513
전남도교육청 홍보담당관 직위 공모 ‘짜고 치는 <b>고스톱</b>’... ,https://blog.naver.com/mrbluesky7?Redirect=Log&logNo=222437114633,치는 <b>고스톱</b>’이라는 비난 역시 피하기 어려운 실정이다. 오랫동안 일반 경력직 공무원들이 수행한... 한편 도 교육청 인사관계자는 ‘짜고 치는 <b>고스톱</b>’ 논란에 대해 “언론 홍보를 해 왔던 전문가를... ,"호남뉴스24 호남지역 신문, 경제, 문화, 교육, 사회",https://blog.naver.com/mrbluesky7,20210719
모바일<b>고스톱</b> 피망뉴맞고 점수 계산 어렵지 않아요.,https://blog.naver.com/subome?Redirect=Log&logNo=222301070621,친근함과 정겨움의 대명사 <b>고스톱</b>!! 오늘은 그런 <b>고스톱</b>을 모바일로 재미있게 즐길 수 있다고 하여 포스팅하고자 합니다. 바로 모바일<b>고스톱</b> 게임 피망뉴맞고 입니다. 게임을 설치 후 실행하시면 깔끔한... ,봄딩 게임,https://blog.naver.com/subome,20210406
"모바일<b>고스톱</b> 피망뉴맞고, 점수계산이 제일 쉬웠어요!",https://blog.naver.com/zzminuda?Redirect=Log&logNo=222142453998,"이번에 가져온 게임은 명절이면 빠지지 않고 저희 가족이 즐기는 게임으로 모바일<b>고스톱</b> 중 최고라... 먼저, 본격적으로 점수계산에 대해 알아보기 전 모바일<b>고스톱</b> 게임으로 추천하는 피망뉴맞고에 대해... ",늘늘 블로그,https://blog.naver.com/zzminuda,20201112
&lt;짜고 치는 <b>고스톱</b> - 묻고 떠블로 가?~ 틱톡?&gt;,https://blog.naver.com/daeshy1?Redirect=Log&logNo=222094341390,"미국 주식을 투자하는 조카가 틱톡 매각에 대해 물어왔는데요, 짜고 치는 <b>고스톱</b>이라고 정리했죠.... 조율할 것은 몇일 전에 므누신 재무장관이 합의한 것에서 알 수 있습니다. 잘 짜여진 <b>고스톱</b>판처럼.... &lt;마침!&gt;",대탐소실님의 블로그,https://blog.naver.com/daeshy1,20200920
<b>고스톱</b> 화투 숫자 유래와 의미~,https://blog.naver.com/crom234?Redirect=Log&logNo=221997499965,"<b>고스톱</b> 화투 숫자 이야기. 좋은 가족 명절놀이 윷놀이가 있기는 하지만, 어른들이 모여 시간가는 줄... 이 화투를 가지고 하는 <b>고스톱</b>도 숫자를 알아야 진행을 할 수 있다. <b>고스톱</b> 화투 안에 있는 그림들의... ",피터팬 캠핑:굳이 편해지려는 이유는 무엇인가?,https://blog.naver.com/crom234,20200611
[화투 치는 법 총정리] <b>고스톱</b> 룰 알짜배기 정리,https://blog.naver.com/rlagkdus0102?Redirect=Log&logNo=222345960352,"안녕하세요, 오늘은 화투 <b>고스톱</b> 치는 법 A to Z 모두 다 알려드리겠습니다! 믿고 따라와. (박력) 게임 준비 기본적인 룰은 3인 <b>고스톱</b> 기준으로 설명할게요. (2인 맞고 기준은 괄호 안 표기) 1. 선을 정한 뒤 패를... ",스칼렛의 꿈꾸는 나무,https://blog.naver.com/rlagkdus0102,20210511
때문에 '수지' 맞았다? 시청률보다 <b>고스톱</b> 방석을 더 주목한 이유,https://blog.naver.com/truefan?Redirect=Log&logNo=222128141779,"<b>고스톱</b>에서 승리한 타짜의 비밀이 결국 오래 앉아도 편안한 전성기 몰입방석에 있었다는 다소 무리한 설정이었지만 다들 즐거워 하셨습니다. ㅋㅋ 아니나 다를까, 드라마 &lt;스타트업&gt; 4회 극중에서 <b>고스톱</b>... ",강효석의 '바른전략연구소',https://blog.naver.com/truefan,20201027
"살았을 것,  <b>고스톱</b> 대결, 시청률, 촬영지 평택 트리하우스",https://blog.naver.com/cooljason92?Redirect=Log&logNo=222272714657,"그러니까 우리, <b>고스톱</b>을 해 보자&quot;라고 난데없는 드립과 담요를 꺼내는데요.. 그렇게 시작된 <b>고스톱</b> 대결 비는 '숨은 타짜'의 실력을 뽐내며 김수미와 전진을 제압 2연승으로 게임을 종료... 벌칙으로 '이마 딱밤... ",글로벌의 꿈 린스가족,https://blog.naver.com/cooljason92,20210312
시부모님과 <b>고스톱</b>,https://blog.naver.com/jml012?Redirect=Log&logNo=222105988403,"1호가 돌이 되기 전 무렵, 지방에 살고 있던 우리 부부의 신혼집에 놀러 오신 시부모님께 <b>고스톱</b>이란... 아버지는 <b>고스톱</b>을 칠 줄은 아시지만, 그리 즐기지 않으셨는데 저를 가르쳐 준 뒤로 저와 어머니와 함께... ",불곰이 된 엄마,https://blog.naver.com/jml012,20201003
<b>고스톱</b> AI 프로젝트(중단),https://blog.naver.com/aaa4379?Redirect=Log&logNo=222386149222,"<b>고스톱</b>이 룰 자체가 명확하지 않고 변형이 많아서 어느게 맞는지 모르겠고 해서, 직접 플레이해보면서 어떻게 해놨는가 체험을 해보았는데, <b>고스톱</b>이란 게 생각보다 재미가 없었다. 한 게임 자체가 애매하게... ",[sowon],https://blog.naver.com/aaa4379,20210605
<b>고스톱</b> 필승 전략 잘치는 법 10가지,https://blog.naver.com/gamejoa20?Redirect=Log&logNo=222429827379,"http://gamejoa.com/home 각종 게임사 이용쿠폰 20%할인 이벤트&quot;게임조아&quot; <b>고스톱</b>은 운칠기삼의 게임이며, 게임에 승리하기 위해서는 운이 가장 중요합니다 (좋은패 앞에는 장사 없습니다). 하지만 <b>고스톱</b>에서 운이... ",포카칩,https://blog.naver.com/gamejoa20,20210713
<b>고스톱</b> 점수계산 치는법 화투 룰 보기,https://blog.naver.com/couponflower?Redirect=Log&logNo=222224912015,"그다음 이어서 이제는 본격적으로 <b>고스톱</b> 치는법과 룰, 점수 계산을 볼 것인데요. 지역에 따라 계산하는 방법이 조금씩 다르니, 시작하기 전에 <b>고스톱</b> 룰을 먼저 대화를 나눈 후 게임하면 되며, 아래 내용은... ",자유와 매력,https://blog.naver.com/couponflower,20210130
코로나 비상시국에 8명이 <b>고스톱</b>... 시의원에 거센 비난,https://blog.naver.com/hun5454?Redirect=Log&logNo=222220908825,이들은 지난 25일 저녁 송학면의 한 주택에서 속칭 '<b>고스톱</b>' 도박을 하다가 112 신고를 받고 출동한... A의원 측은 &quot;이장님이 손두부를 했다며 초대해 갔다가 (<b>고스톱</b>) 세 판을 쳤는데 경찰이 들어왔다&quot;며 &quot;5... ,강성헌희망스포츠단,https://blog.naver.com/hun5454,20210126
농장에서 대방어회와 <b>고스톱</b>을,https://blog.naver.com/sanginlsi?Redirect=Log&logNo=222203803244,<b>고스톱</b> 치는 방식도 까맣게 잊어버리고 있었는데 넷이서 기억을 더듬어 한 번 쳐보기로 하였다. 복잡한 룰은 되도록 줄이고 돈은 1점에 백원씩 계산하기로 하였다. 100원짜리 동전이 없어 각자 천원씩 내고... ,산들농원,https://blog.naver.com/sanginlsi,20210111
피망뉴맞고의 새로운 모드인 <b>고스톱</b> 모드 전격 분석,https://blog.naver.com/dewichien?Redirect=Log&logNo=222414609507,기존의 뉴맞고 버전과 오리지널 버전에 이어서 이제는 3명이 즐길 수 있는 <b>고스톱</b> 모드를 출시했다고 하니 기대를 안 할 수 없더라고요. 오늘은 새롭게 탄생한 <b>고스톱</b> 모드를 여러분께 소개하는 시간을... ,절망에 복종하라!,https://blog.naver.com/dewichien,20210629
"중독성게임 등극, 피망뉴맞고 3장 <b>고스톱</b> 모드의 A TO Z!",https://blog.naver.com/zzminuda?Redirect=Log&logNo=222422336756,바로 1 대 1 대결에서 총 3인이 대결이 가능한 모드인 <b>고스톱</b> 모드가 추가되었다는 소식입니다. 단지 한... 2인 맞고에서는 보너스 패가 50장의 카드 중 단 2장이라는 점이고 3인 <b>고스톱</b> 모드에서는 2장이 더... ,늘늘 블로그,https://blog.naver.com/zzminuda,20210706
피망 <b>고스톱</b> 설치방법,https://blog.naver.com/3x65ynrvb8m6?Redirect=Log&logNo=222436616658,"이번엔 피망 <b>고스톱</b> 주제를 포스팅을 해보도록 하겠습니다. <b>고스톱</b> 하면 대명절이나 가족모임 행사, 그리고 지인들끼리 피서 갔을 때 등등에서 많이들 하는데요. 작게 즐긴다면, 재미난 놀이 게임이 될 수 있는... ",거품목욕 님의블로그,https://blog.naver.com/3x65ynrvb8m6,20210719
트럼프와 하메네이가 짜고 친 <b>고스톱</b>? 트럼프 '원 고!' 했지만... ,https://blog.naver.com/jjostonebird?Redirect=Log&logNo=221765483315,&lt;이번 미·이란 충돌은 트럼프와 하메네이가 짜고 친 <b>고스톱</b>? 트럼프 '원 고!' 했지만 '투 고'는 못해... 이번 사태를 두고 트럼프와 하메네이가 짜고 친 <b>고스톱</b>이라는 말이 나오는 이유다. . ▶트럼프가 친이란... ,중동전문블로그<News Caravan>,https://blog.naver.com/jjostonebird,20200109
부부의 화투판에 난입한 고양이..&quot;셋이 하는 <b>고스톱</b>이 제맛!&quot;,https://blog.naver.com/inbnet?Redirect=Log&logNo=222200683330,자연스럽게 맞고는 <b>고스톱</b>으로 이어졌다. 최근 집에서 휴식을 취하던 여집사 로라 씨는 무료함을... 한 <b>고스톱</b>이 제법 재미가 있었던 모양이다. &quot;솜방망이는 눈보다 빠르다옹..!&quot; 로라 씨는 &quot;원래 고양이들이... ,반려동물뉴스 노트펫,https://blog.naver.com/inbnet,20210111
한게임 <b>고스톱</b> 설치하기,https://blog.naver.com/mount2014?Redirect=Log&logNo=222345170357,<b>고스톱</b>게임을 참 많이 했었는데요. 요즘에는 <b>고스톱</b>게임을 하려면 사람들이 모여야 해서 요즘에는 온라인으로 많이 하는 것 같습니다. 기본적으로 피망뉴맞고와 한게임 맞고를 많이 했었는데요. 오늘 소개드릴... ,찾아줘세무사,https://blog.naver.com/mount2014,20210510
<b>고스톱</b> 배우기,https://blog.naver.com/mlj2772?Redirect=Log&logNo=222186861822,사회생활 할때 집들이나 상가집에서 남들 <b>고스톱</b> 치는거 어깨넘어로 봐서 화투 숫자와 청단.홍단... 그러다보니 아주 강한 세뇌가~~~ㅎㅎ 하여 마침 잠도 안오는 이밤 치매 예방에도 좋다는 <b>고스톱</b>이라도... ,촌노의 전원생활,https://blog.naver.com/mlj2772,20201227
"영어보드게임, 패턴영어,  <b>고스톱</b>게임으로 즐겁게 영어공부!",https://blog.naver.com/0514grace?Redirect=Log&logNo=222397317374,"이수미학습코칭센터의 <b>고스톱</b>게임이랍니다. <b>고스톱</b>영어, <b>고스톱</b>영어보드게임 택배로 주문하니 이렇게 에어캡으로 꼼꼼하게 포장되어 옵니다. 열어보니 (주)이수미학습코칭센터, <b>고스톱</b>영어보드게임이 들어... ",To be a better teacher is really difficult!!,https://blog.naver.com/0514grace,20210614
<b>고스톱</b>치는법 배우고 싶다면 피망뉴맞고 시작해봐,https://blog.naver.com/haleejjang1?Redirect=Log&logNo=222090330951,추석에는 맛있는 음식도 먹고 특집 영화도 하고 뭐니뭐니 해도 가장 좋은 건 가족들끼리 하는 <b>고스톱</b>인데요! 하지만 전 항상 명절 때 <b>고스톱</b> 칠라고 하면 <b>고스톱</b>치는법이 가물가물 기억이 잘 안나더라고요.... ,발컨아 게임블로그,https://blog.naver.com/haleejjang1,20200915
오늘일기. <b>고스톱</b> 연습,https://blog.naver.com/blackstarj?Redirect=Log&logNo=222384255491,"<b>고스톱</b> 배우기 1단계로 짝 맞추고 종류별로 나누기 도전. 이건 너무 쉽잖아? 그 다음엔 점수 내는 법 배우다가, 오늘은 여기까지 레슨 끝. <b>고스톱</b> 치던 순간을 떠올리면 마냥 즐거웠던 순간만 떠오른다. 함께... ",Road Trip,https://blog.naver.com/blackstarj,20210604
<b>고스톱</b> 가족,https://blog.naver.com/press64?Redirect=Log&logNo=222145473314,"바로 <b>고스톱</b> 판이다. 난 <b>고스톱</b> 문외한이라, 낄 생각이 없었는데 남편이 자꾸 옆구리를 찌르며 껴보라고 한다. 자기가 알려준다고 그렇게 시작된 나의 <b>고스톱</b>. 가족들도 내가 초짜라는 걸 알고 봐주기도 하고... ",임 기자의 취재파일,https://blog.naver.com/press64,20201116
피망<b>고스톱</b> 설치하기,https://blog.naver.com/c1004ok?Redirect=Log&logNo=222272895639,"오늘은 피망<b>고스톱</b> 설치방법에 대해 알아보려고 합니다. 아래에서 확인하시면 되겠습니다. 피망<b>고스톱</b> 설치방법보기 뉴피망맞고는 PC전용 게임이며, 게임설치는 홈페이지에서 진행할 수 있습니다. 먼저... ",사장백서 (전수창업 플랫폼),https://blog.naver.com/c1004ok,20210312
놀이 문화로서의 <b>고스톱</b>,https://blog.naver.com/swk64777?Redirect=Log&logNo=222432304475,"# <b>고스톱</b>의 유래. 나는 학자가 아니라서 <b>고스톱</b>의 학술적 연원을 공부한 적은 없다. 그저 풍문으로 들었을 뿐이다. 식민지 시대에, 일제가 우리를 도박중독에 빠뜨려서 국민을 분열시키고 독립운동에 힘을 쏟지... ",소쿠리 인생(so cool),https://blog.naver.com/swk64777,20210715
<b>고스톱</b>치며 치맥 / 강릉 게스트하우스 중앙점,https://blog.naver.com/coffeemarina?Redirect=Log&logNo=222039906630,<b>고스톱</b>치며 치맥 / 강릉 게스트하우스 중앙점 안녕하세요. 강릉 게스트하우스 중앙점입니다! 오랜만에... 다시 <b>고스톱</b> 재개 ㅋㅋㅋㅋㅋㅋㅋㅋㅋㅋㅋㅋ 결국 광을 많이 팔았던 제가 승자가 되었어요... ,강릉게스트하우스 중앙점,https://blog.naver.com/coffeemarina,20200723
노모와 <b>고스톱</b>,https://blog.naver.com/hyunkyungsil?Redirect=Log&logNo=222435741624,#92세노모 #노모와놀기 #<b>고스톱</b> 노모와 하루 2~3시간씩 <b>고스톱</b>을 친다. 이순옥여사가 가장 활기 있는 시간은 <b>고스톱</b> 치는이기 때문이다. 경채는 엄마와 <b>고스톱</b>을 치기 위해 그렇게 바쁜데도 저녁이면 일을 마치고... ,BloomingDays의 블로그,https://blog.naver.com/hyunkyungsil,20210718
"간편하고 손 쉬운 무료 <b>고스톱</b>, 피망뉴맞고. 고수와 깔끔한 한판.",https://blog.naver.com/foxc987?Redirect=Log&logNo=221718038475,"스트레스 없이 간편하게 즐길 수 있지만, 그 안에서 짜릿함을 느낄 수 있는 무료 <b>고스톱</b> 게임을 가장... 간간히 시간 여유가 날 때 마다 <b>고스톱</b>을 즐기다 보면 미묘하게 스트레스가 풀리곤 하는데요. 오늘... ",제목없음,https://blog.naver.com/foxc987,20191125
울산 코로나 확진자 대거 발생한 수상한 <b>고스톱</b> 모임?!1억원... ,https://blog.naver.com/secretsm22?Redirect=Log&logNo=222078576366,우선 88번 확진자가 8월 25일 지인의 집에서 <b>고스톱</b>을 쳤다. 이때 본인을 포함해 총 6명이 있었는데 한 명 빼고 8월 31일 모두 확진 판정을 받았다. 여기는 이날 <b>고스톱</b> 치는 공간을 마련해준 집주인이 94번... ,신뚱이야기,https://blog.naver.com/secretsm22,20200902
"화투, 꽃들의 전쟁. <b>고스톱</b> 몇년만인지~",https://blog.naver.com/polianna825?Redirect=Log&logNo=221706558452,"<b>고스톱</b>, 꽃들의 전쟁, 화투 를 합니다. 판깔았구요.음하하하.시작. 점당 100원으로 ..나의 초기자금은 1만원. 결과요? 화투, 꽃들의 전쟁. <b>고스톱</b> 몇년만인지~ 자본금1만원에서... 몇백원 남기고 쫄당 망했어요. 이... ",폴리안나,https://blog.naver.com/polianna825,20191113
집 위치 심진화 김원효 엄마 어머니 <b>고스톱</b> 대결 펼치다? ◆,https://blog.naver.com/kyongil1228?Redirect=Log&logNo=222282605102,또 1호가에서는 김원효의 엄마와 심진화의 어머니가 <b>고스톱</b> 대결을 펼쳤는데요. 청송타짜와 부산타짜의 대결이 벌써부터 기대감을 모았는데요. 심진화의 엄마가 패를 섞자 심진화는 동작 그만을 외쳤습니다.... ,Bon Appetit & Posting,https://blog.naver.com/kyongil1228,20210321
짜고 치는 <b>고스톱</b>,https://blog.naver.com/skim209?Redirect=Log&logNo=221683627631,치는 <b>고스톱</b>'의 현실을 지적했다. 이런 비리와 불법은 한국사람이 사는 곳이라면 어디서나 벌어지는 것... 치는 <b>고스톱</b>이라는 사실이 다시 한번 확인되었다. 일부의 비리가 아닌 광범위하게 퍼진 관례급이... ,나는 뉴욕이 좋다,https://blog.naver.com/skim209,20191028
"<b>고스톱</b>과 함께 지새운 밤, 설연휴(3)",https://blog.naver.com/joy-907?Redirect=Log&logNo=222250108730,<b>고스톱</b> 독학 유튜브랑 엄마한테 물어보면서 <b>고스톱</b>을 배웠다. 처음 해보는 건데 왜 할매들이 <b>고스톱</b> 치러 경로당 가는지 알겠던걸 할무니할아부지들은 <b>고스톱</b> 열심히 치면 정말 치매예방에 좋을 것 같다. 꽤... ,Joyful PetJoy,https://blog.naver.com/joy-907,20210220
"<b>고스톱</b>태교, 천재태교. 동양화태교",https://blog.naver.com/tns4380?Redirect=Log&logNo=222433658416,#성장동영상 #코로나돌잔치 #조선아성장동영상 #<b>고스톱</b>태교 #동양화태교 38년지기 친구의 아들 돌이다.... 친구도 아주 만족해 한다ㅋㅋㅋ 남들은 임신준비를 운동으로 한다는데 조선아는 임신준비를 <b>고스톱</b>으로... ,밥만잘먹는 애,https://blog.naver.com/tns4380,20210716
남편과 운동을 가고~ 남편과 <b>고스톱</b>을~,https://blog.naver.com/noun555?Redirect=Log&logNo=221889144838,나도 맛있게 먹고~ 카레도 만들어서 남편과 맛있게 먹고~ 남편과 <b>고스톱</b>을 오랜만에 했다. 바닥에 3패가 깔리고 남편이 싼걸 연달아 내가 맞아서 깔깔거리고 웃었다. <b>고스톱</b>은 약오를때도 있지만 꽤 재미있는... ,살아가는 이야기,https://blog.naver.com/noun555,20200403
"<b>고스톱</b> 화투의 유래, 고도리 인생 교훈",https://blog.naver.com/dasan218?Redirect=Log&logNo=222430386820,<b>고스톱</b>을 치며 두 분 부모님 대화 나누시는 모습도 보기가 좋아요. 본인이 이길 때도 상대방의 패를 배려하는 모습을 자주 보이시거든요. &quot; [출처] 시부모님과 <b>고스톱</b>|작성자 죠제 &lt; #화투와 #일본문화... ,실사구시 실버,https://blog.naver.com/dasan218,20210720
<b>고스톱</b> 월 숫자 알아봐요(+ 예쁜 화투),https://blog.naver.com/luvxox?Redirect=Log&logNo=222233694139,"<b>고스톱</b> 칠 때 숫자를 알아야 선을 정할 수 있어요. 조약돌화투 수작업으로 만든 제품이에요. 요즘 나온... <b>고스톱</b> 칠 때 두 장만 쓰는 줄 알았는데 여러 개도 사용 하나 봐요. 화투 월, 숫자 열두 달을 상징하고 각... ",맑 은날,https://blog.naver.com/luvxox,20210206
생각일기) <b>고스톱</b>과 포커의 차이,https://blog.naver.com/moon_terroir?Redirect=Log&logNo=222337915666,<b>고스톱</b>과 포커의 차이는 중간에 외칠 수 있는 '다이(Die)' <b>고스톱</b>은 중간에 내 마음대로 게임을 종료 할 수 없다. 가장 점수가 우세한 사람이 게임의 고(Go) 또는 스톱(Stop)을 결정한다. 그에 반해 포커는 본인이... ,귀족적 유목민 (Nobless nomad),https://blog.naver.com/moon_terroir,20210504
재미 삼아 친 가족 간 <b>고스톱</b>도 도박 처벌 대상일까?,https://blog.naver.com/inalcohol?Redirect=Log&logNo=222245708133,"100원짜리 <b>고스톱</b> 도박인가요?” 모처럼 가족들과 저녁식사를 한 뒤, 오랜만에 판을 벌인다. 녹색 담요 위에서 펼쳐지는 ‘점백 <b>고스톱</b>(점당 100원짜리 화투놀이)’. 단순한 재미로 시작하지만, 판돈이 200원... ",광주동구중독관리통합지원센터,https://blog.naver.com/inalcohol,20210216
<b>고스톱</b> 안쳐 준다고 짐싸신 엄마,https://blog.naver.com/hyunkyungsil?Redirect=Log&logNo=222438000250,#노모모시기 #친정엄마모시기 #엄마의고집 엄마가 아침나절에 갑자기 심심하셨는지 <b>고스톱</b>을 치자고 하신다. 엄마 오신후 바쁜 경채도 합세하여서 매일 두세시간씩 <b>고스톱</b>을 쳤었다. 저녁때 매일 두세시간씩... ,BloomingDays의 블로그,https://blog.naver.com/hyunkyungsil,20210720
<b>고스톱</b>과 인생살이,https://blog.naver.com/k2hansk?Redirect=Log&logNo=222092223236,"<b>고스톱</b>과 인생살이의 공통점은? 앞패보다 뒷패가 좋아야 한다. 곧 추석명절이 다가온다. 그러나 올해... 작게 하면 놀이요, 크게하면 도박이 되는 바로 <b>고스톱</b>, <b>고스톱</b>에 나오는 용어를 어느 분이 살을 붙여서... ",모노의 기깔난중년,https://blog.naver.com/k2hansk,20200917
8월 15일 - 체스와 <b>고스톱</b>의 피,https://blog.naver.com/mogmogtokyo?Redirect=Log&logNo=222061822744,"그니까 요즘 애들이 하는 그런 게임들 말고 전통적인 게임, 예를 들면 <b>고스톱</b> 같은... 뭐랄까... 어쩌면... 했는데, <b>고스톱</b>으로 설겆이 당번을 정했었다. 이런 말은 약간 그렇지만 그때 나는 설겆이를 해본 적이... ",해처럼의 天然生活,https://blog.naver.com/mogmogtokyo,20200816
"오광소주잔, 일삼팔똥비 <b>고스톱</b> 소주잔 이건 안살수가... ",https://blog.naver.com/woan77?Redirect=Log&logNo=222145844168,"카페에서 올라온 소주잔~ <b>고스톱</b> 디자인으로 만들어진 소주잔을 보고... 이건 정말 안살수가 없었다. ㅎㅎ 그래서 와이프한테 부탁을 한다. 사달라고~ ㅋㅋㅋ #내돈내산, #오광소주잔, #<b>고스톱</b>소주잔 왜냐하면... ",내당와니네 가족의 추억담기~,https://blog.naver.com/woan77,20201118
<b>고스톱</b> 나라의 앨리스,https://blog.naver.com/maitaya?Redirect=Log&logNo=222010437074,"<b>고스톱</b>은 잘 모르지만 싸는게 있다고 하던데.&quot; 굉장히 점잖으셨던 교수님이 이렇게 조언해주셔서 탄생된 명장면입니다! 지금도 친구들이 요즘 웹툰 형식으로 칼라로 다시 그려 보라 하는데, 아직까지 그걸... ",뭐하니? 메이타야,https://blog.naver.com/maitaya,20200624
다음 <b>고스톱</b> 접속(설치)하기,https://blog.naver.com/suus8689?Redirect=Log&logNo=222379883841,오랜만에 다음 <b>고스톱</b>에 접속했다면 카카오 계정으로 통합하는 과정이 필요하다 귀찮은 작업이기도 하지만 컴퓨터가 익숙지 않은 유저라면 거부감이 들 수도 있는 과정이기도 할 것이다. 어차피 다음 <b>고스톱</b>... ,또르의 연예 게임리뷰,https://blog.naver.com/suus8689,20210601
설날 상해 춘절 연휴 1일차 : 명절에는 <b>고스톱</b>이지! 상하이 일상,https://blog.naver.com/hannuri0522?Redirect=Log&logNo=222240763548,(메모) 그리고 오늘의 목표!ㅋㅋㅋㅋ 진짜 오랜만에 <b>고스톱</b>을 치기로 했다! 아니 근데 집에 도착하고 나서 집주인의 고백.. <b>고스톱</b>을 못 찾겠다고...ㅋㅋㅋㅋ ㅇㅅㅇ??? 결국 한참 찾다가 포기하고 밥하러 주방... ,Hi Shanghai Life,https://blog.naver.com/hannuri0522,20210211
빵 터지는 <b>고스톱</b> 송,https://blog.naver.com/knoulib?Redirect=Log&logNo=222338566879,#<b>고스톱</b> #빵터지는<b>고스톱</b>송 #재미난<b>고스톱</b>송 #웃기는<b>고스톱</b>송 <b>고스톱</b>에 관한 재미난 영상이 있어 다운 받아 편집해 봤습니다! 그냥 재미로 봐 주세요! 주현미의 '밤비 내리는 영동교' 노래에 개사를 한... ,♣ 사랑보다 그리움을 ♣,https://blog.naver.com/knoulib,20210505
에이치엘비 - <b>고스톱</b>,https://blog.naver.com/psk2850?Redirect=Log&logNo=222247614387,명절이면 많은 사람들이 <b>고스톱</b>을 즐긴다. 일본에서 건너온 놀이문화?인데 정당하게 사람들과 즐기는 자리와 이권이 개입되어 몇몇이 짜고치는 <b>고스톱</b>의 차이는 질적으로 틀리다. 우리가 영화로만 봐오던 그런... ,그대가 있어 행복한 세상,https://blog.naver.com/psk2850,20210218
명절에 친척끼리 친 점 1000원짜리 <b>고스톱</b>…도박죄라고?,https://blog.naver.com/naverlaw?Redirect=Log&logNo=221778850227,"차례를 지낸 후 어김없이 <b>고스톱</b>판이 벌어집니다. 처음엔 돈을 걸지 않은 채 그냥 치고 있었지만 이내... 명절에 친척들끼리 모여 치는 <b>고스톱</b>도 도박죄 처벌대상일까요? 형법 제246조(도박, 상습도박) ①... ",네이버 법률,https://blog.naver.com/naverlaw,20200120
