title,link,description,bloggername,bloggerlink,postdate
신작<b>모바일게임</b> 조합 RPG 아르카나 택틱스 리볼버스 소개 및... ,https://blog.naver.com/honestpsc17?Redirect=Log&logNo=222270615781,아르카나 택틱스 리볼버스에 대해 간단히 알아봤는데요. 조합 RPG를 좋아한다면 추천하고 싶은 <b>모바일게임</b>입니다. 취향을 탈 수 있는 <b>게임</b>은 분명한데요. 내 스타일이다 싶다면 <b>게임</b>을 다운받아 시작해 보세요.,꼴뚝,https://blog.naver.com/honestpsc17,20210310
메타버스 <b>모바일 게임</b> 플레이 투게더 돈벌기- 잃어버린 섬... ,https://blog.naver.com/ppej1234?Redirect=Log&logNo=222342692508,메타버스 <b>모바일 게임</b> 플레이 투게더 돈벌기- 잃어버린 섬 보물찾기 - 플레이 투게더는 아바타를 꾸미고 집을 꾸미죠! 이렇게 무언가를 꾸미기 위해서는 돈을 모아야 하는데요 돈을 모으기 위해 다양한 <b>게임</b>들이... ,니넬의게임이야기,https://blog.naver.com/ppej1234,20210508
신작 <b>모바일게임</b> 추천 AFK배틀 수집형RPG 스타일 방치형<b>게임</b>... ,https://blog.naver.com/dewichien?Redirect=Log&logNo=222294004698,"따끈따끈한 신작 <b>모바일게임</b> 되시겠다. <b>게임</b> 플레이 방식은 우리가 제법 익숙한 [수집형RPG + 방치형<b>게임</b>]의 조합이다. 총 6명의 캐릭터를 전면에 배치시켜 자동 전투를 진행하도록 하며, 각 관문마다 배치된... ",절망에 복종하라!,https://blog.naver.com/dewichien,20210331
[<b>모바일게임</b>] 뉴 한판맞고 플레이 후기,https://blog.naver.com/newpark314?Redirect=Log&logNo=222415654206,(물론 버스 터미널 시간표는 최신 버전을 보시는 게 맞습니다.) 이번 포스트는 40대 이상 분들을 공략할 <b>모바일게임</b> '한판맞고'관련 포스트입니다. 이 <b>게임</b>이 제작사에서는 출시 7주년이라고 합니다만... ,교통시설 탐구를 좋아하는 이의 블로그,https://blog.naver.com/newpark314,20210630
출시예정 <b>모바일 게임</b> 제2의나라 사전예약과 이벤트 진행중,https://blog.naver.com/ppej1234?Redirect=Log&logNo=222311894174,출시예정 <b>모바일 게임</b> 제2의나라 사전예약과 이벤트 진행중 제2의 나라는 4월14일부터 사전예약이 진행중 인데요 우다닥 모자를 지급하는 친구추천 이벤트와 별개로 다른 이벤트들도 진행중이더라고요 <b>게임</b>... ,니넬의게임이야기,https://blog.naver.com/ppej1234,20210416
골프임팩트 사전예약! 네오위즈 신작<b>모바일게임</b>,https://blog.naver.com/kkodug9?Redirect=Log&logNo=222215710826,"싶다.) <b>모바일게임</b>으로 즐기는 만큼 섬세한 조작은 가능하나, 어렵지 않은 컨트롤을 요구하기에 아예 골프라는 종목을 처음 접하는 분들이나 <b>게임</b>에 취약한 분들도 재밌게 즐길 수 있다. <b>게임</b> 내에서 목적은 상대... ",영원한도시 블로그,https://blog.naver.com/kkodug9,20210122
"<b>모바일게임</b>순위 -4월 첫째주 (삼국지전략판 1위 달성, DK온라인... ",https://blog.naver.com/useful1102?Redirect=Log&logNo=222302732039,"특히 전략장르에서는 삼국지전략판, S.O.S, 라오킹 모두 중국<b>게임</b>인걸 보면 국내 <b>모바일게임</b>이 롤플레잉 위주로 편중되어 있음을 알 수 있습니다. 그 외의 소식으로는 DK<b>모바일</b>이 빠르게 순위권 상승에 성공하여... ",생각들이 모여 철학이 된다.,https://blog.naver.com/useful1102,20210408
<b>모바일게임</b> 기대작 제2의나라 사전예약 공개된 신규 정보까지,https://blog.naver.com/obama8775?Redirect=Log&logNo=222310955333,지브리 풍 <b>게임</b>을 찾고 계시는 분들이나 기존 작품들과는 다른 <b>모바일게임</b> 기대작을 원하시는 분들이라면 제2의나라 사전예약에 참여해보시는 건 어떨까요? 하단 링크를 통해 감성 모험 RPG를 직접... ,선비의 엣헴블로그,https://blog.naver.com/obama8775,20210415
<b>모바일게임</b> 환불 과정이 중요해요!,https://blog.naver.com/akrsodhk?Redirect=Log&logNo=222367629531,"<b>모바일게임</b> 환불을 경험하면서 드는 생각은 요즘 세상은 정말 못하는 게 없구나 싶고, 진작 이런 서비스를 알았더라면 싶은 생각이 들어서 지난 시간 동안 <b>게임</b>에 쏟아부었던 금액들이 주마등처럼 스쳐 지나간... ",재와니의 블로그,https://blog.naver.com/akrsodhk,20210526
양대 마켓 <b>모바일게임</b>순위 1위! 파이널기어 여름 업데이트 소식,https://blog.naver.com/kkeangel?Redirect=Log&logNo=222384892673,"소녀들의 메카 컬렉션을 내세운 대작 <b>게임</b> 파이널기어가 출시 직후 바로 양대 마켓 <b>모바일게임</b>순위 1위를 달성해낸 뒤, 무려 일주일간 계속 순위권내에서 고공행진을 하고 있다. 거기에 더해서 6월 2일, 대규모... ",전생했더니개돼지가된건에대하여,https://blog.naver.com/kkeangel,20210604
곽도원이 선택한 신작<b>모바일게임</b> 삼국지 혼 프리뷰 &amp; 사전예약,https://blog.naver.com/subome?Redirect=Log&logNo=222285213082,삼국지 혼은 이미 많은 유저들이 기대하고 있는 신작<b>모바일게임</b> 중 하나인데요. 저 또한 삼국지 <b>게임</b>을 종종 즐겨 하는 편으로 삼국지 혼에 대한 기대감이 높은 상태입니다. 그럼 많은 유저들의 뜨거운 관심을... ,봄딩 게임,https://blog.naver.com/subome,20210323
"신규<b>모바일게임</b> 백야극광 사전예약, 독특한 <b>모바일</b>RPG",https://blog.naver.com/openprice_c?Redirect=Log&logNo=222358844972,"장르의 <b>모바일</b>RPG, 미소녀<b>게임</b>이다. 80명 이상의 미소녀 캐릭터가 등장하며 5명의 캐릭터를 한 팀으로... 인기 <b>모바일 게임</b>으로써 충분해 보인다. 정식 출시에 앞서 탄탄한 세계관과 수려한 일러스트 등이... ",박한량,https://blog.naver.com/openprice_c,20210520
<b>모바일게임</b>순위 7월 2주차,https://blog.naver.com/114632?Redirect=Log&logNo=222029939902,"국내 라그, 바람 등 과같이 인지도가 있는 <b>게임</b>이 <b>모바일</b>로 나온 것으로 국내에도 무조건 출시할 것으로 보이는 네임드류의 <b>게임</b>이랄까요!? 캐주얼형태로는 국내 <b>모바일게임</b>사들과 비슷한 퀄리티로... ",소냉순,https://blog.naver.com/114632,20200713
<b>모바일게임</b>순위 -3월 셋째주 (원펀맨 차트 진입... ,https://blog.naver.com/useful1102?Redirect=Log&logNo=222283482007,출처 : 게볼루션 21년 3월 셋째주 <b>모바일게임</b> 시장 21년 3월 셋째주 장르 분포 이번주 <b>모바일 게임</b>... PC랑 <b>모바일</b>에서 이렇게 장기흥행한 <b>게임</b>은 현재 리니지를 제외하고는 거의 없는데요. 현재도 글로벌... ,생각들이 모여 철학이 된다.,https://blog.naver.com/useful1102,20210322
출시예정 <b>모바일 게임</b> 제2의나라 선발대 및 사전예약 예정날짜,https://blog.naver.com/ppej1234?Redirect=Log&logNo=222308255910,출시예정 <b>모바일 게임</b> 제2의나라 선발대 및 사전예약 예정날짜 요새 광고도 많이 보이고 이야기도 많이... 니노쿠니의 <b>모바일</b> 버전이라고 많이 하는거 같던데요 니노쿠니<b>게임</b>을 잘 몰라서 검색을 해보니까... ,니넬의게임이야기,https://blog.naver.com/ppej1234,20210413
<b>모바일 게임</b> 순위 21년 3월 3주차,https://blog.naver.com/sun0799dh?Redirect=Log&logNo=222278308993,"게볼루션 사이트 - <b>모바일 게임</b> 순위 2021년 3월 3주차 <b>모바일 게임</b> 종합 순위는 1위 쿠키런 킹덤, 2위... 갑자기 엄청난 인기를 끌고 있는데 삼국지 <b>게임</b>은 사실 예전에 인기를 많이 끌다가 요즘 들어 현대에... ",최선웅의 게임 이야기,https://blog.naver.com/sun0799dh,20210317
<b>모바일</b>RPG 프린세스 테일 해보니 신작<b>모바일게임</b> 중 으뜸!,https://blog.naver.com/114632?Redirect=Log&logNo=222349662415,소냉순입니다 : ) <b>게임</b>펍에서 지난 10일 신작<b>모바일게임</b> '프린세스 테일'을 한국을 포함한 글로벌... 끝으로 이렇게 신작<b>모바일게임</b> 중 가장 돋보였던 <b>모바일</b>RPG 프린세스 테일을 만나보셨는데 어떠셨나요?... ,소냉순,https://blog.naver.com/114632,20210513
제2의나라 스노우 필터 등장 &amp; 내 얼굴을 <b>모바일게임</b> 기대작... ,https://blog.naver.com/cowai?Redirect=Log&logNo=222321093628,"그동안 넷마블이 쌓아온 <b>게임</b> 개발 노하우와 완성도가 집결된 최고의 <b>모바일게임</b> 기대작인 만큼 여러모로 신경을 많이 쓴 흔적들이 보인다. 무엇보다 지브리 느낌의 애니메이션 그래픽, 그리고 음악의 거장... ",cowai 코와잉,https://blog.naver.com/cowai,20210424
"혼 프리뷰, 곽도원 최민식 홍보 모델의 출시예정 <b>모바일게임</b>",https://blog.naver.com/seon_me?Redirect=Log&logNo=222296710211,"삼국지를 기반으로 하는 RPG 장르의 <b>모바일게임</b>으로, <b>게임</b> 기본 특징으로 최대 16명의 장수 동시 출전 가능, 장수/군사/병종을 통해 자신만의 전략 및 전술 구사, <b>게임</b> 내 다양한 콘텐츠 등을 내세웠는데요. 지난... ",선미현지의 감성공간,https://blog.naver.com/seon_me,20210405
"만 가지 삼국지 전략의 조합, 신작<b>모바일게임</b> 삼국지 혼 CBT 후기",https://blog.naver.com/1024kby?Redirect=Log&logNo=222277920069,<b>게임</b>을 플레이하기 전에는 전략 RPG 요소가 솔직히 어떤 형태로 구현되었을지 짐작되지 않았다. 과거 경험했던 신작<b>모바일게임</b> 들의 가위바위보 형식의 상성 관계로는 전략 RPG라는 이름을 쓰기 부족하다고... ,핫세의 두번째 이야기,https://blog.naver.com/1024kby,20210316
<b>모바일게임</b> 수집형RPG 빛의 계승자 다크판타지 해보시죠.,https://blog.naver.com/fun3200?Redirect=Log&logNo=222303778462,엄청 빡실 거 같기도 하고 ㅋㅋ 이제 곧 있으면 날씨가 더워질텐데 더위를 식히려면 밝은 <b>게임</b>보다는 으스스하고 무시무시한 친구들이 나오는 <b>모바일게임</b>을 하는게 좋겠죠? 다양한 클래스와 속성을 고려해서... ,사라한,https://blog.naver.com/fun3200,20210409
<b>모바일게임</b>순위 -1월 첫째주,https://blog.naver.com/useful1102?Redirect=Log&logNo=222204381947,21년 1월 첫째주 <b>모바일 게임</b> 총평 1월 첫째주는 블리치 : 만해의길과 찐삼국 두 신규<b>게임</b>의 약진이 돋보였던 한주로 둘다 10권내로 랭크되면서 신규<b>게임</b>의 저력을 보여주고 있습니다. 반면 TOP30... ,생각들이 모여 철학이 된다.,https://blog.naver.com/useful1102,20210111
[<b>모바일게임</b>리뷰] 그랑사가 (GRAN SAGA),https://blog.naver.com/zzminuda?Redirect=Log&logNo=222221508998,△ '그랑사가' 다운로드 링크 (구글플레이) △ '그랑사가' 다운로드 링크 (애플 앱스토어) △ '그랑사가' PC 버전 다운로드 링크 (공식사이트) #<b>게임</b> #<b>모바일게임</b> #<b>게임</b>리뷰 #<b>모바일게임</b>리뷰 #인기<b>모바일게임</b>... ,늘늘 블로그,https://blog.naver.com/zzminuda,20210127
<b>모바일게임</b>추천 킹스레이드 더 파이널 업데이트 초대박 보상!,https://blog.naver.com/114632?Redirect=Log&logNo=222371983441,<b>모바일게임</b>추천 킹스레이드가 좋은 점은 전투 인<b>게임</b>에서 코스튬이 바로 적용된다는 거죠+_+ 그리고 킹스레이드 코스튬에서 정말 놀랐던 것은 '부위별 코스튬'이 있다는 사실! 자주 언급되는... ,소냉순,https://blog.naver.com/114632,20210528
X2: 이클립스 ARPG <b>모바일게임</b>사전예약 어떤 <b>게임</b>일까?,https://blog.naver.com/best03077?Redirect=Log&logNo=222376950744,X2: 이클립스는 ARPG 장르이기 때문에 캐릭터를 조작하면서 성능을 시험해보는 재미가 있는 <b>게임</b>. 정식 런칭 후에 모든 캐릭터들을 사용해보고 싶네요. X2: 이클립스 <b>모바일게임</b> 사전예약 X2: 이클립스는 현재... ,KBROS BLOG,https://blog.naver.com/best03077,20210531
[<b>모바일게임</b>리뷰] 포켓몬 스마일 (교육),https://blog.naver.com/zzminuda?Redirect=Log&logNo=222013050827,△ '포켓몬 스마일' 다운로드 링크 (구글플레이) △ '포켓몬 스마일' 다운로드 링크 (애플 앱스토어) #<b>게임</b> #<b>모바일게임</b> #<b>게임</b>리뷰 #<b>모바일게임</b>리뷰 #신작<b>모바일게임</b> #<b>모바일게임</b>추천 #교육용<b>게임</b> #이닦기... ,늘늘 블로그,https://blog.naver.com/zzminuda,20200626
톰과 제리: 체이스! 커플 또는 아이와 할만한 캐주얼 <b>모바일게임</b>,https://blog.naver.com/meniereman?Redirect=Log&logNo=222287322144,"제작된 <b>모바일게임</b>입니다. 워너브라더스 공식 라이선스를 체결하여, 원작의 캐릭터성과 주요 콘셉트는... 형태의 <b>게임</b>으로 만들어졌습니다. 완벽한 IP의 재구현이라는 말이 아깝지 않을 정도인데요. 이미... ",매니에르의 게임 블로그,https://blog.naver.com/meniereman,20210325
트릭스터M 출시일 전 직업 공략 및 <b>모바일 게임</b> PC로 하기 좋은... ,https://blog.naver.com/nightd?Redirect=Log&logNo=222284261630,필자가 관심을 가진 이유는 서두에 얘기했듯이 애니풍의 <b>게임</b>이면서도 MMORPG 장르이기 때문이다. 트릭스터M <b>모바일 게임</b>은 이미 온라인을 통해서 익히 알려져 있는 유명한 <b>게임</b>이다. 그래서 현재 사전예약 또한... ,스마트 라이프 연결고리,https://blog.naver.com/nightd,20210322
최신<b>모바일게임</b> 원펀맨: 최강의남자 출시까지 단 하루... ,https://blog.naver.com/fun3200?Redirect=Log&logNo=222276361248,"근데 원펀맨: 최강의 남자는 CBT에 참여해보니, 등장하는 캐릭터 구성부터 캐릭터별 보이스, 캐릭터들이 사용하는 스킬 효과, 원작 스토리를 담은 <b>게임</b> 콘텐츠까지 기대 이상이었다. 최신<b>모바일게임</b> 원펀맨... ",사라한,https://blog.naver.com/fun3200,20210315
신작 <b>모바일게임</b> 추천 디케이<b>모바일</b> 룬시스템 &amp; 감옥 공략,https://blog.naver.com/ideungam?Redirect=Log&logNo=222296431821,"다양한 즐길 거리를 담고 있는 2021년 상반기 신작 <b>모바일게임</b> 추천 디케이<b>모바일</b>이 정식 출시 후, 구글 플레이 <b>게임</b> 매출 순위에 안착하며 호조의 출발을 시작했습니다. 본작은 그동안 많은 인기를 얻었던 정통... ",게임앤리뷰,https://blog.naver.com/ideungam,20210402
미소녀<b>게임</b> 백야극광 <b>모바일게임</b> 사전예약 프리뷰,https://blog.naver.com/tsuken?Redirect=Log&logNo=222342638570,신작 <b>모바일 게임</b>을 기다려보는 것을 강력 추천한다. 바로 미소녀<b>게임</b> 백야극광이다. 백야극광은 일단 <b>모바일</b> 전략 RPG를 내포하고 있는 <b>게임</b>으로 보통 전략 RPG를 떠올리면 단순한 캐릭터들의 턴제 방식의... ,츠켄의 게임노트,https://blog.naver.com/tsuken,20210508
<b>모바일게임</b>순위 -2월 셋째주,https://blog.naver.com/useful1102?Redirect=Log&logNo=222252562887,나가는 <b>게임</b>사의 모습을 보여주고 있는데요. NC소프트의 <b>모바일</b>기대작 트릭스터M과 블소2를 제외하곤... 21년 2월 셋째주 <b>모바일게임</b> 총평 기타 순위권내의 <b>게임</b> 소식으로는 포켓몬고가 출시 25주년을 앞두고... ,생각들이 모여 철학이 된다.,https://blog.naver.com/useful1102,20210222
"<b>모바일게임</b> 추천, 블리치 만해의길 플레이하고 PS5 받는 방법?",https://blog.naver.com/puck1001?Redirect=Log&logNo=222300799046,<b>모바일게임</b> 추천 <b>게임</b> 내 일러스트는 원작을 그대로 사용해 블리치를 좋아하는 게이머라면 누구나 선호할 수밖에 없는 형식이다. 필자가 블리치 만해의길을 좋아하는 또 다른 이유는 바로 원작의 이야기를... ,인플루언서 뽀열,https://blog.naver.com/puck1001,20210406
"원펀맨 최강의 남자 등급표 공략, 전략<b>모바일게임</b> 런칭 소식과... ",https://blog.naver.com/dbsgns2011?Redirect=Log&logNo=222283665034,이 <b>게임</b>도 역시 강력한 히어로들을 조합하는 전략<b>모바일게임</b>의 형식을 취하고 있기 때문에 어떤 히어로가 상위 티어에 해당되는지에 대해 곰곰이 생각해볼 필요가 있습니다. 각 히어로마다 스킬도 다양한... ,청비대제(청룡비둘기)의 휴식공간,https://blog.naver.com/dbsgns2011,20210322
<b>모바일게임</b>순위 무료 2월 말 주말에 할만한 것들 간략하게보시죠.,https://blog.naver.com/fun3200?Redirect=Log&logNo=222256780596,"아마 <b>모바일게임</b>을 하시는 분들이라면 작년부터? 구글플레이나 앱스토어, 원스토어 등 엄청난 <b>게임</b>들이 대거 등장을 한 것을 아실 겁니다. 저 또한 <b>게임</b>을 좋아하고 많이 즐기려고 하고 있지만 정말 물밀듯이... ",사라한,https://blog.naver.com/fun3200,20210226
<b>모바일게임</b> 블레이드앤소울2 사전 캐릭터 생성 및 미니<b>게임</b>... ,https://blog.naver.com/rkdgns4517?Redirect=Log&logNo=222338213321,신작<b>모바일게임</b>은 첫 스타트가 중요한 법! 정식 출시를 앞두고 있는 블레이드앤소울2 캐릭터&amp;문파 사전생성 그리고 미니<b>게임</b> 보상 혜택들을 두둑하게 챙겨보기 바란다. 약속 의상과 독초거사의 선물 주머니가... ,G조커의 인생게임,https://blog.naver.com/rkdgns4517,20210505
<b>모바일게임</b> - 던전 기사 키우기 - 방치형 <b>게임</b>,https://blog.naver.com/nohight?Redirect=Log&logNo=222303945594,"방치형 <b>모바일게임</b> - 던전 기사 키우기를 소개해볼까 해요! 핸드폰 붙잡고 있기 힘든 요즘, 일이 많은 분들은 대부분 방치형 <b>게임</b>을 많이 선호하시는데요. 저도 비슷하게 방치형과 컨트롤형을 번갈아 가면서... ",권블권블,https://blog.naver.com/nohight,20210409
엘's <b>모바일게임</b>순위 분석 (21년2월2주차),https://blog.naver.com/sachiel5?Redirect=Log&logNo=222240665681,이야기 해봤는데 신작들 활약이 좋은 거 같다. <b>게임</b>성도 점점 진화하는 듯 하여 보기가 좋은데 계속해서 좋은 <b>게임</b> 나와서 <b>모바일게임</b>시장 더 치열해졌으면 한다. 그래야 좋은 <b>게임</b> 많이 나오니깐요~,사키엘의 블로그,https://blog.naver.com/sachiel5,20210211
"파이널기어 후기 리세마라 추천 캐릭터, 대작 <b>모바일게임</b>추천",https://blog.naver.com/doek11?Redirect=Log&logNo=222366626438,덕후 유저들 사이에서 가장 큰 관심을 받고 있는 대작<b>게임</b> 파이널기어가 정식 론칭했다. 미즈키 나나가... 지금 달리는 사람도 많고 특장점이 뚜렷해서 <b>모바일게임</b>추천 해드리기에 손색이 없다고 본다.... ,네오필 블로그,https://blog.naver.com/doek11,20210525
서머너즈워 백년전쟁 출시일 <b>모바일게임</b> 사전예약,https://blog.naver.com/ggs0011?Redirect=Log&logNo=222256531885,정말 기대되는 실시간 대전 <b>게임</b> 컴투스의 서머너즈워 백년전쟁은 &quot;서머너즈워&quot; IP를 기반으로 제작된 <b>모바일게임</b> 출시 예정 <b>게임</b>으로 실시간으로 8:8 대전의 전략 <b>게임</b>입니다. 글로벌 인기를 받고 있는... ,태디의 게임뉴스,https://blog.naver.com/ggs0011,20210225
<b>모바일게임</b> V4 대규모 업데이트 및 사전등록 소식!,https://blog.naver.com/clubkang?Redirect=Log&logNo=222256339527,2020년 대한민국 <b>게임</b> 대상을 수상한 V4! 가 드디어 <b>게임</b>에 대한 좀더 심도 있는 이야기와 앞으로의... 엘튼 장비 - 신성 엘튼 장비에 이어 드디어 <b>모바일 게임</b> V4의 최고 아이템이 등장하게 됩니다. 각 랭커들과... ,워터포르의 디지털 시간여행&와포TV,https://blog.naver.com/clubkang,20210225
<b>모바일게임</b>추천 명일방주 아미야 가드 &amp; 머드락 등장!,https://blog.naver.com/doek11?Redirect=Log&logNo=222335759331,"<b>모바일게임</b>추천을 해드릴 겸, 자세한 업데이트 내용들을 정리해볼까 한다. 신규 에피소드 기념 영상과... <b>게임</b> 내 구매센터에서 구매가 가능하다. 기간 한정 출석체크와 무료 헤드헌팅의 기회 지금 명일방주에... ",네오필 블로그,https://blog.naver.com/doek11,20210503
삼국지 혼 CBT 후기 &amp; 6배속이 가능한 신작<b>모바일게임</b>,https://blog.naver.com/doek11?Redirect=Log&logNo=222278691113,얼마 전 사전예약을 시작했던 신작<b>모바일게임</b> 삼국지 혼이 CBT를 시작했다는 소식이다. 사실 11일에... 강조되는 <b>모바일</b>RPG다. &quot;요새 안 그런 <b>게임</b>이 어딨어요?&quot;라고 물을 수 있지만 이 <b>게임</b>은 좀 더 특별하다고... ,네오필 블로그,https://blog.naver.com/doek11,20210317
신작 <b>모바일게임</b> 추천 AFK배틀 누구나 쉽게 즐기는 수집형RPG,https://blog.naver.com/sweetk2ss?Redirect=Log&logNo=222292962955,오늘 여러분들에게 소개해드릴 신작 <b>모바일게임</b> 추천 <b>게임</b>은 AFK배틀이라는 <b>게임</b>입니다. 이 <b>게임</b>은 아기자기한 그래픽을 토대로 200종이 넘는 귀여운 영웅들이 등장하는 수집형RPG로 3월 18일에 구글 플레이... ,도찌의블로그,https://blog.naver.com/sweetk2ss,20210330
인기<b>모바일게임</b>추천 기적의검 X 외모지상주의 콜라보레이션... ,https://blog.naver.com/zkvpdls0536?Redirect=Log&logNo=222367480977,"한동안 업데이트가 뜸해서 심심하게 느껴지던 인기<b>모바일게임</b>추천 기적의검에 뜻밖의 콜라보레이션... 다양한 <b>게임</b> 아이템은 물론 외모지상주의 프로필 테두리, 말풍선 한정 보상까지 받을 수 있을 것으로... ",카페인의 게임 라이브러리™,https://blog.naver.com/zkvpdls0536,20210526
"롤플레잉 신규<b>모바일게임</b> 여왕천하, 편하게 집에서 할 수 있는... ",https://blog.naver.com/ideungam?Redirect=Log&logNo=222368486631,<b>모바일 게임</b>의 저변이 넓어짐에 따라 유저층 역시 점점 세분화되고 있습니다. 최근 사전예약을 진행 중인 <b>게임</b>들을 보면 다양한 성향을 가진 게이머들의 참여가 많다는 기사를 자주 접할 수 있습니다. 그에 따라... ,게임앤리뷰,https://blog.naver.com/ideungam,20210526
할만한<b>모바일게임</b> 추천 로드<b>모바일</b> 서현숙 안지현 화보집... ,https://blog.naver.com/gpicture?Redirect=Log&logNo=222335583140,"응원하실 치어리더의 진영 선택 버튼을 클릭하여 '로드<b>모바일</b>' <b>게임</b>을 다운로드 및 실행하고 서현숙 치어리더나 안지현 치어리더 연맹에 가입하시면 됩니다. 로드<b>모바일 게임</b> 설치, 실행 후 우측 하단에... ",이쁜이기린의 리뷰 세상,https://blog.naver.com/gpicture,20210503
"<b>모바일게임</b>신작 삼국지 혼 사전예약, 모델 곽도원 발탁",https://blog.naver.com/dewichien?Redirect=Log&logNo=222280861180,여러모로 방송용으로도 나쁘지 않은 <b>게임</b>이었다. <b>모바일게임</b>신작들 중에서는 '변수'가 상당히 많아 보였기 때문이다. 그리고 일러스트 역시 준수한 퀄리티를 보여주고 있어 수집의 유혹도 꽤나 높은 편이었다.... ,절망에 복종하라!,https://blog.naver.com/dewichien,20210319
"드래곤라자 오리진, 대한민국 No.1 판타지 소설 <b>모바일 게임</b>... ",https://blog.naver.com/obama8775?Redirect=Log&logNo=222380796243,1 판타지 소설 드래곤라자 오리진이 <b>모바일 게임</b>으로 재탄생을 예고했습니다. 2016년 드래곤라자M으로... 된 <b>모바일</b> 사전예약 <b>게임</b> 드래곤라자 오리진. 다시 만날 그날을 기대하며 열심히 소설 정주행에 한번... ,선비의 엣헴블로그,https://blog.naver.com/obama8775,20210602
<b>모바일 게임</b>은 안녕~ 마인크래프트 보드<b>게임</b> 빌더스&amp;바이옴,https://blog.naver.com/moymoy?Redirect=Log&logNo=222015518507,이야기들 부모님과 대화를 거의 하지 않는 중딩이가 이 <b>게임</b>을 온가족이 하면서 신나서 말이 많이졌다는 이야기도 들려오고요 <b>모바일게임</b> 삼매경인 초딩이가 이 <b>게임</b>을 하면서 <b>모바일 게임</b>은 잠시... ,마더스고양이네 즐거운이야기,https://blog.naver.com/moymoy,20200629
신작<b>모바일게임</b> 제2의 나라 과금없이 플레이 가능할까? 확률형... ,https://blog.naver.com/ddihw?Redirect=Log&logNo=222316656667,올초부터 시작된 국내 <b>게임</b>사들에 대한 확률아이템 사건으로 인해 상반기에 출시되는 신작<b>모바일게임</b>들에 대해 관심이 쏠리고 있는 상황입니다. 특히나 넷마블은 더욱 신경이 쓰일텐데요. 블레이드앤소울2도... ,변검,https://blog.naver.com/ddihw,20210421
