title,link,description,bloggername,bloggerlink,postdate
<b>종교활동</b>-대전요양원,https://blog.naver.com/hs4035111?Redirect=Log&logNo=221868619519,#대전요양원#요양원#도마동요양원#대전서구도마동요양원#요양원프로그램#사회적응프로그램#<b>종교활동</b>#최우수A등급# 사회적응 프로그램 중 <b>종교활동</b>입니다 <b>종교활동</b>을 통해 시설 생활로 인한 우울감 해소와... ,대전요양원 A등급 최우수기관,https://blog.naver.com/hs4035111,20200323
[서울근교요양병원] 더원요양병원 9월 4주 <b>종교활동</b>(기독교활동),https://blog.naver.com/theone9834?Redirect=Log&logNo=221663552389,[서울근교요양병원] 더원요양병원 9월 4주 <b>종교활동</b>(기독교활동) 안녕하세요. 서울근교요양병원 더원요양병원 사회복지사입니다.^^ 오늘은 기독교 <b>종교활동</b> 시간입니다. 어느새 가을이 되어 이제 추위가... ,환자가 먼저인 더원요양병원!,https://blog.naver.com/theone9834,20190930
&lt;2월 1주차&gt; <b>종교활동</b>(1),https://blog.naver.com/hatsal2014?Redirect=Log&logNo=220925277390,1 &quot;<b>종교활동</b>-예배&quot; 오늘은 <b>종교활동</b>으로 기독교 예배를 드리는 시간을 가졌습니다. 장안밀알교회 목사님께서 매주 수요일마다 저희 병원에 방문해주셔서 어르신들을 위해 예배를 드려주고 계십니다. 목사님... ,햇살요양병원,https://blog.naver.com/hatsal2014,20170202
&lt;6월 1주차&gt; <b>종교활동</b>,https://blog.naver.com/hatsal2014?Redirect=Log&logNo=220730852890,3 &quot;<b>종교활동</b>-예배&quot; 오늘은 <b>종교활동</b>으로 기독교 예배를 드리는 시간을 가졌습니다. 목사님의 기도로 예배가 시작되었습니다. 오늘은 보호자분도 참여하여 어르신들과 함께 예배를 드렸습니다. 박수를 치며... ,햇살요양병원,https://blog.naver.com/hatsal2014,20160608
[경기요양병원] 더원요양병원 8월 2주 <b>종교활동</b>(기독교활동),https://blog.naver.com/theone9834?Redirect=Log&logNo=221621361468,"[경기요양병원] 더원요양병원 8월 2주 <b>종교활동</b>(기독교활동) 안녕하세요. 더원요양병원 사회복지사입니다.^^ 매주 일요일, 기독교활동 예배 시간인데요~ 오늘도 많은 분들이 참석해주셨네요. 인원 수가... ",환자가 먼저인 더원요양병원!,https://blog.naver.com/theone9834,20190819
13. 04.10 <b>종교활동</b>,https://blog.naver.com/rapasilver?Redirect=Log&logNo=70165553817,2013. 04.10 <b>종교활동</b>,라파재활주간보호센터,https://blog.naver.com/rapasilver,20130412
마노요양원 <b>종교활동</b> - 수요예배,https://blog.naver.com/mahnomed?Redirect=Log&logNo=221388575377,"마노요양원 <b>종교활동</b> - 수요예배 안성 방주교회 정해용 목사님께서 어르신들을 위해 수요예배를 진행해 주셨습니다. 찬송가 424장, 495장, 470장을 찬양하시고 ‘다툼은 다르기 때문이다.’라는 주제로... ",마 노 의 료 재 단 [031.677.7582],https://blog.naver.com/mahnomed,20181031
분당센트럴요양병원_ <b>종교활동</b> 9월 천주교 봉성체,https://blog.naver.com/nabackna?Redirect=Log&logNo=221663924631,매월 셋째주 목요일 천주교 <b>종교활동</b> 시간입니다 ^^ 이매동 성바오로 성당에서 신부님과 봉사자분들이 오셔서 천주교 신자이신 환자분들을 위해 병자 영성체와 기도를 해주십니다. 거동이 불편하신... ,분당 센트럴 재활요양병원,https://blog.naver.com/nabackna,20190930
- <b>종교활동</b>시간♥,https://blog.naver.com/nyj_skyedu?Redirect=Log&logNo=221769041346,남양주스카이에듀학원에서는 매주 일요일마다 희망자에 한해 <b>종교활동</b>을 진행하고 있습니다. 목사님께서 아이들의 <b>종교활동</b>을 도와주고 계시는데요 :) 우리 재원생들에게 의미있는 시간이 되었으면... ,남양주 스카이에듀 기숙학원,https://blog.naver.com/nyj_skyedu,20200112
"&quot;朴, 독방서 일절 안 나온다…<b>종교활동</b>·가족접견 다 거부&quot;",https://blog.naver.com/kbg0101?Redirect=Log&logNo=221431066123,"&quot;朴, 독방서 일절 안 나온다…<b>종교활동</b>·가족접견 다 거부&quot; [중앙일보] 입력 2018.12.30 14:32 수정 2018.12.30... 운동에도 안 나오고 목욕도 안 하고 일주일에 한 번 있는 <b>종교 활동</b>에도 안 온다. 가족 접견도 안... ",自由思想,https://blog.naver.com/kbg0101,20181231
일상 속 체육활동과 <b>종교활동</b>,https://blog.naver.com/jongroedu1?Redirect=Log&logNo=100194939783,일상 속 체육활동과 <b>종교활동</b> 안녕하세요! 오늘은 용인종로학원의 다양한 활동에 대해 알려드리고... 다양한 학생들이 함께 사는 만큼 다양한 종교도 있기 마련이죠. 그래서 학원내에서 주말에 다같이 교실에... ,용인종로기숙학원 공식블로그입니다.,https://blog.naver.com/jongroedu1,20130827
"기도형 <b>종교</b>, 더 이상 ....",https://blog.naver.com/gaffe?Redirect=Log&logNo=222257296818,"인경 스님 &quot;기도형 종교, 더 이상 먹히지 않는 시대 온다&quot; 기사입력 2019.07.08. 오전 7:36 최종수정 2019.07.08.... 소통하는 활동 중심의 운영이 돼야 하지 않을까. 실질적 명상 중심의 <b>종교 활동</b>이어야 하지 않을까.... ",gaffe님의 블로그,https://blog.naver.com/gaffe,20210226
<b>종교활동</b>,https://blog.naver.com/rapasilver?Redirect=Log&logNo=70152040855,<b>종교활동</b> 2012. 11. 14 <b>종교활동</b>을 통하여 은혜로운 시간을 가지시며 함께 예배를 들이시는 어르신들간의 유대관계 형성에 도움이 됩니다,라파재활주간보호센터,https://blog.naver.com/rapasilver,20121123
온라인 <b>종교활동</b> 지원,https://blog.naver.com/yerimess?Redirect=Log&logNo=222070693902,온라인 <b>종교활동</b> 지원 https://youtu.be/EMN03P745FU 코로나19 바이러스 확산 방지를 위해 중소 종교단체의 온라인 <b>종교활동</b>을 지원합니다. 자세한 내용은 ▶ https://bit.ly/3aHXKHA... ,예림의집,https://blog.naver.com/yerimess,20200825
"정부, 온라인 <b>종교활동</b> 지원 &quot;영상 송출용 데이터 무제한&quot;",https://blog.naver.com/jch4512?Redirect=Log&logNo=221896080077,과학기술정보통신부와 문화체육관광부는 자체 온라인 <b>종교활동</b>이 어려운 200인 이하 중소 종교단체를 대상으로 스마트폰 기반 영상 촬영과 송출에 필요한 데이터 및 통신 환경을 지원하고 이용 방법을... ,jch4512님의 블로그,https://blog.naver.com/jch4512,20200407
광주 3단계 사회적 거리두기 행정명령 <b>종교</b> 모임 다중시설... ,https://blog.naver.com/ijoao?Redirect=Log&logNo=222072662719,"27 낮 12시 ~ 9월 10일 낮 12시 이에 따라, 광주시 모든 교회 등 종교시설에 집합금지 행정명령을 내려졌습니다. (비대면 온라인 <b>종교 활동</b>만 허용, 그 모임과 활동은 일절 금지) 대학이 운영하는 체육관을 포함한... ",웃는햇님,https://blog.naver.com/ijoao,20200827
&lt;4월 2주차&gt; <b>종교활동</b>(2),https://blog.naver.com/hatsal2014?Redirect=Log&logNo=220982150328,12 &quot;<b>종교활동</b>-예배&quot; 오늘은 <b>종교활동</b>으로 기독교 예배를 드리는 시간을 가졌습니다. 장안밀알교회 목사님께서 매주 수요일마다 저희 병원에 방문해주셔서 어르신들을 위해 예배를 드려주고 계십니다.... ,햇살요양병원,https://blog.naver.com/hatsal2014,20170413
6월  4주(금) <b>종교활동</b>,https://blog.naver.com/sukmun7785?Redirect=Log&logNo=222012948684,오늘은 화산교회 목사님과 함께 기도하고 예배하는 시간을 가져봤어요~~ #석문노인복지센터 #석문요양원 #화산교회 #<b>종교활동</b>,석문노인복지센터.석문요양원,https://blog.naver.com/sukmun7785,20200626
"삿 6:17-24, <b>종교</b>냐 기독교냐",https://blog.naver.com/hanrasan12?Redirect=Log&logNo=222436076633,"“기독교는 종교가 아니다.” 그런데 많은 사람은 하나님과의 만남을 <b>종교 활동</b>으로 전락시켜버립니다. 우리는 하나님을 만나고, 하나님의 뜻을 세상 가운데 펼치는 것이 우리의 참 목표입니다. 그것이... ",뿌리깊은 나무 한라산,https://blog.naver.com/hanrasan12,20210718
[도봉구요양원 / A+도봉재활요양원] <b>종교</b>지원<b>활동</b>,https://blog.naver.com/dobong5704?Redirect=Log&logNo=221291366331,"재활요양원, 재활프로그램, 재활치료, 노인재활, 실버재활, 재활, 중풍, 치매, 파킨슨, 알츠하이머, 고혈압, 당뇨 요양원 <b>종교활동</b>, 요양원종교지원, 요양원봉성체, 요양원성당, 요양원교회, 요양원예배",A+도봉재활요양원-도봉구요양원 02)3494-6101,https://blog.naver.com/dobong5704,20180605
마노요양원 <b>종교활동</b> - 수요예배,https://blog.naver.com/mahnomed?Redirect=Log&logNo=221398822542,"마노요양원 <b>종교활동</b> - 수요예배 안성 방주교회 정해용 목사님께서 사도신경 낭송을 시작으로 수요예배를 진행해 주셨습니다. 찬송가 85장, 93장, 91장, 432장을 함께 부르시고 로마서 23장 23절, 로마서 5장... ",마 노 의 료 재 단 [031.677.7582],https://blog.naver.com/mahnomed,20181115
<b>종교활동</b>~~,https://blog.naver.com/cafri1004?Redirect=Log&logNo=60126192122,<b>종교활동</b>~~ 이태원이라는 특성상 여러민족이 많이 살다보니.. <b>종교활동</b>도 상상을 초월한다.. 이날은 경찰도 도로에서 호위?해주었당.. 어쩌다 여러나라의 종교선교가 한꺼번에 시작되면 아주 가끔은 무섭다..^^;;,이태원 이야기,https://blog.naver.com/cafri1004,20110319
마노요양원 <b>종교활동</b> - 수요예배,https://blog.naver.com/mahnomed?Redirect=Log&logNo=221393474915,"마노요양원 <b>종교활동</b> - 수요예배 안성 방주교회 정해용 목사님께서 찬송가를 시작으로 수요예배를 진행해 주셨습니다. 찬송가 28장, 123장, 444장을 함께 부르시고 창세기 3장 1절~5절을 주제로 말씀을... ",마 노 의 료 재 단 [031.677.7582],https://blog.naver.com/mahnomed,20181108
<b>종교</b>단체 교회 사찰 기부금영수증 발행과 고유번호증,https://blog.naver.com/withusv?Redirect=Log&logNo=222436133375,"경우라면 <b>종교활동</b>을 지원하기 위한 취지로 해당 종교단체가 교단 교파 등 총회에 소속되어 있음을 입증하는 경우에는 교회, 사찰, 성당 등에서도 기부자가 지출한 현금, 기부금에 대해 소득세법 규정에 따른... ",국민권익 진현행정사 사무소,https://blog.naver.com/withusv,20210718
하늘사이재활주간보호센터 / <b>종교활동</b>,https://blog.naver.com/shm1221?Redirect=Log&logNo=221346048465,매주 어르신들이 기다리는 활동시간 중 한가지가 <b>종교활동</b>시간입니다. 목사님께서 오셔서 기도해주시고 찬송가를 부르며 설교 말씀도 해 주시니 어르신들께서도 너무나 즐거워 하시는 모습이 보입니다.... ,하늘사이 / 주간보호 /방문요양 031 334 1142,https://blog.naver.com/shm1221,20180826
4월  2주(금) <b>종교활동</b>,https://blog.naver.com/sukmun7785?Redirect=Log&logNo=221913145488,"한 주 동안의 즐거웠던 일, 슬펐던 일을 생각하면서 기도하고 찬송가를 부르는 <b>종교활동</b> 시간을 가져봤어요 ~~ #석문노인복지센터 #석문요양원 #<b>종교활동</b>",석문노인복지센터.석문요양원,https://blog.naver.com/sukmun7785,20200417
"<b>종교</b>가 된 정치, 인민의 아편",https://blog.naver.com/shinex99?Redirect=Log&logNo=222097993252,"2015년 한국갤럽 조사에 따르면, 종교를 믿는 한국 여성은 57%, 남성은 44%였다. 실제 개신교회 현장에 가보면 열성적으로 <b>종교 활동</b>을 하는 여성이 체감상 훨씬 많기도 하다. 한국 여성들의 사회적 지위가 그만큼... ",여름 도시,https://blog.naver.com/shinex99,20200923
[<b>종교활동</b>]예배 및 기도,https://blog.naver.com/suncare02?Redirect=Log&logNo=221555071361,병점 새소망 교회서 매주 강도사님과 봉사자님들께서 예배와 어르신들 기도를 해주십니다. 어르신들께 말씀지와 선물까지 늘~~고맙고 감사드립니다. 제가 꽃을 좋아한다고 예쁜 꽃도 사 주셨습니다.감사 합니다.... ,연세엘림요양병원,https://blog.naver.com/suncare02,20190605
[20년귀속 종합소득세] <b>종교</b>인소득 과세대상 '<b>종교</b>관련... ,https://blog.naver.com/she_kim?Redirect=Log&logNo=222337131619,(9) 소속 교회가 없는 목사에게 특별한 설교나 강의활동 없이 국내선교비(복리후생 및 선교활동비)로 매월 일정액을 지급할 때 이것을 종교인소득으로 볼 수 있는지? ☞ 종교인소득은 <b>종교활동</b>과 관련하여... ,풍요집중님의 블로그,https://blog.naver.com/she_kim,20210504
"SNS포교<b>활동</b>, <b>종교</b>평화의 희망을 밝히다",https://blog.naver.com/m924914?Redirect=Log&logNo=70120523341,"SNS포교<b>활동</b>, <b>종교</b>평화의 희망을 밝히다 글로벌 온라인시대, 성직자들의 SNS<b>활동</b> ‘UP' ▲혜민스님 세계 인터넷 인구 20억명, 휴대폰 통신 이용자 30억명 시대. 90년대 pc통신 혁명을 일으키며 등장한 1:1일... ",다시 처음으로 !,https://blog.naver.com/m924914,20111006
"어린이 선교<b>활동</b>,헌법에 의해 보장 받는 <b>종교</b>교육이다",https://blog.naver.com/childmission?Redirect=Log&logNo=150091297164,"이 처럼 어린이 선교원을 통한 어린이 선교 활동, 종교 집회, 종교 교육은 헌법에 의해 보장되고... 선교활동을 위한 어린이 선교원은 <b>종교 활동</b>의 위축과 박해를 야기하는 위헌의 소지가 충분하다고 하여 결국... ",어린이 선교하는 사람들,https://blog.naver.com/childmission,20100803
뿌리요양병원 <b>종교활동</b>,https://blog.naver.com/ppuri0501?Redirect=Log&logNo=221326396886,뿌리요양병원이 <b>종교활동</b>을 진행하였습니다. 휴게공간에 모여 함께 <b>종교활동</b> 시간을 보냈습니다. 모니터에서는 찬송가가 나오고 있네요~^^ 이 시간을 소중하게 보내주신 환자분들과... ,뿌리요양병원,https://blog.naver.com/ppuri0501,20180725
미 국무부 &quot;북한 <b>종교활동</b> 가혹한 처벌 바뀌지 않아&quot;,https://blog.naver.com/decadelater?Redirect=Log&logNo=221996928044,"미 국무부는 이날 발표한 '2019 국제종교자유 보고서'에서 북한 정부는 <b>종교 활동</b>에 참여하는 사람들을 처형하거나 고문, 구타, 체포 등을 통해 계속 가혹하게 다뤄왔다고 밝혔다. 또 한국 비정부기구의 2013년... ",죽정차,https://blog.naver.com/decadelater,20200611
[<b>종교활동</b>] 예배,https://blog.naver.com/suncare02?Redirect=Log&logNo=221601151867,월요예배 봉사자님들께서 오늘 어르신들께 드릴 간식을 사가지고 오셨습니다. 늘~~~미안하고 감사드립니다. 오늘 저희 원장님께서도 어르신들께 간식을 함께 나누어 주고 계십니다. 강도사님 및 봉사자님들... ,연세엘림요양병원,https://blog.naver.com/suncare02,20190731
정치와 <b>종교</b>는 생명을 보호하라,https://blog.naver.com/leejg112?Redirect=Log&logNo=222206696941,"통치권에 보이지 않아 보호 밖에 있고 ,무작정 포교와 <b>종교 활동</b>을 지상 명제로 부르짖는 종교권력 으로 부터도 배제되어 있 다. 주권과 종교는 그들을 보호 하라.",이재구의 세상엿보기,https://blog.naver.com/leejg112,20210114
"&quot;朴, 독방서 일절 안 나온다…<b>종교활동</b>·가족접견 다 거부&quot;",https://blog.naver.com/dima0306?Redirect=Log&logNo=221430512935,"&quot;朴, 독방서 일절 안 나온다…<b>종교활동</b>·가족접견 다 거부&quot; [중앙일보] 입력 2018.12.30 14:32 수정 2018.12.30... 있는 <b>종교 활동</b>에도 안 온다. 가족 접견도 안 한다”고 말했다. 박 전 대통령은 지난해 3월 31일... ",등대마루,https://blog.naver.com/dima0306,20181230
6월  3주(금) <b>종교활동</b>,https://blog.naver.com/sukmun7785?Redirect=Log&logNo=222005918850,오늘은 제일교회에서 사모님이 오셨어요~~ 오늘은 우리 어르신들이 기도가 무엇인지도 들어보고 예배를 갖는 시간을 가졌어요 ~~ #석문노인복지센터 #석문요양원 #<b>종교활동</b>,석문노인복지센터.석문요양원,https://blog.naver.com/sukmun7785,20200619
효사랑전주요양병원 <b>종교활동</b>,https://blog.naver.com/key3615?Redirect=Log&logNo=221312611574,효사랑전주요양병원 <b>종교활동</b> 효사랑전주요양병원 은 매월 중앙성당에서 어르신들을위해 천주교 봉성체 <b>종교활동</b> 를 실시하였습니다 효사랑전주요양병원 <b>종교활동</b> 어르신들이 너무너무 좋아하셔요 매월... ,효사랑전주요양병원 의료사회복지사,https://blog.naver.com/key3615,20180704
&lt;11월 1주차&gt; <b>종교활동</b>,https://blog.naver.com/hatsal2014?Redirect=Log&logNo=221130790014,&quot;<b>종교활동</b>-예배&quot; <b>종교활동</b>으로 기독교 예배를 드리는 시간을 가졌습니다. 매주 수요일마다 장안밀알교회 목사님과 전도사님께서 방문해주셔서 어르신들을 위해 예배를 드려주고 계십니다. 인사를 나누고... ,햇살요양병원,https://blog.naver.com/hatsal2014,20171102
&lt;긴급&gt;거리두기 5단계…마스크·출근·등교·<b>종교활동</b> 어떻게... ,https://blog.naver.com/jongan1024?Redirect=Log&logNo=222132916799,전환 <b>종교</b>시설 1단계부터 '띄어앉기'…2.5∼3단계에선 비대면 원칙 (서울=연합뉴스) 김서영 기자... 아울러 감염 위험이 높은 실외 <b>활동</b> 시 마스크를 착용할 의무가 생긴다. 2단계에서는 100명 이상이 모이는... ,걸어서 지구 한바퀴,https://blog.naver.com/jongan1024,20201101
"수도권 4단계 격상, 사적모임 제한 및 학교, <b>종교</b>시설 비대면 전환",https://blog.naver.com/rain8200?Redirect=Log&logNo=222425361443,"종교인의 경우 전면 비대면 으로 전환되는 점 역시 큰 변화로 느끼실 수 있을 것 같아요. 수도권 4단계... <b>종교활동</b>만 가능, 모임/행사ㆍ식사ㆍ숙박 금지 ※ 무료급식ㆍ공부방 등 취약계층 등 돌봄 활동 운영... ",F R E E N O T E,https://blog.naver.com/rain8200,20210709
위례더효데이케어 5월 23일 <b>종교활동</b> 사진,https://blog.naver.com/hyoday6480?Redirect=Log&logNo=221548721761,부담없이 전화주시고 방문해주세요~ 친절하고 자세히 상담해드립니다~ 백문이 불여일견~!! 031-755-5006 # 데이케어센터 #<b>종교</b> #어르신 유치원 #위례데이케어 #성남데이케어 #치매 #인지<b>활동</b> #어르신케어 #송영서비스,위례더효데이케어센터,https://blog.naver.com/hyoday6480,20190528
6월  2주(금) <b>종교활동</b>,https://blog.naver.com/sukmun7785?Redirect=Log&logNo=221998540204,오늘은 화산교회 목사님이 오셨어요~~ 같이 예배도 드리고 기도도 드리는 시간을 가졌습니다~~ #석문노인복지센터 #석문요양원 #<b>종교활동</b>,석문노인복지센터.석문요양원,https://blog.naver.com/sukmun7785,20200612
민족<b>종교</b>사무처에서 교인들에게,https://blog.naver.com/taichuyoudao?Redirect=Log&logNo=221547931714,"신도들 역시 규정된 종교 장소에 가서 <b>종교 활동</b>에 참여해야 합법적인 활동이다. 그렇지 않다면 위법행위이다. 정상적인 <b>종교활동</b>은 국가 법률의 보호를 받지만, 비정상적인 <b>종교활동</b>은 법의 보호를 받지... ",태초에 말씀이,https://blog.naver.com/taichuyoudao,20190527
"'사이비 <b>종교</b>'라는 표현, 명예훼손은 아니지만 모욕죄 해당한다고?",https://blog.naver.com/naverlaw?Redirect=Log&logNo=221240257330,"재판부는 B교회 소속 어린이들이 종교 지도자를 찬양하는 내용에 대해 &quot;그 행위가 불법적, 비정상적 <b>종교활동</b>이 아닌 이상 <b>종교활동</b> 그 자체를 공개한 것은 명예훼손이 될 수 없다&quot;고 판시했습니다. 재판부는... ",네이버 법률,https://blog.naver.com/naverlaw,20180329
"현대<b>종교</b> 2020년 6월호 - 이요한 구원파, 해외 <b>활동</b> 본격화",https://blog.naver.com/hdjongkyo?Redirect=Log&logNo=222009718572,"타 이단에 비해 잠잠하지만, 꾸준히 교세 확장을 시도하는 생명의말씀선교회를계속해서 주목할 필요가 있다. #이요한 #구원파 #해외 #선교<b>활동</b> #일정 #현대<b>종교</b> #월간현대<b>종교</b> #탁지원 #탁지일",현대종교의블로그,https://blog.naver.com/hdjongkyo,20200623
<b>종교활동</b>,https://blog.naver.com/lucy_99?Redirect=Log&logNo=220505284714,입학하기 전에 <b>종교활동</b>에 대해 관심이 많았는데 이러한 활동을 통해 <b>종교활동</b>에도 차질이 없도록 하게 해주십니다. 혹여나 기숙사학교라 <b>종교활동</b>때문에 걱정되시는 예비 입학생분들 절대... ,한민고등학교 홍보 블로그,https://blog.naver.com/lucy_99,20151011
코로나19 방역보다 <b>종교활동</b>이 우선…보수로 기운 미국 대법원... ,https://blog.naver.com/speedgun2000?Redirect=Log&logNo=222155928021,미 샌페르난도 코로나19 검사소 앞에 줄 선 주민들 [AFP=연합뉴스 자료사진] 종교 단체 측 변호인은 &quot;대법원이 자유로운 <b>종교활동</b>을 보호하기 위해 신속하게 결정해 준 데 감사하다&quot;고 논평했다. 트럼프... ,미스터 리의 인생이모작 프로젝트,https://blog.naver.com/speedgun2000,20201127
[러시아 선교] 외국 출신 <b>종교</b>지도자 <b>활동</b> 어려워져 --- 선교... ,https://blog.naver.com/pragod69?Redirect=Log&logNo=222067773757,종교지도자 활동 어려워져 러시아 하원의회에 해당 법안 제출 러시아에서 외국인 및 해외 유학파 출신 종교 지도자의 러시아 내 <b>종교 활동</b> 참여 및 종교 단체 인도 금지에 관한 법안이 발의되었다고... ,김진수의 블로그,https://blog.naver.com/pragod69,20200822
<b>종교활동</b>-대전요양원,https://blog.naver.com/hs4035111?Redirect=Log&logNo=221787721390,#대전요양원#요양원#요양원프로그램#<b>종교활동</b>#사회적응프로그램# 사회적응 프로그램 중 <b>종교활동</b>입니다 <b>종교활동</b>을 통해 시설 생활로 인한 우울감 해소와 자존감을 회복할 수 있도록 돕고 정서적인 안정과... ,대전요양원 A등급 최우수기관,https://blog.naver.com/hs4035111,20200128
인천요양병원 봉성체 <b>종교 활동</b>,https://blog.naver.com/withme8525?Redirect=Log&logNo=220059628547,"여러가지 <b>종교 활동</b> 중, 오늘은 봉성체 활동 모습을 담아보았습니다. 인천요양병원 봉성체 활동은... 봉성체 활동을 통해 환우분들은 내적으로 마음의 평안과 안정을 얻는 효과가 있습니다. 또한, 종교 의식을... ",위드미 요양병원 블로그,https://blog.naver.com/withme8525,20140714
5월 11일 <b>종교활동</b> 프로그램입니다.,https://blog.naver.com/jsungran1203?Redirect=Log&logNo=220376569736,5월 11일 <b>종교활동</b> 프로그램입니다. 멋지신 목사님의 좋은 말씀과 어르신들을 위해 기도를 해주셨습니다. * 어르신들의 초상권으로 모자이크 한점 양해 부탁드립니다.,실버캐슬요양타운 금천점,https://blog.naver.com/jsungran1203,20150601
한국자유총연맹이 <b>종교</b>특별위원회 <b>활동</b>을 시작합니다,https://blog.naver.com/powerpark514?Redirect=Log&logNo=10096931041,한국자유총연맹이 <b>종교</b>특별위원회 <b>활동</b>을 시작합니다 한국자유총연맹이 국민화합과 따뜻한 자유 실천의 새로운 행보를 내디뎠습니다. 10월 12일 ‘국가와 민족의 미래를 위한 범<b>종교</b>인대회’를 시작으로 연맹... ,대한민국 보수의 중심 박창달,https://blog.naver.com/powerpark514,20101103
6월  1주(금) <b>종교활동</b>,https://blog.naver.com/sukmun7785?Redirect=Log&logNo=221991029940,6월 첫주 사모님과 함께 찬송가도 부르며 예배를 봤답니다 ~~ #석문노인복지센터 #석문요양원 #<b>종교활동</b>,석문노인복지센터.석문요양원,https://blog.naver.com/sukmun7785,20200605
"교육시설 등록해놓고 <b>종교활동</b>…부산 동구, 신천지 세금 추징",https://blog.naver.com/kisscg1101?Redirect=Log&logNo=222019694725,동구는 &quot;당초 신천지가 세금 면제를 신청할 때 <b>종교활동</b>을 한다고 주장해 종교시설로 보고 유예기간을 둔 것&quot;이라며 &quot;2년이 끝나가는 지금 용도와 다르게 쓰고 있다는 사실이 확인돼 세금을 징수하기로... ,지킴이님의블로그,https://blog.naver.com/kisscg1101,20200703
