title,link,description,bloggername,bloggerlink,postdate
"<b>모바일게임</b> 관련주 메타버스 뜻 카카오<b>게임</b>즈, 주연테크... ",https://blog.naver.com/japark6108?Redirect=Log&logNo=222422076119,동사는 <b>모바일</b> 메신저인 '카카오톡'과 포털사이트인 'DAUM' 을 활용해 <b>모바일게임</b>과 PC<b>게임</b>의 퍼블리싱 사업을 영위하고 있습니다. 그리고 다양한 장르의 <b>게임</b>들을 개발하고 있습니다. 새로운 <b>게임</b>을... ,고인돌마을 이장,https://blog.naver.com/japark6108,20210706
<b>모바일게임</b> 파이널 기어 리뷰,https://blog.naver.com/nohight?Redirect=Log&logNo=222413779290,"<b>모바일게임</b> 리뷰 미소녀와 메카닉의 조합 RPG 오늘은 수집형 <b>모바일게임</b> 파이널 기어 리뷰를 해볼까 해요. 요즘 <b>게임</b>할 시간도 없이 바쁘다 보니 간단한 리뷰밖에 못했는데, 이 <b>게임</b>은 할게 정말 많아요. 아마... ",권블권블,https://blog.naver.com/nohight,20210629
인기<b>모바일게임</b> 리니지2M 중립인데 석궁 클래스체인지 해도... ,https://blog.naver.com/subome?Redirect=Log&logNo=222422619231,지난 6월 29일 인기<b>모바일게임</b> 리니지2M에 신규 석궁 클래스가 추가되었다. 원거리에 속사포 같은... 지금까지 인기<b>모바일게임</b> 리니지2M을 하면서 장비 세팅에 걱정 없이 스킬만 잘 맞추면 중간 이상은 따라갈 수... ,봄딩 게임,https://blog.naver.com/subome,20210706
제2의나라 업데이트 정보 및 쿠폰 최신 <b>모바일게임</b> PC로 하기... ,https://blog.naver.com/honestpsc17?Redirect=Log&logNo=222428100164,"또, 이마젠이라고 전투를 지원하는 속성별 3개의 펫과 속성별 3개의 무기를 사용하여 전투의 다양성을 체험할 수 있는 <b>모바일게임</b>이에요. 제2의나라를 처음 보는 유저들의 입장에서 <b>게임</b>이 재미있게... ",꼴뚝,https://blog.naver.com/honestpsc17,20210711
엑솔라(Xsolla)가 말해주는 <b>모바일게임</b> 사업 확장 꿀팁,https://blog.naver.com/dewichien?Redirect=Log&logNo=222433874975,"비교적 적은 투자로 높은 수익을 올릴 수 있고, <b>모바일</b> 플랫폼이 자신들의 아이디어를 보다 쉽게 적용할 수 있기 때문입니다. 물론, <b>모바일게임</b> 생태계가 호락호락하지는 않습니다. 단순히 <b>게임</b>은 '개발'한다고... ",절망에 복종하라!,https://blog.naver.com/dewichien,20210716
신작<b>모바일게임</b> 삼국지군웅전 플레이 후기와 이벤트 정보,https://blog.naver.com/greedady?Redirect=Log&logNo=222433280523,또 하나의 SLG 신작<b>모바일게임</b>이 정식 서비스를 시작했습니다. 아마 '삼국지군웅전'이라는 타이틀만 접해도 원작 IP 기반 전략 <b>게임</b>이라는 걸 어느 정도는 예상해볼 수 있는데요. 일찌감치 연기파 배우 허준호를... ,인포머의 웨어하우스,https://blog.naver.com/greedady,20210716
브롤스타즈 슈팅 <b>모바일 게임</b> 리뷰,https://blog.naver.com/qzfwraruw?Redirect=Log&logNo=222412812217,"오늘은 왠지 여름이랑 잘 어울리는 <b>모바일 게임</b>을 가지고 왔습니다. 바로, &lt;브롤스타즈&gt;인데요. 귀여운 캐릭터와 아기자기한 스킨이 돋보이는, 통통 튀는 매력을 가진 <b>게임</b>입니다. 그리고 모두가 쉽게 할 수... ",굿데이 나이스데이,https://blog.naver.com/qzfwraruw,20210628
신작 <b>모바일게임</b> 드래곤라자 오리진 런칭 후기,https://blog.naver.com/bdh4489?Redirect=Log&logNo=222405625452,"포션과 스킬, 포탈 등을 자동으로 사용할 수 있게 설정을 할 수 있어 <b>모바일게임</b>에 최적화가 되어 있는 모습입니다. 캐릭터 성장 방식 중 정통MMORPG <b>게임</b>이라 느껴지는 부분이 있습니다. 바로 스탯 부분인데... ",게임종결자의 Magazine Games,https://blog.naver.com/bdh4489,20210621
<b>모바일게임</b> 추천 드래곤라자EX 수집형 방치 RPG 소개,https://blog.naver.com/12512512?Redirect=Log&logNo=222423466153,그리고 지난 7월 5일 드래곤라자를 기반으로 한 <b>모바일게임</b> 드래곤라자ex가 출시되었는데요. 원작 속 판타지스러운 이야기들을 <b>게임</b>으로 구현해내기 위해서 노력했다고 합니다. 그래서 오늘은 드래곤라자ex를... ,피스타임 블로그,https://blog.naver.com/12512512,20210707
수집형 RPG <b>모바일게임</b>추천 코노스바 <b>모바일</b> 프리뷰,https://blog.naver.com/tsuken?Redirect=Log&logNo=222433963861,신작 <b>모바일 게임</b>을 출시하는 것보다 원작의 재미있는 요소들을 <b>게임</b> 속으로 그대로 옮겨왔다는 점이 눈에 띈다. 코노스바 <b>모바일</b>의 서비스를 맡은 넥슨은 <b>게임</b> 출시 외에도 애니맥스와 함께 코노스바... ,츠켄의 게임노트,https://blog.naver.com/tsuken,20210716
<b>모바일게임</b>신작 퍼니싱:그레이 레이븐 후기 &amp; 등급표 - ARPG추천!,https://blog.naver.com/jjang986?Redirect=Log&logNo=222432664796,"개인적으로 근래에 출시된 <b>모바일게임</b>신작 중에서 이 정도 액션감을 가진 <b>게임</b>은 없었던 거 같아요.... 또한, 공식 카페 5만 명 달성 기념으로 베스킨라빈스 2만원 <b>모바일</b>쿠폰을 20명에게 주는 이벤트도 새롭게... ",주리오의 겜잇이야기,https://blog.naver.com/jjang986,20210715
신작<b>모바일게임</b> 디 앤츠 정식 출시! 리얼한 개미의 삶!,https://blog.naver.com/114632?Redirect=Log&logNo=222423122117,소냉순입니다 : ) 얼마전에 사전예약 소식으로 만났었던 신작<b>모바일게임</b> 디 앤츠 : 언더그라운드 킹덤이 지난 5일에 정식 출시하였습니다. 디 앤츠는 실제 개미의 리얼하게 그린 전략 시뮬레이션 <b>게임</b>인데요.... ,소냉순,https://blog.naver.com/114632,20210707
ARPG 신규<b>모바일게임</b>추천 퍼니싱:그레이 레이븐 플레이 리뷰,https://blog.naver.com/mastermyth?Redirect=Log&logNo=222432820792,"신규<b>모바일게임</b>추천 작품답게 혜택이 가득한데요. 인 <b>게임</b>뿐만 아니라, 공식 카페에서도 각... 준비된 선물은 베스킨라빈스 <b>모바일</b>쿠폰 20,000원 권으로 20명을 추첨해서 준다고 하니 여러분도 한번... ",겜군의 게임 매뉴얼,https://blog.naver.com/mastermyth,20210715
드래곤라자EX 수집형 방치 RPG <b>모바일게임</b> 추천 꿀잼,https://blog.naver.com/fun3200?Redirect=Log&logNo=222422250695,이영도 작가님의 원작 드래곤라자의 오리지널 스토리를 기반으로 한 <b>모바일게임</b> 드래곤라자EX가... 개발한 <b>모바일</b> 수집형 방치 RPG <b>게임</b>이다 보니 진행하면서 나오는 스토리를 보는 재미가 쏠쏠하다 말씀드릴 수... ,사라한,https://blog.naver.com/fun3200,20210706
<b>모바일게임</b> - 쉐도우 오브 데스 : 어둠의 기사,https://blog.naver.com/nohight?Redirect=Log&logNo=222422364459,<b>모바일게임</b> 리뷰 광고는 지겹지만 플레이는 재미있는 <b>게임</b> 오늘은 시간 때우기 정말 좋은 <b>게임</b> 하나 소개해드릴까 합니다. 횡스크롤 <b>게임</b>의 종류로서 PVP 하는 즐거움이 있는 <b>게임</b>입니다. 바로 쉐도우 오브 데스... ,권블권블,https://blog.naver.com/nohight,20210706
<b>모바일 게임</b> - 마이리틀포레스트 첫플레이기,https://blog.naver.com/wydks119?Redirect=Log&logNo=222434359773,#<b>모바일게임</b> #리틀포레스트 #힐링<b>게임</b> #폰<b>게임</b>추천 #마이리틀포레스트 본격 시골 귀농<b>게임</b>! 마이리틀포레스트를 해봤다 일단 아직가진 만사천원 지르고 열심히 하는 중이다 마이리틀 포레스트 오프닝 곡이... ,겜초초,https://blog.naver.com/wydks119,20210717
"신작<b>모바일게임</b> 삼국지군웅전 직접 해보니, 재밌는데?!",https://blog.naver.com/totogi777?Redirect=Log&logNo=222433558629,"(제발 주세요 ㅠㅠ) 정식 론칭과 함께 푸짐한 이벤트까지 진행 중인 신작<b>모바일게임</b> 삼국지군웅전 소식이었습니다. 직접 <b>게임</b>을 해보니, 삼국지의 매력을 잘 살려서 정말 할만하다는 생각인데요. 더욱이 푸짐한... ",건빵이 블로그,https://blog.naver.com/totogi777,20210716
"인기<b>모바일게임</b> 추천하는 기적의검, 강력한 장비를 획득해보자!",https://blog.naver.com/dewichien?Redirect=Log&logNo=222423945405,요즘 할만한 <b>게임</b> 없다면 주목해주시길 바랍니다 바로 인기<b>모바일게임</b> 기적의검을 추천해드리고자 하는데요. 최근 인기 웹툰인 외모지상주의 콜라보로와 12세 이용가 등급 버전이 추가되어 많은 신규... ,절망에 복종하라!,https://blog.naver.com/dewichien,20210708
'퍼니싱:그레이 레이븐' 액션RPG 신작<b>모바일게임</b>추천 이유는?,https://blog.naver.com/greedady?Redirect=Log&logNo=222431542356,평소 액션RPG 장르에 관심이 있는 분들이라면 '퍼니싱: 그레이 레이븐'은 신작<b>모바일게임</b>추천 대상으로 즐기기 괜찮은 <b>게임</b>입니다. 아마 이번 포스팅에서 언급한 전투 요소를 완벽하게 이해하고 즐긴다면 조금... ,인포머의 웨어하우스,https://blog.naver.com/greedady,20210714
<b>모바일 게임</b> 순위 기대되는 6월 대작 추천,https://blog.naver.com/ggs0011?Redirect=Log&logNo=222398158576,<b>모바일</b> 로그라이트 액션으로 스테이지를 클리어하는 재미 또한 괜찮을 것으로 보였습니다. X2... 최고 매출 <b>모바일 게임</b> 순위 <b>게임</b>명 <b>게임</b>사 1위 리니지M 엔씨소프트 2위 리니지2M 엔씨소프트 3위 제2의나라... ,태디의 게임뉴스,https://blog.naver.com/ggs0011,20210614
"<b>모바일 게임</b> 관련주 넷마블, 우리가 잘 모르는 사실과 주가 전망",https://blog.naver.com/richchild3?Redirect=Log&logNo=222423185302,증권플러스 - 토픽홈 <b>모바일 게임</b> 관련주 7월6일 종가 기준 최근 신규 <b>모바일 게임</b> 출시와 중국 판호(중국 내 <b>게임</b> 서비스 허가) 발급 규제 완화에 대한 기대감에 국내 <b>모바일 게임</b> 관련주 주가가 상승 흐름을... ,킴북이의 주식농장,https://blog.naver.com/richchild3,20210707
세나의달을 맞아 <b>모바일게임</b>순위 상승 도모 중? 세븐나이츠2,https://blog.naver.com/chlguswls063?Redirect=Log&logNo=222431734439,"뭐, 개인사에 따라 조금씩 달라질 수야 있겠지만, <b>게임</b>을 좋아하는 분들이라면 이때 즈음 해서... 출시하며 <b>모바일게임</b>순위 상승을 도모하고 있다고 하는데요. 그래서 오늘은 이와 관련된 내용들을 중심으로... ",Judy's place,https://blog.naver.com/chlguswls063,20210714
신작<b>모바일게임</b> 삼국지군웅전 허준호가 선택한 이유가 있네,https://blog.naver.com/moon_fl?Redirect=Log&logNo=222434249946,"신작<b>모바일게임</b> 삼국지군웅전을 지금 즐겨야 하는 이유!! 인<b>게임</b> 이벤트도 풍성하지만, 공식 카페를 통해 진행되는 이벤트 보상이 상당하기 때문입니다. 인<b>게임</b> 아이템을 획득할 수 있는 이벤트도 준비되어... ",구리구리 꾸리짱~!,https://blog.naver.com/moon_fl,20210716
신작 <b>모바일게임</b> 카카오<b>게임</b>즈 오딘 발할라 라이징,https://blog.naver.com/tsuken?Redirect=Log&logNo=222431571861,"기존 <b>게임</b>과 차원이 다른 퀄리티는 물론, 요즘 등장하는 신작 <b>모바일게임</b>들은 PC에서도 구동이... 하지만 오딘 발할라 라이징은 그런 거짓말 없이 PC와 <b>모바일</b> 각자 플랫폼에서 구동이 가능하고, 특히 PC로... ",츠켄의 게임노트,https://blog.naver.com/tsuken,20210714
"신작<b>모바일게임</b> 디 앤츠, 개미로 펼치는 전략의 재미!",https://blog.naver.com/jjang986?Redirect=Log&logNo=222433674414,"기존까지 SLG <b>게임</b>에서는 이러한 길을 낸 거나 건물을 배치하는 단순히 꾸미기만을 위함이었다면, 신작<b>모바일게임</b> 디 앤츠에서는 실제로 자원을 운반하는 개미들이 영향을 받습니다. 어떻게 길을 내주어야 더... ",주리오의 겜잇이야기,https://blog.naver.com/jjang986,20210716
수집형 방치 RPG <b>모바일게임</b> 드래곤라자EX 플레이 리뷰,https://blog.naver.com/mastermyth?Redirect=Log&logNo=222425093254,"RPG <b>모바일 게임</b>으로서도 완성도 높은 <b>게임</b>성이 느껴졌는데요. 미리 사전예약을 하셨다면 문자를 통해 쿠폰이 전달되었을 겁니다. '드래곤라자EX'로 검색하셔서 찾으시면 되고, 좌측 상단 설정의 서비스에서... ",겜군의 게임 매뉴얼,https://blog.naver.com/mastermyth,20210708
신작 <b>모바일게임</b> SF RPG 탭투갤럭시(Tap To Galaxy) 후기,https://blog.naver.com/playmyworld?Redirect=Log&logNo=222412842010,"우주 배경 SF RPG 부분 방치형<b>게임</b> 탭투갤럭시 신작<b>모바일게임</b> 'Tap To Galaxy' 나만의 전투기로 플레이하자, 안드로이드폰/아이폰 모두 즐길 수 있는 탭투갤럭시, 오랜만에 SF RPG 장르의 <b>모바일게임</b>을... ","IT, 게임, 그리고 육아 이야기",https://blog.naver.com/playmyworld,20210628
수집형 방치 RPG 찾는다면? <b>모바일게임</b> 추천 드래곤라자EX,https://blog.naver.com/rkdgns4517?Redirect=Log&logNo=222423721622,간만에 드래곤라자 오리지널 스토리를 기반으로 만들어진 신규 <b>모바일게임</b>이 출시해 소개를 드릴까... 갖춘 <b>모바일</b> RPG<b>게임</b>이라는 생각이 들었습니다. 캐릭터 수집과 함께 RPG의 재미를 만끽하고 싶으신 분들은... ,G조커의 인생게임,https://blog.naver.com/rkdgns4517,20210707
"<b>모바일게임</b> 추천 드래곤라자EX, 수집형 방치 RPG의 재미... ",https://blog.naver.com/louis0826?Redirect=Log&logNo=222425072692,"소설이나 웹툰을 기반으로 하는 <b>게임</b>들은 그 스토리를 더욱 맛깔나게 즐길 수 있어서 매력적인데, 이영도 작가님의 소설을 베이스로 하는 <b>모바일게임</b> 드래곤라자EX도 그러한 면에서 꽤 이목을 끌고 있는 <b>게임</b>입... ",우박월드,https://blog.naver.com/louis0826,20210708
[가디언테일즈] 무료 100회소환 등급표 &amp; <b>모바일게임</b>추천 이유,https://blog.naver.com/sachiel5?Redirect=Log&logNo=222437383141,"출시 후 지금까지도 완성도 높은 <b>모바일 게임</b>으로 호평 받고 있다. 그동안 <b>모바일</b> 도트 <b>게임</b>이 좀 나오긴 했지만 향수만 자극하고 끝났는데, 이 <b>게임</b>은 스토리부터 시작하여 재미 부분, 여러 기믹들과 패러디로... ",사키엘의 블로그,https://blog.naver.com/sachiel5,20210719
카카오<b>게임</b>즈 오딘 발할라... 육성 공략 신작 <b>모바일게임</b> 대세!,https://blog.naver.com/dewichien?Redirect=Log&logNo=222433969879,"수많은 <b>게임</b>을 플레이해왔지만, 신작 <b>모바일게임</b>을 플레이해보면서 이 정도로 놀랐던 적은... <b>모바일</b>에서 AAA급 퀄리티 그래픽이 돌아가는 광경을 체험하세요. 분명히 여러분이 상상했던 것 이상의 면모를... ",절망에 복종하라!,https://blog.naver.com/dewichien,20210716
레이븐 출시! 신규<b>모바일게임</b>추천 갓겜이 등장하다,https://blog.naver.com/zzminuda?Redirect=Log&logNo=222425949781,신규<b>모바일게임</b>추천작인 퍼니싱:그레이 레이븐은 굉장히 완성도가 높은 <b>게임</b>입니다. 개인적으로 가장 마음에 든 부분은 스토리 입니다. 사실 액션RPG 할 때에는 빠르게 레벨을 올려서 다음 스킬이 보고 싶은... ,늘늘 블로그,https://blog.naver.com/zzminuda,20210709
구글 플레이로 보는 인기 <b>모바일게임</b> 순위 변화(2021년 7월 3주),https://blog.naver.com/greedady?Redirect=Log&logNo=222436022346,<b>게임</b>이 지속적인 상위권 유지를 하고 있는 걸 확인할 수 있습니다. 이번 주 1위를 차지한 피파<b>모바일</b>... 아무래도 구글 플레이 인기 앱/<b>게임</b> 순위로 보는 <b>모바일게임</b> 순위 변화는 신작 출시의 영향을 많이... ,인포머의 웨어하우스,https://blog.naver.com/greedady,20210718
신작<b>모바일게임</b> 디 앤츠: 언더그라운드 킹덤으로 개미군단 공략!,https://blog.naver.com/subome?Redirect=Log&logNo=222429993680,오늘 이처럼 신작<b>모바일게임</b> 디 앤츠에 대해서 이야기해보았는데요. 전략 <b>게임</b>인 만큼 초반보다 점점 성장하고 상대와의 전투가 펼쳐지는 후반이 기대되는 <b>게임</b>이라고 말씀드리고 싶어요. 직접 플레이하면서... ,봄딩 게임,https://blog.naver.com/subome,20210713
출시예정<b>모바일게임</b> 삼국지군웅전에서 천하패권을 장악해볼까,https://blog.naver.com/soary81?Redirect=Log&logNo=222424876598,"천하를 손에 넣기 위한 위대한 혈투를 그려낸 출시예정<b>모바일게임</b>, 삼국지군웅전이 곧 있을 정식... 출시예정<b>모바일게임</b>을 혼자하는 것보다 여럿이서 모여하면 더 즐겁고 재미있기 마련이고, 친한 지인들과... ",소라윙즈의 소소한 IT/게임 리뷰,https://blog.naver.com/soary81,20210708
"<b>모바일게임</b> 카카오<b>게임</b>즈 오딘 발할라 라이징, 인기 <b>모바일</b>... ",https://blog.naver.com/seon_me?Redirect=Log&logNo=222427694791,"신작 <b>모바일게임</b> 카카오<b>게임</b>즈 오딘 발할라 라이징, 인기 <b>모바일</b> RPG <b>게임</b> 언제 어디서나 쉽게 플레이할 수 있다는 점을 특징으로 내세워 <b>모바일게임</b>이 대세를 이루고 있습니다. 휴대성을 살린 <b>모바일</b> 기기를... ",선미현지의 감성공간,https://blog.naver.com/seon_me,20210714
가디언테일즈 1주년 무료 100회소환 총정리 &amp; <b>모바일게임</b> 추천,https://blog.naver.com/cowai?Redirect=Log&logNo=222437344272,완성도 높은 <b>모바일게임</b> 추천 가디언테일즈가 1주년을 맞이하여 무료 100회소환 이벤트를 진행... 하루도 안 빠지고 매일 10일 동안 출석체크하면 추첨을 통해서 <b>게임</b> 굿즈 4종을 받을 수 있다. 비치타올도... ,cowai 코와잉,https://blog.naver.com/cowai,20210719
<b>모바일게임</b> 쿠키런 킹덤 쿠폰 7월 &amp; 쿠킹덤 퓨어바닐라 토핑 공략,https://blog.naver.com/jjang986?Redirect=Log&logNo=222435957576,"<b>모바일게임</b> 쿠킹덤 퓨어바닐라 쿠키는 안 쓰이는 콘텐츠가 없을 정도로 등급표 최상위 티어에... 그순간 파티는 생존력을 잃고 바로 <b>게임</b>이 끝나버리니까, 토핑을 참고하여 최대한 셋팅을 해보시길... ",주리오의 겜잇이야기,https://blog.naver.com/jjang986,20210718
우주 배경의 SF RPG <b>모바일 게임</b> 추천 탭투갤럭시,https://blog.naver.com/mastermyth?Redirect=Log&logNo=222410179964,"우주 배경과 SF RPG, 그리고 기존과 다른 신선한 느낌을 선호하신다면, 2021년 4월 19일 출시된 <b>모바일게임</b> 하나 추천드릴 테니 여기에 주목해보시기를 바랍니다. 바로 '탭투갤럭시'라는 <b>게임</b>인데요. 우주 자원을... ",겜군의 게임 매뉴얼,https://blog.naver.com/mastermyth,20210625
오딘 발할라 라이징 신작 <b>모바일게임</b> 구글플레이 1위 비결은?,https://blog.naver.com/best03077?Redirect=Log&logNo=222432795473,"<b>모바일</b>MMORPG의 새로운 이정표를 제시하다! 오딘 발할라 라이징이 이렇게 많은 사랑을 받고 있는 이유는... 그리스 신화와 삼국지연의와 함께 <b>게임</b>에서 자주 등장하는 세계관이지만, <b>모바일 게임</b>에서는 표현에... ",KBROS BLOG,https://blog.naver.com/best03077,20210715
<b>모바일게임</b>추천 원한다면 무료 100회 소환 지원해주는... ,https://blog.naver.com/foxc987?Redirect=Log&logNo=222432630449,출시 당시 혁신적인 액션 어드벤처 <b>게임</b>으로 <b>모바일게임</b>을 즐겨 하는 유저라면 한 번쯤은 플레이를 해봤을 <b>게임</b>입니다. 저도 이 <b>게임</b>이 출시된 이후부터 지금까지 꾸준하게 플레이를 해오고 있었는데 이번에... ,제목없음,https://blog.naver.com/foxc987,20210715
출시예정<b>모바일게임</b> 삼국지군웅전 출시 전 큰 혜택을 얻을 수... ,https://blog.naver.com/totogi777?Redirect=Log&logNo=222421103871,오늘 소개해드릴 <b>게임</b>은 바로 출시예정<b>모바일게임</b> 삼국지군웅전입니다. 삼국지군웅전은 배우 허준호님을 앞세운 CF 영상이 정말 이슈가 되고 있는 사전예약<b>게임</b>인데요. 개인적으로 삼국지와 이미지가 찰떡인... ,건빵이 블로그,https://blog.naver.com/totogi777,20210705
방치형<b>모바일게임</b> 미니어스 사전예약 고고,https://blog.naver.com/kkodug9?Redirect=Log&logNo=222432935250,"방치형<b>모바일게임</b>의 판도를 바꿀 '미니어스: 작지만 놀라운 모험'이 드디어 사전예약을 시작했습니다. 개인적으로 기대가 큰 <b>게임</b>이기에 서둘러 포스팅을 준비하였는데요. 이미 중국, 대만, 일본 등 해외에서는... ",영원한도시 블로그,https://blog.naver.com/kkodug9,20210715
<b>모바일게임</b>추천 파이널기어 무한런 공략 및 리뷰,https://blog.naver.com/dewichien?Redirect=Log&logNo=222411242604,"파이널기어는 최근 많은 사람들에게 <b>모바일게임</b>추천 <b>게임</b>으로 일컬어지는 중이며, 그만한 퍼포먼스를 보여주고 있다. 1차 업데이트도 마치고, 사람들도 꾸준히 <b>게임</b>에 투자하고 있는 만큼, 지금 신규 진입을... ",절망에 복종하라!,https://blog.naver.com/dewichien,20210627
피플 앤 더 시티 새로운 도시건설 신작 <b>모바일 게임</b> 리뷰(심시티... ,https://blog.naver.com/hyjueng?Redirect=Log&logNo=222430225821,"이렇게 계속 건설하고 재화를 챙기면서 성장해나가는 <b>게임</b>입니다. 즉, 계속 플레이를 하는 헤비한 <b>모바일 게임</b>이 아닌 가끔 접속하여 즐기는 일반적인 도시건설형 <b>모바일 게임</b>이라고 보시면 됩니다. 퀘스트를... ",꿈속에서도 게임을!!,https://blog.naver.com/hyjueng,20210713
"드래곤라자EX, 수집형 방치 RPG로 편하게 즐기는 <b>모바일게임</b>!",https://blog.naver.com/greedady?Redirect=Log&logNo=222423485804,녹여낸 <b>모바일게임</b>으로 누구나 쉽고 편하게 즐길 수 있는 점이 매력 포인트라는 생각이 들기도 합니다. 그리고 이런 특징은 시스템적 요소와 세로형 UI와 잘 어우러지고 있기도 하죠. 보통 원작이 있는 <b>게임</b>은... ,인포머의 웨어하우스,https://blog.naver.com/greedady,20210707
"<b>모바일게임</b>추천 코노스바 <b>모바일</b>, 애니메이션이 <b>게임</b> 속으로!",https://blog.naver.com/mina_100?Redirect=Log&logNo=222422813105,"<b>모바일게임</b>추천 코노스바 <b>모바일</b>, 애니메이션이 <b>게임</b> 속으로! 안녕하세요, 단테 입니다. 여러분들은 기억에 남는 애니메이션이나 만화가 있으신가요? 여러 방면에서 재미를 느낄 수 있지만 저는 코믹물 장르가... ",리뷰어 단테,https://blog.naver.com/mina_100,20210707
<b>모바일게임</b>추천 가디언테일즈 1주년 업데이트 무료 100회... ,https://blog.naver.com/obama8775?Redirect=Log&logNo=222432741696,간만에 <b>모바일게임</b>추천을 원하시는 분들께도 이번 기회에 더욱 풍성하게 모험을 즐길 기회가... 일정 기간마다 출석도 업데이트하며 더 많은 보상을 제공할 계획이라고 하니 간만에 혹은 <b>모바일게임</b>추천을... ,선비의 엣헴블로그,https://blog.naver.com/obama8775,20210715
출시예정<b>모바일게임</b> 삼국지군웅전 사전예약하고 기다려보자!,https://blog.naver.com/subome?Redirect=Log&logNo=222423646579,"오늘 이렇게 출시예정<b>모바일게임</b> 삼국지군웅전에 대한 소식을 가지고 왔는데요. 많은 분들이 전략 <b>게임</b>을 기다렸던 만큼 사전예약도 완료하고, 전략까지 깔끔하게 즐겨보시길 바라요! [사전예약] [공식카페]",봄딩 게임,https://blog.naver.com/subome,20210707
"‘Alive 강화, 연미정에서’ <b>모바일 게임</b> 체험기",https://blog.naver.com/playganghwa?Redirect=Log&logNo=222384949683,"지난 달에 강화군과 한국관광공사(경인지사)의 합작으로 탄생한 <b>모바일 게임</b>, ‘Alive 강화... 여러분의 열의와 사랑에 힘입어 <b>모바일</b>에서나마 복원되었답니다. 느티나무를 소생시키는 것! 이 <b>게임</b>의 가장 큰... ",어서오시겨강화,https://blog.naver.com/playganghwa,20210604
